Section,Headline,Link
Guardian,"Crypto coin firm touted by Eric Adams denies allegations of ""rug pull"" scam",https://www.theguardian.com/technology/2026/jan/13/cryptocurrency-nyc-token-eric-adams
Guardian,Trump gives heckler the middle finger during Michigan Ford plant visit,https://www.theguardian.com/us-news/2026/jan/13/trump-middle-finger-michigan
Guardian,Congressional progressives vow to block DHS funding without reforms,https://www.theguardian.com/us-news/2026/jan/13/dhs-funding-congress-progressives
ABC,'Moscow on the Torrens': How to lose a writers' week in six days,https://www.abc.net.au/news/2026-01-14/analysis-adelaide-writers-week-randa-abdel-fattah-controversy/106223542
ABC,Tom Silvagni files application to appeal rape conviction,https://www.abc.net.au/news/2026-01-14/tom-silvagni-files-application-to-appeal-rape-conviction/106227720
ABC,The man police overlooked in Eloise Worledge disappearance,https://www.abc.net.au/news/2026-01-14/eloise-worledge-disappearance-alistair-webster-beaumaris/106221614
ABC,Indian truckies fed up with racist tirades over their CB radios,https://www.abc.net.au/news/2026-01-14/radio-racism-target-indian-drivers-road-freight-transport/106180274
ABC,Thanasi Kokkinakis's hopeful Aus Open warm-up ends with another injury,https://www.abc.net.au/news/2026-01-14/thanasi-kokkinakis-withdraws-from-adelaide-international/106228146
ABC,"Former NRLW Blues captain 'fixated' with ex's alleged cheating, court told",https://www.abc.net.au/news/2026-01-14/nrlw-player-maddison-studdon-facing-domestic-violence-charges/106227908
ABC,Trump tells Iranians 'help' on the way as reported death toll climbs into thousands,https://www.abc.net.au/news/2026-01-14/iran-protests-death-toll-official-says-2000-killed/106226744
ABC,'Number one target' tobacco kingpin Kazem Hamad arrested in Iraq,https://www.abc.net.au/news/2026-01-14/kazem-hamad-arrested-in-iraq/106227076
ABC,"Trump unleashes again on 'that jerk' Powell, ASX falls back",https://www.abc.net.au/news/2026-01-14/asx-markets-business-live-news/106227246
ABC,"Minns says Bondi bridge should be torn down, not become 'ghoulish reminder'",https://www.abc.net.au/news/2026-01-14/future-of-bondi-attack-site-debated-as-replacement-flagged/106225594
ABC,Russia's 'unstoppable' nuclear-capable missile sparks emergency UN meeting,https://www.abc.net.au/news/2026-01-14/russia-nuclear-capable-hypersonic-oreshnik-missile-ukraine-nato/106220362
ABC,From celebrated cartoonist to pariah — Dilbert creator Scott Adams dead at 68,https://www.abc.net.au/news/2026-01-14/scott-adams-dilbert-obituary/106227212
ABC,Global financial markets to face major test next week,https://www.abc.net.au/news/2026-01-13/bank-chiefs-support-us-federal-reserve-chair-jerome-powell/106226728
ABC,Brisbane neurosurgeon charged over alleged medical devices kickback scheme,https://www.abc.net.au/news/2026-01-14/neurosurgeon-charged-crime-corruption-commission-investigation/106226408
ABC,K-pop supergroup BTS reveal Australian tour dates,https://www.abc.net.au/news/2026-01-14/bts-k-pop-band-announce-australian-tour-dates/106227562
ABC,Rock climber dies in 20m fall from Tasmanian cliff,https://www.abc.net.au/news/2026-01-14/tas-rock-climber-dies-after-fall-at-buckland/106227338
ABC,Clintons refuse to testify for US House Epstein investigation,https://www.abc.net.au/news/2026-01-14/clintons-refuse-to-testify-to-epstein-investigation/106226996
ABC,Man charged after heavily-armed police rush to WA town,https://www.abc.net.au/news/2026-01-14/police-charge-man-over-pinjarra-incident-after-firearm-reports/106227580
ABC,Louise Adler unloads over reputationally 'trashed' Adelaide Writers' Week,https://www.abc.net.au/news/2026-01-13/louise-adler-adelaide-writers-week-cancellation-debacle/106225996
ABC,"Author Craig Silvey not cooperating with authorities after arrest, court told",https://www.abc.net.au/news/2026-01-13/author-craig-silvey-charged-with-child-exploitation-offences/106223528
ABC,Aussies roar in Adelaide as former Aus Open finalist continues slide,https://www.abc.net.au/news/2026-01-14/aleksandar-vukic-takes-down-stefanos-tsitsipas-in-adelaide/106227180
ABC,Australian driver released by battling F1 team in 'mutual decision',https://www.abc.net.au/news/2026-01-14/jack-doohan-released-by-alpine-f1-team/106227130
ABC,"Changes to election laws may amplify corruption risks, watchdog says",https://www.abc.net.au/news/2026-01-14/qld-councillors-mayors-running-state-parliament-step-down/106223176
ABC,SailGP season kicks off in WA city with serious 'sailing DNA',https://www.abc.net.au/news/2026-01-14/sailgp-fremantle-high-speed-catamaran-western-australia/106222188
ABC,Thousands of documents show behind the scenes of embattled childcare industry,https://www.abc.net.au/news/2026-01-13/act-thousands-childcare-documents-behind-the-scenes-industry/106221508
ABC,NSW SES to allow people to volunteer for a day when disaster strikes,https://www.abc.net.au/news/2026-01-10/nsw-ses-embraces-spontaneous-volunteering-from-mud-armies/106148252
ABC,NT pokies clubs claiming members' perks as giving back to the community,https://www.abc.net.au/news/2026-01-09/nt-pokies-community-contributions-member-perks-renovations-foi/106084120
ABC,Teenage girl sexually assaulted and pregnant while in state care,https://www.abc.net.au/news/2026-01-06/13-year-old-pregnant-sexual-assaults-state-residential-care/105980432
ABC,Liberals divided over Labor's plan to outlaw inciting racial hatred,https://www.abc.net.au/news/2026-01-13/liberals-split-over-proposed-hate-speech-laws/106224248
ABC,The sort of world in which Rudd has lived most of his career is now gone,https://www.abc.net.au/news/2026-01-13/kevin-rudd-ambassador-washington-donald-trump-china/106224116
ABC,Kevin Rudd to resign a year early as Australian ambassador to the US,https://www.abc.net.au/news/2026-01-13/kevin-rudd-ends-washington-posting/106222920
ABC,Details of sweeping changes to hate speech and gun laws revealed,https://www.abc.net.au/news/2026-01-13/details-of-new-hate-speech-gun-laws-revealed/106222256
ABC,Prosecutors seek death penalty for ex-South Korean president Yoon Suk Yeol,https://www.abc.net.au/news/2026-01-14/prosecutors-seek-death-penalty-for-yoon-suk-yeol-in-south-korea/106226884
ABC,"Ukraine hit by almost 300 drones, Volodymyr Zelenskyy says",https://www.abc.net.au/news/2026-01-13/russia-launches-another-major-attack-on-ukraine-power-grid/106226640
ABC,Does Iran need foreign intervention? What Iranian Australians say,https://www.abc.net.au/news/2026-01-13/iranian-australians-diaspora-community-iran-protests/106219448
ABC,BBC seeks to have Donald Trump's $15b defamation lawsuit dismissed,https://www.abc.net.au/news/2026-01-13/bbc-seeks-to-have-donald-trump-s-10bn-lawsuit-dismissed/106226538
ABC,Markets shudder as White House goes to war with everyone,https://www.abc.net.au/news/2026-01-13/venezuela-us-fed-white-house-donald-trump-attacks/106220958
ABC,Trump's attack on Federal Reserve 'extremely chilling',https://www.abc.net.au/news/2026-01-13/us-federal-reserve-interest-rates-trump/106222076
ABC,'This won't end well': US Fed Reserve chair facing criminal probe,https://www.abc.net.au/news/2026-01-12/criminal-investigation-opens-into-us-federal-reserve-chair/106220038
ABC,Kaboom signals move to renewables as power station tower crashes down,https://www.abc.net.au/news/2026-01-12/bell-bay-power-station-tower-explosives-demolition/106221046
ABC,Australian Open 2026: When the tournament starts and the stars to watch,https://www.abc.net.au/news/2026-01-14/australian-open-2026-everything-you-need-to-know/106225280
ABC,Rising star Joint beats former Australian Open champion in Adelaide,https://www.abc.net.au/news/2026-01-13/maya-joint-beats-sofia-kenin-at-adelaide-international/106225998
ABC,"As she hangs up her bat and gloves, Healy is set to conquer a new arena",https://www.abc.net.au/news/2026-01-13/alyssa-healy-overcomes-weight-of-name-to-become-cricket-great/106222886
ABC,Tennis great Williams departs Hobart International in first round,https://www.abc.net.au/news/2026-01-13/hobart-international-venus-williams-loses-in-first-round/106224876
ABC,"Air-drying laundry, wooden chopping boards: Reducing exposure to microplastics at home",https://www.abc.net.au/news/2026-01-14/ways-to-reduce-exposure-to-microplastics-at-home-/106128692
ABC,Vanessa decluttered and said goodbye to the fantasy version of herself,https://www.abc.net.au/news/2026-01-13/l-decluttered-my-wardrobe-said-goodbye-to-fantasy-me/106157756
ABC,How I have fun with friends without spending money,https://www.abc.net.au/news/2026-01-12/perspective-koren-on-free-fun-with-friends/106055938
ABC,Your rights when settling your child into child care or kindy,https://www.abc.net.au/news/2026-01-12/supporting-your-child-when-starting-child-care-or-kindy/106115412
ABC,How a video game about donkeys tests social cohesion,https://www.abc.net.au/news/2026-01-13/sydney-festival-live-video-game-asses-masses/106176518
ABC,Adelaide Writers' Week cancelled after week of escalating controversy,https://www.abc.net.au/news/2026-01-13/adelaide-writers-week-cancelled-randa-abdel-fattah-controversy/106225170
ABC,"Golden Globes 2026 key moments: Chalamet bests DiCaprio, Amy Poehler takes podcast nod",https://www.abc.net.au/news/2026-01-12/golden-globes-key-moments-2026/106217878
ABC,Being bored in the Perth suburbs inspired this Oscar-winning writer,https://www.abc.net.au/news/2026-01-11/shaun-tan-tales-from-outer-suburbia/106159172
Sky News,"""Deluded, damaged leader': Anthony Albanese failing to govern Australia",https://www.skynews.com.au/opinion/deluded-damaged-leader-anthony-albanese-failing-to-govern-australia/video/01c92fe875cffecbe8c28e5fde184fc9
Sky News,Violence in Iran continues as hundreds are killed,https://www.skynews.com.au/world-news/global-affairs/violence-in-iran-continues-as-hundreds-are-killed/video/1c43fe1672bf8cb12be30361940e27fa
Sky News,"Kevin Rudd a ""liability' to Australia's relationship with the US",https://www.skynews.com.au/opinion/kevin-rudd-a-liability-to-australias-relationship-with-the-us/video/753685697c38cb16d0963f31bc0a1efc
Sky News,"Ayatollah's regime labelled ""single greatest threat to world peace'",https://www.skynews.com.au/opinion/ayatollahs-regime-labelled-single-greatest-threat-to-world-peace/video/d0c3bf11d1274e061c3247ed1fb5ef6b
Sky News,"""Known for switching loyalties': Nadhim Zahawi defects to Reform UK",https://www.skynews.com.au/opinion/known-for-switching-loyalties-nadhim-zahawi-defects-to-reform-uk/video/5708b30d89ec82a974a48cb140035655
Sky News,"Donald Trump eyes ""underdeveloped' oil and gas reserves in Greenland",https://www.skynews.com.au/world-news/united-states/donald-trump-eyes-underdeveloped-oil-and-gas-reserves-in-greenland/video/d14966594c1a70b5fafd4380e42c5869
Sky News,"""Perverse': Trump administration warns Albanese against new hate speech laws",https://www.skynews.com.au/australia-news/politics/deeply-perverse-trump-administrations-warning-to-albanese-over-new-hate-speech-laws/news-story/de23b708c47ab41baf64928f2790b167
Sky News,Former Labor minister rules himself out to replace Kevin Rudd as US Ambassador despite rumours,https://www.skynews.com.au/australia-news/politics/former-labor-minister-stephen-conroy-shuts-down-rumours-about-replacing-kevin-rudd-as-ambassador-to-the-united-states/news-story/52b703790e21a94ac457650ec9b556a1
Sky News,Labor's hate speech laws under scrutiny in Senate committee,https://www.skynews.com.au/australia-news/politics/donald-trump-tells-iranian-patriots-to-keep-protesting-as-unrest-continues-authorities-indicate-early-death-toll/live-coverage/d943894c265e0c53396a569eb2f4eb2f
Sky News,HRH title and bulletproof glass: Meghan's diva demands for UK visit revealed,https://www.skynews.com.au/lifestyle/celebrity-life/meghan-markles-divalike-demands-for-uk-return-revealed-locked-down-hotel-floors-bulletproof-glass-and-a-staff-request-that-goes-against-the-wishes-of-the-late-queen/news-story/f4c23610b43c7d8c30cf48a19e551610
Sky News,"Missing actor surrenders to cops, denies child sex abuse allegations",https://www.skynews.com.au/lifestyle/celebrity-life/missing-actor-timothy-busfield-surrenders-to-cops-denies-child-sex-abuse-allegations-all-lies/news-story/0598ba30fb82523b46d830e16e6c46ba
Sky News,"Australian Idol judge slammed for ""mum-shaming' woman with crying baby on plane",https://www.skynews.com.au/lifestyle/celebrity-life/this-is-so-rude-australian-idol-judge-amy-shark-slammed-for-mumshaming-woman-over-crying-baby-on-plane/news-story/11d20833bdba7177574c7725a42fc353
Sky News,"Millions brace for rainfall, large parts of the east to be hit by ""widespread' showers",https://www.skynews.com.au/australia-news/weather/millions-bracing-for-further-rainfall-large-parts-of-the-east-forecast-to-be-hit-by-widespread-and-heavy-showers/news-story/481574b1d46038a3473247da49a8b61d
Sky News,Unexpected reason Bondi's council may have to pull down bridge at centre of shooting tragedy,https://www.skynews.com.au/australia-news/politics/waverley-council-to-debate-future-of-bondi-footbridge-used-in-the-mass-shooting-of-dozens-of-innocent-australians/news-story/5e25032652f306c0e83a680346ca6548
Sky News,Two Victorian men arrested following ATM ram raid spree,https://www.skynews.com.au/australia-news/crime/two-victorian-men-arrested-after-alleged-atm-ram-raid-crime-spree-causes-more-than-1-million-in-damage/news-story/cb85249ecbd24449d8cf97824329350a
Sky News,"Liberal Senator to vote against new hate speech omnibus bill, regardless of Coalition position",https://www.skynews.com.au/australia-news/politics/we-have-enough-laws-liberal-senator-alex-antic-to-vote-no-to-albaneses-hate-speech-omnibus-bill-regardless-of-coalition-position/news-story/744b3d84fc3674c594021170f2a95ff5
Sky News,"""Music was still playing': Minns recounts moment he arrived at Bondi terror scene, one month after attack",https://www.skynews.com.au/australia-news/politics/music-was-still-playing-nsw-premier-chris-minns-recounts-midnight-visit-to-the-bondi-terror-scene-one-month-after-attack/news-story/7e2147454d0382f20293344f145ecd3b
Sky News,"Govt's combined hate speech and gun reform push ""very mischievous', says Joyce",https://www.skynews.com.au/australia-news/politics/albanese-governments-combined-hate-speech-and-gun-reform-push-very-mischievous-says-mp-barnaby-joyce/news-story/d72bf6b5adf8a3fd79bef0c85d528915
Sky News,Man threatened to kill politician: cops,https://www.skynews.com.au/breaking-news/nsw-man-to-face-court-over-alleged-death-threats-to-politician/news-story/2c10ab2a38b9d15ce1e3b8c55575dd50
Sky News,Comedy trio's cheeky move after break-in,https://www.skynews.com.au/breaking-news/sooshi-mango-prints-tshirts-in-search-for-man-after-breakin/news-story/85027a230350912502032ca4874be558
Sky News,Mum hits a kangaroo then disappears,https://www.skynews.com.au/breaking-news/desperate-south-australia-bushland-search-for-missing-mum-trisha-graf/news-story/da4f74cab6f6b298cf93de1fbcf17ab3
Sky News,"""Not the time': Be wary of LGBTQ+ advocates hitching a ride on hate crime laws",https://www.skynews.com.au/insights-and-analysis/nows-not-the-time-its-risky-letting-lgbtq-advocates-influence-hate-crime-laws-designed-to-protect-jewish-aussies-reeling-from-antisemitic-violence/news-story/5ac2f1c1a8233357b6a53b9221a6d056
Sky News,"Albanese plays his Ayatollah move as Iran looks set to usher in its ""Berlin Wall moment'",https://www.skynews.com.au/insights-and-analysis/albanese-plays-his-ayatollah-move-as-irans-bloodied-citizens-look-set-to-usher-in-their-berlin-wall-moment/news-story/8feb3cb76d8c1ae684dfb211bc09ab11
Sky News,"Where is Iran's ""Free Palestine' movement?",https://www.skynews.com.au/insights-and-analysis/where-is-the-free-palestine-movement-when-iranians-risk-their-lives-for-liberation/news-story/e75118019e2a796249c3d27bd92ab3fa
Sky News,Protester sentenced to death allowed only 10 minutes to say goodbye to family: report,https://www.skynews.com.au/world-news/global-affairs/iranian-protester-sentenced-to-death-allowed-only-10-minutes-to-say-goodbye-to-family-report/news-story/0dcc7f2a38b46f9bfbd5923f2121f488
Sky News,"Flight cancelled after screams, banging heard inside aircraft",https://www.skynews.com.au/world-news/global-affairs/air-canada-flight-canceled-after-screams-banging-heard-inside-aircraft/news-story/fa855e2ac511bfa47579ef6a02060040
Sky News,"Iran now slaughtering civilians, not just protesters ' as death toll surges",https://www.skynews.com.au/world-news/global-affairs/iran-now-slaughtering-civilians-not-just-protesters-as-death-toll-surges-into-the-thousands/news-story/7abdbc24578be4f68279769279da8529
Sky News,"Billionaire donates $15,000 to ICE agent who fatally shot Renee Nicole Good",https://www.skynews.com.au/world-news/united-states/billionaire-bill-ackman-donates-15000-to-gofundme-for-ice-agent-who-fatally-shot-renee-nicole-good/news-story/ee75b6b3011fc1ec600ae77554ce8704
Sky News,Greenland calls on NATO for protection from possible US invasion,https://www.skynews.com.au/world-news/global-affairs/greenland-calls-on-nato-for-protection-from-possible-us-invasion-as-president-trump-ramps-up-rhetoric-of-takeover/news-story/cfecbe5ffcadcacb4d0180cd3915525b
Sky News,"Murdered Iranian protesters found shot in head, neck during historic protests",https://www.skynews.com.au/world-news/global-affairs/hundreds-of-murdered-iranian-protesters-found-shot-in-head-neck-during-historic-protests-including-23yearold-fashion-student/news-story/e12f47077aeb6a28fb6bf5dbd6766437
Sky News,Security guard shares wild account of mystery sonic weapon US used in Maduro raid,https://www.skynews.com.au/world-news/global-affairs/us-used-powerful-mystery-weapon-that-brought-venezuelan-soldiers-to-their-knees-during-maduro-raid-witness-account/news-story/6bcd7338f316668954b3c34571fddce5
Sky News,"Military intervention in Iran would be ""reckless', says US intelligence expert",https://www.skynews.com.au/world-news/global-affairs/highly-unlikely-military-intervention-in-iran-would-be-reckless-says-us-intelligence-expert-as-hundreds-of-dissidents-killed/news-story/e86947183c9da2d073400d661fcf9652
Sky News,Tim Walz brutally ridiculed over embarrassing gaffe,https://www.skynews.com.au/opinion/tim-walz-brutally-ridiculed-over-embarrassing-gaffe/video/e5d5ea8afb29d3e37b0695cc7ac47d77
Sky News,"""Should be on the same page': Pro-Palestine protesters blasted for double standards on Iran",https://www.skynews.com.au/opinion/should-be-on-the-same-page-propalestine-protesters-blasted-for-double-standards-on-iran/video/9ac16bef246658dde34a5788c6ff4839
Sky News,"""Pretty embarrassing': Man's concert proposal goes horribly wrong following brutal rejection",https://www.skynews.com.au/opinion/pretty-embarrassing-mans-concert-proposal-goes-horribly-wrong-following-brutal-rejection/video/8f965a55cc7014c2d1adbcd6a14c5338
Sky News,The Late Debate | 13 January,https://www.skynews.com.au/stream/opinion-programs/the-late-debate/the-late-debate-13-january/video/c2753780555aabd78da727a888356e01
Sky News,The Bolt Report | 13 January,https://www.skynews.com.au/stream/opinion-programs/the-bolt-report/the-bolt-report-13-january/video/6ff9b76a8383665bf7e11700882dafed
Sky News,Credlin | 13 January,https://www.skynews.com.au/stream/opinion-programs/credlin/credlin-13-january/video/cc7084fc19bc16cfeaaaa6d4d5711be1
Sky News,The Late Debate | 12 January,https://www.skynews.com.au/stream/opinion-programs/the-late-debate/the-late-debate-12-january/video/25e5df06553fdd94542263d6e55ef72f
Sky News,The Bolt Report | 12 January,https://www.skynews.com.au/stream/opinion-programs/the-bolt-report/the-bolt-report-12-january/video/6f948afe7f2f0aaf54a0080fbac50f9e
Sky News,Credlin | 12 January,https://www.skynews.com.au/stream/opinion-programs/credlin/credlin-12-january/video/697b287f5292a0305eb08be05c25a0eb
Sky News,The Late Debate | 9 January,https://www.skynews.com.au/stream/opinion-programs/the-late-debate/the-late-debate-9-january/video/800b552fe283404d203c0ef45491a8e1
Sky News,"""Part of my life is over': Channel Nine star axed after 27 years speaks out",https://www.skynews.com.au/business/media/part-of-my-life-is-over-channel-nine-newsreader-axed-after-27-years-as-he-announces-surprising-new-project/news-story/fecbe0bfceb4875c9c544be59c6b24cf
Sky News,"Apology for divisive cartoon ""too late', says advocate against antisemitism",https://www.skynews.com.au/business/media/apology-for-divisive-newspaper-cartoon-came-too-late-says-aussie-advocate-against-antisemitism-marnie-perlstein/news-story/8fe5f677f39162d34104324f24077fb9
Sky News,Activist Cathy Wilcox snubs SMH after controversial cartoon sparks fury,https://www.skynews.com.au/business/media/activist-cartoonist-cathy-wilcox-snubs-her-own-newspaper-after-smh-apologises-for-divisive-and-hurtful-jewish-cartoon-scandal/news-story/1ed420538d51906adb75094513582479
Sky News,"Sky News Australia expands offering in 2026 with fortnightly polling, new shows and documentaries",https://www.skynews.com.au/business/media/sky-news-australia-expands-offering-in-2026-with-new-shows-polling-reporters-and-docos-as-star-primetime-lineup-returns/news-story/8356f4305f338726b666d4c6c532ef5f
Sky News,Locals lament shock closure of 60-year-old Sydney institution,https://www.skynews.com.au/australia-news/abduls-lebanese-restaurant-announces-shock-closure-of-surry-hills-sydney-institution/news-story/7ca8118fa9930056b7ae57b905e4949d
Sky News,Popular Sydney restaurant announces shock closure after more than 40 years in business,https://www.skynews.com.au/business/heavy-hearts-popular-sydney-restaurant-announces-shock-closure-after-more-than-40-years-in-business/news-story/4e3925253c358ace55cbd9b3aaaad6cf
Sky News,"""Didn't think this could happen to me': Adrian Portelli's $50 million renovation hell",https://www.skynews.com.au/business/real-estate/didnt-think-this-could-happen-to-me-the-block-star-adrian-portellis-50-million-renovation-hell-as-he-reveals-builder-threatened-him-over-ruined-penthouse/news-story/202e3d699d9bd870b5ff0c9fb4ea94c3
Sky News,"Economist reveals harsh rates truth ""no one wants to hear'",https://www.skynews.com.au/business/markets/economist-warren-hogan-reveals-harsh-rates-truth-no-one-wants-to-hear-after-latest-inflation-figures/news-story/ba6a519e03ebbcea4a132c26fe2453f8
Sky News,"""Not appropriate': Grim reality behind ""encouraging' inflation figures",https://www.skynews.com.au/business/finance/not-appropriate-grim-reality-behind-encouraging-inflation-figures-as-mortgageholders-await-next-rate-meeting-in-february/news-story/e30062eef421330a2aa4cc6e3dccfddf
Sky News,Brisbane Lions hit by more drama as another player splits from girlfriend,https://www.skynews.com.au/lifestyle/celebrity-life/major-betrayal-brisbane-lions-hit-by-more-relationship-drama-as-another-star-player-splits-from-girlfriend-amid-lachie-neale-saga/news-story/33e4d0d3594395c5c7eb817725d3064a
Sky News,"Missing actor surrenders to cops, denies child sex abuse allegations",https://www.skynews.com.au/lifestyle/celebrity-life/missing-actor-timothy-busfield-surrenders-to-cops-denies-child-sex-abuse-allegations-all-lies/news-story/0598ba30fb82523b46d830e16e6c46ba
Sky News,HRH title and bulletproof glass: Meghan's diva demands for UK visit revealed,https://www.skynews.com.au/lifestyle/celebrity-life/meghan-markles-divalike-demands-for-uk-return-revealed-locked-down-hotel-floors-bulletproof-glass-and-a-staff-request-that-goes-against-the-wishes-of-the-late-queen/news-story/f4c23610b43c7d8c30cf48a19e551610
Sky News,Lip reader reveals what Leo really said during viral Golden Globes moment,https://www.skynews.com.au/lifestyle/celebrity-life/this-is-gold-lip-reader-reveals-what-leonardo-dicaprio-really-said-during-viral-golden-globes-moment/news-story/e91cb4f7e65e8c6ce4ab89ef8fd53378
Sky News,"Australian Idol judge slammed for ""mum-shaming' woman with crying baby on plane",https://www.skynews.com.au/lifestyle/celebrity-life/this-is-so-rude-australian-idol-judge-amy-shark-slammed-for-mumshaming-woman-over-crying-baby-on-plane/news-story/11d20833bdba7177574c7725a42fc353
Sky News,"Ancient man survived brutal lion attack, suffered lifelong damage",https://www.skynews.com.au/lifestyle/travel/ancient-man-survived-brutal-lion-attack-suffered-lifelong-damage-extremely-rare/news-story/1e7c4d94e3b8726135830369e90a36fe
Sky News,"Medieval castle with 100 rooms hits market with nearly 1,000 years of history",https://www.skynews.com.au/lifestyle/travel/jawdropping-french-medieval-castle-with-100-rooms-hits-market-with-nearly-1000-years-of-history/news-story/a952244ca1045ce8bf27bc1a838fb8ea
Sky News,Hotel experts reveal the tiny detail that could get in the way of your stay,https://www.skynews.com.au/lifestyle/travel/hotel-experts-reveal-which-room-numbers-to-book-for-a-more-peaceful-stay/news-story/5d413b7586904974a30f3bb11dc4b668
Sky News,Northern Territory government to make pepper spray possession a permanent measure,https://www.skynews.com.au/australia-news/politics/northern-territory-government-to-make-pepper-spray-possession-a-permanent-measure/video/68e1c5bf0e4811d71ed21af1b2e8dc87
Sky News,Al Madina Dawah Centre in Sydney permanently closed,https://www.skynews.com.au/australia-news/al-madina-dawah-centre-in-sydney-permanently-closed/video/8bf63ddf92004ee0dcc1d4a2fedcefdd
Sky News,"""Shame on you': Jacinta Allan heckled for Victorian bushfire response",https://www.skynews.com.au/australia-news/politics/shame-on-you-jacinta-allan-heckled-for-victorian-bushfire-response/video/173d5d7c352e8dbfdae077444ab40159
Sky News,Council organises special meeting with victims' families one month on from Bondi shooting,https://www.skynews.com.au/australia-news/council-organises-special-meeting-with-victims-families-one-month-on-from-bondi-shooting/video/4b1cc9d7e51622ead67be92b1671d698
