Section,Headline,Link
ABC,'Everyone's seeing it': Inside the childcare sector a new problem is on the rise,https://www.abc.net.au/news/2025-10-30/child-on-child-abuse-is-the-fresh-childcare-system-horror/105947226
ABC,'Blood on the floor': How James Hardie's board came undone,https://www.abc.net.au/news/2025-10-30/why-the-james-hardie-board-was-gutted/105954054
ABC,Questions over Australian-gifted patrol boat smashed on reef during 'VIP transport',https://www.abc.net.au/news/2025-10-30/vanuatu-patrol-boat-rvs-takuare-to-australia-after-hitting-reef/105947254
ABC,Court documents reveal Nampijinpa Price rejected settlement offer,https://www.abc.net.au/news/2025-10-30/nt-jacinta-nampijinpa-price-60000-defamation-settlement-offer/105952936
ABC,Police allege Australians were given delivery driver jackets before Bali shooting,https://www.abc.net.au/news/2025-10-30/trial-begins-for-three-australians-accused-of-killing-a-man/105952536
ABC,Man jailed after DNA breakthrough leads to conviction for 1990s sex assaults,https://www.abc.net.au/news/2025-10-30/kevin-frederick-combes-jailed-over-1990s-teen-sex-attacks/105950490
ABC,'Shame is yours': Ponzi scheme fraudster gets 14 years for $34m deception,https://www.abc.net.au/news/2025-10-30/chris-marco-jailed-after-stealing-from-perth-investors/105951910
ABC,Australia loses quick wickets after blazing Litchfield ton in World Cup semi,https://www.abc.net.au/news/2025-10-30/australia-vs-india-womens-odi-world-cup-semifinal-live-blog/105954326
ABC,"Islamic leaders condemn 'reckless, targeted' incident at Perth mosque",https://www.abc.net.au/news/2025-10-30/police-investigate-criminal-damage-at-gosnells-mosque/105952988
ABC,School with a principal but no students faces closure,https://www.abc.net.au/news/2025-10-30/gairdner-wa-school-without-students-faces-closure/105953344
ABC,Albanese confident on AUKUS despite Trump's Korean subs promise,https://www.abc.net.au/news/2025-10-30/albanese-confident-on-aukus-despite-us-korean-subs/105952342
ABC,"Coalition split but this time it's over a T-shirt, not net zero",https://www.abc.net.au/news/2025-10-30/coalition-split-albanese-tshirt-labor-transparency/105938072
ABC,Investigation widens into Queensland exam bungle after warning ignored,https://www.abc.net.au/news/2025-10-30/investigations-queensland-qexam-bungle-warning-ignored/105951830
ABC,Family shocked after mum 'dies alone' on tropical island during cruise,https://www.abc.net.au/news/2025-10-30/lizard-island-cruise-passenger-death-daughter-calls-for-inquest/105950816
ABC,Buddhist monk found guilty of historical Melbourne sex offences,https://www.abc.net.au/news/2025-10-30/victoria-buddhist-monk-dhamma-sarana-sexual-offences/105954014
ABC,Barnaby Joyce denies allegation he yelled at staffer,https://www.abc.net.au/news/2025-10-30/barnaby-joyce-denies-yelling-allegation/105952654
ABC,Prison officers angry over bashing sentence told to end 'catastrophic' strike,https://www.abc.net.au/news/2025-10-30/prison-officers-walk-off-job-over-guard-bashings-nsw/105951998
ABC,Former detective reveals horrific crime scene details in Easey St murders,https://www.abc.net.au/news/2025-10-30/victoria-easey-street-committal-hearing-perry-kouroumblis/105950548
ABC,Rio de Janeiro drug raid leaves at least 120 dead,https://www.abc.net.au/news/2025-10-30/brazil-police-raid-rio-de-janeiro-drugs/105950908
ABC,Joe Biden was exposed by his frailties. They're still exposing Kamala Harris,https://www.abc.net.au/news/2025-10-30/kamala-harris-joe-biden-issues-behind-her-for-white-house/105947760
ABC,Israel's latest strikes highlight a difficult truth about the Gaza ceasefire,https://www.abc.net.au/news/2025-10-30/gaza-ceasefire-technically-holding-despite-israeli-strikes/105950142
ABC,Remote Aboriginal community returning to licensed liquor after 30 years,https://www.abc.net.au/news/2025-10-30/nt-wadeye-alcohol-sales-social-club-returns-dry-community/105943922
ABC,Burn or bury? Gold Coast weighs $1.6 billion plan to deal with rubbish,https://www.abc.net.au/news/2025-10-30/waste-to-energy-plan-gold-coast-landfill-solution/105869872
ABC,Cattle station owners face charges over alleged illegal dams,https://www.abc.net.au/news/2025-10-30/sa-anna-creek-station-illegal-dams-charge/105947060
ABC,'A show pony': New cybersecurity course had 80pc dropout rate,https://www.abc.net.au/news/2025-10-29/tastafe-cybersecurity-course-dropouts-staff-issues/105921416
ABC,"National watchdog needed for violence against women, commissioner says",https://www.abc.net.au/news/2025-10-30/violence-against-women-national-watchdog-micaela-cronin/105949568
ABC,Fury over Labor's 'petulant response' to Senate transparency stunt,https://www.abc.net.au/news/2025-10-30/labor-punishment-threat-transparency-senate-jobs-for-mates/105950660
ABC,Government withholds translated public interview about opaque Nauru deal,https://www.abc.net.au/news/2025-10-30/foi-denied-translation-interview-adeang-nauru-deal/105941610
ABC,"Chaotic end to Senate QT as Labor responds to opposition, crossbench revolt — as it happened",https://www.abc.net.au/news/2025-10-30/federal-politics-live-blog-oct-30/105949134
ABC,Trump says South Korea has approval to build nuclear-powered submarine,https://www.abc.net.au/news/2025-10-30/south-korea-permission-to-build-nuclear-submarines/105951210
ABC,Trump to reduce tariffs on Beijing amid resumed US nuclear weapons testing,https://www.abc.net.au/news/2025-10-30/trump-orders-resumption-of-nuclear-weapons-testing/105951930
ABC,"US government blasts Australian who 'betrayed' country, sold Russia secrets",https://www.abc.net.au/news/2025-10-30/peter-williams-faces-us-jail-time-after-selling-trade-secrets/105945752
ABC,Hurricane Melissa devastates Caribbean and leaves dozens dead,https://www.abc.net.au/news/2025-10-30/hurricane-melissa-devastates-caribbean-countries-kills-dozens/105949964
ABC,"James Hardie chair ousted, Trump says trade deal reached with China — as it happened",https://www.abc.net.au/news/2025-10-30/asx-markets-business-live-news-30-oct/105950212
ABC,"A computer alarm, scam calls, then Dorothy's life savings were gone",https://www.abc.net.au/news/2025-10-30/austrac-fines-crypto-atm-operator-cryptolink-in-scams-crackdown/105941804
ABC,"Borrowers can expect one more rate cut, if they're lucky, bank economists predict",https://www.abc.net.au/news/2025-10-30/big-four-banks-expect-no-cash-rate-cut-in-november/105948378
ABC,"As Trump and Xi prepare to talk trade, China will enter the room with a strong hand",https://www.abc.net.au/news/2025-10-30/donald-trump-and-xi-jinping-prepare-for-us-china-trade-talks/105943374
ABC,"Having restored the Socceroos' DNA, Popovic looks to make World Cup history",https://www.abc.net.au/news/2025-10-30/socceroos-coach-tony-popovic-pursues-greatness-fifa-world-cup/105949386
ABC,Papenhuyzen granted release from Storm to consider future amid R360 talk,https://www.abc.net.au/news/2025-10-30/ryan-papenhuyzen-release-from-melbourne-storm/105950764
ABC,What is a wanger and how is it used in cricket training?,https://www.abc.net.au/news/2025-10-30/what-is-a-wanger-and-how-is-it-used-in-cricket-training/105953456
ABC,Cricket Australia defends $11.3m loss amid strong criticism,https://www.abc.net.au/news/2025-10-30/cricket-australia-defends-11m-loss-victorian-chair-criticism/105952134
ABC,Aussie artists on what it's like to share a break-up with the world,https://www.abc.net.au/news/2025-10-29/lily-allen-west-end-girl-artists-on-their-own-breakup-songs/105942042
ABC,What loving someone with an addiction or dependence can look like,https://www.abc.net.au/news/2025-10-28/loving-someone-with-an-addiction-or-dependence/105921866
ABC,We are socialising less and loneliness is rising. Here is what can help,https://www.abc.net.au/news/2025-10-27/decline-in-socialising-rates-impacting-our-wellbeing/105865064
ABC,Readers share their experiences of receiving other people's mail,https://www.abc.net.au/news/2025-10-26/readers-share-frustration-responsibility-return-to-sender-mail/105375268
ABC,Drake appeals defamation loss over Kendrick Lamar's Not Like Us,https://www.abc.net.au/news/2025-10-30/drake-appeals-defamation-loss-over-kendrick-lamar-not-like-us/105950556
ABC,"Phar Lap turns 100 in 2026. This year, two musicals inspired by him debut",https://www.abc.net.au/news/2025-10-30/phar-lap-the-electro-swing-musical-wonder-horse-life-afterlife/105922314
ABC,From Yothu Yindi to Iron & Wine — WOMADelaide's line-up is here,https://www.abc.net.au/news/2025-10-30/womadelaide-line-up-2026-adelaide-yothu-yindi-obongjayar/105948966
ABC,Why the Powerhouse is calling for ideas to be buried for 100 years,https://www.abc.net.au/news/2025-10-29/powerhouse-new-time-capsule-in-parramatta/105945680
Sky News,"""Be very afraid': Jim Chalmers looking to treat super as their ""investment slush fund'",https://www.skynews.com.au/opinion/chris-kenny/be-very-afraid-jim-chalmers-looking-to-treat-super-as-their-investment-slush-fund/video/fedf15a073da9f260c68eeca69f2adfa
Sky News,"""Wrong in every aspect': Indigenous patients at St Vincent's set to be ""assigned as urgent'",https://www.skynews.com.au/opinion/peta-credlin/wrong-in-every-aspect-indigenous-patients-at-st-vincents-set-to-be-assigned-as-urgent/video/2a4db6b4cfa7f987ef6ccd7174472816
Sky News,"""Basic facts': Albanese government failing to deliver promises to reduce power bills",https://www.skynews.com.au/opinion/andrew-bolt/basic-facts-albanese-government-failing-to-deliver-promises-to-reduce-power-bills/video/bd069225dd5463541494c8c6fef8eb11
Sky News,"Coalition ""disunity' laid bare amid Albanese shirt controversy",https://www.skynews.com.au/opinion/sharri-markson/coalition-disunity-laid-bare-amid-albanese-shirt-controversy/video/ad06f637c930c0237a43fc9d623361a7
Sky News,"""The surge is on': One Nation support doubles since federal election",https://www.skynews.com.au/opinion/paul-murray/the-surge-is-on-one-nation-support-doubles-since-federal-election/video/4bd114acabf282ef40cae5185f25f105
Sky News,"""Not the brain of Ireland': Douglas Murray blasts ""dimwit' actress for Gaza comments",https://www.skynews.com.au/opinion/rita-panahi/not-the-brain-of-ireland-douglas-murray-blasts-dimwit-actress-for-gaza-comments/video/5cc80461d1d8cbb62faec338e44596eb
Sky News,Downer: Trump'Xi meeting signals easing tensions and reset on strained relations,https://www.skynews.com.au/australia-news/politics/a-cordial-and-quite-successful-meeting-former-foreign-minister-praises-trumps-breakthrough-talks-with-china/news-story/818f04b21cd906ecca9fd42927dc5434
Sky News,"Albanese declares Trump, Xi deal ""very welcome news'",https://www.skynews.com.au/australia-news/politics/prime-minister-anthony-albanese-declares-donald-trump-xi-jinping-deal-very-welcome-news-brushes-off-critical-minerals-concerns/news-story/d35514c3a449495218d0dad8e1399105
Sky News,"""Excruciatingly painful': Wild scenes in council debate over Israel boycott",https://www.skynews.com.au/australia-news/politics/cumberland-city-council-rejects-israel-boycott-motion-after-tense-debate/news-story/43fa4398168f478b62be57124a1cdc9e
Sky News,Woman receives wild text from her boss on her wedding day,https://www.skynews.com.au/lifestyle/trending/half-an-hour-after-the-ceremony-woman-receives-wild-text-from-her-boss-on-her-wedding-day-but-the-inappropriate-question-she-was-asked-explains-everything/news-story/db6607350ec3670b53cfb077c32fa32d
Sky News,"PM takes a swipe at media, defends recent travels schedule",https://www.skynews.com.au/australia-news/politics/prime-minister-anthony-albanese-fronts-press-to-defend-recent-travels-amid-doubts-about-cop-brazil-trip/news-story/34483d5f8e769c49b9cff3d57418f4e2
Sky News,"""Sneaky': Customer spots huge problem with bill after ordering $60 fish",https://www.skynews.com.au/lifestyle/trending/sneaky-customer-spots-huge-problem-after-ordering-60-fish-at-new-gold-coast-restaurant/news-story/1fc26e1a68cd452fc928a054df2b337c
Sky News,"McKenzie accuses PM of ""bullying' Senate over Question Time extension",https://www.skynews.com.au/australia-news/politics/former-prime-minister-scott-morrison-backs-coalition-to-keep-net-zero-but-dump-push-to-achieve-goal-by-2050/live-coverage/4ffbc1b90a0cc04eb2add7542dde9e21
Sky News,"Vic Police failing to hit targets as Labor seeks to ""bury the truth'",https://www.skynews.com.au/australia-news/politics/new-evidence-reveals-victoria-police-is-failing-to-hit-key-targets-as-allan-government-accused-of-attempting-to-bury-the-truth/news-story/ca3e81dd58e446b1d70fbb41cb5e79f3
Sky News,"""Higher costs, longer delays': Labor mulls reducing rural speed limits",https://www.skynews.com.au/australia-news/politics/higher-costs-longer-delays-albanese-government-considering-reducing-rural-speed-limits-from-100kmh-to-70kmh/news-story/07778243d358019022998f601ad0fc25
Sky News,"Ita Buttrose, 83, reveals heartbreaking health battle",https://www.skynews.com.au/lifestyle/i-cant-walk-australian-media-icon-ita-buttrose-83-reveals-shes-now-confined-to-a-wheelchair-after-being-diagnosed-with-a-rare-disorder/news-story/b077afdeb0da3fa9f9eae7475cb33c06
Sky News,10 News+ trimmed to half-hour time slot as ratings fall short,https://www.skynews.com.au/business/media/network-tens-the-project-replacement-10-news-trimmed-from-hourlong-runtime-to-30minute-slot-amid-poor-ratings/news-story/35ef4bfca4678d0933b9a9b66c41c074
Sky News,Company linked to star chef and pub baron facing seven-figure debt,https://www.skynews.com.au/business/company-linked-to-star-chef-george-calombaris-and-pub-baron-jon-adgemis-facing-sevenfigure-debt-amid-collapse/news-story/935184b8180338bb267c5413d0367770
Sky News,"""Un-Australian': Unbelievable amount NSW café charges to salt your hot chips",https://www.skynews.com.au/lifestyle/trending/unaustralian-aussies-left-outraged-after-caf-in-nsws-hunter-region-adds-surcharge-to-salt-customers-hot-chips/news-story/b7a7111ea244584b49c0dfbf47c379d8
Sky News,"Coles' profits soar, as price inflation continues for consumers",https://www.skynews.com.au/business/coles-earnings-streak-past-woolworths-in-revenue-report-as-the-extent-of-product-inflation-for-consumers-is-revealed/news-story/c4f197ae9fb063b66f0f184e2955427a
Sky News,"Albanese defends ""status quo' on Taiwan amid Trump'Xi trade talks",https://www.skynews.com.au/australia-news/politics/prime-minister-anthony-albanese-defends-status-quo-on-taiwan-amid-trade-talks-between-us-president-donald-trump-and-chinese-president-xi-jinping/news-story/05c16fc836c731bd50bcd27214cc4a26
Sky News,"Why an immigration halt could give Australia ""fresh bargaining power' over China",https://www.skynews.com.au/insights-and-analysis/coveted-place-to-live-immigration-pause-still-one-of-canberras-sharpest-levers-to-wield-over-china-as-xitrump-chess-game-unfolds/news-story/99b4e3e3ba33eddddc5460e3bb9ec74f
Sky News,The cutting-edge technology set to transform Australia's housing sector,https://www.skynews.com.au/insights-and-analysis/green-steel-can-slash-housing-costs-by-unlocking-faster-construction-at-scale-as-well-as-reduce-australias-carbon-bill/news-story/8a6822e2510efd76fa2a2eb01186eef6
Sky News,"Australia months away from 28 million driven by ""artificial' migration surge",https://www.skynews.com.au/insights-and-analysis/coming-soon-australia-to-hit-population-of-28-million-within-a-year-driven-by-mass-artificial-migration-surge/news-story/d44f90c03fb1640c60e97985faa8f7a9
Sky News,Downer: Trump'Xi meeting signals easing tensions and reset on strained relations,https://www.skynews.com.au/australia-news/politics/a-cordial-and-quite-successful-meeting-former-foreign-minister-praises-trumps-breakthrough-talks-with-china/news-story/818f04b21cd906ecca9fd42927dc5434
Sky News,"Donald Trump announces US will ""immediately' begin nuclear weapons testing",https://www.skynews.com.au/world-news/united-states/us-president-donald-trump-announces-us-to-immediately-begin-process-of-nuclear-weapons-testing/news-story/c74de55dba8f550f46affd1961f3d519
Sky News,"""We have a deal': Trump-Xi reach major trade deal in South Korea",https://www.skynews.com.au/world-news/united-states/very-successful-meeting-us-president-donald-trump-and-chinese-president-xi-jinping-sit-down-for-trade-negotiations/news-story/d3507023368c690ed1c7dc9c636d33eb
Sky News,"""Be more specific': Kamala Harris snaps at ABC's Sarah Ferguson in trainwreck interview",https://www.skynews.com.au/world-news/united-states/kamala-harris-and-abcs-sarah-ferguson-clash-over-question-about-joe-bidens-delayed-withdrawal-from-2024-election-race/news-story/56abd9bd5d9dde613c184092759b5673
Sky News,Charlie Kirk suspect's trans lover goes missing six weeks after assassination,https://www.skynews.com.au/world-news/united-states/charlie-kirk-suspects-trans-lover-lance-twiggs-goes-missing-six-weeks-after-political-assassination/news-story/20c841bd605eb50ec928f069beaff021
Sky News,"Principal ""ignored' warnings six-year-old had gun before shooting teacher",https://www.skynews.com.au/world-news/united-states/principal-ignored-warnings-sixyearold-had-gun-before-shooting-virginia-teacher-abby-zwerner-he-has-little-pockets/news-story/d8f54c8b45ca6535c28828a46d0656d8
Sky News,"Grandfather allegedly ""boiled alive' in scalding hotel shower",https://www.skynews.com.au/world-news/united-states/former-marine-grandfather-allegedly-boiled-alive-in-scalding-hotel-shower-skin-peeled-away-from-his-body/news-story/9c1d084db65f21a8faf1315cda93c2b0
Sky News,Major update in Louvre heist case as suspects make stunning admission,https://www.skynews.com.au/world-news/global-affairs/major-update-in-louvre-heist-case-as-alleged-jewel-bandits-partially-admit-to-their-involvement-no-evidence-of-inside-job/news-story/ffc2504388cba25978a1b422b6928cad
Sky News,"""Ludicrous': Chicago Mayor goes on bizarre rant targeting Donald Trump",https://www.skynews.com.au/opinion/ludicrous-chicago-mayor-goes-on-bizarre-rant-targeting-donald-trump/video/cfcde8b4caf89905b820b7245ae06c29
Sky News,Disturbing drone footage of Hamas staging a hostage body discovery,https://www.skynews.com.au/opinion/sharri-markson/disturbing-drone-footage-of-hamas-staging-a-hostage-body-discovery/video/3b2227a0ecb87c907b3d42cdc1873c16
Sky News,Kamala Harris fumbles through ABC interview,https://www.skynews.com.au/opinion/rita-panahi/kamala-harris-fumbles-through-abc-interview/video/3ee137ced1db4b536463766bca31ff10
Sky News,The Kenny Report | 30 October,https://www.skynews.com.au/stream/opinion-programs/the-kenny-report/the-kenny-report-30-october/video/9333f973a631be20c5bbf86c6d6f73f1
Sky News,Credlin | 30 October,https://www.skynews.com.au/stream/opinion-programs/credlin/credlin-30-october/video/907ffbf24222bccfc90401d6c0a33f18
Sky News,The Bolt Report | 30 October,https://www.skynews.com.au/stream/opinion-programs/the-bolt-report/the-bolt-report-30-october/video/733f095c6bbaf6b6c3dbe359b73a8a60
Sky News,Sharri | 30 October,https://www.skynews.com.au/stream/opinion-programs/sharri/sharri-30-october/video/7811b65128fd2df9c5d276cce08371db
Sky News,Paul Murray Live | 30 October,https://www.skynews.com.au/stream/opinion-programs/paul-murray-live/paul-murray-live-30-october/video/2f7a3811bf846dc6e330748d769d900a
Sky News,The Late Debate | 29 October,https://www.skynews.com.au/stream/opinion-programs/the-late-debate/the-late-debate-29-october/video/0ac89f22de74e6fdf0515c6ec39186c8
Sky News,The Rita Panahi Show | 30 October,https://www.skynews.com.au/stream/opinion-programs/the-rita-panahi-show/the-rita-panahi-show-30-october/video/cb119cb47c655ff229763205f6dc3f6d
Sky News,Company linked to star chef and pub baron facing seven-figure debt,https://www.skynews.com.au/business/company-linked-to-star-chef-george-calombaris-and-pub-baron-jon-adgemis-facing-sevenfigure-debt-amid-collapse/news-story/935184b8180338bb267c5413d0367770
Sky News,"Coles' profits soar, as price inflation continues for consumers",https://www.skynews.com.au/business/coles-earnings-streak-past-woolworths-in-revenue-report-as-the-extent-of-product-inflation-for-consumers-is-revealed/news-story/c4f197ae9fb063b66f0f184e2955427a
Sky News,10 News+ trimmed to half-hour time slot as ratings fall short,https://www.skynews.com.au/business/media/network-tens-the-project-replacement-10-news-trimmed-from-hourlong-runtime-to-30minute-slot-amid-poor-ratings/news-story/35ef4bfca4678d0933b9a9b66c41c074
Sky News,"Proposed business tax will ""drive investment offshore', Bunnings boss warns",https://www.skynews.com.au/business/finance/proposed-cash-flow-tax-on-businesses-will-drive-investment-offshore-wesfarmers-chair-michael-chaney-to-declare/news-story/d79bab4e99d57107f5e07d39c9855784
Sky News,"""Rate hike next year': Crushing blow for mortgage holders after inflation jumps",https://www.skynews.com.au/business/finance/pain-for-mortgage-holders-as-possible-rate-hike-on-the-cards-next-year-after-crushing-september-inflation-data/news-story/6a4e4a8d27c965d5fcb63b699f5b52eb
Sky News,"AusPost boss calls cheap Amazon, Temu imports a ""drug'",https://www.skynews.com.au/business/finance/drug-of-the-cheapest-product-available-australia-post-ceo-paul-graham-says-aussies-hooked-on-amazon-temu-as-he-pleads-for-customers-to-buy-local/news-story/e718d17606bb9dcd27ca116722b117b3
Sky News,"""Energy prices are killing industry': Warning inflation surge will hit harder still",https://www.skynews.com.au/business/finance/warning-soaring-energy-costs-driving-inflation-higher-and-putting-australian-industries-on-life-support/news-story/1d5f1cee5de90bf43ec062c20f21d303
Sky News,"""Tricky territory': Crucial reason future rate cuts remain up in the air",https://www.skynews.com.au/business/finance/australian-interest-rates-in-tricky-territory-anzs-chief-economist-richard-yetsenga-says-as-future-cuts-remain-uncertain/news-story/b74cabc956ff6817574e9cc268cbd617
Sky News,"""Enough is enough': Backlash to renewables surges across regional Australia",https://www.skynews.com.au/business/energy/standing-up-for-australian-prosperity-growing-resistance-to-wind-and-solar-projects-intensifies-as-australia-shows-a-national-revolt-against-net-zero/news-story/9ed8a2a6eb3f7ad9dc1d550fbbedee5e
Sky News,"""Sneaky': Customer spots huge problem with bill after ordering $60 fish",https://www.skynews.com.au/lifestyle/trending/sneaky-customer-spots-huge-problem-after-ordering-60-fish-at-new-gold-coast-restaurant/news-story/1fc26e1a68cd452fc928a054df2b337c
Sky News,"""Un-Australian': Unbelievable amount NSW café charges to salt your hot chips",https://www.skynews.com.au/lifestyle/trending/unaustralian-aussies-left-outraged-after-caf-in-nsws-hunter-region-adds-surcharge-to-salt-customers-hot-chips/news-story/b7a7111ea244584b49c0dfbf47c379d8
Sky News,"Ita Buttrose, 83, reveals heartbreaking health battle",https://www.skynews.com.au/lifestyle/i-cant-walk-australian-media-icon-ita-buttrose-83-reveals-shes-now-confined-to-a-wheelchair-after-being-diagnosed-with-a-rare-disorder/news-story/b077afdeb0da3fa9f9eae7475cb33c06
Sky News,Woman receives wild text from her boss on her wedding day,https://www.skynews.com.au/lifestyle/trending/half-an-hour-after-the-ceremony-woman-receives-wild-text-from-her-boss-on-her-wedding-day-but-the-inappropriate-question-she-was-asked-explains-everything/news-story/db6607350ec3670b53cfb077c32fa32d
Sky News,Senior royal forced to pay market rate for royal residence ' despite Andrew living rent free,https://www.skynews.com.au/lifestyle/celebrity-life/prince-edward-left-to-pay-market-value-for-royal-residence-while-brother-prince-andrew-lives-rent-free-at-royal-lodge/news-story/71035d18868156ad0b98d6bef638ac47
Sky News,"Trove of coins, jewellery unearthed in Christian city near Sea of Galilee",https://www.skynews.com.au/lifestyle/travel/treasure-trove-of-gold-coins-ancient-jewellery-unearthed-in-christian-city-near-sea-of-galilee/news-story/84815c907f6a32eef2a8aece30bbb880
Sky News,Qantas launches massive global sale with fares starting from $299,https://www.skynews.com.au/lifestyle/travel/qantas-launches-massive-global-sale-to-27-destinations-including-la-bali-tokyo-with-airfares-starting-from-299-oneway/news-story/db785e3546080cdbbac73b40dfd3df38
Sky News,Sleepy Aussie city named one of the top tourist destinations in the world,https://www.skynews.com.au/lifestyle/travel/sleepy-aussie-city-named-one-of-the-top-tourist-destinations-in-the-world-in-sustainability-travel-rankings/news-story/db360cdddb1840d491a2f78ee18507b6
Sky News,Severe storm risk across the east coast,https://www.skynews.com.au/australia-news/weather/severe-storm-risk-across-the-east-coast/video/71e8bd46d88465d951f6c76eaeefd89c
Sky News,"Today's News Headlines: Trump praises Xi as ""tough negotiator'",https://www.skynews.com.au/australia-news/todays-news-headlines-trump-praises-xi-as-tough-negotiator/video/24deb97f7570ccd42d92d73f3071230c
Sky News,"""Refused to make public': Marles grilled for secretive handling of ""jobs for mates' report",https://www.skynews.com.au/australia-news/politics/refused-to-make-public-marles-grilled-for-secretive-handling-of-jobs-for-mates-report/video/c6e4ecab5828bc3c3fdc0b44f6cce354
Sky News,"""Ruinous situation': Government will build 55,000 homes to tackle housing crisis",https://www.skynews.com.au/australia-news/politics/ruinous-situation-government-will-build-55000-homes-to-tackle-housing-crisis/video/6609719d6031b9d94384292e88bb4454
Sky News,"""Is he aware it is 2025?': Bowen called out for ""misleading' Australians over power prices",https://www.skynews.com.au/australia-news/politics/is-he-aware-it-is-2025-bowen-called-out-for-misleading-australians-over-power-prices/video/2f27acfa25a2c3bffdc9c41f2bfd013f
Sky News,Today's News Headlines: Gaza ceasefire resumes after airstrikes,https://www.skynews.com.au/australia-news/todays-news-headlines-gaza-ceasefire-resumes-after-airstrikes/video/372c96ec82c4dde7398fde90a18a9542
