Section,Headline,Link
9 News,"LIVEHail, storm could confront police hunting alleged cop-killer2 hours ago",https://www.9news.com.au/national/porepunkah-victoria-police-shooting-live-updates-latest-news-headlines-august-28/f7468db3-e8b6-45b9-92b0-16de670d2c26
9 News,Uber rolls out rideshare for teens across Australiaan hour ago,https://www.9news.com.au/national/uber-rolls-out-rideshare-for-teens-across-australia/86c26d53-bb36-48c0-b5ca-e2bb1a82a54c
9 News,Celeste's shock after opening first letter in new house,https://www.domain.com.au/news/aussies-shock-after-receiving-first-letter-in-new-house-1418174/?utm_source=9news.com.au&utm_medium=referral&utm_campaign=editorial-homepage-driver
9 News,Japan releases AI-generated Mt Fuji eruption video2 hours ago,https://www.9news.com.au/wild-weather/tokyo-japan-mount-fuji-eruption-ai-video/0700cf2c-8c28-4b87-8f23-8dbf3fe88fc6
9 News,A rare 'blood moon' will light up Aussie skies next week - here's how to see itan hour ago,https://www.9news.com.au/national/september-blood-moon-total-lunar-eclipse-how-to-see-it-in-australia-everything-to-know-explained/99a56e79-7585-4a66-84fb-5d5dafa7d73f
9 News,"breakingTeen dead after 'callous, vicious' stabbing at Sydney bus terminal40 minutes ago",https://www.9news.com.au/national/fatal-stabbing-at-sydney-bus-station/89f88552-981c-4292-af68-dcece574f56f
9 News,School church shooting 'a hate crime targeting Catholics',https://www.9news.com.au/world/minneapolis-school-shooting-annunciation-catholic-school-minnesota-governor-tim-walz/25b3fabc-d69e-45b9-81d2-ab20aaaa0370
9 News,O'Brien confirms Knights split with candid confessionan hour ago,https://www.nine.com.au/sport/nrl/news-2025-adam-obrien-newcastle-knights-exit-confirmed-20250828-p5mqje.html
9 News,'Unimaginable': School mourns 'talented' year 7 student killed in bus crash37 minutes ago,https://www.9news.com.au/national/christian-college-geelong-bus-crash-school-mourns-year-7-student-milla-killeen-killed/fc8cbf1b-8144-4089-97b7-f0f3f96d9a8a
9 News,Great weather divide across Australia taking holdan hour ago,https://www.9news.com.au/national/australia-weather-update-huge-temperature-contrasts-between-north-and-south/43c067a3-b9d4-48d1-acfb-15b1109e9766
9 News,breakingHuge profit jump for Qantas powered by surging travel demandan hour ago,https://www.9news.com.au/finance/qantas-profits-jump-by-28-per-cent/60e624b4-df91-4c2e-99b0-f635eb4c0ea4
9 News,The 'pie in the sky' reality of the 5 per cent deposit scheme,https://www.domain.com.au/news/pie-in-the-sky-you-cant-buy-a-1-5m-home-on-a-5-per-cent-deposit-2-1417839/?utm_source=9news.com.au&utm_medium=referral&utm_campaign=editorial-homepage-driver
9 News,Queensland pedestrian fighting for life after being hit by truck,https://www.9news.com.au/national/queensland-pedestrian-fighting-for-life-after-being-struck-by-truck/68af62c7-e156-4ed1-a9f9-ec07680bedb4
9 News,Two parents said their 7-month-old son was kidnapped. They're now charged with his murder,https://www.9news.com.au/world/usa-california-emmanuel-haro-kidnap-murder/5125c4cc-9616-486b-bbed-290a29d49121
9 News,Pentagon casts doubt over Defence Minister's 'meeting' with US counterpart,https://www.9news.com.au/national/defence-minister-richard-marles-happenstance-meeting-with-us-counterpart/32890483-4b72-4bb1-9787-627053c6b15e
9 News,'That bloke could be anywhere': Hunt for alleged Porepunkah gunman continues,https://www.9news.com.au/national/porepunkah-police-shooting-update/4c43bcf8-5d9d-4e79-8d74-407ea1ca4ab2
9 News,Someone killed Woody but witnesses 'never' discussed it,https://www.9news.com.au/national/evander-woody-tuala-inquest-men-claim-no-one-saw-who-threw-fatal-punch/ddad4c18-4fe3-42bf-80bb-b6df3e89ecec
9 News,exclusiveFinancial watchdog scrutinising banks over concerns mortgage holders are being ripped off,https://www.9news.com.au/finance/asic-probing-offset-accounts/6b3b2d05-8cae-4301-8025-8fd304b38d65
9 News,"Climate campaigner pays $15,000 for flight with Liberal leader",https://www.9news.com.au/national/midwinter-ball-2025-simon-holmes--court-pays-15000-for-sussan-ley-to-fly-with-climate-change-campaigner/16e25acb-5e7e-43c7-946a-a3d5e1516aef
9 News,Celeste's shock after opening first letter in new house,https://www.domain.com.au/news/aussies-shock-after-receiving-first-letter-in-new-house-1418174/?utm_source=9news.com.au&utm_medium=referral&utm_campaign=editorial-homepage-driver
9 News,Japan releases AI-generated Mt Fuji eruption video2 hours ago,https://www.9news.com.au/wild-weather/tokyo-japan-mount-fuji-eruption-ai-video/0700cf2c-8c28-4b87-8f23-8dbf3fe88fc6
9 News,A rare 'blood moon' will light up Aussie skies next week - here's how to see itan hour ago,https://www.9news.com.au/national/september-blood-moon-total-lunar-eclipse-how-to-see-it-in-australia-everything-to-know-explained/99a56e79-7585-4a66-84fb-5d5dafa7d73f
9 News,TODAY IN HISTORYThe six-day bank siege that started the 'Stockholm syndrome' myth,https://www.9news.com.au/world/today-in-history-august-28-what-happened-on-this-day-stockholm-syndrom/05c01aa1-b7d8-42fc-9c88-0fce1dbce9ff
9 News,What is the 'sovereign citizen' movement?,https://www.9news.com.au/national/what-is-a-sovereign-citizen-movement-beliefs-explainer/968ac369-a7bd-4a6d-9465-7bc2a1d13bdf
9 News,'Revolutionary' terror group behind antisemitic attacks in Australia,https://www.9news.com.au/world/islamic-revolutionary-guard-corps-explainer/38561258-a275-4f50-9153-7e438e160626
9 News,What we know about the fatal police shooting in Porepunkah,https://www.9news.com.au/national/porepunkah-victoria-police-officer-shooting-at-rural-property/fdd5dcce-fb0f-4c32-9d6a-2910db764fe7
9 News,"Queensland woman denied boarding, forced to pay $10k over visa error",https://www.9news.com.au/national/us-immigration-esta-error-queensland-woman-denied-boarding-flight-in-canada/56068ae8-803d-414f-a3f9-1413269f7e3a
9 News,Suns break 15-year hoodoo as finals fixtures locked in,https://www.nine.com.au/sport/afl/news-2025-week-one-finals-schedule-locked-in-gold-coast-suns-essendon-bombers-20250827-p5mqfu.html
9 News,Politicians and media figures glam up for Canberra's night of nights,https://www.9news.com.au/national/midwinter-ball-canberra-2025-august-gallery/05d966bd-0d79-443c-b7dd-af37796a82b2
9 News,'Unique and irreplaceable': Officers killed in Porepunkah shooting named,https://www.9news.com.au/national/porepunkah-police-shooting-victims-identified/fa941b5e-76f9-49a4-a4eb-78468b52d747
9 News,Diehard Adelaide fans preparing for early start to secure AFL final tickets,https://www.9news.com.au/national/afl-finals-adelaide-crows-fans-ticket-demand/2318d22d-2d7f-4ba4-b38c-96bff0c721bc
9 News,A Current AffairFormer fugitive-hunting cop explains why Dezi Freeman hasn't been captured,https://9now.nine.com.au/a-current-affair/former-fugitivehunting-cop-explains-challenges-in-bush-search-for-dezi-freeman/526be1bb-5858-44c9-9950-6b69687ef3fc
9 News,"'Incredibly confronting': Girl killed, 10 people injured after school bus rolls",https://www.9news.com.au/national/victoria-stonehaven-school-bus-crash-several-seriously-injured/64d5912e-013f-4f76-a161-cf324b5405a9
9 News,Brittany Higgins responds after $315k defamation loss to ex-senator Linda Reynolds,https://www.9news.com.au/national/brittany-higgins-to-learn-defamation-fate-over-posts/4ef8b9c3-6033-4849-978e-97ef62451dbc
9 News,A Current Affair'Highly ideologically motivated': Extremism expert fears Dezi Freeman won't surrender peacefully,https://9now.nine.com.au/a-current-affair/highly-ideologically-motivated-extremism-expert-believes-dezi-freeman-wont-surrender-peacefully/7bf69cf8-fb10-444f-b82a-0c7d25a47227
9 News,Beloved father and skipper killed in fishing boat capsize,https://www.9news.com.au/national/one-man-dies-others-rescued-after-boat-capsizes-off-mooloolaba/e0c60a5e-0823-418a-a389-9629a1c943db
9 News,"Domino's to shake up menu, scrap discounts after first annual loss in 20 years",https://www.9news.com.au/national/dominos-pizza-chain-posts-first-profit-loss-for-20-years-in-major-restructure/4b35c58c-809e-4abe-bd4d-53522b8d55b2
9 News,Homeowner slugged $240K for felling century-old tree,https://www.domain.com.au/news/homeowner-ordered-to-pay-240k-for-chopping-down-100-year-old-tree-1418193/?utm_source=9news.com.au&utm_medium=referral&utm_campaign=editorial-homepage-driver
9 News,'Do not enter': Abandoned house comes with unusual squatters,https://www.domain.com.au/news/do-not-enter-abandoned-house-comes-with-unusual-squatters-1417468/?utm_source=9news.com.au&utm_medium=referral&utm_campaign=editorial-homepage-driver
9 News,This little black dot travelled faster than anything else on Earth ever had,https://www.9news.com.au/world/today-in-history-august-27-what-happened-on-this-day/285f74b2-4903-463e-8c66-6fd5432985bf
9 News,Israeli military says strikes on Gaza hospital targeted what it says was a Hamas camera,https://www.9news.com.au/world/israeli-military-says-strikes-on-gaza-hospital-targeted-what-it-says-was-a-hamas-camera/1093e593-c5a4-4a95-bd2b-9493badba49d
9 News,"'Weak politician': Iran echoes Israel, slamming response to attacks",https://www.9news.com.au/world/iran-australia-ambassador-expelled-over-attacks-on-synagogue-and-restaurant-foreign-minister-abbas-araghchi-responds/26fd6d68-a5fb-404e-927d-bfc39bd34c78
9 News,'Revolutionary' terror group behind antisemitic attacks in Australia,https://www.9news.com.au/world/islamic-revolutionary-guard-corps-explainer/38561258-a275-4f50-9153-7e438e160626
9 News,'All that has changed': Roosters players turn on Smith,https://wwos.nine.com.au/nrl/news-2025-the-mole-brandon-smith-sydney-roosters-teammates-matt-burton-perth-bears-exclusive/4f12d2e3-ec93-48db-b308-f2275a121e20
9 News,Slater tips 'freakish' cross-code star for rare feat,https://wwos.nine.com.au/nrl/news-2025-mark-nawaqanitawase-sydney-roosters-form-kangaroos-squad-hopes-billy-slater-comments-flick-pass-video/7508e681-bb0a-4514-994b-5a6608d6e74e
9 News,Eagles deliver firm stance on trade request as Saints circle,https://wwos.nine.com.au/afl/news-2025-liam-ryan-trade-request-west-coast-eagles-st-kilda-saints/b33439c8-e158-4e17-bb85-5a1683c9e54f
9 News,Australia's fastest man pulls out of world championships,https://wwos.nine.com.au/athletics/news-2025-world-championships-tokyo-lachlan-kennedy-injury-stress-fracture-back/83cd731d-e1bc-4810-beb7-5058551901ef
9 News,Hird in disbelief at priority pitch from AFL's 'wealthiest club',https://wwos.nine.com.au/afl/news-2025-west-coast-eagles-priority-picks-james-hird-comments-footy-classified/9b3b6e4b-ba92-4e44-aeb1-d8747fc7572e
9 News,Former All-Australian retires due to ongoing injury issues,https://wwos.nine.com.au/afl/news-2025-matt-crouch-retires-hip-injury-adelaide-crows/7bfefc3d-6656-4afb-9f2b-a29e90fc21d8
9 News,Sloane laments Rankine's 'missed opportunity' over apology,https://wwos.nine.com.au/afl/news-2025-izak-rankine-apology-jordan-dawson-aflw-team-adelaide-crows-rory-sloane-comments/8b7f00cd-99ed-4a23-a960-4156a7f2f22d
9 News,Huge '90s boyband reveal details on 'healing' reunion tour,https://9now.nine.com.au/today/5ive-boy-band-nineties-comeback-tour-five-sit-down-with-richard-wilkins/7264cde1-03b5-4654-819d-d2f1d7da314c
9 News,Simple recipes that look fancy to spoil dad this Father's Day,https://9now.nine.com.au/today/simple-recipes-that-look-fancy-to-spoil-dad-this-fathers-day/0f9f157e-dd0f-4303-9de4-359f3b8910e8
9 News,'Really terrifying': Porepunkah family bunker down after shooting,https://9now.nine.com.au/today/porepunkah-police-shooting-caravan-park-family-safety-fears-during-community-lockdown/484757d9-4bb5-4b76-aafe-1e247072c510
9 News,'A great man': Patient remembers pioneering heart surgeon three decades on from murder,https://9now.nine.com.au/a-current-affair/victor-chang-patient-remembers-pioneering-heart-surgeon-three-decades-on-from-murder/fb7cfa70-f63b-4394-8d67-098ef43d5bc4
9 News,'Highly ideologically motivated': Extremism expert fears Dezi Freeman won't surrender peacefully,https://9now.nine.com.au/a-current-affair/highly-ideologically-motivated-extremism-expert-believes-dezi-freeman-wont-surrender-peacefully/7bf69cf8-fb10-444f-b82a-0c7d25a47227
9 News,Former fugitive-hunting cop explains why Dezi Freeman hasn't been captured,https://9now.nine.com.au/a-current-affair/former-fugitivehunting-cop-explains-challenges-in-bush-search-for-dezi-freeman/526be1bb-5858-44c9-9950-6b69687ef3fc
9 News,Profits before kids: The childcare operators cashing in on our kids,https://9now.nine.com.au/60-minutes/profits-before-kids-the-childcare-operators-cashing-in-on-our-kids/a89863d9-8432-4345-ba4e-b41f7caa39cd
9 News,The miraculous revival of Australia's 'Humpback Highway',https://9now.nine.com.au/60-minutes/whales-the-miraculous-revival-of-australias-humpback-highway/7420b2d9-4c67-4408-a958-36c07b42afd8
9 News,More teens are turning to Ozempic - but is it safe?,https://9now.nine.com.au/60-minutes/ozempic-more-teens-are-turning-to-ozempic--but-is-it-safe/98f29d16-1ef2-4227-9cbd-aebc3d74b6e1
9 News,Couple arrive home to find nasty note taped to their door,https://www.domain.com.au/news/couple-confronted-by-rude-note-eight-hours-after-picking-up-apartment-keys-1414069/?utm_source=nine.com.au&utm_medium=referral&utm_campaign=editorial-homepage-driver
9 News,The last affordable suburb in Sydney revealed,https://www.domain.com.au/news/girraween-the-closest-suburb-to-sydneys-cbd-for-under-1-million-is-24km-away-1408376/?utm_source=nine.com.au&utm_medium=referral&utm_campaign=editorial-homepage-driver
9 News,The unusual reason Peter bought this derelict cottage,https://www.domain.com.au/news/i-collected-it-peter-bought-this-run-down-riverside-nz-cottage-for-nostalgia-1414033/?utm_source=nine.com.au&utm_medium=referral&utm_campaign=editorial-homepage-driver
9 News,Mercedes-Benz smashes electric-car driving distance record with a car you can't buy,https://www.drive.com.au/news/mercedes-benz-smashes-electric-car-driving-distance-record-with-a-car-you-cant-buy/?utm_source=nine-rail&utm_medium=referral
9 News,"This Honda CR-V is a great daily driver, but not everything is rosy",https://www.drive.com.au/caradvice/commuting-with-the-honda-cr-v-hybrid/?utm_source=nine-rail&utm_medium=referral
9 News,Suzuki has rolled out a drive-away price offer,https://www.drive.com.au/news/2025-suzuki-fronx-gains-sub-30000-drive-away-deal-to-rival-chery-mahindra/?utm_source=nine-rail&utm_medium=referral
9 News,Accused gunman could hide in bush 'for months'28 minutes ago,https://www.9news.com.au/national/porepunkah-shooting-updates-manhunt-for-accused-gunman-dezi-freeman-enters-third-day/c1ad8829-6fe9-4de8-aa8a-24f0a62dc1bd
9 News,'Unimaginable': School mourns 'talented' year 7 student killed in bus crash37 minutes ago,https://www.9news.com.au/national/christian-college-geelong-bus-crash-school-mourns-year-7-student-milla-killeen-killed/fc8cbf1b-8144-4089-97b7-f0f3f96d9a8a
9 News,"Teen dead after 'callous, vicious' stabbing at Sydney bus terminal40 minutes ago",https://www.9news.com.au/national/fatal-stabbing-at-sydney-bus-station/89f88552-981c-4292-af68-dcece574f56f
9 News,Huge profit jump for Qantas powered by surging travel demandan hour ago,https://www.9news.com.au/finance/qantas-profits-jump-by-28-per-cent/60e624b4-df91-4c2e-99b0-f635eb4c0ea4
9 News,O'Brien confirms Knights split with candid confessionan hour ago,https://www.nine.com.au/sport/nrl/news-2025-adam-obrien-newcastle-knights-exit-confirmed-20250828-p5mqje.html
9 News,A rare 'blood moon' will light up Aussie skies next week - here's how to see itan hour ago,https://www.9news.com.au/national/september-blood-moon-total-lunar-eclipse-how-to-see-it-in-australia-everything-to-know-explained/99a56e79-7585-4a66-84fb-5d5dafa7d73f
9 News,Great weather divide across Australia taking holdan hour ago,https://www.9news.com.au/national/australia-weather-update-huge-temperature-contrasts-between-north-and-south/43c067a3-b9d4-48d1-acfb-15b1109e9766
9 News,Uber rolls out rideshare for teens across Australiaan hour ago,https://www.9news.com.au/national/uber-rolls-out-rideshare-for-teens-across-australia/86c26d53-bb36-48c0-b5ca-e2bb1a82a54c
9 News,"Hail, storm could confront police hunting alleged cop-killer2 hours ago",https://www.9news.com.au/national/porepunkah-victoria-police-shooting-live-updates-latest-news-headlines-august-28/f7468db3-e8b6-45b9-92b0-16de670d2c26
9 News,Japan releases AI-generated Mt Fuji eruption video2 hours ago,https://www.9news.com.au/wild-weather/tokyo-japan-mount-fuji-eruption-ai-video/0700cf2c-8c28-4b87-8f23-8dbf3fe88fc6
Guardian,Attempt to partner African countries with Japanese cities triggers xenophobic backlash ,https://www.theguardian.com/world/2025/aug/27/attempt-to-partner-african-countries-with-japanese-cities-triggers-xenophobic-backlash
Guardian,"Botswana""s president declares health emergency over supply shortages",https://www.theguardian.com/world/2025/aug/26/botswana-president-declares-public-health-emergency-medicine-supply-shortages
Guardian,Eswatini government faces court challenge over men deported by US,https://www.theguardian.com/world/2025/aug/22/court-case-challenging-eswatini-us-immigrant-deportation-deal-postponed
Guardian,Uganda reaches agreement with US to take in some failed asylum seekers,https://www.theguardian.com/world/2025/aug/21/uganda-reaches-agreement-with-us-to-take-in-some-of-its-failed-asylum-seekers
Guardian,Pressure grows on Tanzania to free victim of domestic violence who has been on death row for 13 years,https://www.theguardian.com/global-development/2025/aug/21/tanzania-lemi-limbu-woman-learning-disabilities-death-row
Guardian,"Ontario premier Doug Ford""s party spent nearly $300,000 on novelty ""Canada is not for sale"" hats",https://www.theguardian.com/world/2025/aug/28/ontario-premier-doug-ford-spent-six-figures-canada-not-for-sale-hats
Guardian,Old master painting looted by Nazis disappears from home in Argentina,https://www.theguardian.com/world/2025/aug/27/old-master-painting-looted-by-nazis-disappears-from-home-in-argentina
Guardian,"Rightwing ""parents"" rights"" groups gain ground in Canada as Alberta book bans target LGBTQ+ titles",https://www.theguardian.com/world/2025/aug/27/alberta-book-ban-canada-parents-rights-groups
Guardian,"Deforestation has killed half a million people in past 20 years, study finds",https://www.theguardian.com/environment/2025/aug/27/deforestation-has-killed-half-a-million-people-in-past-20-years-study-finds
Guardian,"Brazil judge orders round-the-clock surveillance of ""flight risk"" Bolsonaro",https://www.theguardian.com/world/2025/aug/26/brazil-judge-orders-round-the-clock-surveillance-of-flight-risk-bolsonaro
Guardian,Japanese town wants residents to limit smartphone use to two hours a day,https://www.theguardian.com/world/2025/aug/28/japanese-town-toyoake-proposes-smartphone-limit-residents-two-hours-day
Guardian,"Cambodia MPs pass ""chilling"" bill enabling citizenship to be stripped",https://www.theguardian.com/world/2025/aug/26/cambodia-treason-citizenship-law
Guardian,"Protests erupt in Indonesia over privileges for parliament members and ""corrupt elites""",https://www.theguardian.com/world/2025/aug/26/indonesia-protests-austerity-parliament-member-privileges
Guardian,Trump says he hopes to meet Kim Jong-un and raises prospect of US taking over some South Korean land,https://www.theguardian.com/us-news/2025/aug/25/trump-north-korea-kim-jong-un-lee-jae-myung
Guardian,"Piracy and armed robbery surge in the straits of Malacca and Singapore "" report",https://www.theguardian.com/world/2025/aug/26/piracy-straits-of-malacca-singapore
Guardian,"Porepunkah shooting live: Victoria police ""throwing everything"" at manhunt for suspect as search enters day three",https://www.theguardian.com/australia-news/live/2025/aug/28/porepunkah-shooting-live-updates-victoria-police-manhunt-latest-news-ntwnfb
Guardian,Australia politics live: Khawaja gets meeting with PM on gambling ads he thought was cancelled; ATO whistleblower avoids jail,https://www.theguardian.com/australia-news/live/2025/aug/28/australian-politics-live-usman-khawaja-gambling-ads-anthony-albanese-sussan-ley-labor-coalition-question-time-ntwnfb
Guardian,"Who is Dezi Freeman? Porepunkah shooting suspect has association with ""sovereign citizen"" ideas and called police ""terrorist thugs""",https://www.theguardian.com/australia-news/2025/aug/28/who-is-dezi-freeman-porepunkah-victoria-police-shooting-suspect-sovereign-citizen-ntwnfb
Guardian,Australia accused of not acting on 2023 warnings Iran was harassing and surveilling diaspora,https://www.theguardian.com/australia-news/2025/aug/28/australia-accused-of-not-acting-on-2023-warnings-iran-was-harassing-and-surveilling-diaspora-ntwnfb
Guardian,"Tax breaks for investors unfair but there""s no quick fix, housing affordability boss says",https://www.theguardian.com/australia-news/2025/aug/28/tax-breaks-for-investors-unfair-but-theres-no-quick-fix-housing-affordability-boss-says
Guardian,Macron backs Bayrou and calls on budget critics to show responsibility,https://www.theguardian.com/world/2025/aug/27/emmanuel-macron-backs-francois-bayrou-france
Guardian,Groom dies of injuries from celebratory gunfire after wedding in Turkey,https://www.theguardian.com/world/2025/aug/27/groom-dies-of-injuries-from-celebratory-gunfire-after-wedding-in-turkey
Guardian,"Denmark summons US charge d""affaires over alleged attempts to interfere with Greenland""s status "" as it happened",https://www.theguardian.com/world/live/2025/aug/27/volodymyr-zelenskyy-substantive-talks-eu-us-security-guarantees-ukraine-europe-latest-updates-news
Guardian,Denmark summons US diplomat over alleged Greenland influence campaign,https://www.theguardian.com/world/2025/aug/27/denmark-summons-us-diplomat-over-alleged-greenland-influence-campaign
Guardian,Frustrated Russians grapple with fuel crisis as Ukraine attacks oil refineries,https://www.theguardian.com/world/2025/aug/27/frustrated-russians-grapple-with-fuel-crisis-as-ukraine-attacks-oil-refineries
Guardian,Tony Blair attends White House meeting with Trump on postwar Gaza,https://www.theguardian.com/politics/2025/aug/27/tony-blair-attends-white-house-meeting-with-trump-on-postwar-gaza
Guardian,"Pope demands ""collective punishment"" end in Gaza as 10 more die of hunger",https://www.theguardian.com/world/2025/aug/27/ten-palestinians-have-died-from-starvation-in-last-24-hours-says-gaza-health-ministry
Guardian,Return of UN nuclear inspectors to Iran met with protests by MPs,https://www.theguardian.com/world/2025/aug/27/return-of-un-nuclear-inspectors-to-iran-met-with-protests-by-mps
Guardian,"Middle East crisis: Israeli military carries out raid in West Bank city of Nablus "" as it happened",https://www.theguardian.com/world/live/2025/aug/27/donald-trump-meeting-white-house-gaza-israel-middle-east-crisis-latest-updates-news
Guardian,"A third of outpatients treated for wounds at MSF""s Gaza hospitals in 2024 were children, figures show",https://www.theguardian.com/world/2025/aug/27/children-make-up-third-of-outpatients-in-msf-hospitals-in-gaza-statistics-show
Guardian,"How hard will Trump""s 50% tariff hit India, and what is Delhi doing about it?",https://www.theguardian.com/us-news/2025/aug/27/trump-50-percent-tariff-india-explainer
Guardian,"India""s supreme court orders inquiry into giant zoo run by son of Asia""s richest person",https://www.theguardian.com/world/2025/aug/26/india-supreme-court-giant-zoo-son-asia-richest-person-vantara
Guardian,Historic Myanmar bridge destroyed in fighting ,https://www.theguardian.com/world/2025/aug/25/myanmar-historic-gokteik-bridge-destroyed
Guardian,Former Sri Lankan president admitted to hospital after arrest,https://www.theguardian.com/world/2025/aug/23/sri-lanka-former-president-ranil-wickremesinghe-admitted-to-hospital-arrest-charges
Guardian,India scales back plan to remove stray dogs from streets of Delhi,https://www.theguardian.com/world/2025/aug/22/india-scales-back-plan-remove-stray-dogs-streets-delhi
Guardian,"Property tax threat is slowing down housing market, say UK agents",https://www.theguardian.com/business/2025/aug/28/property-tax-threat-slow-down-housing-market-uk-agents
Guardian,"Overdiagnosis of children overlooks that growing up is ""messy and uneven"", says Jeremy Hunt",https://www.theguardian.com/education/2025/aug/27/overdiagnosis-of-children-overlooks-that-growing-up-is-messy-and-uneven-says-jeremy-hunt
Guardian,Man whose arrest sparked asylum hotel protests tells court he did not touch girls,https://www.theguardian.com/uk-news/2025/aug/27/man-whose-arrest-sparked-asylum-hotel-protests-tells-court-he-did-not-touch-girls
Guardian,Octopus Energy founder appointed as UK government adviser,https://www.theguardian.com/business/2025/aug/27/octopus-energy-founder-greg-jackson-given-cabinet-office-role-to-help-shape-future-policies
Guardian,"Tommy Robinson will not be charged over alleged St Pancras assault, police say",https://www.theguardian.com/uk-news/2025/aug/27/tommy-robinson-no-charge-alleged-st-pancras-assault
Guardian,"CDC chief ""targeted"" for refusing to ""rubber-stamp unscientific, reckless directives"", lawyers say "" US politics live",https://www.theguardian.com/us-news/live/2025/aug/27/cdc-resignation-susan-monarez-trump-administration-us-politics-updates-rfk-jr
Guardian,Minneapolis Catholic school shooting: two children killed and 17 injured,https://www.theguardian.com/us-news/2025/aug/27/minneapolis-active-shooter-school
Guardian,"Nvidia sets fresh sales record amid fears of an AI bubble and Trump""s trade wars",https://www.theguardian.com/technology/2025/aug/27/nvidia-second-quarter-earnings
Guardian,"CDC director Susan Monarez ousted for refusing ""to rubber-stamp unscientific"" orders, say lawyers",https://www.theguardian.com/us-news/2025/aug/27/cdc-director-susan-monarez-ousted
