Section,Headline,Link
9 News,Sour expression tells all as rival swipes star in AFL Draftan hour ago,https://www.nine.com.au/sport/afl/news-2025-afl-draft-melbourne-demons-carlton-blues-gold-coast-suns-academy-every-pick-selection-20251119-p5ngvn.html
9 News,"UPDATETropical Cyclone Fina intensifying faster than expected, forecasters warn",https://www.9news.com.au/national/tropical-cyclone-fina-forms-off-northern-australia/0f75ced2-f1e6-4274-b200-b40b8d939bd0
9 News,White House attacks journalist who Donald Trump called 'piggy',https://www.9news.com.au/world/donald-trump-calls-reporter-piggy-after-jeffrey-epstein-question/d53a7a53-c344-4560-bfff-01de835f38cf
9 News,How a grandmother's $5 raffle ticket delivered $6m and a new life,https://www.domain.com.au/news/dont-believe-you-how-a-grandmothers-5-raffle-ticket-delivered-6m-and-a-new-life-1459096/?utm_source=9news.com.au&utm_medium=referral&utm_campaign=editorial-homepage-driver
9 News,One hurdle remains in race to release Epstein files - Trump himself,https://www.9news.com.au/world/epstein-files-what-happens-next-everything-we-know-explained/592dcdd7-bd99-4dba-a547-72cf792fea69
9 News,Australia loses out in bid to host crucial $1 billion conference,https://www.9news.com.au/national/australia-wont-host-cop31/78427091-dc31-400d-a012-8f75a0690cda
9 News,Mum wants charges laid after toddler slapped at Melbourne childcare centre,https://www.9news.com.au/national/childcare-centre-toddler-slapped-melbourne/5a07ab33-1c04-43e4-860b-af0626e6e623
9 News,"'Very, very tough': ANZ CEO not proud of decision to lay off 3500 workers",https://www.9news.com.au/national/anz-mass-redundancies-ceo-nuno-matos-not-proud-of-decision-to-lay-off-3500-workers/b23dc996-7a2d-4a12-9c60-931d68da4d83
9 News,Sliver of good news for prospective home buyers in South Australia,https://www.9news.com.au/national/south-australia-property-price-trends-2026/4ea8c4c0-48ed-42a0-ad7e-f241f95e2dae
9 News,"Single mistake costing some Aussies $205,000: report",https://www.9news.com.au/national/super-consumers-australia-report-retirees-missing-out-on-200000-dollars/808645ea-e045-45d3-a57f-d116a629c8d3
9 News,Police to use extra wanding powers for SA schoolies festival,https://www.9news.com.au/national/police-expanded-powers-south-australia-schoolies/2e98ea61-e08b-46f4-b1e4-8d9475ea71d2
9 News,Teen accused of being part of criminal gang pulled from roof cavity during arrest,https://www.9news.com.au/national/brisbane-police-crime/e64de6e6-c8e7-4782-ae4e-8fb664dd4f11
9 News,WATCHState and territory leaders demand aged care funding in rare display of unity,https://www.9news.com.au/videos/national/leaders-demand-funding-as-aged-care-waiting-hits-critical-levels/cmi5o3kf2001g0hs5dpugasu4
9 News,Three more alleged gang members arrested as police seize $12.5m worth of drugs,https://www.9news.com.au/national/three-kvt-associates-charged-with-alleged-drug-supply-offences/fb61d4f0-8f0d-4f57-90ab-4774ceacacf5
9 News,Victorian schools added to list impacted by asbestos-linked sand,https://www.9news.com.au/national/coloured-sand-recall-asbestos-found-300-schools-south-australia-impacted/e6a295fc-1684-41bc-90c2-fef6e2b3afae
9 News,Accused storms out after negligent manslaughter ruling,https://www.9news.com.au/national/john-torney-court-updates-accused-storms-out-after-negligent-manslaughter-ruling/1076f298-3aa9-437a-a78a-6a54955b348b
9 News,"'Loyal, warm and lived life to the full': Russell Crowe pays tribute to radio titan John Laws",https://www.9news.com.au/national/john-laws-state-funeral-in-sydney/2d0c78e2-aa3c-46bd-95df-d43b7d0fb907
9 News,"Man charged after childcare centre allegedly torched, causing $500k in damages",https://www.9news.com.au/national/man-charged-arson-after-fire-child-care-centre-mandurah/596c9c6c-b93b-4d60-a69e-59a2c66a432d
9 News,Man in court accused of murdering two men at first birthday party,https://www.9news.com.au/national/man-arrested-double-fatal-stabbing-clyde-north-melbourne/36eb9b23-f684-4981-ac89-293b548f14c0
9 News,White House attacks journalist who Donald Trump called 'piggy',https://www.9news.com.au/world/donald-trump-calls-reporter-piggy-after-jeffrey-epstein-question/d53a7a53-c344-4560-bfff-01de835f38cf
9 News,How a grandmother's $5 raffle ticket delivered $6m and a new life,https://www.domain.com.au/news/dont-believe-you-how-a-grandmothers-5-raffle-ticket-delivered-6m-and-a-new-life-1459096/?utm_source=9news.com.au&utm_medium=referral&utm_campaign=editorial-homepage-driver
9 News,One hurdle remains in race to release Epstein files - Trump himself,https://www.9news.com.au/world/epstein-files-what-happens-next-everything-we-know-explained/592dcdd7-bd99-4dba-a547-72cf792fea69
9 News,Today in HistoryJury sides with drug dealer who shot six police officers,https://www.9news.com.au/world/today-in-history-november-19-what-happened-on-this-day-larry-davis/0492fc8a-0112-47b0-bc11-96c9828bbd43
9 News,The $1200 crime Aussies are committing without realising,https://www.9news.com.au/national/seatbelt-fines-rules-in-australia-explained/0055f393-a2d0-4f50-b479-bd9d5c289b1d
9 News,Who else has been name-checked in the Epstein email trove?,https://www.9news.com.au/world/jeffrey-epstein-emails-more-revelations-donald-trump-prince-andrew-ghislaine-maxwell-bill-clinton/1aab28f8-865f-47ac-9df8-63ba6b4c722a
9 News,"The US government has reopened after a historic shutdown. What does that mean, exactly?",https://www.9news.com.au/world/us-government-shutdown-what-it-is-how-works-how-affects-australians-explained/fb5f4b09-2157-461d-bc45-b4037bb7afe0
9 News,Billionaire owner of $80 million Melbourne 'knockdown' estate named,https://www.domain.com.au/news/billionaire-owner-of-80-million-melbourne-knockdown-estate-named-1458991/?utm_source=9news.com.au&utm_medium=referral&utm_campaign=editorial-homepage-driver
9 News,Haunting 150-year-old castle ruins for sale,https://www.domain.com.au/news/150-year-old-mysterious-castle-ruins-offered-for-sale-in-the-blue-mountains-1453393/?utm_source=9news.com.au&utm_medium=referral&utm_campaign=editorial-homepage-driver
9 News,Money mules: International students warned against selling bank accounts,https://www.9news.com.au/national/money-mules-international-students-warned-against-selling-bank-accounts-for-quick-cash/e5f7589a-55aa-4860-8b4e-d9046036c515
9 News,'Threw up in my mouth': Bitter Liberal spat explodes into the open,https://www.9news.com.au/national/australia-politics-liberal-party-jacinta-price-hollie-hughes/e7ff1295-12b5-4cfe-80c2-0203561f8ffc
9 News,Woman accused of trying to kill police during search warrant fronts court,https://www.9news.com.au/national/woman-accused-of-trying-to-kill-police-fronts-court/ca2cecfb-f988-4dc3-81f6-80b50510dac8
9 News,Social workers to be put in schools to stop youth crime before it starts,https://www.9news.com.au/national/victoria-early-intervention-officers-youth-crime/cb8ac555-99af-4f61-bc95-1d7d0421bac9
9 News,Origin of mystery debris balls on beaches revealed,https://www.9news.com.au/national/debris-balls-nsw-central-coast-likely-originated-in-sydney-epa-says/9b1a3db9-2d88-420b-a1d3-260a00458ac3
9 News,Teen charged following sexual assault of elderly woman in NSW park,https://www.9news.com.au/national/investigation-underway-sexual-assault-woman-nsw-park/cdedcd4d-6a8d-47aa-b4ab-5e124a4a5740
9 News,Mosquito outbreak at popular park divides council as residents left bleeding,https://www.9news.com.au/national/perth-warradale-park-mosquito-outbreak-city-of-wanneroo/f380b934-dc7a-4803-963b-2f4992ee5312
9 News,Anti-Semitic vandal jailed but set for release soon,https://www.9news.com.au/national/mohommed-farhat-and-thomas-stojanovski-anti-semitic-vandal-jailed-but-set-for-release-soon/a590fb07-55fb-4434-9b2b-6c7e78e879b4
9 News,Popular online travel agency announces takeover bid,https://www.9news.com.au/national/helloworld-launches-takeover-bid-of-webjet/a95f434b-d784-4a19-8b43-8dcd9082f29e
9 News,Trump's allies cave on Epstein files after months of delays,https://www.9news.com.au/world/jeffrey-epstein-files-us-house-vote-to-force-justice-department-to-release-files/d1850ba7-dabc-4253-88e9-1a53f0ead44d
9 News,"Entertainment duo the Kessler twins die on the same day, aged 89",https://www.9news.com.au/world/entertainment-duo-the-kessler-twins-die-by-assisted-suicide-aged-89/64e91f9f-802e-4f80-962d-9691eeb6aaa6
9 News,Monster weed infestation sparks outrage in $7m neighbourhood,https://www.domain.com.au/news/monster-weed-infestation-sparks-outrage-in-7m-neighbourhood-1458886/?utm_source=9news.com.au&utm_medium=referral&utm_campaign=editorial-homepage-driver
9 News,The controversial ex-cop who was the only 'no' in the Epstein vote,https://www.9news.com.au/world/epstein-files-release-why-republican-clay-higgins-was-only-no-vote-in-us-house/dcb58958-c9c5-44f6-93e2-34e439777327
9 News,Trump claims slain journalist Khashoggi was 'extremely controversial',https://www.9news.com.au/world/donald-trump-claims-murdered-journalist-jamai-khashoggi-was-controversial/c81f8e6d-12a3-4b8c-9106-11c5aa27e336
9 News,"Web failure knocks out Uber, ChatGPT, X and Aussie airport sites",https://www.9news.com.au/world/internet-outage-cloudflare-experiencing-issues-worldwide-taking-down-several-sites/2c0cfab7-d28d-4ffd-a91b-f9a14377685a
9 News,Latest contracted NRL star on R360's radar after Haas blow,https://www.nine.com.au/sport/nrl/news-2025-the-mole-exclusive-r360-target-billy-smith-payne-haas-broncos/a993d782-c1fe-48a1-8aeb-29be9825cfa6
9 News,'Get under his skin': Barmy Army to target Aussie 'villain',https://www.nine.com.au/sport/cricket/the-ashes-2025-alex-carey-not-convinced-of-barmy-armys-reported-silence-warned-of-taunts/657952bc-2051-4f27-b935-234dd43abdf7
9 News,Nation the size of Cairns makes World Cup history,https://www.nine.com.au/sport/football/concacaf-world-cup-qualifiers-curacao-history-making-qualification-match-jamaica-who-has-qualified/9ce52071-4cca-470a-afee-6a5c6cbca991
9 News,Hewitt steps out of retirement to team up with son,https://www.nine.com.au/sport/tennis/news-2025-lleyton-hewitt-joins-son-cruz-atp-challenger-doubles-event/8cceeee6-ecaa-4c06-b8f3-564b58fe3994
9 News,'Looks a bit forlorn': Champ's observation dire for Piastri,https://www.nine.com.au/sport/motorsport/f1-news-2025-lando-norris-damon-hill-world-championship/ead15d46-b6ba-4feb-a337-cb9026195dc1
9 News,'Not an issue': Rogers tips new wave of NRL defectors,https://www.nine.com.au/sport/nrl/news-2025-r360-10-year-ban-mat-rogers-comments-zac-lomax-ryan-papenhuyzen-wallabies/27034be5-9ffa-4a58-9ec2-9ea40b3e457b
9 News,Wallabies whacked for playing 'Russian roulette',https://www.nine.com.au/sport/rugby/news-2025-wallabies-australia-ireland-review-france-test-exclusive-analysis-opinion-joe-schmidt-tenure/8cc249d8-9201-417e-8369-208c575a8d6f
9 News,Australia's top brands for customer experience revealed,https://9now.nine.com.au/today/top-brands-for-customer-experience-in-australia-revealed-specsavers-eyewear-number-1/e2662ea5-f627-44fd-9f3a-951a2a8bfcdd
9 News,Wicked: For Good director teases third film,https://9now.nine.com.au/today/wicked-for-good-director-teases-third-film-entertainment-news-november-19/a079508b-e8ee-4d58-82b5-71310a67869e
9 News,Calls to limit child access to dangerous 'fat bikes',https://9now.nine.com.au/today/fat-bike-ebike-safety-concerns-school-crackdown-following-serious-injury-and-death/ad4a8537-befa-4eb6-9203-5c6e250f8726
9 News,Tattoo artists say insurance companies are treating them like criminals,https://9now.nine.com.au/a-current-affair/tattoo-artists-say-insurance-companies-are-treating-them-like-criminals/e4787107-5155-49ca-bbe0-8cb5ef6c568d
9 News,Sydney home marooned due to water runoff from troubled development,https://9now.nine.com.au/a-current-affair/sydney-home-marooned-due-to-water-runoff-from-troubled-risland-development/bb963a99-8fbc-43b9-944b-6173a6e3fe25
9 News,$2b 'mini city' development in limbo after new owner goes bust,https://9now.nine.com.au/a-current-affair/wilton-greens-mini-city-development-in-limbo-after-new-owner-goes-bust/31a66348-444f-4593-9988-0ea8fcd9d69c
9 News,Allegation of cover-up in Laos methanol poisoning investigation,https://9now.nine.com.au/60-minutes/allegation-of-cover-up-in-laos-methanol-poisoning-investigation/c842f67a-f968-4fe6-988e-e4e86a44b07a
9 News,Bree thought surgery would solve her problems. It led to a world of pain,https://9now.nine.com.au/60-minutes/bree-thought-jaw-surgery-would-solve-her-problems-instead-it-led-to-a-world-of-pain/78c0d278-46fb-43c8-afda-70665ad213aa
9 News,Families of crash victims fighting for better e-bike regulations,https://9now.nine.com.au/60-minutes/families-of-crash-victims-fighting-for-better-ebike-regulations/8143ff22-9caf-40d4-b330-b12042fbf74d
9 News,Couple arrive home to find nasty note taped to their door,https://www.domain.com.au/news/couple-confronted-by-rude-note-eight-hours-after-picking-up-apartment-keys-1414069/?utm_source=nine.com.au&utm_medium=referral&utm_campaign=editorial-homepage-driver
9 News,The last affordable suburb in Sydney revealed,https://www.domain.com.au/news/girraween-the-closest-suburb-to-sydneys-cbd-for-under-1-million-is-24km-away-1408376/?utm_source=nine.com.au&utm_medium=referral&utm_campaign=editorial-homepage-driver
9 News,The unusual reason Peter bought this derelict cottage,https://www.domain.com.au/news/i-collected-it-peter-bought-this-run-down-riverside-nz-cottage-for-nostalgia-1414033/?utm_source=nine.com.au&utm_medium=referral&utm_campaign=editorial-homepage-driver
9 News,Porsche has no plans to drop petrol engines,https://www.drive.com.au/news/porsche-has-no-plans-to-drop-petrol-engines/?utm_source=nine-rail&utm_medium=referral
9 News,Mitsubishi Australia considering a rebadged Nissan,https://www.drive.com.au/news/volkswagen-t-roc-r-to-return-with-second-generation-in-2027/?utm_source=nine-rail&utm_medium=referral
9 News,Best new car deals for November 2025,https://www.drive.com.au/news/best-new-car-deals-november-2025/?utm_source=nine-rail&utm_medium=referral
9 News,Man accused of spearheading Perth's illicit tobacco ringan hour ago,https://www.9news.com.au/videos/national/man-accused-of-spearheading-perths-illicit-tobacco-ring/cmi5wgn5p001m0gk49sym9sq3
9 News,Health scare for students at WA primary schoolan hour ago,https://www.9news.com.au/videos/national/health-scare-for-students-at-wa-primary-school/cmi5wh7k4001b0hoch3ytxh59
9 News,Sour expression tells all as rival swipes star in AFL Draftan hour ago,https://www.nine.com.au/sport/afl/news-2025-afl-draft-melbourne-demons-carlton-blues-gold-coast-suns-academy-every-pick-selection-20251119-p5ngvn.html
9 News,Little-known allergy probed over death of teen hours after sausage dinner2 hours ago,https://www.9news.com.au/national/jeremy-webb-inquest-spotlight-on-teens-legacy-after-camping-trip-death/2107945b-7f7f-4949-81a2-6536a47d65c0
9 News,Teen accused of being part of criminal gang pulled from roof cavity during arrest,https://www.9news.com.au/national/brisbane-police-crime/e64de6e6-c8e7-4782-ae4e-8fb664dd4f11
9 News,Sydney home marooned due to water runoff from troubled development,https://9now.nine.com.au/a-current-affair/sydney-home-marooned-due-to-water-runoff-from-troubled-risland-development/bb963a99-8fbc-43b9-944b-6173a6e3fe25
9 News,Sliver of good news for prospective home buyers in South Australia,https://www.9news.com.au/national/south-australia-property-price-trends-2026/4ea8c4c0-48ed-42a0-ad7e-f241f95e2dae
9 News,Police to use extra wanding powers for SA schoolies festival,https://www.9news.com.au/national/police-expanded-powers-south-australia-schoolies/2e98ea61-e08b-46f4-b1e4-8d9475ea71d2
9 News,Australia loses out in bid to host crucial $1 billion conference,https://www.9news.com.au/national/australia-wont-host-cop31/78427091-dc31-400d-a012-8f75a0690cda
9 News,Victorian schools added to list impacted by asbestos-linked sand,https://www.9news.com.au/national/coloured-sand-recall-asbestos-found-300-schools-south-australia-impacted/e6a295fc-1684-41bc-90c2-fef6e2b3afae
Guardian,"New drug could be a breakthrough in treatment for killer TB, trial suggests",https://www.theguardian.com/global-development/2025/nov/19/new-drug-could-be-breakthrough-killer-tb-tuberculosis-sorfequiline
Guardian,"The rainforest the world forgot: the Congo basin is the second largest on Earth, so why is it being neglected?",https://www.theguardian.com/environment/2025/nov/18/congo-basin-rainforest-africa-research-funding-aoe
Guardian,"Nestlé accused of ""risking health of babies for profit"" over added sugar in cereals sold in African countries",https://www.theguardian.com/global-development/2025/nov/17/nestle-accused-of-risking-health-of-babies-for-profit-over-added-sugar-in-cereals-sold-in-african-countries
Guardian,Nicki Minaj to spotlight plight of Nigerian Christians in UN speech arranged by White House,https://www.theguardian.com/music/2025/nov/17/nicki-minaj-un-speech-trump-nigeria-christian
Guardian,Eswatini confirms receiving over $5m from US to accept deportees,https://www.theguardian.com/world/2025/nov/17/eswatini-5-m-dollars-us-deportees
Guardian,Disease fears as Argentina child vaccination rates hit historic lows ,https://www.theguardian.com/world/2025/nov/19/argentina-immunisations-childhood-adolescent-plummet
Guardian,British woman among four tourists killed in blizzard at nature reserve in Chile,https://www.theguardian.com/world/2025/nov/18/british-woman-among-four-tourists-killed-in-blizzard-at-nature-reserve-in-chile
Guardian,"Sheinbaum again dismisses Trump""s threat of sending troops to Mexico: ""We do not want intervention""",https://www.theguardian.com/world/2025/nov/18/claudia-sheinbaum-us-military-mexico-trump
Guardian,"Argentina judge fired after causing mistrial in case over Maradona""s death ",https://www.theguardian.com/world/2025/nov/18/argentina-judge-diego-maradona-case-fired
Guardian,"Venezuela""s top opposition leader claims ""new era"" is coming despite lack of clear plan",https://www.theguardian.com/world/2025/nov/18/venezuela-new-era-maria-corina-machado-trump
Guardian,"Watch out for online contact with Chinese spies, UK defence minister warns public",https://www.theguardian.com/world/2025/nov/19/watch-out-online-contact-chinese-spies-uk-defence-minister-warns-public
Guardian,China suspends seafood imports from Japan as Taiwan row escalates,https://www.theguardian.com/world/2025/nov/19/china-suspends-seafood-imports-from-japan-as-taiwan-row-escalates
Guardian,"UN to hear human rights complaint over New Zealand""s treatment of Māori",https://www.theguardian.com/world/2025/nov/19/un-to-hear-human-rights-complaint-over-new-zealands-treatment-of-maori
Guardian,Chinese travellers cancel hundreds of thousands of trips to Japan amid rising tensions,https://www.theguardian.com/world/2025/nov/18/chinese-travellers-estimated-to-have-cancelled-500000-flights-to-japan-amid-rising-tensions
Guardian,"Philippine president Marcos denies estranged sister""s claim he is a cocaine addict",https://www.theguardian.com/world/2025/nov/18/philippine-president-marcos-denies-estranged-sisters-claim-he-is-a-cocaine-addict
Guardian,Bonn nuit: nailbiter for German city as Albanese and Bowen offer mixed messages on hosting Cop31,https://www.theguardian.com/environment/2025/nov/19/albanese-bowen-mixed-messages-cop31-host-germany-turkey-australia
Guardian,"""Deathly silent"": two out of three corals in world heritage-listed Ningaloo reef have been killed, scientists confirm",https://www.theguardian.com/environment/2025/nov/19/two-out-of-three-corals-in-world-heritage-listed-ningaloo-reef-are-dead
Guardian,"Labor MP Ed Husic urges own party to ""pry open the jaws of Treasury"" after CSIRO announces job cuts",https://www.theguardian.com/australia-news/2025/nov/19/fund-csiro-amid-hundreds-of-job-losses-labor-mp-ed-husic-tells-own-party-
Guardian,"Former Liberal senator quits party "" as it happened",https://www.theguardian.com/australia-news/live/2025/nov/19/australia-news-live-optus-amazon-nsw-leaders-mark-speakman-challenge-spill-coalition-john-laws-funeral-ntwnfbhip-liberal
Guardian,Tony Burke reviewing anti-hate laws and says South African neo-Nazi will not be allowed back into Australia ,https://www.theguardian.com/australia-news/2025/nov/19/tony-burke-reviewing-anti-hate-laws-and-says-south-african-neo-nazi-will-not-be-allowed-back-into-australia
Guardian,"Poland detains several people in connection with rail sabotage as foreign minister condemns Russian ""state terrorism"" "" Europe live",https://www.theguardian.com/world/live/2025/nov/19/russia-ukraine-poland-zelenskyy-germany-sweden-turkey-europe-live-latest-news-updates
Guardian,"Shabana Mahmood accused of ""ethnic stereotyping"" by Albania""s PM ",https://www.theguardian.com/uk-news/2025/nov/19/shabana-mahmood-accused-ethnic-stereotyping-albania-pm
Guardian,Social Democrats in Denmark suffer sweeping election losses,https://www.theguardian.com/world/2025/nov/19/denmark-social-democrats-suffer-election-losses-mette-frederiksen
Guardian,Moscow passes laws to boost defences against Ukrainian strikes,https://www.theguardian.com/world/2025/nov/19/moscow-passes-laws-to-boost-defences-against-ukrainian-strikes
Guardian,"""Dangerous nostalgia"": did Spain""s ""pact of forgetting"" after Franco leave new generation open to far right?",https://www.theguardian.com/world/2025/nov/19/franco-continues-to-haunt-and-divide-spain
Guardian,"Trump defends Saudi crown prince over Khashoggi killing, threatens ABC News in White House meeting "" as it happened",https://www.theguardian.com/world/live/2025/nov/18/donald-trump-mbs-saudi-arabia-meeting-f35-jets-latest
Guardian,Saudi entourage for US visit may include official implicated in Twitter spy plot ,https://www.theguardian.com/world/2025/nov/18/saudi-leader-mohammed-bin-salman-entourage-includes-official-implicated-in-twitter-spy-plot
Guardian,Trump says US will sell F-35 stealth jets to Saudis as Prince Mohammed visits ,https://www.theguardian.com/us-news/2025/nov/18/trump-says-us-will-sell-f-35-stealth-jets-to-saudis-as-prince-mohammed-visits
Guardian,One of the oddest UN resolutions in history seeks to solidify shaky Gaza ceasefire into an enduring peace,https://www.theguardian.com/world/2025/nov/18/one-of-the-oddest-un-resolutions-in-history-seeks-to-solidify-shaky-gaza-ceasefire-into-an-enduring-peace
Guardian,"""They have total impunity"": West Bank settler violence surges after Gaza ceasefire",https://www.theguardian.com/world/2025/nov/18/west-bank-surge-settler-violence-israel-palestine
Guardian,"Bhutan PM on leading the first carbon-negative nation: ""The wellbeing of our people is at the centre of our agenda""",https://www.theguardian.com/environment/2025/nov/18/bhutan-pm-tshering-tobgay-first-carbon-negative-nation-climate-wellbeing
Guardian,Ousted Bangladesh PM Sheikh Hasina sentenced to death for crimes against humanity,https://www.theguardian.com/world/2025/nov/17/ousted-bangladesh-pm-sheikh-hasina-found-guilty-of-crimes-against-humanity
Guardian,Blast from confiscated explosives at police station in Indian-controlled Kashmir kills nine,https://www.theguardian.com/world/2025/nov/15/blast-from-confiscated-explosives-at-police-station-in-indian-controlled-kashmir-kills-nine
Guardian,"Kashmir is focus of arrests after Delhi car blast linked to ""terror module""",https://www.theguardian.com/world/2025/nov/14/kashmir-is-focus-of-arrests-after-delhi-car-blast-linked-to-terror-module
Guardian,India confirms deadly Delhi car blast being treated as terror incident,https://www.theguardian.com/world/2025/nov/12/india-confirms-deadly-delhi-car-blast-being-treated-as-terror-incident-red-fort
Guardian,"Starmer refuses to rule out freezing tax thresholds as Badenoch criticises budget plans "" UK politics live",https://www.theguardian.com/politics/live/2025/nov/19/pmqs-uk-politics-latest-news-john-healey-rachel-reeves-keir-starmer-labour
Guardian,Wimbledon to get exemption from ticket resale crackdown for seats that can cost thousands,https://www.theguardian.com/money/2025/nov/19/wimbledon-debenture-tickets-exempt-uk-resale-crackdown
Guardian,UK inflation eases for first time in five months to 3.6% before crunch budget,https://www.theguardian.com/business/2025/nov/19/uk-inflation-falls-budget-october-rachel-reeves-interest-rate
Guardian,Man wrongly jailed for 38 years says Merseyside police forced confession,https://www.theguardian.com/uk-news/2025/nov/19/peter-sullivan-wrongly-jailed-for-38-years-says-merseyside-police-forced-confession
Guardian,"Farage""s wholesale denial of detailed racism claims is ""troubling"", says former extremism adviser",https://www.theguardian.com/politics/2025/nov/19/farages-wholesale-denial-of-detailed-racism-claims-is-troubling-says-former-extremism-adviser
Guardian,"Owl described as ""fighter"" set to fly free after falling into cement mixer in Utah",https://www.theguardian.com/us-news/2025/nov/19/owl-flies-free-cement-mixer-utah
Guardian,First Thing: Senate agrees to pass Epstein files bill after near-unanimous House vote,https://www.theguardian.com/us-news/2025/nov/19/first-thing-senate-agrees-pass-epstein-files-bill-near-unanimous-house-vote
Guardian,State department to cut 38 universities from research program over DEI policies,https://www.theguardian.com/us-news/2025/nov/19/universities-state-department-dei-research-program
Guardian,Nearly all immigrants detained in Trump Chicago raid had no criminal conviction,https://www.theguardian.com/us-news/2025/nov/19/trump-chicago-immigration-raid
Guardian,"Trump""s anti-climate agenda could result in 1.3m more deaths globally, analysis finds",https://www.theguardian.com/environment/2025/nov/19/trump-emissions-policy-could-cause-climate-deaths
