Section,Headline,Link
Sky News,Today's News Headlines: Allegations against Trump in newly released Epstein files,https://www.skynews.com.au/australia-news/todays-news-headlines-allegations-against-trump-in-newly-released-epstein-files/video/8c28bafd533dd957c8af6febccc55fad
Sky News,Georgie Cavanough highlights strong team of horses ready for Country Championships Qualifier,https://www.skynews.com.au/australia-news/sport/georgie-cavanough-highlights-strong-team-of-horses-ready-for-country-championships-qualifier/video/be91cbc79f8f8f43dfefb1992ce4901d
Sky News,"""A great day': Trainer Adrian Bott previews Randwick's Guineas Day",https://www.skynews.com.au/australia-news/sport/a-great-day-trainer-adrian-bott-previews-randwicks-guineas-day/video/9fff61adeb22d8d6cdfd14a69ae03719
Sky News,Brad Gray's top tips for Randwick on Saturday,https://www.skynews.com.au/australia-news/sport/brad-grays-top-tips-for-randwick-on-saturday/video/4a3b105abfe5d71939d9b72ac9356584
Sky News,"Trainer Rob Archibald previews ""exciting' autumn horse racing season",https://www.skynews.com.au/australia-news/sport/trainer-rob-archibald-previews-exciting-autumn-horse-racing-season/video/444e2c1898fe6232f8217f44518acfa5
Sky News,Today's News Headlines: Trump and Netanyahu promise to intensify strikes in Iran,https://www.skynews.com.au/australia-news/todays-news-headlines-trump-and-netanyahu-promise-to-intensify-strikes-in-iran/video/9f51842d17a728ae1236597865c17577
Sky News,"Australia lodges complaints with China following ""unsafe' navy helicopter encounter",https://www.skynews.com.au/australia-news/defence-and-foreign-affairs/australia-lodges-complaints-with-china-following-unsafe-navy-helicopter-encounter/video/7469ee0efbdc90884b0fd92d2b8dc710
Sky News,Today's News Headlines: Qatar cancels events at Melbourne's Grand Prix,https://www.skynews.com.au/australia-news/todays-news-headlines-qatar-cancels-events-at-melbournes-grand-prix/video/b45fb2d86dce61dddacbec46961b8186
Sky News,Friday prayers held for the first time since Ayatollah's death,https://www.skynews.com.au/australia-news/friday-prayers-held-for-the-first-time-since-ayatollahs-death/video/e46c59e919d1f30c457aa79c8fef969f
Sky News,"Listen to ""Sky News Radio' on the Nova Player app",https://www.skynews.com.au/business/media/you-can-listen-to-sky-news-australia-anytime-and-on-any-platform-with-sky-news-radio-on-iheartradio/news-story/2d6aca31bc7566b5c0652db48284f5b7
Sky News,Catch up on your favourite Sky News shows with podcasts,https://www.skynews.com.au/opinion/your-favourite-sky-news-australia-shows-are-available-to-listen-to-any-time-as-podcasts/news-story/379bbe36e745709ce679d2813be0249c
