Section,Headline,Link
ABC,'Hell has froze over': Trump's new nemesis saw the signs before Epstein vote,https://www.abc.net.au/news/2025-11-19/donald-trump-epstein-files-unlikely-series-of-events/106022276
ABC,Duursma becomes an Eagle as Suns and Dons secure big draft wins,https://www.abc.net.au/news/2025-11-19/afl-draft-2025-first-round-live-blog/106029566
ABC,eSafety Commissioner labelled 'zealot' and beckoned before US Congress,https://www.abc.net.au/news/2025-11-19/julie-inman-grant-called-to-testify-us-congress/106028042
ABC,"Woman told to cordon off backyard, access to house, after using coloured sand",https://www.abc.net.au/news/2025-11-19/potentially-asbestos-contaminated-coloured-sand-at-diwali/106027712
ABC,"Former CFMEU boss sent abusive text to anti-corruption barrister, inquiry hears",https://www.abc.net.au/news/2025-11-19/qld-cfmeu-inquiry-hearing-geoffrey-watson-john-setka/106029388
ABC,Emergency meeting between states after federal swipe on hospital funding,https://www.abc.net.au/news/2025-11-19/states-launch-attack-on-hospital-funding-negotiations/106029008
ABC,Court hears graphic details about condition of dead man's body,https://www.abc.net.au/news/2025-11-19/dimboola-murder-trial-supreme-court-jodie-hill-john-hunter-crime/106027156
ABC,The CSIRO cuts are just the tip of the iceberg for Australia's science funding,https://www.abc.net.au/news/science/2025-11-19/csiro-cuts-tip-australia-science-funding/106026174
ABC,ABC and Test cricket legend part ways over gambling company sponsorship,https://www.abc.net.au/news/2025-11-19/glenn-mcgrath-and-abc-sport-part-ways-over-gambling-company-link/106028682
ABC,ABC managing director tells journalists not to 'second-guess' their work,https://www.abc.net.au/news/2025-11-19/abc-managing-director-addresses-national-press-club/106027282
ABC,Marg won a Tony for a one-woman Dorian Gray and now dresses 85 in Carmen,https://www.abc.net.au/news/2025-11-19/marg-horwell-the-picture-of-dorian-gray-tony-award-carmen/105399248
ABC,Quiz: Do you remember who won the Booker just a week ago?,https://www.abc.net.au/news/2025-11-19/booker-prize-2025-quiz/105950622
ABC,"Advice around 'forever chemicals' outdated, as inquiry calls for testing overhaul",https://www.abc.net.au/news/2025-11-19/pfas-inquiry-hopes-to-strengthen-regulation-human-health/106026416
ABC,When will the Epstein files get released? Here is how it could work,https://www.abc.net.au/news/2025-11-19/where-does-the-jeffrey-epstein-files-bill-go-from-here/106023134
ABC,PM says no apologies over Border Force's secret boat returnee scheme,https://www.abc.net.au/news/2025-11-19/pm-says-no-apologies-over-border-force-boat-returnee-scheme/106023066
ABC,Housing Dept tried to evict DV victim after noise complaints related to abuse,https://www.abc.net.au/news/2025-11-19/perth-mother-facing-social-housing-eviction-over-dv-wins-case/106028396
ABC,Singapore to tax travellers for fuel in world first. Australia may follow,https://www.abc.net.au/news/2025-11-19/singapore-sustainable-aviation-fuel-levy-costs-explained/106018080
ABC,Popovic fumes at penalty decision in 3-0 friendly loss to Colombia in New York,https://www.abc.net.au/news/2025-11-19/socceroos-vs-colombia-new-york-live-blog/106026972
ABC,Nothing like Adelaide uni merger 'has been attempted in Australia before',https://www.abc.net.au/news/2025-11-19/sa-adelaide-university-co-vice-chancellors-on-uni-merger/106022624
ABC,Wife of slain paramedic says killer is getting the 'help he finally needs',https://www.abc.net.au/news/2025-11-18/wife-slain-paramedic-steven-tougher-speaks-out-on-mental-health/106019350
ABC,'Easier to access poker machines' than support in Indigenous communities,https://www.abc.net.au/news/2025-11-18/data-on-pokies-in-indigenous-communities/105999308
ABC,A mentally ill man was shot dead by police. An officer involved was promoted,https://www.abc.net.au/news/2025-11-17/nsw-police-mental-health-responses-criticism-from-coroners/105914846
ABC,How retirees are failed by Australia's superannuation system,https://www.abc.net.au/news/2025-11-19/super-consumers-performance-warning-retirees-after-retirement/106021954
ABC,"Public hospitals wasting $1.2b a year on avoidable costs, report says",https://www.abc.net.au/news/2025-11-18/public-hospital-wastage-grattan-institute-report/106019006
ABC,Prime minister hails WA role in critical minerals deal with US,https://www.abc.net.au/news/2025-11-18/anthony-albanese-hails-wa-role-in-us-critical-minerals-deal/106024178
ABC,Senator calls on prime minister for support amid torrent of online abuse,https://www.abc.net.au/news/2025-11-18/senator-fatima-payman-calls-on-pm-to-denounce-online-trolls/106024908
ABC,"After 15 years of democracy, is Tonga turning back to its king?",https://www.abc.net.au/news/2025-11-19/tonga-election-king-democracy-noble-votes/106022830
ABC,'Things happen': Trump defends Saudi prince over killing of Washington Post journalist,https://www.abc.net.au/news/2025-11-19/donald-trump-defends-mohammed-bin-salman-jamal-khashoggi-killing/106025864
ABC,Ukrainians working for Moscow suspected of Polish rail line sabotage,https://www.abc.net.au/news/2025-11-19/poland-says-russian-intelligence-likely-behind-railway-sabotage/106025554
ABC,Rude shock for Australia as South Korea unshackles from coal reliance,https://www.abc.net.au/news/2025-11-18/south-korea-coal-plant-closure-warning-on-australian-exports/106021660
ABC,Wages growth data quashes rate cut hopes — as it happened,https://www.abc.net.au/news/2025-11-19/asx-markets-business-live-news/106025882
ABC,"Wage growth remains steady, just ahead of inflation",https://www.abc.net.au/news/2025-11-19/abs-wage-price-index-figures-released-september-quarter/106026360
ABC,Is Victoria really facing a gas shortfall?,https://www.abc.net.au/news/2025-11-19/victorias-gas-supply-and-shortage-explained/105999652
ABC,Samsung phones 'slipped through the cracks' before Triple Zero tragedy,https://www.abc.net.au/news/2025-11-19/tpg-telecom-contact-customers-triple-zero-death/106022250
ABC,Curaçao makes history as smallest-ever nation to qualify for World Cup,https://www.abc.net.au/news/2025-11-19/curacao-smallest-nation-qualify-fifa-world-cup/106028664
ABC,Tim Tszyu returns to Sydney for next fight as he looks to save a career on the brink,https://www.abc.net.au/news/2025-11-19/tim-tszyu-next-fight-sydney-comeback/106028520
ABC,Scotland ends 28-year World Cup absence after breathtaking bicycle kick goal,https://www.abc.net.au/news/2025-11-19/fifa-world-cup-scotland-beat-denmark-scott-mctominay/106026514
ABC,The AFL draft might be broken for the league's biggest strugglers,https://www.abc.net.au/news/2025-11-19/the-afl-draft-might-be-broken-for-leagues-strugglers/106011254
ABC,"Should you make mortgage repayments monthly, fortnightly or weekly?",https://www.abc.net.au/news/2025-11-19/mortgage-repayments-frequency-fortnightly-or-monthly/105996588
ABC,I'm a male early childhood educator. I worry about my son in care,https://www.abc.net.au/news/2025-11-18/what-it-is-like-being-a-male-educator-amid-the-childcare-crisis/105995392
ABC,Five speedy dinners for the busy end of year,https://www.abc.net.au/news/2025-11-17/easy-healthy-summer-dinners/105822526
ABC,Avoiding 'just living for the weekend' is trending. Is it all it's cracked up to be?,https://www.abc.net.au/news/2025-11-17/not-living-for-the-weekend-social-media-trend/105999240
ABC,Amyl and the Sniffers win Album of the Year at ARIAs — as it happened,https://www.abc.net.au/news/2025-11-19/arias-2025-live-red-carpet-kicks-off-australian-music/106021634
ABC,ARIA Awards 2025 winners' list: every winner at this year's ceremony,https://www.abc.net.au/news/2025-11-19/aria-awards-winners-list-2025/106029368
ABC,Nintendo gave away millions of games for free. The risk paid off,https://www.abc.net.au/news/2025-11-19/nintendo-wii-release-anniversary/105971384
ABC,Game designed to save dying Aboriginal language wins global awards,https://www.abc.net.au/news/2025-11-19/aboriginal-language-game-wins-global-award/105975448
Sky News,"ABC's ""journalistic integrity' in question over Donald Trump editing scandal",https://www.skynews.com.au/opinion/chris-kenny/abcs-journalistic-integrity-in-question-over-donald-trump-editing-scandal/video/543fe4fa969e989e4078ee83aab3564d
Sky News,"Peta Credlin urges Jess Wilson to be wary of the ""factional clowns' who could hurt the economy",https://www.skynews.com.au/opinion/peta-credlin/peta-credlin-urges-jess-wilson-to-be-wary-of-the-factional-clowns-who-could-hurt-the-economy/video/3c081bb35e3bee837c9795172380877b
Sky News,"""Great sin': ABC operates like a ""gang of thieves'",https://www.skynews.com.au/opinion/andrew-bolt/great-sin-abc-operates-like-a-gang-of-thieves/video/c91c018edd6dfe994cd83b645858247a
Sky News,"""Cut through': Kellie Sloane set to be new NSW Opposition Leader by Friday",https://www.skynews.com.au/opinion/sharri-markson/cut-through-kellie-sloane-set-to-be-new-nsw-opposition-leader-by-friday/video/197134f731d5bdbb04878bbdbd28b0dc
Sky News,Power bills increase as more Australians encounter financial hardship,https://www.skynews.com.au/opinion/paul-murray/power-bills-increase-as-more-australians-encounter-financial-hardship/video/aa61d14d8cadaa947edf2b3408c96e08
Sky News,"""Michelle is wrong as usual': Ms Obama claims Kamala lost because she's a woman",https://www.skynews.com.au/opinion/michelle-is-wrong-as-usual-ms-obama-claims-kamala-lost-because-shes-a-woman/video/39909dec60ce2817ef0e6853717a2f7b
Sky News,I told my boss I was pregnant ' then I was hauled into HR,https://www.skynews.com.au/lifestyle/they-cant-treat-women-like-this-aussie-woman-recounts-the-shocking-way-she-was-treated-by-her-workplace-immediately-after-telling-her-boss-she-was-pregnant/news-story/e109e5d4b5b67695f17ce38e904ee332
Sky News,Liberal MP Kellie Sloane set to be new NSW Opposition Leader by Friday,https://www.skynews.com.au/australia-news/politics/liberal-mp-kellie-sloane-set-to-be-new-nsw-opposition-leader-by-friday-morning-sky-news-host-reveals/news-story/e5e3faa8ffb27af1d1585fcbca9c24c4
Sky News,"ABC Senate inquiry push continues, despite boss' Press Club pledge",https://www.skynews.com.au/business/media/liberal-senator-sarah-henderson-doubles-down-on-abc-senate-inquiry-push-despite-hugh-marks-press-club-pledge/news-story/a715529ccb5af967ed4521a330173f49
Sky News,The six-word question Ley demands Albanese answer,https://www.skynews.com.au/australia-news/politics/opposition-leader-sussan-ley-demands-media-ask-anthony-albanese-sixword-question-on-energy-bills/news-story/596e22733fccab6219d52e8af4c78209
Sky News,Former PM hits out after Australian cricket legend loses ABC commentary gig,https://www.skynews.com.au/australia-news/sport/former-australian-cricketer-glenn-mcgrath-loses-abc-commentary-gig-over-gambling-links-just-days-out-from-ashes-series/news-story/7c062d4452876afcf2253f4ef4ab075b
Sky News,"""The dishonesty beggars belief': Tehan hits out at Albanese govt after bombshell energy price report",https://www.skynews.com.au/australia-news/politics/the-dishonesty-beggars-belief-shadow-energy-minister-dan-tehan-hits-out-at-albanese-after-bombshell-energy-price-report/news-story/b54ff80af70dbd60b7a25f62c2a7328c
Sky News,New Vic Opposition Leader doubles down on Treaty stance,https://www.skynews.com.au/australia-news/politics/vastly-different-new-liberal-leader-jess-wilson-slams-vic-treaty-laws-despite-past-support-voice-to-parliament/news-story/ae0c07cc7d9f5f5beef981e26376c23f
Sky News,Affluent Sydney area targeted as items worth thousands allegedly stolen,https://www.skynews.com.au/australia-news/crime/charges-laid-after-reported-breakins-and-items-worth-thousands-allegedly-stolen-from-affluent-sydney-area/news-story/6f4c2c3e193b82f687b088e6cbcdcd16
Sky News,"""Medicine could kill the patient': ANZ boss' warning on net zero",https://www.skynews.com.au/business/energy/anz-boss-nuno-matos-warns-the-medicine-could-kill-the-patient-as-debate-over-net-zero-by-2050-rages-on/news-story/9274e3b7f638d79e4421fcc27702a403
Sky News,"""Not actually allowed': Aussies outraged by man ""reserving' public parking spot",https://www.skynews.com.au/lifestyle/trending/not-actually-allowed-aussies-stunned-after-man-tried-to-reserve-public-parking-spot-with-a-recycling-bin-that-wasnt-even-his/news-story/5f726f7f7b1fc20f4672d88cb294850f
Sky News,Popular US food chain to debut in Australia ' and you won't believe its X-rated name,https://www.skynews.com.au/lifestyle/trending/popular-us-food-chain-to-debut-in-australia-after-the-government-forced-it-to-change-its-original-xrated-name/news-story/2bea85c50aca7c4259607068b8b699cc
Sky News,Fitness First owner seeking buyer as it struggles with hefty debts,https://www.skynews.com.au/business/finance/fitness-first-owner-fitness-lifestyle-group-reportedly-up-for-sale-by-quadrant-pe-as-it-struggles-with-hefty-debts/news-story/a778a153661282cbd2955803ad2a2f7b
Sky News,"Controversial ""Word Of The Year' announced ' but no one knows what it means",https://www.skynews.com.au/australia-news/parasocial-takes-out-cambridge-dictionarys-word-of-the-year-but-no-one-knows-what-it-means/news-story/85a2a997f2cbc432ae071dca9f933c81
Sky News,"""Start thinking about Australians': Anthony Albanese urged to ditch climate summit obsession",https://www.skynews.com.au/australia-news/politics/david-littleproud-tells-anthony-albanese-to-just-give-up-hosting-any-climate-summit-arguing-it-distracts-from-domestic-issues/news-story/f3515d0d38a0390bc0d24fc7dfc3cba9
Sky News,Sky News host demands apology and fires back at ABC boss over Trump edit,https://www.skynews.com.au/business/media/sky-news-host-chris-kenny-fires-back-at-abc-managing-director-hugh-marks-over-four-corners-donald-trump-edits/news-story/1147e7ca53d0a15d3acc143397293c96
Sky News,"Data shows an ""Australian Mamdani' is inevitable unless conservatives radically change course",https://www.skynews.com.au/insights-and-analysis/data-shows-an-australian-zohran-mamdani-is-inevitable-unless-conservatives-in-this-country-radically-change-course/news-story/bd10b1e25990df4703294c19e2e96b39
Sky News,The ABC's own maths reveals just how hard net zero decarbonisation will be,https://www.skynews.com.au/insights-and-analysis/the-abcs-own-maths-reveals-mammoth-task-ahead-decarbonising-the-atmosphere-to-meet-2035-2050-climate-targets/news-story/11ff3e6474c19e9973698cd4bfe98de1
Sky News,New development puts Taiwan on brink of reunification with China,https://www.skynews.com.au/insights-and-analysis/why-china-might-not-need-an-invasion-to-unify-with-taiwan-as-islands-usfriendly-government-cops-domestic-backlash/news-story/8b0ee043badbb51eefbe70ad89f02c54
Sky News,"Trump scolds US reporter over Saudi questions, threatens to pull broadcast licence",https://www.skynews.com.au/world-news/united-states/donald-trump-scolds-abc-reporter-mary-bruce-over-her-questions-about-saudi-arabias-crown-prince-threatens-to-pull-broadcast-licence/news-story/cfda782d5d47d6069c3d362bc9ebd16d
Sky News,Florida man accused of murdering suicidal woman who travelled to US seeking violent death,https://www.skynews.com.au/world-news/united-states/florida-man-accused-of-murdering-suicidal-uk-woman-who-travelled-to-us-seeking-a-violent-death-reports/news-story/e2d267775d3357b5e80f50463b4394c2
Sky News,Backpacker dies at Bali hostel in grim illness outbreak,https://www.skynews.com.au/australia-news/crime/major-probe-at-budget-bali-hostel-after-dozens-hospitalised-and-one-sudden-death/news-story/8d0fbdbd2a6c333e89182bd9b0a74f2e
Sky News,House of Reps overwhelmingly votes to force Epstein document release,https://www.skynews.com.au/world-news/united-states/us-house-of-representatives-votes-overwhelmingly-to-force-doj-to-release-jeffrey-epstein-files/news-story/2c8f4f61a195fcd48f45bf108a6e563a
Sky News,Donald Trump defends Saudi leader over killing of journalist,https://www.skynews.com.au/world-news/united-states/donald-trump-defends-saudi-leader-crown-prince-mohammed-bin-salman-over-killing-of-usbased-journalist-jamal-khashoggi/news-story/434023f541805f09f86ce1d06eaa6e17
Sky News,"Notorious serial killer, rapist may have been caught due to his micropenis",https://www.skynews.com.au/world-news/united-states/californias-golden-state-killer-may-have-only-been-caught-because-of-his-micropenis-theres-nothing-there/news-story/91296721c1dc5af29a0aceacc95bd847
Sky News,"eSafety boss called to testify in US Congress over ""threat' to Americans' free speech",https://www.skynews.com.au/world-news/united-states/esafety-commissioner-julie-inman-grant-called-to-testify-before-us-congress-by-donald-trump-ally-over-threat-to-americans-free-speech/news-story/c232d406b9a58089bf94240cb3b425d3
Sky News,"""Liberal-slash-communist mayor': Trump threatens to remove FIFA World Cup fixtures from US city",https://www.skynews.com.au/world-news/united-states/donald-trump-threatens-to-remove-football-fixtures-from-us-city-led-by-communist-mayor-ahead-of-2026-fifa-world-cup/news-story/529384ef475ea73add55be2c6bcd5bf6
Sky News,"""Party-pooper': Busking hotspots created after Clover Moore ban",https://www.skynews.com.au/opinion/partypooper-busking-hotspots-created-after-clover-moore-ban/video/9669ffbb325b434ba00e86cb3b291c79
Sky News,"""Strange': Manchester bar bans solo drinkers during late hours",https://www.skynews.com.au/opinion/strange-manchester-bar-bans-solo-drinkers-during-late-hours/video/4fae946a8498ada16a8ad3dae3b7e4f0
Sky News,Power bills increase as more Australians encounter financial hardship,https://www.skynews.com.au/opinion/paul-murray/power-bills-increase-as-more-australians-encounter-financial-hardship/video/aa61d14d8cadaa947edf2b3408c96e08
Sky News,The Kenny Report | 19 November,https://www.skynews.com.au/stream/opinion-programs/the-kenny-report/the-kenny-report-19-november/video/4488762c23bb148345ab2828640974a6
Sky News,Credlin | 19 November,https://www.skynews.com.au/stream/opinion-programs/credlin/credlin-19-november/video/db9d57ef6d515dbbe50cbee4139032b0
Sky News,The Bolt Report | 19 November,https://www.skynews.com.au/stream/opinion-programs/the-bolt-report/the-bolt-report-19-november/video/183e831c3f6aa01e137777eb3df95925
Sky News,Sharri | 19 November,https://www.skynews.com.au/stream/opinion-programs/sharri/sharri-19-november/video/aa232252eaa5f171b5ad5de771c6aca0
Sky News,Paul Murray Live | 18 November,https://www.skynews.com.au/stream/opinion-programs/paul-murray-live/paul-murray-live-18-november/video/2bd6633e8e8dd80c27dd3758a93e5d0d
Sky News,The Late Debate | 18 November,https://www.skynews.com.au/stream/opinion-programs/the-late-debate/the-late-debate-18-november/video/4003f2be95a16100da223fba88653302
Sky News,The Rita Panahi Show | 19 November,https://www.skynews.com.au/stream/opinion-programs/the-rita-panahi-show/the-rita-panahi-show-19-november/video/a647ce64110cde2e59e39357307b1163
Sky News,"""The dishonesty beggars belief': Tehan hits out at Albanese govt after bombshell energy price report",https://www.skynews.com.au/australia-news/politics/the-dishonesty-beggars-belief-shadow-energy-minister-dan-tehan-hits-out-at-albanese-after-bombshell-energy-price-report/news-story/b54ff80af70dbd60b7a25f62c2a7328c
Sky News,"ABC Senate inquiry push continues, despite boss' Press Club pledge",https://www.skynews.com.au/business/media/liberal-senator-sarah-henderson-doubles-down-on-abc-senate-inquiry-push-despite-hugh-marks-press-club-pledge/news-story/a715529ccb5af967ed4521a330173f49
Sky News,Fitness First owner seeking buyer as it struggles with hefty debts,https://www.skynews.com.au/business/finance/fitness-first-owner-fitness-lifestyle-group-reportedly-up-for-sale-by-quadrant-pe-as-it-struggles-with-hefty-debts/news-story/a778a153661282cbd2955803ad2a2f7b
Sky News,"""The Simpsons' kills off longtime character ' and fans aren't happy",https://www.skynews.com.au/business/media/the-simpsons-permanently-kills-off-longtime-character-after-35-seasons-and-fans-arent-happy/news-story/fc69730e5d79a2bb63e134dbe5afbd4a
Sky News,"""Medicine could kill the patient': ANZ boss' warning on net zero",https://www.skynews.com.au/business/energy/anz-boss-nuno-matos-warns-the-medicine-could-kill-the-patient-as-debate-over-net-zero-by-2050-rages-on/news-story/9274e3b7f638d79e4421fcc27702a403
Sky News,"The $205,000 mistake Australian retirees don't know they're making",https://www.skynews.com.au/business/finance/super-consumers-australia-says-australian-retirees-could-lose-up-to-205000-if-they-pick-worstperforming-investment-options/news-story/19f7552b9c57d5f570e5b8de043dcaa4
Sky News,"""Brutal blow': Warning to Australians after top bank boss makes dire rate cut prediction",https://www.skynews.com.au/business/finance/jimflation-shadow-treasurer-ted-obrien-warns-australian-mortgage-holders-will-continue-to-pay-more-after-dire-prediction/news-story/860a1a8011718aa4fd0aceab57f649d3
Sky News,Sky News host demands apology and fires back at ABC boss over Trump edit,https://www.skynews.com.au/business/media/sky-news-host-chris-kenny-fires-back-at-abc-managing-director-hugh-marks-over-four-corners-donald-trump-edits/news-story/1147e7ca53d0a15d3acc143397293c96
Sky News,ABC boss addresses National Press Club amid concerns of bias in reporting,https://www.skynews.com.au/business/media/watch-live-abc-boss-hugh-marks-addresses-national-press-club-amid-concerns-over-public-broadcasters-bias/news-story/24c2440951f4abfe947b4d1fc63be8de
Sky News,Why Emma Memma insists there's no tension with The Wiggles,https://www.skynews.com.au/lifestyle/celebrity-life/im-really-excited-to-see-them-emma-memma-spills-on-her-current-relationship-with-former-band-the-wiggles-at-the-2025-aria-awards/news-story/5037061eade33ca1bb120fb24bf9f35c
Sky News,"ABC Senate inquiry push continues, despite boss' Press Club pledge",https://www.skynews.com.au/business/media/liberal-senator-sarah-henderson-doubles-down-on-abc-senate-inquiry-push-despite-hugh-marks-press-club-pledge/news-story/a715529ccb5af967ed4521a330173f49
Sky News,"MAFS couple Evelyn and Duncan speak out against ""bad edit' complaints",https://www.skynews.com.au/lifestyle/celebrity-life/how-it-was-portrayed-was-what-it-was-married-at-first-sight-star-duncan-james-slams-stars-complaining-about-bad-edits-during-2025-aria-awards-appearance/news-story/8684ac06ef8ead02ff53a0671f9fedf7
Sky News,How top influencer went from front row at NY Fashion Week to facing five years years in jail,https://www.skynews.com.au/lifestyle/celebrity-life/front-row-at-nyfw-a-lavish-wedding-featured-in-vogue-now-one-of-the-worlds-biggest-fashion-influencers-is-facing-five-years-jail-time/news-story/12e58660315ba87c0652af6c412721a8
Sky News,Popular US food chain to debut in Australia ' and you won't believe its X-rated name,https://www.skynews.com.au/lifestyle/trending/popular-us-food-chain-to-debut-in-australia-after-the-government-forced-it-to-change-its-original-xrated-name/news-story/2bea85c50aca7c4259607068b8b699cc
Sky News,The smartest ways to use AI to book your next holiday: experts,https://www.skynews.com.au/lifestyle/travel/the-smartest-ways-to-use-ai-to-book-your-next-holiday-according-to-experts/news-story/394724f2811e5746c599a69330b8f3e2
Sky News,Aussies beware: Most dangerous US states for solo travellers revealed,https://www.skynews.com.au/lifestyle/travel/australian-jetsetters-beware-the-most-dangerous-us-states-for-solo-travellers-revealed/news-story/726739e51f8f5741f2e4ebffaf0a28cc
Sky News,Aussie airline axes premium entry amid peak holiday season,https://www.skynews.com.au/lifestyle/travel/major-aussie-airline-axes-popular-premium-entry-service-as-peak-holiday-season-fast-approaches/news-story/8ccae334e87d4c78e785a7ae215e549a
Sky News,Today's News Headlines: NSW government cracks down on youth offenders,https://www.skynews.com.au/australia-news/todays-news-headlines-nsw-government-cracks-down-on-youth-offenders/video/8e71c89987eff4daa6207f630a13d1b1
Sky News,"""High profile' figures arrive for the state funeral of John Laws",https://www.skynews.com.au/australia-news/politics/high-profile-figures-arrive-for-the-state-funeral-of-john-laws/video/52df06a3ab67d80af1dda1341cd8347c
Sky News,ABC Managing Director pressed on BBC controversy,https://www.skynews.com.au/australia-news/abc-managing-director-pressed-on-bbc-controversy/video/d1073ef6626e4861481813151c241dcf
Sky News,"Today's News Headlines: Hughes aims at ""undermining' Liberals",https://www.skynews.com.au/australia-news/todays-news-headlines-hughes-aims-at-undermining-liberals/video/01dd4ff1c7991ea494987e5082fe4d3c
Sky News,"Sussan Ley says Australia needs to ""step on the gas' with energy",https://www.skynews.com.au/australia-news/politics/sussan-ley-says-australia-needs-to-step-on-the-gas-with-energy/video/660008efe09eabacd14a54ab309e3529
Sky News,Asbestos scare shuts dozens of schools across Australia,https://www.skynews.com.au/australia-news/asbestos-scare-shuts-dozens-of-schools-across-australia/video/eaeb7b91d93aa87c3e22fb1a334e5c6e
Sky News,"Anthony Albanese ""shamed' into ""giving up' $2 billion COP Summit bid",https://www.skynews.com.au/australia-news/politics/anthony-albanese-shamed-into-giving-up-2-billion-cop-summit-bid/video/ee74d001835506d75ae43564e337d98c
Sky News,Today's News Headlines: Trump defends Saudi Prince over Khashoggi,https://www.skynews.com.au/australia-news/todays-news-headlines-trump-defends-saudi-prince-over-khashoggi/video/02dc08d0e4e751df3e219f26c3db371d
Sky News,"Jess Wilson ""excited' about becoming Victoria's new Liberal Leader",https://www.skynews.com.au/australia-news/politics/jess-wilson-excited-about-becoming-victorias-new-liberal-leader/video/436bd7268746d2635eadd70060e218b7
