Section,Headline,Link
Guardian,Texas fracker turned escort says repression allowed business to flourish,https://www.theguardian.com/us-news/2026/mar/07/handyman-west-texas-escort-podcast
Guardian,Pakistani man convicted of plotting to kill Trump over death of Iranian commander,https://www.theguardian.com/us-news/2026/mar/07/pakistani-man-convicted-of-plotting-to-kill-trump-over-death-of-iranian-commander
Guardian,"Trump scolds Fox News reporter for question about Russia helping Iran target US troops "" as it happened",https://www.theguardian.com/us-news/live/2026/mar/06/kristi-noem-democrats-ice-donald-trump-pete-hegseth-iran-middle-east-us-politics-latest-news-updates
ABC,If 'mini supreme leader' Mojtaba Khamenei rises to power it will send a message,https://www.abc.net.au/news/2026-03-07/iran-supreme-leader-son-mojtaba-khamenei-and-war/106419508
ABC,Iran's women's football team being held 'hostage' amid calls for them to remain in Australia,https://www.abc.net.au/news/2026-03-07/iran-women-s-football-calls-for-protection-womens-asian-cup/106428380
ABC,Gulf nations are worried about what Trump will leave behind,https://www.abc.net.au/news/2026-03-07/gulf-states-pessimistic-about-what-trump-will-leave-behind/106418872
ABC,Good Samaritan killed while trying to protect boy from group assault,https://www.abc.net.au/news/2026-03-07/four-arrested-over-death-of-man-in-mernda-railway-station-fight/106427586
ABC,'I'm not a hero': Austin Appelbee reunited with rescuers who saved family,https://www.abc.net.au/news/2026-03-07/appelbee-family-thanks-rescuers-who-saved-them/106425048
ABC,Agricultural businessman to stand for One Nation in Farrer by-election,https://www.abc.net.au/news/2026-03-07/david-farley-one-nation-candidate-nsw-farrer-may-byelection/106428064
ABC,The Catholic priest who quit over celibacy rules,https://www.abc.net.au/news/2026-03-07/alberto-ravagnani-quits-catholic-ministry/106423724
ABC,Superstar Sutherland backs up record-breaking ton with key wickets,https://www.abc.net.au/news/2026-03-07/australia-vs-india-women-s-test-day-two-live-blog/106428124
ABC,Bulldogs beat the Lions in a thriller at the Gabba as Giants get revenge on Hawks,https://www.abc.net.au/news/2026-03-07/afl-opening-round-giants-hawks-lions-bulldogs-live-blog/106427374
ABC,Raiders beat Manly in dramatic golden point season opener,https://www.abc.net.au/news/2026-03-07/nrl-live-blog-sharks-titans-sea-eagles-raiders-march-7/106427024
ABC,'I'm not going to sit here and get killed': Trans lives in Trump's America,https://www.abc.net.au/news/2026-03-07/transgender-americans-donald-trump-anti-trans-safety/106251956
ABC,Embrace simplicity with baked eggplant and soy-garlic chicken mince,https://www.abc.net.au/news/2026-03-07/baked-eggplant-with-soy-garlic-chicken-mince-and-chives/106364468
ABC,Brisbane man drowns in surf on Sunshine Coast,https://www.abc.net.au/news/2026-03-07/chermside-man-drowns-at-marcoola-beach-sunshine-coast/106428288
ABC,SA Liberals to preference One Nation over ALP as Bernardi comments condemned,https://www.abc.net.au/news/2026-03-07/sa-liberals-to-preference-one-nation/106428070
ABC,Community outrage as respected senior doctor escorted from hospital,https://www.abc.net.au/news/2026-03-07/doctor-david-clancy-escorted-from-albury-hospital/106423466
ABC,"Labor on track to win Nightcliff by-election, taking NT's single Greens seat",https://www.abc.net.au/news/2026-03-07/labor-on-track-to-win-nightcliff-by-election-abc-predicts/106428180
ABC,PNG military boss issues warning over Australian rifles after high-powered guns seized,https://www.abc.net.au/news/2026-03-07/png-military-boss-warning-over-australian-rifle-delivery/106397550
ABC,China accuses Australia of 'distorting facts' about helicopters' encounter,https://www.abc.net.au/news/2026-03-06/adf-helicopter-evasive-action-chinese-military/106426388
ABC,'Most brazen acts of corruption': Obeid family loses $30m worth of property,https://www.abc.net.au/news/2026-03-07/obeid-family-lose-control-of-30m-worth-sydney-properties/106427598
ABC,Comedy course for 'cranky women' allows them to rage on stage,https://www.abc.net.au/news/2026-03-07/the-cranky-womens-club-comedy-to-tackle-serious-issues/106409120
ABC,'It's about emotion': Labor minister explains how to deradicalise young boys,https://www.abc.net.au/news/2026-03-07/anne-aly-roger-cook-radicalisation-extremism-solutions-terror/106423686
ABC,Aussie star Sutherland described as cricketer 'everyone dreams to be',https://www.abc.net.au/news/2026-03-07/cricket-australia-india-day-night-test-annabel-sutherland/106427562
ABC,Cory Bernardi stands by bestiality claim ahead of SA election,https://www.abc.net.au/news/2026-03-07/cory-bernardi-stands-by-bestiality-claim-ahead-of-sa-election/106423186
ABC,Former senior ACT public servant says risks to Indigenous staff ignored,https://www.abc.net.au/news/2026-03-06/act-public-servant-calls-for-inquiry-treatment-indigenous-staff/106420128
ABC,"Fortnightly food budgets disappear in a day, with salad packs costing $20",https://www.abc.net.au/news/2026-03-06/nt-remote-communities-residents-struggling-to-afford-food-costs/106408694
ABC,"Four years and $880m later, what did the Resilient Homes Program achieve?",https://www.abc.net.au/news/2026-03-06/lismore-flood-recovery-funding-disaster-response/106329720
ABC,"Muslims 'should not be forced to beg' for protection, Labor MP says",https://www.abc.net.au/news/2026-03-06/labor-mp-joins-calls-for-islamophobia-royal-commission-bondi/106421442
ABC,Government silent on claims Australians were on US sub that sank warship,https://www.abc.net.au/news/2026-03-05/claims-australian-soldiers-on-us-sub-iranian-warship/106421552
ABC,"Wilson croons, Taylor gets politicking and Carney visits",https://www.abc.net.au/news/2026-03-05/isis-brides-tim-wilson-angus-taylor-mark-carney-cost-of-living/106405248
ABC,"As missiles pounded Middle East, warring nations struck a delicate deal",https://www.abc.net.au/news/2026-03-05/middle-east-war-deal-could-see-stranded-passengers-get-home/106417228
ABC,Trump demands 'unconditional surrender' from Iran as Israel targets Beirut,https://www.abc.net.au/news/2026-03-07/donald-trump-says-no-iran-deal-except-unconditional-surrender-/106427078
ABC,Indonesia to ban social media for children under 16,https://www.abc.net.au/news/2026-03-07/indonesia-to-ban-social-media-for-under-16s/106427038
ABC,Satellite imagery shows strikes around Iranian school where girls were killed,https://www.abc.net.au/news/2026-03-07/verify-satellite-imagery-direct-strikes-around-minab-school/106419210
ABC,Russia makes Paralympics return amid calls for peace at opening ceremony,https://www.abc.net.au/news/2026-03-07/winter-paralympics-milano-cortina-begin-with-opening-ceremony/106427686
ABC,$100b wiped off ASX this week as war shows no signs of easing — as it happened,https://www.abc.net.au/news/2026-03-06/asx-markets-business-news-march06-2026/106422840
ABC,The hidden forces driving Trump's attack on Iran,https://www.abc.net.au/news/2026-03-06/oil-reaction-trump-attack-on-iran/106424164
ABC,One missile attack 'can erase an entire day of gains' on global markets,https://www.abc.net.au/news/2026-03-06/donald-trump-risks-global-financial-markets-middle-east-war/106419242
ABC,"Four years and $880m later, what did the Resilient Homes Program achieve?",https://www.abc.net.au/news/2026-03-06/lismore-flood-recovery-funding-disaster-response/106329720
ABC,"Mercedes flex muscle as Russell claims pole, Piastri qualifies fifth",https://www.abc.net.au/news/2026-03-07/f1-live-australian-grand-prix-qualifying/106413532
ABC,Sympathy in short supply as Lomax urged to 'live with' his NRL exit,https://www.abc.net.au/news/2026-03-07/zac-lomax-parramatta-eels-wayne-bennett/106427942
ABC,Mercedes involved in crash in practice ahead of F1 qualifying,https://www.abc.net.au/news/2026-03-07/f1-australian-grand-prix-saturday-practice-three/106413520
ABC,The unorthodox coaching gambit that helped Matildas to greatest triumph,https://www.abc.net.au/news/2026-03-07/how-the-matildas-won-the-2010-womens-asian-cup/106390122
ABC,Seasonal produce to make the most of in March,https://www.abc.net.au/news/2026-03-05/march-seasonal-fruit-and-veg/106414688
ABC,Can you ask a neighbour to cut or trim a large tree?,https://www.abc.net.au/news/2026-03-03/can-you-ask-a-neighbour-to-cut-or-trim-a-large-tree/106277180
ABC,As my destination wedding loomed I knew it would ruin our lives,https://www.abc.net.au/news/2026-03-03/i-knew-i-needed-to-call-off-my-wedding-i-just-did-not-know-why/106368494
ABC,Simple recipes to celebrate autumn and enjoy the cosy kitchen,https://www.abc.net.au/news/2026-03-02/five-of-our-best-autumn-recipes-/106392174
ABC,More than 180 authors quit writers' week. Many returned for a DIY replacement,https://www.abc.net.au/news/2026-03-07/constellations-not-writers-week-adelaide/106420422
ABC,How Melissa Lucashenko's new book Not Quite White in the Head came about,https://www.abc.net.au/news/2026-03-07/melissa-lucashenko-on-new-book-not-quite-white-in-the-head/106425310
ABC,'A shock to me': Jackie O denies quitting radio show,https://www.abc.net.au/news/2026-03-06/jackie-o-denies-quitting-kiis-show-arn-kyle-sandilands/106415494
ABC,From a hilarious novel to a stellar charity album — we have your weekend covered,https://www.abc.net.au/news/2026-03-06/what-to-watch-read-and-listen-to-this-weekend/106376416
Sky News,"World's Gone Mad: ""Brave' young Iranian women celebrate their freedom",https://www.skynews.com.au/opinion/worlds-gone-mad-brave-young-iranian-women-celebrate-their-freedom/video/59293ab2d5dbc680a6a563f701d01dc3
Sky News,"Iranian regime is possibly the ""single cruelest society' on planet Earth",https://www.skynews.com.au/opinion/iranian-regime-is-possibly-the-single-cruelest-society-on-planet-earth/video/8eb80cdc9e193940a68eedc8ceb79602
Sky News,Albanese revealed Australians were on the US submarine that sank an Iranian frigate,https://www.skynews.com.au/opinion/albanese-revealed-australians-were-on-the-us-submarine-that-sank-an-iranian-frigate/video/3e2f79877bd929c410b6ac7f67fc4720
Sky News,Trump pushes to pick the Supreme Leader's successor,https://www.skynews.com.au/opinion/trump-pushes-to-pick-the-supreme-leaders-successor/video/10754e12f3d7e95c081cd368096d9af4
Sky News,"Iranian Navy ""badly crippled' after 24 ships have been sunk",https://www.skynews.com.au/opinion/iranian-navy-badly-crippled-after-24-ships-have-been-sunk/video/f8da668773fb6a056791d997d79eb3c5
Sky News,"The left has ""conveniently forgotten' the atrocities Iranian regime has committed",https://www.skynews.com.au/opinion/the-left-has-conveniently-forgotten-the-atrocities-iranian-regime-has-committed/video/f14f079842dd9c87a24d09148e5dabdb
Sky News,"""Honoured to be with a courageous party': David Farley sets out vision after winning One Nation preselection for Farrer",https://www.skynews.com.au/australia-news/politics/one-nation-candidate-david-farley-outlines-push-for-agriculture-and-migration-reform-as-he-readies-himself-for-may-9-byelection/news-story/94cf36e8fe95e0906ee6c3b6aa99e330
Sky News,"""Unconditional surrender is unrealistic': Expert warns Trump's Iran demands will only escalate conflict",https://www.skynews.com.au/world-news/global-affairs/us-demand-for-irans-unconditional-surrender-faces-nearimpossible-obstacles-amid-escalating-middle-east-conflict/news-story/9a41f8b3f2481fe40f079ccebe723cd8
Sky News,David Farley wins One Nation candidacy for Farrer by-election,https://www.skynews.com.au/australia-news/politics/one-nation-selects-david-farley-for-nsw-farrer-byelection-as-pauline-hanson-says-albanese-fears-labor-is-on-the-downward-slope/news-story/9c637dcf1afcd0cfba087154697c1bfb
Sky News,Wife of Bondi attack victim makes desperate plea for return of his beloved possession,https://www.skynews.com.au/australia-news/wife-of-bondi-attack-victim-peter-meagher-makes-desperate-plea-for-return-of-his-beloved-possession-feared-stolen/news-story/aabef074b7132081b6ee59f616ffd7ad
Sky News,David Southwick slams Victoria government as three train lines shut over busy weekend,https://www.skynews.com.au/australia-news/politics/what-a-joke-david-southwick-slams-victoria-government-as-three-train-lines-shut-over-one-of-the-busiest-weekends-of-the-year/news-story/1a527a2c08a2fdc961e39f7b13d0422d
Sky News,Almost half of Australians back cutting tobacco tax as illicit trade explodes,https://www.skynews.com.au/australia-news/crime/almost-half-of-australians-back-cutting-tobacco-tax-in-new-poll-as-illicit-trade-explodes/news-story/3417f70f591f99f19ea895123abaf47c
Sky News,Israel launches fresh strikes on Iran,https://www.skynews.com.au/world-news/global-affairs/donald-trump-demands-irans-unconditional-surrender-as-israel-launches-new-wave-of-attacks/live-coverage/99b01c14c71824f9932d552f5f9aa4b1
Sky News,One Nation could win record Senate haul and more than 20 seats at next election,https://www.skynews.com.au/australia-news/politics/one-nations-election-hopes-revealed-in-new-sky-news-feature-on-pauline-hansons-surge-in-popularity/news-story/af0fc73dafa538cfb521fffccc9f40b7
Sky News,Young boy dead after horror motorcycle crash near Perth,https://www.skynews.com.au/australia-news/crime/young-boy-dead-after-horror-motorcycle-crash-in-waroona-south-of-perth/news-story/65c42d160b7d7ba16545f3ec2968d6e2
Sky News,"""Big problem': Major pitch to Jim Chalmers for Australia's housing crisis",https://www.skynews.com.au/business/real-estate/big-problem-major-pitch-put-forward-to-treasurer-jim-chalmers-to-solve-australias-massive-housing-crisis/news-story/7713ed0fd8628c91ec1bcfd0290ae9dd
Sky News,"""Leave quickly': Journalist warned by worshippers of mosque celebrating slain terror leader",https://www.skynews.com.au/world-news/global-affairs/you-should-leave-quickly-journalist-warned-by-worshippers-of-sydney-mosque-celebrating-slain-terror-leader-ayatollah-khamenei/news-story/462b97684593da6a4498b6f5189040dc
Sky News,"""Will not tolerate': NRL club calls out death threats towards their players following shock loss",https://www.skynews.com.au/australia-news/sport/sydney-roosters-call-out-death-threats-after-players-received-ugly-messages-after-shock-loss-to-warriors/news-story/e3f1e8128481b6c03510c6335275da50
Sky News,Decade long Kyle and Jackie O Haunted House axed from Royal Easter Show,https://www.skynews.com.au/lifestyle/celebrity-life/royal-easter-show-removes-kyle-and-jackie-o-haunter-house-after-running-for-10-years/news-story/91be631581a15ca16bac7af691418e38
Sky News,Former INXS assistant locked in $500m inheritance battle with family,https://www.skynews.com.au/australia-news/daughter-challenges-late-fathers-estate-as-nsw-supreme-court-hears-claims-of-multimilliondollar-family-payouts/news-story/248beb4805062de528dff4d98f3ff37b
Sky News,Aussies banned from Pornhub from today,https://www.skynews.com.au/breaking-news/pornhub-owner-begins-blocking-australian-users-in-protest-of-nations-new-age-verification-laws/news-story/b50d959c1c4e5ddad33da4384dd99a18
Sky News,Bowen talks up green batteries for the rich amid rapidly growing list of failed solar projects,https://www.skynews.com.au/insights-and-analysis/chris-bowen-pushes-full-steam-ahead-on-green-batteries-for-the-rich-as-household-subsidy-scheme-joins-list-of-failed-taxpayerbacked-solar-boondoggles/news-story/4a14e045f218881768e11394f2e8177f
Sky News,"ABC's veneer of impartiality cracks as ""activist' journos turn on PM, Israel ambassador in hostile coverage",https://www.skynews.com.au/insights-and-analysis/the-abcs-veneer-of-impartiality-shatters-as-activist-journalists-aggressively-crossexamine-israeli-ambassador-accuse-pm-of-propaganda-in-hostile-iran-coverage/news-story/40f4abbd8ed18fea31b09bb320df65e1
Sky News,Debunking the absurd theory Iran's unhinged dictator could have been reined in around the negotiating table,https://www.skynews.com.au/insights-and-analysis/deconstructing-the-ridiculous-theory-irans-unhinged-dictator-could-have-been-reined-in-without-the-use-of-military-force/news-story/7194de26500ac75c9fb26a83ed796948
Sky News,"""Unconditional surrender is unrealistic': Expert warns Trump's Iran demands will only escalate conflict",https://www.skynews.com.au/world-news/global-affairs/us-demand-for-irans-unconditional-surrender-faces-nearimpossible-obstacles-amid-escalating-middle-east-conflict/news-story/9a41f8b3f2481fe40f079ccebe723cd8
Sky News,Pakistani man convicted over Iranian plot to kill Donald Trump,https://www.skynews.com.au/world-news/united-states/pakistani-man-found-guilty-of-planning-to-kill-donald-trump-and-other-prominent-us-politicians/news-story/7f68fa50350655f4ccfd4604ee8994ec
Sky News,Israel launches fresh strikes on Iran,https://www.skynews.com.au/world-news/global-affairs/donald-trump-demands-irans-unconditional-surrender-as-israel-launches-new-wave-of-attacks/live-coverage/99b01c14c71824f9932d552f5f9aa4b1
Sky News,"""Leave quickly': Journalist warned by worshippers of mosque celebrating slain terror leader",https://www.skynews.com.au/world-news/global-affairs/you-should-leave-quickly-journalist-warned-by-worshippers-of-sydney-mosque-celebrating-slain-terror-leader-ayatollah-khamenei/news-story/462b97684593da6a4498b6f5189040dc
Sky News,Anthony Albanese won't direct security agencies to probe those celebrating slain terror leader,https://www.skynews.com.au/world-news/global-affairs/anthony-albanese-reveals-he-will-not-direct-security-agencies-to-investigate-those-celebrating-brutal-terrorist-leader-ali-khamenei/news-story/f95e54263d5edb66eea59eeaa18b4928
Sky News,Moment Israeli F-35 fighter jet takes down Iranian plane over Tehran,https://www.skynews.com.au/world-news/global-affairs/dramatic-footage-captures-moment-israeli-f35-fighter-jet-takes-down-iranian-plane-over-tehran/news-story/495a58dbb8525cae916554e6a3aafe19
Sky News,"Tehran eyewitness reveals life after Khamenei: ""I want them gone, even at the cost of my own life'",https://www.skynews.com.au/world-news/global-affairs/iranian-eyewitness-in-tehran-reveals-life-after-khamenei-i-want-them-gone-even-at-the-cost-of-my-own-life/news-story/40f3c6b8f1ffa46e55079c39501ed741
Sky News,How Israel killed Ayatollah Khamenei with a missile from space,https://www.skynews.com.au/world-news/global-affairs/how-israel-killed-ayatollah-khamenei-with-a-missile-from-space/news-story/a63da5a996078db29a793f31ed41f235
Sky News,"""Waste everywhere': The Australian government blasted for failure to achieve anything",https://www.skynews.com.au/opinion/waste-everywhere-the-australian-government-blasted-for-failure-to-achieve-anything/video/972f176d2754a3cc3d4fb93c57cc3121
Sky News,The tide has turned on climate change,https://www.skynews.com.au/opinion/the-tide-has-turned-on-climate-change/video/c84beb3cdd2b042b748bb81a84340fed
Sky News,"""Unnecessary risk': The government isn't taking the ISIS cohort concerns seriously enough",https://www.skynews.com.au/opinion/unnecessary-risk-the-government-isnt-taking-the-isis-cohort-concerns-seriously-enough/video/2ed6983f4b8b3239c1cc65308408b639
Sky News,The World According To Rowan Dean | 6 March,https://www.skynews.com.au/stream/opinion-programs/the-world-according-to-rowan-dean/the-world-according-to-rowan-dean-6-march/video/3b3ea5f08e6ea348de0003addabc5d92
Sky News,The Bond Report | 6 March,https://www.skynews.com.au/stream/opinion-programs/the-bond-report/the-bond-report-6-march/video/618a4eee2fd5eeed6f3c8a2a78e48258
Sky News,Steve Price | 6 March,https://www.skynews.com.au/stream/opinion-programs/steve-price/steve-price-6-march/video/5b005c6d77e0e1255b31ca9c22f5d264
Sky News,Opinionated | 6 March,https://www.skynews.com.au/stream/opinion-programs/opinionated/opinionated-6-march/video/9eef6b0bf5e77d3be52c9bd94c4c480b
Sky News,The Media Show | 6 March,https://www.skynews.com.au/stream/opinion-programs/the-media-show/the-media-show-6-march/video/f5886043003433abda97475afa08c913
Sky News,The U.S. Report | 6 March,https://www.skynews.com.au/stream/opinion-programs/the-us-report/the-us-report-6-march/video/b7b5346d7215c4c0efb8bfe50ae18051
Sky News,The Kenny Report | 5 March,https://www.skynews.com.au/stream/opinion-programs/the-kenny-report/the-kenny-report-5-march/video/c835e72b02eac99f80500d351bb05c00
Sky News,"""Big problem': Major pitch to Jim Chalmers for Australia's housing crisis",https://www.skynews.com.au/business/real-estate/big-problem-major-pitch-put-forward-to-treasurer-jim-chalmers-to-solve-australias-massive-housing-crisis/news-story/7713ed0fd8628c91ec1bcfd0290ae9dd
Sky News,Major motoring company could cut hundreds of Aussie jobs due to govt scheme,https://www.skynews.com.au/business/markets/ford-could-cut-hundreds-of-aussie-jobs-due-to-labors-new-vehicle-emissions-scheme/news-story/88f7436c88ced0a4c0ec66e574cad8b4
Sky News,Grim rate warning for price-squeezed Australians,https://www.skynews.com.au/business/finance/australian-households-warned-interest-rates-could-lift-another-two-times-this-year-as-iran-war-worsens-inflation-woes/news-story/d7cc824cd12b67c765df0b02d4f550f5
Sky News,Aussie stocks tank again in $103 billion week-long wipeout,https://www.skynews.com.au/business/markets/asx-200-tanks-again-on-friday-adding-to-107-billion-weeklong-wipeout-as-investors-are-rocked-by-middle-east-conflict/news-story/4b01e464e10f7c73b37b038f3dc2ff91
Sky News,"Chris Bowen considers scaling back ""upper-class welfare' battery subsidy scheme after massive cost blowout",https://www.skynews.com.au/business/energy/energy-minister-chris-bowen-considering-scaling-back-upperclass-welfare-home-solar-battery-subsidy-scheme-after-massive-cost-blowout/news-story/52e5a61d2c76f4787060b596e342c119
Sky News,"Former Star CEO failed in his duties as a director, Federal Court judge finds",https://www.skynews.com.au/business/finance/former-star-entertainment-group-ceo-matt-bekier-failed-in-his-duties-as-federal-court-judge-clears-majority-of-board/news-story/1cf305768dfee935c9a2a851a0f4210e
Sky News,"Santos boss sounds alarm on oil weak spot that leaves Australia ""exposed' amid Iran conflict",https://www.skynews.com.au/business/energy/santos-boss-sounds-alarm-on-oil-and-gas-weak-spot-that-leaves-australia-exposed-amid-iran-conflict/news-story/96cefcc426fe9b425c4f8ee54084323f
Sky News,"Labor Senator's swipe at ABC reporter who called PM's statement on Iran ""political propaganda'",https://www.skynews.com.au/business/media/labor-senators-brutal-swipe-at-abc-after-reporter-calls-pms-statement-on-iran-political-propaganda/news-story/2dd47666c8d66fa436cfac9414c2fdcd
Sky News,"RBA ""completely misread the economy' by cutting rates last year as GDP runs hot",https://www.skynews.com.au/business/finance/reserve-bank-of-australia-completely-misread-the-economy-by-cutting-last-year-warren-hogan-declares-as-gdp-runs-hot/news-story/e18b2171b2c3b2b9b3e3eb3ee8a5199b
Sky News,Major business blow for Meghan Markle after Netflix cuts ties with her brand,https://www.skynews.com.au/lifestyle/celebrity-life/netflix-ends-meghan-markles-as-ever-partnership-after-axing-of-show/news-story/87c75543221f30cd4bc9dd7163bf1fb7
Sky News,Decade long Kyle and Jackie O Haunted House axed from Royal Easter Show,https://www.skynews.com.au/lifestyle/celebrity-life/royal-easter-show-removes-kyle-and-jackie-o-haunter-house-after-running-for-10-years/news-story/91be631581a15ca16bac7af691418e38
Sky News,"Inside Princess Beatrice and Princess Eugenie's ""horrified' reaction to ex-Prince Andrew's arrest",https://www.skynews.com.au/lifestyle/celebrity-life/inside-princess-beatrice-and-princess-eugenies-horrified-reaction-to-exprince-andrews-arrest/news-story/f02f29322fdff20864442449db2fea08
Sky News,"""Who does this?' Boyfriend's wild spreadsheet divides the internet",https://www.skynews.com.au/lifestyle/trending/who-does-this-woman-divides-the-internet-after-revealing-boyfriends-wild-spreadsheet-on-reddit/news-story/97cd9dac0980413d55f71843599789e2
Sky News,"""I did not quit': Jackie O breaks silence on radio exit with bombshell statement",https://www.skynews.com.au/lifestyle/celebrity-life/i-did-not-quit-jackie-o-henderson-breaks-silence-on-kyle-sandilands-split-with-bombshell-statement/news-story/17507b9874ae79d340208075c9e747fb
Sky News,"Sydney surf spot among most ""relaxing' beaches in the world ' and it's not Bondi",https://www.skynews.com.au/lifestyle/travel/revealed-the-popular-surf-spot-in-sydneys-north-lauded-as-one-of-the-most-relaxing-beaches-in-the-world-and-its-not-bondi/news-story/3fee1e8de43a19599a03d96419d7cb65
Sky News,Metro outage to cause mass commuter chaos on major long weekend,https://www.skynews.com.au/australia-news/weather/major-metro-outage-to-cause-mass-commuter-chaos-across-fourday-easter-long-weekend/news-story/179cc384675c45cde1f8560119bb117c
Sky News,The tiny town with a remarkable ability to find unlucky-in-love Aussies their perfect match,https://www.skynews.com.au/lifestyle/travel/five-euros-for-a-husband-unluckyinlove-aussies-urged-to-visit-annual-matchmaking-festival-in-lisdoonvarna-ireland/news-story/7bf3d2376e02b4d42259f219343e930e
Sky News,Western Australia's Women's Hall of Fame honours 20 women in Perth,https://www.skynews.com.au/australia-news/western-australias-womens-hall-of-fame-honours-20-women-in-perth/video/e3831c1ba0cc90386f3b683c94a2c3da
Sky News,Queensland psychiatrist's suspension scrutinised by Crime and Corruption Commission,https://www.skynews.com.au/australia-news/crime/queensland-psychiatrists-suspension-scrutinised-by-crime-and-corruption-commission/video/e91b7106a91e4b85197052c62f97e5a5
Sky News,David Farley to run for One Nation in Farrer by-election,https://www.skynews.com.au/australia-news/politics/david-farley-to-run-for-one-nation-in-farrer-byelection/video/284e497a7c99a6874f6779723ba21958
