Section,Headline,Link
Guardian,"New details emerge of how Rob and Michele Singer Reiner""s bodies were found",https://www.theguardian.com/film/2025/dec/17/new-details-rob-and-michele-singer-reiner-deaths-were-discovered
Guardian,MIT grieves shooting death of renowned director of plasma science center,https://www.theguardian.com/education/2025/dec/17/mit-shooting-death-nuno-loureiro
ABC,Philippines police investigate gunmen's travel to region with violent history,https://www.abc.net.au/news/2025-12-17/philippines-officials-investigating-bondi-gunmen-travel/106153264
ABC,From the Syrian army to a brave act in Sydney: The backstory of the Bondi hero,https://www.abc.net.au/news/2025-12-17/bondi-beach-attack-hero-ahmed-hometown-in-syria-proud/106152374
ABC,Furious Frydenberg calls to ban 'incubators of hate' after Bondi attack,https://www.abc.net.au/news/2025-12-17/frydenberg-s-fury-at-bondi-attack-royal-commission-calls/106154546
ABC,Bondi shooter charged with 59 offences,https://www.abc.net.au/news/2025-12-17/nsw-bondi-shooting-naveed-akram-charged-police-terrorist-attack/106144420
ABC,Police officer shot in Bondi attack loses sight in one eye,https://www.abc.net.au/news/2025-12-17/bondi-beach-attack-injured-officer-jack-hibbert/106153520
ABC,Brother of injured Bondi volunteer feels 'betrayed',https://www.abc.net.au/news/2025-12-17/injured-bondi-volunteer-yaakov-super-identitified/106151280
ABC,NSW premier flags gun reforms and protest restrictions,https://www.abc.net.au/news/2025-12-17/nsw-parliament-recalled-for-gun-reform-over-bondi-beach-shooting/106154014
ABC,They were loved: The 15 lives taken in Bondi terror,https://www.abc.net.au/news/2025-12-16/bondi-beach-shooting-victims-tributes/106144588
ABC,"Tom Silvagni, son of AFL star, sentenced to six years' jail for rape",https://www.abc.net.au/news/2025-12-17/tom-silvagni-rape-court-sentencing/106149996
ABC,Man denied bail for 'blatant' alleged display of Nazi symbols on boat,https://www.abc.net.au/news/2025-12-17/man-refused-bail-charged-with-depicting-hitler-and-nazi-symbols/106155230
ABC,"Home buyers hit by harsh debt pursuit, inquiry finds",https://www.abc.net.au/news/2025-12-17/act-stamp-duty-home-buyer-concession-scheme-recomendations/106154636
ABC,Tim Tszyu comfortably wins on blood-soaked return to the ring,https://www.abc.net.au/news/2025-12-17/live-updates-tim-tszyu-vs-anthony-velazquez-boxing/106154982
ABC,Former Beauty and the Geek contestant's murder case adjourned,https://www.abc.net.au/news/2025-12-17/former-beauty-and-the-geek-contestant-murder-case-adjourned-sa/106152380
ABC,Ex-AFL star Marlion Pickett sentenced in 'line-ball decision',https://www.abc.net.au/news/2025-12-17/ex-afl-tigers-star-marlion-pickett-given-suspended-prison-term/106152720
ABC,The details we share about our kids online that are riskier than photos,https://www.abc.net.au/news/2025-12-17/photos-not-most-harmful-thing-we-share-about-our-kids-online/106074142
ABC,ABC Places quiz: Find your way around the world,https://www.abc.net.au/news/2025-12-17/abc-places-quiz/106149122
ABC,Father pays tribute to 'loving' teenage daughter after lookout death,https://www.abc.net.au/news/2025-12-17/father-pays-tribute-to-teenage-daughter-following-lookout-death/106153356
ABC,Greens councillor rejects 'antisemitic' newsletter claims from mayor,https://www.abc.net.au/news/2025-12-17/schrinner-accuses-greens-of-spreading-antisemitic-newsletter/106154840
ABC,Miner refuses to revive rail line from world's biggest lithium mine,https://www.abc.net.au/news/2025-12-17/lithium-train-not-viable-company-says/106154826
ABC,Noosa Council blames 'human error' for $2.3 million AI scam,https://www.abc.net.au/news/2025-12-17/noosa-council-backflip-scam-human-error/106152030
ABC,Tom's son was killed in a horror crash. Today the driver got the maximum penalty,https://www.abc.net.au/news/2025-12-17/shakira-adams-jailed-over-matthew-mcluckie-canberra-road-death/106153876
ABC,Prominent Halls Creek man faces court for alleged sly grogging,https://www.abc.net.au/news/2025-12-17/cyril-mark-yeeda-alcohol-sly-grogging-court/106149408
ABC,Deaths of rays and sharks blamed on algal bloom,https://www.abc.net.au/news/2025-12-17/rays-and-sharks-washed-up-on-sa-kangaroo-island/106153566
ABC,Cricket Australia reveals future of day-night Tests,https://www.abc.net.au/news/2025-12-17/day-night-tests-cricket-australia-future/106155236
ABC,"Trump orders Venezuela oil blockade, labelling it a 'terrorist' regime",https://www.abc.net.au/news/2025-12-17/trump-orders-blockade-of-sanctioned-oil-tankers-leaving-entering/106152674
ABC,Nick Reiner to be charged over Rob Reiner's death,https://www.abc.net.au/news/2025-12-17/nick-reiner-charged-over-rob-reiner-and-michele-deaths/106152000
ABC,Short-term spending rises despite overall budget improvement,https://www.abc.net.au/news/2025-12-17/short-term-spending-rises-despite-overall-budget-improvement/106152498
ABC,PNG community seeking support to repatriate victims of minivan crash,https://www.abc.net.au/news/2025-12-17/muckatah-crash-victims-papua-new-guinea-repatriation/106154584
ABC,Second farmer dies within a month battling bushfires in WA's south,https://www.abc.net.au/news/2025-12-17/volunteer-firefighter-farmer-killed-in-mindarabin/106154044
ABC,The best boxer in the world just retired at the peak of his powers,https://www.abc.net.au/news/2025-12-17/terence-crawford-retirement-boxing-best-in-the-world/106152704
ABC,Hope for Australia's sea lions amid more pup deaths,https://www.abc.net.au/news/2025-12-17/significant-jump-in-sea-lion-pup-deaths-on-sa-island/106000790
ABC,No beds available for women escaping family violence,https://www.abc.net.au/news/2025-12-14/hundreds-turned-away-from-broome-domestic-violence-refuge/106057354
ABC,"'Heels, a mini skirt and tank top': Warning for 'summer' hikers in Tasmania",https://www.abc.net.au/news/2025-12-14/tasmania-cradle-mountain-rescues-hiking-prep-for-summer/106028884
ABC,'We are born into that fear': Canberra's failure to fix systemic racism,https://www.abc.net.au/news/2025-12-13/aboriginal-canberrans-feel-forgotten-failure-close-the-gap/106112204
ABC,Thousands of Australians unaware they have serious lung condition,https://www.abc.net.au/news/2025-12-17/drop-in-testing-behind-underdiagnosis-of-copd-lung-foundation/106115100
ABC,Chalmers flags difficult decisions to come in next year's budget — as it happened,https://www.abc.net.au/news/2025-12-17/federal-politics-live-blog-dec-17/106151730
ABC,Budget update to show $8.4b improvement to bottom line,https://www.abc.net.au/news/2025-12-16/myefo-budget-update-show-deficit-improvement/106150778
ABC,PM under pressure to take more action on antisemitism,https://www.abc.net.au/news/2025-12-16/coalition-launches-antisemitism-taskforce-after-bondi-terror-att/106151212
ABC,Philippines police investigate gunmen's travel to region with violent history,https://www.abc.net.au/news/2025-12-17/philippines-officials-investigating-bondi-gunmen-travel/106153264
ABC,From the Syrian army to a brave act in Sydney: The backstory of the Bondi hero,https://www.abc.net.au/news/2025-12-17/bondi-beach-attack-hero-ahmed-hometown-in-syria-proud/106152374
ABC,Ukraine peace deal could be presented to Russia within days: Zelenskyy,https://www.abc.net.au/news/2025-12-17/ukraine-war-wrap-deal-could-be-presented-to-russia-in-days/106151590
ABC,US hits three more suspected drug boats in Pacific,https://www.abc.net.au/news/2025-12-16/us-strikes-on-three-vessels-in-eastern-pacific-kill-eight/106150752
ABC,"ASX falls, Westpac removes rate cut call, silver tops $US65 per ounce — as it happened",https://www.abc.net.au/news/2025-12-17/asx-markets-business-live-news-dec-17/106151834
ABC,Court win for traders seeking compensation over Sydney light rail,https://www.abc.net.au/news/2025-12-17/high-court-appeal-light-rail-class-action-result/106152520
ABC,Multiple rate hikes next year? First look across the Tasman,https://www.abc.net.au/news/2025-12-16/rba-interest-rates-what-australia-can-learn-from-new-zealand/106143194
ABC,HelloFresh and Youfoodz sued by ACCC over allegedly misleading consumers,https://www.abc.net.au/news/2025-12-16/hellofresh-and-youfoodz-sued-by-accc-for-misleading-consumers/106148656
ABC,Alex Carey praises late father after emotional maiden Ashes ton,https://www.abc.net.au/news/2025-12-17/ashes-live-adelaide-oval-third-test-australia-england/106151318
ABC,Five quick hits: Umpire questions DRS tech as Khawaja aces comeback Test,https://www.abc.net.au/news/2025-12-17/ashes-adelaide-oval-day-one-quick-hits-alex-carey-snicko/106152316
ABC,Police presence increased at Adelaide Oval Ashes Test in wake of Bondi shooting,https://www.abc.net.au/news/2025-12-17/increased-police-powers-begin-at-adelaide-oval-following-bondi/106152410
ABC,CA explains Smith's shock withdrawal as Khawaja gets Test lifeline,https://www.abc.net.au/news/2025-12-17/ashes-2025-steve-smith-unwell-as-usman-khawaja-comes-into-team/106152450
ABC,"Laura was uncertain about whether to adopt a cat, until she met Giles",https://www.abc.net.au/news/2025-12-16/deciding-to-get-a-pet-when-i-did-not-think-i-could/105985508
ABC,Psychologists on talking to kids about the Bondi beach shooting,https://www.abc.net.au/news/2025-12-15/talking-to-kids-about-bondi-shooting-terror-attack/106143526
ABC,"Punchy, bright and crunchy: Here are seven salads for summer",https://www.abc.net.au/news/2025-12-15/best-easy-summer-salads/106090760
ABC,Plan Christmas with our 10 essential recipes,https://www.abc.net.au/news/2025-12-12/easy-christmas-recipes-mains-desserts/105721782
ABC,Rob Reiner's classic films and the lines that have endured,https://www.abc.net.au/news/2025-12-16/rob-reiner-classic-films-and-the-lines-that-have-endured/106149700
ABC,Jane Austen would have turned 250 today. Here's why she is still relevant,https://www.abc.net.au/news/2025-12-16/this-day-in-history-jane-austen-250th-birthday/106143026
ABC,We keep giving each other books at Christmas we may never read,https://www.abc.net.au/news/science/2025-12-17/book-christmas-gifts-presents-never-read-reading-rates/106098940
ABC,Bendigo Writers Festival debacle continues as sponsor is asked to apologise,https://www.abc.net.au/news/2025-12-16/bendigo-writers-festival-la-trobe-apology-call/106142986
Sky News,Sydney community mourns Bondi Beach attack victims,https://www.skynews.com.au/opinion/sydney-community-mourns-bondi-beach-attack-victims/video/0ad172f3dc2c1ef43920e16f45724ddb
Sky News,"""Not up to the job': Albanese ""playing the politics' of antisemitism",https://www.skynews.com.au/opinion/peta-credlin/not-up-to-the-job-albanese-playing-the-politics-of-antisemitism/video/2097983755f356852008b60ab35df0a8
Sky News,"""Finished': Albanese's reputation destroyed after failing to attend Bondi massacre funerals",https://www.skynews.com.au/opinion/andrew-bolt/finished-albaneses-reputation-destroyed-after-failing-to-attend-bondi-massacre-funerals/video/009920e3c23c8120210beb4b62ff7790
Sky News,"Albanese refuses to address alleged ""Islamic violent extremism' in aftermath of Bondi attack",https://www.skynews.com.au/opinion/sharri-markson/albanese-refuses-to-address-alleged-islamic-violent-extremism-in-aftermath-of-bondi-attack/video/1de786473f06e27fa7c746accc77cb17
Sky News,"""Until you stand here': Josh Frydenberg's intense Bondi speech lauded",https://www.skynews.com.au/opinion/paul-murray/until-you-stand-here-josh-frydenbergs-intense-bondi-speech-lauded/video/3b9be88faa76c6ce76274deaf22dad5a
Sky News,"""Deceptive and inflammatory': Trump sues BBC for $5 billion over edited speech",https://www.skynews.com.au/opinion/rita-panahi/deceptive-and-inflammatory-trump-sues-bbc-for-5-billion-over-edited-speech/video/df2ea0c058baaa19534413dfb6836574
Sky News,The 10 questions Tony Burke refuses to answer amid calls for his resignation,https://www.skynews.com.au/australia-news/politics/home-affairs-minister-tony-burke-dodges-series-of-questions-from-sky-news-as-australian-jewish-anger-grows/news-story/c5f1b63d8d654f7dbff8bcfa01de5c19
Sky News,Bondi terror suspect Naveed Akram charged after massacre that killed 15,https://www.skynews.com.au/australia-news/crime/bondi-beach-terrorism-suspect-naveed-akram-charged-by-police-after-massacre-that-killed-15-innocent-victims/news-story/9664dc38af3979f387d395c05d38b3f6
Sky News,Pressure builds on Albanese government to respond to antisemitic failures,https://www.skynews.com.au/australia-news/crime/bondi-shooters-isisstyle-propaganda-video-featuring-pair-posing-with-weapons-seized-by-police-after-raid/news-story/72347372a210b3da9246f98531582f6a
Sky News,"Albanese ""failed my daughter': Parents of 10-year-old alleged Bondi terror attack victim speak out",https://www.skynews.com.au/australia-news/crime/albanese-government-failed-my-daughter-parents-of-10yearold-matilda-killed-in-bondi-attack-speak-out/news-story/1b65724fc64f682c49bf2533819a8634
Sky News,New Year's Eve fireworks event cancelled after alleged Bondi Beach terror attack,https://www.skynews.com.au/lifestyle/arts-and-culture/new-years-eve-fireworks-event-cancelled-after-alleged-bondi-beach-terror-attack/news-story/13bf42c2bdaee9e2c88442c09bd39327
Sky News,"Laura Tingle ""ought to be ashamed' after claiming the actions of the alleged Bondi terrorists had ""nothing to do with religion'",https://www.skynews.com.au/australia-news/politics/abc-journalist-laura-tingle-ought-to-be-ashamed-after-claiming-the-actions-of-the-alleged-bondi-terrorists-had-nothing-to-do-with-religion/news-story/cc3904852c5e70083a3774510b527b14
Sky News,NSW Premier flags major protest reforms in wake of Bondi Beach massacre,https://www.skynews.com.au/australia-news/politics/nsw-premier-chris-minns-makes-startling-admission-about-police-presence-ahead-of-bondi-attack-reveals-just-two-officers-on-duty/live-coverage/57bd581d54c94107e123a390bf356366
Sky News,"""Why wasn't he there?': Minister grilled after PM no show at Bondi funeral",https://www.skynews.com.au/australia-news/politics/why-wasnt-he-there-matt-thistlewaite-grilled-after-anthony-albanese-no-showed-at-eli-schlangers-funeral/news-story/8b44d5f2091bdbc276d3e68535091205
Sky News,"Public outrage over PM's ""garden party' with Jewish leaders after failures on antisemitism",https://www.skynews.com.au/australia-news/politics/pundits-public-take-aim-at-pms-meeting-with-jewish-leaders-at-the-ggs-admiralty-house-after-brief-visit-to-bondi-memorial/news-story/adb5f71271679663a57cb2dc5b25596a
Sky News,"National Curriculum creating generation of ""chronically anxious' kids",https://www.skynews.com.au/australia-news/politics/australia-risks-creating-a-generation-of-chronically-anxious-kids-unless-changes-are-made-to-the-national-curriculum-report-warns/news-story/923735cc2b9e9c7df749fa25146a9e22
Sky News,"""Very surprising': Major Aussie retailer makes shock store closures amid Christmas rush",https://www.skynews.com.au/business/markets/major-aussie-retailer-makes-shock-closure-of-two-nsw-stores-amid-christmas-rush/news-story/ccaed2b0756a3b13f6eb222b5936a095
Sky News,Failed government-backed recycling company secures new buyer,https://www.skynews.com.au/business/tech-and-innovation/rino-recycling-failed-business-which-received-75m-from-clean-energy-finance-corporation-secures-new-brisbane-buyer/news-story/29347f95f323cc49ab0d0220fb711f98
Sky News,"""He would be booed': The real reason Anthony Albanese won't attend public vigils at Bondi Beach",https://www.skynews.com.au/australia-news/politics/he-would-be-booed-the-real-reason-anthony-albanese-wont-attend-public-vigils-at-bondi-beach/news-story/e61ac5d66a03a28d253e5a550217a942
Sky News,Major update on fresh-faced officer shot in Bondi,https://www.skynews.com.au/australia-news/crime/major-update-on-freshfaced-officer-jack-hibbert-shot-in-bondi-beach-attack/news-story/45f0282ce3a5d0768e0087d931293b7f
Sky News,Frydenberg to make return to politics after impassioned speech on antisemitism,https://www.skynews.com.au/australia-news/politics/former-treasurer-josh-frydenberg-to-make-return-to-politics-after-impassioned-speech-on-antisemitism-at-bondi-beach/news-story/4c277df1b68e84b4bb2922c3be285009
Sky News,"Stop indoctrination, enforce laws: The concrete actions that can prevent repeat of Bondi tragedy",https://www.skynews.com.au/insights-and-analysis/stop-the-indoctrination-of-kids-enforce-your-laws-australia-has-two-options-to-stop-spread-of-festering-hatred-after-horrors-of-bondi-beach-alleged-terror-attack/news-story/86311ca2cfc5201a5f5b1b8e5f0a4be6
Sky News,Meghan's dad makes sobering claim that blows apart the villain narrative against him,https://www.skynews.com.au/insights-and-analysis/its-her-duty-to-see-him-meghan-markle-choosing-to-punish-father-thomas-for-mistake-seven-years-ago-says-more-about-her-than-him/news-story/e5243a50ecaaf2ae1f53245f6c642320
Sky News,Greens have gall to preach compassion at Bondi after two years of peddling racial division,https://www.skynews.com.au/insights-and-analysis/mehreen-faruqi-has-gall-to-mourn-at-the-site-of-australias-worst-ever-antisemitic-terror-attack-after-greens-spent-two-years-vilifying-israel-for-their-own-means/news-story/57671139d1b62e35bacc61760e3de947
Sky News,FBI did not believe it had probable cause to raid Mar-a-Lago: bombshell files,https://www.skynews.com.au/world-news/united-states/fbi-did-not-believe-it-had-probable-cause-to-raid-donald-trumps-maralago-for-classified-documents-bombshell-files-show/news-story/e5ed7c67ea91e889a23867291254feb5
Sky News,Mother of two's naked body found inside a freezer at discount store,https://www.skynews.com.au/world-news/united-states/mother-of-twos-naked-body-found-inside-a-freezer-at-discount-store-dollar-tree-in-miami-florida/news-story/df452dd0e90b9767731a2622b7d71fa3
Sky News,"Trump stands by chief of staff after bombshell interviews ' admits he has ""alcoholic's personality'",https://www.skynews.com.au/world-news/united-states/donald-trump-stands-by-chief-of-staff-susie-wiles-after-bombshell-vanity-fair-interviews-admits-he-has-alcoholics-personality/news-story/846200dc4606a05b77533a6611f292d0
Sky News,"US senator blasts ""weak' Albanese for putting Jews ""at risk'",https://www.skynews.com.au/world-news/united-states/pathetically-weak-us-senator-lindsey-graham-turns-fire-on-australian-leadership-following-bondi-massacre/news-story/cc7eed52f26ee2be8a13fe04671dac34
Sky News,Bermuda Triangle hiding mysterious structure unlike anything else on Earth: scientists,https://www.skynews.com.au/world-news/global-affairs/bermuda-triangle-waters-are-hiding-a-mysterious-giant-structure-thats-unlike-anything-else-on-earth-scientists/news-story/186e4c597b5203b7a39a58eae4cdfdf6
Sky News,Trump-style law-and-order conservative clinches Chile's presidency,https://www.skynews.com.au/world-news/global-affairs/donald-trumpstyle-conservative-jos-antonio-kast-clinches-chiles-presidency-as-violent-crime-crisis-reshapes-nation/news-story/6582915c803a189c8ca5f1e142c05237
Sky News,"Far-left extremists ""who planned New Year's Eve terror attack also wanted to take out ICE agents'",https://www.skynews.com.au/world-news/united-states/farleft-extremists-who-allegedly-planned-los-angeles-new-years-eve-terror-attack-also-wanted-to-take-out-ice-agents/news-story/ab50007d972860f2b51e472430ce0c08
Sky News,"Erika Kirk says all livestreams ""on hold' until after private Candace Owens meeting",https://www.skynews.com.au/world-news/united-states/erika-kirk-agrees-to-private-discussion-with-candace-owens-amid-rising-tensions-in-the-wake-of-her-husband-charlies-death/news-story/88df3240ae42aa47ff3822f1d26cab0e
Sky News,"""Absolutely despicable': Sarah Ferguson blasted for ""offensive' question to Josh Frydenberg",https://www.skynews.com.au/opinion/paul-murray/absolutely-despicable-sarah-ferguson-blasted-for-offensive-question-to-josh-frydenberg/video/a3f585b86adef3c2680cf8a6dcfdf690
Sky News,Jewish bakery shuts down after Bondi attack,https://www.skynews.com.au/opinion/sharri-markson/jewish-bakery-shuts-down-after-bondi-attack/video/0f6077d4fd880c6f37f962fff7c5c1ce
Sky News,"""Extraordinary claim': ABC under scrutiny over Bondi Beach shooting analysis",https://www.skynews.com.au/opinion/extraordinary-claim-abc-under-scrutiny-over-bondi-beach-shooting-analysis/video/f133706c0680e9f7b1d0f6997410327b
Sky News,The Kenny Report | 17 December,https://www.skynews.com.au/stream/opinion-programs/the-kenny-report/the-kenny-report-17-december/video/9cdc38481a99b7b6c3a568ffc8c66237
Sky News,Credlin | 17 December,https://www.skynews.com.au/stream/opinion-programs/credlin/credlin-17-december/video/43c50f6b2fb655d59118e7aa4bc3365e
Sky News,The Bolt Report | 17 December,https://www.skynews.com.au/stream/opinion-programs/the-bolt-report/the-bolt-report-17-december/video/b34986ddfb63a167b0946d0683287de1
Sky News,Sharri | 17 December,https://www.skynews.com.au/stream/opinion-programs/sharri/sharri-17-december/video/7522f685046cf1b8350ce39ba9ca035f
Sky News,Paul Murray Live | 16 December,https://www.skynews.com.au/stream/opinion-programs/paul-murray-live/paul-murray-live-16-december/video/75d328788f0cc9cd3f22455413754201
Sky News,The Late Debate | 16 December,https://www.skynews.com.au/stream/opinion-programs/the-late-debate/the-late-debate-16-december/video/5afde46555ce2457bbca011c822a2b13
Sky News,The Rita Panahi Show | 17 December,https://www.skynews.com.au/stream/opinion-programs/the-rita-panahi-show/the-rita-panahi-show-17-december/video/ddfcca16ca7916330f282ff19e3422ee
Sky News,"""Very surprising': Major Aussie retailer makes shock store closures amid Christmas rush",https://www.skynews.com.au/business/markets/major-aussie-retailer-makes-shock-closure-of-two-nsw-stores-amid-christmas-rush/news-story/ccaed2b0756a3b13f6eb222b5936a095
Sky News,Failed government-backed recycling company secures new buyer,https://www.skynews.com.au/business/tech-and-innovation/rino-recycling-failed-business-which-received-75m-from-clean-energy-finance-corporation-secures-new-brisbane-buyer/news-story/29347f95f323cc49ab0d0220fb711f98
Sky News,Bermuda Triangle hiding mysterious structure unlike anything else on Earth: scientists,https://www.skynews.com.au/world-news/global-affairs/bermuda-triangle-waters-are-hiding-a-mysterious-giant-structure-thats-unlike-anything-else-on-earth-scientists/news-story/186e4c597b5203b7a39a58eae4cdfdf6
Sky News,Two major banks now tipping February rate hike,https://www.skynews.com.au/business/finance/commonwealth-bank-of-australia-nab-now-tipping-rba-to-hike-cash-rate-025-per-cent-in-february/news-story/d561e6f65280935922374c755c049a54
Sky News,NSW government flags support for small businesses in Bondi,https://www.skynews.com.au/business/finance/nsw-government-flags-support-for-small-businesses-in-bondi/news-story/068046e1cd1c3ee7a01d6a6abd274c0d
Sky News,"""Please stop': Moment daughter of Holocaust survivor shot in Bondi turns on ABC interviewers",https://www.skynews.com.au/business/media/daughter-of-holocaust-survivor-shot-in-bondi-terror-attack-blasts-abc-for-bias-reporting-in-frosty-interview-with-public-broadcaster/news-story/9a7e7fb5786691ed1f61d9192a861a43
Sky News,Financially crippling move one in four Aussies are making,https://www.skynews.com.au/business/finance/at-least-one-in-four-aussies-unable-to-repay-credit-card-debt-over-past-three-years-fresh-finder-research-reveals/news-story/694a8bf8159c65fe96f92ca47397325a
Sky News,"International media praises ""bloody legend' who tackled Bondi shooter",https://www.skynews.com.au/business/media/international-media-praises-bloody-legend-ahmed-al-ahmed-who-tackled-bondi-beach-shooter-sjid-akram-during-massacre/news-story/23ca13f06c87a2edcf44e4953bcf9172
Sky News,Explosion in AI-fuelled cyber crime sparks warning to Australian businesses,https://www.skynews.com.au/business/tech-and-innovation/cyber-expert-issues-warning-to-australian-businesses-as-fortiguard-labs-report-reveals-explosion-in-automated-cyberattacks/news-story/ece0ada4c9efe547074096f805b5e35c
Sky News,New Year's Eve fireworks event cancelled after alleged Bondi Beach terror attack,https://www.skynews.com.au/lifestyle/arts-and-culture/new-years-eve-fireworks-event-cancelled-after-alleged-bondi-beach-terror-attack/news-story/13bf42c2bdaee9e2c88442c09bd39327
Sky News,Channel Nine slammed over on-air snub during emotional Bondi lifeguard interview,https://www.skynews.com.au/lifestyle/trending/shame-on-channel-nine-a-current-affair-slammed-for-abruptly-cutting-off-bondi-lifeguard-honouring-heroes-of-the-attack/news-story/620b8325d6b0ac611dd1b8b675681b75
Sky News,Celebrity chef's Jewish bakery closing after two years of antisemitic harassment,https://www.skynews.com.au/lifestyle/trending/ed-halmagyis-sydneybased-jewish-bakery-avners-shutting-down-after-two-years-of-near-constant-antisemitic-harassment/news-story/68b498e0cc9ba3b9e4dda54f85257d22
Sky News,Prince Harry and William suffer fresh heartbreak as beloved childhood friend dies,https://www.skynews.com.au/lifestyle/celebrity-life/we-are-devastated-prince-harry-and-williams-fresh-heartbreak-as-exnanny-tiggy-leggebourkes-mother-dies-aged-82/news-story/789783b4a89850929162b2e41afb4def
Sky News,"York sisters make telling move in midst of new ""family dilemma'",https://www.skynews.com.au/lifestyle/celebrity-life/pulled-in-different-directions-princesses-beatrice-and-eugenie-attend-king-charles-iiis-christmas-lunch-without-disgraced-parents-amid-new-family-dilemma/news-story/6795b4ab745c0eff77920346e0a76af2
Sky News,"Luxe resort is offers menopause holidays with pelvic floor yoga, ""symptom bingo'",https://www.skynews.com.au/lifestyle/travel/arizona-luxe-resort-offers-menopause-holidays-with-pelvic-floor-yoga-and-symptom-bingo/news-story/d12d39fb40a05e861645691dc391c446
