Section,Headline,Link
9 News,Watch livePremier Jacinta Allan addresses the media in Melbourne,https://www.9news.com.au/videos/watch-live/premier-jacinta-allan-addresses-the-media-in-melbourne/cl920gdll000v0jquqs98ss81
9 News,"Donald Trump flips off, appears to swear at heckler",https://www.9news.com.au/world/donald-trump-swears-at-factory-worker-middle-finger-flips-off-usa-news-latest-updates-jeffrey-epstein/8a1834f9-8569-4409-ba1a-6add1e173f23
9 News,How your job influences how much alcohol you drinkan hour ago,https://www.9news.com.au/national/work-habits-linked-to-dangerous-drinking-levels/94fdff7e-e1de-487b-ad67-bd1bb002249b
9 News,It looks like a normal tree house but it's hiding a wild feature,https://www.domain.com.au/news/it-looks-like-a-normal-treehouse-but-its-hiding-a-wild-feature-1472485/?utm_source=9news.com.au&utm_medium=referral&utm_campaign=editorial-homepage-driver
9 News,Exclusive'Incomprehensible': Tragic triple blow after Mandy's home destroyed in bushfire,https://www.9news.com.au/national/mandy-dashwood-lost-home-in-harcourt-bushfire-after-losing-mum-and-battling-breast-cancer/3c4e98ca-cb08-44ac-aa1d-01cc78759f51
9 News,Clintons to face contempt proceedings after refusing Epstein investigation subpoenas,https://www.9news.com.au/world/bill-clinton-hillary-clinton-jeffrey-epstein-case-subpoena-contempt-congress-james-comer/de96914d-8d54-4e07-a3cf-13aeb8384b41
9 News,breakingTom Silvagni files appeal against rape convictions2 hours ago,https://www.9news.com.au/national/tom-silvagni-lodges-appeal-against-rape-conviction/7e7883b2-8d82-4fa2-9ab4-41b6bec87178
9 News,RBA governor takes stand against Donald Trumpan hour ago,https://www.9news.com.au/world/donald-trump-jerome-powell-feud-rba-chair-michele-bullock-expresses-full-solidarity-with-fed-chair-after-trump-escalates-feud/5390890e-e66e-4ca4-bd60-c5b19ea4fab2
9 News,'Number one target': AFP boss speaks on Iraqi arrest of alleged kingpin44 minutes ago,https://www.9news.com.au/national/kazem-hamad-alleged-underworld-kingpin-reportedly-arrested-in-iraq/15025f82-b5ce-47e6-9d24-bdb961fa53a6
9 News,Sydney prayer hall linked to radical preacher permanently shuts downan hour ago,https://www.9news.com.au/national/sydney-al-madina-dawah-centre-linked-to-radical-preacher-wissam-haddad-permanently-shuts-down/9c9a270a-cd40-4485-bb71-962d55ee7fbc
9 News,Author launches defamation proceedings against SA premieran hour ago,https://www.9news.com.au/national/randa-abdel-fattah-issues-defamation-concerns-notice-against-sa-premier-peter-malinauskas/236c6923-4afb-4c90-a9ab-bfcef689c61e
9 News,Man charged with making several death threats to federal politicianan hour ago,https://www.9news.com.au/national/western-sydney-man-death-threats-federal-politician/ee1d063c-eece-4a6d-bb8e-4cce14723b45
9 News,West Wing actor surrenders to police over child sex abuse allegations2 hours ago,https://www.9news.com.au/world/usa-timothy-busfield-surrenders-to-police-over-child-sex-abuse-allegations/87de4f0e-293f-4752-a907-1c4490c6808f
9 News,Prosecutors seek death penalty for former South Korea president2 hours ago,https://www.9news.com.au/world/south-korea-former-president-yoon-suk-yeol-prosecutors-seek-death-penalty-over-alleged-insurrection/49f4571a-f823-4d51-8a73-1a1e3f85001c
9 News,Sydney driver allegedly makes Nazi salute before road rage assault,https://www.9news.com.au/national/sydney-man-nazi-salute-road-rage-assault/d19f2786-750c-491b-8dab-2ed841f4f5b8
9 News,Bondi footbridge's future in the air as council meets after mass shooting,https://www.9news.com.au/national/bondi-beach-terror-attack-footbridge-used-by-gunmen-to-be-debated-by-council/aab0d8b2-df57-4664-bcbb-b775a8b4fe2e
9 News,'Great fear' for Queensland even as rain eases after major floods,https://www.9news.com.au/national/queensland-floods-update-threat-remains-despite-rain-easing/9f5b71ed-0d41-42de-817b-6521e4fe37db
9 News,Expat Jess wants to change her gender and name in the UK. It could cost her $5k,https://www.9news.com.au/national/uk-passport-trans-woman-jessica-gender-not-recognised-on-british-passport/fc8f22bf-2518-444c-95d2-b5f0c4e2c068
9 News,Protest death toll surges past 2000,https://www.9news.com.au/world/death-toll-from-iranian-protests-surpasses-2000-activists-say-as-chaos-recalls-1979-revolution/be25bf4b-fbcb-4c8e-a458-c49ee998f22c
9 News,"Two charged over string of ram raids, ATM thefts in Victoria",https://www.9news.com.au/national/two-charged-victoria-atm-ram-raids/039e6b8a-b36a-489e-95dd-0e2f59b0d529
9 News,It looks like a normal tree house but it's hiding a wild feature,https://www.domain.com.au/news/it-looks-like-a-normal-treehouse-but-its-hiding-a-wild-feature-1472485/?utm_source=9news.com.au&utm_medium=referral&utm_campaign=editorial-homepage-driver
9 News,Exclusive'Incomprehensible': Tragic triple blow after Mandy's home destroyed in bushfire,https://www.9news.com.au/national/mandy-dashwood-lost-home-in-harcourt-bushfire-after-losing-mum-and-battling-breast-cancer/3c4e98ca-cb08-44ac-aa1d-01cc78759f51
9 News,Clintons to face contempt proceedings after refusing Epstein investigation subpoenas,https://www.9news.com.au/world/bill-clinton-hillary-clinton-jeffrey-epstein-case-subpoena-contempt-congress-james-comer/de96914d-8d54-4e07-a3cf-13aeb8384b41
9 News,TODAY IN HISTORYTV host's on-air prank on chimpanzee rival backfires,https://www.9news.com.au/world/today-in-history-january-14-what-happened-on-this-day/af405674-cfb3-4341-8a95-c8b924838301
9 News,Should Australia be calling Trump out over Greenland threats?,https://www.9news.com.au/world/should-australia-be-calling-donald-trump-out-over-greenland-threats/7925b22b-f85c-4814-b30f-c97e81effdd5
9 News,How a collapsing currency led to the deaths of hundreds and may topple a nation,https://www.9news.com.au/world/iran-protests-currency-timeline-everything-to-know-explainer/806bc084-6b24-418e-ae63-5ceae92d78c4
9 News,Your nationwide guide to the Australia Day long weekend,https://www.9news.com.au/national/australia-day-2026-public-holiday-weather-double-demerits-explainer/fe736e92-fdac-4ab0-b16c-870505d78a0b
9 News,Kokkinakis withdraws from Adelaide International hours before match24 minutes ago,https://www.nine.com.au/sport/tennis/news-2026-thanasi-kokkinakis-withdraws-adelaide-international-injury-australian-open-20260114-p5ntzl.html
9 News,"Simple step netted home owners an extra $100,000",https://www.domain.com.au/news/how-sellers-are-leaning-on-vendor-advocates-to-boost-their-sale-price-and-eliminate-stress-1472043/?utm_source=9news.com.au&utm_medium=referral&utm_campaign=editorial-homepage-driver
9 News,Which of these images is made by AI? New data reveals most Aussies can't tell,https://www.9news.com.au/national/commbank-research-most-australians-are-unable-to-spot-ai-generated-scams/11d952b9-0a57-454d-9b06-c29da34316f8
9 News,a current affairSerial babysitter killer caught looking after kids again,https://9now.nine.com.au/a-current-affair/helen-moore-convicted-serial-babysitter-killer-caught-looking-after-children-again-in-nsw/59592b3e-bc43-4011-a99c-48ccf8911772
9 News,SA Police scour bushland in case of missing mum,https://www.9news.com.au/national/south-australia-police-scour-bushland-in-search-for-missing-mum-trisha-graf/5d93ccdc-1560-4326-8226-891411922eb9
9 News,"Dog killed, pedestrian hurt while crossing road in NSW",https://www.9news.com.au/national/dog-killed-owner-injured-crossing-road-in-nelson-bay-nsw/9a4c2801-ffb7-4c47-889e-a81644b1ec00
9 News,Acclaimed Australian author faces court on alleged child exploitation offences,https://www.9news.com.au/national/craig-silvey--acclaimed-australian-childrens-author-faces-court-on-child-exploitation-offences/32140e02-89e0-4679-9111-9129b60f4ea6
9 News,Man caught up in Bondi bomb scare apologises,https://www.9news.com.au/national/victorian-man-apologises-following-bondi-bomb-scare/694f0276-067f-44ee-9d7d-2a282e765208
9 News,Commotion in court as man accused of attacking  imam denied bail,https://www.9news.com.au/national/commotion-in-court-as-accused-imam-attacker-denied-bail/9936aea5-da3f-4168-a071-245947b80034
9 News,A Current AffairNew troubles for brothers Jamie and Dennis McIntyre,https://9now.nine.com.au/a-current-affair/new-troubles-for-brothers-jamie-and-dennis-mcintyre/2fa3d315-28d7-4ac6-94c9-1022a3dd91a3
9 News,Woman sentenced for slamming cream crepe into face of chief minister,https://www.9news.com.au/national/suzanne-lee-milgate-court-updates-woman-sentenced-for-crepe-attack-on-former-northern-territory-chief-minister-natasha-fyles/7ce35857-7336-45e4-89b3-49caa6326148
9 News,Should Australia be calling Trump out over Greenland threats?,https://www.9news.com.au/world/should-australia-be-calling-donald-trump-out-over-greenland-threats/7925b22b-f85c-4814-b30f-c97e81effdd5
9 News,'Help is on its way': Trump urges Iranians to keep protesting,https://www.9news.com.au/world/iran-protests-donald-trump-urges-iranians-to-keep-protesting-says-help-is-on-its-way/4db46743-931d-4828-a9f2-269df80c7e87
9 News,Greenland official calls US plans 'unfathomable',https://www.9news.com.au/world/greenland-official-calls-it-unfathomable-that-the-us-is-considering-taking-over-the-island/f051d594-8ed2-4181-ae5d-4829675c0faf
9 News,Bill and Hillary Clinton refuse to testify in Epstein probe,https://www.9news.com.au/world/epstein-probe-bill-clinton-hillary-clinton-refuse-to-testify/9742f931-8b71-4480-86f3-1e5dd23fe2af
9 News,People inside Iran describe damage in first calls to outside world,https://www.9news.com.au/world/iran-protests-people-describe-heavy-security-scattered-damage-in-first-calls-to-outside-world/989bcfd8-fc56-47ce-8770-f48d650b8249
9 News,'Two dog sleds': Trump mocks Greenland's defence system,https://www.9news.com.au/world/donald-trump-renews-push-to-take-greenland-in-air-force-one-comments/3c6ad8f7-7564-44fe-8ada-af74f91c48a2
9 News,Broad hits out at England drinking allegations,https://www.nine.com.au/sport/cricket/news-2026-ashes-stuart-broad-drinking-culture-england-day-night-test-mcg-joe-root-ben-duckett/8baa0ee0-9240-4a00-8bcc-27d924fed9ca
9 News,Piastri urged to push back against McLaren team orders,https://www.nine.com.au/sport/motorsport/f1-news-2026-oscar-piastri--push-back-against-mclaren-damon-hill-says-lando-norris-championship-aussie/79b44e80-73d7-47ea-92c8-e14472a62b54
9 News,'A brand new era': Bears unveil logo that's eerily familiar,https://www.nine.com.au/sport/nrl/news-2025-perth-bears-logo-mal-meninga-james-bracey-comments-reaction-north-sydney/f523cbd6-7b36-4bfd-990a-34f44ec57281
9 News,Captain lauds 'fantastic' City signing after another goal,https://www.nine.com.au/sport/football/efl-cup-2025-antoine-semenyo-scores-manchester-city-beats-newcastle/a8bb9f03-dc4e-4ef9-a3c8-4e761dd817f4
9 News,Final piece of Neale's puzzle awaits in 'fairytale' move,https://www.nine.com.au/sport/afl/news-2026-lachie-neale-brisbane-lions-fremantle-dockers-trade-cameron-mooney-drama-split-wife-jules/d46982e0-c70b-4aed-b93d-18e660d1c483
9 News,Olympian to take on Enhanced Games without drugs,https://www.nine.com.au/sport/news/2026-reece-prescod-enhanced-games-debut-drug-free/1e8d61e4-ce0f-4790-b87e-9bf6df6a89d2
9 News,Smith makes huge call on wild PGA Tour ultimatum,https://www.nine.com.au/sport/golf/news-2026-cameron-smith-pga-tour-liv-ultimatum-brooks-koepka-australian-penalty/52a1ce5a-a4bd-4363-860d-8cb248129fce
9 News,Surprise pick crowned Australia's number one Christmas song,https://9now.nine.com.au/today/surprise-christmas-song-tops-today-show-poll/9ad476cc-917e-45e5-9bdf-edb687bd7daa
9 News,First look at Christopher Nolan's The Odyssey,https://9now.nine.com.au/today/the-odyssey-christopher-nolan-film-first-look-entertainment-news-on-december-23/ebcfb14c-a6db-443b-b14d-98fb4ea3b0ae
9 News,Crowded House to perform at action-packed Australian Open,https://9now.nine.com.au/today/crowded-house-to-perform-australian-open-other-entertainment-news-december-22/bdfd61f4-f211-4a45-868f-4ceb07eca37c
9 News,New troubles for brothers Jamie and Dennis McIntyre,https://9now.nine.com.au/a-current-affair/new-troubles-for-brothers-jamie-and-dennis-mcintyre/2fa3d315-28d7-4ac6-94c9-1022a3dd91a3
9 News,Serial babysitter killer caught looking after kids again in NSW,https://9now.nine.com.au/a-current-affair/helen-moore-convicted-serial-babysitter-killer-caught-looking-after-children-again-in-nsw/59592b3e-bc43-4011-a99c-48ccf8911772
9 News,Heroic locals band together to save homes in fire ravaged town,https://9now.nine.com.au/a-current-affair/victoria-bushfires-ruffy/8497979c-c8b6-4948-9576-0c7d30f25d7d
9 News,CCTV provides vital clues into death of young Australian in Bali,https://9now.nine.com.au/60-minutes/byron-haddow-bali-cctv-footage-provides-vital-clues-into-the-death-of-young-australian-villa/5e7278d1-f714-4c34-9aea-afdfea0deaee
9 News,Families of four airmen killed in Taipan chopper crash break silence,https://9now.nine.com.au/60-minutes/taipan-families-of-four-airmen-killed-helicopter-crash-accuse-army/46e8e75d-f438-46b1-a76d-47d7110b572f
9 News,Sanna Marin: The partying prime minister who stood up against Russia,https://9now.nine.com.au/60-minutes/finland-sanna-marin-partying-prime-minister-who-stood-up-against-russia/49abe402-f6b5-4496-9669-a6b7536ea953
9 News,Couple arrive home to find nasty note taped to their door,https://www.domain.com.au/news/couple-confronted-by-rude-note-eight-hours-after-picking-up-apartment-keys-1414069/?utm_source=nine.com.au&utm_medium=referral&utm_campaign=editorial-homepage-driver
9 News,The last affordable suburb in Sydney revealed,https://www.domain.com.au/news/girraween-the-closest-suburb-to-sydneys-cbd-for-under-1-million-is-24km-away-1408376/?utm_source=nine.com.au&utm_medium=referral&utm_campaign=editorial-homepage-driver
9 News,The unusual reason Peter bought this derelict cottage,https://www.domain.com.au/news/i-collected-it-peter-bought-this-run-down-riverside-nz-cottage-for-nostalgia-1414033/?utm_source=nine.com.au&utm_medium=referral&utm_campaign=editorial-homepage-driver
9 News,"Jeep's rise and fall in Australia, and what's around the corner",https://www.drive.com.au/news/jeeps-rise-and-fall-in-australia-and-whats-around-the-corner/?utm_source=nine-rail&utm_medium=referral
9 News,Electric cars launching in Australia in 2026,https://www.drive.com.au/news/electric-cars-launching-in-australia-in-2026/?utm_source=nine-rail&utm_medium=referral
9 News,"Toyota, Nissan and Volkswagen models lose safety stars in new crash testing",https://www.drive.com.au/news/toyota-nissan-and-volkswagen-models-lose-safety-stars-in-new-crash-testing/?utm_source=nine-rail&utm_medium=referral
9 News,A video of a parking hack went viral. Copying it could land you in jail9 minutes ago,https://www.9news.com.au/national/queensland-couple-parking-hack-could-lead-to-jail/998691be-289a-4f25-80be-d0218223f1c5
9 News,Kokkinakis withdraws from Adelaide International hours before match24 minutes ago,https://www.nine.com.au/sport/tennis/news-2026-thanasi-kokkinakis-withdraws-adelaide-international-injury-australian-open-20260114-p5ntzl.html
9 News,'Number one target': AFP boss speaks on Iraqi arrest of alleged kingpin44 minutes ago,https://www.9news.com.au/national/kazem-hamad-alleged-underworld-kingpin-reportedly-arrested-in-iraq/15025f82-b5ce-47e6-9d24-bdb961fa53a6
9 News,How your job influences how much alcohol you drinkan hour ago,https://www.9news.com.au/national/work-habits-linked-to-dangerous-drinking-levels/94fdff7e-e1de-487b-ad67-bd1bb002249b
9 News,Sydney prayer hall linked to radical preacher permanently shuts downan hour ago,https://www.9news.com.au/national/sydney-al-madina-dawah-centre-linked-to-radical-preacher-wissam-haddad-permanently-shuts-down/9c9a270a-cd40-4485-bb71-962d55ee7fbc
9 News,Man charged with making several death threats to federal politicianan hour ago,https://www.9news.com.au/national/western-sydney-man-death-threats-federal-politician/ee1d063c-eece-4a6d-bb8e-4cce14723b45
9 News,RBA governor takes stand against Donald Trumpan hour ago,https://www.9news.com.au/world/donald-trump-jerome-powell-feud-rba-chair-michele-bullock-expresses-full-solidarity-with-fed-chair-after-trump-escalates-feud/5390890e-e66e-4ca4-bd60-c5b19ea4fab2
9 News,Author launches defamation proceedings against SA premieran hour ago,https://www.9news.com.au/national/randa-abdel-fattah-issues-defamation-concerns-notice-against-sa-premier-peter-malinauskas/236c6923-4afb-4c90-a9ab-bfcef689c61e
9 News,Tom Silvagni files appeal against rape convictions2 hours ago,https://www.9news.com.au/national/tom-silvagni-lodges-appeal-against-rape-conviction/7e7883b2-8d82-4fa2-9ab4-41b6bec87178
9 News,West Wing actor surrenders to police over child sex abuse allegations2 hours ago,https://www.9news.com.au/world/usa-timothy-busfield-surrenders-to-police-over-child-sex-abuse-allegations/87de4f0e-293f-4752-a907-1c4490c6808f
Guardian,Trump administration ends temporary protected status for Somalis in US,https://www.theguardian.com/us-news/2026/jan/13/trump-administration-ends-tps-somalia
Guardian,"Quarter of developing countries poorer than in 2019, World Bank finds",https://www.theguardian.com/business/2026/jan/13/developing-countries-poorer-world-bank-report
Guardian,"Author Chimamanda Ngozi Adichie accuses Lagos hospital of negligence after son""s death",https://www.theguardian.com/books/2026/jan/12/chimamanda-ngozi-adichie-accuses-lagos-hospital-negligence-son-death
Guardian,"Attempt to overturn the Gambia""s ban on FGM heard by supreme court",https://www.theguardian.com/global-development/2026/jan/09/the-gambia-female-genital-mutilation-fgm-supreme-court-case-overturn-ban
Guardian,"Two weeks on, questions linger over targeting and impact of US airstrikes in Nigeria ",https://www.theguardian.com/world/2026/jan/08/questions-targeting-impact-us-airstrikes-in-nigeria
Guardian,"US plan to exploit Venezuela""s oil could eat up 13% of carbon budget to keep 1.5C limit",https://www.theguardian.com/environment/2026/jan/12/us-plan-to-exploit-venezuelas-oil-could-eat-up-13-of-carbon-budget-to-keep-15c-limit
Guardian,"Trump""s other Latin American feud: why Colombia""s Petro is not Maduro",https://www.theguardian.com/world/2026/jan/12/trump-latin-america-feud-colombia-gustavo-petro
Guardian,"US frackers were already facing a global oil supply glut. Trump""s Venezuelan dream could make it worse",https://www.theguardian.com/us-news/2026/jan/12/us-oil-producers-global-supply-glut-venezuela
Guardian,"Carney heads to Beijing as Trump""s America First agenda forces Canada into trade rethink",https://www.theguardian.com/world/2026/jan/12/carney-heads-to-beijing-as-trump-america-first-agenda-forces-canada-into-trade-rethink
Guardian,"Trump threatens to block ExxonMobil from Venezuela after CEO calls country ""uninvestable""",https://www.theguardian.com/us-news/2026/jan/12/donald-trump-threatens-block-exxonmobil-venezuela
Guardian,South Korean prosecutors demand death penalty for former president Yoon Suk Yeol,https://www.theguardian.com/world/2026/jan/13/south-korean-prosecutors-demand-death-penalty-for-former-president-yoon-suk-yeol
Guardian,BTS announces return with new world tour in 2026 and 2027,https://www.theguardian.com/music/2026/jan/14/bts-announces-return-with-new-world-tourm-includin-in-2026-and-2027
Guardian,"Workers at Chinese factory that produces Labubu toys are being exploited, says NGO",https://www.theguardian.com/world/2026/jan/13/workers-at-chinese-factory-that-produces-labubu-toys-are-being-exploited-says-ngo
Guardian,"China pressing European countries to bar Taiwan politicians or face crossing a ""red line""",https://www.theguardian.com/world/2026/jan/13/china-europe-pressure-block-taiwanese-politicians-visas
Guardian,Coal power generation falls in China and India for first time since 1970s,https://www.theguardian.com/business/2026/jan/13/coal-power-generation-falls-china-india-since-1970s
Guardian,Australia news live: Randa Abdel-Fattah threatens legal action against SA premier; Sydney prayer hall linked to controversial cleric closes permanently,https://www.theguardian.com/australia-news/live/2026/jan/14/adelaide-festival-writers-week-lousie-adler-politics-reaction-peter-malinauskas-victoria-bushfires-queensland-floods-anthony-albanese-labor-sussan-ley-coalition-ntwnfb
Guardian,"Ten Sydney Harbours"" worth of threatened species habitat approved for destruction in 2025, report finds",https://www.theguardian.com/environment/2026/jan/13/threatened-species-habitat-destruction-australia-15-year-high
Guardian,NSW government calls for rethink on capital gains tax discount to ease housing affordability,https://www.theguardian.com/australia-news/2026/jan/13/nsw-government-capital-gains-tax-discount-negative-gearing-australia-housing-affordability
Guardian,"Australian politicians are condemning X and Grok, so why won""t they leave the platform?",https://www.theguardian.com/australia-news/2026/jan/13/grok-x-anthony-albanese-australia-politicians-condemn-post-platform
Guardian,Australian author Craig Silvey charged with possessing and distributing child exploitation material,https://www.theguardian.com/australia-news/2026/jan/13/australian-author-craig-silvey-charged-child-exploitation-ntwnfb
Guardian,"""I""ve had vets chasing lorries down the motorway"": The ""hell"" of post-Brexit paperwork",https://www.theguardian.com/politics/2026/jan/13/dealing-with-post-brexit-paperwork-pure-hell-shipping-head-tells-mps
Guardian,"Maker of Peaky Blinders ""in advanced talks"" to merge with The Traitors producer",https://www.theguardian.com/media/2026/jan/13/peaky-blinders-makers-banijay-merger-talks-traitors-producers-all3media
Guardian,"Greenland""s PM says territory ""chooses Denmark over the US"" ahead of talks with JD Vance "" as it happened",https://www.theguardian.com/world/live/2026/jan/13/zelenskyy-ukraine-russia-strikes-drones-energy-europe-live
Guardian,Greenland and Denmark unite against US advances before White House talks,https://www.theguardian.com/world/2026/jan/13/jd-vance-to-host-greenland-talks-at-white-house
Guardian,Julio Iglesias accused of sexual assault by two female former employees,https://www.theguardian.com/world/2026/jan/13/julio-iglesias-accused-of-sexual-assault-by-two-female-former-employees
Guardian,"Iran protests live updates: Trump warns of ""very strong action"" if Iran executes protesters, as death toll soars",https://www.theguardian.com/world/live/2026/jan/14/iran-protests-live-updates-trump-us-action-death-toll-protester-executions-erfan-soltani
Guardian,Winter storms kill five in Gaza amid desperate conditions in makeshift camps,https://www.theguardian.com/world/2026/jan/14/gaza-storms-kill-palestinians-makeshift-camps
Guardian,"US citizens should ""leave Iran now"", says US state department "" as it happened",https://www.theguardian.com/world/live/2026/jan/13/iran-protest-crackdown-regime-crisis-us-donald-trump-tariffs-latest-updates
Guardian,"Keir Starmer offered place on Trump""s Gaza ""peace board""",https://www.theguardian.com/world/2026/jan/13/keir-starmer-offered-place-on-trumps-gaza-peace-board
Guardian,Hundreds of gunshot eye injuries found in one Iranian hospital amid brutal crackdown on protests,https://www.theguardian.com/global-development/2026/jan/13/hundreds-of-gunshot-eye-injuries-found-in-one-iranian-hospital-amid-brutal-crackdown-on-protests
Guardian,Search for single-tusked elephant after 22 killed in India rampage,https://www.theguardian.com/world/2026/jan/13/search-elephant-people-killed-india-jharkand
Guardian,Russia working to circumvent sanctions to ensure India oil imports continue,https://www.theguardian.com/world/2026/jan/13/russia-working-to-circumvent-sanctions-to-ensure-india-oil-imports-continue
Guardian,Sikh activist in UK told to increase security over Hindu nationalist threats,https://www.theguardian.com/uk-news/2026/jan/12/sikh-activist-uk-increase-security-hindu-nationalist-threats
Guardian,"Myanmar junta holds second phase of election widely decried as a ""sham exercise""",https://www.theguardian.com/world/2026/jan/11/myanmar-junta-holds-second-phase-of-election-widely-decried-as-a-sham-exercise
Guardian,Indian police raid home of environmental activists over anti-fossil fuel campaign,https://www.theguardian.com/world/2026/jan/07/indian-police-raid-home-of-environmental-activists-over-anti-fossil-fuel-campaign
Guardian,"One in four UK teenagers in care have attempted to end their lives, study says",https://www.theguardian.com/society/2026/jan/14/one-in-four-uk-teenagers-in-care-have-attempted-to-end-their-lives-study-says
Guardian,Labour revives Northern Powerhouse Rail project with pledge of £45bn funds,https://www.theguardian.com/business/2026/jan/13/northern-powerhouse-rail-project-pledge-funds
Guardian,UK government rolls back key part of digital ID plans,https://www.theguardian.com/politics/2026/jan/13/government-rolls-back-digital-identity-card-plans
Guardian,West Midlands police commissioner criticises MPs for bias against chief constable,https://www.theguardian.com/uk-news/2026/jan/13/west-midlands-police-commissioner-criticises-mps-for-bias-against-chief-constable
Guardian,"LGB+ people in England and Wales ""much"" more likely to die by suicide than straight people",https://www.theguardian.com/society/2026/jan/13/lgb-people-in-uk-much-more-likely-to-take-their-own-lives-than-straight-people
Guardian,Trump threatens to revoke citizenship of naturalized immigrants convicted of fraud - US politics live,https://www.theguardian.com/us-news/live/2026/jan/13/donald-trump-tariffs-supreme-court-iran-ice-immigration-jerome-powell-us-politics-live
Guardian,"Trump says CBS anchor Tony Dokoupil wouldn""t have job if Kamala Harris had won",https://www.theguardian.com/us-news/2026/jan/13/trump-cbs-interview-tony-dokoupil
