Section,Headline,Link
Sky News,Today's News Headlines: State of disaster declared in Victoria,https://www.skynews.com.au/australia-news/todays-news-headlines-state-of-disaster-declared-in-victoria/video/5e00331cc1b1906d6d2a41bfbd1f34d1
Sky News,Albanese faces criticism from his own Labor Party,https://www.skynews.com.au/australia-news/politics/albanese-faces-criticism-from-his-own-labor-party/video/2458207a80aa1f9e3281657c2d0350f5
Sky News,North Queensland on cyclone watch,https://www.skynews.com.au/australia-news/weather/north-queensland-on-cyclone-watch/video/44c5e86da56b9074fb336f131a537a51
Sky News,Total fire ban in place as intense heatwave moves across NSW,https://www.skynews.com.au/australia-news/weather/total-fire-ban-in-place-as-intense-heatwave-moves-across-nsw/video/ef3980edae08490e741a11f73a34d445
Sky News,Victoria declares state of disaster as out-of-control bushfires rage,https://www.skynews.com.au/australia-news/weather/victoria-declares-state-of-disaster-as-outofcontrol-bushfires-rage/video/fb9eabeb4354516d9ac9532af0183d54
Sky News,Today's News Headlines: Two girls in hospital after Queensland crash,https://www.skynews.com.au/australia-news/todays-news-headlines-two-girls-in-hospital-after-queensland-crash/video/b4216e2643eaac194bc40966cba5f058
Sky News,Former PM Kevin Rudd meets Bondi hero Ahmed al Ahmed,https://www.skynews.com.au/australia-news/former-pm-kevin-rudd-meets-bondi-hero-ahmed-al-ahmed/video/65fb47ad56807e12dcc4d65b63dc801e
Sky News,"Listen to ""Sky News Radio' on the Nova Player app",https://www.skynews.com.au/business/media/you-can-listen-to-sky-news-australia-anytime-and-on-any-platform-with-sky-news-radio-on-iheartradio/news-story/2d6aca31bc7566b5c0652db48284f5b7
Sky News,Catch up on your favourite Sky News shows with podcasts,https://www.skynews.com.au/opinion/your-favourite-sky-news-australia-shows-are-available-to-listen-to-any-time-as-podcasts/news-story/379bbe36e745709ce679d2813be0249c
