Section,Headline,Link
ABC,Storm win finals nail-biter as Bulldogs coach fumes at crucial ref calls,https://www.abc.net.au/news/2025-09-12/nrl-finals-live-updates-melbourne-storm-canterbury-bulldogs/105751872
ABC,Pacific leaders reject China's push to exclude Taiwan from regional forum,https://www.abc.net.au/news/2025-09-12/pacific-backs-taiwan-in-regional-forum-despite-chinas-opposition/105768946
ABC,Why are musicians and listeners boycotting Spotify?,https://www.abc.net.au/news/2025-09-12/spotify-boycott-daniel-ek-ai-music-military-tech-fenn-wilson/105765846
ABC,Student says he's lost pride in ANU as vice-chancellor's departure sparks debate,https://www.abc.net.au/news/2025-09-12/anu-staff-disagree-way-forward-after-genevieve-bell-departure/105766052
ABC,'Shining light': Tributes flow after Australian basketballer Tiana Mangakahia dies of cancer,https://www.abc.net.au/news/2025-09-12/tiana-mangakahia-dies-of-cancer/105768486
ABC,Qatar accuses Israel of ignoring Gaza hostages in attack on Doha,https://www.abc.net.au/news/2025-09-12/qatar-accuses-israel-of-ignoring-hostages-after-doha-attack/105767280
ABC,Prince Harry arrives in Kyiv to meet with wounded Ukrainian war veterans,https://www.abc.net.au/news/2025-09-12/prince-harry-is-in-kyiv-to-meet-with-wounded-war-veterans/105768694
ABC,Matildas announce October clash against England,https://www.abc.net.au/news/2025-09-12/matildas-to-face-england-in-october-international-window/105768734
ABC,Terry Irving says $130k for malicious prosecution is 'insignificant',https://www.abc.net.au/news/2025-09-12/qld-terry-irving-compensation-supreme-court-maurice-blackburn/105767562
ABC,University staff 'disheartened and demoralised' as thousands sacked,https://www.abc.net.au/news/2025-09-12/university-sector-job-cuts-/105761276
ABC,Clive Palmer's human rights complaint referred to Supreme Court,https://www.abc.net.au/news/2025-09-12/clive-palmer-fraud-human-rights-complaint-supreme-court/105767518
ABC,YouTube rapper accused of rape allowed to fly home to UK on bail,https://www.abc.net.au/news/2025-09-12/youtube-creator-yung-filly-allowed-to-fly-overseas-on-bail/105094220
ABC,Recommendations into IVF review accepted after embryo mix-ups,https://www.abc.net.au/news/2025-09-12/health-ministers-meeting-ivf-rapid-review/105767258
ABC,Murdered children's PlayStation data allegedly the last proof they were alive,https://www.abc.net.au/news/2025-09-12/week-one-trial-hakyung-lee-case/105757948
ABC,"Inside the plan to station 1,200 Americans and their subs near Perth",https://www.abc.net.au/news/2025-09-12/inside-the-aukus-plan-to-station-american-subs-near-perth/105763818
ABC,'We ... changed the world': Norman expresses pride as he ends controversial LIV Golf stint,https://www.abc.net.au/news/2025-09-12/greg-norman-pride-as-he-ends-liv-golf-stint/105766876
ABC,More Australian consumers are falling for mimic shopping websites,https://www.abc.net.au/news/2025-09-12/clone-websites-retailers-catch-out-online-shoppers-scam/105736854
ABC,"'A tragedy': 2,500 elderly patients stuck in hospital waiting for aged care",https://www.abc.net.au/news/2025-09-12/federal-government-aged-care-hospital-beds-waitlist/105763730
ABC,Man awarded $450k in damages after ex-premier's son fabricated death threats,https://www.abc.net.au/news/2025-09-12/man-gets-450k-damages-for-daniel-keneally-fabricating-evidence/105767836
ABC,"Stewards placed hundreds of bets on Tasmanian races, investigation finds",https://www.abc.net.au/news/2025-09-12/stewards-placed-bets-on-tasmanian-races/105766996
ABC,Australia on alert as shot-hole borer wipes out thousands of trees,https://www.abc.net.au/news/2025-09-10/shot-hole-borer-tree-threat-australia/105740250
ABC,Friends combine finances to buy dream home together,https://www.abc.net.au/news/2025-09-10/homebuyers-turn-to-shared-ownership-in-property-market/105719548
ABC,'Jarring to have my experience dismissed': Women report low healthcare satisfaction,https://www.abc.net.au/news/2025-09-09/women-health-canberra-survey-access-affordability-not-serious/105748894
ABC,"In this food bowl region, the alarm is ringing over water supply",https://www.abc.net.au/news/2025-09-09/limestone-coast-concerns-for-groundwater-shortage/105619362
ABC,"Islamophobia has been 'persistent' and 'ignored', envoy says — as it happened",https://www.abc.net.au/news/2025-09-12/federal-politics-live-sept-12/105765250
ABC,Jacinta Nampijinpa Price accused of working against electorate on migration,https://www.abc.net.au/news/2025-09-12/jacinta-nampijinpa-price-comments-nt-migration-push-criticism/105761316
ABC,Muslim groups welcome Islamophobia report amid harassment spike,https://www.abc.net.au/news/2025-09-12/muslim-groups-call-for-rethink-of-counter-terrorism-approach/105764246
ABC,What hope do the Liberals have if one rebellious senator brought a crisis?,https://www.abc.net.au/news/2025-09-12/sussan-ley-jacinta-nampijinpa-price-sacking/105748980
ABC,"After uniting to upend Nepal politics, Gen Z looks to appoint leader",https://www.abc.net.au/news/2025-09-12/youth-leaders-nepal-gen-z-meet-army-nepal-interim-leader/105764316
ABC,Australian in Bali says she's never seen anything like recent floods,https://www.abc.net.au/news/2025-09-12/australian-in-bali-survives-indonesian-flash-floods/105764660
ABC,"Macron is so unpopular in France, many say resignation is his only option",https://www.abc.net.au/news/2025-09-12/france-could-hold-snap-elections-again-amid-deadlock/105764462
ABC,Ex-Brazilian president Jair Bolsonaro found guilty of coup charges,https://www.abc.net.au/news/2025-09-12/brazil-bolsonaro-guilty-of-coup-charges/105765198
ABC,Markets 'significantly under-weighting' US inflation risk — as it happened,https://www.abc.net.au/news/2025-09-12/asx-markets-business-live-news-sept-12/105765376
ABC,Regulator in gas leak 'scandal' had paid role with industry lobbyist,https://www.abc.net.au/news/2025-09-12/nt-regulator-oversight-gas-leak-scandal-paid-role-lobbyist/105752490
ABC,Growing group of Labor MPs urge 2035 emissions target above Climate Authority's floor,https://www.abc.net.au/news/2025-09-12/labor-mps-urge-2035-target-within-climate-authority-advice/105762592
ABC,Lifeline for peanut industry as family business buys Bega factories,https://www.abc.net.au/news/rural/2025-09-12/bega-group-sells-peanut-processing-assets-to-crumpton-group/105763466
ABC,King 'humbled' after beating Buckley to Melbourne coaching job,https://www.abc.net.au/news/2025-09-12/afl-steven-king-named-melbourne-demons-coach/105767854
ABC,Netball players to get share of Diamonds' revenue in landmark deal,https://www.abc.net.au/news/2025-09-12/netball-australia-players-strike-landmark-revenue-sharing-deal/105765526
ABC,Jamal Fogarty isn't the perfect halfback but he's the perfect halfback for Canberra,https://www.abc.net.au/news/2025-09-12/jamal-fogarty-canberra-raiders-nrl-finals-broncos/105763708
ABC,'Nothing for granted': Aussies wary of Belgian Davis Cup threat,https://www.abc.net.au/news/2025-09-12/nothing-for-granted-aussies-wary-of-belgian-davis-cup-threat/105767498
ABC,"Is the pink soap scum in my bathroom mould, or something else?",https://www.abc.net.au/news/2025-09-11/why-is-the-soap-scum-in-my-bathroom-pink-and-orange-/105721212
ABC,There is a high rate of suicide in construction. Here's what to look for,https://www.abc.net.au/news/2025-09-10/supporting-loved-ones-who-work-in-construction/105724124
ABC,"Avoiding your tax? Don't panic, but 'act now'",https://www.abc.net.au/news/2025-09-09/how-to-start-on-tax-return-if-feeling-overwhelmed/105623326
ABC,What I learnt from three months of drastically reducing my screen time,https://www.abc.net.au/news/2025-09-08/what-i-learnt-from-three-months-of-slashing-my-screen-time/105670916
ABC,Toni Jordan grew up at the greyhound track. It inspired her latest novel,https://www.abc.net.au/news/2025-09-12/toni-jordan-books-tenderfoot-interview/105754310
ABC,Why Krishna Istha turned to art to find a sperm donor,https://www.abc.net.au/news/2025-09-10/first-trimester-melbourne-fringe-krisha-istha-sperm-donor/105650028
ABC,Ireland threatens Eurovision boycott if Israel takes part,https://www.abc.net.au/news/2025-09-12/ireland-threatens-eurovision-boycott-if-isreal-takes-part/105764652
ABC,Meet the Spanish conductor bringing Australian music to the world stage,https://www.abc.net.au/news/2025-09-11/jaime-martin-melbourne-symphony-orchestra-uk-europe-tour/105753542
Sky News,"""World has lost a great man': Charlie Kirk has exposed the ""insane hypocrisy' of the left",https://www.skynews.com.au/opinion/world-has-lost-a-great-man-charlie-kirk-has-exposed-the-insane-hypocrisy-of-the-left/video/0188165608572d045a192e84173162a7
Sky News,"Treatment of Jacinta Price labelled an ""absolute disgrace' amid axing",https://www.skynews.com.au/opinion/treatment-of-jacinta-price-labelled-an-absolute-disgrace-amid-axing/video/ce067ec0853bf4386d5bf34269a88acf
Sky News,"""Common sense': Charlie Kirk acted as an ""antidote to the craziness of the left'",https://www.skynews.com.au/opinion/common-sense-charlie-kirk-acted-as-an-antidote-to-the-craziness-of-the-left/video/cac18957a9264a303be42f4bec4ce8bc
Sky News,"""Absolute disgrace': Antisemitism ""couldn't be addressed' until Islamophobia ""gave permission'",https://www.skynews.com.au/opinion/absolute-disgrace-antisemitism-couldnt-be-addressed-until-islamophobia-gave-permission/video/4bae344aa9ea0bd8b08b7487c845cc98
Sky News,Charlie Kirk mourned around the world at candlelight vigils,https://www.skynews.com.au/opinion/charlie-kirk-mourned-around-the-world-at-candlelight-vigils/video/2df8ca1498369308f17f695b741fba29
Sky News,"""He was a mainstream Republican': Charlie Kirk didn't have ""hate in his heart'",https://www.skynews.com.au/opinion/rita-panahi/he-was-a-mainstream-republican-charlie-kirk-didnt-have-hate-in-his-heart/video/907a44679c276ce64bf90a99629c5558
Sky News,"Suspect in custody in murder of Charlie Kirk, Trump says",https://www.skynews.com.au/world-news/united-states/suspect-in-custody-in-murder-of-charlie-kirk-according-to-us-president-donald-trump/news-story/3bf6ddcc685a8a54acb73e1306971cfb
Sky News,"""Make the right decision': Hanson urges Jacinta Price to join One Nation",https://www.skynews.com.au/australia-news/politics/pauline-hanson-wants-senator-jacinta-nampijinpa-price-to-join-one-nation-saying-there-is-still-a-future-for-her-in-politics/news-story/85ff23ccc7197d429af3126b33c795fb
Sky News,"FBI release fresh footage of Charlie Kirk's assassination suspect, authorities pursuing death penalty",https://www.skynews.com.au/world-news/united-states/watch-live-authorities-set-to-deliver-update-on-investigation-into-charlie-kirks-assassination-after-rapid-developments-delayed-press-briefing/news-story/e3264565f57ca00f42c386951ae9cc6c
Sky News,JD Vance's plane arrives in Arizona with Charlie Kirk's casket,https://www.skynews.com.au/australia-news/us-president-donald-trump-to-posthumously-award-charlie-kirk-presidential-medal-of-freedom-nations-highest-civilian-honour/live-coverage/17b07f820d1c00ea2ea1f5fda99cd81d
Sky News,Heartbreaking detail about Harry and Charles summit,https://www.skynews.com.au/lifestyle/celebrity-life/prince-harry-reportedly-showed-up-to-king-charles-summit-armed-with-photos-of-prince-archie-and-princess-lilibet/news-story/1f4507ec4be2fa439d033eda55dae085
Sky News,Labor approves controversial North West Shelf project,https://www.skynews.com.au/business/energy/environment-minister-murray-watt-approves-extending-woodsides-controversial-north-west-shelf-project-to-2070-with-48-conditions/news-story/29397312995d8fa04d4073e45ab2150f
Sky News,Donald Trump Jr's heartbreaking call to Charlie Kirk's wife moments after horror shooting,https://www.skynews.com.au/world-news/united-states/were-praying-for-them-donald-trump-jrs-heartbreaking-call-to-charlie-kirks-wife-moments-after-horror-shooting/news-story/9ccd83e55b49a4e21b1cbdcd6fafa9dc
Sky News,"""So disrespectful': Teal MP tears into Nationals Senator in heated on-air clash",https://www.skynews.com.au/australia-news/politics/teal-mp-zali-steggall-tears-into-nationals-senator-bridget-mckenzie-over-immigration-labelling-her-so-disrespectful-in-heated-onair-exchange/news-story/6046899d7b9389f33bcde5358b3dfdb8
Sky News,The reason delays are expected for thousands of Sydney Airport travellers,https://www.skynews.com.au/australia-news/delays-expected-for-thousands-of-travellers-this-weekend-as-sydney-airport-struck-with-shortage-of-air-traffic-controllers/news-story/e328316cf23c1d50ad552a79df0ee24c
Sky News,Man arrested after seizure of $1 million worth of cannabis plants,https://www.skynews.com.au/australia-news/crime/man-arrested-after-seizure-of-1-million-worth-of-cannabis-plants-at-his-sydney-property/news-story/45a754a181bbdd42ece26f94643deb52
Sky News,Australian faces death penalty in Bali over $1.1m cocaine shipment,https://www.skynews.com.au/australia-news/crime/lamar-ahchee-appears-in-bali-court-accused-of-importing-and-distributing-17-kilograms-of-cocaine-charges-that-carry-the-death-penalty/news-story/eefaf345cf45b8f886d2453006abc36b
Sky News,Former Virgin Australia CEO reaps $50m payday after leaving airline,https://www.skynews.com.au/business/finance/former-virgin-australia-chief-executive-officer-jayne-hrdlicka-reaps-50m-windfall-after-leaving-the-airline/news-story/0656d8767c509c92a6ab8c0045455fbc
Sky News,Penrith Panthers speak out after superstar Brian To'o makes Mary Fowler lewd joke,https://www.skynews.com.au/australia-news/sport/penrith-panthers-speak-out-after-superstar-brian-too-makes-lewd-sexualised-jokes-about-teammates-partners/news-story/024ac779bf3f60748185b1567450f880
Sky News,"Liberal Senator decries ""unfortunate targeting of senior Liberal women' at hands of Ley",https://www.skynews.com.au/australia-news/politics/liberal-senator-decries-unfortunate-targeting-of-senior-liberal-women-at-hands-of-sussan-ley-following-jacinta-price-sacking-as-tensions-mount/news-story/8c8f7bbfa65108bdbfec8860b06ad35d
Sky News,Aussie stocks jump after Wall Street hits record highs,https://www.skynews.com.au/business/markets/asx-200-soars-after-major-wall-street-indexes-hit-record-highs-on-rate-cut-hopes/news-story/faca269bb07b17d1f0d8428fe1f3a92f
Sky News,The Albanese government has just stood firm against Vanuatu's climate lecture,https://www.skynews.com.au/insights-and-analysis/albanese-govt-caving-to-vanuatus-climate-lecture-would-have-granted-microstates-effective-veto-power-over-australian-energy-infrastructure/news-story/ee8a5ec4b8df9a5967c7a60bb3eb24ba
Sky News,Charlie Kirk's killer has created a million versions of the visionary conservative activist,https://www.skynews.com.au/insights-and-analysis/esther-krakue-courageous-visionary-charlie-kirk-taught-me-it-was-not-only-acceptable-but-necessary-to-be-a-conservative/news-story/5ccab3d4ba4d9221b362fd11c55036bd
Sky News,"Note to Canberra, don't gamble with immigration if you want to protect your nation's soul",https://www.skynews.com.au/insights-and-analysis/a-message-from-the-us-to-canberra-dont-gamble-with-immigration-unless-you-want-splintered-communities-strained-public-services/news-story/e95a17266bbcdc07ed59d42d99feb576
Sky News,Joe Rogan left speechless as Charlie Kirk assassination confirmed on his show,https://www.skynews.com.au/world-news/united-states/joe-rogan-and-charlie-sheen-left-stunned-after-learning-of-charlie-kirks-fatal-shooting-during-podcast-recording/news-story/3d814d67b4cabf8555e8cdcf669a8708
Sky News,Elon Musk pledges $1.5 million to murals honouring slain refugee,https://www.skynews.com.au/world-news/united-states/elon-musk-pledges-15-million-to-murals-honouring-ukrainian-refugee-iryna-zarutska-murdered-in-north-carolina/news-story/c5dfbc50f1a66f9cb440a3c1b614cdb8
Sky News,Britain sacks US ambassador over Epstein ties,https://www.skynews.com.au/world-news/united-kingdom/british-prime-minister-sir-keir-starmer-sacks-us-ambassador-peter-mandelson-over-ties-to-notorious-sex-trafficker-jeffrey-epstein/news-story/ef16b52a403cf4d37144fd9550712e1d
Sky News,"Suspect in custody in murder of Charlie Kirk, Trump says",https://www.skynews.com.au/world-news/united-states/suspect-in-custody-in-murder-of-charlie-kirk-according-to-us-president-donald-trump/news-story/3bf6ddcc685a8a54acb73e1306971cfb
Sky News,Donald Trump Jr's heartbreaking call to Charlie Kirk's wife moments after horror shooting,https://www.skynews.com.au/world-news/united-states/were-praying-for-them-donald-trump-jrs-heartbreaking-call-to-charlie-kirks-wife-moments-after-horror-shooting/news-story/9ccd83e55b49a4e21b1cbdcd6fafa9dc
Sky News,FBI releases more images of person of interest in Charlie Kirk assassination,https://www.skynews.com.au/world-news/united-states/the-fbi-releases-more-images-of-person-of-interest-in-charlie-kirks-utah-assassination/news-story/d0dabeece32eb3ed588b0c8a77a8d845
Sky News,"Consequence of Charlie Kirk's assassination ""bigger than people realise'",https://www.skynews.com.au/world-news/united-states/bigger-than-people-realise-charlie-kirks-assassination-sends-shock-waves-through-political-and-media-landscape/news-story/1410bd9dec80c3b825c8c43d8bcb737e
Sky News,Ilhan Omar cruelly stomps on Charlie Kirk's legacy,https://www.skynews.com.au/world-news/united-states/democrat-ilhan-omar-cruelly-stomps-on-charlie-kirks-legacy/news-story/216d04c4e9afdf4511c918bd5dd0c510
Sky News,EXCLUSIVE: Megyn Kelly concerned for her safety after Charlie Kirk assassination,https://www.skynews.com.au/opinion/paul-murray/exclusive-megyn-kelly-concerned-for-her-safety-after-charlie-kirk-assassination/video/80405fde9213d8786860401ccc2af1be
Sky News,"""He was a uniter': Kirk's assassination a reflection of ""serious sickness' within US",https://www.skynews.com.au/opinion/sharri-markson/he-was-a-uniter-kirks-assassination-a-reflection-of-serious-sickness-within-us/video/34d650fcaf85feca5a23a7c235fe47eb
Sky News,"""So much for women': Jacinta Price's axing exposes deep division in Coalition",https://www.skynews.com.au/opinion/peta-credlin/so-much-for-women-jacinta-prices-axing-exposes-deep-division-in-coalition/video/e93d01c977dd6d92e51b5a5858bd8b3e
Sky News,Danica De Giorgio | 12 September,https://www.skynews.com.au/stream/opinion-programs/danica-de-giorgio/danica-de-giorgio-12-september/video/997da633ad4030802f8cd49f8b665e64
Sky News,Steve Price | 12 September,https://www.skynews.com.au/stream/opinion-programs/steve-price/steve-price-12-september/video/357819e5945d8d6a10510d3ae5a5deaa
Sky News,The World According to Rowan Dean | 12 September,https://www.skynews.com.au/stream/opinion-programs/the-world-according-to-rowan-dean/the-world-according-to-rowan-dean-12-september/video/43d856bacd2613ac616bbca865233cd8
Sky News,The Media Show | 12 September,https://www.skynews.com.au/stream/opinion-programs/the-media-show/the-media-show-12-september/video/061021702c8153ae5e0acfe7f082d79f
Sky News,The U.S. Report | 12 September,https://www.skynews.com.au/stream/opinion-programs/the-us-report/the-us-report-12-september/video/b97698c2a6921c03af8879caee34030b
Sky News,The Kenny Report | 11 September,https://www.skynews.com.au/stream/opinion-programs/the-kenny-report/the-kenny-report-11-september/video/9df10036fb9ede8b254b4eada20e4ab1
Sky News,Credlin | 11 September,https://www.skynews.com.au/stream/opinion-programs/credlin/credlin-11-september/video/d5bc0dec0dba3c032ff7a3a087d9db87
Sky News,Labor approves controversial North West Shelf project,https://www.skynews.com.au/business/energy/environment-minister-murray-watt-approves-extending-woodsides-controversial-north-west-shelf-project-to-2070-with-48-conditions/news-story/29397312995d8fa04d4073e45ab2150f
Sky News,Former Virgin Australia CEO reaps $50m payday after leaving airline,https://www.skynews.com.au/business/finance/former-virgin-australia-chief-executive-officer-jayne-hrdlicka-reaps-50m-windfall-after-leaving-the-airline/news-story/0656d8767c509c92a6ab8c0045455fbc
Sky News,Aussie stocks jump after Wall Street hits record highs,https://www.skynews.com.au/business/markets/asx-200-soars-after-major-wall-street-indexes-hit-record-highs-on-rate-cut-hopes/news-story/faca269bb07b17d1f0d8428fe1f3a92f
Sky News,"""Brave face': Chinese car makers dominate European competitors at major car show",https://www.skynews.com.au/business/tech-and-innovation/european-car-makers-put-on-brave-face-against-dominant-chinese-competitors-at-2025-international-motor-show-germany/news-story/0620f1097ec17b80a1f235a86fc36b49
Sky News,"""Oh hell no': Brisbane comic dives into city's ""terrifying' pool",https://www.skynews.com.au/lifestyle/christian-hull-finally-takes-the-plunge-at-27storeyhigh-infinity-pool-as-social-media-erupts-in-fear-and-fascination/news-story/37139df9a9d79d4b77b84a2ba9f50937
Sky News,Shocking rise of home insurance costs hurts struggling Australians,https://www.skynews.com.au/business/finance/home-and-contents-insurance-premiums-skyrocket-upwards-of-700-over-past-year-fresh-canstar-research-shows/news-story/149e446e5925b94c232961f388b8fbac
Sky News,"Another bank slashes jobs as sector faces a ""tidal wave of cuts'",https://www.skynews.com.au/business/finance/bendigo-bank-cuts-158-jobs-after-anz-nab-bank-of-queensland-slashed-roles-as-the-sector-faces-a-tidal-wave-of-cuts/news-story/7642f96cc7ee23474f058a582dea1918
Sky News,Elon Musk briefly dethroned as the world's richest man,https://www.skynews.com.au/business/markets/elon-musk-briefly-dethroned-as-worlds-richest-man-by-oracles-larry-ellison-after-massive-deal-with-chatgptmaker-openai/news-story/4f815572254a47fc47f0137ad6066e88
Sky News,Local ChatGPT competitor emerges with $10m promise for content creators,https://www.skynews.com.au/business/tech-and-innovation/local-chatgpt-competitor-sovereign-australia-ai-emerges-to-shake-up-tech-industry-with-10m-promise-for-creators/news-story/9cb0e7775fc065d45cf7596e490145c3
Sky News,Heartbreaking detail about Harry and Charles summit,https://www.skynews.com.au/lifestyle/celebrity-life/prince-harry-reportedly-showed-up-to-king-charles-summit-armed-with-photos-of-prince-archie-and-princess-lilibet/news-story/1f4507ec4be2fa439d033eda55dae085
Sky News,"""I stand by everything': Piers fires back at Harry and Meghan",https://www.skynews.com.au/lifestyle/celebrity-life/hes-kept-the-royal-titles-so-he-can-continue-making-money-piers-morgans-shock-onair-rant-over-prince-harry-after-his-infamous-meghan-comments-on-good-morning-britain/news-story/11bd5b046dbfcda67a2ddbfee76f9171
Sky News,"Kate's clear ""message' in cold war between Prince William, Prince Harry",https://www.skynews.com.au/lifestyle/celebrity-life/not-a-random-choice-princess-catherine-sends-very-clear-message-to-prince-harry-meghan-markle-after-breakthrough-king-charles-meeting/news-story/cb03a9fc2fce68023be02f4938b3750d
Sky News,Married At First Sight star dies suddenly at 47,https://www.skynews.com.au/lifestyle/celebrity-life/married-at-first-sight-star-lachlan-rofe-dead-at-age-47-after-spending-final-years-on-nsw-farm-out-of-limelight/news-story/4e3e81c711b7507553f84c506e17bc5a
Sky News,Greta Thunberg's sister distances herself from climate activist,https://www.skynews.com.au/lifestyle/celebrity-life/greta-thunbergs-sister-beata-ernman-quietly-distances-herself-from-climate-activist-after-name-change/news-story/df63c011852c902ba0f66ac6eda03a0e
Sky News,Meghan Markle's big legal win amid family feud,https://www.skynews.com.au/lifestyle/celebrity-life/meghan-markles-big-legal-win-in-libel-battle-with-estranged-half-sister-after-judge-casts-double-on-latest-appeal/news-story/c2d5931542a0653b8ab9bb0a3b83ae16
Sky News,The surprising person King Charles met with after Harry reunion,https://www.skynews.com.au/lifestyle/trending/king-charles-meets-sa-premier-peter-malinauskas-literally-immediately-after-reuniting-with-harry/news-story/6245bd93ca9c804302c9ff5ebf0d0616
Sky News,American influencer slammed for wrestling crocodile in Queensland,https://www.skynews.com.au/lifestyle/bloke-clearly-had-no-clue-steve-irwins-father-bob-slams-american-influencer-mike-holston-for-wrestling-queensland-crocodile/news-story/29a4f9789fece36acc1209c2f361a673
Sky News,Today's News Headlines: Trump to award Kirk medal of freedom,https://www.skynews.com.au/australia-news/todays-news-headlines-trump-to-award-kirk-medal-of-freedom/video/0f081bee26f6cbe55be0ed096153634e
Sky News,Today's News Headlines: Charlie Kirk's casket arrives in Arizona,https://www.skynews.com.au/australia-news/todays-news-headlines-charlie-kirks-casket-arrives-in-arizona/video/cd37624e7ba21f975c2bb1921f94aa48
Sky News,"""So disrespectful': Zali Steggall and Bridget McKenzie clash over immigration",https://www.skynews.com.au/australia-news/politics/so-disrespectful-zali-steggall-and-bridget-mckenzie-clash-over-immigration/video/015117eec519bf0bf32eee3a4eb27a85
Sky News,Today's News Headlines: Donald Trump to award Charlie Kirk medal of freedom,https://www.skynews.com.au/australia-news/todays-news-headlines-donald-trump-to-award-charlie-kirk-medal-of-freedom/video/1d5af69b0696a672e2147a4040a5c7c9
Sky News,Today's News Headlines: Charlie Kirk shot at Utah university,https://www.skynews.com.au/australia-news/todays-news-headlines-charlie-kirk-shot-at-utah-university/video/e915e79102f51e2e4263b4f110904108
Sky News,Northern Territory man uses pepper spray in self defence,https://www.skynews.com.au/australia-news/crime/northern-territory-man-uses-pepper-spray-in-self-defence/video/fdf8a13372c01262bc482edc6d37fef2
Sky News,Today's News Headlines: Jacinta Price sacked from shadow cabinet,https://www.skynews.com.au/australia-news/todays-news-headlines-jacinta-price-sacked-from-shadow-cabinet/video/5b34ff896e23913934fc21e3278f1c4f
