Section,Headline,Link
Sky News,Albanese to join world leaders for Pacific Island Forum,https://www.skynews.com.au/australia-news/politics/albanese-to-join-world-leaders-for-pacific-island-forum/video/d8b02d32adc41b8908471b786be3942b
Sky News,"Liberals to scrap ADF ban on ""death symbols'",https://www.skynews.com.au/australia-news/politics/liberals-to-scrap-adf-ban-on-death-symbols/video/beadf0f18c5523f000d20e30b1d9a9de
Sky News,Today's News Headlines: NZ Police find fugitive's children,https://www.skynews.com.au/australia-news/todays-news-headlines-nz-police-find-fugitives-children/video/73c6f0de6aba68efdc4922a04824eaa2
Sky News,"Nuclear energy makes ""environmental and economic sense' for Australia",https://www.skynews.com.au/australia-news/politics/nuclear-energy-makes-environmental-and-economic-sense-for-australia/video/fde0eb80693d488baa5cab082e5fba10
Sky News,Today's News Headlines: Mushroom murderer Erin Patterson sentenced to life in prison,https://www.skynews.com.au/australia-news/todays-news-headlines-mushroom-murderer-erin-patterson-sentenced-to-life-in-prison/video/d096e414dc37efe3510b85f4a097e6e0
Sky News,"""Spectacular own goal': Jacinta Price blasted for ""poor judgement' with Indian migrant comments",https://www.skynews.com.au/australia-news/politics/spectacular-own-goal-jacinta-price-blasted-for-poor-judgement-with-indian-migrant-comments/video/b081d26ac7686339b548259f16c07e5c
Sky News,"Listen to ""Sky News Radio' on the Nova Player app",https://www.skynews.com.au/business/media/you-can-listen-to-sky-news-australia-anytime-and-on-any-platform-with-sky-news-radio-on-iheartradio/news-story/2d6aca31bc7566b5c0652db48284f5b7
Sky News,Catch up on your favourite Sky News shows with podcasts,https://www.skynews.com.au/opinion/your-favourite-sky-news-australia-shows-are-available-to-listen-to-any-time-as-podcasts/news-story/379bbe36e745709ce679d2813be0249c
