Section,Headline,Link
9 News,State of disaster declared as firefighters continue to battle out-of-control bushfires,https://www.9news.com.au/national/victoria-fires-state-faces-catastrophic-and-extreme-fire-conditions/c57fd4c4-d767-4be8-827d-b37976be2ce7
9 News,ICE agent's phone captures fatal confrontation in Minneapolis,https://www.9news.com.au/world/minneapolis-ice-shooting-renee-good-jonathan-ross-jd-vance-video/bf3fbd72-fc95-4a5f-a58e-ef20fd98315b
9 News,'High' chance of cyclone as rain sweeps Queensland coast,https://www.9news.com.au/national/queensland-cyclone-warning-severe-weather-forecast-heavy-rain-updates/41d13e7e-3d9c-43f8-9326-da96909c22b6
9 News,'Like an atomic bomb': Small town unrecognisable as fire destroys homes,https://www.9news.com.au/national/victoria-bushfires-longwood-ruffy-unrecognisable-scenes/18de54ff-08d1-4ffb-b690-9c204acb4604
9 News,How a $70k DIY reno saved this 'disgusting' villa,https://www.domain.com.au/advice/real-renos-tarsha-iggy-caiaffa-1469692/?utm_source=9news.com.au&utm_medium=referral&utm_campaign=editorial-homepage-driver
9 News,Hundreds of firefighters on standby as Sydney tops 40 degrees11 minutes ago,https://www.9news.com.au/national/sydney-set-for-intense-heat/99df6d08-5ded-4d24-a90e-1eb77a0307d2
9 News,"Medical student, 21, dies a month after Sydney police pursuit crash39 minutes ago",https://www.9news.com.au/national/lidija-faamau-liverpool-crash-woman-dies-sydney-nsw/7422332d-3afb-4437-a01d-302cbbbd8aab
9 News,Man shot dead inside unit in Sydney's westan hour ago,https://www.9news.com.au/national/man-shot-dead-in-sydneys-west/08568cfa-02c3-4f5a-88ca-289a27f1b10f
9 News,'Whether they like it or not': Donald Trump's threat to Greenland,https://www.9news.com.au/world/donald-trump-greenland-takeover-threat-china-russia/9815c98e-11de-4c64-a9d3-681e2df422b6
9 News,Woman charged following dangerous motorway stunt,https://www.9news.com.au/national/driver-charged-following-dangerous-motorway-stunt/f20f59e5-81f9-4c38-a584-4c6f1eb39e13
9 News,Campers to pay extra fees at popular spots across Australia,https://www.9news.com.au/national/fees-now-being-charges-at-free-campsites-tasmania/c1f2e21b-f76d-4b71-a8cc-5700f94ed3d4
9 News,Iran supreme leader signals upcoming crackdown on protesters,https://www.9news.com.au/world/iran-supreme-leader-signals-upcoming-crackdown-on-protesters-ruining-their-own-streets-for-trump/1a396997-46cd-4486-99e8-243255f79018
9 News,'Expect to lose power': Queenslanders in path of likely cyclone urged to prepare,https://www.9news.com.au/national/tropical-cyclone-prepare-now-authorities-warn-northern-queensland-weather-news/0721abb1-148e-4623-87e5-e6aa080e585a
9 News,Trump cancels 'second wave' of attacks on Venezuela,https://www.9news.com.au/world/venezuela-donald-trump-cancelled-second-wave-of-attacks-on-venezuela-due-to-country-cooperation/ca48aeb1-c951-462d-965e-ee989db2a518
9 News,Dozens of writers withdraw from event after Palestinian author dropped from program,https://www.9news.com.au/national/adelaide-writers-festival-drop-palestinian-author-randa-abdel-fattah-dozens-of-writers-withdraw/da716f04-249c-43e2-ad68-fcb707f37f5c
9 News,Luxury SUV recalled due to potential fire risk,https://www.9news.com.au/national/product-recall-volkswagen-touareg-2020-2024-model-suv-recalled-over-potential-fire-risk/2b4315be-a9b3-41cd-a48c-3983051993a0
9 News,Forecasters say 50-60 per cent chance cyclone will cross Queensland coast,https://www.9news.com.au/national/tropical-cyclone-queensland-12u-forecast-to-reach-cyclone-intensity-before-landfall-bureau-of-meteorology-weather-news/86a618d0-1a98-4e4c-a142-6d197fd6e9c4
9 News,Two motorbike riders killed in head on collision in Perth,https://www.9news.com.au/national/wembley-crash-two-men-die-after-motorcycle-collision-in-perths-western-suburbs/b07e8d20-5e0b-4133-acfd-8d8ea2f108af
9 News,US federal immigration agents shoot and injure two people in car outside hospital in Portland,https://www.9news.com.au/national/usa-portland-shooting-federal-agents-injure-two-people-inside-car-day-after-minneapolis-shooting/ca4c5131-584d-4db3-9ba1-f28d1eccdb53
9 News,'High' chance of cyclone as rain sweeps Queensland coast,https://www.9news.com.au/national/queensland-cyclone-warning-severe-weather-forecast-heavy-rain-updates/41d13e7e-3d9c-43f8-9326-da96909c22b6
9 News,'Like an atomic bomb': Small town unrecognisable as fire destroys homes,https://www.9news.com.au/national/victoria-bushfires-longwood-ruffy-unrecognisable-scenes/18de54ff-08d1-4ffb-b690-9c204acb4604
9 News,How a $70k DIY reno saved this 'disgusting' villa,https://www.domain.com.au/advice/real-renos-tarsha-iggy-caiaffa-1469692/?utm_source=9news.com.au&utm_medium=referral&utm_campaign=editorial-homepage-driver
9 News,"TODAY IN HISTORYTwelve survivors out of 20,000 at notorious prison",https://www.9news.com.au/world/today-in-history-january-10-what-happened-on-this-day-s21-cambodia-genocide/267e07e1-dc4b-411f-806b-61836e403c52
9 News,Aussie kids are officially booted from social media today. What now?,https://www.9news.com.au/national/social-media-ban-australia-penalties-children-platforms-explainer/63ac14f5-2bd8-4747-9622-e84f539b64c0
9 News,The little-known apps kids are switching to ahead of ban,https://www.9news.com.au/national/tiktok-instagram-alternatives-booming-as-australian-kids-switch-before-social-media-ban/a2950b1d-898e-467f-a9e4-744f1807a3ec
9 News,'The social media ban is the easy option. That's why it will fail',https://www.9news.com.au/national/social-media-ban-about-avoiding-the-truth/4ccfac45-9ee4-45e0-b189-d7b7b3aed2ea
9 News,The unlikely suburb where buyers spent $1 billion on property in 2025,https://www.domain.com.au/news/the-sydney-suburbs-where-home-buyers-splashed-the-most-cash-last-year-1471950/?utm_source=9news.com.au&utm_medium=referral&utm_campaign=editorial-homepage-driver
9 News,A Current AffairRoundabout chaos has drivers scratching their heads,https://9now.nine.com.au/a-current-affair/roundabout-chaos-has-drivers-scratching-their-heads/83133767-2485-49c5-8acc-9e706ec44eca
9 News,update'Nobody shied away': Bystanders jumped in to help family trapped in major crash,https://www.9news.com.au/national/banya-truck-crash-toddlers-fighting-for-life-sunshine-coast-queensland-news/46080911-594d-40e0-b9fa-5417220f902f
9 News,Fears Victorian bushfire could spread to NSW ahead of extreme heat conditions,https://www.9news.com.au/national/hottest-day-in-years-for-parts-of-southeastern-australia/12241c2a-8277-4d36-8c9b-a4a0917e02e3
9 News,Costco beer recalled over excessive amount of alcohol,https://www.9news.com.au/national/product-recall-loophole-brewing-company-pacific-ale-sold-at-costco-recalled-over-excessive-amount-of-alcohol/a0336048-f4ba-4f14-859e-c5e409692e7e
9 News,"Rio Tinto, Glencore in talks to merge, form $300 billion mining behemoth",https://www.9news.com.au/national/rio-tinto-glencore-in-talks-to-merge-mining-company-market-takeover-news/fb8402bb-d483-486b-bb20-f88b42738e8b
9 News,Prime Minister rejects criticism of former judge leading Bondi attack royal commission,https://www.9news.com.au/national/prime-minister-defends-bondi-beach-shooting-royal-commissioner-virginia-bell/4428e9b6-5efa-435b-9482-a0f299452120
9 News,Ice packs recalled over toxic substance concerns,https://www.9news.com.au/national/product-recall-australia-kmart-pulls-ankos-small-gel-pak-and-large-gel-pak-over-toxic-substance-concerns/eecfdc07-eeef-4f34-b39a-49484a2bba9c
9 News,Teen girl dies in horror crash south-west of Sydney,https://www.9news.com.au/national/teen-girl-dies-in-horror-crash-southwest-of-sydney-appin-new-south-wales-news/46d0d4db-025c-4331-b659-cc803913ee2e
9 News,Teen charged with attempted murder following alleged stabbing in Sydney's west,https://www.9news.com.au/national/teen-charged-with-attempted-murder-following-alleged-stabbing/c43ef877-c7d0-453a-8e85-282f08e89599
9 News,'Incomprehensible': Thieves steal lifeguard jet skis from waterfront yard,https://www.9news.com.au/national/incomprehensible-thieves-steal-lifeguard-jet-skis-from-beachside-yard/3550e71f-4ce8-4e89-b502-59dffb1e56bf
9 News,The $1 beach shack sale that ended in disaster,https://www.domain.com.au/news/beach-shack-with-1-reserve-back-on-market-in-new-zealand-1471880/?utm_source=9news.com.au&utm_medium=referral&utm_campaign=editorial-homepage-driver
9 News,Obscure rule allows Jack to live in a 500-year-old palace,https://www.domain.com.au/news/jack-lives-in-a-500-year-old-haunted-palace-1471822/?utm_source=9news.com.au&utm_medium=referral&utm_campaign=editorial-homepage-driver
9 News,Greenland and Denmark diplomats meet with White House officials as Trump seeks ownership,https://www.9news.com.au/world/top-diplomats-from-greenland-and-denmark-met-with-white-house-officials-as-trump-pushes-for-ownership/2df7db23-eacb-4180-8d76-cc227c98e921
9 News,Street protests erupt in Iran as nationwide anti-government turmoil spreads,https://www.9news.com.au/world/street-protests-erupt-in-tehran-as-nationwide-antigovernment-turmoil-spreads/bdb8a376-fdd4-4c00-888b-698fab530873
9 News,Was an ICE officer allowed to open fire at a driver? The rules explained,https://www.9news.com.au/world/what-to-know-about-the-rules-for-officers-firing-at-a-moving-vehicle/7e14e6b5-7dc4-4822-a177-ba9cf5b59f5c
9 News,Polar blast across Europe sends temperatures plunging as low as -33 degrees,https://www.9news.com.au/world/arctic-freeze-grips-britain-and-europe/d97d7db2-09e2-4b7e-af94-d16c1b014c76
9 News,Coach 'takes offence' to question from ex-England skipper,https://www.nine.com.au/sport/cricket/ashes-2026-brendon-mccullum-interview-england-coaching-methods-nasser-hussain-question-video/3b1e92f3-7aa9-4a66-8cc4-2b521c83c773
9 News,Smith explains 'random' new gesture as theory debunked,https://www.nine.com.au/sport/cricket/the-ashes-2026-steve-smith-hand-gesture-press-conference-jofra-archer-brydon-carse/9ee0875c-9c09-4089-80f0-2b8b9054ba96
9 News,Why four-game rookie 'holds the key' for Raiders,https://www.nine.com.au/sport/nrl/news-2025-the-mole-canberra-raiders-best-17-squad-team-selection-analysis/0c721eff-1584-4dba-8c8b-665eab577463
9 News,Bozza: My warning to 'old friend' before taking United job,https://www.nine.com.au/sport/football/premier-league-2026-mark-bosnich-exclusive-column-manchester-united-coach-sacked-gareth-southgate-ruben-amorim/4b5a0457-8cec-4e79-bba1-f4f37b88f6dd
9 News,ECB slammed for sweeping Brook incident 'under the carpet',https://www.nine.com.au/sport/cricket/the-ashes-2026-harry-brook-new-zealand-bouncer-incident-behaviour-issues/a606a500-636c-4bea-9974-5bc7e79de3bd
9 News,Aussie teen's plan to upset world No.2 in crunch Cup clash,https://www.nine.com.au/sport/tennis/united-cup-2026-quater-final-australia-poland-maya-joint-iga-swiatek/5fdb2706-376a-48ef-a33a-dfe4fae58b6c
9 News,'Cult' of 'arrogance' could end three England careers,https://www.nine.com.au/sport/cricket/the-ashes-2026-news-england-reaction-michael-vaughan-geoffrey-boycott-ben-stokes-brendon-mccullum-rob-key-sacked-changes/d0b0e372-ce3f-43ee-bd5d-747be4a59804
9 News,Surprise pick crowned Australia's number one Christmas song,https://9now.nine.com.au/today/surprise-christmas-song-tops-today-show-poll/9ad476cc-917e-45e5-9bdf-edb687bd7daa
9 News,First look at Christopher Nolan's The Odyssey,https://9now.nine.com.au/today/the-odyssey-christopher-nolan-film-first-look-entertainment-news-on-december-23/ebcfb14c-a6db-443b-b14d-98fb4ea3b0ae
9 News,Crowded House to perform at action-packed Australian Open,https://9now.nine.com.au/today/crowded-house-to-perform-australian-open-other-entertainment-news-december-22/bdfd61f4-f211-4a45-868f-4ceb07eca37c
9 News,Roundabout chaos has drivers scratching their heads,https://9now.nine.com.au/a-current-affair/roundabout-chaos-has-drivers-scratching-their-heads/83133767-2485-49c5-8acc-9e706ec44eca
9 News,Famous 250-year-old drink experiences surprising new boom,https://9now.nine.com.au/a-current-affair/guinness-drink-experiences-surprising-new-boom/a0d8cfee-4f98-481b-a17d-b59f225dac9a
9 News,Football player's fight to overturn 20-year ban from the game he loves,https://9now.nine.com.au/a-current-affair/football-player-matthew-neans-fight-to-overturn-20-year-ban-from-the-game-he-loves/a34c05b4-ce15-4407-9719-6a15d747344d
9 News,CCTV provides vital clues into death of young Australian in Bali,https://9now.nine.com.au/60-minutes/byron-haddow-bali-cctv-footage-provides-vital-clues-into-the-death-of-young-australian-villa/5e7278d1-f714-4c34-9aea-afdfea0deaee
9 News,Families of four airmen killed in Taipan chopper crash break silence,https://9now.nine.com.au/60-minutes/taipan-families-of-four-airmen-killed-helicopter-crash-accuse-army/46e8e75d-f438-46b1-a76d-47d7110b572f
9 News,Sanna Marin: The partying prime minister who stood up against Russia,https://9now.nine.com.au/60-minutes/finland-sanna-marin-partying-prime-minister-who-stood-up-against-russia/49abe402-f6b5-4496-9669-a6b7536ea953
9 News,Couple arrive home to find nasty note taped to their door,https://www.domain.com.au/news/couple-confronted-by-rude-note-eight-hours-after-picking-up-apartment-keys-1414069/?utm_source=nine.com.au&utm_medium=referral&utm_campaign=editorial-homepage-driver
9 News,The last affordable suburb in Sydney revealed,https://www.domain.com.au/news/girraween-the-closest-suburb-to-sydneys-cbd-for-under-1-million-is-24km-away-1408376/?utm_source=nine.com.au&utm_medium=referral&utm_campaign=editorial-homepage-driver
9 News,The unusual reason Peter bought this derelict cottage,https://www.domain.com.au/news/i-collected-it-peter-bought-this-run-down-riverside-nz-cottage-for-nostalgia-1414033/?utm_source=nine.com.au&utm_medium=referral&utm_campaign=editorial-homepage-driver
9 News,"Jeep's rise and fall in Australia, and what's around the corner",https://www.drive.com.au/news/jeeps-rise-and-fall-in-australia-and-whats-around-the-corner/?utm_source=nine-rail&utm_medium=referral
9 News,Electric cars launching in Australia in 2026,https://www.drive.com.au/news/electric-cars-launching-in-australia-in-2026/?utm_source=nine-rail&utm_medium=referral
9 News,"Toyota, Nissan and Volkswagen models lose safety stars in new crash testing",https://www.drive.com.au/news/toyota-nissan-and-volkswagen-models-lose-safety-stars-in-new-crash-testing/?utm_source=nine-rail&utm_medium=referral
9 News,Hundreds of firefighters on standby as Sydney tops 40 degrees11 minutes ago,https://www.9news.com.au/national/sydney-set-for-intense-heat/99df6d08-5ded-4d24-a90e-1eb77a0307d2
9 News,"Medical student, 21, dies a month after Sydney police pursuit crash39 minutes ago",https://www.9news.com.au/national/lidija-faamau-liverpool-crash-woman-dies-sydney-nsw/7422332d-3afb-4437-a01d-302cbbbd8aab
9 News,Boy drowns in pool on NSW mid north coastan hour ago,https://www.9news.com.au/national/boy-dies-after-drowning-in-pool-on-nsw-mid-north-coast/39596206-c3b9-4a8d-88aa-fadb4c568668
9 News,Man shot dead inside unit in Sydney's westan hour ago,https://www.9news.com.au/national/man-shot-dead-in-sydneys-west/08568cfa-02c3-4f5a-88ca-289a27f1b10f
9 News,"Fires to burn 'for days, if not weeks', emergency boss warnsan hour ago",https://www.9news.com.au/national/live-updates-victoria-fires-heatwaves-nsw-evacuations-warnings-queensland-cyclone-australia-news/83f99d75-21ac-420c-b716-4b02168bebd9
9 News,'Whether they like it or not': Donald Trump's threat to Greenland,https://www.9news.com.au/world/donald-trump-greenland-takeover-threat-china-russia/9815c98e-11de-4c64-a9d3-681e2df422b6
9 News,'High' chance of cyclone as rain sweeps Queensland coast,https://www.9news.com.au/national/queensland-cyclone-warning-severe-weather-forecast-heavy-rain-updates/41d13e7e-3d9c-43f8-9326-da96909c22b6
9 News,Woman charged following dangerous motorway stunt,https://www.9news.com.au/national/driver-charged-following-dangerous-motorway-stunt/f20f59e5-81f9-4c38-a584-4c6f1eb39e13
9 News,How a $70k DIY reno saved this 'disgusting' villa,https://www.domain.com.au/advice/real-renos-tarsha-iggy-caiaffa-1469692/?utm_source=9news.com.au&utm_medium=referral&utm_campaign=editorial-homepage-driver
9 News,ICE agent's phone captures fatal confrontation in Minneapolis,https://www.9news.com.au/world/minneapolis-ice-shooting-renee-good-jonathan-ross-jd-vance-video/bf3fbd72-fc95-4a5f-a58e-ef20fd98315b
Guardian,"Attempt to overturn the Gambia""s ban on FGM heard by supreme court",https://www.theguardian.com/global-development/2026/jan/09/the-gambia-female-genital-mutilation-fgm-supreme-court-case-overturn-ban
Guardian,"Two weeks on, questions linger over targeting and impact of US airstrikes in Nigeria ",https://www.theguardian.com/world/2026/jan/08/questions-targeting-impact-us-airstrikes-in-nigeria
Guardian,"Anthony Joshua""s driver charged with dangerous driving after fatal crash in Nigeria",https://www.theguardian.com/world/2026/jan/02/anthony-joshuas-driver-charged-with-dangerous-driving-after-fatal-crash-in-nigeria
Guardian,"Cremation pyre in Africa thought to be world""s oldest containing adult remains ",https://www.theguardian.com/science/2026/jan/01/cremation-pyre-in-africa-thought-to-be-worlds-oldest-containing-adult-remains
Guardian,"US ""adapt, shrink or die"" terms for $2bn aid pot will mean UN bowing down to Washington, say experts",https://www.theguardian.com/global-development/2026/jan/01/us-aid-cuts-conditions-un-humanitarian-pledge-ocha
Guardian,"Trump promises oil companies ""total safety"" in Venezuela as he urges them to invest billions",https://www.theguardian.com/us-news/2026/jan/09/trump-oil-company-executives-meeting-venezuela
Guardian,Trump claims he has cancelled second wave of attacks on Venezuela,https://www.theguardian.com/world/2026/jan/09/trump-venezuela-leadership-meeting-opposition-machado
Guardian,EU states back controversial Mercosur deal with Latin American countries,https://www.theguardian.com/world/2026/jan/09/eu-states-back-controversial-mercosur-deal-with-latin-american-countries
Guardian,US military forces seize fifth tanker in effort to control Venezuelan oil,https://www.theguardian.com/world/2026/jan/09/us-venezuela-oil-tanker-seizure
Guardian,"Venezuela begins releasing political detainees to ""consolidate peace""",https://www.theguardian.com/world/2026/jan/08/venezuela-to-release-important-number-of-detainees
Guardian,Alleged scam kingpin Chen Zhi arrives in China after extradition from Cambodia,https://www.theguardian.com/world/2026/jan/08/alleged-scam-kingpin-chen-zhi-extradited-china-cambodia-arrest
Guardian,Anger in Papua New Guinea after Starlink ordered to shut down internet services,https://www.theguardian.com/world/2026/jan/06/papua-new-guinea-internet-starlink-shut-down
Guardian,"What does the US raid in Venezuela mean for China""s designs on Taiwan?",https://www.theguardian.com/world/2026/jan/06/what-us-action-in-venezuela-means-for-taiwan
Guardian,"Trump""s attack leaves China worried about its interests in Venezuela",https://www.theguardian.com/world/2026/jan/05/venezuela-trump-attack-china-interests-analysis
Guardian,'Tuna King' pays record £2.4m for giant bluefin at Tokyo auction,https://www.theguardian.com/world/2026/jan/05/giant-bluefin-tuna-sold-record-amount-tokyo-auction-kiyoshi-kimura
Guardian,Australia heatwave live updates: Victorian bushfires raze scores of properties as new warnings issued; temperatures climb in Sydney,https://www.theguardian.com/australia-news/live/2026/jan/10/australia-heatwave-updates-sydney-temperature-victorian-fires-bushfire-latest
Guardian,"More than 100 buildings destroyed and 300,000 hectares burned as Victoria""s bushfires rage",https://www.theguardian.com/australia-news/2026/jan/09/ten-properties-in-ruffy-destroyed-including-firefighters-home-as-fire-hits-victorian-town-like-a-bomb
Guardian,"With a new leader and tired opponent, this should be the Victorian Liberals"" year "" if not for self-inflicted wounds ",https://www.theguardian.com/australia-news/2026/jan/10/victorian-liberals-year-ahead-new-leader-jess-wilson
Guardian,"""Toughest conditions imaginable"": Victorians urged to shelter inside from heatwave as tropical cyclone heads for Queensland",https://www.theguardian.com/environment/2026/jan/09/heatwave-engulfs-south-eastern-states-as-victoria-faces-catastrophic-bushfire-conditions-not-seen-since-black-summer
Guardian,Almost 50 writers boycott Adelaide festival after it dumps pro-Palestine academic Randa Abdel-Fattah,https://www.theguardian.com/culture/2026/jan/09/adelaide-festival-boycott-pro-palestine-academic-randa-abdel-fattah-ntwnfb
Guardian,"Trump ramps up Greenland threats and says US will intervene ""whether they like it or not""",https://www.theguardian.com/us-news/2026/jan/09/trump-greenland-threats-white-house
Guardian,"Le Constellation bar co-owner arrested as Switzerland honours victims of Crans-Montana fire "" as it happened",https://www.theguardian.com/world/live/2026/jan/09/ukraine-russia-tanker-fleet-meloni-switzerland-fire-greenland-europe-latest-news-updates
Guardian,"""An incomprehensible nightmare"": grief turns to anger over Swiss bar fire as Le Constellation owner arrested",https://www.theguardian.com/world/2026/jan/09/swiss-bar-fire-le-constellation-owner-arrested
Guardian,Germany braces for more heavy snowfall as Storm Goretti hits northern Europe,https://www.theguardian.com/world/2026/jan/09/storm-goretti-germany-heavy-snowfall-strong-winds-france-northern-europe
Guardian,"Anonymous painting bought at auction on ""hunch"" identified as two-in-one Rubens",https://www.theguardian.com/artanddesign/2026/jan/09/anonymous-painting-bought-at-auction-on-hunch-identified-as-two-in-one-rubens
Guardian,"Iran""s supreme leader sets stage for harsher crackdown as protest movement swells",https://www.theguardian.com/global-development/2026/jan/09/iran-supreme-leader-harsher-crackdown-protest-movement-swells
Guardian,Growing protests in Iran do not necessarily herald a return to monarchy,https://www.theguardian.com/world/2026/jan/09/growing-protests-in-iran-do-not-necessarily-herald-a-return-to-monarchy
Guardian,Syrian army says it will renew Aleppo attacks after Kurds reject ceasefire terms ,https://www.theguardian.com/world/2026/jan/09/syria-announces-ceasefire-aleppo-clashes-kurds
Guardian,"""In isolation, we""ll never flourish"": What Iranians think about the protests and an end to the Islamic Republic",https://www.theguardian.com/global-development/ng-interactive/2026/jan/09/in-isolation-well-never-flourish-what-iranians-think-about-the-protests-and-an-end-to-the-islamic-republic
Guardian,Home Office tells Gaza academic his bid to bring family to UK not urgent,https://www.theguardian.com/politics/2026/jan/09/home-office-gaza-academic-bassem-abudagga-family
Guardian,Indian police raid home of environmental activists over anti-fossil fuel campaign,https://www.theguardian.com/world/2026/jan/07/indian-police-raid-home-of-environmental-activists-over-anti-fossil-fuel-campaign
Guardian,"Ministers cannot go on ignoring the Shamima Begum case, for two important reasons",https://www.theguardian.com/uk-news/2026/jan/02/ministers-cannot-go-on-ignoring-the-shamima-begum-case-for-two-important-reasons
Guardian,"Sewage in drinking water blamed for at least 10 deaths in India""s ""cleanest city""",https://www.theguardian.com/world/2026/jan/02/sewage-in-drinking-water-deaths-india-cleanest-city-indore
Guardian,"Khaleda Zia, first female Bangladesh prime minister, dies aged 80",https://www.theguardian.com/world/2025/dec/30/khaleda-zia-first-female-bangladesh-prime-minister-dies-aged-80
Guardian,Polls close in first phase of Myanmar elections widely condemned as a sham,https://www.theguardian.com/world/2025/dec/28/myanmar-elections-voting-begins-under-junta-stranglehold-with-aung-san-suu-kyi-banned
Guardian,"Zarah Sultana""s Your Party membership launch may be ""criminal"" matter for police, ICO says",https://www.theguardian.com/politics/2026/jan/09/zarah-sultana-your-party-unauthorised-membership-portal-launch-may-have-been-serious-criminal-act
Guardian,Storm Goretti batters UK with heavy winds and snow,https://www.theguardian.com/uk-news/2026/jan/09/storm-goretti-uk-weather-warning-snow-wind
Guardian,University of Glasgow rector cleared by medical watchdog over alleged antisemitism,https://www.theguardian.com/uk-news/2026/jan/09/university-glasgow-rector-ghassan-abu-sitta-cleared-misconduct-medical-watchdog-alleged-antisemitism
Guardian,Reform UK accused of betraying election pledges after council tax rises,https://www.theguardian.com/politics/2026/jan/09/reform-uk-accused-of-betraying-election-pledges-after-council-tax-rises
Guardian,"Storm Goretti: rail services suspended, flights cancelled and schools closed across UK "" as it happened",https://www.theguardian.com/uk-news/live/2026/jan/09/storm-goretti-live-news-updates-uk-weather-snow-latest-met-office-warnings
Guardian,Federal immigration officers pull out of Louisiana to head to Minneapolis,https://www.theguardian.com/us-news/2026/jan/09/federal-immigration-officers-louisiana-minneapolis
Guardian,"Trump threatens Greenland and Iran at meeting with oil bosses on Venezuela "" US politics live",https://www.theguardian.com/us-news/live/2026/jan/09/trump-venezuela-oil-attacks-minnesota-portland-ice-supreme-court-tariffs-latest-news-updates
Guardian,Maryland woman who says she is US citizen finally released from ICE custody,https://www.theguardian.com/us-news/2026/jan/09/maryland-woman-us-citizen-released-ice-custody
Guardian,"Renee Nicole Good said ""I""m not mad at you"" before ICE agent shot her, video shows",https://www.theguardian.com/us-news/2026/jan/09/ice-agent-minneapolis-bodycam-footage
Guardian,"Washington National Opera to move out of Kennedy Center after Trump ""takeover""",https://www.theguardian.com/us-news/2026/jan/09/washington-national-opera-kennedy-center
