Section,Headline,Link
Guardian,Pennsylvania official faces threats over post she says was misconstrued as Charlie Kirk killing celebration,https://www.theguardian.com/us-news/2025/sep/23/pennsylvania-school-board-official-post-charlie-kirk-killing
Guardian,"Donald Trump signs order designating antifa as a domestic terror organization "" as it happened",https://www.theguardian.com/us-news/live/2025/sep/22/donald-trump-charlie-kirk-autism-us-politics-live-news-updates
ABC,"In the West Bank, Palestinians have mixed feelings about the growing statehood push",https://www.abc.net.au/news/2025-09-23/palestinians-react-to-statehood-recognition-australia-un/105805514
ABC,'I stood still': The night-time stalker that terrorised 10yo Siraj in Gaza,https://www.abc.net.au/news/2025-09-23/children-living-in-gaza/105789464
ABC,How airport schooner helped police capture Sydney's 'Night Stalker',https://www.abc.net.au/news/2025-09-23/moore-park-rapist-glenn-cameron-pleads-guilty-sexual-assaults/105806986
ABC,Vanuatu to sign China police deal as security pact with Australia lies in limbo,https://www.abc.net.au/news/2025-09-23/china-vanuatu-police-agreement-equipment-training/105806934
ABC,Pest found in nappy pants could cost grains industry $15b if not contained,https://www.abc.net.au/news/2025-09-23/khapra-beetle-15b-dollar-threat-to-grains-industry/105807350
ABC,Hawthorn's Mabior Chol free to play in 2026 after three-match ban is overturned,https://www.abc.net.au/news/2025-09-23/hawthorn-mabior-chol-afl-tribunal-hearing/105808298
ABC,"White House all but confirms no meeting between Albanese, Trump",https://www.abc.net.au/news/2025-09-23/meeting-unlikely-between-albanese-and-trump/105804978
ABC,What happened in the hours between Optus's outage and public notification,https://www.abc.net.au/news/2025-09-23/timeline-on-optus-triple-0-outage-what-we-know/105805890
ABC,Former AFLW player alleges she was spat at during local league grand final,https://www.abc.net.au/news/2025-09-23/former-aflw-player-alleges-she-was-spat-at-local-grand-final/105807282
ABC,"More Perth teens sentenced for bashing, torture of men lured on Grindr",https://www.abc.net.au/news/2025-09-23/teenagers-detention-grindr-attacks-men-perth/105807670
ABC,NSW Police officer charged with assault over arrest of former Greens candidate,https://www.abc.net.au/news/2025-09-23/nsw-officer-charged-assault-hannah-thomas-greens-arrest/105805966
ABC,Judge finds businessman had 'magic pudding' approach to valuing company,https://www.abc.net.au/news/2025-09-23/dave-hodgson-queensland-businessman-asic/105806258
ABC,Watchdog takes insurer to court over 'misleading' renewal notices,https://www.abc.net.au/news/2025-09-23/racq-insurance-premiums-regulator-action/105805622
ABC,The key change that could make Sydney train commuters' lives easier,https://www.abc.net.au/news/2025-09-23/nsw-sydney-trains-communication-issues-new-report/105806734
ABC,'Not a scintilla of reasonable doubt': Court rejects killer couple's appeal,https://www.abc.net.au/news/2025-09-23/cedric-noelene-jordan-lose-appeal-over-murder-sentence/105807794
ABC,Mother found guilty of murdering two children found in suitcases,https://www.abc.net.au/news/2025-09-23/nz-suitcase-verdict-hakyung-lee-trial/105658224
ABC,Court hears girl to stand trial for murder told mother she 'stabbed a paedo',https://www.abc.net.au/news/2025-09-23/girl-to-stand-trial-for-alleged-hervey-bay-caravan-park-murder/105805474
ABC,Rare nitazene found in Canberra believed to be Australian first,https://www.abc.net.au/news/2025-09-23/illicit-substance-detected-in-single-pill-in-australia-first/105806232
ABC,"Diddy's lawyers pitch shorter prison term, therapy ahead of sentence",https://www.abc.net.au/news/2025-09-23/sean-diddy-combs-lawyers-try-to-impose-14-month-sentence/105807480
ABC,ICC charges Philippines former leader with crimes against humanity,https://www.abc.net.au/news/2025-09-23/icc-prosecutors-charge-duterte-3-counts-crimes-against-humanity/105806448
ABC,Eighth murder charge laid following boys' stabbing deaths,https://www.abc.net.au/news/2025-09-23/eighth-person-charged-cobblebank-murder-dau-akueng/105806430
ABC,Storm include injured star Hughes with NRL grand final on the line,https://www.abc.net.au/news/2025-09-23/storm-jahrome-hughes-against-cronulla-broncos-panthers/105808480
ABC,Egyptian activist who helped Peter Greste released from jail,https://www.abc.net.au/news/2025-09-23/egyptian-activist-alaa-abd-el-fattah-released-from-prison/105805902
ABC,'They can't sleep': Humming sound keeping Sydney residents awake,https://www.abc.net.au/news/2025-09-23/epa-investigates-disturbing-hum-sound-parramatta/105805278
ABC,Concerns illegal cigarettes easy to access and cheaper,https://www.abc.net.au/news/2025-09-23/act-easy-access-to-illegal-cigarettes-seeing-high-smoking-rates/105803450
ABC,Qld women denied chosen miscarriage care say it's like something from the US,https://www.abc.net.au/news/2025-09-23/qld-mater-miscarriage-care-catholic-hospital-abortion/105781022
ABC,A check of Tasmania's school attendance levels shows why experts are concerned,https://www.abc.net.au/news/2025-09-23/tasmania-school-attendance-level-concerns/105770010
ABC,How the ANU's interim leader wants to turn its reputation around,https://www.abc.net.au/news/2025-09-22/interim-vice-chancellor-rebekah-brown-interview-plan-reputation/105800874
ABC,Why some pensioners might notice a slight drop in their next payment,https://www.abc.net.au/news/2025-09-23/deeming-rate-freeze-ends-impact-on-pension-payments/105798966
ABC,Ley writes to Republicans on Gaza ahead of Albanese's UN address,https://www.abc.net.au/news/2025-09-22/albanese-un-palestine-address-ley-republican-letter/105803078
ABC,More customers caught in triple-0 failure as Optus awaits 'consequences',https://www.abc.net.au/news/2025-09-22/optus-investigation-triple-0-outage/105800556
ABC,This program could be a blueprint for keeping kids off the streets,https://www.abc.net.au/news/2025-09-22/homeless-kids-domestic-violence-solution-politics/105793902
ABC,"Myanmar junta revoking citizenship of actors, singers and other celebrities",https://www.abc.net.au/news/2025-09-23/myanmar-celebrities-left-stateless-after-criticising-junta/105787574
ABC,"Typhoon Ragasa triggers alerts across Philippines, Taiwan and Hong Kong",https://www.abc.net.au/news/2025-09-22/typhoon-ragasa-closes-hong-kong-airport-suspends-flights/105803976
ABC,Police clash with pro-Palestinian protesters in Italy,https://www.abc.net.au/news/2025-09-23/pro-palestinian-protests-in-italy/105804908
ABC,Moldova arrests 74 over alleged Russia-backed plot for unrest around election,https://www.abc.net.au/news/2025-09-23/moldova-election-arrests-russia-backed-plot/105804776
ABC,"ASX rises again as gold miners rally, Myer slumps on large loss — as it happened",https://www.abc.net.au/news/2025-09-23/asx-markets-business-live-news-sept23-2025/105805154
ABC,'Biggest gold rush' with AI set to revolutionise Australian economy,https://www.abc.net.au/news/2025-09-23/australias-future-economy-will-be-dominated-by-ai/105802364
ABC,Australians lay dead as investors of Optus's parent company bought shares,https://www.abc.net.au/news/2025-09-23/three-australians-lay-dead-investors-buy-up-shares/105803922
ABC,CEO quizzed over bonuses after increase in childcare centre breaches,https://www.abc.net.au/news/2025-09-23/nsw-childcare-inquiry-ceo-questioned-over-bonuses/105805562
ABC,The Nasiah moment that showed the AFL has a serious Brownlow Medal problem,https://www.abc.net.au/news/2025-09-23/afl-matt-rowell-nasiah-moment-brownlow-medal-voting-analysis/105804320
ABC,Sharks star reveals players were 'at each other's throats' before revival,https://www.abc.net.au/news/2025-09-23/nrl-siosifa-talakai-cronulla-sharks-season-revival/105806244
ABC,Lachie Neale trains as Lions' grand final return gathers pace,https://www.abc.net.au/news/2025-09-23/neale-trains-as-lion-s-grand-final-return-hopes-gather-pace/105806698
ABC,"Dembélé beats Yamal, Salah to Ballon d'Or as Bonmatí joins rare club",https://www.abc.net.au/news/2025-09-23/football-ousmane-dembele-ballon-d-or-bonmati-salah-yamal/105805184
ABC,"As a doctor, I bang on about self-care — I'm finally taking my own advice",https://www.abc.net.au/news/2025-09-23/doctor-choosing-self-care-over-resilience/105728568
ABC,Five easy and healthy spring dinners,https://www.abc.net.au/news/2025-09-22/easy-healthy-recipes-for-spring-dinners/105660408
ABC,How to tackle an overcrowded and overwhelming wardrobe,https://www.abc.net.au/news/2025-09-21/how-to-spring-clean-wardobe-clean-out/105780140
ABC,One-tray honey chicken wings are an easy family dinner,https://www.abc.net.au/news/2025-09-20/one-tray-sticky-chicken-wings/105658174
ABC,"Farming, music and philanthropy — there's more than just six degrees of Kevin Bacon",https://www.abc.net.au/news/2025-09-23/kevin-bacon-take-5-actor-music-philanthropy-interview/105793360
ABC,Two giants of 20th-century photography appear together in new exhibition,https://www.abc.net.au/news/2025-09-23/man-ray-max-dupain-photography-exhibition-heide-melbourne/105790024
ABC,'Turning it up to eleven': Spinal Tap returns,https://www.abc.net.au/news/2025-09-22/turning-it-up-to-eleven-spinal-tap-returns/105792970
ABC,Scrubs is getting a reboot just in time for the hospital procedural revival,https://www.abc.net.au/news/2025-09-21/scrubs-reboot-the-pitt-cheat-sheet/105793612
Sky News,"""Humiliating': Donald Trump continues snubbing Anthony Albanese",https://www.skynews.com.au/opinion/chris-kenny/humiliating-donald-trump-continues-snubbing-anthony-albanese/video/532936cebe58eebd3376a453a128fca3
Sky News,"""Mutual aversion' between Trump and Albanese potentially over Palestinian recognition",https://www.skynews.com.au/opinion/peta-credlin/mutual-aversion-between-trump-and-albanese-potentially-over-palestinian-recognition/video/6513ce911a3a35d5ff7e762a47b77142
Sky News,"""Rewarding terrorists': Albanese goes ""rogue' on foreign policy",https://www.skynews.com.au/opinion/rewarding-terrorists-albanese-goes-rogue-on-foreign-policy/video/480a19aaa003766dde6d04adf4e7a3bb
Sky News,"Anthony Albanese officially a ""reject' after getting ""friend zoned' by Donald Trump",https://www.skynews.com.au/opinion/anthony-albanese-officially-a-reject-after-getting-friend-zoned-by-donald-trump/video/ff9cbe2024b2f074eece96e468a4a3f4
Sky News,"""Nothing to see here': Airbus Albo lands at the UN",https://www.skynews.com.au/opinion/paul-murray/nothing-to-see-here-airbus-albo-lands-at-the-un/video/ec13628a270a519bb9c5f16daa5819a3
Sky News,"Angelina Jolie says she ""doesn't recognise' America after Jimmy Kimmel drama",https://www.skynews.com.au/opinion/rita-panahi/angelina-jolie-says-she-doesnt-recognise-america-after-jimmy-kimmel-drama/video/04bc48a573271e46c3b861a4d35444df
Sky News,Morrison: The reason Albanese is yet to meet Trump,https://www.skynews.com.au/australia-news/politics/scott-morrison-warns-anthony-albaneses-foreign-policy-missteps-are-a-key-reason-albanese-hasnt-met-donald-trump/news-story/0198db0e836e43ef212baab13588750c
Sky News,"Sydney uni refuses to confirm if it sacked lecturer who said he wanted Zionists ""executed'",https://www.skynews.com.au/australia-news/politics/university-of-sydney-refuses-to-say-whether-it-sacked-lecturer-fahad-ali-after-he-tweeted-he-wanted-zionists-executed/news-story/98de2841a540244b2788a99efa4c5dda
Sky News,246 days and counting: Sky News analysis exposes PM's historically bad relationship with Trump,https://www.skynews.com.au/insights-and-analysis/246-days-and-counting-how-trumps-snub-of-albanese-compares-with-previous-prime-ministers-who-dealt-with-the-us-president/news-story/9cc8819c202b41d1b6a9424f6287099c
Sky News,"""Probably never necessary': Brett Sutton's bombshell Covid lockdown admission",https://www.skynews.com.au/australia-news/politics/probably-never-necessary-victoria-former-chief-health-officer-brett-suttons-bombshell-admission-about-andrews-governments-covid-response/news-story/119a9f3f761103e4e61018e0d782f25e
Sky News,Fortescue winds back mentions of hydrogen from climate report after axing projects,https://www.skynews.com.au/business/energy/fortescue-winds-back-mentions-of-hydrogen-from-climate-report-after-axing-major-projects-in-queensland-alaska/news-story/93d8b61481e349ad2c02b5192b0fff77
Sky News,"Aussie woman's warning after trying to buy a ""new mattress' on Facebook Marketplace",https://www.skynews.com.au/lifestyle/giant-neon-red-flag-aussie-womans-warning-after-trying-to-buy-a-new-mattress-on-facebook-marketplace/news-story/9ca702649b6279e970ee47f2336757ac
Sky News,Israel initiated phone call with Opposition Leader Sussan Ley,https://www.skynews.com.au/australia-news/sussan-ley-pens-defiant-letter-to-us-politicians-opposing-albanese-govts-palestinian-state-recognition/live-coverage/74ab02a0ef804f2ed0a5d729d649fe7d
Sky News,Woman arrested after allegedly storming into Sydney bank with knife,https://www.skynews.com.au/australia-news/crime/police-arrest-38yearold-woman-after-allegedly-storming-into-sydney-bank-with-knife/news-story/bfa1d5c4a144ee6c65e1b41675d99a24
Sky News,"""Clearly sending Anthony Albanese a message': PM under fire after another Trump snub",https://www.skynews.com.au/australia-news/politics/anthony-albanese-misses-out-on-securing-bilateral-meeting-with-united-states-president-donald-trump-in-new-york/news-story/80176db6f79d8e03e75f5083f10e5611
Sky News,Man charged after dog thrown from police vehicle in collision,https://www.skynews.com.au/australia-news/crime/man-charged-after-dog-thrown-from-police-vehicle-after-collision-with-mercedes/news-story/13646150581f30bc18be346e3a74a8fc
Sky News,Millions in major city to cop eye-watering bill hike amid cost-of-living crunch,https://www.skynews.com.au/australia-news/politics/millions-of-sydneysiders-set-to-cop-mammoth-water-bill-hike-as-authorities-flag-future-price-increases/news-story/979078912a62dcab2df845ac80d67244
Sky News,New study reveals major health impact of cost of living crisis,https://www.skynews.com.au/australia-news/new-study-reveals-major-health-impact-of-cost-of-living-crisis-as-76-per-cent-of-australians-attempt-to-cut-costs/news-story/e009683676886a85f7acd4457729a1a7
Sky News,"Prince Archie and Princess Lilibet unaware they're royals, sources claim",https://www.skynews.com.au/lifestyle/celebrity-life/prince-archie-and-princess-lilibet-completely-unaware-theyre-royals-as-parents-prince-harry-and-meghan-markle-keep-major-identity-secret-sources-claim/news-story/166a156a6321d46cf57924cceaaf0a48
Sky News,"""Pick up again': Major warning for Aussies still struggling with price pains",https://www.skynews.com.au/business/finance/major-warning-for-aussies-still-struggling-with-price-pains-after-rba-governor-admits-postpandemic-inflation-will-not-reverse/news-story/04bda6944b96359375028626d6cda537
Sky News,Why this toy car in Bondi Junction apartment car park sparked neighbourhood war,https://www.skynews.com.au/lifestyle/trending/eastern-suburbs-neighbour-war-erupts-after-afluent-mum-takes-up-apartment-parking-spot-with-childs-toy-convertible/news-story/3be8ffaa6e4e2c4479748248b20ca7c5
Sky News,"""Be a little kinder': I dare Fatima Payman to sling her mud at Kirk in front of his widow",https://www.skynews.com.au/insights-and-analysis/james-bolt-i-dare-fatima-payman-and-hannah-ferguson-to-sling-their-mud-at-charlie-kirk-in-front-of-his-widow/news-story/3f7ce15c731cd86482eefa2ec033d8c4
Sky News,"""When prophecy fails': Why it's not too late for Bowen to say he's been wrong all along",https://www.skynews.com.au/insights-and-analysis/when-prophesy-fails-chris-bowens-2035-climate-target-a-mere-desperate-attempt-to-rescue-faulty-hypothesis/news-story/1c7d32aa66192bce1d5aba0968d45b84
Sky News,"Self-help movement Meghan ascribes to peddles nonsensical ""words of wisdom'",https://www.skynews.com.au/insights-and-analysis/modern-selfhelp-movement-meghan-markle-ascribes-to-touts-nonsensical-words-of-wisdom-that-sell-by-the-bucketload/news-story/2e16524929b8fb4a81d46b7169597b76
Sky News,"Nicolas Maduro training Venezuelans for ""militia,' Trump says, as poll shows support for regime change",https://www.skynews.com.au/world-news/global-affairs/nicolas-maduro-training-venezuelans-for-militia-donald-trump-says-as-poll-shows-support-for-regime-change-in-caracas/news-story/00f694312d7a54537b67cef11a5d37c7
Sky News,"Man allegedly kept four adults captive in basement for 10 years, stole their money",https://www.skynews.com.au/world-news/united-states/fiend-allegedly-kept-four-adults-captive-in-his-south-carolina-basement-for-over-10-years-abused-them-and-stole-their-money/news-story/7e31be3d78d91ccbb8cca26c2632a8d9
Sky News,"Video shows plane plummeting to ground, killing Mexican TV host",https://www.skynews.com.au/world-news/global-affairs/video-shows-plane-plummeting-to-ground-killing-mexican-tv-host-taking-a-flying-lesson/news-story/508309fefce7265e285f6b16d38f67f9
Sky News,"Jill Biden's ex-spokesman reveals ""cult' of ""mean girls' ruled White House",https://www.skynews.com.au/world-news/united-states/jill-bidens-exspokesman-reveals-cult-of-mean-girls-ruled-white-house/news-story/c2c285b2c1ff6738dd702fa8af63adb9
Sky News,Kirk's Turning Point USA urges ABC affiliates not to carry Kimmel show,https://www.skynews.com.au/world-news/united-states/charlie-kirks-turning-point-usa-urges-abc-affiliates-not-to-carry-jimmy-kimmel-show-when-it-returns-to-air/news-story/dc2275aad426c29d7699da4cdd6fbc6a
Sky News,Trump backs form of folic acid as new treatment for autism,https://www.skynews.com.au/world-news/united-states/trump-administration-suggests-leucovorin-as-treatment-after-claiming-paracetamol-use-during-pregnancy-linked-to-autism/news-story/c317905f9a2163d6cfef1a802ab6161d
Sky News,"""A revival of faith': Kirk's friend on what his assassination has sparked",https://www.skynews.com.au/world-news/united-states/a-revival-of-faith-charlie-kirks-friend-explains-us-spiritual-reawakening-following-his-assassination/news-story/c27d9e57a413abcb87aa00862aff965d
Sky News,FBI probes troubling questions over Charlie Kirk assassination,https://www.skynews.com.au/world-news/united-states/charlie-kirk-assassination-fbi-probes-troubling-and-lingering-questions-popularised-by-online-sleuths/news-story/9a5e894ea748c134a626965e42110c23
Sky News,Outrage sparks over reports showing university executives earn more than $1 million a year,https://www.skynews.com.au/opinion/outrage-sparks-over-reports-showing-university-executives-earn-more-than-1-million-a-year/video/035c208ce8031ae449593da42a2f7e21
Sky News,"""He loved it': Nigel Farage weighs in on Trump's ""magnificent' UK trip",https://www.skynews.com.au/opinion/paul-murray/he-loved-it-nigel-farage-weighs-in-on-trumps-magnificent-uk-trip/video/ba8de651d866aa14b3a087eb1f035b0c
Sky News,"""Hamas is intent on destruction': Palestine state recognition labelled ""monstrous'",https://www.skynews.com.au/opinion/paul-murray/hamas-is-intent-on-destruction-palestine-state-recognition-labelled-monstrous/video/163ce3fcb5adfc5cc6a87408ee2d24c3
Sky News,The Kenny Report | 23 September,https://www.skynews.com.au/stream/opinion-programs/the-kenny-report/the-kenny-report-23-september/video/17bfe66be1b66b605bbe947abc5b6ed8
Sky News,Credlin | 23 September,https://www.skynews.com.au/stream/opinion-programs/credlin/credlin-23-september/video/4b96e6b1c3c7a1afaf8fd60df42d709d
Sky News,The Bolt Report | 23 September,https://www.skynews.com.au/stream/opinion-programs/the-bolt-report/the-bolt-report-23-september/video/5aa0c3cb3c8bcf45a71a271b3a25252f
Sky News,Sharri | 23 September,https://www.skynews.com.au/stream/opinion-programs/sharri/sharri-23-september/video/335880ee299da7717184442f836ff36d
Sky News,Paul Murray Live | 22 September,https://www.skynews.com.au/stream/opinion-programs/paul-murray-live/paul-murray-live-22-september/video/fba4a4aba43bf05196925fb8d4f36947
Sky News,The Late Debate | 22 September,https://www.skynews.com.au/stream/opinion-programs/the-late-debate/the-late-debate-22-september/video/47c95d21f86ca02d635bfd22c537aefb
Sky News,The Rita Panahi Show | 23 September,https://www.skynews.com.au/stream/opinion-programs/the-rita-panahi-show/the-rita-panahi-show-23-september/video/c546fe0fceec625cfb3ec68a7a3a57c3
Sky News,Fortescue winds back mentions of hydrogen from climate report after axing projects,https://www.skynews.com.au/business/energy/fortescue-winds-back-mentions-of-hydrogen-from-climate-report-after-axing-major-projects-in-queensland-alaska/news-story/93d8b61481e349ad2c02b5192b0fff77
Sky News,Push for Optus to lose naming rights to WA stadium after national outage,https://www.skynews.com.au/business/markets/push-for-optus-to-lose-naming-rights-to-perths-stadium-after-triple0-outage-linked-to-four-deaths/news-story/8d5ce53c39b57dbc4b8ecd3e3416427d
Sky News,"""Pick up again': Major warning for Aussies still struggling with price pains",https://www.skynews.com.au/business/finance/major-warning-for-aussies-still-struggling-with-price-pains-after-rba-governor-admits-postpandemic-inflation-will-not-reverse/news-story/04bda6944b96359375028626d6cda537
Sky News,Major Aussie retailer's share price crashes after poor performance,https://www.skynews.com.au/business/markets/myers-share-price-nosedives-after-revealing-poor-performance-in-2025-financial-year-as-the-asx-200-rises-on-tuesday/news-story/cf70d2d628ec54781a9dab4d29b8e3b2
Sky News,"""Material decline' in living standards coming for millions of Australians",https://www.skynews.com.au/business/finance/australians-to-face-a-material-decline-in-living-standards-despite-inflation-falling/news-story/1024a8bb3185d8e1da5dfa4c6ea7d473
Sky News,Aussies forced to drive hours for banking as final small town branch to close,https://www.skynews.com.au/business/finance/aussies-in-queenstown-tasmania-forced-to-drive-hours-for-banking-as-the-towns-remaining-bendigo-bank-branch-will-close/news-story/ad48a121d7fe421a29d642b083c5c9d2
Sky News,"Massive price rises of recent years will not come back down, RBA warns",https://www.skynews.com.au/business/finance/massive-price-rises-of-recent-years-will-not-come-back-down-reserve-bank-of-australia-governor-michele-bullock-warns/news-story/c12bcd434f756e3e96ac264d29110776
Sky News,ASX rises after Wall Street lifts on future rate cut hopes,https://www.skynews.com.au/business/markets/asx-200-rises-on-monday-after-wall-street-lifts-on-future-interest-rate-cut-hopes/news-story/606efff4404e21518ac976f977cdb60a
Sky News,"""Santos doesn't need anybody': Boss speaks out after failed $36b sale",https://www.skynews.com.au/business/energy/santos-ceo-kevin-gallagher-says-the-oil-and-gas-giant-doesnt-need-a-purchaser-after-failed-36b-sale-to-abu-dhabi/news-story/7d1f2beaaacd4135ee27251906657b4e
Sky News,Major warning as black-market cigarettes fuel smoking surge,https://www.skynews.com.au/lifestyle/health/widespread-illicit-tobacco-trade-drives-rising-smoking-rates-while-causing-billions-in-lost-revenue/news-story/1f17e09f10458ad1394b0c2af7b8c0a5
Sky News,Why major Archie decision could set Harry and William on collision course,https://www.skynews.com.au/lifestyle/celebrity-life/really-the-only-sensible-choice-prince-harrys-reported-shock-plan-for-sixyearold-archie-at-eton-college-may-put-him-on-a-collision-course-with-prince-william/news-story/7fecf01f3ae022fe17a2f0efa60ffce3
Sky News,Why this toy car in Bondi Junction apartment car park sparked neighbourhood war,https://www.skynews.com.au/lifestyle/trending/eastern-suburbs-neighbour-war-erupts-after-afluent-mum-takes-up-apartment-parking-spot-with-childs-toy-convertible/news-story/3be8ffaa6e4e2c4479748248b20ca7c5
Sky News,"Why Nicole Kidman is ""worried' about model daughter Sunday Rose",https://www.skynews.com.au/lifestyle/celebrity-life/nicole-kidman-worried-daughter-sunday-rose-17-could-become-a-diva-nepobaby-nightmare-as-her-modelling-career-takes-off/news-story/103e0d803baa03b24ff5437d8f8c7144
Sky News,Seven charities drop Fergie amid Epstein email fallout,https://www.skynews.com.au/lifestyle/celebrity-life/inappropriate-for-her-to-continue-sarah-fergie-ferguson-dumped-by-seven-charities-including-teenage-cancer-trust-after-grovelling-jeffrey-epstein-email-surfaces/news-story/2f0a7b22eab3d6c05cb23a9d9a109001
Sky News,"Goldberg, defiant ""The View' co-hosts finally address Jimmy Kimmel saga",https://www.skynews.com.au/lifestyle/celebrity-life/whoopi-goldberg-and-defiant-the-view-cohosts-finally-address-jimmy-kimmel-saga-no-one-silences-us/news-story/b2e8dbf82c378abb967210fa2d5c8edf
Sky News,"I was told to ""button up' my cardigan in Qantas lounge to ""protect other cultures'",https://www.skynews.com.au/lifestyle/trending/aussie-woman-told-to-button-up-cardigan-in-brisbane-airports-qantas-lounge-to-protect-other-cultures/news-story/9bc1cec7976b26bd9119832225caa543
Sky News,Terri Irwin doesn't look like this anymore,https://www.skynews.com.au/lifestyle/celebrity-life/i-swear-she-is-ageing-backwards-terri-irwin-wows-with-unbelievable-new-look-in-los-angeles-as-she-cheers-on-son-roberts-dancing-with-the-stars-debut/news-story/e73390fc313df33a3b2d6ca9f156160c
Sky News,Today's News Headlines: PM recognises Palestine in first UN speech,https://www.skynews.com.au/australia-news/todays-news-headlines-pm-recognises-palestine-in-first-un-speech/video/e4ac192dfa577add53db5b0d63f35ff4
Sky News,Palestinian academic no longer employed at Sydney University over offensive tweets,https://www.skynews.com.au/australia-news/palestinian-academic-no-longer-employed-at-sydney-university-over-offensive-tweets/video/0795b2f096dcae15f2c583848b1e7c45
Sky News,Data exposes PM's historically bad relationship with Trump,https://www.skynews.com.au/australia-news/politics/data-exposes-pms-historically-bad-relationship-with-trump/video/6340cf9987a7b9894819bdbc16a34212
