Section,Headline,Link
Guardian,Glacier melt will lead to ice-free peaks in California for first time in human history,https://www.theguardian.com/environment/2025/oct/07/california-sierra-nevada-glaciers
ABC,Mining giant gets $600m worth of taxpayer funds to keep refinery open,https://www.abc.net.au/news/2025-10-08/glencore-copper-queensland-smelter-refinery-open/105462262
ABC,Email detailing Optus triple-0 outage sent to wrong government mailbox,https://www.abc.net.au/news/2025-10-08/federal-politics-live-october-8/105863462
ABC,Police alerting hundreds of accused sexual offenders as cases re-examined,https://www.abc.net.au/news/2025-10-08/victoria-police-audit-sex-offence-cases-potentially-compromised/105864962
ABC,US to 'do everything possible' to prevent war if Hamas agrees to peace deal,https://www.abc.net.au/news/2025-10-08/us-to-do-everything-possible-to-prevent-war-if-hamas-agree-peace/105864574
ABC,Fears of online journalism Armageddon as Google changes the game,https://www.abc.net.au/news/science/2025-10-08/how-googles-ai-overviews-are-affecting-australian-news-websites/105839588
ABC,Increasing rent driving people away from employment,https://www.abc.net.au/news/2025-10-08/rental-prices-surge-almost-44-per-cent-review-finds/105865000
ABC,Trump's Pentagon nominee flags possible 'commonsense' AUKUS changes,https://www.abc.net.au/news/2025-10-08/trump-pentagon-nominee-john-noh-questioned-on-aukus/105864552
ABC,US attorney-general accused of using justice system to protect Trump,https://www.abc.net.au/news/2025-10-08/pam-bondi-accused-of-using-doj-to-target-donald-trump-opponents/105864762
ABC,Aussie dollar jumps to 10-month high against Japanese yen,https://www.abc.net.au/news/2025-10-08/asx-markets-business-live-news-october-8/105864736
ABC,Gold prices surge as investors watch 'extraordinary global scenario',https://www.abc.net.au/news/2025-10-08/gold-price-hits-record-high-topping-4000-an-ounce/105863902
ABC,'I was so cross': NDIS participants blast 'nonsensical' spending rules,https://www.abc.net.au/news/2025-10-08/participants-frustrated-with-ndis-support-rules/105815444
ABC,"Kerr finally set for Matildas return, Fowler on track for Asian Cup",https://www.abc.net.au/news/2025-10-08/sam-kerr-matildas-return-mary-fowler-asian-cup/105864112
ABC,Taylor Swift shines in Australian-designed dress in lead single,https://www.abc.net.au/news/2025-10-08/taylor-swift-wears-paolo-sebastian-dress/105864738
ABC,Will Trump win the Nobel Peace Prize?,https://www.abc.net.au/news/2025-10-08/can-trump-win-nobel-peace-prize-expert-thoughts/105862126
ABC,Minjee Lee chases more prizes in Asian golf swing,https://www.abc.net.au/news/2025-10-08/minjee-lee-eyeing-spot-in-end-of-season-rankings/105865746
ABC,Saltwater crocodile found with mouth zip-tied shut near Darwin,https://www.abc.net.au/news/2025-10-08/saltwater-crocodile-found-with-snout-zip-tied-in-darwin-nt/105848320
ABC,Calls for national gambling watchdog grow after NT regulator accusations,https://www.abc.net.au/news/2025-10-08/government-reviews-conflict-allegations-against-nt-gambling-body/105863006
ABC,'It's a human rights tragedy': Aged care facility inappropriately restrained residents,https://www.abc.net.au/news/2025-10-08/disability-sa-northgate-restrictive-practices-prompt-outrage/105861214
ABC,Iron ore mining shows no signs of slowing despite price drop concerns,https://www.abc.net.au/news/2025-10-08/rio-tinto-bhp-continue-to-invest-in-pilbara-iron-ore-mining/105862166
ABC,"Industry warns 'no gas, no future' amid high prices and falling demand",https://www.abc.net.au/news/2025-10-08/bluescope-steel-mark-vassella-press-club-speech-on-gas-crisis/105856934
ABC,New AFP boss warns hate crime laws may need to be strengthened further,https://www.abc.net.au/news/2025-10-08/afp-commissioner-krissy-barrett-national-security-warning/105848960
ABC,Telcos face surprise 'stress test' within weeks as Optus fallout continues,https://www.abc.net.au/news/2025-10-08/surprise-drill-for-telcos-as-coalition-goes-after-wells/105863244
ABC,Brewer stages beer boycott over Kangaroo Island ferry's 'ridiculous' fares,https://www.abc.net.au/news/2025-10-08/kangaroo-island-brewer-boycotts-sealink-ferry-over-fare-prices/105861274
ABC,Outback athlete shares journey to ironman world championship,https://www.abc.net.au/news/2025-10-08/ironwoman-world-championship-hawaii-australian-competitor/105845064
ABC,Ship lift project dubbed 'one of the biggest blowouts' in Australia,https://www.abc.net.au/news/2025-10-07/nt-taxpayers-billion-dollar-ship-lift-pearling-giant-paspaley/105856034
ABC,Clients of Melbourne builder lose life savings as company goes bust,https://www.abc.net.au/news/2025-10-06/melbourne-builder-mike-harris-under-investigation/105849496
ABC,'I fought back as best I could': Older Territorians share home invasion horror stories,https://www.abc.net.au/news/2025-10-06/calls-for-nt-ban-on-machetes-and-crossbows/105747486
ABC,"Australia were world champs, now teams are scrambling for players",https://www.abc.net.au/news/2025-10-05/softball-decline-struggle-young-players-exposure-olympics/105851876
ABC,Australian flotilla activist speaks after being detained by Israel,https://www.abc.net.au/news/2025-10-08/australian-gaza-flotilla-member-speaks-after-israel-detention/105865294
ABC,Estimates gets heated as McKenzie tells minister 'get off your arse' over assaults,https://www.abc.net.au/news/2025-10-07/bridget-mckenzie-driving-instructor-assaults-catherine-king/105861268
ABC,"Outback water project unlikely due to $30m shortfall, minister says",https://www.abc.net.au/news/2025-10-07/wilcannia-weir-project-funding-issues-rose-jackson/105849134
ABC,NT parents referred to income management if kids fail to attend class,https://www.abc.net.au/news/2025-10-07/nt-government-school-truancy-plan-backlash-education/105856318
ABC,Inside the dramatic rescue of Indonesian teens buried alive under their school,https://www.abc.net.au/news/2025-10-07/efforts-to-rescue-indonesian-students-buried-under-school/105857382
ABC,Macron urged by his first PM to resign in escalating French crisis,https://www.abc.net.au/news/2025-10-08/macron-urged-by-first-pm-to-resign-in-escalating-french-crisis/105864272
ABC,"German mayor stabbed outside home, Chancellor Merz condemns 'abhorrent act'",https://www.abc.net.au/news/2025-10-08/herdecke-mayor-iris-stalzer-stabbed-in-germany-/105864280
ABC,Scientists win Nobel Prize in Physics for discoveries in quantum mechanics,https://www.abc.net.au/news/2025-10-07/scientists-physics-nobel-prize-quantum-mechanics-discovery/105863766
ABC,Telcos face Canberra grilling as bill to improve triple-0 system is introduced,https://www.abc.net.au/news/2025-10-07/telcos-meet-anika-wells-as-triple-zero-custodian-enshrined/105859926
ABC,Betting on the weather emerges as a solution as insurance costs skyrocket,https://www.abc.net.au/news/2025-10-07/ica-finds-australia-extreme-weather-loss-among-highest-in-world/105831772
ABC,Customers face empty shelves as farmers battle potato shortage,https://www.abc.net.au/news/rural/2025-10-07/potato-shortage-as-farmers-battle-weather-extremes/105848984
ABC,Clients of Melbourne builder lose life savings as company goes bust,https://www.abc.net.au/news/2025-10-06/melbourne-builder-mike-harris-under-investigation/105849496
ABC,"Five quick hits: Marnus scores big, other Test hopefuls flounder in Shield",https://www.abc.net.au/news/2025-10-08/sheffield-shield-round-one-quick-hits-labuschagne-century/105861198
ABC,Mistakes costly for Arsenal as trio of Matildas feature in Champions League,https://www.abc.net.au/news/2025-10-08/womens-champions-league-arsenal-lose-to-lyon/105865154
ABC,Neighbour pays tribute to Broncos star Staggs after family heartbreak,https://www.abc.net.au/news/2025-10-08/kotoni-staggs-tribute-after-death-of-david-orange/105864876
ABC,Has the WA government made AC Milan an offer they can't refuse?,https://www.abc.net.au/news/2025-10-08/serie-a-game-perth-ac-milan-como-reaction/105861988
ABC,How some simple planning can make Christmas easier financially,https://www.abc.net.au/news/2025-10-07/preparing-financially-for-christmas-and-holidays/105795388
ABC,What is task paralysis and how do you overcome it?,https://www.abc.net.au/news/2025-10-06/what-is-task-paralysis-and-how-to-overcome-it/105816676
ABC,"Minimise weeknight cooking with these easy, big-batch recipes",https://www.abc.net.au/news/2025-10-05/easy-make-ahead-meal-prep-dinners-for-busy-weeknights/105668174
ABC,Cheesy lemon ravioli is a simple dinner with just three steps,https://www.abc.net.au/news/2025-10-04/easy-lemon-ravioli-with-baby-spinach-cheese/105534228
ABC,'It's sickening': The lengths Trent Dalton has gone for a good story,https://www.abc.net.au/news/2025-10-07/trent-dalton-new-book-gravity-let-me-go-boy-swallows-universe/105806326
ABC,Pulp's Jarvis Cocker has a wild wedding story few will top,https://www.abc.net.au/news/2025-10-07/pulp-jarvis-cocker-love-songs-glastonbury-more-take-5-zan-rowe/105836540
ABC,Mystery Road: Origin screenwriter Erica Glynn has only ever written with mob,https://www.abc.net.au/news/2025-10-07/mystery-road-first-nations-writing-room-erica-glynn/105803594
ABC,Paul Thomas Anderson's latest movie already eyed for Best Picture,https://www.abc.net.au/news/2025-10-05/one-battle-after-another-paul-thomas-anderson-film/105838240
Sky News,"""Tragic': October 7 Hamas massacre is ""amplifying' extremism and propaganda",https://www.skynews.com.au/opinion/chris-kenny/tragic-october-7-hamas-massacre-is-amplifying-extremism-and-propaganda/video/30e8bcadaeb8e743f84c234badc66ef1
Sky News,"""Men, women and children': October 7 massacre remembered two years on",https://www.skynews.com.au/opinion/peta-credlin/men-women-and-children-october-7-massacre-remembered-two-years-on/video/b35bd127569192ed6dabb4ad4b858bcf
Sky News,"""Chilling': Graffiti supporting Hamas sprayed across Australian walls",https://www.skynews.com.au/opinion/chilling-graffiti-supporting-hamas-sprayed-across-australian-walls/video/2ed2c4c28313f51e0ece3f6f71ab50c6
Sky News,"Jewish community hailed for its ""ancient DNA of resilience' in the face of antisemitism",https://www.skynews.com.au/opinion/sharri-markson/jewish-community-hailed-for-its-ancient-dna-of-resilience-in-the-face-of-antisemitism/video/445b394391715e5972f10787999af26e
Sky News,"""Obviously provocative': Pro-Palestine rallies mock October 7 anniversary",https://www.skynews.com.au/opinion/paul-murray/obviously-provocative-propalestine-rallies-mock-october-7-anniversary/video/064ef407702ff256b90d00e0cd579f0b
Sky News,"""This was politically motivated': Pro-life influencer gets punched mid-interview",https://www.skynews.com.au/opinion/rita-panahi/this-was-politically-motivated-prolife-influencer-gets-punched-midinterview/video/d06bcd829cc985849bc4eb78c9107cba
Sky News,"""Political cover up': Coalition accuses Albanese of concealing details about ISIS brides",https://www.skynews.com.au/australia-news/politics/shadow-foreign-affairs-minister-michaelia-cash-accuses-albanese-of-political-cover-up-over-isis-brides-returning-to-australia/news-story/c1aee8c9b49806081a8c3432368d1a89
Sky News,Australian actor to be immediately executed if last-ditch legal bid fails,https://www.skynews.com.au/australia-news/crime/australian-movie-starturneddrug-smuggler-karm-gilespie-facing-immediate-execution-in-china-if-his-appeal-to-overturn-conviction-fails/news-story/0624f9daa24dbe7e2c4d8b1748f33caa
Sky News,"""Cowards': Alarming details revealed of alleged murder plot thwarted by police",https://www.skynews.com.au/australia-news/crime/alleged-organised-crime-hit-foiled-after-being-intercepted-by-police-near-daycare-centre-in-southwest-sydney/news-story/aa2ecd0e688d8a82c81a2fa94cbb927b
Sky News,"""No Future Made in Australia': Dire warning to Labor over gas prices",https://www.skynews.com.au/business/energy/manufacturing-australias-mark-vassella-warns-there-will-be-no-future-made-in-australia-as-gas-prices-remain-elevated/news-story/c35b8a16a9425d9d94ef9fab1e71c57c
Sky News,PM Albanese announces upgraded comprehensive strategic partnership with Singapore,https://www.skynews.com.au/australia-news/politics/australian-spy-chief-andrew-shearer-sounds-alarm-over-daytoday-coercion-designed-to-make-world-safer-for-authoritarianism/live-coverage/46d84d96981704199b7961a9741e61ed
Sky News,Labor ministers pass the buck over returned ISIS brides,https://www.skynews.com.au/australia-news/politics/no-answers-on-isis-brides-as-housing-minister-clare-oneil-and-foreign-minister-penny-wong-pass-responsibility/news-story/6a73fc6726919d85d09f6a61fb0fbf81
Sky News,"Chilling footage shows pro-Palestine protesters back Hamas' right to ""fight back'",https://www.skynews.com.au/insights-and-analysis/sky-news-sharri-markson-exposes-chilling-footage-showing-propalestine-protestors-back-hamas-right-to-fight-back/news-story/0cbd188b692427b0c3c2a778933c0f5a
Sky News,"""Sickening': Shadow communications minister fumes over delayed response to telco failures",https://www.skynews.com.au/australia-news/politics/sickening-melissa-mcintosh-blasts-labors-delayed-action-on-recommendations-to-telco-failures-after-optus-outage/news-story/7ef9e46cc66f049fcdc132fa5e381059
Sky News,Proposed MCG $2bn revamp revealed,https://www.skynews.com.au/australia-news/sport/melbourne-cricket-ground-set-for-2-billion-revamp-to-rebuild-the-shane-warne-stand-over-two-to-three-years/news-story/2bb3b6275392b0b64ea3823e612afbd2
Sky News,Embattled Optus boss refused to meet Coalition over triple-zero crisis,https://www.skynews.com.au/australia-news/politics/embattled-optus-boss-stephen-rue-refused-to-meet-coalition-as-he-copped-grilling-from-anika-wells-and-the-media-over-fatal-triplezero-outages/news-story/2088b3c83e73c6a8706790e30964126f
Sky News,"Former neighbour of missing boy's family issues heartfelt plea amid ""online vitriol'",https://www.skynews.com.au/australia-news/former-neighbour-of-missing-fouryearold-boy-gus-lamonts-family-issues-heartfelt-plea-amid-online-speculation-over-disappearance/news-story/a3ca9724a5e26cb63234cc491c8d0d8d
Sky News,Victorian govt makes major free public transport announcement,https://www.skynews.com.au/australia-news/politics/victorian-government-announces-three-months-of-free-weekend-travel-on-all-public-transport-as-metro-tunnel-set-to-open/news-story/917697496505880489904cf5f6bfb52f
Sky News,Hundreds of jobs out of the firing line as massive smelter set for bailout,https://www.skynews.com.au/business/tech-and-innovation/federal-and-queensland-governments-to-bailout-out-glencores-embattled-mount-isa-copper-smelter-townsville-refinery/news-story/5ba794c8f4fa9e7ce9c7aaeaed51d4c7
Sky News,Aussie airline reveals jaw-dropping fares to popular Asia destinations,https://www.skynews.com.au/lifestyle/travel/jetstar-reveals-jawdropping-sale-with-fares-starting-from-179-to-japan-and-south-korea/news-story/c73026569f7b8da97133014b93511ac2
Sky News,Surprise number of Aussies that don't want any more rate cuts,https://www.skynews.com.au/business/finance/majority-of-aussies-worried-about-how-rate-cuts-are-shrinking-their-savings-interest-moneycomau-finds/news-story/868d2e4676a8b8cd2cdce8b517b2e400
Sky News,My four-step process to create a Farage-like force within Australian conservatism,https://www.skynews.com.au/insights-and-analysis/stuck-in-place-stupid-how-australian-conservatism-can-morph-into-a-reform-partylike-force-and-leave-era-of-timidity-behind/news-story/b8c07b00231fa02945340c408e8d7582
Sky News,"Welcome to Sydney, a beautiful but absurd city no-one can afford to live in",https://www.skynews.com.au/insights-and-analysis/700aweek-sydney-granny-flat-listing-sparks-outrage-among-renters-in-the-harbour-city-a-beautiful-but-absurd-place-noone-can-afford-to-live-in/news-story/32ea5f9d628874642aa4f4baf68a6bc6
Sky News,COP climate bosses can still save us all from a pointless $100 million exercise,https://www.skynews.com.au/insights-and-analysis/rejecting-australias-bid-and-moving-cop31-climate-summit-to-zoom-would-save-us-all-from-a-pointless-hundredmilliondollar-exercise/news-story/1fa3892af60ea5946378cdef5a6be7e4
Sky News,"Doctors gave puberty blockers to nine-year-old, despite ""shoddy' research: report",https://www.skynews.com.au/world-news/united-states/california-doctors-gave-puberty-blockers-to-nineyearold-despite-admitting-shoddy-research-report/news-story/c900a21f1ba30ce73bed7e5ef935c55c
Sky News,"Girl, 12, killed while train surfing was a thrillseeker who posted terrifying TikToks",https://www.skynews.com.au/world-news/united-states/new-york-girl-12-killed-while-subway-surfing-was-a-thrillseeker-who-posted-terrifying-tiktoks-including-on-train-tracks/news-story/c5386b124ffe0b304643bc44693e839a
Sky News,Troubled teen accused of decapitating mum's beau shares gory confession details,https://www.skynews.com.au/world-news/united-states/troubled-new-york-teen-accused-of-decapitating-mothers-boyfriend-shares-gory-confession-details-sources/news-story/b64661dd30ae09f44a234114b537502f
Sky News,Trump aide hits AOC with savage innuendo after she mocked official's height,https://www.skynews.com.au/world-news/united-states/donald-trump-aide-hits-aoc-with-savage-innuendo-after-she-mocked-stephen-millers-height/news-story/a5f4913edf47705805ecf3b16bfbe2e5
Sky News,Tony Abbott's drastic solution to the UK migrant crisis,https://www.skynews.com.au/world-news/united-kingdom/former-pm-tony-abbott-gives-uk-advice-on-turning-back-the-boats-suggests-an-offshore-mothership-detention-facility/news-story/ca921d871f4c77911369cdb8283ed2fc
Sky News,"Property baron disowns son in savage statement over alleged ""man cave' scam",https://www.skynews.com.au/world-news/united-states/richest-us-real-estate-baron-donald-bren-disowns-son-in-savage-12word-statement-over-alleged-ultimate-man-cave-scam/news-story/af3fcf67211bc75d4795bd3af9d81f1c
Sky News,"White House blasts Chicago Mayor for creating ""ICE Free Zones' banning agents",https://www.skynews.com.au/world-news/united-states/white-house-blasts-sick-chicago-mayor-brandon-johnson-for-creating-ice-free-zones-banning-agents/news-story/65871f2a2492c93c270767bb93b8d7ba
Sky News,PNG sidelines China after signing defence pact with Albanese govt,https://www.skynews.com.au/world-news/donald-trump-says-negotiations-on-gaza-ceasefire-deal-going-very-well-set-to-last-couple-of-days/live-coverage/44c622021a5dcf1276c0303ffcf6103f
Sky News,"""Get over it': Paddington creators sue Spitting Image over parody foul-mouthed bear depiction",https://www.skynews.com.au/opinion/get-over-it-paddington-creators-sue-spitting-image-over-parody-foulmouthed-bear-depiction/video/a5c2212119214875bf5fbd6bc1df5f13
Sky News,"""Having a sook': Rosie O'Donnell brutally skewered following ""hysterical' Trump meltdown",https://www.skynews.com.au/opinion/having-a-sook-rosie-odonnell-brutally-skewered-following-hysterical-trump-meltdown/video/513db0bef5973ec5312725dccab408dd
Sky News,Ray Hadley teases possible return to radio,https://www.skynews.com.au/opinion/sharri-markson/ray-hadley-teases-possible-return-to-radio/video/31c9f97b2bdf782d42a2cd5c8c11e665
Sky News,The Kenny Report | 7 October,https://www.skynews.com.au/stream/opinion-programs/the-kenny-report/the-kenny-report-7-october/video/c61dc251ead11c6d43fda45d8a146f95
Sky News,Credlin | 7 October,https://www.skynews.com.au/stream/opinion-programs/credlin/credlin-7-october/video/71816509c84d11e568ee9c7790dad266
Sky News,The Bolt Report | 7 October,https://www.skynews.com.au/stream/opinion-programs/the-bolt-report/the-bolt-report-7-october/video/d473f3cb5bae6c505416a10b4158b24a
Sky News,Sharri | 7 October,https://www.skynews.com.au/stream/opinion-programs/sharri/sharri-7-october/video/898a3336a77f296f0154ff8c4e428293
Sky News,Paul Murray Live | 7 October,https://www.skynews.com.au/stream/opinion-programs/paul-murray-live/paul-murray-live-7-october/video/313cffca07bc2952106077773786ba6a
Sky News,The Late Debate | 7 October,https://www.skynews.com.au/stream/opinion-programs/the-late-debate/the-late-debate-7-october/video/a582303d4f73453fd479b7c959c0171b
Sky News,The Rita Panahi Show | 7 October,https://www.skynews.com.au/stream/opinion-programs/the-rita-panahi-show/the-rita-panahi-show-7-october/video/c8f7089ccf9091b1b3d163d11a114cbc
Sky News,"""No Future Made in Australia': Dire warning to Labor over gas prices",https://www.skynews.com.au/business/energy/manufacturing-australias-mark-vassella-warns-there-will-be-no-future-made-in-australia-as-gas-prices-remain-elevated/news-story/c35b8a16a9425d9d94ef9fab1e71c57c
Sky News,Hundreds of jobs out of the firing line as massive smelter set for bailout,https://www.skynews.com.au/business/tech-and-innovation/federal-and-queensland-governments-to-bailout-out-glencores-embattled-mount-isa-copper-smelter-townsville-refinery/news-story/5ba794c8f4fa9e7ce9c7aaeaed51d4c7
Sky News,JPMorgan foots $174 million legal tab for ex employees who scammed bank: report,https://www.skynews.com.au/business/finance/jpmorgan-foots-174-million-tab-of-legal-bills-for-charlie-javice-codefendant-who-scammed-bank-out-of-266-million-report/news-story/5f914336921181b714481b87f65d802f
Sky News,Massive number of Aussies expecting rates to lift in the coming year,https://www.skynews.com.au/business/finance/westpacs-matthew-hassan-reveals-the-massive-number-of-aussies-that-expect-interest-rates-to-lift-over-the-coming-year/news-story/88ea01c25732f38c3cbd099e228cc507
Sky News,Surprise number of Aussies that don't want any more rate cuts,https://www.skynews.com.au/business/finance/majority-of-aussies-worried-about-how-rate-cuts-are-shrinking-their-savings-interest-moneycomau-finds/news-story/868d2e4676a8b8cd2cdce8b517b2e400
Sky News,ASX falls after surge on Wall Street driven by ChatGPT-maker deal,https://www.skynews.com.au/business/markets/asx-200-falls-after-surge-on-wall-street-driven-by-fresh-deal-between-chatgptmaker-openai-and-amd/news-story/703e856edaae087f0e054a85e5a281ef
Sky News,"Environmentalist slams ""reckless' wind farm rollout destroying Queensland forests",https://www.skynews.com.au/business/energy/conservationist-warns-australias-renewable-energy-push-fragmenting-forests-and-wiping-out-wildlife-as-new-mapping-exposes-scale-of-land-clearing-for-wind-and-solar-projects/news-story/9c513268ce312db1cc139eed5fd17e6e
Sky News,Aussie AI startup that wants to double healthcare capacity outpacing Canva's growth,https://www.skynews.com.au/business/tech-and-innovation/aussie-ai-startup-heidi-ceo-joe-kelly-says-he-wants-to-double-healthcare-capacity-as-the-company-outpaces-canvas-growth/news-story/1ab7ff4231b39d36bae762bcb93ad82a
Sky News,Hundreds of jobs in jeopardy as shoe retailer to close down,https://www.skynews.com.au/business/finance/hundreds-of-jobs-in-jeopardy-as-australian-womens-shoe-retail-chain-famous-footwear-to-shut-down/news-story/713a968624bb9b735717d2918a3ff612
Sky News,"Glamourous newly single star Keith Urban has found comfort with as he's ""out to embarrass' ex Nicole Kidman",https://www.skynews.com.au/lifestyle/celebrity-life/keith-urban-finds-comfort-with-glamourous-newly-single-star-kelsea-ballerini-as-hes-out-to-embarrass-exwife-nicole-kidman/news-story/552a78d51ec1cb69ad6d1efdf4f16f33
Sky News,African country cuts ties with Harry's charity over explosive misconduct claims,https://www.skynews.com.au/lifestyle/celebrity-life/prince-harrys-conservation-charity-african-parks-dumped-by-chad-after-alleged-recurring-indelicate-and-disrespectful-attitude-towards-the-government/news-story/7b6d264d120c46b9d0c1e51efdabc89b
Sky News,Popular NZ singer-songwriter Lorde's music vanishes from Apple Music Israel,https://www.skynews.com.au/lifestyle/trending/popular-nz-singersongwriter-lordes-music-vanishes-from-apple-music-spotify-israel-after-concert-outburst/news-story/3b770cfa97eb6fd3a1f060fd0b420833
Sky News,Fears for Jelena Dokic as Aussie tennis star breaks down amid split rumours,https://www.skynews.com.au/lifestyle/celebrity-life/i-am-just-done-jelena-dokic-breaks-down-in-series-of-cryptic-instagram-posts-amid-split-rumours-from-new-boyfriend/news-story/dc6b9ce07f23e153cf1c5ecf7aa78cb0
Sky News,"William ""livid beyond words' over Meghan's ""insensitive' Paris video",https://www.skynews.com.au/lifestyle/celebrity-life/he-said-it-was-grotesque-prince-william-reportedly-livid-beyond-words-after-meghan-markle-shared-video-of-herself-near-where-princess-diana-died/news-story/02e2afad998c92c06e3fe38665003d71
Sky News,Aussie airline reveals jaw-dropping fares to popular Asia destinations,https://www.skynews.com.au/lifestyle/travel/jetstar-reveals-jawdropping-sale-with-fares-starting-from-179-to-japan-and-south-korea/news-story/c73026569f7b8da97133014b93511ac2
Sky News,Jetstar customer spots major problem with airport baggage scale after $60 fine,https://www.skynews.com.au/lifestyle/travel/jetstar-customer-spots-major-problem-with-airport-scale-after-60-excess-baggage-fee/news-story/82b587d525b2f98a4947316c396fda59
Sky News,"Haunted hotel offering brave soul $7,500 to investigate paranormal activity",https://www.skynews.com.au/lifestyle/travel/oldest-and-most-haunted-hotel-in-las-vegas-is-offering-one-brave-soul-7500-to-investigate-potential-paranormal-activity/news-story/6d5b941e03491fde57d71ac84ed5e918
Sky News,"Singapore PM says authorities need to ""identify root cause' of Optus outages",https://www.skynews.com.au/australia-news/politics/singapore-pm-says-authorities-need-to-identify-root-cause-of-optus-outages/video/c679db1d654137ecb8ca10d87f0dad2b
Sky News,"Australia and Singapore launch ""upgraded' strategic partnership",https://www.skynews.com.au/australia-news/politics/australia-and-singapore-launch-upgraded-strategic-partnership/video/ece6857f2bd7888d454c02cd35b2c48c
