Section,Headline,Link
Sky News,"""It was very warm': Anthony Albanese opens up on Trump meeting",https://www.skynews.com.au/australia-news/politics/it-was-very-warm-anthony-albanese-opens-up-on-trump-meeting/video/e7515a72cae33b59f4bf529ab89837e0
Sky News,Today's News Headlines: Russia warns NATO against aggression,https://www.skynews.com.au/australia-news/todays-news-headlines-russia-warns-nato-against-aggression/video/ecd4e3d98e98c9f7217441e92185b476
Sky News,Labor government expands first home buyer scheme,https://www.skynews.com.au/australia-news/politics/labor-government-expands-first-home-buyer-scheme/video/f87e0efdbfefe5470049c0c3fa6db78f
Sky News,Victoria calls for domestic gas reserve scheme,https://www.skynews.com.au/australia-news/politics/victoria-calls-for-domestic-gas-reserve-scheme/video/e9c3d542047f8056bcaa588d63ec8690
Sky News,Multiplex files $250 million lawsuit against INSW over Sydney Fish Market,https://www.skynews.com.au/australia-news/multiplex-files-250-million-lawsuit-against-insw-over-sydney-fish-market/video/88044d57e9293e2662040780d719796d
Sky News,Tourist dies after being stranded in Tasmania's Cradle Mountain,https://www.skynews.com.au/australia-news/tourist-dies-after-being-stranded-in-tasmanias-cradle-mountain/video/1f42c50f5146b6ffbfd5a5b1e6b5dd85
Sky News,Tensions rise over coal mining royalties and looming job losses,https://www.skynews.com.au/australia-news/politics/tensions-rise-over-coal-mining-royalties-and-looming-job-losses/video/19d261b7faf2d939a53b89c1d75837e0
Sky News,Hopes for new government cash injection to help stop Queensland locust plague,https://www.skynews.com.au/australia-news/hopes-for-new-government-cash-injection-to-help-stop-queensland-locust-plague/video/1e91ccd43cd317cdd4d1e57938118c4c
Sky News,"Listen to ""Sky News Radio' on the Nova Player app",https://www.skynews.com.au/business/media/you-can-listen-to-sky-news-australia-anytime-and-on-any-platform-with-sky-news-radio-on-iheartradio/news-story/2d6aca31bc7566b5c0652db48284f5b7
Sky News,Catch up on your favourite Sky News shows with podcasts,https://www.skynews.com.au/opinion/your-favourite-sky-news-australia-shows-are-available-to-listen-to-any-time-as-podcasts/news-story/379bbe36e745709ce679d2813be0249c
