Section,Headline,Link
9 News,Attorney-general dodges questions about alleged incriminating Trump-Epstein photos2 hours ago,https://www.9news.com.au/world/jeffrey-epstein-donald-trump-pam-bondi-questions-incriminating-photos-young-women-usa-news/9f623928-138a-4dea-83db-3143bb52ced6
9 News,Miss this looming deadline and face up to $1650 in fines,https://www.9news.com.au/national/tax-return-2025-deadline-when-you-need-to-lodge-your-return-by/f6d8833d-1ab4-4f11-b4dd-02cbfc5c2bcf
9 News,Google hopes this one little tab is about to change the way you search,https://www.9news.com.au/technology/google-ai-mode-search-giant-launching-most-powerful-ai-search-experience-yet-in-australia/08b9f298-2e32-4c84-a68e-c169a3487682
9 News,Trump threatens no back pay for federal workers in shutdown,https://www.9news.com.au/world/us-government-shutdown-trump-threatens-no-back-pay-for-workers/627c6ab2-212e-4716-958f-e1556bcbdabb
9 News,Surfer twice bitten by shark chasing seal off Kangaroo Island,https://www.9news.com.au/national/surfer-survives-shark-attack-off-kangaroo-island/b2b4efb3-6ad9-483f-a7d1-de9e57e3c2d5
9 News,Tony Abbott's provocative advice to UK politicians raises eyebrowsan hour ago,https://www.9news.com.au/world/tony-abbott-australia-prime-minister-united-kingdom-britain-england-migrants/dc9da3e7-2428-4671-afb2-d21660790203
9 News,breakingOptus sent triple-zero outage notification to wrong email address15 minutes ago,https://www.9news.com.au/national/optus-triple-zero-outage-email-notification-wrong-address/9e012423-d5ff-440f-b650-d1727e46aea8
9 News,"Females carry a higher genetic risk of depression than males, scientists sayan hour ago",https://www.9news.com.au/health/women-carry-far-higher-genetic-risk-of-depression-than-men/969c61a1-cd78-4ef4-94d2-60058c282450
9 News,Man taken into custody after woman stabbed at home in Far North Queensland,https://www.9news.com.au/national/manoora-stabbing-man-taken-in-to-custody-woman-stabbed-queensland-police-news/96339269-180d-4c63-a302-6a7af3e14ab8
9 News,Russia's costly new move to boost troops,https://www.9news.com.au/world/russia-ukraine-war-russia-boosting-military-sign-up-bonuses/4175dce5-316f-4a55-9ba6-adf544b8cd65
9 News,The world is anxious and it's fuelling a new Australian gold rush,https://www.9news.com.au/national/gold-prices-gold-to-become-australias-second-richest-resource-export-as-prices-skyrocket-in-uncertain-world/7115c64c-a272-43b7-bf50-6fb867c949b0
9 News,Police release images of two suspects after vacant bowling alley goes up in flames,https://www.9news.com.au/national/melbourne-moorabbin-bowling-alley-fire-police/01c0ba8a-2311-4647-81b8-28722b592458
9 News,Opera House rally decision today as Israel marks October 7 attacks,https://www.9news.com.au/national/october-7-hamas-attack-on-israel-two-year-anniversary-sydney-rally-israel-commemorates-date/6f265376-ae8b-4234-9a8c-dd84b1d397d0
9 News,US woman allegedly tried to kill partner with poisoned wine amid custody battle,https://www.9news.com.au/world/us-woman-charged-trying-to-kill-partner-poison-wine-during-custody-battle/20dffa65-a37d-471c-b6ed-5fdafc71ced4
9 News,Seven Australian activists released from Israel and deported to Jordan,https://www.9news.com.au/world/seven-australian-activists-from-gaza-flotilla-released-from-israel-and-deported-to-jordan/daf759d1-d636-47b5-adc3-39bf87091720
9 News,Aussies hit with nationwide potato shortage after 'toughest season' in a decade,https://www.9news.com.au/national/potato-shortage-coles-woolworths-extreme-weather/fed2f001-8743-4449-b30b-ab4686ce91b0
9 News,Pope Leo announces first trip of papacy to war-torn Middle East,https://www.9news.com.au/world/pope-leo-xiv-first-overseas-trip-turkey-lebanon/f2594906-26b9-4d9f-87cd-68c2227166dc
9 News,Footprint ruled out as police scale back search for Gus,https://www.9news.com.au/national/gus-lamont-missing-update-police-scale-back-search-say-they-have-done-all-they-can/2c1125f7-97da-4384-96c0-5af056de7578
9 News,Nobel Prize in Physics goes to three scientists whose work advanced quantum technology,https://www.9news.com.au/world/nobel-prize-in-physics-goes-to-3-scientists-whose-work-advanced-quantum-technology/30a5e703-7260-49b1-b646-6411dfecc4ef
9 News,Google hopes this one little tab is about to change the way you search,https://www.9news.com.au/technology/google-ai-mode-search-giant-launching-most-powerful-ai-search-experience-yet-in-australia/08b9f298-2e32-4c84-a68e-c169a3487682
9 News,Trump threatens no back pay for federal workers in shutdown,https://www.9news.com.au/world/us-government-shutdown-trump-threatens-no-back-pay-for-workers/627c6ab2-212e-4716-958f-e1556bcbdabb
9 News,Surfer twice bitten by shark chasing seal off Kangaroo Island,https://www.9news.com.au/national/surfer-survives-shark-attack-off-kangaroo-island/b2b4efb3-6ad9-483f-a7d1-de9e57e3c2d5
9 News,TODAY IN HISTORYPeople didn't know for decades why incredible quantity of milk was dumped in the ocean,https://www.9news.com.au/national/today-in-history-october-8-what-happened-on-this-day/2e187bb1-e516-433b-b400-00237b437a63
9 News,Miss this looming deadline and face up to $1650 in fines,https://www.9news.com.au/national/tax-return-2025-deadline-when-you-need-to-lodge-your-return-by/f6d8833d-1ab4-4f11-b4dd-02cbfc5c2bcf
9 News,Strip-searches at music festivals: What are the rules,https://www.9news.com.au/national/strip-searches-music-festivals-rules-in-nsw-explained/600c1c7f-69ed-446e-867d-fb48294d2d6f
9 News,Major changes coming to how Aussies visit Europe,https://www.9news.com.au/world/eu-entry-exit-system-2025-how-australians-are-impacted-by-new-travel-laws/efb9f58a-b744-4b0a-a75b-4d71f9b606c1
9 News,LIVEEagles skipper's move set to result in record compensationan hour ago,https://www.nine.com.au/sport/afl/trade-news-2025-live-updates-day-three-rumours-whispers-draft-20251008-p5n0ux.html
9 News,Cricketer hit with conduct breach for bizarre incident,https://www.nine.com.au/sport/cricket/sheffield-shield-2025-news-chris-green-dissent-umpire-video-nsw-v-wa-20251007-p5n0ti.html
9 News,"TV star, podcaster accused of unleashing abuse and hatred on former close friend",https://www.9news.com.au/national/abbie-chatfield-tv-star-and-podcaster-accused-of-unleashing-abuse-and-hatred-on-former-close-friend-heath-kelley/17784720-5147-4d42-898f-9989c20ec532
9 News,Jet ski operator clashes with residents over plans for NSW town,https://9now.nine.com.au/a-current-affair/jet-ski-operator-play-hard-jet-ski-hire-clashes-with-residents-over-plans-for-lake-illawarra-in-wollongong/d0765d97-052c-49e7-9921-cdd13de039e4
9 News,Telco bosses dragged to parliament as new triple zero laws unveiled,https://www.9news.com.au/national/telco-bosses-hauled-in-to-parliament-for-questioning/eb113798-8dcd-4314-b28b-04fb96a76509
9 News,Battle breaks out between competing lawyers to represent accused Sydney shooter,https://www.9news.com.au/national/artemios-mintzas-court-updates-lawyers-clash-over-accused-shooter/6962ede4-cc0b-4c83-899d-1f3663a2f7fc
9 News,"Deloitte to partially refund the government after using AI in $440,000 report",https://www.9news.com.au/national/deloitte-to-partially-refund-the-government-after-using-ai-in-report/653580b1-3c85-4778-bc0a-cac217d926f0
9 News,'Quite lovely': Albanese reveals surprise gift from White House,https://www.9news.com.au/national/anthony-albanese-latter-white-house-donald-trump-meeting/506dc901-6729-4e52-90c4-3e292b8adf51
9 News,"'Cold, lonely, fearful': Brother believes accused cop killer is dead",https://www.9news.com.au/national/dezi-freeman-alleged-police-killer-brother-believes-he-is-dead-according-to-youtube-host/23547104-d2f9-41cc-a4b5-a3ffc81e6283
9 News,CCTV shows group attacking Brisbane motorbike shop owner,https://www.9news.com.au/national/queensland-crime-motorbike-mechanic-business-owner-attacked-sumner-brisbane-news/8802169f-818e-4d5d-ac98-c341bfc9f8ea
9 News,CCTV shows vandals spraypainting pro-Hamas graffiti on shop,https://www.9news.com.au/national/pro-hamas-graffiti-on-building-in-fitzroy-melbourne/fe8388c2-2e7b-4048-8203-892fa9819ba8
9 News,Three critically injured after helicopter crashes onto California highway,https://www.9news.com.au/world/helicopter-crash-sacramento-california/d3fed4b2-1af7-459b-99f2-26a324b0cbde
9 News,"This cottage comes with two, eerie underwater surprises",https://www.domain.com.au/news/a-140-year-old-shipwreck-is-buried-in-this-familys-backyard-1435826/?utm_source=9news.com.au&utm_medium=referral&utm_campaign=editorial-homepage-driver
9 News,Blizzard continues to trap hundreds of Mount Everest hikers,https://www.9news.com.au/world/mount-everest-blizzard-traps-hundreds-of-chinese-hikers/c059ce2b-83e7-4322-8fb1-6d9144f879da
9 News,Trump considering a pardon for Ghislaine Maxwell,https://www.9news.com.au/world/ghislaine-maxwell-pardon-donald-trump-jeffrey-epstein-files-adelita-grijalva/faa265c4-a41d-4eaa-96e0-c06830ff201e
9 News,'It's bad': Couple lament 'mistake' not inspecting new home's pool,https://www.domain.com.au/news/something-lives-down-there-couple-bought-a-house-without-inspecting-the-pool-1435606/?utm_source=9news.com.au&utm_medium=referral&utm_campaign=editorial-homepage-driver
9 News,Aussies still in custody as Israel deports Greta Thunberg,https://www.9news.com.au/world/greta-thunberg-deported-from-israel-others-still-in-prison/67ca88a2-3e54-4d9f-9706-8ef99a3feaec
9 News,"Feuds, scandal, bizarre calls: Roosters scoop forgotten awards",https://www.nine.com.au/sport/nrl/news-2025-the-mole-exclusive-end-of-season-awards/dc409c47-b1c5-4613-92f0-3ee4558ba0b8
9 News,Tonga coach defends 'very humble' Storm star after fiery sledge,https://www.nine.com.au/sport/nrl/pacific-championships-news-2025-stefano-utoikamanu-grand-final-sledge-kristian-woolf-tonga-squad/71880d26-8716-414d-9cfd-ee59a18028c1
9 News,Former Bathurst 1000 champion announces retirement,https://www.nine.com.au/sport/motorsport/bathurst-1000-news-2025-nick-percat-retirement-comments/8a1ef30e-88ac-44fd-bf3b-f8b3a7ba2956
9 News,'Chewed up and spat out': Quade sorry for post-match truth bomb,https://www.nine.com.au/sport/rugby/news-2025-wallabies-fly-halves-tane-edmed-quade-cooper-australia-japan-opinion-analysis/632f5c60-606c-4023-8b28-e48dd0f068ee
9 News,'Make them ineligible': Rugby reads riot act to R360 targets,https://www.nine.com.au/sport/rugby/r360-news-world-union-response-australia-statement-rebel-league-targeting-nrl-stars/abcf4c40-53ab-445b-be44-1a8175e49a38
9 News,Shield cricketer cops code of conduct breach for dissent,https://www.nine.com.au/sport/cricket/sheffield-shield-2025-news-chris-green-dissent-umpire-video-nsw-v-wa/b9f4270d-6018-4852-be10-d9b4ea596a5a
9 News,"Cummins, Head offered $10m each to leave Aussie cricket",https://www.nine.com.au/sport/cricket/news-2025-pat-cummins-travis-head-offer-10-million-to-leave-australian-cricket/1ef56c47-973d-4b4c-bcf3-fe24506be5cf
9 News,Aussie newlyweds surprise wedding guests with meat raffle,https://9now.nine.com.au/today/meat-raffle-wedding-is-this-the-aussiest-nuptials-ever/6e4a4e46-501e-42a5-8a41-158374103f4b
9 News,Former Tyrrell investigator 'reads between lines' on Gus Lamont disappearance,https://9now.nine.com.au/today/toddler-missing-from-south-australian-sheep-farm-search-continues/707817fb-6739-4ee5-9ac9-3e36ce0ca68c
9 News,'Honey Badger' labelled a hero after saving little girl choking on lolly,https://9now.nine.com.au/today/honeybadger-nick-cummins-saves-toddler-choking-in-park/bc0c3f39-b550-43a2-849f-157c04e07210
9 News,Alleged mastermind of multimillion-dollar bribery scandal faces questioning,https://9now.nine.com.au/a-current-affair/ibrahim-helmy-alleged-mastermind-of-multimillion-dollar-bribery-scandal-faces-questioning/8e9157f0-3ca6-40b8-b72c-1028ae86521b
9 News,Jet ski operator clashes with residents over plans for NSW city,https://9now.nine.com.au/a-current-affair/jet-ski-operator-play-hard-jet-ski-hire-clashes-with-residents-over-plans-for-lake-illawarra-in-wollongong/d0765d97-052c-49e7-9921-cdd13de039e4
9 News,Locals feel let down by system over out-of-control behaviour,https://9now.nine.com.au/a-current-affair/locals-feel-let-down-by-system-over-outofcontrol-behaviour/c5f78a7b-c15b-4592-8f6c-e423cd21eab7
9 News,'Terrible Pandora's box': Inside Amorosi's decade-long family dispute,https://9now.nine.com.au/60-minutes/vanessa-amorosi-breaks-her-silence-after-decadelong-family-dispute/3c4cf6de-8d61-47ca-8a26-bdaa51bec4ae
9 News,'Ripped off': Calls for new inquest into Queensland beach town tragedy,https://9now.nine.com.au/60-minutes/ripped-off-calls-for-new-inquest-into-queensland-beach-town-tragedy/4d83319e-34e9-453e-9f72-634297ef7cbf
9 News,'She deserves better': Grieving daughter's fight for justice after mother's murder,https://9now.nine.com.au/60-minutes/prabha-arunkumar-murder-sydney-parramatta-park-grieving-daughters-fight-for-justice/fca20ea5-e60d-40b6-afd3-048e5ad41c8f
9 News,Couple arrive home to find nasty note taped to their door,https://www.domain.com.au/news/couple-confronted-by-rude-note-eight-hours-after-picking-up-apartment-keys-1414069/?utm_source=nine.com.au&utm_medium=referral&utm_campaign=editorial-homepage-driver
9 News,The last affordable suburb in Sydney revealed,https://www.domain.com.au/news/girraween-the-closest-suburb-to-sydneys-cbd-for-under-1-million-is-24km-away-1408376/?utm_source=nine.com.au&utm_medium=referral&utm_campaign=editorial-homepage-driver
9 News,The unusual reason Peter bought this derelict cottage,https://www.domain.com.au/news/i-collected-it-peter-bought-this-run-down-riverside-nz-cottage-for-nostalgia-1414033/?utm_source=nine.com.au&utm_medium=referral&utm_campaign=editorial-homepage-driver
9 News,The bad driving habits Australians can't stop admitting to,https://www.drive.com.au/caradvice/blame-other-drivers-the-bad-driving-habits-australians-cant-stop-admitting-to/?utm_source=nine-rail&utm_medium=referral
9 News,"The new Aston Martin unveiled: 'quicker, more powerful, and more focused'",https://www.drive.com.au/news/2026-aston-martin-db12-s-arrives-as-new-flagship-for-the-db-line/?utm_source=nine-rail&utm_medium=referral
9 News,GWM confirms new-model blitz for Australia,https://www.drive.com.au/news/gwm-confirms-new-model-blitz-for-australia-led-by-hybrid-and-electric-cars/?utm_source=nine-rail&utm_medium=referral
9 News,The white markings are not a DIY disaster. It's more concerning5 minutes ago,https://www.domain.com.au/news/whole-place-is-littered-pest-controller-horrified-by-state-of-homes-roof-space-1436470/?utm_source=9news.com.au&utm_medium=referral&utm_campaign=editorial-homepage-driver
9 News,Optus sent triple-zero outage notification to wrong email address15 minutes ago,https://www.9news.com.au/national/optus-triple-zero-outage-email-notification-wrong-address/9e012423-d5ff-440f-b650-d1727e46aea8
9 News,This 'snack' could make millions of unfit Aussies 'significantly' healthieran hour ago,https://www.9news.com.au/national/exercise-snacks-could-make-unfit-australians-healthier/dd84905e-a2d7-4950-aac2-c1cf6f28c6da
9 News,Cyclist dies after collision with Mercedes in Melbourne's northan hour ago,https://www.9news.com.au/national/cyclist-dies-after-collision-with-mercedes-in-attawood-in-melbournes-north-victoria/121c8378-d59b-467a-9d4a-271e61215136
9 News,Tony Abbott's provocative advice to UK politicians raises eyebrowsan hour ago,https://www.9news.com.au/world/tony-abbott-australia-prime-minister-united-kingdom-britain-england-migrants/dc9da3e7-2428-4671-afb2-d21660790203
9 News,"Females carry a higher genetic risk of depression than males, scientists sayan hour ago",https://www.9news.com.au/health/women-carry-far-higher-genetic-risk-of-depression-than-men/969c61a1-cd78-4ef4-94d2-60058c282450
9 News,Eagles skipper's move set to result in record compensationan hour ago,https://www.nine.com.au/sport/afl/trade-news-2025-live-updates-day-three-rumours-whispers-draft-20251008-p5n0ux.html
9 News,Attorney-general dodges questions about alleged incriminating Trump-Epstein photos2 hours ago,https://www.9news.com.au/world/jeffrey-epstein-donald-trump-pam-bondi-questions-incriminating-photos-young-women-usa-news/9f623928-138a-4dea-83db-3143bb52ced6
9 News,Crime syndicate 'breakdown' behind alleged 'kill team' hit attempt2 hours ago,https://www.9news.com.au/national/police-operation-in-sydney-south-west/4a50e992-95bd-4de7-bf77-525a3d301083
9 News,Public transport in Victoria to be free on weekends for two months2 hours ago,https://www.9news.com.au/national/victoria-free-public-transport-every-weekend-over-summer/4cf3d6e7-89a0-42f9-b5ea-07e85e0c1115
Guardian,ICC convicts former Sudan militia leader for war crimes in Darfur,https://www.theguardian.com/world/2025/oct/06/icc-convicts-former-sudan-militia-leader-ali-kushayb-war-crimes-in-darfur-janjaweed
Guardian,Eswatini confirms arrival of 10 more people as part of US deportation deal,https://www.theguardian.com/world/2025/oct/06/us-deportees-eswatini-lawyers-ngos
Guardian,"""The fear was immense"": al-Shabaab exploits fragmented politics to reclaim land in Somalia",https://www.theguardian.com/world/2025/oct/04/the-fear-was-immense-al-shabaab-exploits-fragmented-politics-to-reclaim-land-in-somalia
Guardian,Kenyan activists abducted after joining opposition rally in Uganda,https://www.theguardian.com/world/2025/oct/02/kenyan-activists-abducted-after-joining-opposition-rally-in-uganda
Guardian,Organisers call for sixth night of protest as Morocco death toll rises to three,https://www.theguardian.com/world/2025/oct/02/first-deaths-in-moroccos-youth-led-anti-government-protests-as-police-open-fire
Guardian,"Brazil""s president asks US to scrap tariffs in ""friendly"" call with Trump",https://www.theguardian.com/world/2025/oct/06/brazil-president-lula-trump-tariffs-sanctions
Guardian,"Rush reform for first time since drummer Neil Peart""s death",https://www.theguardian.com/music/2025/oct/06/rush-reform-for-first-time-since-drummer-neil-peart-death-annika-nilles
Guardian,Weather tracker: Typhoon Matmo batters southern China,https://www.theguardian.com/environment/2025/oct/06/weather-tracker-typhoon-matmo-batters-southern-china
Guardian,"US struck another alleged drug boat off Venezuela coast, Trump says",https://www.theguardian.com/us-news/2025/oct/05/trump-drug-boat-strike-venezuela
Guardian,Hegseth says four killed in US strike on alleged drug boat off Venezuelan coast,https://www.theguardian.com/us-news/2025/oct/03/hegseth-venezuela-deadly-boat-strike
Guardian,"New Zealand oceans warming 34% faster than global average, putting homes and industry at risk, report finds",https://www.theguardian.com/world/2025/oct/08/new-zealand-oceans-warming-34-per-cent-faster-than-global-average
Guardian,Indonesia school collapse: search for victims ends as 67 confirmed dead,https://www.theguardian.com/world/2025/oct/07/ndonesia-school-collapse-search-for-victims-ends-as-67-confirmed-dead
Guardian,"New Zealand foreign minister Winston Peters"" home vandalised ""during a protest""",https://www.theguardian.com/world/2025/oct/07/new-zealand-foreign-minister-winston-peters-home-vandalised-during-protest-ntwnfb
Guardian,"Mount Everest hikers describe ""extreme"" conditions as huge rescue effort continues",https://www.theguardian.com/world/2025/oct/06/mount-everest-hikers-describe-extreme-conditions-as-huge-rescue-effort-continues
Guardian,Gaza flotilla passengers allege poor conditions in detention as Israel prepares to deport dozens of activists,https://www.theguardian.com/world/2025/oct/06/gaza-flotilla-passengers-allege-poor-conditions-in-detention-as-israel-prepares-to-deport-dozens-of-activists
Guardian,"Australia politics live: Price says leaks risk Liberals looking like ""clown show""; police warn of potential ""disaster"" at Gaza rally",https://www.theguardian.com/australia-news/live/2025/oct/08/australia-politics-live-gaza-rally-parliament-anthony-albanese-sussan-ley-question-time-andrew-hastie-ntwnfb
Guardian,"Alleged ""kill team"" charged after arrest en route to hit near Sydney daycare",https://www.theguardian.com/australia-news/2025/oct/08/alleged-kill-team-charged-after-arrest-en-route-to-hit-near-sydney-daycare
Guardian,NSW official admits hiding in cupboard during multimillion-dollar kickback investigation,https://www.theguardian.com/australia-news/2025/oct/07/nsw-official-admits-hiding-in-cupboard-during-multimillion-dollar-kickback-investigation
Guardian,"Media and political attacks on Australia""s emissions targets ""straight out of the climate obstruction playbook"", expert says",https://www.theguardian.com/australia-news/2025/oct/07/media-political-attacks-australia-emissions-target-climate-obstruction-playbook-newscorp-business-council
Guardian,"Women carry a higher genetic risk of depression, new study says",https://www.theguardian.com/science/2025/oct/07/women-carry-a-higher-genetic-risk-of-depression-new-study-says
Guardian,"Gisèle Pelicot""s ex-husband tells court man convicted of rape knew she was sedated",https://www.theguardian.com/world/2025/oct/07/gisele-pelicot-ex-husband-tells-court-man-convicted-rape-knew-sedated
Guardian,"Denmark plans social media ban for under-15s as PM warns phones ""stealing childhood""",https://www.theguardian.com/world/2025/oct/07/danish-pm-plans-to-ban-social-media-for-under-15s-warning-it-is-stealing-childhood
Guardian,"EU plan to match Trump steel tariffs spurs ""existential threat"" to UK steel industry",https://www.theguardian.com/business/2025/oct/07/eu-plan-to-match-trump-steel-tariffs-spurs-existential-threat-to-uk-steel-industry
Guardian,Macron under pressure to call snap parliamentary elections or resign,https://www.theguardian.com/world/2025/oct/07/edouard-philippe-sebastien-lecornu-france-emmanuel-macron-elections
Guardian,"Far-right National Rally snubs French PM""s bid to salvage cabinet amid political turmoil "" as it happened",https://www.theguardian.com/world/live/2025/oct/07/france-macron-lecornu-cabinet-europe-live
Guardian,Mamdani attends Israelis for Peace vigil after his 7 October statement draws ire from Israel,https://www.theguardian.com/us-news/2025/oct/07/zohran-mamdani-statement-october-7-anniversary
Guardian,US delegation led by Steve Witkoff due to arrive in Egypt for Gaza talks,https://www.theguardian.com/us-news/2025/oct/07/us-steve-witkoff-to-arrive-egypt-gaza-talks
Guardian,"Israel marks two years since 7 October Hamas attack as Gaza ceasefire talks continue "" as it happened",https://www.theguardian.com/world/live/2025/oct/07/gaza-ceasefire-peace-talks-israel-hamas-egypt-7-october-anniversary-middle-east-crisis-live-news-updates
Guardian,"Diplomacy""s lowest point: how the Israel-Gaza conflict was mishandled",https://www.theguardian.com/world/2025/oct/07/diplomacy-lowest-point-how-the-israel-gaza-conflict-was-mishandled
Guardian,"Israelis gather to mark two years since 7 October Hamas attack that killed 1,200",https://www.theguardian.com/world/2025/oct/07/israelis-gather-to-mark-two-years-since-7-october-hamas-attack-that-killed-1200
Guardian,Arbitrary detention victims urge Starmer to press Modi on jailed British Sikh,https://www.theguardian.com/politics/2025/oct/01/keir-starmer-narendra-modi-india-jagtar-singh-johal-release
Guardian,"Afghanistan ""blind without phones and internet"" on second day of telecoms blackout",https://www.theguardian.com/world/2025/sep/30/afghanistan-mobile-phones-internet-telecoms-blackout-taliban
Guardian,Afghanistan hit by communications blackout after Taliban shuts internet,https://www.theguardian.com/world/2025/sep/29/afghanistan-communications-blackout-taliban-shuts-internet
Guardian,At least 40 dead and 124 injured in crush at Vijay rally in India,https://www.theguardian.com/world/2025/sep/27/dead-and-injured-in-stampede-at-vijay-rally-in-india
Guardian,"Trump brags of ""massive"" oil deal in Pakistan "" but drilling has not found any",https://www.theguardian.com/world/2025/sep/27/pakistan-us-oil-deal-analysis-trump
Guardian,Green groups criticise plans to weaken protections for English national parks,https://www.theguardian.com/environment/2025/oct/08/green-groups-criticise-plans-weaken-protections-english-national-parks
Guardian,"One in three UK workers have called in sick after work drinks, survey finds",https://www.theguardian.com/society/2025/oct/08/one-in-three-uk-workers-have-called-in-sick-after-work-drinks-survey-finds
Guardian,"Lifetime of earnings not enough for UK workers to join wealthiest 10%, report says",https://www.theguardian.com/inequality/2025/oct/08/lifetime-of-earnings-not-enough-for-uk-workers-to-join-wealthiest-10-report-says
Guardian,"Brexit has done nothing to stem sharp decline of UK fish populations, shows study",https://www.theguardian.com/environment/2025/oct/08/brexit-nothing-stem-decline-uk-fish-populations-study
Guardian,"A British Ice and more stop and search: Badenoch""s Tories set out new policies",https://www.theguardian.com/politics/2025/oct/07/badenoch-tories-new-policies-british-ice-stop-and-search
Guardian,"Dolly Parton ""going to be just fine"", singer""s sister says as she calls for prayers amid health problems",https://www.theguardian.com/music/2025/oct/08/dolly-parton-health-problems-sister-prayers-going-to-be-just-fine
Guardian,"Tesla debuts ""affordable"" Model Y and 3 in US that strike some as too expensive",https://www.theguardian.com/us-news/2025/oct/07/tesla-affordable-model-y-3
Guardian,"Oregon""s governor says she told Kristi Noem ""there is no insurrection in Oregon"" "" live",https://www.theguardian.com/us-news/live/2025/oct/07/donald-trump-national-guard-pam-bondi-mark-carney-government-shutdown-us-politics-live-news-updates
Guardian,Thirty Bob Ross paintings to be sold at auction to help fund public TV stations,https://www.theguardian.com/us-news/2025/oct/07/bob-ross-painting-auction-public-television
