Section,Headline,Link
Sky News,Autism diagnosis' putting strain on NDIS sustainability,https://www.skynews.com.au/australia-news/autism-diagnosis-putting-strain-on-ndis-sustainability/video/a059a26b8e261f81da5e67e7e2a0d003
Sky News,"Coalition ""unapologetically' pro-gas",https://www.skynews.com.au/australia-news/politics/coalition-unapologetically-progas/video/8fa0431b584361ee607563e496654f18
Sky News,"""Extraordinary achievement': James Paterson praises ASIO for IRGC findings",https://www.skynews.com.au/australia-news/politics/extraordinary-achievement-james-paterson-praises-asio-for-irgc-findings/video/d599b491f8bad760468dcbe1b4aaae63
Sky News,Politicians dress up for Canberra's annual Midwinter Ball,https://www.skynews.com.au/australia-news/politicians-dress-up-for-canberras-annual-midwinter-ball/video/8b921f4a15a55e7f386e9b3bc3e1b0eb
Sky News,Today's News Headlines: Palestinian UN Envoy: Palestine won't fade,https://www.skynews.com.au/australia-news/todays-news-headlines-palestinian-un-envoy-palestine-wont-fade/video/0e356be60c77aae48274d29c6930e330
Sky News,Thick sea foam blankets Adelaide's Henley Beach,https://www.skynews.com.au/australia-news/thick-sea-foam-blankets-adelaides-henley-beach/video/d99631c5f93c0f6ff77458a5f823ebd8
Sky News,Calls for e-scooter ban for Queensland children,https://www.skynews.com.au/australia-news/calls-for-escooter-ban-for-queensland-children/video/6e8ead8222326f793bc650d8f33bb8bb
Sky News,Coalition plans a domestic gas reserve,https://www.skynews.com.au/australia-news/politics/coalition-plans-a-domestic-gas-reserve/video/3bb314e76edde07b77ac730d29090eba
Sky News,Pentagon denies formal meeting between Marles and Hegseth,https://www.skynews.com.au/australia-news/politics/pentagon-denies-formal-meeting-between-marles-and-hegseth/video/5960d3ca5fc2cf6056b62c34a5d7b1e5
Sky News,Today's News Headlines: Monthly inflation rises to 2.8 per cent,https://www.skynews.com.au/australia-news/todays-news-headlines-monthly-inflation-rises-to-28-per-cent/video/88d4c36902bb5364fc7bd42476dc4929
Sky News,"Treasurer slams Ted O'Brien for wanting to waste ""hundreds of billions of dollars' on nuclear",https://www.skynews.com.au/australia-news/politics/treasurer-slams-ted-obrien-for-wanting-to-waste-hundreds-of-billions-of-dollars-on-nuclear/video/2e8b95e92ad6a81246490cff8a754d8d
Sky News,"Listen to ""Sky News Radio' on the Nova Player app",https://www.skynews.com.au/business/media/you-can-listen-to-sky-news-australia-anytime-and-on-any-platform-with-sky-news-radio-on-iheartradio/news-story/2d6aca31bc7566b5c0652db48284f5b7
Sky News,Catch up on your favourite Sky News shows with podcasts,https://www.skynews.com.au/opinion/your-favourite-sky-news-australia-shows-are-available-to-listen-to-any-time-as-podcasts/news-story/379bbe36e745709ce679d2813be0249c
