Section,Headline,Link
9 News,ExclusiveSweet 16 birthday party gatecrashed by 500 teens,https://www.9news.com.au/national/kirrawee-birthday-party-gatecrashed-by-500-teenagers-in-sydneys-south/6a917952-9de8-422e-9918-b34fc4138421
9 News,Piastri fifth as Mercedes take dominant first-row lockout,https://www.nine.com.au/sport/motorsport/f1-australian-grand-prix-2026-qualifying-george-russell-pole-mercedes-first-row-max-verstappen-crash-video-oscar-piastri-fifth-20260307-p5o8e7.html
9 News,Six-hour mission rescues 34 people trapped on a bus in Queensland floodwaters,https://www.9news.com.au/national/queensland-weather-major-flooding-katherine-rainfall/a95f31e3-c068-44e6-b677-5d45d6a4f908
9 News,'I did not quit': Jackie O breaks her silence,https://www.9news.com.au/national/kyle-and-jackie-o-feud-henderson-breaks-silence-over-sandilands-fallout/e6899dc2-424a-46eb-ae1e-745f59ca578b
9 News,Why Savannah's commute costs more than just time,https://www.domain.com.au/news/priced-out-young-australians-are-struggling-to-find-affordable-homes-in-inner-city-suburbs-1489481/?utm_source=9news.com.au&utm_medium=referral&utm_campaign=editorial-homepage-driver
9 News,Teens charged with murder following deadly Melbourne train station brawlan hour ago,https://www.9news.com.au/national/melbourne-fatal-brawl-mernda-four-teenagers-arrested/d580167c-7731-4362-9afc-f5b24961c2c1
9 News,Iran's president apologises for strikes on neighbours,https://www.9news.com.au/world/us-israel-attack-iran-iranian-president-apologises-for-strikes-on-neighbours/a1f5f2dc-3fd9-44b5-b7bd-3e4e27da2e48
9 News,"Entertainer Jamie Dunn, voice behind beloved puppet Agro, dies aged 76",https://www.9news.com.au/national/jamie-dunn-death-agro-dies-at-the-age-of-75/3ebf4ab8-077a-490d-be2f-9b16a408fc43
9 News,Opposition Leader gives first major party address,https://www.9news.com.au/videos/national/opposition-leader-gives-first-major-party-address/cmmg0tokd001j0gnxjhvvhoe8
9 News,Bomb squad detectives uncover multiple 'explosive devices' in Perth2 hours ago,https://www.9news.com.au/videos/national/bomb-squad-detectives-uncover-multiple-explosive-devices-in-perths-east/cmmg6f58k001e0gochrpds7o5
9 News,China hits back at claims of 'unsafe' encounter with Australian forces2 hours ago,https://www.9news.com.au/videos/world/beijing-hits-back-at-accusations-of-unsafe-encounter-with-australian-forces/cmmg67a1l00160hpha87dgr8x
9 News,One Nation's lead candidate Cory Bernardi doubles down on gay marriage comments,https://www.9news.com.au/videos/national/one-nations-lead-candidate-cory-bernardi-doubles-down-on-gay-marriage-comments/cmmg0to1q00180go2mg41n1p7
9 News,Wife's plea over camera after husband killed in Bondi terror attack,https://www.9news.com.au/national/bondi-shooting-terror-attack-widows-plea/ba00e49e-0a00-4a1c-8b2f-ea65899bb3e8
9 News,Stranded Aussies offered buses from Qatar to Saudi Arabia,https://www.9news.com.au/national/government-to-offer-bus-rides-from-qatar-to-saudi-arabia-to-help-stranded-aussies-get-home/01e5eb0a-af57-4ef1-a77d-c04143fd5da4
9 News,Porn giant blocks Australian website access over new age-check laws,https://www.9news.com.au/national/aylo-pornhub-global-pornography-giant-blocks-australian-website-access-over-new-agecheck-laws/ccfe9d8a-6fd8-42a9-878e-7f561892f9b9
9 News,"Iran getting secret, potentially deadly help from long-time US adversary",https://www.9news.com.au/world/russia-has-provided-iran-with-information-that-can-help-tehran-strike-us-military-ap-sources-say/64ae102a-de8d-4c2b-ad25-6b110b5b3fef
9 News,Man allegedly stabbed two people after carjacking ATV,https://www.9news.com.au/national/stabbing-sunshine-coast-bokarina--queensland/ed7ee1bf-b32d-4a53-baca-ff43edb2de94
9 News,Aussies to prove their age to access these online sites and services,https://www.9news.com.au/national/esafety-commission-age-restriction-codes-aussies-to-prove-their-age/f6e14c62-4e3d-4c13-b53b-bcbc2413d254
9 News,Indonesia to follow Australia in under-16s social media ban,https://www.9news.com.au/world/indonesia-will-ban-social-media-for-children-under-16-communication-minister-says/634d7359-f9e6-4b2d-8c63-fc96b56eca55
9 News,Six-hour mission rescues 34 people trapped on a bus in Queensland floodwaters,https://www.9news.com.au/national/queensland-weather-major-flooding-katherine-rainfall/a95f31e3-c068-44e6-b677-5d45d6a4f908
9 News,'I did not quit': Jackie O breaks her silence,https://www.9news.com.au/national/kyle-and-jackie-o-feud-henderson-breaks-silence-over-sandilands-fallout/e6899dc2-424a-46eb-ae1e-745f59ca578b
9 News,Why Savannah's commute costs more than just time,https://www.domain.com.au/news/priced-out-young-australians-are-struggling-to-find-affordable-homes-in-inner-city-suburbs-1489481/?utm_source=9news.com.au&utm_medium=referral&utm_campaign=editorial-homepage-driver
9 News,"today in historyWaitress sued, kidnapped after getting winning lottery ticket as a tip",https://www.9news.com.au/world/today-in-history-march-7-what-happened-on-this-day-lottery-win-tragedy/b789654f-90b5-42aa-a29f-fcf4a142b597
9 News,How 73 years of history led to an attack and leader's assassination,https://www.9news.com.au/world/us-israel-attacks-iran-timline-events/ff4273f6-5e5f-40cf-949d-28907f8dfc21
9 News,The men in line to take over from the ayatollah,https://www.9news.com.au/world/us-iran-israel-war-who-is-running-iran-after-ayatollah-ali-khamenei-death/0c4850b8-871f-43ad-ae05-d02d12a6d0ee
9 News,"Iran's airstrikes may have just cracked Dubai's safe, shiny façade forever",https://www.9news.com.au/world/us-israel-attacks-iran-air-strikes-rock-dubai-reputation/0c961082-f5a0-4bc4-a440-717be79e027a
9 News,Tony went through 'hell' due to unnecessary surgery as a child,https://www.9news.com.au/national/intersex-australians-tony-briffa-went-through-hell-due-to-unnecessary-surgery/8506f309-373a-48b6-9327-310fefbdbd92
9 News,Inside a footy titan's $47m waterfront estate,https://www.domain.com.au/news/carlton-afl-president-lists-historic-mosman-waterfront-estate-1491467/?utm_source=9news.com.au&utm_medium=referral&utm_campaign=editorial-homepage-driver
9 News,Police launch co-ordinated raids on outlaw motorcycle gangs across Australia and NZ,https://www.9news.com.au/national/comancheros-raids-police-motorcycle-outlaw-gangs-australia-new-zealand-raids/b983ad1b-619a-48cf-86d6-b86f9098eb8f
9 News,Town facing flood disaster as twin tropical lows dump rain,https://www.9news.com.au/national/qld-cyclone-weather-forecast-tropical-low-north-queensland-pelted-with-heavy-rain-millions-prepare-for-wet-weekend/af168ca1-ac26-46c7-8199-46f5413d5f38
9 News,Huge call over future of cash made amid fears over 'cashless society',https://www.9news.com.au/national/reserve-bank-makes-call-on-the-future-of-cash-during-meeting/fe4b931b-d830-48ee-97aa-d37df86f6184
9 News,Young man jailed over crash that killed his two passengers,https://www.9news.com.au/videos/national/young-man-jailed-over-crash-that-killed-his-two-passengers/cmmelzr4s00190hmolh3mnke2
9 News,WATCHDangerous incident between ADF and China's navy,https://www.9news.com.au/videos/national/dangerous-incident-between-adf-and-chinas-navy/cmmeks0sf001c0gmzoq52ooh0
9 News,Dingoes to blame for Canadian teen's beach death: coroner,https://www.9news.com.au/national/kgari-backpacker-death-piper-james-drowning-dingo-attack-coroners-court-queensland-news/1507f2a9-008f-40e0-bb9c-4473c6ea3a09
9 News,"Business owner sends premier $24,000 bill over new public holiday",https://www.9news.com.au/national/nsw-business-owner-sends-premier-chris-minns-24000-bill-over-new-public-holiday-costs/95bd2449-c6a5-4e38-9888-39d29628d090
9 News,Girl mauled by dog in Perth's northern suburbs,https://www.9news.com.au/national/hillarys-dog-attack-young-girl-rushed-to-hospital-after-dog-attack-in-perths-northern-suburbs/8b1a4862-b163-41d0-b8f2-26d24650c6d3
9 News,Fire ant nest detected in World Heritage rainforest on Gold Coast,https://www.9news.com.au/national/fire-ants-queensland-detected-in-world-heritage-rainforest-lamington-national-park-environment-news/309a3679-5ac2-4f2c-b8f7-76a03835a1c6
9 News,Satellite images show the extent of US-Israeli attacks across Iran,https://www.9news.com.au/world/us-israel-attacks-iran-satellite-images-show-the-extent-of-usisraeli-attacks-across-iran/71fe336c-32be-435c-a1a0-858899389ef7
9 News,Trump rules out talks absent Iran's 'unconditional surrender',https://www.9news.com.au/world/us-israel-attack-iran-donald-trump-rules-out-negotiating-with-iran-unconditional-surrender/e16f67ed-4bbc-4d1e-9d93-5da95b04ad90
9 News,Trump identifies his next target for attack,https://www.9news.com.au/world/donald-trump-says-cuba-to-fall-soon/53ecb406-2629-415d-9b60-cefab14412af
9 News,"Country by country, here's how the unfolding war is affecting the Middle East and beyond",https://www.9news.com.au/world/us-israel-attack-iran-country-by-country-here-is-how-the-unfolding-war-is-affecting-the-middle-east-and-beyond/f2073115-4157-431a-a658-b4a34b89a7ec
9 News,This $1m penthouse just sold for less than $4k,https://www.domain.com.au/news/the-luxury-million-dollar-penthouse-that-sold-for-less-than-4000-1491489/?utm_source=9news.com.au&utm_medium=referral&utm_campaign=editorial-homepage-driver
9 News,Mystery dot on old map leads to shock discovery,https://www.domain.com.au/news/urban-explorers-uncover-forgotten-18th-century-homestead-1491559/?utm_source=9news.com.au&utm_medium=referral&utm_campaign=editorial-homepage-driver
9 News,Big call on Eels star's ban after controversial sin bin,https://www.nine.com.au/sport/nrl/news-2026-jmaine-hopgood-charge-high-tackle-parramatta-eels-vs-storm-reaction-brian-kelly/39826e2b-f787-447b-97e4-42ebfe8bc4ed
9 News,Bellamy's cheeky dig at Grant amid Smith comparisons,https://www.nine.com.au/sport/nrl/news-2026-melbourne-storm-harry-grant-vs-eels-craig-bellamy-cameron-smith-comparisons/b4c56eea-7e5f-4716-980e-4d84db405447
9 News,Star sprays former captain then posts to Instagram,https://www.nine.com.au/sport/afl/news-2026-swans-vs-carlton-blues-fights-charlie-curnow-ollie-florent-callum-mills-isaac-heeney-video/d3f76277-d754-4869-ba1a-693c377d7200
9 News,World Cup semi turns on run out after England gun's epic hundred,https://www.nine.com.au/sport/cricket/news-t20-world-cup-semi-final-england-india-scores-jacob-bethell-hundred-run-out/30edef50-018b-46c8-84ae-afde74bb13b2
9 News,'Cruel blow' threatens to derail Titans on eve of season,https://www.nine.com.au/sport/nrl/season-preview-2026-gold-coast-titans-round-one-starting-17-predictions-team-list-latest-news-mole-exclusive/6bf08ff9-21e6-474b-94a6-412bf8c9b32c
9 News,'Very problematic' injury rocks Matildas despite win,https://www.nine.com.au/sport/football/womens-asian-cup-2026-australia-matildas-defeat-ir-iran-alanna-kennedy-scores-brace-hayley-raso-injury/65e56195-cd95-4da2-8aea-fdc635425f24
9 News,Unthinkable 49-year first looms for woeful Spurs,https://www.nine.com.au/sport/football/premier-league-2026-tottenham-hotspur-crystal-palace-news-spurs-disarray-micky-van-de-ven-red-card-video-reaction/6d9026dd-0438-489b-801e-dbebd4ce97e5
9 News,Roast chook - four ways to level up your bachelor's handbag,https://9now.nine.com.au/today/roast-chicken-four-ways/fd790ca9-889a-4bbc-b0f4-509eef602366
9 News,Ray Hadley provides update on granddaughter's cancer battle,https://9now.nine.com.au/today/ray-hadley-radio-legend-granddaughter-cancer-remission/579c8700-a5c2-42df-90a6-b7c34b6c2f20
9 News,Penny Wong concerned conflict could be spreading,https://9now.nine.com.au/today/penny-wong-concerned-conflict-in-middle-east-could-be-spreading/3a32d4da-306e-491c-aad3-fb9774867842
9 News,Empty seats on flight home to Australia from the Middle East,https://9now.nine.com.au/a-current-affair/qantas-statement-on-middle-east-crisis/1133698b-1514-4e87-8875-3523da0839d8
9 News,Retired mechanic's extraordinary marine project,https://9now.nine.com.au/a-current-affair/retired-mechanic-pauly-mccamleys-extraordinary-marine-project/a475ce62-6a3c-4641-bbad-5986e355c85f
9 News,Looters target landslide homes as owners left in limbo,https://9now.nine.com.au/a-current-affair/newcastle-landslide-governments-argue-over-130-million-repair-bill/d4d752f5-53c8-4a60-a8c2-036b7ae6115e
9 News,How an unconventional Australian family became caught in a media storm in Italy,https://9now.nine.com.au/60-minutes/unconventional-australian-family-caught-in-a-media-storm-in-italy/c6a1424b-e0ff-4558-9e19-ced2edd48271
9 News,Meeting the Bondi hero who tried to stop a terrorist,https://9now.nine.com.au/60-minutes/bondi-shooting-meeting-bondi-hero-ahmed-al-ahmed-who-tried-to-stop-a-terrorist/098bf922-1d62-47a9-afa4-7de7dc4e3262
9 News,"'My target was just to take the gun, and stop him from killing a human being'",https://9now.nine.com.au/60-minutes/bondi-shooting-terror-attack-ahmed-al-ahmed/4586130f-5643-46e2-859d-5283aec53aa9
9 News,Rich-lister Brad Moran's giant Gold Coast compound up for grabs,https://www.domain.com.au/news/inside-the-estate-tallais-30m-tech-powered-mansion-redefining-gold-coast-luxury-1448607/?utm_source=nine.com.au&utm_medium=referral&utm_campaign=editorial-homepage-driver
9 News,Owner ordered to tear down $2.5 million house amid planning feud,https://www.domain.com.au/news/man-ordered-to-tear-down-2-5-million-house-amid-planning-feud-1475103/?utm_source=nine.com.au&utm_medium=referral&utm_campaign=editorial-homepage-driver
9 News,Grandmother wins $9m lake house after ignoring husband's warning,https://www.domain.com.au/news/grandmother-wins-9m-lake-house-after-ignoring-husbands-warning-1474093/?utm_source=nine.com.au&utm_medium=referral&utm_campaign=editorial-homepage-driver
9 News,Couple arrive home to find nasty note taped to their door,https://www.domain.com.au/news/couple-confronted-by-rude-note-eight-hours-after-picking-up-apartment-keys-1414069/?utm_source=nine.com.au&utm_medium=referral&utm_campaign=editorial-homepage-driver
9 News,The last affordable suburb in Sydney revealed,https://www.domain.com.au/news/girraween-the-closest-suburb-to-sydneys-cbd-for-under-1-million-is-24km-away-1408376/?utm_source=nine.com.au&utm_medium=referral&utm_campaign=editorial-homepage-driver
9 News,The unusual reason Peter bought this derelict cottage,https://www.domain.com.au/news/i-collected-it-peter-bought-this-run-down-riverside-nz-cottage-for-nostalgia-1414033/?utm_source=nine.com.au&utm_medium=referral&utm_campaign=editorial-homepage-driver
9 News,Five things Max Verstappen hates about the new F1 cars,https://www.drive.com.au/caradvice/five-things-max-verstappen-hates-about-the-new-f1-cars/?utm_source=nine-rail&utm_medium=referral
9 News,Supercharged V8 muscle car will make a comeback,https://www.drive.com.au/news/dodge-charger-hellcat-supercharged-v8-muscle-car-to-return-report/?utm_source=nine-rail&utm_medium=referral
9 News,Skoda Kodiaq recalled in Australia over potential airbag issue,https://www.drive.com.au/news/2024-2025-skoda-kodiaq-recalled-in-australia-over-potential-airbag-issue/?utm_source=nine-rail&utm_medium=referral
9 News,Teens charged with murder following deadly Melbourne train station brawlan hour ago,https://www.9news.com.au/national/melbourne-fatal-brawl-mernda-four-teenagers-arrested/d580167c-7731-4362-9afc-f5b24961c2c1
9 News,China hits back at claims of 'unsafe' encounter with Australian forces2 hours ago,https://www.9news.com.au/videos/world/beijing-hits-back-at-accusations-of-unsafe-encounter-with-australian-forces/cmmg67a1l00160hpha87dgr8x
9 News,Bomb squad detectives uncover multiple 'explosive devices' in Perth2 hours ago,https://www.9news.com.au/videos/national/bomb-squad-detectives-uncover-multiple-explosive-devices-in-perths-east/cmmg6f58k001e0gochrpds7o5
9 News,One Nation's lead candidate Cory Bernardi doubles down on gay marriage comments,https://www.9news.com.au/videos/national/one-nations-lead-candidate-cory-bernardi-doubles-down-on-gay-marriage-comments/cmmg0to1q00180go2mg41n1p7
9 News,Opposition Leader gives first major party address,https://www.9news.com.au/videos/national/opposition-leader-gives-first-major-party-address/cmmg0tokd001j0gnxjhvvhoe8
9 News,"Entertainer Jamie Dunn, voice behind beloved puppet Agro, dies aged 76",https://www.9news.com.au/national/jamie-dunn-death-agro-dies-at-the-age-of-75/3ebf4ab8-077a-490d-be2f-9b16a408fc43
9 News,Six-hour mission rescues 34 people trapped on a bus in Queensland floodwaters,https://www.9news.com.au/national/queensland-weather-major-flooding-katherine-rainfall/a95f31e3-c068-44e6-b677-5d45d6a4f908
9 News,Sweet 16 birthday party gatecrashed by 500 teens,https://www.9news.com.au/national/kirrawee-birthday-party-gatecrashed-by-500-teenagers-in-sydneys-south/6a917952-9de8-422e-9918-b34fc4138421
9 News,Iran's president apologises for strikes on neighbours,https://www.9news.com.au/world/us-israel-attack-iran-iranian-president-apologises-for-strikes-on-neighbours/a1f5f2dc-3fd9-44b5-b7bd-3e4e27da2e48
9 News,Piastri fifth as Mercedes take dominant first-row lockout,https://www.nine.com.au/sport/motorsport/f1-australian-grand-prix-2026-qualifying-george-russell-pole-mercedes-first-row-max-verstappen-crash-video-oscar-piastri-fifth-20260307-p5o8e7.html
Guardian,"Weight-loss jab could be made for $3 a month, study finds",https://www.theguardian.com/global-development/2026/mar/06/generic-drugs-weight-loss-semaglutide-ozempic-wegovy-diabetes-obesity-study
Guardian,Three men deported by US file legal case against Eswatini over detention,https://www.theguardian.com/world/2026/mar/05/three-men-deported-us-eswatini-legal-case-detention
Guardian,"South Africa""s president calls Trump""s policy to offer refuge to white Afrikaners ""racist""",https://www.theguardian.com/world/2026/mar/05/south-africa-president-cyril-ramaphosa-calls-donald-trump-policy-white-afrikaners-racist
Guardian,Lewis Hamilton sets sights on racing in an African grand prix before retiring,https://www.theguardian.com/sport/2026/mar/05/lewis-hamilton-race-africa-grand-prix-retiring-formula-one-colonial
Guardian,South Sudan risks return to full-blown civil war as violence escalates,https://www.theguardian.com/world/2026/mar/03/south-sudan-risks-return-civil-war-violence-escalates
Guardian,"""An ideological guest list"": Trump invites Latin America""s rightwing leaders to Florida summit",https://www.theguardian.com/world/2026/mar/07/an-ideological-guest-list-trump-invites-latin-americas-rightwing-leaders-to-florida-summit
Guardian,"Peruvian state responsible for mother""s death in forced sterilisation, court rules",https://www.theguardian.com/global-development/2026/mar/06/peruvian-state-responsible-for-mothers-death-in-forced-sterilisation-court-rules
Guardian,"Iranian mathematician missing in Canada may have been targeted by Tehran, activists say",https://www.theguardian.com/world/2026/mar/06/missing-iranian-canada-masood-masjoody
Guardian,"Iran is not Venezuela, despite Trump""s hopes of repeating ""regime capture"" strategy",https://www.theguardian.com/world/2026/mar/06/iran-venezuela-trump-regime-capture
Guardian,"US and Venezuela move to restore diplomatic ties two months after Maduro""s capture",https://www.theguardian.com/us-news/2026/mar/06/us-venezuela-diplomatic-ties-relations-delcy-rodriguez
Guardian,Indonesia to ban social media for children under 16,https://www.theguardian.com/technology/2026/mar/06/indonesia-social-media-ban-children
Guardian, Philippines orders energy cuts in response to Middle East war,https://www.theguardian.com/world/2026/mar/06/philippines-orders-energy-cuts-middle-east-war-fuel-prices
Guardian,"Jimmy Lai will not appeal conviction, paving way for political negotiations over release",https://www.theguardian.com/world/2026/mar/06/jimmy-lai-will-not-appeal-conviction-paving-way-for-political-neogtiations-over-release
Guardian,Vanuatu moves forward with UN climate resolution despite Trump opposition,https://www.theguardian.com/world/2026/mar/05/vanuatu-un-climate-crisis-trump
Guardian,Oil price continues to rise amid Middle East crisis but stock markets rebound across Asia,https://www.theguardian.com/business/2026/mar/05/oil-price-continues-to-rise-amid-middle-east-crisis-but-stock-markets-rebound-across-asia
Guardian,"Jamie Dunn, radio personality and Agro puppeteer, dies aged 76",https://www.theguardian.com/tv-and-radio/2026/mar/07/radio-personality-and-agro-puppeteer-jamie-dunn-dies-aged-76
Guardian,"At Perth""s CPAC conference, Liberal party faithful speak of ""the lost Australians"" "" with no sign of One Nation",https://www.theguardian.com/australia-news/2026/mar/07/at-perths-cpac-conference-liberal-party-faithful-speak-of-the-lost-australians-with-no-sign-of-one-nation
Guardian,Canadian PM Mark Carney says former prince Andrew should be removed from royal line of succession ,https://www.theguardian.com/world/2026/mar/07/canadian-pm-mark-carney-says-former-prince-andrew-should-be-removed-from-royal-line-of-succession
Guardian,"Investors are expecting Donald Trump to back down in the war with Iran "" but what if he doesn""t? ",https://www.theguardian.com/business/2026/mar/06/investors-are-expecting-donald-trump-to-back-down-in-the-war-with-iran-but-what-if-he-doesnt
Guardian,Ex-Liberal MP says the party must introduce gender quotas to start winning elections,https://www.theguardian.com/australia-news/2026/mar/06/australian-liberal-party-gender-quotas
Guardian,Revealed: the Ukrainian facility where UK engineers help fix vital weapons,https://www.theguardian.com/world/2026/mar/06/revealed-the-ukrainian-facility-where-uk-engineers-help-fix-vital-weapons
Guardian,Cyprus raises doubts about future of British bases on island after drone strike,https://www.theguardian.com/world/2026/mar/06/cyprus-raises-doubts-about-future-of-british-bases-on-island-after-drone-strike
Guardian,"German twist in the Telegraph tale shatters Lord Rothermere""s dreams ",https://www.theguardian.com/media/2026/mar/06/german-twist-in-the-telegraph-tale-shatters-lord-rothermeres-dreams
Guardian,"Hungary ""demands answers"" over seized Ukrainian gold and cash as Kyiv accuses Budapest of ""hostage"" situation "" as it happened",https://www.theguardian.com/world/live/2026/mar/06/ukraine-russia-hungary-orban-zelenskyy-putin-middle-east-iran-cyprus-europe-latest-news-updates
Guardian,Hungary seizes millions of euros in cash and gold from Ukrainian convoy,https://www.theguardian.com/world/2026/mar/06/hungary-seizes-millions-euros-cash-gold-ukrainian-convoy
Guardian,"Middle East crisis live: Iran""s president apologises to Gulf nations; Trump threatens further strikes",https://www.theguardian.com/world/live/2026/mar/07/middle-east-crisis-live-tehran-explosions-beirut-trump-israel-iran-war-second-week
Guardian,Trump skirts Congress over Iran war as Republicans simply step aside,https://www.theguardian.com/us-news/2026/mar/07/trump-congress-republicans-iran-war-powers
Guardian,"Iran rejects Trump""s demand for unconditional surrender as a ""dream""",https://www.theguardian.com/world/2026/mar/07/iran-trump-unconditional-surrender-war-masoud-pezeshkian
Guardian,"""It means missile defence on data centres"": drone strikes raises doubts over Gulf as AI superpower",https://www.theguardian.com/world/2026/mar/07/it-means-missile-defence-on-data-centres-drone-strikes-raises-doubts-over-gulf-as-ai-superpower
Guardian,"From ""peace president"" to Operation Epic Fury: Donald Trump""s road to war",https://www.theguardian.com/us-news/2026/mar/07/from-peace-president-to-operation-epic-fury-donald-trumps-road-to-war
Guardian,Sri Lanka evacuates crew from Iranian navy vessel days after warship was destroyed by US,https://www.theguardian.com/world/2026/mar/05/iran-ship-sri-lanka-port-after-us-sinking-of-frigate
Guardian,Nepal: voting closes in election pitting old guard against powerful youth movement,https://www.theguardian.com/world/2026/mar/05/nepal-election-2026-voting-balen-shah-sharma-oli
Guardian,US submarine sinks Iranian warship as conflict spreads beyond Middle East,https://www.theguardian.com/world/2026/mar/04/us-submarine-torpedo-iran-warship-sri-lanka-coast-pete-hegseth
Guardian,"Nepal""s gen-Z election: can popular former rapper Balen topple a veteran political heavyweight?",https://www.theguardian.com/world/2026/mar/03/nepal-gen-z-election-popular-former-rapper-balen
Guardian,Afghanistan says it thwarted Pakistan airstrikes on Bagram airbase,https://www.theguardian.com/world/2026/mar/02/afghanistan-pakistan-airstrikes-bagram-airbase
Guardian,MPs demand to meet Travelodge CEO over security after Maidenhead sexual assault case,https://www.theguardian.com/society/2026/mar/07/mps-demand-to-meet-travelodge-ceo-over-maidenhead-sexual-assault-case-kyran-smith
Guardian,"Families say infected blood scandal compensation scheme creates ""penalty for dying""",https://www.theguardian.com/uk-news/2026/mar/07/families-say-infected-blood-scandal-compensation-scheme-creates-penalty-for-dying
Guardian,US bomber lands in UK after warning of surge in strikes on Iran,https://www.theguardian.com/world/2026/mar/07/us-bomber-lands-in-uk-after-warning-of-surge-in-strikes-on-iran
Guardian,Soham murderer Ian Huntley dies after HMP Frankland prison attack,https://www.theguardian.com/uk-news/2026/mar/07/soham-murderer-ian-huntley-dies-after-hmp-frankland-prison-attack
Guardian,"Campaign seeks 50 objects to ""take the heat"" out of Englishness debate",https://www.theguardian.com/uk-news/2026/mar/07/campaign-seeks-50-objects-englishness-debate
Guardian,"""We were ready"": Democratic attorneys general lead fight to stop Trump",https://www.theguardian.com/us-news/2026/mar/07/democratic-attorneys-general-trump
Guardian,"""Operation Epstein Distraction"": Trump""s bloody Iran ""hype videos"" seem to target niche audience",https://www.theguardian.com/us-news/2026/mar/07/trump-iran-hype-videos
