Section,Headline,Link
ABC,15yo charged with Sydney boy's murder faces court for first time,https://www.abc.net.au/news/2025-11-25/rouse-hill-stabbing-15-year-old-faces-court/106049804
ABC,"In the Ukraine peace plan, brutal equations are being considered",https://www.abc.net.au/news/2025-11-25/what-we-know-about-the-28-point-plan-for-peace/106046140
ABC,"Bendigo Bank shares dive on money laundering worries, ASX flat",https://www.abc.net.au/news/2025-11-25/asx-markets-business-live-news-25-nov/106048786
ABC,'Contagion' fears surface as bitcoin crash unsettles financial markets,https://www.abc.net.au/news/2025-11-25/cryptocurrency-fears-as-bitcoin-crash-unsettles-market/106044010
ABC,Call for changes to deadly beach with 'daily' rips after 18yo drowns,https://www.abc.net.au/news/2025-11-25/nsw-central-coast-drowning-beach-safety-concerns-norah-head/106048794
ABC,Child murderer Bevan Spencer von Einem in serious condition,https://www.abc.net.au/news/2025-11-25/sa-bevan-spencer-von-einem-in-yatala-infirmary/106047868
ABC,Kyrgios's Australian Open wildcard bid heats up with Kooyong entry,https://www.abc.net.au/news/2025-11-25/kyrgios-australian-open-wildcard-bid-heats-up-with-kooyong-entry/106049462
ABC,'Wildly inconsistent' evidence from Bondi stabber's psychiatrist,https://www.abc.net.au/news/2025-11-25/bondi-junction-westfield-attack-cauchi-psychiatrist-inconsistent/106049828
ABC,Uber Eats and DoorDash strike historic deal on pay 'safety net' and accident insurance,https://www.abc.net.au/news/2025-11-25/minimum-wage-for-gig-workers-in-historic-deal-uber-eats-doordash/106048976
ABC,Pub made famous by Crocodile Dundee sells after three years on market,https://www.abc.net.au/news/2025-11-25/crocodile-dundee-pub-the-walkabout-creek-hotel-sells/106048772
ABC,New phase in search for 4yo Gus with police to include six mine shafts,https://www.abc.net.au/news/2025-11-25/police-search-mine-shafts-for-missing-boy-gus/106045808
ABC,"Gambling ad ban would pass parliament with conscience vote, Labor MP says",https://www.abc.net.au/news/2025-11-25/gambling-advertising-ban-push-multi-partisan-support/106047600
ABC,Elderly woman charged over alleged hit-run crash that killed 6yo boy,https://www.abc.net.au/news/2025-11-25/woman-charged-over-fatal-teesdale-march-crash/106049036
ABC,Sydney man behind 'absolutely abhorrent' child abuse revealed as suburban architect,https://www.abc.net.au/news/2025-11-25/lane-cove-architect-anthony-dibden-convicted-child-abuse-materia/106045060
ABC,How Riddell's rise to become AFLW's best mirrors Kangaroos' dominance,https://www.abc.net.au/news/2025-11-25/aflw-ash-riddell-best-and-fairest-north-melbourne-kangaroos/106049038
ABC,'These are real humans': More mental health patients ending up in EDs,https://www.abc.net.au/news/2025-11-25/emergency-wait-times-for-mental-health-stretch-out/106044964
ABC,"Taiwan's 'return to China' key to international order, Xi tells Trump",https://www.abc.net.au/news/2025-11-25/xi-jinping-and-donald-trump-reportedly-discuss-taiwan/106048382
ABC,Zelenskyy warns Ukraine's borders 'cannot be changed by force',https://www.abc.net.au/news/2025-11-25/us-ukraine-refined-peace-plan-russia-invasion-europe/106048192
ABC,Everton player sent off for slapping teammate during Premier League match,https://www.abc.net.au/news/2025-11-25/idrissa-gueye-michael-keane-everton-slap-red-card-premier-league/106048932
ABC,South Africa's largest gold producer greenlights a $2.4 billion Qld copper mine,https://www.abc.net.au/news/2025-11-25/harmony-gold-green-lights-eva-copper-project-cloncurry/106048642
ABC,School bus cancellations blindside parents and providers,https://www.abc.net.au/news/2025-11-25/school-bus-route-cancellations-regional-wa/106017038
ABC,Thousands of women missing out on 'gold standard' antenatal care,https://www.abc.net.au/news/2025-11-25/midwifery-group-practice-program-gold-standard-care/106044292
ABC,Illegal tobacco sellers leave tens of millions of fines unpaid,https://www.abc.net.au/news/2025-11-24/illegal-tobacco-industry-millions-in-fines-unpaid-queensland/106030978
ABC,"As Launceston works on a new flood strategy, some locals suggest floodgates",https://www.abc.net.au/news/2025-11-23/climate-change-flood-risk-launceston-tamar-estuary-floodgates/106004394
ABC,Experiences of homophobia 'happening every day' in Australia's most progressive city,https://www.abc.net.au/news/2025-11-23/homophobia-in-canberra-australias-most-progressive-city/106004910
ABC,The group welcoming refugees with a bushwalk,https://www.abc.net.au/news/2025-11-22/first-hike-project-welcome-refugees-/106005500
ABC,Fire service blocked from pursuing US giant over 'forever chemicals',https://www.abc.net.au/news/2025-11-25/fire-rescue-victoria-pfas-3m-lawsuit-blocked-state-government/106044128
ABC,BOM boss reveals $96.5m website rebuild approved by Turnbull government,https://www.abc.net.au/news/2025-11-24/bom-website-approved-by-coalition-ceo-says/106047518
ABC,Senate shut down for 1.5 hours after Pauline Hanson's burka stunt,https://www.abc.net.au/news/2025-11-24/senate-suspended-after-pauline-hansons-burka-stunt/106047124
ABC,Calls for new Darwin hospital following Cyclone Fina,https://www.abc.net.au/news/2025-11-24/nt-royal-darwin-hospital-cyclone-fina-damage-government-funding/106045310
ABC,Controversial Israel and US-backed Gaza aid organisation closes,https://www.abc.net.au/news/2025-11-25/gaza-humanitarian-foundation-closes/106048550
ABC,US labels Venezuela's Cartel de los Soles a terror organisation,https://www.abc.net.au/news/2025-11-25/us-set-to-label-maduro-tied-cartel-as-a-terror-organisation/106048356
ABC,Tehran close to running dry due to 'water bankruptcy',https://www.abc.net.au/news/2025-11-24/iran-facing-worst-drought-in-60-years/106035210
ABC,Man jailed for life in largest cybersex crime case in South Korea's history,https://www.abc.net.au/news/2025-11-25/kim-nok-wan-jailed-for-life-for-south-korea-cybersex-crime-ring/106048240
ABC,'Extraordinary' housing values crush home ownership dreams,https://www.abc.net.au/news/2025-11-25/housing-unaffordability-reaches-record-levels-in-australia/106044078
ABC,Why the EU moved to preference military hardware purchases from its members,https://www.abc.net.au/news/2025-11-24/eu-and-us-trade-talks-could-have-knock-on-effects-for-australia/106036434
ABC,Rental affordability worsens in regions as 'dire' situation remains,https://www.abc.net.au/news/2025-11-24/sgs-economics-rental-affordability-index-data-release/106031672
ABC,Humanoid robots will change work forever,https://www.abc.net.au/news/2025-11-24/artificial-intelligence-robot-humanoid-workforce-labour-tax-ubi/106034208
ABC,'Revolutionary' talent has girls in Bangladesh flocking to cricket,https://www.abc.net.au/news/2025-11-25/marufa-akter-bangladesh-womens-cricket-revolution/105993656
ABC,Riddell credits Roos teammate after winning AFLW's top individual honour,https://www.abc.net.au/news/2025-11-25/aflw-best-and-fairest-ash-riddell-jasmine-garner-kangaroos/106048756
ABC,Guardiola 'embarrassed and ashamed' after confronting camera operator,https://www.abc.net.au/news/2025-11-25/premier-league-pep-guardiola-apologises-camera-operator/106048840
ABC,Kangaroos star Ash Riddell wins AFLW best and fairest award,https://www.abc.net.au/news/2025-11-25/kangaroos-star-ash-riddell-wins-aflw-best-and-fairest/106047276
ABC,One evening's planning has made me feel more prepared for an emergency,https://www.abc.net.au/news/2025-11-21/emergency-plan-natural-disasters-here-is-how/106027454
ABC,Why celebrity scandals can leave us feeling personally betrayed,https://www.abc.net.au/news/2025-11-20/why-celebrity-scandals-can-leave-us-feeling-shattered/105991484
ABC,"Should you make mortgage repayments monthly, fortnightly or weekly?",https://www.abc.net.au/news/2025-11-19/mortgage-repayments-frequency-fortnightly-or-monthly/105996588
ABC,I'm a male early childhood educator. I worry about my son in care,https://www.abc.net.au/news/2025-11-18/what-it-is-like-being-a-male-educator-amid-the-childcare-crisis/105995392
ABC,"Perth exhibition exhorts visitors to hunt, be free and stay married",https://www.abc.net.au/news/2025-11-24/paola-pivi-art-gallery-wa/106020310
ABC,"Actor-turned-author's new book reimagines 'queer, sexy Greek myths'",https://www.abc.net.au/news/2025-11-22/zoe-terakes-book-eros-queer-myths-for-lovers/106017590
ABC,Bollywood superstar Dharmendra dies aged 89,https://www.abc.net.au/news/2025-11-24/bollywood-star-dharmendra-dies-aged-89/106048046
ABC,"Jimmy Cliff, reggae music pioneer, dies at 81",https://www.abc.net.au/news/2025-11-24/jimmy-cliff-reggae-music-pioneer-dies-at-81/106048100
Sky News,"Chris Bowen misses Question Time for COP30 ""global warming talkfest'",https://www.skynews.com.au/opinion/chris-kenny/chris-bowen-misses-question-time-for-cop30-global-warming-talkfest/video/af4d6fdf6a761aa04988913a00c63ff1
Sky News,"""Learnt from the master': Dan Andrews' shadow looms over the Allan government",https://www.skynews.com.au/opinion/learnt-from-the-master-dan-andrews-shadow-looms-over-the-allan-government/video/384912a3cee5f402c1e44d39f0e63d1c
Sky News,"Chris Bowen ""sold Australia out' in Brazil to stop coal and gas",https://www.skynews.com.au/opinion/andrew-bolt/chris-bowen-sold-australia-out-in-brazil-to-stop-coal-and-gas/video/bf5857a2ac60c6601621725e6da0a968
Sky News,Liberal leadership in question as Taylor and Hastie solidify their place as alternatives,https://www.skynews.com.au/opinion/sharri-markson/liberal-leadership-in-question-as-taylor-and-hastie-solidify-their-place-as-alternatives/video/ba9377d09c6bbb51c8b742e803d5a346
Sky News,"""Huge gulf': Aussies to pay more tax under Labor government",https://www.skynews.com.au/opinion/paul-murray/huge-gulf-aussies-to-pay-more-tax-under-labor-government/video/64020489908afe6dc658babb76d205c3
Sky News,"""Ukraine's going to have to give up territory': Trump's Ukraine peace deal analysed",https://www.skynews.com.au/opinion/rita-panahi/ukraines-going-to-have-to-give-up-territory-trumps-ukraine-peace-deal-analysed/video/290d647fe652ddd84ba153da99bfed0e
Sky News,"Sussan Ley survives ""killing season' as leadership rivals hold fire",https://www.skynews.com.au/australia-news/politics/opposition-leader-sussan-ley-survives-killing-season-after-no-challenge-emerges-in-final-2025-partyroom-meeting/news-story/6d77ab3b7abd52099494374d611f365d
Sky News,Pauline Hanson to be censured for burqa stunt,https://www.skynews.com.au/australia-news/politics/one-nation-leader-pauline-hanson-to-be-censured-by-senate-colleagues-for-controversial-burqa-stunt/news-story/89263606949f3da2b345d8bbecef9d0c
Sky News,"""He'd do really well': Fmr Rudd advisor tipped to replace Chris Bowen as energy minister",https://www.skynews.com.au/australia-news/politics/andrew-charlton-tipped-for-meteoric-rise-amid-speculation-he-will-replace-chris-bowen-as-energy-minister/news-story/d970d33a0d79101545fad0754a1ae73e
Sky News,More damaging storms set to lash Australia's east coast as more than 95k homes without power,https://www.skynews.com.au/australia-news/weather/damaging-storms-set-to-lash-southeast-queensland-and-parts-of-nsw-as-about-95k-homes-and-businesses-left-without-power/news-story/d77d8aa64fcfb5b44c0c8429d51bc0a2
Sky News,Almost 100 jobs slashed in major move by energy giant,https://www.skynews.com.au/business/energy/energyaustralia-cuts-up-to-100-jobs-as-company-reshapes-itself-for-major-shift-to-renewables/news-story/36ad3d084c294927c85d647fa82c9c75
Sky News,Police hunt for Andrew officers' emails in latest blow for besieged Royal,https://www.skynews.com.au/lifestyle/celebrity-life/police-hunt-for-andrew-officers-emails-after-claims-besieged-royal-sought-to-dig-up-dirt-on-accuser-virginia-giuffre/news-story/c98335103c77fcd69039592dd872de60
Sky News,"Penny Wong criticises Pauline Hanson, moves censure motion against One Nation leader",https://www.skynews.com.au/australia-news/politics/one-nation-leader-pauline-hanson-hits-out-after-senate-suspension-over-burqa-stunt-brands-critics-hypocrites/live-coverage/0b1200fcd097844ad8802e6741889a25
Sky News,"""Delicate': How specialist police will scour mineshafts in new push to find Gus Lamont",https://www.skynews.com.au/australia-news/crime/specialist-police-return-to-south-australian-homestead-desperate-to-find-missing-fouryearold-gus-lamont/news-story/bb4897143c0a50734bfdccc8fb0cd21a
Sky News,Barnaby Joyce formally offered One Nation Senate spot,https://www.skynews.com.au/australia-news/politics/nationals-mp-barnaby-joyce-formally-offered-chance-to-run-for-one-nation-senate-spot-in-nsw/news-story/23aa6691f8ce9c960498bcb0d6fe696e
Sky News,NSW Premier defends knife laws after teenage boy killed in stabbing,https://www.skynews.com.au/australia-news/crime/police-charge-15yearold-boy-with-murder-after-17yearold-fatally-stabbed-in-sydneys-northwest/news-story/7db39483bec1c6e0c5642d9b853504d6
Sky News,"Uhlmann: Bowen to join ""pack of grifters' when he takes on COP role",https://www.skynews.com.au/australia-news/politics/veteran-journalist-chris-uhlmann-declares-chris-bowen-to-join-worlds-biggest-pack-of-grifters-when-he-taken-on-cop-presidency/news-story/bd0280b4b37764217a8a3b51dd63a10a
Sky News,School exams and events thrown into chaos as Queensland teachers strike,https://www.skynews.com.au/australia-news/politics/queensland-government-accused-of-sparking-mass-teacher-walkoff-as-exams-and-school-events-thrown-into-chaos/news-story/ae69434d86ce7dad54056a6d804d639d
Sky News,"Transport chaos warning as 70,000 AC/DC fans head to Sydney Olympic Park",https://www.skynews.com.au/lifestyle/celebrity-life/nsw-officials-issue-transport-warning-as-70000-rock-fans-head-to-accor-stadium-for-final-sydney-acdc-show/news-story/520885f669b50efea1be22f722bd3e11
Sky News,"""Needs to be held to account': Ex-ABC journo turned Senator demands inquiry into public broadcaster",https://www.skynews.com.au/australia-news/politics/needs-to-be-held-to-account-former-abc-journo-turned-coalition-senator-sarah-henderson-demands-inquiry-into-public-broadcaster/news-story/f28b54403d52bb731c11cbbaba65f2b4
Sky News,"""Total disgrace': Mundine unloads on ""ridiculous' Welcome to Country at AFLW final",https://www.skynews.com.au/australia-news/politics/total-disgrace-warren-mundine-unloads-on-aflw-welcome-to-country-which-lasted-twice-the-length-of-national-anthem/news-story/c55b68eb99658c451e42665e92c667fa
Sky News,It's time judges are held accountable for failing to lock up violent criminals,https://www.skynews.com.au/insights-and-analysis/miranda-devine-its-high-time-liberal-judges-are-held-accountable-for-failing-to-lock-up-violent-career-criminals/news-story/24898207567193f1ef0db30060060ddd
Sky News,How Australia's record foreign student population is killing housing affordability,https://www.skynews.com.au/insights-and-analysis/does-australia-really-need-one-million-international-enrolments-education-data-reveals-how-our-broken-immigration-system-is-killing-housing-affordability/news-story/36b5acd9d100675e4e8f7826dccb46b7
Sky News,"""Cleanest energy source so far': Nuclear fusion the answer to our fear of radioactive waste",https://www.skynews.com.au/insights-and-analysis/cleanest-energy-source-so-far-nuclear-fusion-technology-the-antidote-to-australian-publics-fear-of-radioactive-waste/news-story/160697090141b20fd9f0e820ab963a81
Sky News,"Fire chief's wife ""flashed 14-year-old volunteer ' and said she wanted to have sex when he turned 18'",https://www.skynews.com.au/world-news/united-states/fire-chiefs-wife-allegedly-flashed-14yearold-volunteer-firefighter-and-said-she-wanted-to-have-sex-when-he-turned-18/news-story/6935105d24062a44de326157325dd135
Sky News,"US, Ukraine peace plan vastly different from Trump's previous one: reports",https://www.skynews.com.au/world-news/global-affairs/us-ukraine-agree-on-new-19point-peace-plan-thats-vastly-different-from-donald-trumps-previous-one-reports/news-story/36743a9901a0469ffe63821467e79d29
Sky News,"Crypto thieves beat, sexually assaulted family in sickening $2.4 million heist",https://www.skynews.com.au/world-news/global-affairs/crypto-thieves-waterboarded-beat-and-sexually-assaulted-family-in-sickening-24-million-heist/news-story/7c2f8c58bedcf3b471944f0fb04f527e
Sky News,"Trump and Xi discuss ""Taiwan question' during phone call",https://www.skynews.com.au/world-news/united-states/unusual-phone-call-brings-trump-and-xi-closer-as-us-president-cheers-extremely-strong-relationship-with-china/news-story/390eef88d6b1ebafb14a8ddb65f06ead
Sky News,"Trump hints at ""big progress' even as Ukrainian officials insist handing land to Russia a ""red line'",https://www.skynews.com.au/world-news/global-affairs/us-president-donald-trump-hints-at-big-progress-in-peace-talks-even-as-ukrainian-officials-insist-handing-land-to-russia-crossing-a-red-line/news-story/8663664ca4138265f17223f3ca64d0bb
Sky News,"Stepdad screams ""my kid is dead' after 11-year-old killed in road-rage shooting",https://www.skynews.com.au/world-news/united-states/bodycam-footage-shows-nevada-stepdad-scream-my-kid-is-dead-after-11yearold-is-killed-in-roadrage-shooting/news-story/42baceae65dd54e9073cc179e162aa40
Sky News,Ex-TV anchor sentenced in Covid fraud scheme ' will be jailed with Ghislaine Maxwell,https://www.skynews.com.au/world-news/united-states/disgraced-exnews-anchor-stephanie-hockridge-sentenced-in-massive-covid-fraud-scheme-will-be-jailed-with-ghislaine-maxwell/news-story/afbde8322cda440bec0e34d646378e73
Sky News,Shrieking passenger berates employee during unhinged airport meltdown,https://www.skynews.com.au/world-news/united-states/shrieking-southwest-passenger-berates-employee-during-unhinged-airport-meltdown-do-you-guys-feel-safe/news-story/5e1ee01a051c042efa228633aa525462
Sky News,"""People are being fleeced': Regions push for cheaper electricity",https://www.skynews.com.au/opinion/people-are-being-fleeced-regions-push-for-cheaper-electricity/video/f3eae03c1d5b9941f7ffa6493cc3bbf3
Sky News,"""Growing behemoth': Reports taxpayers could bail out NDIS providers",https://www.skynews.com.au/opinion/growing-behemoth-reports-taxpayers-could-bail-out-ndis-providers/video/f18441c74dc9fbbd7bfcd265cbac7abb
Sky News,"""It just doesn't cut it': Pocock highlights the secretive nature of the Albanese government",https://www.skynews.com.au/opinion/paul-murray/it-just-doesnt-cut-it-pocock-highlights-the-secretive-nature-of-the-albanese-government/video/26db124d9bc605cbd9aa3ad1f60d5d40
Sky News,The Kenny Report | 24 November,https://www.skynews.com.au/stream/opinion-programs/the-kenny-report/the-kenny-report-24-november/video/c7d630312ede69821ddf609a14ed8f42
Sky News,Credlin | 24 November,https://www.skynews.com.au/stream/opinion-programs/credlin/credlin-24-november/video/e73195f7311566c4253a793079961493
Sky News,The Bolt Report | 24 November,https://www.skynews.com.au/stream/opinion-programs/the-bolt-report/the-bolt-report-24-november/video/bee56bc039fbf8dd35a9917ecd0c0fe7
Sky News,Sharri | 24 November,https://www.skynews.com.au/stream/opinion-programs/sharri/sharri-24-november/video/bea3ac5f096890ce3c2f4ee829934f15
Sky News,Paul Murray Live | 24 November,https://www.skynews.com.au/stream/opinion-programs/paul-murray-live/paul-murray-live-24-november/video/4b149827e0a08beaed8cfd4bcfa10f63
Sky News,The Late Debate | 24 November,https://www.skynews.com.au/stream/opinion-programs/the-late-debate/the-late-debate-24-november/video/63e5e434df0e22b8af4afee036242d7f
Sky News,The Rita Panahi Show | 24 November,https://www.skynews.com.au/stream/opinion-programs/the-rita-panahi-show/the-rita-panahi-show-24-november/video/967dfc8e9b92cfd8d8bad8a950678fed
Sky News,Almost 100 jobs slashed in major move by energy giant,https://www.skynews.com.au/business/energy/energyaustralia-cuts-up-to-100-jobs-as-company-reshapes-itself-for-major-shift-to-renewables/news-story/36ad3d084c294927c85d647fa82c9c75
Sky News,"Soup exec belittled ""poor' customers, spewed racist hate in secret recording: lawsuit",https://www.skynews.com.au/business/markets/campbell-soup-executive-belittled-poor-customers-spewed-racist-hate-in-secret-recording-lawsuit/news-story/225e7692691c0dfc299c472735fe0528
Sky News,Shocking number of dog attacks on Australian posties revealed,https://www.skynews.com.au/lifestyle/health/australia-post-issues-warning-to-pet-owners-as-concerning-number-of-dogattacks-on-posties-revealed/news-story/7501f697925fc431ec85f38cc0e15609
Sky News,New study suggests everyone was wrong about where the Moon came from,https://www.skynews.com.au/business/science/new-study-suggests-everyone-was-wrong-about-where-the-moon-came-from-billions-of-years-ago/news-story/4d0d204e81fd47cfe78a8ad66d80d69b
Sky News,"""Headed for disaster': Unaffordable rents crippling regional Australia",https://www.skynews.com.au/business/real-estate/australia-headed-for-disaster-as-unaffordable-rents-set-to-cripple-regional-australia-housing-all-australians-warns/news-story/f29a35996182b1a388f6135b213973ca
Sky News,Alarm as Jacinta Allan calls on super funds to help Vic Labor's public projects,https://www.skynews.com.au/business/finance/alarm-as-victorian-premier-jacinta-allan-calls-on-super-funds-to-help-fund-the-debtriddled-states-public-projects/news-story/e70ed1db49e29815b43325c37bc56b96
Sky News,Update after nationwide warning for Chinese wind turbine components,https://www.skynews.com.au/business/energy/renewables-operator-issues-update-after-asbestos-discovered-in-imported-wind-turbine-parts/news-story/82f9cbcbe2d72368187ad1e5dbcb5b32
Sky News,"""It's not laziness': How young Australians are rewriting the rules of Christmas shopping",https://www.skynews.com.au/business/how-young-australians-are-rewriting-the-rules-of-christmas-shopping-as-spending-is-set-to-surge-despite-inflation-pressures/news-story/122d91b647c9755db84b994daf6e1a6a
Sky News,"""Too much spending': Jim Chalmers challenged after dire IMF warning",https://www.skynews.com.au/business/finance/too-much-spending-challenge-plaguing-treasurer-jim-chalmers-after-international-monetary-fund-delivers-dire-warning/news-story/d9fe671df768fa22c2c3bdc42ce40cc5
Sky News,"Transport chaos warning as 70,000 AC/DC fans head to Sydney Olympic Park",https://www.skynews.com.au/lifestyle/celebrity-life/nsw-officials-issue-transport-warning-as-70000-rock-fans-head-to-accor-stadium-for-final-sydney-acdc-show/news-story/520885f669b50efea1be22f722bd3e11
Sky News,Police hunt for Andrew officers' emails in latest blow for besieged Royal,https://www.skynews.com.au/lifestyle/celebrity-life/police-hunt-for-andrew-officers-emails-after-claims-besieged-royal-sought-to-dig-up-dirt-on-accuser-virginia-giuffre/news-story/c98335103c77fcd69039592dd872de60
Sky News,"ABC star suddenly announces ""very difficult' decision to quit role",https://www.skynews.com.au/lifestyle/celebrity-life/veteran-abc-radio-presenter-chris-bath-announces-very-difficult-decision-to-quit-coverted-role-after-less-than-a-year/news-story/091c29917197fbb6baec4fbeced87544
Sky News,The View hosts dare Trump to make an appearance on the show,https://www.skynews.com.au/lifestyle/celebrity-life/ivanka-has-been-on-six-times-the-view-hosts-publicly-challenge-donald-trump-to-appear-on-the-show-just-weeks-after-whoopi-goldberg-tore-up-legal-note-about-us-president-live-onair/news-story/85274b06f22e749e73e3ca84fd9f267a
Sky News,Hinch's blunt truth about heartbreaking health battle,https://www.skynews.com.au/lifestyle/celebrity-life/i-sometimes-just-hit-the-floor-derryn-hinch-lays-bare-heartbreaking-health-reality-as-he-reveals-how-long-he-thinks-he-has-left/news-story/d9b1c033c6ebc24bcffcb56fe062f939
Sky News,"Archaeologists retrieve first treasure items from $31 billion ""Holy Grail' shipwreck",https://www.skynews.com.au/lifestyle/travel/archaeologists-retrieve-first-treasure-items-from-31-billion-holy-grail-shipwreck-off-colombia/news-story/a47f37c6c94f978b44940e0405880dfc
Sky News,Australia pipped to top spot in world's safest country rankings,https://www.skynews.com.au/lifestyle/travel/netherlands-pips-australia-for-top-spot-in-worlds-safest-country-rankings-as-us-is-snubbed-despite-decrease-in-crime/news-story/38730ece2fd3a76fa05233d63abbe85e
Sky News,Aussie airlines clamp down on power banks after string of mid-air fire scares,https://www.skynews.com.au/lifestyle/travel/aussie-airlines-clamp-down-on-power-banks-amid-spate-of-midair-fire-incidents/news-story/c5d07c515f0db66cef7f2ae4597c0b88
Sky News,"""Severe storms' set to impact parts of NSW and Queensland",https://www.skynews.com.au/australia-news/weather/severe-storms-set-to-impact-parts-of-nsw-and-queensland/video/66a5562558032df100bb9538cd280276
Sky News,Government staff warned of China hack threat,https://www.skynews.com.au/australia-news/politics/government-staff-warned-of-china-hack-threat/video/741987230b8f7ddd57f64e07362363f5
Sky News,"""It's 2025': Pauline Hanson urged to ""get with the program' over burqa stunt",https://www.skynews.com.au/australia-news/politics/its-2025-pauline-hanson-urged-to-get-with-the-program-over-burqa-stunt/video/6c4072454d9b661b3831b66e2c0148c1
Sky News,"""Performative nonsense': One Nation voters divided over Hanson burqa stunt",https://www.skynews.com.au/australia-news/politics/performative-nonsense-one-nation-voters-divided-over-hanson-burqa-stunt/video/7838c68d9fb22851d645a6ab472cbb3a
Sky News,Kevin Rudd grilled by Trump administration over Australian streaming laws,https://www.skynews.com.au/australia-news/politics/kevin-rudd-grilled-by-trump-administration-over-australian-streaming-laws/video/371899df8667ad855e81e5bcea8b90da
Sky News,"Coalition demands ""full audit' over asbestos found in wind farms",https://www.skynews.com.au/australia-news/politics/coalition-demands-full-audit-over-asbestos-found-in-wind-farms/video/5c183382f7169c6fb7b17f77ca641c61
