Section,Headline,Link
ABC,Typhoon Bualoi forces thousands to evacuate in Vietnam,https://www.abc.net.au/news/2025-09-28/typhoon-bualoi-forces-thousands-to-evacuate-in-vietnam/105828376
ABC,Man suffers 'brutal and violent attack' before death at Brisbane shops,https://www.abc.net.au/news/2025-09-28/brisbane-man-found-dead-at-shopping-centre/105827860
ABC,Penrith's NRL stranglehold ends in stunning fashion as Broncos win thriller,https://www.abc.net.au/news/2025-09-28/nrl-finals-live-updates-brisbane-broncos-penrith-panthers/105780678
ABC,Russian missile and drone barrage kills four in Ukraine,https://www.abc.net.au/news/2025-09-28/russian-missile-and-drone-barrage-kills-four/105828200
ABC,Search underway for two men aboard catamaran missing off northern NSW,https://www.abc.net.au/news/2025-09-28/search-for-two-men-missing-catamaran-mangrove-jack/105828064
ABC,Eight skydivers launched from plane just two minutes before fatal crash,https://www.abc.net.au/news/2025-09-28/moruya-plane-crash-pilot-named-as-paul-smith/105827770
ABC,Police searching for four-year-old boy missing in remote SA,https://www.abc.net.au/news/2025-09-28/police-searching-for-four-year-old-boy-missing-in-remote-sa/105828250
ABC,"Up to 30,000 people at risk of losing some or all their super, ASIC boss warns",https://www.abc.net.au/news/2025-09-28/as-australian-retirement-savings-grow-greater-regulation-needed/105820684
ABC,"Trump to deploy troops to 'war-ravaged' Portland, ICE facilities",https://www.abc.net.au/news/2025-09-28/trump-orders-deployment-of-troops-to-portland-ice-facilities/105825548
ABC,'Tom's story' inspires tough new rules for young drivers,https://www.abc.net.au/news/2025-09-28/tougher-rules-proposed-wa-young-drivers-/105827684
ABC,"'To eat bitterness': In the Pacific, there is 'old' Chinese and 'new' Chinese",https://www.abc.net.au/news/2025-09-28/china-pacific-islands-untold-story-chinese-geopolitics-influence/105818894
ABC,Nicheliving customer left with leaking home after plumber uses wrong pipe,https://www.abc.net.au/news/2025-09-28/former-nicheliving-customer-discovers-defective-plumbing-work/105822686
ABC,Bedsharing with your dog has benefits — and some minor risks,https://www.abc.net.au/news/2025-09-28/the-benefits-and-risks-of-sleeping-next-to-our-dogs/105774468
ABC,Retro gadgets stand test of time in an era of disposable tech,https://www.abc.net.au/news/2025-09-28/old-electrical-appliances-made-to-be-fixed-and-still-performing/105791190
ABC,Investigation unearths name of alleged confessed killer police officer,https://www.abc.net.au/news/2025-09-28/nt-missing-yolngu-man-cold-case-police-killing-confession/105581636
ABC,Saints pull off record comeback win as AFLW stars celebrate centuries,https://www.abc.net.au/news/2025-09-28/st-kilda-stuns-port-with-aflw-comeback/105828018
ABC,Broncos return to NRLW grand final for first time since 2020,https://www.abc.net.au/news/2025-09-28/brisbane-broncos-beat-knights-to-set-up-nrlw-grand-final/105827872
ABC,Teens among three charged after woman injured in alleged carjacking,https://www.abc.net.au/news/2025-09-27/woman-suffers-life-threatening-injuries-in-car-theft/105824808
ABC,"It's time to put Australia's pint-sized hot shots in their place. Let's play, HARD!",https://www.abc.net.au/news/2025-09-28/hard-quiz-kids-weekly-trivia/105773368
ABC,"'Horrible' vandalism of signs shows need for pride event, organiser says",https://www.abc.net.au/news/2025-09-28/calls-for-queer-visibility-after-vandalism-at-pride-festival/105811572
ABC,Australia's first female astronaut says we 'need more women space',https://www.abc.net.au/news/2025-09-28/astronaut-katherine-bennell-pegg-study-space-bushfires-floods/105827566
ABC,Snow town struggles as high housing prices force residents out,https://www.abc.net.au/news/2025-09-28/jindabyne-short-term-rentals-high-prices-tourism-snow/105761672
ABC,"Feral pigs found in SA were imported illegally from NSW, testing shows",https://www.abc.net.au/news/2025-09-28/dna-testing-finds-feral-pigs-illegally-brought-into-sa-from-nsw/105806616
ABC,Algal bloom sea casualties find new life in commercial compost,https://www.abc.net.au/news/2025-09-28/algal-bloom-dead-sea-life-turned-to-compost/105807488
ABC,Identity revealed of man charged with Nazi salute at AFL game,https://www.abc.net.au/news/2025-09-27/qld-man-charged-with-performing-nazi-salute-political-candidate/105815900
ABC,Family's anger at seven-year coronial inquest wait,https://www.abc.net.au/news/2025-09-25/anger-at-seven-year-coronial-inquest-wait/105805234
ABC,Tired of police 'excuses': Family of missing people demand change,https://www.abc.net.au/news/2025-09-25/families-of-missing-persons-call-for-probe-into-police/105693338
ABC,'Sustainable development': Golf course reimagined for club and housing,https://www.abc.net.au/news/2025-09-24/golf-course-redevelopments-providing-housing-financial-lifelines/105799100
ABC,"Thumbs up from Trump, as White House releases official photo with Albanese",https://www.abc.net.au/news/2025-09-27/albanese-trump-photo/105824944
ABC,Palmer ordered to pay more than $13m after foreign investor claim dismissed,https://www.abc.net.au/news/2025-09-27/clive-palmer-foreign-investor-claim-dismissed/105823966
ABC,Andrew Hastie wants to be Liberal leader. The question is when,https://www.abc.net.au/news/2025-09-27/andrew-hastie-liberal-party-leadership/105822510
ABC,The government provided a media management masterclass on climate,https://www.abc.net.au/news/2025-09-27/climate-announcement-targets-emissions/105801294
ABC,UN sanctions on Iran come into effect after failure of sideline talks,https://www.abc.net.au/news/2025-09-28/un-reinstates-sanctions-on-iran/105827774
ABC,Russian minister warns NATO any aggression will be met with a 'decisive response',https://www.abc.net.au/news/2025-09-28/russian-foreign-minister-sergey-lavrov-warns-nato-europe-at-unga/105825572
ABC,"No word on Donald Trump's Israel-Gaza ceasefire plan, says Hamas",https://www.abc.net.au/news/2025-09-28/no-word-on-donald-trump-s-israel-gaza-ceasefire-plan-says-hamas/105825646
ABC,Albanese meets with King Charles at Balmoral,https://www.abc.net.au/news/2025-09-27/anthony-albanese-meets-king-charles-balmoral-castle/105825036
ABC,"ASX closes up, Singtel boss flown in to meet Australian government over triple-0 failure — as it happened",https://www.abc.net.au/news/2025-09-26/asx-markets-business-live-news-26-sept-2025/105819610
ABC,Macquarie coughs up $321 million payout after superannuation failures,https://www.abc.net.au/news/2025-09-25/macquarie-admits-to-shield-contraventions/105814728
ABC,'Waiting for the axe to fall': Fears for jobs in AI boom,https://www.abc.net.au/news/2025-09-25/australia-in-dangerous-place-as-ai-adoption-ramps-up/105807430
ABC,Singapore's PM is Optus's majority shareholder. Here's why that could be a problem,https://www.abc.net.au/news/2025-09-25/who-really-controls-optus/105813620
ABC,Geelong's superpower fails its biggest test against Brisbane juggernaut,https://www.abc.net.au/news/2025-09-28/afl-grand-final-geelong-cats-brisbane-lions-analysis/105824608
ABC,Aussies ice World Para Swimming Championships with relay gold,https://www.abc.net.au/news/2025-09-28/world-para-swimming-championships-australia-wins-relay-gold/105825652
ABC,England wins third Women's Rugby World Cup after defeating Canada in final,https://www.abc.net.au/news/2025-09-28/rugby-world-cup-final-england-defeats-canada/105825580
ABC,Wright claims silver for Australia at World Para Athletics Championships,https://www.abc.net.au/news/2025-09-28/world-para-athletics-championships-kirra-wright-silver/105827702
ABC,The signs experts say could mean it's time to call a relationship quits,https://www.abc.net.au/news/2025-09-27/signs-it-might-be-time-to-end-a-relationship/105675792
ABC,The benefits of glass food containers over plastic,https://www.abc.net.au/news/2025-09-26/are-glass-containers-better-for-food-storage/105814738
ABC,Why are we still asking mothers to hide breastfeeding?,https://www.abc.net.au/news/2025-09-25/why-are-we-still-asking-mothers-to-hide-breastfeeding/105789046
ABC,'Veiled in secrecy': Busting the stigma of redundancy by sharing online,https://www.abc.net.au/news/2025-09-24/busting-the-stigma-on-redundancy-by-sharing-online/105751880
ABC,"No more streaming fees, these films and TV series are free to watch",https://www.abc.net.au/news/2025-09-28/where-to-watch-movies-tv-for-free/105809908
ABC,Oasis's 'biblical' reunion is largely thanks to this blockbuster album,https://www.abc.net.au/news/2025-09-28/oasis-morning-glory-30-years-anniversary-review-reunion/105816312
ABC,The eight books our critics couldn't put down in September,https://www.abc.net.au/news/2025-09-27/best-books-september-ian-mcewan-patrick-ryan-lee-lai/105805520
ABC,'Scale and sophistication': New Canberra lyric theatre designs revealed,https://www.abc.net.au/news/2025-09-27/act-new-lyric-theatres-detailed-designs-revealed/105823106
Sky News,"""Destructive body': Trump has ""absolute disdain' for the United Nations",https://www.skynews.com.au/opinion/outsiders/destructive-body-trump-has-absolute-disdain-for-the-united-nations/video/8ee1ddb129891b1e8be2a0536544a5b3
Sky News,"Charlie Kirk's last ever interview, on building a movement, filmed day of assassination",https://www.skynews.com.au/business/charlie-kirks-last-ever-interview-on-building-a-movement-filmed-day-of-assassination/video/fc756699373ed184b2e66c25d23105da
Sky News,Kamala Harris ruthlessly mocked over odd word salad about babies,https://www.skynews.com.au/opinion/outsiders/kamala-harris-ruthlessly-mocked-over-odd-word-salad-about-babies/video/cfee6a9d01b80d112706c3671572b6b9
Sky News,"TV host drops truth bomb following ""unhinged backlash' from ""hypocrites' over Comey indictment",https://www.skynews.com.au/opinion/outsiders/tv-host-drops-truth-bomb-following-unhinged-backlash-from-hypocrites-over-comey-indictment/video/f3a336c185ed6a14c3a348dfe3a2d215
Sky News,"""He didn't mince his words': Netanyahu pledges to crush Hamas as fast as possible",https://www.skynews.com.au/opinion/outsiders/he-didnt-mince-his-words-netanyahu-pledges-to-crush-hamas-as-fast-as-possible/video/d2b873eb82015ecc1afd63d4550291fc
Sky News,"Trump has a ""strong case to send the military' to Portland amid anti-ICE protests",https://www.skynews.com.au/opinion/outsiders/trump-has-a-strong-case-to-send-the-military-to-portland-amid-antiice-protests/video/0c507ed41e5acf6ede584fa34f3d1558
Sky News,"Albanese hits out at Farage while warning migration concerns must be ""respected'",https://www.skynews.com.au/australia-news/politics/politics-of-grievance-albanese-hits-out-at-nigel-farages-reform-party-despite-admitting-migration-concerns-must-be-respected/news-story/c84fab37cdf998cd0fd690ad1ee5c534
Sky News,Four key changes to form part of Vic Opposition's tough on crime election pitch,https://www.skynews.com.au/australia-news/politics/victorian-opposition-leader-brad-battin-adds-sentencing-reform-to-tougher-on-crime-agenda-as-criminal-offences-soar/news-story/57142381a97b7387b51c532381868cc8
Sky News,Albanese govt under fire after mammoth housing fund invests equivalent of eight Sydney homes,https://www.skynews.com.au/australia-news/politics/albanese-government-under-fire-after-mammoth-housing-fund-invests-equivalent-of-eight-sydney-homes-in-one-year/news-story/3b5e0e3d420e55eadb1597fefb7d5223
Sky News,"""Swanning around on taxpayer dollar': Albanese defends UK trip to Labour conference",https://www.skynews.com.au/australia-news/politics/swanning-around-on-taxpayer-dollar-prime-minister-albanese-defends-uk-trip-to-labour-party-conference-in-liverpool/news-story/1c3a08a9c994049ff7038781f08f3075
Sky News,"""I want a refund': Snoop Dogg's unbelievable act leaves Sydney fans fuming",https://www.skynews.com.au/lifestyle/trending/i-want-a-refund-fans-left-fuming-after-snoop-dogg-makes-sydney-crowd-wait-over-five-hours-following-afl-grand-final-performance/news-story/8d825e3c6f934601765d42ba9f694b57
Sky News,Cash backs Hastie's hardline immigration stance amid Liberal Party debate,https://www.skynews.com.au/australia-news/politics/shadow-foreign-affairs-minister-michaelia-cash-backs-andrew-hasties-hardline-stance-on-immigration-amid-liberal-party-debate/news-story/a712c966cda0e838f1e87703963f35e3
Sky News,Clive Palmer to take $300bn legal fight against Australia to Switzerland,https://www.skynews.com.au/australia-news/politics/australian-billionaire-clive-palmer-eyes-swiss-court-after-tribunal-rejects-300-billion-claim-orders-payment-of-13-million-legal-costs/news-story/37b3a988f3aa7f85fbc6f1e6f0082a9d
Sky News,Authorities desperately searching for two men after catamaran goes missing,https://www.skynews.com.au/australia-news/multiagency-operation-underway-as-authorities-desperately-search-for-missing-catamaran-carrying-two-men/news-story/1d2156c41d4c816e8a87dd28ed170fb2
Sky News,"Coalition aligns with Netanyahu, condemns Albanese for Palestine recognition",https://www.skynews.com.au/australia-news/politics/shadow-foreign-affairs-minister-michaelia-cash-aligns-with-israeli-prime-minister-benjamin-netanyahu-condemning-albanese-for-palestine-recognition/news-story/8a127dd61ca05957b219de478f23272f
Sky News,Pilot killed in horror plane crash identified,https://www.skynews.com.au/breaking-news/man-54-killed-after-skydiving-plane-crashed-off-nsw-coast/news-story/70786847a049dd437c9108fe0c53325b
Sky News,Health Minister rejects Trump's warning on paracetamol and autism,https://www.skynews.com.au/australia-news/politics/health-minister-mark-butler-rejects-us-president-donald-trumps-warning-about-paracetamol-and-autism/news-story/f2ecad5865e99a283e889accd3f8621f
Sky News,Albanese rules out republic referendum after private meeting with King Charles,https://www.skynews.com.au/australia-news/politics/prime-minister-anthony-albanese-attends-private-audience-with-king-charles-iii-at-balmoral-castle/news-story/8070ed20181b798fc92daf09d79997fe
Sky News,Suspicious death at suburban shopping centre in Brisbane,https://www.skynews.com.au/australia-news/crime/queensland-police-investigating-after-man-declared-dead-at-suburban-shopping-centre-in-manly-west-brisbane/news-story/dc7c639c757bbd9dcbc6e47250f12d17
Sky News,Man dies after being struck by light rail vehicle on arterial intersection in Canberra,https://www.skynews.com.au/australia-news/crime/man-dies-after-being-horrifically-struck-by-light-rail-tramcar-on-arterial-canberra-intersection-in-rare-incident/news-story/e5782ea8de263cfdd640cc1d8bdc3690
Sky News,"""I like Trump': Albanese says ahead of meeting with US President",https://www.skynews.com.au/australia-news/politics/prime-minister-anthony-albanese-announces-he-likes-us-president-donald-trump-after-previous-criticism/news-story/899f4f86c80512bd77e48b569ba86554
Sky News,The short Trump exchange that exposed Albo's selfie diplomacy for what it is,https://www.skynews.com.au/insights-and-analysis/macrontrump-phone-call-on-the-streets-of-manhattan-exposed-anthony-albaneses-ineffectual-selfie-diplomacy-for-what-it-is/news-story/1e55eca9c6a131c68208a98b70b8f354
Sky News,These reasonable climate opinions could be silenced if the HRC gets its way,https://www.skynews.com.au/insights-and-analysis/these-reasonable-climate-change-opinions-could-be-silenced-if-the-human-rights-commission-outlaws-misinformation/news-story/6de9f7e7f896d5ba0bce97dd919e515a
Sky News,"Media Watch sneers at the ""land of the free' in spirited defence of Jimmy Kimmel",https://www.skynews.com.au/insights-and-analysis/media-watch-dog-linton-besser-sneers-at-the-land-of-the-free-as-he-airs-leftwing-charlie-kirk-conspiracy-theory-in-spirited-defence-of-jimmy-kimmel/news-story/a0a15864187d1fc749264252119f9d0d
Sky News,"""Authorising full force': Trump orders troops into ""war ravaged' US city",https://www.skynews.com.au/world-news/united-states/donald-trump-authorising-full-force-to-send-troops-into-war-ravaged-portland/news-story/6febd48cd0aed5cb7ae80a7055152dda
Sky News,Charlie Kirk praises Elon Musk's entrepreneurialism in his final interview,https://www.skynews.com.au/world-news/united-states/charlie-kirk-praises-elon-musks-entrepreneurialism-in-his-final-interview-given-just-hours-before-he-was-shot/news-story/f31547883ae9542de209b5e1d7d4cab0
Sky News,"Trump says Gaza deal almost ""done'",https://www.skynews.com.au/world-news/united-states/us-president-donald-trump-says-intense-negotiations-ongoing-in-latest-suggestion-deal-to-end-war-in-gaza-is-close/news-story/32aec6c37244efa24eed294108a9aae8
Sky News,"""Extremely lamentable': IDF veteran lashes UN walkout during Netanyahu address",https://www.skynews.com.au/world-news/global-affairs/extremely-lamentable-idf-veteran-lashes-un-walkout-during-israeli-pm-benjamin-netanyahus-very-strong-address/news-story/8e5bba5a122cb175313166f8c7f41bdf
Sky News,Forensic lip readers explain heated exchange between US President and First Lady,https://www.skynews.com.au/world-news/united-states/forensic-lip-readers-explain-heated-row-between-us-president-donald-trump-and-first-lady-melania-following-tense-un-visit/news-story/3bec0179024d1fa6dfa7600d0c00d4c2
Sky News,Kamala Harris' word salad makes comeback at start of her nationwide book tour,https://www.skynews.com.au/world-news/united-states/kamala-harris-resurrects-campaign-word-salad-when-concerned-pregnant-mum-asks-about-raising-a-son-under-donald-trump/news-story/8e3baeea85c93dd7809ee8f4b9884268
Sky News,Police make major admission after Kiwis criticised the four-year delay in catching fugitive father Tom Phillips,https://www.skynews.com.au/world-news/new-zealand-police-make-major-admission-after-kiwis-criticised-the-fouryear-delay-in-catching-fugitive-father-tom-phillips/news-story/8f46885d5a09a571305547c70f27c53e
Sky News,Trump slaps 100 per cent tariff on Australian pharmaceuticals,https://www.skynews.com.au/world-news/united-states/president-donald-trump-imposes-100-per-cent-tariff-on-australian-pharmaceuticals-unless-manufactured-in-the-states/news-story/d2f868e8a25bc0672128b405add10ab5
Sky News,"""I'm very in touch with my community': Dai Le focuses on Fowler's needs",https://www.skynews.com.au/opinion/paul-murray/im-very-in-touch-with-my-community-dai-le-focuses-on-fowlers-needs/video/3069455ae5e993bdf5813d591c28b495
Sky News,Highlighting Harvey Norman's Produce Awards and pushing growth of AFLW,https://www.skynews.com.au/opinion/paul-murray/highlighting-harvey-normans-produce-awards-and-pushing-growth-of-aflw/video/fcd5dd291ca47f7067bc3ee53fd6fbc5
Sky News,Paul Murray hits Western Sydney for an adrenaline filled Our Town special,https://www.skynews.com.au/opinion/paul-murray/paul-murray-hits-western-sydney-for-an-adrenaline-filled-our-town-special/video/7fde0b6c61ad4f40ecb89ebedbea8cbe
Sky News,The Sunday Showdown | 28 September,https://www.skynews.com.au/stream/opinion-programs/the-sunday-showdown/the-sunday-showdown-28-september/video/6c54ae2f7aac6248beb9d37880285b17
Sky News,Danica & James | 28 September,https://www.skynews.com.au/stream/opinion-programs/danica-and-james/danica-james-28-september/video/4f82ee9e9d5f36781d73a84bf73fcf69
Sky News,Outsiders | 28 September,https://www.skynews.com.au/stream/opinion-programs/outsiders/outsiders-28-september/video/8e48238517374672652f5fe16f322975
Sky News,Danica De Giorgio | 26 September,https://www.skynews.com.au/stream/opinion-programs/danica-de-giorgio/danica-de-giorgio-26-september/video/4b1864b287f4d606de1637a8a6cf9315
Sky News,Steve Price | 26 September,https://www.skynews.com.au/stream/opinion-programs/steve-price/steve-price-26-september/video/2e3071416b77a1bda5015a35a456090a
Sky News,The U.S. Report | 26 September,https://www.skynews.com.au/stream/opinion-programs/the-us-report/the-us-report-26-september/video/e6a72d0e7f11d42fe3d702a58f9b3aca
Sky News,The Media Show | 26 September,https://www.skynews.com.au/stream/opinion-programs/the-media-show/the-media-show-26-september/video/48f48389baa11083d53307d644351013
Sky News,Aussie startups in the firing line from Trump's mega pharmaceuticals tariff,https://www.skynews.com.au/business/tech-and-innovation/aussie-startups-in-the-firing-line-from-donald-trumps-mega-pharmaceuticals-tariff-medicines-australia-ceo-warns/news-story/88510b37ae5b6c7a856e422129b9caf6
Sky News,Qantas flight makes emergency landing after fears of fire on board,https://www.skynews.com.au/business/qantas-flight-travelling-from-sydney-to-auckland-forced-to-make-emergency-landing-after-concerns-of-fire-on-board/news-story/24ee647273694f095de3085e67321f63
Sky News,Aussie companies sink after massive Trump tariffs,https://www.skynews.com.au/business/markets/australian-health-companies-fall-after-us-president-donald-trump-reveals-100-per-cent-pharmaceuticals-tariffs/news-story/9c5b9ff75645b0ce3641f069e680df4e
Sky News,Trump signs executive order allowing TikTok deal to proceed,https://www.skynews.com.au/business/media/donald-trump-signs-executive-order-allowing-tiktok-deal-to-proceed/news-story/cfaaf78d569aa29eb15d44e95447c165
Sky News,"Macquarie investors had ""no awareness' their money was in risky fund",https://www.skynews.com.au/business/finance/macquarie-investors-had-no-awareness-their-money-was-in-shield-master-fund-which-collapsed-asics-sarah-court-says/news-story/24cb41ca9bd133184187b1092c672486
Sky News,Sydney mansion smashes Australian auction record,https://www.skynews.com.au/business/real-estate/historic-rose-bay-estate-fetches-451m-in-fierce-bidding-war-to-set-new-australian-auction-benchmark/news-story/125d58ca7b84c6d7262a855860e53a62
Sky News,More than $10.6b back in Aussies' hands after corporate watchdog lifts ban,https://www.skynews.com.au/business/finance/more-than-106b-back-in-aussies-hands-after-corporate-watchdog-asic-lifts-ban-on-two-la-trobe-financial-products/news-story/ea3fed41708cad99d26d6b35b002d658
Sky News,Nine Entertainment chair resigns after 18 months in role,https://www.skynews.com.au/business/media/nine-entertainment-chair-catherine-west-resigns-after-close-to-a-decade-serving-on-the-companys-board/news-story/b06fcb5cab048b3374b0976bc96b921a
Sky News,ASX zigzags after suffering its worst day in weeks,https://www.skynews.com.au/business/markets/asx-200-zigzags-after-suffering-its-worst-day-in-three-weeks-following-concerning-inflation-data/news-story/8d9d4df0de790c7bcf0d39d7c9f85667
Sky News,"""I want a refund': Snoop Dogg's unbelievable act leaves Sydney fans fuming",https://www.skynews.com.au/lifestyle/trending/i-want-a-refund-fans-left-fuming-after-snoop-dogg-makes-sydney-crowd-wait-over-five-hours-following-afl-grand-final-performance/news-story/8d825e3c6f934601765d42ba9f694b57
Sky News,Princess Beatrice unlikely to carry Royal duties following Prince Andrew's scandalous history,https://www.skynews.com.au/lifestyle/celebrity-life/princess-beatrice-unlikely-to-carry-royal-duties-following-prince-andrews-epstein-history-engulfing-house-of-york/news-story/c359741bd7bc3ce9bfaff3be5f1c6f8d
Sky News,Snoop steals the show at AFL grand final,https://www.skynews.com.au/australia-news/sport/fans-call-snoop-doggs-blockbuster-afl-grand-final-performance-the-highlight-of-the-day/news-story/e5c7bd9c61db16abd1750065ae7b2964
Sky News,"Alarming detail in photo of truck sparks claims of ""animal cruelty'",https://www.skynews.com.au/lifestyle/trending/adelaide-truck-driver-caught-travelling-at-speed-with-dog-chained-to-the-back-of-open-tray-sparks-claims-of-animal-cruelty/news-story/938eed7853e63fe7fb6148121abdbdb1
Sky News,"Harry and Meghan to be crowned ""humanitarians of the year'",https://www.skynews.com.au/lifestyle/celebrity-life/prince-harry-and-meghan-markle-will-make-joint-appearance-to-accept-project-healthy-minds-humanitarians-of-the-year-award/news-story/47b212b18dd2bc20cfd2033c9bad1d81
Sky News,Beatrice and Eugenie in jeopardy after Fergie's downfall,https://www.skynews.com.au/lifestyle/celebrity-life/this-will-be-a-deeply-painful-period-sad-update-for-princesses-beatrice-and-eugenie-after-fergie-and-prince-andrews-downfall/news-story/207f72656bee444114d95713ee84b58d
Sky News,Prince William quietly flies to Balmoral to meet King Charles,https://www.skynews.com.au/lifestyle/celebrity-life/not-diarised-prince-william-quietly-flies-to-balmoral-castle-to-spend-private-quality-time-with-king-charles/news-story/6e62ca7d253894d979013ecfc945310c
Sky News,Meghan 2.0? Major royal spotted kissing American actress Madelyn Cline,https://www.skynews.com.au/lifestyle/celebrity-life/prince-constantine-alexios-of-greece-and-american-actress-madelyn-cline-spark-romance-rumours-after-pair-spotted-kissing/news-story/3d0d4ea6fb5bd64c65d7966e1dc7268c
Sky News,Today's News Headlines: Albanese rules out a republic referendum,https://www.skynews.com.au/australia-news/todays-news-headlines-albanese-rules-out-a-republic-referendum/video/8cb19008e144f58f0c91267f3ff18419
Sky News,Today's News Headlines: White House releases photo of Anthony Albanese and Donald Trump,https://www.skynews.com.au/australia-news/todays-news-headlines-white-house-releases-photo-of-anthony-albanese-and-donald-trump/video/a096781a0e9a416a6e8a8d9c2eb3ae2d
Sky News,"Labor ""won't budge' on the PBS amid Donald Trump's 100 per cent tariff on pharmaceuticals",https://www.skynews.com.au/australia-news/politics/labor-wont-budge-on-the-pbs-amid-donald-trumps-100-per-cent-tariff-on-pharmaceuticals/video/341a45b42c05b6225a40dee54d3cd447
Sky News,"""We secured an exemption': Michaelia Cash slams Albanese's ""lowest' tariff justification",https://www.skynews.com.au/australia-news/politics/we-secured-an-exemption-michaelia-cash-slams-albaneses-lowest-tariff-justification/video/2ef31054a17582ca1dd1ec5e3797e7dc
