Section,Headline,Link
Guardian,Peter Attia appears to be staying at CBS News despite Epstein communications,https://www.theguardian.com/media/2026/feb/14/cbs-peter-attia-jeffrey-epstein
Guardian,US homeland security department partially shut down after lawmakers fail to agree funding,https://www.theguardian.com/us-news/2026/feb/13/us-homeland-security-department-shutdown
Guardian,"Trump says regime change in Iran ""would be the best thing"" as US military reportedly plans for operation "" as it happened",https://www.theguardian.com/us-news/live/2026/feb/13/trump-climate-epa-repeal-pollution-john-kerry-us-politics-latest-news-updates
ABC,Courtney thought her doctor 'knew best'. Then she asked to see her medical records,https://www.abc.net.au/news/2026-02-14/patients-endometriosis-surgery-by-simon-gordon-unnecessary-/106330214
ABC,Angus Taylor flags housing focus ahead of by-election 'challenge',https://www.abc.net.au/news/2026-02-14/angus-taylor-housing-affordability-cost-of-living/106344998
ABC,One living former PM made the same choice as Sussan Ley,https://www.abc.net.au/news/2026-02-14/liberal-party-women-sussan-ley-leadership-spill/106340280
ABC,Travel industry sounds alarm as US enters another partial shutdown,https://www.abc.net.au/news/2026-02-14/us-government-shuts-down-again/106344600
ABC,Police operation underway related to Nancy Guthrie,https://www.abc.net.au/news/2026-02-14/police-operation-kidnap-nancy-savannah-guthrie-in-tucson-arizona/106345266
ABC,Carlton star taken to hospital as Victoria holds off WA in AFL Origin,https://www.abc.net.au/news/2026-02-14/afl-state-of-origin-wa-victoria-live-blog/106345370
ABC,Hume was punished after the election. Now she's been crowned Liberal deputy,https://www.abc.net.au/news/2026-02-14/who-is-jane-hume-the-new-liberal-deputy/106340342
ABC,These Kennedys were an 'It' couple — until their untimely demise,https://www.abc.net.au/news/2026-02-14/love-story-john-f-kennedy-jr-and-carolyn-bessette-what-happened/105519010
ABC,Australia and EU on the cusp of signing landmark free trade agreement,https://www.abc.net.au/news/2026-02-14/australia-and-eu-sign-landmark-free-trade-agreement/106344826
ABC,"Two women die in Sydney crash, man arrested after police pursuit",https://www.abc.net.au/news/2026-02-14/two-die-man-arrested-in-camden-car-crash-after-police-pursuit/106345042
ABC,'Disordered eating': Former captain on relationship with food while playing,https://www.abc.net.au/news/2026-02-14/former-afl-captain-dyson-heppell-disordered-eating/106344044
ABC,'You have the wrong person': Appeal to kidnappers for safe return of elderly man,https://www.abc.net.au/news/2026-02-14/man-kidnapped-sydney-police-say-mistaken-identity/106345228
ABC,Here's what we know about Angus Taylor's policies,https://www.abc.net.au/news/2026-02-14/what-we-know-about-angus-taylor-policies/106342170
ABC,One celebrity in the entertainment world got Epstein 'withdrawal',https://www.abc.net.au/news/2026-02-14/entertainment-celebrities-in-epstein-files/106317858
ABC,Romance scam 'red flags' revealed in Valentine's Day warning,https://www.abc.net.au/news/2026-02-14/romance-scammers-fleecing-millions-from-west-australians/106345070
ABC,Construction starts on Adelaide's first skyscraper amid continued opposition,https://www.abc.net.au/news/2026-02-14/major-construction-starts-on-adelaide-skyscraper-festival-tower/106345112
ABC,Baff's self-belief a blessing with a gold medal payoff,https://www.abc.net.au/news/2026-02-14/josie-baff-winter-olympics-snowboard-cross-gold-belief/106344394
ABC,Wool price jumps ahead of industry-first Chinese New Year break,https://www.abc.net.au/news/2026-02-14/wool-price-rising-ahead-of-chinese-new-year-break/106339658
ABC,"Once a safe Coalition seat, Farrer is buzzing with talk of change",https://www.abc.net.au/news/2026-02-14/farrer-constituents-react-sussan-ley-resignation/106341264
ABC,National park officials defend 'diabolical' new booking system for WA campers,https://www.abc.net.au/news/2026-02-14/ningaloo-campsite-booking-system-crashes-during-trial/106308456
ABC,There is something that doesn't make sense in the Nancy Guthrie case,https://www.abc.net.au/news/2026-02-14/the-very-unusual-factor-in-the-nancy-guthrie-case/106333408
ABC,A well-intentioned grand display turned a prince into a frog,https://www.abc.net.au/news/2026-02-14/sturla-holm-laegreid-winter-olympics-confession/106337204
ABC,"From Japan to Israel, elections are reshaping global politics",https://www.abc.net.au/news/2026-02-14/elections-japan-israel-ukraine-global-politics-trump/106337028
ABC,'Storm before the calm': Israeli president's visit divides community,https://www.abc.net.au/news/2026-02-14/israeli-president-isaac-herzog-visit-divides-community/106337710
ABC,The Darwin doctor devoting thousands of hours each year to volunteering,https://www.abc.net.au/news/2026-02-13/nt-australian-of-year-dr-felix-ho-thousands-of-volunteer-hours/106329556
ABC,"Charges over 'shocking' abuse of puppy take a year, as RSPCA prosecutions drop",https://www.abc.net.au/news/2026-02-12/queensland-rspca-drop-in-prosecutions-animal-cruelty/106277220
ABC,"Communities 'triggered' by bushfires, six years after towns burned",https://www.abc.net.au/news/2026-02-09/cobargo-deua-river-still-rebuilding-after-black-summer-bushfires/106273804
ABC,'There's nothing we can do': Inside the bullying crisis gripping ACT public schools,https://www.abc.net.au/news/2026-02-09/bullying-reports-rise-in-act-public-schools/106269450
ABC,"To survive, the Liberals must now get over their self-obsession",https://www.abc.net.au/news/2026-02-13/angus-taylor-liberal-leadership-change-self-obsession/106339870
ABC,Angus Taylor just got an unwelcome parting gift from the leader he deposed,https://www.abc.net.au/news/2026-02-13/farrer-byelection-sussan-ley-angus-taylor/106341236
ABC,"It took 80 years for a woman to become Liberal leader, and 9 months to dump her",https://www.abc.net.au/news/2026-02-13/sussan-ley-s-time-as-liberal-leader/106045934
ABC,Taylor says he will focus on standard of living and protecting 'our way of life',https://www.abc.net.au/news/2026-02-13/angus-taylor-becomes-liberal-leader/106339798
ABC,Pair who plotted attack on Jews in northern England jailed for life,https://www.abc.net.au/news/2026-02-14/men-who-plotted-gun-attack-on-uk-jews-jailed-for-life/106344876
ABC,Nine people killed in Canada mass shooting identified,https://www.abc.net.au/news/2026-02-14/tumbler-ridge-school-mass-shooting-victims-named/106343974
ABC,"Japan seizes Chinese fishing boat, arrests captain",https://www.abc.net.au/news/2026-02-13/japan-seizes-chinese-fishing-boat-amid-dispute-between-countries/106343816
ABC,US aircraft carrier redeployed from Caribbean as Iran tensions rise,https://www.abc.net.au/news/2026-02-13/us-aircraft-carrier-carribbean-middle-east-iran/106342830
ABC,Share market tumbles on 'traditional Friday 13 meltdown' — as it happened,https://www.abc.net.au/news/2026-02-13/asx-markets-business-live-news-feb-13-2026/106339608
ABC,How the ASX went from rooster to feather duster,https://www.abc.net.au/news/2026-02-13/asx-boss-to-depart-as-another-controversy-unfolds/106336322
ABC,Aussie backyard icon now on the chopping block,https://www.abc.net.au/news/2026-02-12/barbeques-galore-enters-receivership/106337962
ABC,Michele Bullock frustrated by 'repeated questions' at Senate estimates,https://www.abc.net.au/news/2026-02-12/rba-governor-accused-of-gaslighting-australians-on-economy/106335332
ABC,Anthony creates Aussie Winter Olympic history with epic dual moguls win,https://www.abc.net.au/news/2026-02-14/winter-olympics-2026-milano-cortina-jakara-anthony-gold/106345576
ABC,Peel's desperate despair a heartwrenching way for her Games to end,https://www.abc.net.au/news/2026-02-14/laura-peel-milano-cortina-2026-winter-olympics-injury/106302402
ABC,Winter Olympics 2026 quick guide: What to watch,https://www.abc.net.au/news/2026-02-14/winter-olympics-2026-daily-guide-jakara-anthony/106339970
ABC,The heartache of 'almost' strikes again for Scotty James,https://www.abc.net.au/news/2026-02-14/scotty-james-silver-2026-milano-cortina-winter-olympics/106344652
ABC,Find decluttering overwhelming? Try this simple method,https://www.abc.net.au/news/2026-02-13/simple-ways-to-start-decluttering-at-home/106300708
ABC,Chocolate recipes to share some love with the people in your life,https://www.abc.net.au/news/2026-02-12/valentines-day-recipes-love-chocolate/106325802
ABC,Practical ways to avoid feeling lonely or isolated while working from home,https://www.abc.net.au/news/2026-02-11/how-to-reduce-loneliness-while-working-remotely/106286338
ABC,"I love caring for my brother, but I didn't have enough support at school",https://www.abc.net.au/news/2026-02-10/support-i-wish-i-had-at-school-while-caring-for-my-brother/106279156
ABC,Why this award-winning author's philosophy is 'write like you're dead',https://www.abc.net.au/news/2026-02-14/michael-mohammed-ahmad-new-book-bugger/106331764
ABC,'A perfect moment in time': Musical couple reflect on 10 years working together,https://www.abc.net.au/news/2026-02-14/musical-matches-harpist-emily-granger-composer-tristan-coelho/106343946
ABC,'Hate has been given an outlet': Why Jack Thorne made a new Lord of the Flies,https://www.abc.net.au/news/2026-02-13/lord-of-the-flies-tv-show-jack-thorne-adolescence/106295874
ABC,The Muppet 50th birthday special makes the case for a new season,https://www.abc.net.au/news/2026-02-11/what-to-watch-the-muppets-scrubs/106325818
Sky News,"""No stake in this country': Angus Taylor must win back young voters to save the Liberals",https://www.skynews.com.au/opinion/no-stake-in-this-country-angus-taylor-must-win-back-young-voters-to-save-the-liberals/video/3a866a0f4d03e3072829cacbd4b292c6
Sky News,"""Wouldn't mind a bit of fact checking': TV host blasts Labor for social media hit on Angus Taylor",https://www.skynews.com.au/opinion/wouldnt-mind-a-bit-of-fact-checking-tv-host-blasts-labor-for-social-media-hit-on-angus-taylor/video/ec8f681ba8f43dba69419e285249f880
Sky News,"Angus Taylor urged to fight ""last vestiges' of Liberal moderates and Labor",https://www.skynews.com.au/opinion/angus-taylor-urged-to-fight-last-vestiges-of-liberal-moderates-and-labor/video/156d2119dd25d453852b55ac8333e3f7
Sky News,"""Funded to cause chaos': The Democrats need illegal immigrants to win the election",https://www.skynews.com.au/opinion/funded-to-cause-chaos-the-democrats-need-illegal-immigrants-to-win-the-election/video/b4c0b9eac88b673861b035311b45a64a
Sky News,"""Populist right' wants Trump to release entirety of Epstein files",https://www.skynews.com.au/opinion/populist-right-wants-trump-to-release-entirety-of-epstein-files/video/cf45cd03dd6ce4bf2c27f3732ef81b5c
Sky News,"""Are you high?': Joe Rogan breaks silence after name appears in Epstein files",https://www.skynews.com.au/opinion/rita-panahi/are-you-high-joe-rogan-breaks-silence-after-name-appears-in-epstein-files/video/41bdec419aaef9bae67c549ce9601f2d
Sky News,Sydney council sparks controversy over bikini ban while riding bus,https://www.skynews.com.au/lifestyle/get-with-the-times-sydney-council-sparks-controversy-by-banning-beachgoers-from-riding-bus-while-shirtless-or-wearing-bikinis/news-story/f0b91998d6cccb40583f35fd09e48044
Sky News,Two dead in horror crash after alleged car theft and police chase,https://www.skynews.com.au/australia-news/crime/two-dead-in-horror-crash-after-alleged-car-theft-and-police-chase-in-sydney/news-story/529178ca91074592900c1b79d04e0acf
Sky News,"ABC agitator-in-chief goes after Angus Taylor's private education, forgets own affluent background",https://www.skynews.com.au/insights-and-analysis/turn-it-up-sarah-abc-host-scrutinises-angus-taylors-private-school-education-conveniently-glosses-over-her-own-affluent-background/news-story/3bd69dcadd9e97740d1beddf0d40e871
Sky News,"""We want different things': Celeste Barber and ""hot husband' split after 20 years",https://www.skynews.com.au/lifestyle/celebrity-life/we-want-different-things-comedian-celeste-barber-and-hot-husband-api-robin-split-after-20-years/news-story/206a744ed65898e53652e2ddb8b68a2b
Sky News,How Aussies could face $22k fine and two years in prison over popular romantic gesture,https://www.skynews.com.au/lifestyle/trending/grotesque-couples-could-face-22k-fine-and-two-years-in-prison-over-harmless-romantic-stunt-on-valentines-day/news-story/e7b2b284c7198e879b7eb50259108b22
Sky News,Co-founders of popular charcoal chicken chain lists lavish Sydney estate for over $10m,https://www.skynews.com.au/business/real-estate/cofounders-of-el-jannah-lists-lavish-sydney-estate-for-eyewatering-11m-price-tag/news-story/3900cf8ba80bc53374b3a3a479db0454
Sky News,"Viking Highlights Tours: Piers, Deer and a Very Helpful Daily",https://www.skynews.com.au/lifestyle/travel/viking-highlights-tours-piers-deer-and-a-very-helpful-daily/news-story/bfaa415e4da282325a43a634330f29dc
Sky News,"""Ripped off': Spirit of Hanson-Young's travel questioned as she escapes formal reproach",https://www.skynews.com.au/australia-news/politics/ripped-off-spirit-of-the-family-entitlements-examined-as-sarah-hansonyoung-escapes-formal-reproach/news-story/73d6695d22e8eb89dcdf921033bc6c4f
Sky News,Man charged after allegedly carjacking woman's vehicle before crashing on Brisbane's Story Bridge,https://www.skynews.com.au/australia-news/crime/man-charged-after-allegedly-carjacking-womans-car-before-causing-multivehicle-crash-on-brisbanes-story-bridge/news-story/7b4f36539650c4297b64ad4c1ba18f8d
Sky News,"Snowboarder Josie Baff wins riveting final, claiming second Winter Olympics gold medal for Australia",https://www.skynews.com.au/australia-news/sport/snowboarder-josie-baff-wins-riveting-final-claiming-australias-second-winter-olympics-gold-medal-in-24-hours/news-story/b507e5d4315c3f819922cd4b0936db2a
Sky News,Flash flood warning for south-east Queensland as Australia's east battles storms,https://www.skynews.com.au/australia-news/weather/flash-flood-warning-for-southeast-queensland-as-australias-east-battles-severe-thunderstorms-braced-for-heavy-rainfall/news-story/b1ded874bd23e4094ca6149c4b2e4c79
Sky News,Boy pulled from water at aquatic centre,https://www.skynews.com.au/breaking-news/young-boy-pulled-from-water-at-oran-park-leisure-centre/news-story/141e913e8e7b4b5a320f0467aa624496
Sky News,"The reason behind the ""incredibly volatile' beginning to reporting season",https://www.skynews.com.au/business/markets/incredibly-volatile-beginning-to-1h26-reporting-season-sg-hiscocks-hamish-tadgell-declares-as-ai-worries-mount/news-story/1e560855e33f0b6072d0ac6baa15a8ff
Sky News,"""We are the true opposition': Hanson's conservative warning shot, as she claims Taylor's victory changes nothing",https://www.skynews.com.au/australia-news/politics/we-are-the-true-opposition-hansons-conservative-warning-shot-as-she-claims-taylors-victory-changes-nothing/news-story/fc4df88af41343baec44d4fe3960e570
Sky News,Wild statistic shows just how repugnant Liberals became under Ley,https://www.skynews.com.au/insights-and-analysis/angus-taylor-has-gargantuan-task-ahead-of-him-after-standfornothing-liberal-party-lost-50000-voters-a-week-under-sussan-ley/news-story/6b4275b56c2bbd50aa1f874c7b936ed6
Sky News,Wild statistic shows just how repugnant Liberals became under Ley,https://www.skynews.com.au/insights-and-analysis/angus-taylor-has-gargantuan-task-ahead-of-him-after-standfornothing-liberal-party-lost-50000-voters-a-week-under-sussan-ley/news-story/6b4275b56c2bbd50aa1f874c7b936ed6
Sky News,"ABC agitator-in-chief goes after Angus Taylor's private education, forgets own affluent background",https://www.skynews.com.au/insights-and-analysis/turn-it-up-sarah-abc-host-scrutinises-angus-taylors-private-school-education-conveniently-glosses-over-her-own-affluent-background/news-story/3bd69dcadd9e97740d1beddf0d40e871
Sky News,Miranda Devine: Trump debunking Al Gore's climate fears has made world a better place,https://www.skynews.com.au/insights-and-analysis/miranda-devine-donald-trump-debunking-al-gores-climate-fears-has-made-the-world-a-better-place/news-story/30659c7b92a1503e25ee24c412aee91a
Sky News,New video shows man with backpack near Nancy Guthrie home the night she vanished,https://www.skynews.com.au/world-news/united-states/fbi-wants-to-talk-to-man-seen-on-video-with-backpack-near-nancy-guthries-home-the-night-she-vanished/news-story/fde62f20164780bad96f325e94e0532b
Sky News,"Teacher got pregnant by student she ""groomed' ' and broke teenager's heart by aborting baby",https://www.skynews.com.au/world-news/united-states/new-jersey-teacher-got-pregnant-by-student-she-groomed-and-broke-the-teenagers-heart-by-aborting-the-baby/news-story/4863aaed60a486380582e883348dce14
Sky News,Chilling new ransom note has warning for Nancy Guthrie's family,https://www.skynews.com.au/world-news/united-states/chilling-new-ransom-note-has-warning-for-nancy-guthries-family-after-mother-of-tv-breakfast-star-vanished/news-story/8fefe26de833ede52247447fd44f2663
Sky News,Trump axes Obama-era climate change rule saving voters thousands each,https://www.skynews.com.au/world-news/united-states/donald-trump-epa-chief-roll-back-obamaera-climate-change-rule-saving-each-american-more-than-5400/news-story/3ac7433ee061f26238714f487ecce3d7
Sky News,Mum killed by trans school shooter son called out trans hate in old post,https://www.skynews.com.au/world-news/united-states/mum-killed-by-transgender-son-who-shot-up-school-in-canada-leaving-eight-dead-called-out-trans-hate-in-old-social-media-post/news-story/af4cb490eaeb27d4a3b9a1c601d44c82
Sky News,"Read the texts sent by ""party mum' who allegedly watched teens having sex at wild parties",https://www.skynews.com.au/world-news/united-states/read-the-messages-sent-by-silicon-valley-party-mum-who-allegedly-watched-teens-having-sex-at-boozefilled-parties-what-happens-in-vegas-stays-in-vegas/news-story/e5e98f37730c5e6a1bf9240fb6a1afa1
Sky News,Nobel Peace laureate beaten nearly to death in prison: award committee,https://www.skynews.com.au/world-news/global-affairs/nobel-peace-laureate-narges-mohammadi-beaten-nearly-to-death-in-iran-prison-nobel-committee-says/news-story/b92e14f47f48123daea86edf417f82aa
Sky News,"Trans ex-student in ""dress' ID'd as shooter who killed eight in school massacre",https://www.skynews.com.au/world-news/global-affairs/jesse-van-rootselaar-18-idd-as-transgender-exstudent-behind-tumbler-ridge-mass-shooting-in-canada/news-story/fd54764b4bf65312642aac312ef5569b
Sky News,Pressure mounts for Coalition to strike preference deal with One Nation,https://www.skynews.com.au/opinion/pressure-mounts-for-coalition-to-strike-preference-deal-with-one-nation/video/08c1d682c722e60b6d140d62f38d41c6
Sky News,"""Left-wing media are your enemy': Rowan Dean blasts Liberal Party machine",https://www.skynews.com.au/opinion/leftwing-media-are-your-enemy-rowan-dean-blasts-liberal-party-machine/video/f39a9107bec1d8e11f3b5ea37604afad
Sky News,"One Nation a ""formidable force': Danby warns of growing political threat to Liberals",https://www.skynews.com.au/opinion/one-nation-a-formidable-force-danby-warns-of-growing-political-threat-to-liberals/video/c08499ab3a2b8e507f0c5e169e244990
Sky News,The World According To Rowan Dean | 13 February,https://www.skynews.com.au/stream/opinion-programs/the-world-according-to-rowan-dean/the-world-according-to-rowan-dean-13-february/video/9c83fc7239d547916cdcbf990bc48222
Sky News,The Bond Report | 13 February,https://www.skynews.com.au/stream/opinion-programs/the-bond-report/the-bond-report-13-february/video/bc4a1f439cad28925efd142a4f9f946e
Sky News,Steve Price | 13 February,https://www.skynews.com.au/stream/opinion-programs/steve-price/steve-price-13-february/video/50bf1587719ca34753e7d537e095c18c
Sky News,Opinionated | 13 February,https://www.skynews.com.au/stream/opinion-programs/opinionated/opinionated-13-february/video/48948a67e258f67a33e3d193f882aabb
Sky News,The U.S. Report | 13 February,https://www.skynews.com.au/stream/opinion-programs/the-us-report/the-us-report-13-february/video/54da3f8a2c779520b5ee8951a6c57730
Sky News,The Media Show | 13 February,https://www.skynews.com.au/stream/opinion-programs/the-media-show/the-media-show-13-february/video/badd9afe351d7d459f7b29152f953b99
Sky News,The Kenny Report | 12 February,https://www.skynews.com.au/stream/opinion-programs/the-kenny-report/the-kenny-report-12-february/video/d2f95975fce71961804232deef6b43a1
Sky News,Co-founders of popular charcoal chicken chain lists lavish Sydney estate for over $10m,https://www.skynews.com.au/business/real-estate/cofounders-of-el-jannah-lists-lavish-sydney-estate-for-eyewatering-11m-price-tag/news-story/3900cf8ba80bc53374b3a3a479db0454
Sky News,"The reason behind the ""incredibly volatile' beginning to reporting season",https://www.skynews.com.au/business/markets/incredibly-volatile-beginning-to-1h26-reporting-season-sg-hiscocks-hamish-tadgell-declares-as-ai-worries-mount/news-story/1e560855e33f0b6072d0ac6baa15a8ff
Sky News,"Disney loses $240 million after ""Snow White' flop: report",https://www.skynews.com.au/business/media/disney-loses-nearly-240-million-with-snow-white-film-flop-report/news-story/3a5ab07b434b239b46a250f1aa6746a2
Sky News,Veteran newsreader announces bold run for Lord Mayor after losing job at Nine Network,https://www.skynews.com.au/business/media/veteran-newsreader-gavin-morris-announces-bold-run-for-lord-mayor-of-newcastle-after-losing-job-at-nine-network/news-story/c381278eb4da6aa74b78a9d34e795f5e
Sky News,Furniture retailer crashes more than $330m despite posting 36 per cent profit jump,https://www.skynews.com.au/business/finance/nick-scalis-share-price-crashes-dragging-its-market-cap-down-more-than-330m-despite-posting-36-per-cent-profit-jump/news-story/c22b1fab5f7c4ed4dea53fa11771bac4
Sky News,The shocking cost of coffee that could become the new normal in Melbourne,https://www.skynews.com.au/business/markets/data-reveals-the-shocking-cost-of-coffee-that-could-become-the-new-normal-in-melbourne/news-story/7f54d172d742f9fa087da2c00804fbdf
Sky News,ABC fact checked after calling trans Canadian school shooter a woman,https://www.skynews.com.au/business/media/abc-backlash-as-broadcaster-accused-of-misinformation-and-misgendering-person-related-to-canadian-school-shooting/news-story/4036158e81e0ddf8f790e919d267f621
Sky News,Speculation mounts over Channel Seven star after she vanished from the airwaves,https://www.skynews.com.au/business/media/speculation-mounts-over-channel-7-presenter-mel-mclaughlin-after-she-disappeared-from-the-airwaves/news-story/bd58fa287c23a45c723b5986cd1d2f5f
Sky News,Exciting change for Aussies as McDonald's shakes up its breakfast menu,https://www.skynews.com.au/business/markets/exciting-change-for-aussies-after-mcdonalds-shake-up-breakfast-menu/news-story/c0e74bb195b97505e639baa739caf5eb
Sky News,"""We want different things': Celeste Barber and ""hot husband' split after 20 years",https://www.skynews.com.au/lifestyle/celebrity-life/we-want-different-things-comedian-celeste-barber-and-hot-husband-api-robin-split-after-20-years/news-story/206a744ed65898e53652e2ddb8b68a2b
Sky News,"Major warning issued ahead of Ed Sheeran gigs, Lunar New Year and Mardi Gras festivals",https://www.skynews.com.au/lifestyle/trending/transport-warning-for-sydneysiders-ahead-of-mega-ed-sheeran-concerts-lunar-new-year-and-mardi-gras-events/news-story/8d9c5ec228da2a1ca45bb6186055f4b8
Sky News,Iconic restaurant chain announces Sydney comeback six years after closure,https://www.skynews.com.au/lifestyle/trending/run-dont-walk-iconic-restaurant-chain-announces-sydney-comeback-six-years-after-closure/news-story/fcd5a38f48c33b9c13ca8e3f56c231ce
Sky News,"Flirting at 35,000ft: New data unveils romantic travel trend",https://www.skynews.com.au/lifestyle/flirting-at-35000ft-new-data-shows-romantic-travel-trend-thats-taking-off/news-story/5eff0bad442e8142eb52b5987230d473
Sky News,How Aussies could face $22k fine and two years in prison over popular romantic gesture,https://www.skynews.com.au/lifestyle/trending/grotesque-couples-could-face-22k-fine-and-two-years-in-prison-over-harmless-romantic-stunt-on-valentines-day/news-story/e7b2b284c7198e879b7eb50259108b22
Sky News,"Viking Highlights Tours: Piers, Deer and a Very Helpful Daily",https://www.skynews.com.au/lifestyle/travel/viking-highlights-tours-piers-deer-and-a-very-helpful-daily/news-story/bfaa415e4da282325a43a634330f29dc
Sky News,"Flirting at 35,000ft: New data unveils romantic travel trend",https://www.skynews.com.au/lifestyle/flirting-at-35000ft-new-data-shows-romantic-travel-trend-thats-taking-off/news-story/5eff0bad442e8142eb52b5987230d473
Sky News,Jetstar announces review of carry-on baggage policy,https://www.skynews.com.au/lifestyle/travel/jetstar-announces-review-of-strict-carryon-baggage-rules-in-bid-to-reduce-airport-stress/news-story/cc74dbf064d765ba7583d854cc8cab8a
Sky News,"""It's a win': Flowers remain big hit on Valentine's Day",https://www.skynews.com.au/australia-news/its-a-win-flowers-remain-big-hit-on-valentines-day/video/00e5d9fd13c67f71f07aaad137184df4
Sky News,"""For good government, you need good Opposition': Taylor's new leadership is a ""great thing'",https://www.skynews.com.au/australia-news/politics/for-good-government-you-need-good-opposition-taylors-new-leadership-is-a-great-thing/video/fcfcdca96fb8347f00cdbe8386e87196
Sky News,"""We're here to fight for Australians': Angus Taylor speaks in regional NSW on new position",https://www.skynews.com.au/australia-news/politics/were-here-to-fight-for-australians-angus-taylor-speaks-in-regional-nsw-on-new-position/video/95b5579b6fb50b46328f18c43a0c833a
