Section,Headline,Link
9 News,Woman charged after stolen puppy located 30 kilometres from home,https://www.9news.com.au/national/teen-arrested-after-allegedly-stolen-puppy-located-30-kilometres-from-home/9fa0e8f4-90a4-4f6a-b9e4-9747e3bd7c44
9 News,Aussies could face $4400 fine over 'dangerous' jerry can act,https://www.9news.com.au/national/panicked-buyers-empty-shelves-to-stockpile-jerry-cans-as-fuel-prices-surge/75f156f4-b974-418f-9f17-f7ac550f3051
9 News,VPN services exploding in popularity as Pornhub cuts nudity to protest new laws,https://www.9news.com.au/national/pornhub-cut-nudity-australian-vpn-popularity-explodes-new-laws/630efbd9-76c6-45d3-b3e7-59857ee06c5a
9 News,The most dangerous area in Australia revealed,https://www.domain.com.au/news/the-most-dangerous-area-in-australia-revealed-1492528/?utm_source=9news.com.au&utm_medium=referral&utm_campaign=editorial-homepage-driver
9 News,'Queen of Versailles' faces legal woes over $300k,https://www.domain.com.au/news/queen-of-versailles-faces-legal-woes-over-300k-unpaid-bill-1492320/?utm_source=9news.com.au&utm_medium=referral&utm_campaign=editorial-homepage-driver
9 News,'Like a train': NSW and ACT shaken by earthquake,https://www.9news.com.au/national/nsw-earthquake-boorowa-shaken-by-quake-geoscience-australia-says/9cdbfa0c-6228-47dc-8548-7c833365f247
9 News,Security scare after Iranian player's change of heart over asylum decision,https://www.9news.com.au/national/iranian-football-players-senior-iranian-community-figure-says-more-footballers-seek-asylum/871406ab-bfe3-41ca-94aa-598f80eeeffe
9 News,Horror as two UK tourists die at popular beach despite rescue attempts,https://www.9news.com.au/national/shellharbour-deaths-man-and-women-die-at-popular-beach-in-nsw-illawarra-region/6dd06af9-d7a6-497d-8f31-750f675ae0e9
9 News,'Shocking' oversight put foster children in same house as convicted killer,https://www.9news.com.au/national/nsw-government-minister-orders-urgent-review-after-foster-children-found-living-with-convicted-serial-killer/95343234-a790-46fd-a345-e79647e93384
9 News,Man slashed with a machete after confronting teenagers outside of home,https://www.9news.com.au/national/croydon-attack-melbourne-man-to-undergo-three-surgeries-after-being-attacked-by-machetewielding-gang-victoria-crime/0ee93f28-0c15-45a6-b564-c7cef355e627
9 News,Search under way for missing swimmer on Sunshine Coast,https://www.9news.com.au/national/search-and-rescue-under-way-on-queenslands-sunshine-coast/02b8b678-3b27-4768-a599-35fe63b8b00f
9 News,Man to face trial for his wife's decades-old murder,https://www.9news.com.au/national/craig-freeman-court-updates-man-to-face-trial-for-his-wifes-decadesold-murder/3704f70d-8a82-4a2f-93b1-43fe74c075ed
9 News,Sydney beach shut after sharks spotted inside nets,https://www.9news.com.au/national/shark-spotted-inside-of-nets-of-beach-in-sydneys-lower-north-shore/cbf43785-c0d9-4b6d-a0e0-23fd0a61a366
9 News,Teachers charged with assault of young boys at NSW south-east school,https://www.9news.com.au/national/multiple-teenagers-charged-with-assault-in-nsw-south-east/0b428fd3-a51c-44d0-989d-89035a395999
9 News,Man who mimicked Bondi shooting says actions were 'drunken stupidity',https://www.9news.com.au/national/bondi-terror-attack-impersonators-hateful-tirade/e2ad3c0c-b154-44c9-9bfb-cd3c77831eba
9 News,Qantas hikes fares due to Iran war's impact on jet fuel prices,https://www.9news.com.au/national/us-israel-attack-iran-airlines-qantas-air-india-and-air-new-zealand-raise-fare-prices-due-to-surging-jet-fuel-costs/3f574ad4-c3b0-4cf7-bdd8-2972ac0d8c1d
9 News,Police resume Gus Lamont search 165 days after he vanished,https://www.9news.com.au/national/gus-lamont-search-resumed-oak-park-station/4ec902c5-ca16-48e3-ae7d-889bcf156de0
9 News,Melbourne office workers evacuated after bomb scarean hour ago,https://www.9news.com.au/national/melbourne-office-evacuated-bomb-threat-queens-road/f674e0f5-53ca-4e80-8bf7-4511893f8510
9 News,Nursing home fined after 45 residents died during COVID,https://www.9news.com.au/national/fine-for-nursing-home-after-residents-died-during-covid/a173253d-22a8-4199-9581-0f516c320d0d
9 News,VPN services exploding in popularity as Pornhub cuts nudity to protest new laws,https://www.9news.com.au/national/pornhub-cut-nudity-australian-vpn-popularity-explodes-new-laws/630efbd9-76c6-45d3-b3e7-59857ee06c5a
9 News,The most dangerous area in Australia revealed,https://www.domain.com.au/news/the-most-dangerous-area-in-australia-revealed-1492528/?utm_source=9news.com.au&utm_medium=referral&utm_campaign=editorial-homepage-driver
9 News,'Queen of Versailles' faces legal woes over $300k,https://www.domain.com.au/news/queen-of-versailles-faces-legal-woes-over-300k-unpaid-bill-1492320/?utm_source=9news.com.au&utm_medium=referral&utm_campaign=editorial-homepage-driver
9 News,TODAY IN HISTORYSuperstar dies in freak bathroom accident,https://www.9news.com.au/world/today-in-history-march-11-what-happened-on-this-day-claude-francois/d813231a-713a-40d7-84f2-31b31aca6ebb
9 News,How 73 years of history led to an attack and leader's assassination,https://www.9news.com.au/world/us-israel-attacks-iran-timline-events/ff4273f6-5e5f-40cf-949d-28907f8dfc21
9 News,The men in line to take over from the ayatollah,https://www.9news.com.au/world/us-iran-israel-war-who-is-running-iran-after-ayatollah-ali-khamenei-death/0c4850b8-871f-43ad-ae05-d02d12a6d0ee
9 News,"Iran's airstrikes may have just cracked Dubai's safe, shiny façade forever",https://www.9news.com.au/world/us-israel-attacks-iran-air-strikes-rock-dubai-reputation/0c961082-f5a0-4bc4-a440-717be79e027a
9 News,The concrete farmhouse that isn't what it seems,https://www.domain.com.au/news/buyer-snaps-up-historic-wwii-military-bunker-to-convert-into-new-home-1489082/?utm_source=9news.com.au&utm_medium=referral&utm_campaign=editorial-homepage-driver
9 News,"Independent petrol stations in regional Queensland running dry, mayor says",https://www.9news.com.au/national/independent-petrol-stations-in-regional-queensland-running-dry-mayor-says/7f93e7bc-b09d-49bb-9e55-20fc5d2f2220
9 News,'It hasn't been an easy journey to get here': Sarah Abo reveals she's pregnant,https://9now.nine.com.au/today/sarah-abo-pregnant-breaking-news/eea71be7-d5c8-4204-a61b-0d8f43107ccd
9 News,"Tests paused, students escorted from exam halls amid widespread NAPLAN issue",https://www.9news.com.au/national/naplan-technical-issue-nation-wide-students-unable-to-sit-exam/de1a264a-ea5d-471c-8fa0-b0e6cc1cc32a
9 News,Matt Canavan elected new Nationals leader,https://www.9news.com.au/national/federal-politics-new-nationals-leader/3e705dea-b553-47e3-9fad-9fe32d90d84b
9 News,"Lululemon fined more than $700,000 over marketing emails",https://www.9news.com.au/national/lululemon-fined-700000-over-marketing-emails-unsubscribe/9f2452ba-d369-4e28-9079-fb49b8c6dad1
9 News,Debbie was grieving her mum's sudden death. Then her ashes were stolen,https://www.9news.com.au/national/debbie-kristenson-mother-ashes-missing-sydney/91eb63fb-a32e-4623-a46c-99034287bb28
9 News,"'I'm buggered, mate': Nationals leader announces shock resignation",https://www.9news.com.au/national/federal-politics-news-david-littleproud-quits-nationals-leader/87176214-b470-4872-8425-3fb86b9f66d6
9 News,Deadly diabetic driver speaks publicly for first time,https://www.9news.com.au/national/william-swale-diabetic-driver-speaks-publicly-for-first-time-daylesford-pub-crash/ab8b0900-6aa7-44a3-995e-5cfe3ca3f59c
9 News,Cops seize water pistol after Sydney TAFE thrown into lockdown,https://www.9news.com.au/national/campbelltown-tafe-lockdown-police-operation-under-way-suspicious-behaviour/babd926a-a74a-4ba6-b3b6-3c13a5b78d8f
9 News,'Insult': Teen killer's appeal upsets slain grandmother's family,https://www.9news.com.au/national/vyleen-white-updates-appeal-upsets-slain-grandmothers-family/33adf4e1-d6d2-430b-8de9-4061ec9ea1ca
9 News,"AS IT HAPPENED: Football team member changes mind, heading back to Iran",https://www.9news.com.au/world/us-israel-attack-iran-live-updates-march-11-donald-trump-latest-world-news-headline/06bb3cab-63f2-47c3-93cb-0ae650ea1142
9 News,Top oil exporter warns Iran war could have 'catastrophic consequences',https://www.9news.com.au/world/worlds-top-oil-exporter-warns-iran-war-could-have-catastrophic-consequences-for-the-worlds-oil-markets/66f53431-b144-48c7-9303-a4e2c9d12e6d
9 News,'Iran will determine when the war ends': Fresh strikes heard across Middle East,https://www.9news.com.au/world/iran-launches-new-attacks-at-gulf-arab-countries-as-it-keeps-up-pressure-on-the-middle-east/54a3c472-952d-46d7-88bb-24567113dd02
9 News,AS IT HAPPENED: 'Iran will determine when the war ends',https://www.9news.com.au/world/us-israel-attack-iran-live-updates-march-10-donald-trump-latest-world-news-headline/f56853f3-caaf-4561-a0f2-16433f810007
9 News,Wife of US teacher killed in student prank gone wrong wants all charges dropped,https://www.9news.com.au/world/us-teacher-killed-in-student-prank-gone-wrong-world-news/7319d5e0-cddc-4eca-a912-4da50453752f
9 News,Trump has been giving the Iranians the boot. Now he demands asylum,https://www.9news.com.au/world/iranian-footballers-asylum-australia-news-donald-trump-iran-deportation-migrants-usa-updates/eb00f5c5-2b5d-428a-a0c4-96c1fc9a9d80
9 News,Cowboys star earns downgrade after Ponga shot in Vegas,https://www.nine.com.au/sport/nrl/las-vegas-2026-newcastle-knights-north-queensland-cowboys-result-kalyn-ponga-braidon-burns-high-tackle-sin-bin-video/07899d89-c68a-490c-8998-c7219728b8f3
9 News,'Deciding factors' as Broncos weigh up Hunt contract call,https://www.nine.com.au/sport/nrl/news-2026-the-mole-ben-hunt-contract-future-brisbane-broncos-david-mead-png-chiefs-comments/833474a1-cc63-4ad4-aed9-fb65d27f92da
9 News,Lions captain learns fate after lengthy tribunal hearing,https://www.nine.com.au/sport/afl/news-2026-brisbane-lions-harris-andrews-tribunal-result-darcy-gardiner-charge/64f6151c-ce08-4168-b009-0ee9473ba53a
9 News,Pies' $1m salary move that opens path to swoop on star,https://www.nine.com.au/sport/afl/news-2026-collingwood-salary-cap-space-nick-daicos-deal-zak-butters-target/46946db2-bde6-4e33-9d5c-d89439a0a215
9 News,'Foolish mistake' lands two Hawks in custody in the US,https://www.nine.com.au/sport/afl/news-2026-hawthorn-dylan-moore-connor-macdonald-arrested-us-training-camp-comments/738ace07-c8f9-4793-b142-d7dcffac6a0b
9 News,Surprise 'dark horse' threatening to trip up Matildas,https://www.nine.com.au/sport/football/womens-asian-cup-2026-matildas-dpr-korea-quarter-finals-preview-clare-wheeler-comments/02a7d2d2-40f1-41ec-84bd-ed3c013b489f
9 News,Powerful agent of Aussie stars rebrands after Epstein links,https://www.nine.com.au/sport/nrl/news-2026-wasserman-agency-rebrand-complete-the-team-epstein-files/3b539c46-f363-4534-a18e-279cd5d64c8a
9 News,Wong defends Australian contribution to Middle East conflict,https://9now.nine.com.au/today/penny-wong-defends-australian-contribution-to-middle-east-conflict/d476adf2-d5ef-45cc-a2af-864154dd8490
9 News,Sneak peek at highly anticipated Hannah Montana reunion,https://9now.nine.com.au/today/hannah-montana-reunion-20th-anniversary-entertainment-news-on-march-11/c4102640-94c0-47ec-8164-0fce5077ae8f
9 News,Sarah Abo announces she's pregnant,https://9now.nine.com.au/today/sarah-abo-pregnant-breaking-news/eea71be7-d5c8-4204-a61b-0d8f43107ccd
9 News,Comedian back in the spotlight following his spectacular cancellation,https://9now.nine.com.au/a-current-affair/marty-sheargold-steps-back-into-the-spotlight-following-his-spectacular-cancellation/59adc755-d3c7-47cc-9ff4-5ff169e0af0c
9 News,"Sydney women reveal survival story after brutal, random attack by celebrity dentist",https://9now.nine.com.au/a-current-affair/sydney-women-reveal-miraculous-survival-story-following-brutal-random-attack-by-celebrity-dentist/bb5bcc6b-6b54-422c-94ff-45b77915fe53
9 News,Dance studio owner throws open doors for free to encourage male participation,https://9now.nine.com.au/a-current-affair/dance-studio-owner-throws-open-doors-for-free-to-encourage-male-participation/8e40ae72-f27c-446d-96e9-f9583426b170
9 News,"Coles, Bunnings, Kmart respond to claims of staff exploitation by contractor",https://9now.nine.com.au/60-minutes/coles-bunnings-kmart-respond-to-claims-of-staff-exploitation-by-private-security-contractor/f7986b2f-f0dc-4412-ac2e-937a3efadb6e
9 News,How an unconventional Australian family became caught in a media storm in Italy,https://9now.nine.com.au/60-minutes/unconventional-australian-family-caught-in-a-media-storm-in-italy/c6a1424b-e0ff-4558-9e19-ced2edd48271
9 News,Meeting the Bondi hero who tried to stop a terrorist,https://9now.nine.com.au/60-minutes/bondi-shooting-meeting-bondi-hero-ahmed-al-ahmed-who-tried-to-stop-a-terrorist/098bf922-1d62-47a9-afa4-7de7dc4e3262
9 News,Rich-lister Brad Moran's giant Gold Coast compound up for grabs,https://www.domain.com.au/news/inside-the-estate-tallais-30m-tech-powered-mansion-redefining-gold-coast-luxury-1448607/?utm_source=nine.com.au&utm_medium=referral&utm_campaign=editorial-homepage-driver
9 News,Owner ordered to tear down $2.5 million house amid planning feud,https://www.domain.com.au/news/man-ordered-to-tear-down-2-5-million-house-amid-planning-feud-1475103/?utm_source=nine.com.au&utm_medium=referral&utm_campaign=editorial-homepage-driver
9 News,Grandmother wins $9m lake house after ignoring husband's warning,https://www.domain.com.au/news/grandmother-wins-9m-lake-house-after-ignoring-husbands-warning-1474093/?utm_source=nine.com.au&utm_medium=referral&utm_campaign=editorial-homepage-driver
9 News,Couple arrive home to find nasty note taped to their door,https://www.domain.com.au/news/couple-confronted-by-rude-note-eight-hours-after-picking-up-apartment-keys-1414069/?utm_source=nine.com.au&utm_medium=referral&utm_campaign=editorial-homepage-driver
9 News,The last affordable suburb in Sydney revealed,https://www.domain.com.au/news/girraween-the-closest-suburb-to-sydneys-cbd-for-under-1-million-is-24km-away-1408376/?utm_source=nine.com.au&utm_medium=referral&utm_campaign=editorial-homepage-driver
9 News,The unusual reason Peter bought this derelict cottage,https://www.domain.com.au/news/i-collected-it-peter-bought-this-run-down-riverside-nz-cottage-for-nostalgia-1414033/?utm_source=nine.com.au&utm_medium=referral&utm_campaign=editorial-homepage-driver
9 News,Toyota spied undergoing testing by rival company,https://www.drive.com.au/news/toyota-4runner-spied-testing-in-australia-by-ford-not-toyota/?utm_source=nine-rail&utm_medium=referral
9 News,All new electric car brings price rise,https://www.drive.com.au/news/2026-bmw-ix3-price-and-specs-all-new-electric-car-brings-price-rise-long-range/?utm_source=nine-rail&utm_medium=referral
9 News,"Chery rival to Toyota Prado, Denza B5: 'Never say never'",https://www.drive.com.au/news/chery-rival-to-toyota-prado-denza-b5-never-say-never/?utm_source=nine-rail&utm_medium=referral
9 News,Evacuation routes blocked amid Perth bushfire emergencyan hour ago,https://www.9news.com.au/national/perth-hills-bushfire-evacuation-routes-blocked-as-roads-closed/03bffab6-ab91-496a-81bf-2738b64a3846
9 News,Two backpackers missing as Queensland grapples with major floodingan hour ago,https://www.9news.com.au/national/queensland-flooding-bundaberg-homes-and-businesses-hit-by-flooding-for-the-fourth-time-in-15-years/ad2f38b1-e4e1-4ab8-bae3-02825837c9ab
9 News,Melbourne office workers evacuated after bomb scarean hour ago,https://www.9news.com.au/national/melbourne-office-evacuated-bomb-threat-queens-road/f674e0f5-53ca-4e80-8bf7-4511893f8510
9 News,Police treating man's death as suspicious,https://www.9news.com.au/videos/national/police-treating-mans-death-as-suspicious/cmmlrptsh002q0hlhww1oh9mb
9 News,Matt Canavan elected new Nationals leader,https://www.9news.com.au/national/federal-politics-new-nationals-leader/3e705dea-b553-47e3-9fad-9fe32d90d84b
9 News,Shocking moment car flips down Sydney street in alleged drunken crash,https://www.9news.com.au/national/chester-hills-news-shocking-moment-car-flips-down-western-sydney-street-in-alleged-drunken-crash/0529978f-f2c4-4a1b-a9ee-cfb63efbc34a
9 News,'Like a train': NSW and ACT shaken by earthquake,https://www.9news.com.au/national/nsw-earthquake-boorowa-shaken-by-quake-geoscience-australia-says/9cdbfa0c-6228-47dc-8548-7c833365f247
9 News,Sydney beach shut after sharks spotted inside nets,https://www.9news.com.au/national/shark-spotted-inside-of-nets-of-beach-in-sydneys-lower-north-shore/cbf43785-c0d9-4b6d-a0e0-23fd0a61a366
9 News,Horror as two UK tourists die at popular beach despite rescue attempts,https://www.9news.com.au/national/shellharbour-deaths-man-and-women-die-at-popular-beach-in-nsw-illawarra-region/6dd06af9-d7a6-497d-8f31-750f675ae0e9
9 News,"Tests paused, students escorted from exam halls amid widespread NAPLAN issue",https://www.9news.com.au/national/naplan-technical-issue-nation-wide-students-unable-to-sit-exam/de1a264a-ea5d-471c-8fa0-b0e6cc1cc32a
Guardian,"French aid worker among three killed in drone attack in eastern DRC, M23 rebels say",https://www.theguardian.com/world/2026/mar/11/drone-attack-goma-eastern-democratic-republic-of-the-congo-m23-rebels
Guardian,"Experts fear ""unethical"" vaccine trial in Africa is ""prototype"" for US studies under RFK Jr",https://www.theguardian.com/us-news/2026/mar/11/rfk-vaccine-trials-guinea-bissau
Guardian,"Prison sentences for pair who attacked gay men hailed as sign of hope for Kenya""s LGBTQ+ community",https://www.theguardian.com/global-development/2026/mar/11/prison-sentences-attacked-gay-men-hope-kenya-lgbtq-community
Guardian,"Villagers on Príncipe, the ""African Galapagos"", to be paid for protecting the ecosystem",https://www.theguardian.com/travel/2026/mar/10/principe-africa-villagers-to-be-paid-protect-ecosystem-african-galapagos
Guardian,Descendants of Zimbabwe resistance heroes urge UK to locate looted skulls,https://www.theguardian.com/world/2026/mar/07/descendants-of-zimbabwe-resistance-heroes-urge-uk-to-locate-looted-skulls
Guardian,"José Antonio Kast, the Pinochet fan about to swerve Chile to the far right",https://www.theguardian.com/world/2026/mar/11/jose-antonio-kast-pinochet-fan-chile-far-right
Guardian,"Haiti president""s assassination driven by greed and power, US prosecutors say",https://www.theguardian.com/world/2026/mar/10/haiti-president-jovenel-moise-trial
Guardian,"Shots fired at US consulate in Canada in what police call ""national security incident""",https://www.theguardian.com/world/2026/mar/10/shots-fired-canada-consulate-toronto
Guardian,Family of Tumbler Ridge shooting victim sues OpenAI alleging it could have prevented attack,https://www.theguardian.com/world/2026/mar/10/tumbler-ridge-shooting-victim-sues-openai-canada
Guardian,"Fears for women""s rights in Chile as anti-abortion president set to take office",https://www.theguardian.com/global-development/2026/mar/10/fears-womens-rights-chile-anti-abortion-president-jose-antonio-kast
Guardian,"""My lovely distraction"": live stream of kākāpō "" world""s fattest parrot "" and her chicks captivates New Zealand",https://www.theguardian.com/world/2026/mar/11/kakapo-cam-live-stream-parrot-new-zealand
Guardian,"China-North Korea trains to restart, six years after Covid brought them to stop",https://www.theguardian.com/world/2026/mar/10/china-north-korea-trains-to-resume-after-six-year-halt-following-covid-outbreak
Guardian,"New Zealand Covid response among world""s best but ""scars"" remain, inquiry finds ",https://www.theguardian.com/world/2026/mar/10/new-zealand-covid-response-inquiry-royal-commission-findings
Guardian,"Trump""s Iran war will reinforce North Korea""s view that nuclear weapons are the only path to security",https://www.theguardian.com/world/2026/mar/10/north-korea-nuclear-weapons-trump-iran-war
Guardian,"X suspends 800m accounts in one year amid ""massive"" scale of manipulation attempts",https://www.theguardian.com/technology/2026/mar/09/x-suspends-accounts-massive-scale-manipulation-attempts-russia
Guardian,"SA Liberals stand by candidate who said homosexuality opens up ""demonic realms"" ",https://www.theguardian.com/australia-news/2026/mar/11/south-australia-election-liberal-candidate-carston-woodhouse-homosexuality-demonic-realms-comments
Guardian,"Two protesters charged on first day of Queensland""s ""from the river to the sea"" ban ",https://www.theguardian.com/australia-news/2026/mar/11/two-protesters-arrested-on-first-day-of-queenslands-from-the-river-to-the-sea-ban-ntwnfb
Guardian,"""Intended to divide"": Porsche-driving middleman behind string of antisemitic attacks in Sydney sentenced to five years"" jail",https://www.theguardian.com/australia-news/2026/mar/11/middleman-behind-string-of-antisemitic-attacks-in-sydney-sentenced-to-five-years-jail-ntwnfb
Guardian,NSW police visited home where foster children lived with convicted killer weeks before government removed her,https://www.theguardian.com/australia-news/2026/mar/11/foster-children-left-in-home-triple-killer-regina-arthurell-ntwnfb
Guardian,"ACCC calls emergency meeting with fuel suppliers "" as it happened",https://www.theguardian.com/australia-news/live/2026/mar/11/federal-politics-updates-iran-womens-football-team-asylum-anthony-albanese-tony-burke-labor-angus-taylor-coalition-ntwnfb
Guardian,"Mojtaba Khamenei was hurt in strike that killed his father, Iran""s Cyprus ambassador confirms",https://www.theguardian.com/world/2026/mar/11/mojtaba-khamenei-was-hurt-in-strike-that-killed-his-father-irans-cyprus-ambassador-confirms
Guardian,Police investigating Swiss bus fire that killed six say no evidence of terrorist motive,https://www.theguardian.com/world/2026/mar/11/swiss-bus-fire-police-investigating-rule-out-terrorist-motive-for-now
Guardian,"Roman Abramovich""s Chelsea FC sale cash may be under investigation as ""proceeds of crime""",https://www.theguardian.com/world/2026/mar/11/investigation-roman-abramovich-chelsea-sale-cash
Guardian,"Ultrasound repellers could keep hedgehogs off roads, scientists hope ",https://www.theguardian.com/environment/2026/mar/11/ultrasound-repellers-hedgehogs-roads-scientists
Guardian,"Cologne Cathedral""s plans to charge for tickets spark outcry",https://www.theguardian.com/artanddesign/2026/mar/11/cologne-cathedral-plans-visitor-fees-outcry
Guardian,"Middle East crisis live: three ships hit in strait of Hormuz as Iran calls vessels belonging to US or allies ""legitimate targets""",https://www.theguardian.com/world/live/2026/mar/11/iran-war-live-updates-trump-oil-hormuz-protestors-us-israel-beirut-middle-east-latest-news
Guardian,IEA poised to call for largest ever release of stockpiled oil to reduce crude price,https://www.theguardian.com/business/2026/mar/11/international-energy-agency-release-oil-stockpile-iran-war
Guardian,"Why Iran""s vital Kharg Island oil hub is still untouched by US-Israel bombers",https://www.theguardian.com/world/2026/mar/11/why-irans-vital-kharg-island-oil-hub-is-still-untouched-by-us-israel-bombers
Guardian,"Iran""s regional proxies hold back from all-out war with US and Israel",https://www.theguardian.com/world/2026/mar/11/irans-regional-proxies-hold-back-from-all-out-war-with-us-and-israel
Guardian,"US attacks Iran""s mine-laying boats in strait of Hormuz as tensions rise over oil",https://www.theguardian.com/news/2026/mar/11/us-iran-strait-of-hormuz-mine-boat-attacks
Guardian,"Ex-rapper Balendra Shah set to be Nepal PM after party""s landslide election win",https://www.theguardian.com/world/2026/mar/08/ex-rapper-balendra-shah-nepal-pm-landslide-election-win
Guardian,US grants waiver to allow India to buy Russian oil amid Iran war,https://www.theguardian.com/us-news/2026/mar/05/us-waiver-india-russian-oil
Guardian,Sri Lanka evacuates crew from Iranian navy vessel days after warship was destroyed by US,https://www.theguardian.com/world/2026/mar/05/iran-ship-sri-lanka-port-after-us-sinking-of-frigate
Guardian,Nepal: voting closes in election pitting old guard against powerful youth movement,https://www.theguardian.com/world/2026/mar/05/nepal-election-2026-voting-balen-shah-sharma-oli
Guardian,US submarine sinks Iranian warship as conflict spreads beyond Middle East,https://www.theguardian.com/world/2026/mar/04/us-submarine-torpedo-iran-warship-sri-lanka-coast-pete-hegseth
Guardian,"Starmer and Badenoch spar over Iran at PMQs ahead of Mandelson documents release "" UK politics live",https://www.theguardian.com/politics/live/2026/mar/11/peter-mandelson-documents-keir-starmer-pmqs-iran-latest-news-updates
Guardian,"""Nothing off the table"" as Rachel Reeves considers ""targeted support"" over energy costs",https://www.theguardian.com/politics/2026/mar/11/nothing-off-the-table-as-rachel-reeves-considers-targeted-support-over-energy-costs
Guardian,"Quentin Tarantino""s ""swashbuckling epic"" The Popinjay Cavalier set for West End debut",https://www.theguardian.com/stage/2026/mar/11/quentin-tarantino-play-west-end-theatre-debut-the-popinjay-cavalier-london
Guardian,Average UK mortgage rate tops 5% as lenders scurry to reprice loans amid Middle East crisis,https://www.theguardian.com/money/2026/mar/11/uk-mortgage-rates-lenders-reprice-loans-middle-east-crisis
Guardian,Teenage boy arrested after reports girl stabbed at Norwich school,https://www.theguardian.com/uk-news/2026/mar/11/teenage-girl-stabbed-school-near-norwich
Guardian,"Nearly 4,000 US meatpacking workers to strike at plant run by top Trump donor",https://www.theguardian.com/environment/2026/mar/11/jbs-usa-meatpacking-strike-trump
Guardian,"First Thing: US attacks Iran""s mine-laying boats in strait of Hormuz as tensions rise over oil",https://www.theguardian.com/us-news/2026/mar/11/first-thing-us-israel-attack-iran-boats-strait-of-hormuz-middle-east-crisis-oil
