Section,Headline,Link
9 News,Authorities receive shocking video of person standing on dead whale south of Sydney,https://www.9news.com.au/national/wollongong-wombarra-beach-dead-humpback-whale-authorities-investigating-video-of-person-standing-on-mammal/1f5631ba-3457-4563-ae32-7fb235fd5ac0
9 News,'12 out of 10': Trump lowers tariffs after successful China meeting,https://www.9news.com.au/world/donald-trump-xi-jinping-meeting-first-time-in-six-years-as-world-watches/053a6555-9fb7-4aa4-81a9-b2a2ff9e1ae9
9 News,a current affairBuddy Franklin and Johnathan Thurston team up for most meaningful challenge yet,https://9now.nine.com.au/a-current-affair/lance-buddy-franklin-and-johnathan-thurston-team-up-for-most-meaningful-challenge-yet/306e33d6-3e27-4e16-b012-600532f1b66e
9 News,'Salacious gossip' or news? Tennis star turned MP to test new privacy law,https://www.9news.com.au/national/sam-groth-herald-sun-victoria-liberal-party/7d1ad0c2-cf9b-45ae-956c-6eb09e7d581e
9 News,Council introduces cat law with owners facing household limit and $300 fine,https://www.9news.com.au/national/perth-city-of-melville-introduces-cat-law/aea347d2-5754-491a-b751-95c778c63cb1
9 News,NSW dad almost killed in freak accident involving loose bed base,https://www.9news.com.au/national/nsw-dad-almost-killed-in-freak-accident-involving-loose-bed-base/b340ffa2-dbb1-46f5-a121-070e0cb25d73
9 News,Family 'shocked and saddened' by death of cruise ship passenger on Lizard Island,https://www.9news.com.au/national/lizard-island-cruise-ship-passenger-death-investigated-by-maritime-safety-body/5da8759e-f67e-4569-b74d-a7d016cdec08
9 News,"Baby killer was tired, frustrated before assaulting boy28 minutes ago",https://www.9news.com.au/national/baby-killer-was-tired-frustrated-before-assaulting-boy/e2f75f65-1586-4223-9d57-07f8082bc298
9 News,Fraudster cops 14 years' jail for Ponzi rip-off40 minutes ago,https://www.9news.com.au/national/fraudster-chris-marco-cops-14-years-jail-for-ponzi-ripoff/a0438457-75b7-41b2-b54c-8f11a1b3aa54
9 News,Boy dies after two e-bikes crash on bike path after school2 hours ago,https://www.9news.com.au/national/sunshine-coast-ebike-crash-boy-dies-after-two-ebikes-crash-in-mountain-creek/9bd4e4e9-6537-4297-9855-f0674ce0f2cf
9 News,a current affairCaravaning couple swindling in outback Aussie towns,https://9now.nine.com.au/a-current-affair/sally-clinch-and-scott-mclean-aussie-towns-targeted-in-outback-swingle/12034ee6-d088-42f7-ba5f-dfb605972c43
9 News,Young girl fighting for life after being hit by ute outside school,https://www.9news.com.au/national/child-hit-ute-critical-condition-western-sydney/4ea08e98-d19c-4ee2-a632-c532bc12d7df
9 News,Five more arrests made over brazen Louvre heist,https://www.9news.com.au/world/louvre-theft-five-new-arrests/d9c7bcbf-2df7-4f80-aa4c-23b5bd462df0
9 News,'A killing field': Hundreds murdered in hospital in horrific massacre,https://www.9news.com.au/world/sudan-violence-hospital-massacre-darfur/d592e345-944d-4889-9542-44d7d20a29c9
9 News,a current affairNational plan to tackle domestic violence outlined to parliament,https://9now.nine.com.au/a-current-affair/hannah-mcguire-michaela-cronin-domestic-violence-advocate/5ac4b741-3b70-4cdb-8efc-6effaafd8986
9 News,New laws to give Queensland parents access to child sex offender registry,https://www.9news.com.au/national/daniels-law-queensland-public-child-sex-offender-registry/1c410eb5-cd19-4d66-baaa-2136cce674c9
9 News,"'Supercell storms', wild weather headed for south-east Queensland",https://www.9news.com.au/national/queensland-weather-severe-thunderstorm-warning/0d45b15b-5059-4e2c-86d8-8bc5f050e80b
9 News,Asbestos found during $2 million park upgrade in Melbourne's west,https://www.9news.com.au/national/mccormack-park-laverton-melbourne-potential-asbestos-found-in-construction-area/5b29a895-02e9-4f47-a5dc-64a629f19d79
9 News,NSW government to appeal landmark music festival strip-search decision,https://www.9news.com.au/national/raya-meredith-class-action-nsw-government-to-appeal-landmark-stripsearch-court-decision/7462796a-6104-4351-9ea9-4814081563d9
9 News,a current affairBuddy Franklin and Johnathan Thurston team up for most meaningful challenge yet,https://9now.nine.com.au/a-current-affair/lance-buddy-franklin-and-johnathan-thurston-team-up-for-most-meaningful-challenge-yet/306e33d6-3e27-4e16-b012-600532f1b66e
9 News,'Salacious gossip' or news? Tennis star turned MP to test new privacy law,https://www.9news.com.au/national/sam-groth-herald-sun-victoria-liberal-party/7d1ad0c2-cf9b-45ae-956c-6eb09e7d581e
9 News,Council introduces cat law with owners facing household limit and $300 fine,https://www.9news.com.au/national/perth-city-of-melville-introduces-cat-law/aea347d2-5754-491a-b751-95c778c63cb1
9 News,TODAY IN HISTORYThe radio broadcast mass panic that never happened,https://www.9news.com.au/world/today-in-history-october-30-what-happened-on-this-day/d30adabe-e9b6-4542-8f69-62cec4d92c6e
9 News,$7.9 billion Medicare overhaul about to come into effect,https://www.9news.com.au/national/medicare-bulk-billing-changes-australia-november-explained/0d3f161a-0dec-4861-aff4-7f440fb43984
9 News,Days left to lodge tax return and dodge $330 monthly penalties,https://www.9news.com.au/national/tax-return-2025-deadline-when-you-need-to-lodge-your-return-by/f6d8833d-1ab4-4f11-b4dd-02cbfc5c2bcf
9 News,The people already putting their hands up for 2028 White House race,https://www.9news.com.au/world/us-presidential-election-2028-current-potential-candidates-favourites/d8364cd5-c70c-4c4c-b760-76d0d94eb59f
9 News,Six-figure warning as 'silver tsunami' of 2.8 million Aussies head for retirement,https://www.9news.com.au/national/sixfigure-warning-as-silver-tsunami-of-28-million-australians-race-towards-retirement/eba09da8-0629-4394-add9-47445d8843a9
9 News,Australia's richest people under 40 revealed in new list,https://www.9news.com.au/national/afr-reveals-australia-young-rich-list-for-2025/cb9fa810-70fb-4de4-ac07-38f86a7dd4c3
9 News,'Every four hours': Shock stat reveals Australia's illegal gun crisis,https://www.9news.com.au/national/gun-stolen-every-four-hours-in-australia-new-study-finds/5882c1cc-48aa-4138-ab1d-8a2ead97b347
9 News,exclusiveNSW prison officers ordered back to work after walkout sparked by brutal jail yard attack,https://www.9news.com.au/national/prison-officers-walk-off-job-after-inmate-sentenced-for-jail-attack/d29b4583-7a4c-48f2-b9dc-f03c9335a9b0
9 News,Cricketer killed in training tragedy remembered as 'shining light',https://www.9news.com.au/national/ben-austin-young-cricketer-dies-after-training-accident-victoria/b55935be-0408-4938-a3e6-bb46b649c8b1
9 News,Man found shot in car in Melbourne's south-east in mid-afternoon,https://www.9news.com.au/national/doveton-man-found-shot-in-car-in-melbournes-southeast-in-midafternoon/755b65cd-8316-47e9-afa7-5bc7bde5d454
9 News,No time behind bars for men who assaulted cricket great Stuart MacGill in shed,https://www.9news.com.au/national/stuart-macgill-cocaine-theft-no-time-in-jail-national-news/00a7ba13-a380-401e-89c3-5e32975fad26
9 News,"Defence lawyers point to separate, 'capable' Easey Street double murder suspect",https://www.9news.com.au/national/toddler-of-slain-mother-clung-to-neighbour-like-koala-after-easey-street-double-murder/136d2f2a-1ce2-4b0a-93eb-683471aeaff3
9 News,Police reveal shocking driving statistics ahead of long weekend,https://www.9news.com.au/national/victoria-police-roads-melbourne-cup-operation-furlong/d321e7df-4ef9-4cfa-8369-65a70c298288
9 News,'Just ideology': Morrison walks back his own net zero target of 2050,https://www.9news.com.au/national/scott-morrison-walks-back-net-zero-target-of-2050-describes-it-as-just-ideology/33dd833c-c9d3-4491-ac56-558b182b6bc8
9 News,Searchers to drain large dam in renewed search for missing boy Gus,https://www.9news.com.au/national/gus-lamont-updates-police-return-to-remote-homestead-in-search-for-missing-toddler/8bd49656-8fe5-4e76-bb60-cfe1672eb226
9 News,Trump makes 'immediate' nuclear weapons testing order,https://www.9news.com.au/world/donald-trump-nuclear-weapons-testing-order/313382ba-b47b-4a27-be10-9cc8782b3b97
9 News,"Earth at its hottest temperature in 125,000 years, report finds",https://www.9news.com.au/world/earth-at-hottest-temperature-of-the-past-125-000-years/902f6b6f-dabf-4d5c-abb1-0e9b16e693d7
9 News,Australian man admits selling hacking secrets to Russia in US court,https://www.9news.com.au/world/australian-man-admits-selling-pentagon-secrets-to-russia/b4632957-b6a5-45ce-93ed-5aab92d56854
9 News,Hurricane death tolls rises as it bears down on resort paradise,https://www.9news.com.au/world/hurricane-melissa-update-storm-hits-cuba-after-lashing-jamaica/ad94e02b-508d-4ca6-a3bc-636bea25ae99
9 News,Trump heaps praise on Albanese ahead of crucial meeting with China's leader,https://www.9news.com.au/world/albanese-meets-trump-ahead-of-us-presidents-meeting-with-china-leader/c5490936-6780-4a45-b934-9f35bd1e2eb9
9 News,Web outage hits major services for the second time this month,https://www.9news.com.au/world/microsoft-outage-microsoft-365-outlook-azure-xbox-minecraft-and-more-go-down/99cb72e2-b496-47f5-ba64-87666bce2711
9 News,Warner backflips on Konstas debate as old teammate firms,https://www.nine.com.au/sport/cricket/news-2025-sam-konstas-matt-renshaw-ashes-opener-debate-david-warner-comments/076d27fc-a244-4f1c-a375-b97d7f31ec66
9 News,Fifita deal confirmed as Wayne's overhaul gets major boost,https://www.nine.com.au/sport/nrl/news-2025-david-fifita-signs-south-sydney-rabbitohs-deal/331d5472-6b16-422c-aac7-87e8b54fcfac
9 News,"Test stars, hopefuls produce mixed bag as Smith tons up",https://www.nine.com.au/sport/cricket/news-the-ashes-2025-sam-konstas-sheffield-shield-nsw-v-queensland-wicket-out-video/cce919cf-a8f6-4a99-a2b8-4a9a5ea0f91f
9 News,Red Bull's itchy trigger finger as ghost of Ricciardo lurks,https://www.nine.com.au/sport/motorsport/f1-driver-line-up-2026-red-bull-daniel-ricciardo-hole-yuki-tsunoda-facing-axe-analysis/a569f88a-6e13-47b4-afcc-96effe10e5c5
9 News,'Such difficult news': Worst fears confirmed for Diamonds star,https://www.nine.com.au/sport/netball/news-2025-sunday-aryang-injury-diamonds-new-zealand-silver-ferns-constellation-cup/c669fbb7-bb97-4beb-9773-2b6eaf039fda
9 News,Rain ruins India onslaught as match abandoned,https://www.nine.com.au/sport/cricket/news-2025-australia-india-first-t20-washout-abandoned-suryakumar-yadav-six-video/52db509a-6abd-445b-9de6-cf5650c55267
9 News,Eels reveal 'perfect storm' behind Pezet deal,https://www.nine.com.au/sport/nrl/news-2025-jonah-pezet-parramatta-eels-jason-ryles-comments/ac33055d-98dc-47bf-ae5a-5ada2dac7907
9 News,Today host gets propositioned by 'the next Golden Bachelor',https://9now.nine.com.au/today/john-singleton-new-golden-bachelor-karl-stefanovic-wild-suggestion/e3480afb-c04e-46ea-b28c-856950684e03
9 News,Bohemian Rhapsody celebrates half a century,https://9now.nine.com.au/today/bohemian-rhapsody-celebrates-50-years-today-hosts-pay-tribute-to-queen-rock-anthem/398e5397-4d5b-49e9-95c3-81398a5e4f77
9 News,Fun fruit-based Halloween treats,https://9now.nine.com.au/today/paddys-ambassador-and-chef-melinda-esseys-fun-fruitbased-halloween-treats/3bf8a730-5459-432a-b0f6-a6d4662177ac
9 News,Buddy Franklin and Johnathan Thurston team up for most meaningful challenge yet,https://9now.nine.com.au/a-current-affair/lance-buddy-franklin-and-johnathan-thurston-team-up-for-most-meaningful-challenge-yet/306e33d6-3e27-4e16-b012-600532f1b66e
9 News,National plan to tackle domestic violence outlined to parliament,https://9now.nine.com.au/a-current-affair/hannah-mcguire-michaela-cronin-domestic-violence-advocate/5ac4b741-3b70-4cdb-8efc-6effaafd8986
9 News,Caravaning couple swindling in outback Aussie towns,https://9now.nine.com.au/a-current-affair/sally-clinch-and-scott-mclean-aussie-towns-targeted-in-outback-swingle/12034ee6-d088-42f7-ba5f-dfb605972c43
9 News,CFMEU administrator responds to 60 Minutes,https://9now.nine.com.au/60-minutes/cfmeu-administrator-responds-to-60-minutes/3ff67d7c-26e9-491c-b0c6-9f4490a3a962
9 News,Rise of home-schooling challenges traditional education system,https://9now.nine.com.au/60-minutes/rise-of-homeschooling-challenges-traditional-education-system/fc21be55-d866-4987-8e0a-49a752894dce
9 News,Juliette's dad tried to kill her after he murdered her sister,https://9now.nine.com.au/60-minutes/juliette-playford--my-dad-tried-to-kill-me-after-he-murdered-my-sister/582054c5-0414-4ff7-bd70-ffe9f4b737ca
9 News,Couple arrive home to find nasty note taped to their door,https://www.domain.com.au/news/couple-confronted-by-rude-note-eight-hours-after-picking-up-apartment-keys-1414069/?utm_source=nine.com.au&utm_medium=referral&utm_campaign=editorial-homepage-driver
9 News,The last affordable suburb in Sydney revealed,https://www.domain.com.au/news/girraween-the-closest-suburb-to-sydneys-cbd-for-under-1-million-is-24km-away-1408376/?utm_source=nine.com.au&utm_medium=referral&utm_campaign=editorial-homepage-driver
9 News,The unusual reason Peter bought this derelict cottage,https://www.domain.com.au/news/i-collected-it-peter-bought-this-run-down-riverside-nz-cottage-for-nostalgia-1414033/?utm_source=nine.com.au&utm_medium=referral&utm_campaign=editorial-homepage-driver
9 News,Honda will sell Australia's smallest electric car,https://www.drive.com.au/news/honda-will-sell-australias-smallest-electric-car-with-super-one-confirmed-for-2026/?utm_source=nine-rail&utm_medium=referral
9 News,Subaru WRX STI hatch returns as aggressive concept,https://www.drive.com.au/news/subaru-wrx-sti-hatch-returns-as-aggressive-concept-but-you-wont-be-able-to-buy-one/?utm_source=nine-rail&utm_medium=referral
9 News,Can Australian police 'steal' your car to use in an emergency?,https://www.drive.com.au/caradvice/can-australian-police-actually-take-and-use-your-vehicle-in-an-emergency/?utm_source=Nine-Rail&utm_medium=Referral
9 News,"Baby killer was tired, frustrated before assaulting boy28 minutes ago",https://www.9news.com.au/national/baby-killer-was-tired-frustrated-before-assaulting-boy/e2f75f65-1586-4223-9d57-07f8082bc298
9 News,Fraudster cops 14 years' jail for Ponzi rip-off40 minutes ago,https://www.9news.com.au/national/fraudster-chris-marco-cops-14-years-jail-for-ponzi-ripoff/a0438457-75b7-41b2-b54c-8f11a1b3aa54
9 News,Boy dies after two e-bikes crash on bike path after school2 hours ago,https://www.9news.com.au/national/sunshine-coast-ebike-crash-boy-dies-after-two-ebikes-crash-in-mountain-creek/9bd4e4e9-6537-4297-9855-f0674ce0f2cf
9 News,Caravaning couple swindling in outback Aussie towns,https://9now.nine.com.au/a-current-affair/sally-clinch-and-scott-mclean-aussie-towns-targeted-in-outback-swingle/12034ee6-d088-42f7-ba5f-dfb605972c43
9 News,National plan to tackle domestic violence outlined to parliament,https://9now.nine.com.au/a-current-affair/hannah-mcguire-michaela-cronin-domestic-violence-advocate/5ac4b741-3b70-4cdb-8efc-6effaafd8986
9 News,Buddy Franklin and Johnathan Thurston team up for most meaningful challenge yet,https://9now.nine.com.au/a-current-affair/lance-buddy-franklin-and-johnathan-thurston-team-up-for-most-meaningful-challenge-yet/306e33d6-3e27-4e16-b012-600532f1b66e
9 News,Cricketer killed in training tragedy remembered as 'shining light',https://www.9news.com.au/national/ben-austin-young-cricketer-dies-after-training-accident-victoria/b55935be-0408-4938-a3e6-bb46b649c8b1
9 News,Trial set to begin for Australian trio over alleged Bali villa murder,https://www.9news.com.au/national/bali-trio-trial-to-begin-over-alleged-murder-of-zivan-radmanovic/40c484af-108a-4ae4-8ef4-5ab4f2e107a3
9 News,Man slashed with machete on Melbourne street,https://www.9news.com.au/national/man-slashed-with-machete-on-melbourne-street-belgrave/efb09b1b-7220-491f-af38-d1842c648bb8
9 News,Five more arrests made over brazen Louvre heist,https://www.9news.com.au/world/louvre-theft-five-new-arrests/d9c7bcbf-2df7-4f80-aa4c-23b5bd462df0
Guardian,"""They killed civilians in their beds"": chaos and brutality reign after fall of El Fasher",https://www.theguardian.com/global-development/2025/oct/30/they-killed-civilians-in-their-beds-chaos-and-brutality-reign-after-fall-of-el-fasher
Guardian,Hundreds reportedly killed at Sudanese hospital as evidence of RSF atrocities mounts,https://www.theguardian.com/world/2025/oct/29/hundreds-reportedly-killed-at-sudanese-hospital-as-evidence-of-rsf-atrocities-mounts
Guardian,Violent protests erupt as Tanzanian president nears election victory,https://www.theguardian.com/world/2025/oct/29/tanzania-election-president-samia-suluhu-hassan-poised-to-retain-power
Guardian,"Wole Soyinka, Nigerian Nobel laureate and Trump critic, says US visa revoked",https://www.theguardian.com/books/2025/oct/28/wole-soyinka-nobel-us-visa-trump
Guardian,Mass killings reported in Sudanese city seized by paramilitary group,https://www.theguardian.com/world/2025/oct/28/mass-killings-reported-el-fasher-sudan-paramilitary-group-rapid-support-forces
Guardian,"Hurricane Melissa death toll rises as storm wreaks destruction across Caribbean "" as it happened",https://www.theguardian.com/world/live/2025/oct/29/hurricane-melissa-live-updates-strengthens-cuba-extensive-damage-parts-of-jamaica
Guardian,"Hurricane Melissa hits Cuba after turning Jamaica into ""disaster area""",https://www.theguardian.com/world/2025/oct/29/hurricane-melissa-hits-cuba-after-turning-jamaica-into-disaster-area
Guardian,"""This was a slaughter, not an operation"": the favela reeling from Rio""s deadliest police raid",https://www.theguardian.com/world/2025/oct/29/favela-reeling-rio-deadliest-police-raid-brazil
Guardian,"""A colony of the US"": Argentinians contemplate future after Trump-backed Milei coasts to victory ",https://www.theguardian.com/world/2025/oct/29/a-colony-of-the-us-argentinians-contemplate-future-after-trump-backed-milei-coasts-to-victory
Guardian,"Wednesday briefing: ""Catastrophic"" reports as Jamaica reels from worst storm since records began",https://www.theguardian.com/world/2025/oct/29/wednesday-briefing-catastrophic-reports-as-jamaica-reels-from-worst-storm-since-records-began
Guardian,"Donald Trump says rare earths dispute ""settled"" and China to resume buying US soybeans after Xi Jinping talks "" live",https://www.theguardian.com/world/live/2025/oct/30/donald-trump-xi-jinping-meeting-live-updates
Guardian,Trump-Xi meeting shows price of confrontation was too high for both sides,https://www.theguardian.com/us-news/2025/oct/30/trump-xi-jinping-meeting-us-china-price-confrontation
Guardian,Trump directs Pentagon to match Russia and China in nuclear weapons testing,https://www.theguardian.com/us-news/2025/oct/29/trump-pentagon-us-nuclear-weapons
Guardian,Trump-Xi meeting: US president says rare earths deal and tariff cut agreed,https://www.theguardian.com/us-news/2025/oct/30/trump-and-xi-meet-in-south-korea-for-crunch-talks-on-trade
Guardian,"Donald Trump praises ""great"" Washington meeting with Anthony Albanese as leaders dine at Apec",https://www.theguardian.com/australia-news/2025/oct/30/donald-trump-anthony-albanese-apec-dinner-gyeongju-south-korea
Guardian,"Queensland to create public register of sex offenders as Daniel Morcombe""s parents ""hope it will go national""",https://www.theguardian.com/australia-news/2025/oct/30/queensland-to-create-public-register-of-sex-offenders-as-daniel-morcombes-parents-hope-it-will-go-national
Guardian,State disability ministers threaten Butler with boycott over two-minute speaking limit at NDIS meeting,https://www.theguardian.com/australia-news/2025/oct/30/state-disability-ministers-threaten-mark-butler-boycott-ndis
Guardian,New record as Senate question time blows out into chaotic marathon over transparency fight,https://www.theguardian.com/australia-news/2025/oct/30/david-pocock-murray-watt-labor-coalition-senate-transparency-debate-question-time-extended
Guardian,"Former Adelaide MP named new ALP president "" as it happened",https://www.theguardian.com/australia-news/live/2025/oct/30/anthony-albanese-donald-trump-meeting-murray-watt-epbc-nature-laws-press-club-parliament-labor-coalition-sussan-ley-ntwnfb
Guardian,"News Corp had no first-hand source suggesting Sam Groth""s wife underage at start of relationship, MP""s lawyer tells court",https://www.theguardian.com/australia-news/2025/oct/30/sam-groth-wife-brittany-privacy-laws-news-corp-ntwnfb
Guardian,"Dutch election results: far-right and centrist parties in dead heat as last votes counted "" Europe live",https://www.theguardian.com/world/live/2025/oct/30/dutch-election-results-netherlands-geert-wilders-rob-jetten-france-louvre-russia-poland-ukraine-latest-news-updates
Guardian,Geert Wilders faces shutout as centrists hail huge gains in knife-edge Dutch election,https://www.theguardian.com/world/2025/oct/30/geert-wilders-faces-shutout-centrists-dutch-election-netherlands
Guardian,German dentists hold memorial recognising sadistic practices of profession under Nazis,https://www.theguardian.com/world/2025/oct/30/german-dentists-memorial-recognising-sadistic-practices-under-nazis
Guardian,"WPP jobs at risk as ad group""s new boss condemns ""unacceptable"" performance",https://www.theguardian.com/media/2025/oct/30/wpp-jobs-at-risk-as-ad-groups-new-boss-condemns-unacceptable-performance
Guardian,Geert Wilders convinced Dutch voters the far right could run the country. What is their verdict now?,https://www.theguardian.com/world/2025/oct/29/geert-wilders-convinced-dutch-voters-the-far-right-could-run-the-country-what-is-their-verdict-now
Guardian,UK rule change allows Palestinian scholars to bring families from Gaza,https://www.theguardian.com/education/2025/oct/30/uk-rule-change-allows-palestinian-scholars-to-bring-families-from-gaza-university-students
Guardian,Israel strikes Gaza again after overnight bombardment that killed at least 104,https://www.theguardian.com/world/2025/oct/29/israeli-strikes-in-gaza-overnight-as-ceasefire-looks-increasingly-fragile
Guardian,Greek police increase security after protests against Israeli cruise ship,https://www.theguardian.com/world/2025/oct/29/greek-police-increase-security-after-protests-against-israeli-cruise-ship
Guardian,Israel strikes Gaza after Netanyahu accuses Hamas of breaching ceasefire,https://www.theguardian.com/world/2025/oct/28/returned-body-parts-were-of-hostage-recovered-two-years-ago-israel-says
Guardian,"Teenager from Gaza ""stuck in hell"" after being prevented from joining mother in UK",https://www.theguardian.com/uk-news/2025/oct/28/teenager-from-gaza-stuck-in-hell-after-being-prevented-from-joining-mother-in-uk
Guardian,"Australia Women""s Cricket World Cup players ""touched inappropriately"" in India",https://www.theguardian.com/sport/2025/oct/25/australia-womens-cricket-world-cup-players-allegedly-touched-inappropriately-in-india
Guardian,"India trials Delhi cloud seeding to clean air in world""s most polluted city",https://www.theguardian.com/world/2025/oct/24/india-trial-delhi-cloud-seeding-clean-air-world-polluted-city-bharatiya-janata-party
Guardian, Thailand to let Myanmar refugees work to counter aid cuts and labour shortages,https://www.theguardian.com/global-development/2025/oct/22/thailand-to-let-myanmar-refugees-work-aid-cuts-labour-shortages
Guardian,Delhi awakes to a toxic haze after Diwali as pollution season begins,https://www.theguardian.com/world/2025/oct/21/delhi-awakes-toxic-haze-diwali-pollution-season-begins
Guardian,Thousands detained as Myanmar military raids notorious KK park scam compound,https://www.theguardian.com/world/2025/oct/21/myanmar-kk-park-raid-scam-cybercrime-centre-compound
Guardian,How deprived is your area? Look up your postcode as new data for England released,https://www.theguardian.com/society/ng-interactive/2025/oct/30/how-deprived-is-your-area
Guardian,"Tories call for Reeves to be sacked after breaking home rental rules but PM rules out investigation "" UK politics live",https://www.theguardian.com/politics/live/2025/oct/30/rachel-reeves-labour-keir-starmer-uk-politics-latest-news-updates
Guardian,"Birmingham city council was probably never bankrupt, says accountancy expert",https://www.theguardian.com/society/2025/oct/30/birmingham-city-council-bankruptcy-spending-cuts-accountancy-expert
Guardian, Toxin levels in fish lead to calls for UK-wide ban on mercury dental fillings,https://www.theguardian.com/environment/2025/oct/30/toxin-levels-in-fish-lead-to-calls-for-uk-wide-ban-on-mercury-dental-fillings
Guardian,"Tories will not deport legally settled people, Badenoch clarifies",https://www.theguardian.com/politics/2025/oct/30/tories-will-not-deport-legally-settled-people-kemi-badenoch-katie-lam
Guardian,"Senators demand answers on ICE""s use of full-body restraints on deportees",https://www.theguardian.com/us-news/2025/oct/30/ice-full-body-restraints-democratic-senators
Guardian,Revealed: ICE violates its own policy by holding people in secretive rooms for days or weeks,https://www.theguardian.com/us-news/2025/oct/30/ice-hidden-detention-sites
Guardian,"Extremists exploit political ""trigger events"" to recruit people online, says study",https://www.theguardian.com/us-news/2025/oct/30/extremists-political-violence-online
Guardian,National guard deployment in Washington DC extended until February,https://www.theguardian.com/us-news/2025/oct/29/hegseth-washington-dc-national-troops
Guardian,Microsoft reports strong earnings as Azure hit by major outage,https://www.theguardian.com/technology/2025/oct/29/microsoft-earnings-azure-outage-xbox
ABC,"Five new suspects arrested over Louvre heist, Paris prosecutor says",https://www.abc.net.au/news/2025-10-30/five-new-suspects-arrested-over-louvre-museum-jewels-robbery/105954530
