Section,Headline,Link
9 News,exclusiveTeens pinned to wall by out-of-control car skidding into takeaway shop,https://www.9news.com.au/national/ipswich-crash-teenagers-pinned-to-wall-after-car-skids-out-of-control-outside-queensland-takeaway-shop/7c3bd62e-3f0c-413a-9084-35a6d176786d
9 News,A Current AffairSon claims vulnerable dad was treated 'like a bank account' by NDIS provider,https://9now.nine.com.au/a-current-affair/son-claims-vulnerable-dad-was-treated-like-a-bank-account-by-ndis-provider/e1b575b6-b0f0-45cd-a9bc-f04fc3d2a8c0
9 News,Law enforcement block road near Nancy Guthrie's home,https://www.9news.com.au/world/nancy-guthrie-missing-tv-mother-kidnapping-arizona-law-enforcement-block-road-near-home/938601a1-6474-4f04-952b-70850830ae1a
9 News,'Quad God' falls twice in huge Olympic upset,https://www.nine.com.au/sport/olympics/milano-cortina-2026-ilia-malinin-falls-twice-mens-figure-skating-20260214-p5o2aw.html
9 News,La Niña on the way out as experts flag possibility of El Niño within months,https://www.9news.com.au/national/weather-la-nia-on-the-way-out-as-experts-flag-possibility-of-el-nio-within-months/d71b613e-c882-4b8e-8053-297da3794460
9 News,Grandfather kidnapped in case of mistaken identity from Sydney home,https://www.9news.com.au/national/sydney-north-ryde-85-year-old-man-chris-baghsarian-kidnapped-by-mistake/6149610e-4b4f-4cd5-8147-d6b5fddb4a96
9 News,Two women killed after allegedly reckless driver in stolen car crashes,https://www.9news.com.au/national/camden-crash-emergency-services-called-to-twocar-crash-on-the-old-hume-highway-at-camden-bypass/72a82da6-fdee-4d22-99c9-fbdaef482bae
9 News,ExclusiveMelbourne father says his life's changed forever after vicious attack19 minutes ago,https://www.9news.com.au/national/melbourne-father-plea-after-being-bashed-on-donut-delivery-run/2f92ff0b-3c12-40d1-9961-473ee13b2f80
9 News,exclusiveRecord-breaking number of tip-offs help solve 300 cases in one Aussie statean hour ago,https://www.9news.com.au/national/western-australia-crime-stoppers-record-breaking-number-of-tips-help-solve-crimes/07ee783e-4631-44b3-a7ed-9ca042410f60
9 News,A Current AffairWoman's home without roof nearly a year on from Cyclone Alfred,https://9now.nine.com.au/a-current-affair/gold-coast-womans-home-without-a-roof-nearly-one-year-on-from-cyclone-alfred/41e6d110-a38b-4976-a506-2bd58b38fd5b
9 News,New Liberal leader starts job in regional NSW,https://www.9news.com.au/videos/national/new-libs-leader-stars-job/cmllzg5ce00180hn5c0dc51ba
9 News,Three people rescued after becoming trapped in floodwaters as heavy rain lashes Queensland,https://www.9news.com.au/national/queensland-weather-large-parts-of-state-on-alert-for-heavy-rain-and-rapid-river-rises/e36b75ff-5587-489e-98d0-b7e29c250bf0
9 News,Four-hour Melbourne siege ends as man bitten by police dog,https://www.9news.com.au/national/bundoora-man-arrested-after-major-police-operation-in-melbournes-northeast/a870ae31-0241-4aa5-b335-80e4b379ec0d
9 News,Out of control driver hits several parked cars,https://www.9news.com.au/videos/national/out-of-control-driver-hits-several-parked-cars/cmlm1ivmu00120hr0k2r3ed45
9 News,'Priceless' Egyptian artifacts stolen in Queensland museum heist,https://www.9news.com.au/national/museum-egyptian-artefact-stolen-brisbane/628a8d1a-3dfe-4b88-9e6c-f37d374b4766
9 News,Ley's parting gift gives new opposition leader 'messy' early headache,https://www.9news.com.au/national/farrer-byelection-2026-date-candidates-and-everything-we-know-so-far-explained/2bac35b3-1581-473b-8ad9-e528ced802e9
9 News,Figure skating body hits back at bias allegations,https://www.nine.com.au/sport/olympics/milano-cortina-2026-figure-skating-ice-dance-free-dance-scoring-judging-controversy-isu-response-20260214-p5o2ak.html
9 News,Growing push for scrutiny of Sydney police after protest as lawyers offer free help,https://www.9news.com.au/national/sydney-town-hall-protest-lawyers-offer-free-help/7d5dcb70-8488-4e07-80d5-6cd33dd2b2e5
9 News,Organised crime figure used airport insiders and plane in $40 million drug plot,https://www.9news.com.au/national/organised-crime-figure-used-airport-insiders-and-plane-in-40-million-drug-plot/b154068a-26fd-45d2-a95e-cde9a8a81e35
9 News,Law enforcement block road near Nancy Guthrie's home,https://www.9news.com.au/world/nancy-guthrie-missing-tv-mother-kidnapping-arizona-law-enforcement-block-road-near-home/938601a1-6474-4f04-952b-70850830ae1a
9 News,'Quad God' falls twice in huge Olympic upset,https://www.nine.com.au/sport/olympics/milano-cortina-2026-ilia-malinin-falls-twice-mens-figure-skating-20260214-p5o2aw.html
9 News,La Niña on the way out as experts flag possibility of El Niño within months,https://www.9news.com.au/national/weather-la-nia-on-the-way-out-as-experts-flag-possibility-of-el-nio-within-months/d71b613e-c882-4b8e-8053-297da3794460
9 News,TODAY IN HISTORYThe creepy motivation behind the world's second most popular website,https://www.9news.com.au/world/today-in-history-february-14-what-happened-on-this-day-youtube/7bc2a368-9452-43ea-afe4-7c4390c64e02
9 News,$23 billion tax break could be overhauled in matter of months,https://www.9news.com.au/national/capital-gains-tax-discount-australia-speculation-overhaul-federal-budget-2026/1fcd9f5b-370a-4045-a4c3-c00c4dbec466
9 News,How much more you could be paying on your mortgage after cash rate hike,https://www.9news.com.au/national/rba-february-2026-interest-rates-decision-what-this-means-mortgage-explained/2e9fa2e7-e7a6-4909-a7aa-4fdb9c626e5c
9 News,What is the Nipah virus? Two confirmed cases spark airport screening across Asia,https://www.9news.com.au/world/nipah-virus-what-is-known-about-deadly-disease-explainer/db21f1c2-d80c-4e4e-b4cd-c3e61b58bc7f
9 News,Charcoal chicken barons list $11m Sydney estate,https://www.domain.com.au/news/el-jannah-co-founders-put-11-million-sydney-estate-on-the-market-1483488/?utm_source=9news.com.au&utm_medium=referral&utm_campaign=editorial-homepage-driver
9 News,Stubborn call that cost Scotty James gold in this crucial moment,https://www.nine.com.au/sport/olympics/milano-cortina-2026-scotty-james-interview-silver-medal-snowboard-halfpipe-final-20260214-p5o2a1.html
9 News,Why Aussies are finally ditching this one house rule,https://www.domain.com.au/news/is-multigenerational-living-the-answer-to-domestic-bliss-1481852/?utm_source=9news.com.au&utm_medium=referral&utm_campaign=editorial-homepage-driver
9 News,Man charged after multi-vehicle crash on Brisbane's Story Bridge,https://www.9news.com.au/national/queensland-police-man-charged-after-alleged-stolen-car-crash-on-brisbanes-story-bridge/201674af-26ec-477c-b207-05e5145d0331
9 News,Disability advocates call for 'life-changing' reform,https://www.9news.com.au/national/disability-advocates-call-for-provider-neutral-subsidy-scheme-transport-news-national/8bb2c18b-2d95-419e-950f-fd61ae01d9ed
9 News,Why an army of pink beanies were cheering Aussie to gold,https://www.nine.com.au/sport/olympics/milano-cortina-2026-josie-baff-family-mum-dad-brother-sister-boyfriend-canadian-olympian-eliot-grondin-20260214-p5o28l.html
9 News,Public child sex offender registry rolling out in South Australia,https://www.9news.com.au/national/south-australia-child-sex-offender-registry/a00e7224-c5e4-453b-bdb2-4db3b4d98fac
9 News,Man fighting for life after alleged stabbing on the Gold Coast,https://www.9news.com.au/national/gold-coast-news-man-in-a-critical-condition-after-alleged-stabbing-in-queensland/6f3c60a2-e94a-48f4-aada-8cbb4b85bf63
9 News,Battle over Virginia Giuffre's estate inches forward in WA,https://www.9news.com.au/national/virginia-giuffre-death-battle-over-her-estate-inches-forward/1decf627-e25f-4d2d-8215-ed653ced659c
9 News,Ex-Rebels bikie jailed over botched assassination,https://www.9news.com.au/videos/national/former-rebels-bikie-jailed-for-botched-assassination-attempt-2026-02-13-t-10-22-47-mp-4/cmlkqokek00110gnwpdgxkkn7
9 News,Almost 100 soldiers injured after group photo goes wrong,https://www.9news.com.au/national/queensland-townsville-lavarack-barracks-almost-100-soldiers-injured-after-group-photo-goes-wrong/ca3d1788-d2eb-4388-b0e1-e5f63321b4d1
9 News,Dawson's Creek star's final $6.7m act for his family,https://www.domain.com.au/news/james-van-der-beek-bought-his-familys-6-7m-rented-ranch-a-month-before-his-death-1483680/?utm_source=9news.com.au&utm_medium=referral&utm_campaign=editorial-homepage-driver
9 News,Brazilian au pair gets 10-year sentence for killing man in murder plot against lover's wife,https://www.9news.com.au/world/brazilian-au-pair-gets-10year-sentence-for-killing-joseph-ryan-in-murder-plot-against-lovers-wife/6ec4b153-2924-4b86-ad7b-6a27caec69d6
9 News,Chilling images from Nancy Guthrie's porch could hold valuable clues,https://www.9news.com.au/world/chilling-images-from-nancy-guthries-porch-could-hold-valuable-clues-about-the-masked-suspect/4951f593-e7c7-47f1-82b3-91a5f6c4bef9
9 News,Donald Trump pardons five former NFL players,https://www.9news.com.au/world/trump-pardons-5-former-nfl-players-for-crimes-ranging-from-perjury-to-drug-trafficking/5ba7cc8e-30eb-4ef7-a1d8-f4b7f3bd034c
9 News,This 500-year-old 'cave house' is carved into stone,https://www.domain.com.au/news/16th-century-cave-cottage-hits-the-market-with-1m-price-guide-1483655/?utm_source=9news.com.au&utm_medium=referral&utm_campaign=editorial-homepage-driver
9 News,FBI issues new details of suspect in Nancy Guthrie case,https://www.9news.com.au/world/nancy-guthrie-suspect-description-and-backpack/f5533911-7080-42fa-bd6a-e53ff3e4e504
9 News,Vonn shares gnarly photo after surgery on broken leg,https://www.nine.com.au/sport/olympics/milano-cortina-2026-lindsey-vonn-injury-update-broken-leg-photo/7ed58c21-cd24-45b7-8a41-151debb66d7d
9 News,Jakara's response to heartbreak only enhanced incredible legacy,https://www.nine.com.au/sport/olympics/milano-cortina-2026-jakara-anthony-womens-mogul-skiing-final-result-video-interview-analysis/3c1e1dc3-c8ba-4543-b71e-2c0223eea8ab
9 News,Insane NRL backline Wallabies could field at World Cup,https://www.nine.com.au/sport/rugby/nrl-news-2026-angus-crichton-wallabies-switch-tom-wright-interview-super-pacific-season-preview/853e4454-cbe7-4848-a4b0-6da8938e42f3
9 News,'Done a job on us': Broncos CEO blames rugby for Haas exit,https://www.nine.com.au/sport/nrl/news-2026-payne-haas-rejects-michael-maguire-rumours-brisbane-broncos-exit-south-sydney-rabbitohs/c4960868-b458-4b5a-889c-b063b8923eb3
9 News,Ange curse strikes twice as manager sacked after midnight,https://www.nine.com.au/sport/football/premier-league-2026-nottingham-forest-sack-manager-sean-dyche-news-reaction-updates/2387ffbd-3691-4a2c-8445-52a408307fd5
9 News,Stuffed Yoda toy that reminds family of 'zen master' Guseli,https://www.nine.com.au/sport/olympics/milano-cortina-2026-valentino-guseli-zen-master-family-reaction-interview-video-comments/fdead6b1-730c-4710-9c50-ac4431bb8b86
9 News,Coach gets measly fine for foul-mouthed rant at rival,https://www.nine.com.au/sport/basketball/nbl-news-2026-sem-phoenix-v-sydney-kings-result-kendric-davis-kicking-allegation-brian-goorjian-spray/1dde4957-32f0-40b2-97ab-273239ec9c5f
9 News,Kylie Minogue immortalised with very own Barbie,https://9now.nine.com.au/today/kylie-minogue-barbie-doll-announced-entertainment-news-february-13/103a4bb3-c434-4b29-9b46-eefc2ff258d7
9 News,Family slapped with $6k fine after terrifying home invasion,https://9now.nine.com.au/today/gold-coast-couple-fined-after-terrifying-home-invasion-car-stolen/1c66488b-98cc-4e83-8fb9-99d0e8f9bcf0
9 News,"Dawson's Creek star, James Van Der Beek, dead at 48",https://9now.nine.com.au/today/james-van-der-beek-dawsons-creek-star-dead-at-48-entertainment-news-february-12/c0549d8e-9fcf-472b-a57d-fab77e2b3cc3
9 News,Gold Coast woman's home without a roof nearly one year on from Cyclone Alfred,https://9now.nine.com.au/a-current-affair/gold-coast-womans-home-without-a-roof-nearly-one-year-on-from-cyclone-alfred/41e6d110-a38b-4976-a506-2bd58b38fd5b
9 News,Son claims vulnerable dad was treated 'like a bank account' by NDIS provider,https://9now.nine.com.au/a-current-affair/son-claims-vulnerable-dad-was-treated-like-a-bank-account-by-ndis-provider/e1b575b6-b0f0-45cd-a9bc-f04fc3d2a8c0
9 News,"One kidney, one married couple and a lifetime of love",https://9now.nine.com.au/a-current-affair/one-kidney-one-married-couple-and-a-lifetime-of-love/7628ef35-521f-4831-9d4b-927f654e6df0
9 News,CCTV provides vital clues into death of young Australian in Bali,https://9now.nine.com.au/60-minutes/byron-haddow-bali-cctv-footage-provides-vital-clues-into-the-death-of-young-australian-villa/5e7278d1-f714-4c34-9aea-afdfea0deaee
9 News,Families of four airmen killed in Taipan chopper crash break silence,https://9now.nine.com.au/60-minutes/taipan-families-of-four-airmen-killed-helicopter-crash-accuse-army/46e8e75d-f438-46b1-a76d-47d7110b572f
9 News,Sanna Marin: The partying prime minister who stood up against Russia,https://9now.nine.com.au/60-minutes/finland-sanna-marin-partying-prime-minister-who-stood-up-against-russia/49abe402-f6b5-4496-9669-a6b7536ea953
9 News,Rich-lister Brad Moran's giant Gold Coast compound up for grabs,https://www.domain.com.au/news/inside-the-estate-tallais-30m-tech-powered-mansion-redefining-gold-coast-luxury-1448607/?utm_source=nine.com.au&utm_medium=referral&utm_campaign=editorial-homepage-driver
9 News,Owner ordered to tear down $2.5 million house amid planning feud,https://www.domain.com.au/news/man-ordered-to-tear-down-2-5-million-house-amid-planning-feud-1475103/?utm_source=nine.com.au&utm_medium=referral&utm_campaign=editorial-homepage-driver
9 News,Grandmother wins $9m lake house after ignoring husband's warning,https://www.domain.com.au/news/grandmother-wins-9m-lake-house-after-ignoring-husbands-warning-1474093/?utm_source=nine.com.au&utm_medium=referral&utm_campaign=editorial-homepage-driver
9 News,Couple arrive home to find nasty note taped to their door,https://www.domain.com.au/news/couple-confronted-by-rude-note-eight-hours-after-picking-up-apartment-keys-1414069/?utm_source=nine.com.au&utm_medium=referral&utm_campaign=editorial-homepage-driver
9 News,The last affordable suburb in Sydney revealed,https://www.domain.com.au/news/girraween-the-closest-suburb-to-sydneys-cbd-for-under-1-million-is-24km-away-1408376/?utm_source=nine.com.au&utm_medium=referral&utm_campaign=editorial-homepage-driver
9 News,The unusual reason Peter bought this derelict cottage,https://www.domain.com.au/news/i-collected-it-peter-bought-this-run-down-riverside-nz-cottage-for-nostalgia-1414033/?utm_source=nine.com.au&utm_medium=referral&utm_campaign=editorial-homepage-driver
9 News,What do these strange stop signs actually mean?,https://www.drive.com.au/caradvice/stop-sign-with-three-black-dots/?utm_source=nine-rail&utm_medium=referral
9 News,Touchscreens 'wrong' for primary car controls,https://www.drive.com.au/news/touchscreens-wrong-for-primary-car-controls-iphone-designer/?utm_source=nine-rail&utm_medium=referral
9 News,MG has slashed price off its cheapest models in Australia - with a catch,https://www.drive.com.au/news/2026-mg-3-hatchback-slides-under-20000-with-a-catch/?utm_source=nine-rail&utm_medium=referral
9 News,Melbourne father says his life's changed forever after vicious attack19 minutes ago,https://www.9news.com.au/national/melbourne-father-plea-after-being-bashed-on-donut-delivery-run/2f92ff0b-3c12-40d1-9961-473ee13b2f80
9 News,Record-breaking number of tip-offs help solve 300 cases in one Aussie statean hour ago,https://www.9news.com.au/national/western-australia-crime-stoppers-record-breaking-number-of-tips-help-solve-crimes/07ee783e-4631-44b3-a7ed-9ca042410f60
9 News,JAKARA ANTHONY WINS GOLD!2 hours ago,https://www.nine.com.au/sport/olympics/milano-cortina-2026-jakara-anthony-wins-gold-dual-moguls-skiing-20260214-p5o2cr.html
9 News,Protesters gather against WA's controversial $217 million racetrack,https://www.9news.com.au/videos/national/protesters-gather-against-w-as-controversial-217-million-racetrack/cmlm65hka00140hmh1outareu
9 News,Teens pinned to wall by out-of-control car skidding into takeaway shop,https://www.9news.com.au/national/ipswich-crash-teenagers-pinned-to-wall-after-car-skids-out-of-control-outside-queensland-takeaway-shop/7c3bd62e-3f0c-413a-9084-35a6d176786d
9 News,Out of control driver hits several parked cars,https://www.9news.com.au/videos/national/out-of-control-driver-hits-several-parked-cars/cmlm1ivmu00120hr0k2r3ed45
9 News,Work begins to build South Australia's tallest tower,https://www.9news.com.au/videos/national/work-begins-to-build-south-australias-tallest-tower/cmlm1j66m00110hmhflxpkco7
9 News,Man charged after multi-vehicle crash on Brisbane's Story Bridge,https://www.9news.com.au/national/queensland-police-man-charged-after-alleged-stolen-car-crash-on-brisbanes-story-bridge/201674af-26ec-477c-b207-05e5145d0331
9 News,New Liberal leader starts job in regional NSW,https://www.9news.com.au/videos/national/new-libs-leader-stars-job/cmllzg5ce00180hn5c0dc51ba
9 News,Three people rescued after becoming trapped in floodwaters as heavy rain lashes Queensland,https://www.9news.com.au/national/queensland-weather-large-parts-of-state-on-alert-for-heavy-rain-and-rapid-river-rises/e36b75ff-5587-489e-98d0-b7e29c250bf0
Guardian,53 people dead or missing after migrant boat capsizes in Mediterranean,https://www.theguardian.com/world/2026/feb/09/deaths-migrant-boat-capsizes-mediterranean-libya
Guardian,"Ebo Taylor, Ghanaian highlife pioneer and guitarist, dies age 90",https://www.theguardian.com/music/2026/feb/09/ebo-taylor-ghanaian-highlife-pioneer-dies-age-90
Guardian,Weather tracker: Spain and Portugal hit by third deadly storm in two weeks,https://www.theguardian.com/environment/2026/feb/09/weather-tracker-spain-and-portugal-hit-by-third-fatal-storm
Guardian,"RSF drone attack kills 24 people fleeing fighting in central Sudan, says doctors group",https://www.theguardian.com/world/2026/feb/07/sudan-rsf-drone-attack-rahad-kills-displaced-people
Guardian,Thousands of Malawi businesses close in protest over tax changes ,https://www.theguardian.com/global-development/2026/feb/07/businesses-close-protest-malawi-tax-changes-electronic-invoicing-system
Guardian,Venezuelan deportee welcomes chance of US return but fears repeat of ordeal,https://www.theguardian.com/us-news/2026/feb/14/venezuelan-illegally-deported-return-fears
Guardian,Mark Carney joins hands with Canada opposition leader as he pays tribute to school shooting victims,https://www.theguardian.com/world/2026/feb/14/mark-carney-joins-hands-with-canada-opposition-leader-as-he-pays-tribute-to-school-shooting-victims
Guardian,"""What word is there for this?"" Tumbler Ridge reaches for unity in storm of grief",https://www.theguardian.com/world/2026/feb/13/tumbler-ridge-school-shooting-canada-unity-grief
Guardian,"Haiti""s Winter Olympics kit redesigned at last minute to fit IOC guidelines",https://www.theguardian.com/world/2026/feb/13/haiti-winter-olympics-ski-uniform-redesigned-ioc-guidelines
Guardian,Canada school deaths suspect created shooting simulator on gaming platform,https://www.theguardian.com/world/2026/feb/13/canada-school-deaths-suspect-created-shooting-simulator-roblox
Guardian,University expels student who called for accountability over Hong Kong fire,https://www.theguardian.com/world/2026/feb/13/university-expels-student-who-called-for-accountability-over-hong-kong-fire-miles-kwan
Guardian,"Beijing pastry shop overrun by shoppers after Xi Jinping""s visit ",https://www.theguardian.com/world/2026/feb/13/beijing-pastry-shop-overrun-shoppers-xi-jinping-visit-lunar-new-year
Guardian,CIA publishes recruitment video aimed at disaffected Chinese soldiers,https://www.theguardian.com/us-news/2026/feb/13/cia-publishes-recruitment-video-disaffected-chinese-soldiers
Guardian,Japan seizes Chinese fishing boat inside its economic zone amid Beijing rift,https://www.theguardian.com/world/2026/feb/13/japan-seizes-chinese-fishing-boat
Guardian,"Kim close to naming teenage daughter as future North Korean leader, South believes",https://www.theguardian.com/world/2026/feb/12/kim-jong-un-daughter-future-leader-north-korea-south
Guardian,"Anthony Albanese taunts new Liberal leaders in first comments since Sussan Ley""s ousting ",https://www.theguardian.com/australia-news/2026/feb/14/anthony-albanese-souffle-liberal-leaders-angus-taylor-jane-hume
Guardian,"Once demoted, now deputy leader: what will Jane Hume do for the Liberal party?",https://www.theguardian.com/australia-news/2026/feb/14/jane-hume-deputy-liberal-leader
Guardian,Weather tracker: cyclones hit Australia and Madagascar and -40C cold snap in northern Europe,https://www.theguardian.com/environment/2026/feb/13/weather-tracker-tropical-cyclone-mitchell-hits-western-australia
Guardian,"Qld coalmine expansion approved by Albanese government will clear habitat and fuel climate crisis, scientists say",https://www.theguardian.com/environment/2026/feb/13/qld-coalmine-expansion-approved-by-albanese-government-will-clear-habitat-and-fuel-climate-crisis-scientists-say
Guardian,"New leader targets immigration in first comments after spill "" as it happened",https://www.theguardian.com/australia-news/live/2026/feb/13/australia-politics-live-liberals-leadership-spill-vote-angus-taylor-sussan-ley-libspill-anthony-albanese-indigenous-apology-anniversary-ntwnfb
Guardian,Munich Security Conference live: Zelenskyy criticises Orbán and joins Starmer in calling for European unity,https://www.theguardian.com/world/live/2026/feb/14/munich-security-conference-live-marco-rubio-keir-starmer-eu-europe-ukraine-russia-latest-news-updates
Guardian,"Starmer stresses ""urgency"" of closer defence ties with Europe at Munich conference",https://www.theguardian.com/politics/2026/feb/14/keir-starmer-munich-conference-closer-europe-defence-ties
Guardian,Danish state could face legal action over deal that gives US powers on its soil,https://www.theguardian.com/world/2026/feb/14/denmark-us-powers-legal-action-greenland-washington-donald-trump-europe
Guardian,Gisèle Pelicot plans to meet ex-husband in prison for answers on other allegations,https://www.theguardian.com/world/2026/feb/14/gisele-pelicot-ex-husband-dominique-abuse
Guardian,"Rubio tells Europe US wants renewed alliance "" but on Trump""s terms",https://www.theguardian.com/us-news/2026/feb/14/marco-rubio-us-child-of-europe-trump-munich
Guardian,Trump sends second aircraft carrier to Middle East in effort to increase pressure on Iran,https://www.theguardian.com/world/2026/feb/13/trump-sends-second-aircraft-carrier-middle-east-iran
Guardian,"Bitter dispute between Trump and EU over Gaza""s future breaks out into the open",https://www.theguardian.com/us-news/2026/feb/13/dispute-future-of-gaza-trump-board-of-peace-eu-un
Guardian,NGOs sound alarm as foreign families flee camp holding suspected IS members,https://www.theguardian.com/world/2026/feb/13/ngos-sound-alarm-as-families-flee-islamic-state-camp
Guardian,Israeli journalists fear for press freedom if UK billionaire sells TV channel stake,https://www.theguardian.com/world/2026/feb/13/israeli-journalists-fear-press-freedom-uk-billionaire-sells-tv-channel-stake
Guardian,"Tony Blair""s oil lobbying is a misleading rehash of fossil fuel industry spin",https://www.theguardian.com/business/2026/feb/13/tony-blair-oil-lobbying-fossil-fuel-industry-renewables-energy-bills
Guardian, Bangladesh election: BNP wins historic first vote since overthrow of Hasina,https://www.theguardian.com/world/2026/feb/13/bangladesh-election-bnp-wins
Guardian,"""Invisible"" children born in the brothels of Bangladesh finally get birth certificates",https://www.theguardian.com/global-development/2026/feb/13/invisible-children-born-in-the-brothels-of-bangladesh-finally-get-birth-certificates
Guardian,Tarique Rahman promises era of clean politics as Bangladesh holds first election since fall of Hasina,https://www.theguardian.com/world/2026/feb/12/tarique-rahman-bnp-bangladesh-election
Guardian,"""Women""s freedoms are at stake"": concern at rise of Islamist party before Bangladesh election",https://www.theguardian.com/world/2026/feb/11/bangladesh-election-islamist-party-women-freedoms
Guardian,"Traditional food could help reverse Nepal""s ""diabetes epidemic"", studies suggest",https://www.theguardian.com/global-development/2026/feb/10/traditional-food-could-help-reverse-nepals-diabetes-epidemic-studies-suggest
Guardian,"Ban on Palestine Action ""massively backfired"", says group""s co-founder ",https://www.theguardian.com/uk-news/2026/feb/14/palestine-action-ban-backfired-says-co-founder-huda-ammori
Guardian,"Pension annuity sales hit record as average pot exceeds £80,000",https://www.theguardian.com/money/2026/feb/14/uk-pension-annuities-sales-rachel-reeves-inheritance-tax-invest
Guardian,Peta calls for pork-free menus as Peppa Pig show rolls into Grimsby,https://www.theguardian.com/stage/2026/feb/14/peta-pork-free-menus-peppa-pig-big-family-show-grimsby
Guardian,"Andrew aide advised Epstein to omit conviction on China visa form, files suggest",https://www.theguardian.com/us-news/2026/feb/14/david-stern-jeffrey-epstein-hide-conviction-china-visa
Guardian,"He ran, but he can""t keep hiding: Pressure mounts for Andrew to talk to police",https://www.theguardian.com/news/ng-interactive/2026/feb/14/will-police-question-andrew-andrew-mountbatten-windsor-epstein-relationship
Guardian,US fixation on the hard-hat economy and making manufacturing great again makes little sense,https://www.theguardian.com/business/2026/feb/14/trump-manufacturing-jobs-economy
Guardian,US man who fled jail and pleaded to Trump and Kim Kardashian gets 60-year term,https://www.theguardian.com/us-news/2026/feb/14/new-orleans-jailbreak-prison-sentence
