Section,Headline,Link
Sky News,"""Utter economic misery': Unemployment and inflation figures skyrocket",https://www.skynews.com.au/australia-news/politics/utter-economic-misery-unemployment-and-inflation-figures-skyrocket/video/4f55b60e76b374302bfba4156285b059
Sky News,"""Reckless': Rate cut unlikely after ""shocking' inflation rise",https://www.skynews.com.au/australia-news/politics/reckless-rate-cut-unlikely-after-shocking-inflation-rise/video/f02c9e56bf4719a69070ff1bc041d3a3
Sky News,Barnaby Joyce faces complaint over alleged tirade against female Nationals staffer,https://www.skynews.com.au/australia-news/politics/barnaby-joyce-faces-complaint-over-alleged-tirade-against-female-nationals-staffer/video/f937913927553cea1a68be878b032be6
Sky News,Former PM Scott Morrison supports Sussan Ley's net zero position,https://www.skynews.com.au/australia-news/politics/former-pm-scott-morrison-supports-sussan-leys-net-zero-position/video/53cd035d0dd837264b82e3c898f6d286
Sky News,Bureau of Meteorology apologises for new website rollout,https://www.skynews.com.au/australia-news/bureau-of-meteorology-apologises-for-new-website-rollout/video/2e3695c7f9c22371852608e4fc5f96be
Sky News,Today's News Headlines: At least 30 dead in Hurricane Melissa,https://www.skynews.com.au/australia-news/todays-news-headlines-at-least-30-dead-in-hurricane-melissa/video/29fe644c893312bf94bd22516f2178a0
Sky News,"Listen to ""Sky News Radio' on the Nova Player app",https://www.skynews.com.au/business/media/you-can-listen-to-sky-news-australia-anytime-and-on-any-platform-with-sky-news-radio-on-iheartradio/news-story/2d6aca31bc7566b5c0652db48284f5b7
Sky News,Catch up on your favourite Sky News shows with podcasts,https://www.skynews.com.au/opinion/your-favourite-sky-news-australia-shows-are-available-to-listen-to-any-time-as-podcasts/news-story/379bbe36e745709ce679d2813be0249c
