Section,Headline,Link
ABC,US Supreme Court backs Trump on aggressive immigration raids,https://www.abc.net.au/news/2025-09-09/us-supreme-court-backs-trump-on-aggressive-immigration-raids/105751210
ABC,Donald Trump displays signs of being an American authoritarian,https://www.abc.net.au/news/2025-09-09/donald-trump-dictator-authoritarian/105720444
ABC,"ASX falls, ANZ shares down despite mass sackings",https://www.abc.net.au/news/2025-09-09/asx-markets-business-live-news-sept-9-2025/105746990
ABC,Coalition vows to vote against treaty tabled in Victorian parliament,https://www.abc.net.au/news/2025-09-09/victoria-treaty-legislation-parliment-first-peoples/105749692
ABC,PM says Nampijinpa Price should apologise for Indian remarks,https://www.abc.net.au/news/2025-09-09/pm-says-nampijinpa-price-should-apologise-for-indian-remarks/105751534
ABC,PM says Nauru deal figures not 'necessarily correct',https://www.abc.net.au/news/2025-09-09/federal-politics-live-sept-9/105749822
ABC,Nepal lifts social media ban after 19 die in protests,https://www.abc.net.au/news/2025-09-09/nepal-lifts-social-media-ban-after-protests-leave-19-dead/105752254
ABC,Premier considers more police powers after fatal Melbourne stabbings,https://www.abc.net.au/news/2025-09-09/cobblebank-stabbing-youth-crime-machete/105746858
ABC,'Hate her for this': Ex-state ward says another child exposed her to abuse,https://www.abc.net.au/news/2025-09-09/state-ward-was-groomed-while-in-residential-care/105699088
ABC,The Good Guys hit with $13.5m fine for deceptive store credit promotions,https://www.abc.net.au/news/2025-09-09/the-good-guys-misleading-store-credit-promotions/105751816
ABC,'Jarring to have my experience dismissed': Women report low healthcare satisfaction,https://www.abc.net.au/news/2025-09-09/women-health-canberra-survey-access-affordability-not-serious/105748894
ABC,Teenage girl dies in hospital after NSW dog attack,https://www.abc.net.au/news/2025-09-09/teenage-girl-dies-after-singleton-dog-attack/105751342
ABC,Albanese flies to Vanuatu for $500m signing ceremony unlikely to happen,https://www.abc.net.au/news/2025-09-09/albanase-vanuatu-australia-nakamal-agreement/105750522
ABC,"ANZ to cut 3,500 jobs in next year in broader restructure",https://www.abc.net.au/news/2025-09-09/anz-to-cut-jobs-3500-to-go-by-sept-2026/105751484
ABC,Charges dropped against ex-Greens candidate injured in protest arrest,https://www.abc.net.au/news/2025-09-09/charges-against-hannah-thomas-dropped-court/105751884
ABC,High Court to decide on Katie Perry's trademark claim against Katy Perry,https://www.abc.net.au/news/2025-09-09/high-court-to-decide-on-katie-perry-trademark-claim-katy-perry/105748520
ABC,Childcare worker under investigation was hired and fired by another facility,https://www.abc.net.au/news/2025-09-09/childcare-worker-stood-down-silkstone-rehired-ipswich/105751774
ABC,Data reveals number of ADF veterans who sought help in year before suicide,https://www.abc.net.au/news/2025-09-09/australian-defence-force-deaths-by-suicide-data/105734216
ABC,"In this food bowl region, the alarm is ringing over water supply",https://www.abc.net.au/news/2025-09-09/limestone-coast-concerns-for-groundwater-shortage/105619362
ABC,'No-go' zones to be created in overhaul of environment laws,https://www.abc.net.au/news/2025-09-09/epbc-environment-laws-no-go-zones/105748644
ABC,One $785 payslip in 14 months: The life of Australia's 'country liaison officers',https://www.abc.net.au/news/2025-09-09/country-liaison-officers-allege-underpayment-pacific/105694912
ABC,Court hears of crime boss's alleged $1m offer to murder rival during dispute,https://www.abc.net.au/news/2025-09-09/bilal-hamze-murder-trial-ibrahem-hamze-rafat-alameddine/105748202
ABC,Harmful AI chatbot interactions target of world-first online safety reform,https://www.abc.net.au/news/2025-09-08/chatbots-banned-from-talking-sex-or-suicide-with-australian-kids/105750012
ABC,'Little things' driving Australia's golden generation of athletics stars,https://www.abc.net.au/news/2025-09-09/australian-athletics-stars-inspired-and-highly-motivated/105749554
ABC,'Loopholes and lags': The ACT's gun registry is still mostly paper based,https://www.abc.net.au/news/2025-09-07/act-firearms-registry-mostly-paper-based-police-say-need-digital/105744732
ABC,"After waiting 50 years, remote community resorts to Chinese prefab homes",https://www.abc.net.au/news/2025-09-07/calls-for-housing-investment-in-remote-wa-desert-communities/105580560
ABC,Senior doctor warns WA emergency departments run like 'disaster situation',https://www.abc.net.au/news/2025-09-06/dr-peter-allely-warns-wa-emergency-departments-struggling/105736090
ABC,"SA education minister says childcare staff key to preventing ""shocking"" incidents",https://www.abc.net.au/news/2025-09-05/south-australia-childcare-system-reform-stateline-blair-boyer/105733804
ABC,"Laws boosting deportation powers not sufficiently justified, committee warns",https://www.abc.net.au/news/2025-09-08/senate-committee-warns-new-laws-not-justified/105748164
ABC,Senator's Indian constituents call for apology over 'offensive' comments,https://www.abc.net.au/news/2025-09-08/nt-indian-community-react-jacinta-price-comments/105747404
ABC,Hawke tells Nampijinpa Price to apologise to Indian Australians,https://www.abc.net.au/news/2025-09-08/hawke-nampijinpa-price-apologise-indian-australians/105747484
ABC,PM flags corporate tax reform in speech to big business,https://www.abc.net.au/news/2025-09-08/pm-flags-corporate-tax-reform-in-speech-to-big-business/105745316
ABC,"Prince Harry makes rare visit to London, on anniversary of queen's death",https://www.abc.net.au/news/2025-09-09/prince-harry-makes-rare-visit-to-london/105751016
ABC,France just lost its fourth PM in two years. Here's what it means,https://www.abc.net.au/news/2025-09-09/what-does-francois-bayrou-confidence-vote-loss-mean-for-france/105751006
ABC,"Six killed by gunmen at bus stop in Jerusalem, at least 15 wounded",https://www.abc.net.au/news/2025-09-08/at-least-15-shot-after-gunmen-boards-bus-in-jerusalem/105749970
ABC,Palestinians in Gaza City consider evacuating for their children's sake,https://www.abc.net.au/news/2025-09-08/displaced-palestinians-gaza-city-fear-evacuating/105745934
ABC,Retailers 'alarmed' by Woolworths and Coles underpayment judgement,https://www.abc.net.au/news/2025-09-08/coles-woolworths-underpayment-court-judgement-fallout/105747578
ABC,Timber industry counts cost of ban from Great Koala National Park,https://www.abc.net.au/news/2025-09-09/nsw-timber-industry-shocked-by-logging-ban/105747810
ABC,Urgent calls for overdue upgrades on dangerous Darwin road,https://www.abc.net.au/news/2025-09-09/boulter-road-berrimah-nt-housing-developments-infrastructure/105729110
ABC,BA flight's emergency landing at Sydney Airport was due to false alarm,https://www.abc.net.au/news/2025-09-08/british-airway-flight-emergency-landing-sydney-airport-mayday/105750252
ABC,Richmond AFLW side packed with big names but winless and in trouble,https://www.abc.net.au/news/2025-09-09/richmond-aflw-in-trouble-after-four-straight-losses/105748382
ABC,"Hindley eyes Vuelta success, saying 'you race to win bike races'",https://www.abc.net.au/news/2025-09-09/jai-hindley-targeting-podium-in-vuelta-a-espana-final-week/105751220
ABC,Bulldogs prop forced to move out of home on eve of NRL finals,https://www.abc.net.au/news/2025-09-08/canterbury-bulldogs-player-max-king-moves-out-of-home/105750316
ABC,Gumboots replace running shoes for this annual community race,https://www.abc.net.au/news/rural/2025-09-09/farmers-run-in-gumboots-south-gippsland-gumboot-gift/105746634
ABC,What I learnt from three months of drastically reducing my screen time,https://www.abc.net.au/news/2025-09-08/what-i-learnt-from-three-months-of-slashing-my-screen-time/105670916
ABC,Our 10 most popular spring recipes,https://www.abc.net.au/news/2025-09-08/popular-easy-dinner-recipes-for-spring/105506036
ABC,Men reflect on how fatherhood has changed them,https://www.abc.net.au/news/2025-09-07/men-on-how-fatherhood-has-changed-them/105703614
ABC,Tiramisu cookies with mascarpone icing,https://www.abc.net.au/news/2025-09-06/tiramisu-cookies-mascarpone-icing/105693184
ABC,A stage adaptation of Craig Silvey's novel Runt will premiere next year,https://www.abc.net.au/news/2025-09-08/runt-craig-silvey-play-belvoir-st-theatre-2026-season/105747908
ABC,Key moments from the 2025 MTV Video Music Awards,https://www.abc.net.au/news/2025-09-08/key-moments-from-the-2025-vmas/105746958
ABC,From Wolf Creek to The Family Next Door: Teresa Palmer lands back home,https://www.abc.net.au/news/2025-09-07/teresa-palmer-the-family-next-door-mix-tape-last-anniversary/105644760
ABC,Comfort viewing 'feels good' but it can have 'a dark side',https://www.abc.net.au/news/2025-09-08/comfort-viewing-why-we-rewatch-tv-shows-and-movies/105728730
Sky News,"""Chants for terrorist uprisings': Pro-Palestinian protests at Bondi Beach ""crossed the line'",https://www.skynews.com.au/opinion/chris-kenny/chants-for-terrorist-uprisings-propalestinian-protests-at-bondi-beach-crossed-the-line/video/749438567435b4fa0b92cc2182bc761b
Sky News,"Claims Labor's $500 billion renewable targets could be ""easily doubled'",https://www.skynews.com.au/opinion/peta-credlin/claims-labors-500-billion-renewable-targets-could-be-easily-doubled/video/51160120d0399f05b0d31460a78f3b48
Sky News,"Melbourne labelled as ""city known for its crime' after machete crisis gets out of control",https://www.skynews.com.au/opinion/melbourne-labelled-as-city-known-for-its-crime-after-machete-crisis-gets-out-of-control/video/65ff15e6f2115884c18416fa0eee7ef1
Sky News,"""Unholy chants': Bondi Beach ""defiled' by pro-Palestinian hatred",https://www.skynews.com.au/opinion/sharri-markson/unholy-chants-bondi-beach-defiled-by-propalestinian-hatred/video/ee2c56bd189826705f2dbd44bfafc69b
Sky News,"""Should have been a one-day story': Liberal Party locked into inside battle",https://www.skynews.com.au/opinion/should-have-been-a-oneday-story-liberal-party-locked-into-inside-battle/video/aa210c786a9a31e18683071ee24085eb
Sky News,"""She lies': ""Insufferable' Meghan Markle under fire for latest interview",https://www.skynews.com.au/opinion/rita-panahi/she-lies-insufferable-meghan-markle-under-fire-for-latest-interview/video/286fa9a4c87fe43a0deaecbe4a7fee0b
Sky News,"""Prodigal sister': Nationals ready to welcome Jacinta Price back",https://www.skynews.com.au/australia-news/politics/prodigal-sister-national-party-ready-to-welcome-jacinta-price-back-with-open-arms-amid-liberal-tensions-matt-canavan-claims/news-story/7530ebf569265003b1f205559e2b25b4
Sky News,Images released: Police search for trio after Bondi Beach protest brawl,https://www.skynews.com.au/australia-news/crime/pictured-three-men-sought-by-nsw-police-after-brawl-at-chaotic-bondi-beach-propalestine-protest/news-story/9f00b960b43f507aed34ce192a522921
Sky News,Hey Hey It's Saturday star reveals cancer battle,https://www.skynews.com.au/lifestyle/celebrity-life/hey-hey-its-saturday-star-reveals-cancer-battle-following-routine-dental-check-a-year-after-death-of-john-blackman/news-story/05d0031ae3f8dc388d114a718d0d8b09
Sky News,Coalition vows to review divisive military edict if it regains power,https://www.skynews.com.au/australia-news/defence-and-foreign-affairs/angus-taylor-says-coalition-would-look-to-scrap-australian-army-ban-on-death-symbol-insignia-lashes-creeping-political-correctness-in-the-military/news-story/49c552f14c528087b0619806912866f4
Sky News,University professor hacked to death by fiend while walking her dog in a park,https://www.skynews.com.au/world-news/united-states/pintsized-auburn-university-veterinary-professor-hacked-to-death-by-fiend-while-walking-her-dog-in-the-park-police/news-story/70669e6d2c37fe98055509e520d87b7b
Sky News,"Shockingly ""short drive' Harry and William failed to take as brothers' meeting falters",https://www.skynews.com.au/lifestyle/celebrity-life/a-short-drive-prince-harry-william-mere-kilometres-from-each-other-but-did-not-meet-as-chasm-between-once-close-brothers-deepens/news-story/e3d5b383fe028954c8e7fd3525a80ec2
Sky News,Labor to announce new mega education agency,https://www.skynews.com.au/australia-news/labor-to-announce-planned-merger-of-four-education-agencies-to-create-new-teaching-and-learning-commission/live-coverage/8032718ec30a726e08494d3198d64b10
Sky News,Teenager dies following devastating dog attack in NSW's Hunter,https://www.skynews.com.au/australia-news/crime/teenage-girl-dies-in-hospital-days-after-devastating-dog-attack-on-singleton-property-nsws-hunter/news-story/e7aa9988276eba0a39adee857547c1cf
Sky News,Couple finally find $20 million Powerball ticket ' and you won't believe where it was hiding,https://www.skynews.com.au/lifestyle/trending/melbourne-couple-20-million-richer-after-ignoring-winning-powerball-ticket-stuck-on-their-fridge-door-for-days/news-story/979232ed032aa2203b60d75b724c6cec
Sky News,"The ""perfect' way I got revenge against a horror neighbour who kept blocking my garage",https://www.skynews.com.au/lifestyle/trending/man-praised-for-enacting-revenge-against-horror-neighbour-who-always-parked-in-front-of-his-garage-by-towing-her-car-twice/news-story/4963205c472310259ba56aa5c7f05144
Sky News,Lachlan Murdoch secures control of News Corp and Fox as succession battle ends,https://www.skynews.com.au/business/media/lachlan-murdoch-secures-control-of-news-corp-and-fox-as-succession-battle-ends/news-story/91d97f9159b7c5587edd1fa189934362
Sky News,"Leading Australian entrepreneur brands Labor's immigration intake ""ridiculous'",https://www.skynews.com.au/australia-news/politics/dick-smith-stresses-the-importance-of-population-plan-while-labelling-labors-immigration-intake-ridiculous/news-story/a7f4a57c642d310f6545be02e6f50da3
Sky News,"ANZ to axe 3,500 jobs in sweeping shake-up",https://www.skynews.com.au/business/finance/anz-to-axe-thousands-of-roles-as-chief-executive-nuno-matos-launches-560-million-overhaul/news-story/663b568a25463f8f6c197894610a4bf8
Sky News,"""I wanted to call that out': Jacinta Price hits back at Alex Hawke over staffer treatment",https://www.skynews.com.au/australia-news/i-wanted-to-call-that-out-senator-jacinta-price-hits-back-at-liberal-colleague-alex-hawke-over-treatment-of-staffer/news-story/f4b36790d7c2be92e40719f267d72b73
Sky News,"Australians warned to brace for ""severe weather' including dry lightning, damaging winds",https://www.skynews.com.au/australia-news/weather/australians-warned-to-brace-for-severe-weather-including-dry-lightning-damaging-winds-and-hail-across-central-areas-and-parts-of-nsw/news-story/06a99406735ca27ea20a98f9f9fe95c4
Sky News,Labor immigration pledge reveals what Australia's future looks like ' and it's not pretty,https://www.skynews.com.au/insights-and-analysis/labor-doesnt-care-about-your-marches-this-one-immigration-commitment-reveals-what-australias-future-looks-like-and-its-not-pretty/news-story/72b2a33f7f08b8c80beda882df996f3e
Sky News,Activists must never be allowed to turn Bondi Beach into a hate-filled no-go zone again,https://www.skynews.com.au/insights-and-analysis/sharri-markson-palestinian-activists-must-never-be-allowed-to-sully-bondi-beach-with-hate-again-after-this-weekends-violent-disruptive-clashes/news-story/4a017d8961dc5327a1431e3b526a06c9
Sky News,Unfathomable cost of Labor's green vanity project exposed by new data,https://www.skynews.com.au/insights-and-analysis/unfathomable-cost-of-elites-funding-green-fantasies-while-australian-families-fall-to-addiction-exposed-by-worsening-drug-crisis/news-story/2365d425b7554b179c8d469b404b5ca5
Sky News,University professor hacked to death by fiend while walking her dog in a park,https://www.skynews.com.au/world-news/united-states/pintsized-auburn-university-veterinary-professor-hacked-to-death-by-fiend-while-walking-her-dog-in-the-park-police/news-story/70669e6d2c37fe98055509e520d87b7b
Sky News,France's govt collapses after PM tried to rein in public debt,https://www.skynews.com.au/world-news/global-affairs/frances-government-collapses-in-spectacular-fashion-after-emmanuel-macrons-handpicked-leader-tried-to-rein-in-public-debt/news-story/b7b96a24e2ef896c0c6ad4ce79d2c2ff
Sky News,"Huge interstellar object could release ""mini-probes' that hit Earth: experts",https://www.skynews.com.au/world-news/global-affairs/manhattansized-interstellar-object-3iatlas-could-release-miniprobes-that-hit-earth-experts-warn/news-story/38fe4d9607621f595e9aaee2a0355d2a
Sky News,Children of NZ fugitive Tom Phillips found safe after desperate search,https://www.skynews.com.au/world-news/remaining-children-of-new-zealand-fugitive-tom-phillips-found-safe-after-father-shot-dead-by-police/news-story/3ae527df4e09c079607ba074d69e07a9
Sky News,"Hippo capsizes boat, leaving 11 people missing ' including children and baby",https://www.skynews.com.au/world-news/united-states/hippo-capsizes-boat-in-ivory-coast-leaving-11-people-missing-including-children-and-a-baby/news-story/02ab3792c9126987215f9ce94fc4dbbf
Sky News,Cheerleader's ex gives DNA sample after her newborn is found dead in a trash bag,https://www.skynews.com.au/world-news/united-states/cheerleader-laken-snellings-exboyfriend-provides-dna-sample-to-cops-after-her-newborn-found-dead-in-trash-bag/news-story/faa60ab3fe08558a552615ccfbe2f4ae
Sky News,"Horror video of Ukrainian refugee's slaughter met with silence from Dem leaders, media",https://www.skynews.com.au/world-news/united-states/horror-video-of-ukrainian-refugee-iryna-zarutskas-slaughter-on-charlotte-train-is-met-with-deafening-silence-from-democrat-leaders-media/news-story/0b51ed5a093366a24c302d0148f52bab
Sky News,"Trump blasts reporter asking about war with Chicago: ""Darling, that's fake news'",https://www.skynews.com.au/world-news/united-states/donald-trump-goes-off-at-reporter-for-asking-if-hes-going-to-war-with-chicago-darling-thats-fake-news/news-story/b1ba0e4226e1491ccc6537b36be17071
Sky News,"""Symbolism over substance is deadly': Gender diversity for firefighters questioned",https://www.skynews.com.au/opinion/symbolism-over-substance-is-deadly-gender-diversity-for-firefighters-questioned/video/a79c0f7239b84da3072c1c1e34283a2a
Sky News,"""A lot to unpack': Internal Liberal turmoil over Jacinta Price's ABC Indian comments",https://www.skynews.com.au/opinion/a-lot-to-unpack-internal-liberal-turmoil-over-jacinta-prices-abc-indian-comments/video/29d20da59e55b7cf9e591614f3a7ff93
Sky News,"""What's it going to cost?': Labor's big renewable promises come with little detail",https://www.skynews.com.au/opinion/paul-murray/whats-it-going-to-cost-labors-big-renewable-promises-come-with-little-detail/video/7f7768a33d2226bd60edcfae5643abff
Sky News,The Kenny Report | 8 September,https://www.skynews.com.au/stream/opinion-programs/the-kenny-report/the-kenny-report-8-september/video/254465fc3f94525b7767d80681e9a59a
Sky News,Credlin | 8 September,https://www.skynews.com.au/stream/opinion-programs/credlin/credlin-8-september/video/43560f3a28c44ea457dbf52aca546b58
Sky News,The Bolt Report | 8 September,https://www.skynews.com.au/stream/opinion-programs/the-bolt-report/the-bolt-report-8-september/video/ac14bea10b1d597590b2c06ac2c5953e
Sky News,Sharri | 8 September,https://www.skynews.com.au/stream/opinion-programs/sharri/sharri-8-september/video/45b3fb076ca31781e912dea74d3b2b1d
Sky News,Paul Murray Live | 8 September,https://www.skynews.com.au/stream/opinion-programs/paul-murray-live/paul-murray-live-8-september/video/69edc7b28726f4a4d2aa4a6fed339fa0
Sky News,The Late Debate | 8 September,https://www.skynews.com.au/stream/opinion-programs/the-late-debate/the-late-debate-8-september/video/629743559d90f9dd28acabdc299d2d33
Sky News,The Rita Panahi Show | 8 September,https://www.skynews.com.au/stream/opinion-programs/the-rita-panahi-show/the-rita-panahi-show-8-september/video/0ef2082e3ef253f233b0fb6b51275329
Sky News,"Don Lemon heckled as ""moron' in fiery street clash caught on tape",https://www.skynews.com.au/business/media/excnn-host-don-lemon-heckled-as-moron-in-fiery-new-york-street-clash-caught-on-tape/news-story/ca87260c29a7a7945a75716a6a480a20
Sky News,"ANZ to axe 3,500 jobs in sweeping shake-up",https://www.skynews.com.au/business/finance/anz-to-axe-thousands-of-roles-as-chief-executive-nuno-matos-launches-560-million-overhaul/news-story/663b568a25463f8f6c197894610a4bf8
Sky News,Lachlan Murdoch secures control of News Corp and Fox as succession battle ends,https://www.skynews.com.au/business/media/lachlan-murdoch-secures-control-of-news-corp-and-fox-as-succession-battle-ends/news-story/91d97f9159b7c5587edd1fa189934362
Sky News,"""Only going to get worse': Dire warning over labour shortages",https://www.skynews.com.au/business/finance/warren-hogan-warns-labour-shortages-only-going-to-get-worse-as-large-government-spending-squeezes-private-sector/news-story/9e50998a3d6cac89acbef679ba5647b6
Sky News,Major Aussie tech company surges in ASX reshuffle,https://www.skynews.com.au/business/tech-and-innovation/technology-one-to-join-the-asx-50-after-soaring-more-than-65-per-cent-in-12-months/news-story/57af1e965005d23b2ffa9d5e40a2642a
Sky News,Shock number of Aussies booking holidays they can't afford,https://www.skynews.com.au/business/finance/almost-three-million-aussies-booking-holidays-they-cannot-afford-fresh-finder-research-shows/news-story/95a6c1f6951fd489c97d2393c3c68515
Sky News,Major supermarkets owe upwards of $1b to underpaid workers,https://www.skynews.com.au/business/finance/woolworths-coles-facing-almost-1b-in-costs-after-a-judge-rules-against-the-supermarkets-in-underpaid-staffers-scandal/news-story/b341c7b9d943e317e220be01139abef8
Sky News,ASX sinks after alarming data emerges from the US,https://www.skynews.com.au/business/markets/asx-200-sinks-after-disappointing-jobs-numbers-emerge-from-the-us-in-blow-to-trump-administrations-economic-agenda/news-story/f8304adb67f681c1ec4367408a0b9f57
Sky News,Controversial Atlassian CEO defends sacking 150 via pre-recorded video,https://www.skynews.com.au/business/tech-and-innovation/atlassian-ceo-mike-cannonbrookes-defends-sacking-150-people-via-prerecorded-video-and-rails-against-media-spin/news-story/81f40d463394e4234c9d5ee735815f3d
Sky News,"Shockingly ""short drive' Harry and William failed to take as brothers' meeting falters",https://www.skynews.com.au/lifestyle/celebrity-life/a-short-drive-prince-harry-william-mere-kilometres-from-each-other-but-did-not-meet-as-chasm-between-once-close-brothers-deepens/news-story/e3d5b383fe028954c8e7fd3525a80ec2
Sky News,Hey Hey It's Saturday star reveals cancer battle,https://www.skynews.com.au/lifestyle/celebrity-life/hey-hey-its-saturday-star-reveals-cancer-battle-following-routine-dental-check-a-year-after-death-of-john-blackman/news-story/05d0031ae3f8dc388d114a718d0d8b09
Sky News,Couple finally find $20 million Powerball ticket ' and you won't believe where it was hiding,https://www.skynews.com.au/lifestyle/trending/melbourne-couple-20-million-richer-after-ignoring-winning-powerball-ticket-stuck-on-their-fridge-door-for-days/news-story/979232ed032aa2203b60d75b724c6cec
Sky News,"Charlie Sheen recalls dad Martin's ""biggest betrayal' following drug-fuelled spiral",https://www.skynews.com.au/lifestyle/celebrity-life/charlie-sheen-recalls-dad-martins-biggest-betrayal-following-drugfuelled-spiral/news-story/8dc2f684c23da9fafcdace88190a4ebe
Sky News,"Clueless American tourists board flight to Africa, thinking it's bound for France",https://www.skynews.com.au/lifestyle/trending/clueless-american-tourists-board-flight-to-africa-thinking-its-bound-for-france-airline-employee-misheard-us/news-story/2cb96c21d5856c51b738bfa4ff879b2b
Sky News,"The ""perfect' way I got revenge against a horror neighbour who kept blocking my garage",https://www.skynews.com.au/lifestyle/trending/man-praised-for-enacting-revenge-against-horror-neighbour-who-always-parked-in-front-of-his-garage-by-towing-her-car-twice/news-story/4963205c472310259ba56aa5c7f05144
Sky News,TikTok socialite's jaw-dropping wedding invite fail,https://www.skynews.com.au/lifestyle/celebrity-life/tiktok-socialite-becca-blooms-lavish-wedding-invite-riddled-with-bizarre-grammatical-errors/news-story/7e0343779420338aa3b26b25b09a51aa
Sky News,Real reason men are leaving FIFO as women preferred for lucrative work,https://www.skynews.com.au/lifestyle/trending/despise-going-to-work-now-fifo-men-reveal-psychological-toll-major-factor-in-leaving-industry-after-study-found-women-were-given-preference-for-roles/news-story/b02e605b7af51377c124e4bc420db531
Sky News,Australia Post to resume US deliveries,https://www.skynews.com.au/australia-news/australia-post-to-resume-us-deliveries/video/ca318571c96153151ea7e8d91caed81f
Sky News,British Airways flight makes emergency landing in Sydney after mayday call,https://www.skynews.com.au/australia-news/british-airways-flight-makes-emergency-landing-in-sydney-after-mayday-call/video/ac8d051c12ded0f8101362da5e84f1d0
Sky News,Government to combat student dropout rates,https://www.skynews.com.au/australia-news/politics/government-to-combat-student-dropout-rates/video/2bb3fddf69c3c5b9c97d56c818362ad7
Sky News,Mary Fowler to model at Paris Fashion Week,https://www.skynews.com.au/australia-news/sport/mary-fowler-to-model-at-paris-fashion-week/video/f0abd5657ae70d08ee7e57e6df62a54d
Sky News,Today's News Headlines: France Prime Minister loses confidence vote,https://www.skynews.com.au/australia-news/todays-news-headlines-france-prime-minister-loses-confidence-vote/video/e8d6112c4c0a55045ab4c37f4ed84e65
Sky News,Labor government warned against cash flow tax changes,https://www.skynews.com.au/australia-news/politics/labor-government-warned-against-cash-flow-tax-changes/video/31d77bea80b29715b11f17868cad24e6
