Section,Headline,Link
Sky News,Today's News Headlines: Trump links autism to paracetamol use,https://www.skynews.com.au/australia-news/todays-news-headlines-trump-links-autism-to-paracetamol-use/video/693cdf122348c87fb155b1fcfdc4c8ee
Sky News,NSW Police officer charged with assault over arrest of former Greens candidate,https://www.skynews.com.au/australia-news/nsw-police-officer-charged-with-assault-over-arrest-of-former-greens-candidate/video/f495747640f49bb1a2a393abc30886eb
Sky News,"Anthony Albanese ""mismanaging' Australia's alliance with the US following White House snub",https://www.skynews.com.au/australia-news/politics/anthony-albanese-mismanaging-australias-alliance-with-the-us-following-white-house-snub/video/c9cd451e9dbb9f4ee269527e7723545f
Sky News,Exclusive: Israel initiated phone call with Sussan Ley,https://www.skynews.com.au/australia-news/politics/exclusive-israel-initiated-phone-call-with-sussan-ley/video/f4abdb5e90d3a44814ce80f259077a44
Sky News,David Crisafulli to criticise BHP in state address,https://www.skynews.com.au/australia-news/politics/david-crisafulli-to-criticise-bhp-in-state-address/video/6dfa2c6de9246815a9dc7864020a4e44
Sky News,Rail network buckling under severe weather,https://www.skynews.com.au/australia-news/weather/rail-network-buckling-under-severe-weather/video/ae9f38a84ccf7aeba058cd71d3483ae9
Sky News,Optus' parent company to be investigated following network crisis,https://www.skynews.com.au/australia-news/optus-parent-company-to-be-investigated-following-network-crisis/video/4d837a7c7f5bc8ec7c98dd66ec4afa7e
Sky News,AI threatens Labor's climate ambition,https://www.skynews.com.au/australia-news/politics/ai-threatens-labors-climate-ambition/video/5b72e426b5409f1aadaffc69ad3a78e1
Sky News,"""Produce a lasting peace': Matt Thistlethwaite discusses recognising Palestinian statehood",https://www.skynews.com.au/australia-news/politics/produce-a-lasting-peace-matt-thistlethwaite-discusses-recognising-palestinian-statehood/video/07a51564ce03988c885abe66588362f8
Sky News,"Listen to ""Sky News Radio' on the Nova Player app",https://www.skynews.com.au/business/media/you-can-listen-to-sky-news-australia-anytime-and-on-any-platform-with-sky-news-radio-on-iheartradio/news-story/2d6aca31bc7566b5c0652db48284f5b7
Sky News,Catch up on your favourite Sky News shows with podcasts,https://www.skynews.com.au/opinion/your-favourite-sky-news-australia-shows-are-available-to-listen-to-any-time-as-podcasts/news-story/379bbe36e745709ce679d2813be0249c
