Section,Headline,Link
Guardian,Judges allow North Carolina to use Republican-drawn congressional map,https://www.theguardian.com/us-news/2025/nov/26/north-carolina-congressional-map
ABC,"Government projected to badly miss 2035 climate target, fall shy of 2030",https://www.abc.net.au/news/2025-11-27/climate-target-2035-badly-miss-projection/106059034
ABC,"Hot summer ahead leads to increased bushfire risk in parts of WA, NSW and Victoria",https://www.abc.net.au/news/2025-11-27/summer-bushfire-outlook-2025-afac-bom/106056420
ABC,A new war looms one year on from the Israel-Lebanon ceasefire,https://www.abc.net.au/news/2025-11-27/new-war-looms-israel-hezbollah-ceasefire/106054010
ABC,Woman killed in shark attack on NSW Mid North Coast,https://www.abc.net.au/news/2025-11-27/crowdy-bay-shark-attack/106058158
ABC,Banking regulator APRA to impose home loan caps amid housing boom,https://www.abc.net.au/news/2025-11-27/banking-regulator-apra-imposes-home-loan-caps/106058604
ABC,Two National Guard members shot in 'targeted' attack near White House,https://www.abc.net.au/news/2025-11-27/national-guard-members-shot-in-washington-dc/106057960
ABC,Police investigating reported stabbing at Melbourne school,https://www.abc.net.au/news/2025-11-27/police-investigating-reported-school-stabbing-berwick-melbourne/106058974
ABC,Police concerned for mother after newborn baby found outside fire station,https://www.abc.net.au/news/2025-11-27/newborn-baby-found-abandoned-outside-fire-station-in-the-act/106071838
ABC,Teen's death from suspected meat allergy caused by ticks could be a 'first',https://www.abc.net.au/news/2025-11-27/nsw-central-coast-mammalian-meat-allergy-ticks-inquest/106050534
ABC,'Nudify' services used by Australian school students blocked,https://www.abc.net.au/news/2025-11-27/nudify-services-used-by-australian-students-blocked/106057134
ABC,State park search for Samantha Murphy could continue beyond Thursday,https://www.abc.net.au/news/2025-11-27/latest-samantha-murphy-search-in-state-park-near-ballarat/106058858
ABC,Inquest finds murder of Lilie James 'was a premeditated killing',https://www.abc.net.au/news/2025-11-27/nsw-lilie-james-murder-sydney-coronial-inquest-findings/106055226
ABC,"ASX rises, APRA to impose home loan limits",https://www.abc.net.au/news/2025-11-27/asx-markets-business-live-news-nov27-2025/106058006
ABC,The 'concerning' link between childhood maltreatment and suicide risk,https://www.abc.net.au/news/2025-11-27/suicide-prevention-australia-recommendations/106051458
ABC,Spotlight on England's poor batting as ICC rates Perth pitch 'very good',https://www.abc.net.au/news/2025-11-27/icc-rates-perth-stadium-cricket-pitch-very-good-two-day-finish/106071812
ABC,'Nightmare' complaint left Optus customer and offshore worker in tears,https://www.abc.net.au/news/2025-11-27/optus-customers-complaints-network-ombudsman/106017302
ABC,Labor and Greens agree on extra ABC funding for kids' programs,https://www.abc.net.au/news/2025-11-27/labor-and-greens-agree-on-extra-abc-kids-funding/106058638
ABC,Ballarat mine operators charged over fatal rockfall,https://www.abc.net.au/news/2025-11-27/ballarat-gold-mine-collapse-charges/106031668
ABC,White wine grape growers already in crisis suffer 'another kick in the guts',https://www.abc.net.au/news/2025-11-27/white-wine-oversupply-set-to-deepen-grower-crisis/106049916
ABC,The rule change that could stop 'overpowered' e-bikes being brought into Australia,https://www.abc.net.au/news/2025-11-27/ebike-regulation-changes-to-halt-overpowered-bikes/106050674
ABC,Her 8yo son was killed in an e-motorbike crash. Now Kloe Weedon wants new rules to protect kids,https://www.abc.net.au/news/2025-11-27/mother-calls-for-change-zeke-hondow-killed-emotorbike-crash/106038102
ABC,Black Friday 'social pressure' pushing some Australians into debt binge,https://www.abc.net.au/news/2025-11-27/black-friday-sales-pressure-pushing-families-into-debt/106050862
ABC,Government threatens to shut down 'illegal' street charity,https://www.abc.net.au/news/2025-11-27/tmr-orders-shutdown-of-unauthorised-street-charity/106056444
ABC,Contender for Khawaja's Test spot calls him one of Australia's best ever,https://www.abc.net.au/news/2025-11-27/cricket-matt-renshaw-backs-usman-khawaja-amid-test-battle/106058068
ABC,Israel launches new military operation in northern West Bank,https://www.abc.net.au/news/2025-11-27/israel-launches-new-military-operation-in-northern-west-bank/106057468
ABC,Guinea-Bissau military launches coup and arrests political leaders,https://www.abc.net.au/news/2025-11-27/military-seizes-control-and-arrests-president-in-guinea-bissau/106057826
ABC,Sydney's rubbish leaves farmers feeling like 'second-class citizens',https://www.abc.net.au/news/2025-11-26/sydney-rubbish-waste-to-energy-tarago-concerns/106000072
ABC,"Despite having a law degree, this victim-survivor still found the court system 'traumatising'",https://www.abc.net.au/news/2025-11-25/calls-for-independent-representative-sexual-violence-victims/106045528
ABC,Illegal tobacco sellers leave tens of millions of fines unpaid,https://www.abc.net.au/news/2025-11-24/illegal-tobacco-industry-millions-in-fines-unpaid-queensland/106030978
ABC,"As Launceston works on a new flood strategy, some locals suggest floodgates",https://www.abc.net.au/news/2025-11-23/climate-change-flood-risk-launceston-tamar-estuary-floodgates/106004394
ABC,Waits on housing and renewables may have just gone from years to months,https://www.abc.net.au/news/2025-11-27/how-new-epbc-environment-laws-may-speed-up-housing-renewables/106051844
ABC,What the social media ban means for rural boarding school students,https://www.abc.net.au/news/2025-11-27/social-media-ban-regional-remote-students-boarding-school/106044168
ABC,Labor deals with Greens but grants business concessions on environment laws,https://www.abc.net.au/news/2025-11-27/labor-strikes-greens-deal-to-end-environmental-stalemate/106054928
ABC,Tough economic choices lie ahead after Labor's successful year,https://www.abc.net.au/news/2025-11-27/albanese-government-budget-repair-tax-reform-inflation-figures/106045644
ABC,Hong Kong's worst fire in years leaves at least 44 dead,https://www.abc.net.au/news/2025-11-26/hong-kong-high-rise-blaze-kills-people-dead-missing/106057480
ABC,"Styrofoam, bamboo and three arrests — here's what we know about the Hong Kong fire",https://www.abc.net.au/news/2025-11-27/what-we-know-about-hong-kong-tai-po-fire-bamboo-scaffolding/106057774
ABC,Indonesia launches probe into exports of radioactive goods. Here's what we know,https://www.abc.net.au/news/2025-11-27/indonesia-radiation-contamination-explained/106057730
ABC,Russia overtakes Australia in Asia regional power ranking,https://www.abc.net.au/news/2025-11-26/lowy-institute-power-index-asia-australia-slips-us-china-on-top/106054512
ABC,Global miner BMA drops Queensland mine expansion plan,https://www.abc.net.au/news/2025-11-27/bma-drops-queensland-saraji-east-mine-expansion-plan/106054392
ABC,"Premier says newly formed Queensland company secures 1,000 coal mining jobs",https://www.abc.net.au/news/2025-11-26/queensland-company-buys-coal-miner-fitzroy-resources/106053568
ABC,Concerns SA's 'best agricultural land' being taken up by battery projects,https://www.abc.net.au/news/2025-11-27/tagenergy-naracoorte-big-battery-project-concerns-farm-land-sa/106053784
ABC,Affordability crisis triggers surge in outback NSW land values,https://www.abc.net.au/news/2025-11-26/regional-nsw-land-values-surge-amid-affordability-crisis/106049688
ABC,Why a second job is a joy for Ash Riddell in the lead-up to grand final,https://www.abc.net.au/news/2025-11-27/aflw-grand-final-roos-brisbane-lions-ash-riddell/106055592
ABC,Staggs reveals one condition to ensure he continues playing for Australia,https://www.abc.net.au/news/2025-11-27/rugby-league-kotoni-staggs-kangaroos-kevin-walters-coach/106057948
ABC,The way Rockliff will be remembered inextricably tied to Hobart stadium's future,https://www.abc.net.au/news/2025-11-27/hobart-stadium-contentious-projects-not-new-for-tasmania/106031950
ABC,Aussie stronghold sports in line for Commonwealth Games return in India,https://www.abc.net.au/news/2025-11-27/cricket-hockey-set-potential-to-return-commonwealth-games/106057916
ABC,Amanda's husband seemed able to read her mind. Then she learnt why,https://www.abc.net.au/news/2025-11-26/how-amandas-ex-used-technology-to-gaslight-and-abuse/106000194
ABC,Experts recommend new mums stay offline for six weeks after their baby is born,https://www.abc.net.au/news/2025-11-25/taking-care-online-during-postpartum/106045302
ABC,One evening's planning has made me feel more prepared for an emergency,https://www.abc.net.au/news/2025-11-21/emergency-plan-natural-disasters-here-is-how/106027454
ABC,Why celebrity scandals can leave us feeling personally betrayed,https://www.abc.net.au/news/2025-11-20/why-celebrity-scandals-can-leave-us-feeling-shattered/105991484
ABC,Think you know Aussie music? Prove it in our quiz,https://www.abc.net.au/news/2025-11-27/australian-music-quiz-ausmusic-t-shirt-day/106024778
ABC,Fringe director reflects on 11 years leading country's biggest arts festival,https://www.abc.net.au/news/2025-11-26/adelaide-fringe-outgoing-director-biggest-arts-festival/106047078
ABC,Designing Andor's costumes required building an entire world,https://www.abc.net.au/news/2025-11-25/michael-wilkinson-costume-designer-andor-death-by-lightning/103577456
ABC,Want to connect with your inner child? These artists can show you how,https://www.abc.net.au/news/2025-11-26/the-art-of-the-inner-child/106038688
Sky News,"""Open season': Chris Bowen under fire over UN climate negotiation position",https://www.skynews.com.au/opinion/peta-credlin/open-season-chris-bowen-under-fire-over-un-climate-negotiation-position/video/27b420c5efe8771a898712e62e590cdf
Sky News,Chris Kenny celebrates Paul Murray's 15 year Sky News anniversary,https://www.skynews.com.au/opinion/chris-kenny/chris-kenny-celebrates-paul-murrays-15-year-sky-news-anniversary/video/436d1fa4d960f20469009c2a65d5277c
Sky News,"Sydney Opera House was ""reclaimed' for ""decency' after its controversial protests",https://www.skynews.com.au/opinion/chris-kenny/sydney-opera-house-was-reclaimed-for-decency-after-its-controversial-protests/video/127d707451b101aaf50e43b7324117bb
Sky News,Reserve Bank's shock announcement of electricity prices up 37 per cent,https://www.skynews.com.au/opinion/andrew-bolt/reserve-banks-shock-announcement-of-electricity-prices-up-37-per-cent/video/e065ad0dd24e89e6d32d190f166cade8
Sky News,"Anti-Israel vandal allowed to ""walk free'",https://www.skynews.com.au/opinion/sharri-markson/antiisrael-vandal-allowed-to-walk-free/video/34798a776eeba97084a8b2458cf0db6b
Sky News,Macaulay Culkin reveals he is eager to star in a Home Alone sequel 35 years later,https://www.skynews.com.au/opinion/rita-panahi/macaulay-culkin-reveals-he-is-eager-to-star-in-a-home-alone-sequel-35-years-later/video/5bafde0d2d6f7d14b8a2111ae317cac5
Sky News,Barnaby Joyce expected to defect to One Nation after months of speculation,https://www.skynews.com.au/australia-news/politics/nationals-mp-barnaby-joyce-defecting-to-one-nation-after-months-of-speculation/news-story/6fdf6c21a7212479306367fb6efac169
Sky News,"Labor sidelines Coalition, strikes deal with Greens on environmental laws",https://www.skynews.com.au/australia-news/politics/albanese-government-sidelines-coalition-strikes-deal-with-australian-greens-on-longawaited-environmental-laws/news-story/81af5c39175fd76f9f30cbe61f648aa9
Sky News,"Swedish tourist dead in shark mauling, as hero bystander saves a second victim",https://www.skynews.com.au/australia-news/crime/woman-dead-after-shark-attacks-two-swimmers-at-crowdy-bay-new-south-wales/news-story/541cf5e2ebaa8cf5987a1884ff1f09a0
Sky News,Afghan national identified as suspect in shooting of two National Guard members near White House,https://www.skynews.com.au/world-news/united-states/two-national-guard-members-shot-in-washington-dc-near-the-white-house-one-suspect-taken-into-custody/news-story/d029f6c0205c1de6811b51e78bdf3d7d
Sky News,Queensland Year 12 student dies in horror fall at formal,https://www.skynews.com.au/lifestyle/health/horror-fall-at-queensland-school-formal-results-in-death-of-wellington-point-year-12-student/news-story/2adf7fd0e5b65326c00cb441884125da
Sky News,"Judi Dench can ""no longer recognise loved ones' amid heartbreaking health battle",https://www.skynews.com.au/lifestyle/celebrity-life/i-dont-recognise-anyone-oscar-winner-judi-dench-90-shares-devastating-update-amid-rapidly-progressing-health-condition/news-story/2d503262bf715c55a95e4b7932e6d5f1
Sky News,Death toll rises following horror Hong Kong high-rise inferno,https://www.skynews.com.au/world-news/china/labor-warned-of-need-for-247-triple-zero-watchdog-to-protect-against-system-failures-before-fatal-optus-outage/live-coverage/6513aebd552c45ed415ac7251f8ae4d4
Sky News,"""Broke girls' summer: Allan govt plots raid on super to patch over her budget",https://www.skynews.com.au/insights-and-analysis/broke-girls-summer-jacinta-allan-jaclyn-symes-plot-raid-on-super-to-patch-over-victorian-budget-drowning-in-red-ink/news-story/d7d43d071773b818f258c8b8cd9bc861
Sky News,"""Unsustainable': Shock number of parents still financially supporting adult children",https://www.skynews.com.au/business/finance/more-than-one-in-three-parents-financially-supporting-their-adult-children-comparison-site-finder-reveals-as-cost-of-living-pressures-plague-millions-of-australians/news-story/246a5d59dfe1119b2155f782cb697515
Sky News,"""Out of control': Shadow minister lashes inflationary impact of Labor's spending policies",https://www.skynews.com.au/australia-news/politics/shadow-finance-minister-james-paterson-says-rising-inflation-reflects-direct-result-of-government-policy-as-pressure-builds-on-chalmers/news-story/4fcd25cd9a871bee8d5c99de2d9ee114
Sky News,Wild scenes from Sydney's most recent storms circulate online,https://www.skynews.com.au/australia-news/weather/wild-scenes-from-sydneys-most-recent-storms-circulate-online/news-story/067183c7952a6fd22d479e7b55731bb2
Sky News,Sunrise favourite reveals major career decision after 30 years at Seven,https://www.skynews.com.au/lifestyle/from-the-bottom-of-my-heart-sunrise-veteran-mark-beretta-59-announces-shock-retirement-after-three-decades-with-channel-seven/news-story/605187414b3dc084374464e0dfcca066
Sky News,"""Wrong priorities': Allan govt to make ""fourth apology' to Indigenous Victorians",https://www.skynews.com.au/australia-news/politics/wrong-priorities-allan-government-to-make-fourth-apology-to-indigenous-victorians-following-treaty-signing/news-story/5e8299042c7ac8cc85e3ef4935c1ae5d
Sky News,"""Get rates up': Major RBA call after inflation spikes",https://www.skynews.com.au/business/finance/get-rates-up-eq-economics-warren-hogan-delivers-major-interest-rate-call-after-inflation-spikes-in-year-to-october/news-story/fb6ebeb34e2becc8a85fcdf3f3a4d33e
Sky News,Western Sydney man charged with multiple animal cruelty offences,https://www.skynews.com.au/australia-news/crime/western-sydney-man-57-charged-with-multiple-animal-cruelty-offences-after-two-dogs-found-in-train-station-bike-locker/news-story/56215a90db583eae648c5cfdc864c4ef
Sky News,"Cuban Missile Crisis 2.0: Ukraine peace talks risk global conflict 10,000km away",https://www.skynews.com.au/insights-and-analysis/cuban-missile-crisis-20-ukraine-peace-talks-risk-global-conflict-10000km-away-in-repeat-of-cold-war-tensions-in-latin-america/news-story/8800761a822dc693bdb056e6b9d70c2f
Sky News,"Pauline Hanson ""self-destructs' with offensive burqa stunt that offsides quiet Australians",https://www.skynews.com.au/insights-and-analysis/pauline-hanson-selfdestructs-with-offensive-burqa-stunt-that-offsides-quiet-australians-and-undermines-one-nations-rehabilitation-efforts/news-story/73d7113eb9714fdb761a585b49aba55b
Sky News,It's time judges are held accountable for failing to lock up violent criminals,https://www.skynews.com.au/insights-and-analysis/miranda-devine-its-high-time-liberal-judges-are-held-accountable-for-failing-to-lock-up-violent-career-criminals/news-story/24898207567193f1ef0db30060060ddd
Sky News,"Progressive journalist blasted for on-air comments on National Guard shooting: ""Insane take'",https://www.skynews.com.au/world-news/united-states/ms-now-journalist-blasted-for-live-broadcast-comments-on-national-guard-shooting-insane-take/news-story/cec6435731d0a63feb0946c9f8e89a4b
Sky News,Putin persuaded Trump not to send Ukraine missiles in high-stakes call: transcript,https://www.skynews.com.au/world-news/united-states/vladimir-putin-convinced-trump-not-to-send-ukraine-tomahawks-in-call-set-in-motion-by-white-house-envoy-transcript-shows/news-story/b241228f1402afa5382e7208a65146f4
Sky News,"Trump condemns ""animal' who shot two National Guardsmen blocks from the White House",https://www.skynews.com.au/world-news/united-states/washington-dc-attack-donald-trump-condemns-animal-who-shot-two-national-guardsmen-blocks-from-white-house/news-story/74a8196f35621f4f0bc5aaf7a2cca26a
Sky News,Afghan national identified as suspect in shooting of two National Guard members near White House,https://www.skynews.com.au/world-news/united-states/two-national-guard-members-shot-in-washington-dc-near-the-white-house-one-suspect-taken-into-custody/news-story/d029f6c0205c1de6811b51e78bdf3d7d
Sky News,"Three arrested, at least 36 dead after blaze tears through Hong Kong high-rise towers",https://www.skynews.com.au/world-news/china/three-arrested-after-hong-kong-fire-leaves-at-least-36-killed-and-279-missing-as-bambooclad-buildings-burn/news-story/2be7e98ce0c88bdd7c8992ab0cf6a212
Sky News,How coach in child porn probe went from sporting scion to fugitive from justice,https://www.skynews.com.au/world-news/united-states/how-travis-turner-coach-at-centre-of-child-porn-probe-went-from-football-scion-to-fugitive-from-justice/news-story/7fd79b135f94fb4f898699ef6aa99bf2
Sky News,Death toll rises following horror Hong Kong high-rise inferno,https://www.skynews.com.au/world-news/china/labor-warned-of-need-for-247-triple-zero-watchdog-to-protect-against-system-failures-before-fatal-optus-outage/live-coverage/6513aebd552c45ed415ac7251f8ae4d4
Sky News,Coffin nightmare as Thai woman wakes up moments before cremation,https://www.skynews.com.au/world-news/global-affairs/thai-temple-staff-stunned-after-faint-knocking-comes-from-coffin-and-dead-woman-begins-moving/news-story/c094a9ceed9e3aced3ffe955c2efc510
Sky News,"Princess Kate warns smartphones are ""wrecking' parent-child bonds",https://www.skynews.com.au/opinion/princess-kate-warns-smartphones-are-wrecking-parentchild-bonds/video/e205559c3a81ba0eb44ae59dc43dfbf8
Sky News,"Princess Catherine praised for ""powerful' statement spotlighting addiction issues",https://www.skynews.com.au/opinion/princess-catherine-praised-for-powerful-statement-spotlighting-addiction-issues/video/a706ebdbf7303c6e48f363d46bab82a2
Sky News,"Harry and Meghan set to be ""left out in the cold' during Royal Family's US visit",https://www.skynews.com.au/opinion/harry-and-meghan-set-to-be-left-out-in-the-cold-during-royal-familys-us-visit/video/f3f657f115d19c9393521a52e269be04
Sky News,The Kenny Report | 26 November,https://www.skynews.com.au/stream/opinion-programs/the-kenny-report/the-kenny-report-26-november/video/040f4c0c1bfeae9c72f89c66220f2843
Sky News,Credlin | 26 November,https://www.skynews.com.au/stream/opinion-programs/credlin/credlin-26-november/video/da26f30313176526e0d2d3c0335f74cd
Sky News,The Bolt Report | 26 November,https://www.skynews.com.au/stream/opinion-programs/the-bolt-report/the-bolt-report-26-november/video/b36f2958e81c7ad5a3dec96299972f5a
Sky News,Sharri | 26 November,https://www.skynews.com.au/stream/opinion-programs/sharri/sharri-26-november/video/5968448987ea4701b6cb3a6233f5cfbc
Sky News,Paul Murray LIVE | Celebrating 15 years on air,https://www.skynews.com.au/stream/opinion-programs/paul-murray-live/paul-murray-live-celebrating-15-years-on-air/video/49169c058d9b0c7d70a33855d261ca60
Sky News,The Late Debate | 26 November,https://www.skynews.com.au/stream/opinion-programs/the-late-debate/the-late-debate-26-november/video/6cb776921d93998a1af5dc0f8b39d26f
Sky News,The Rita Panahi Show | 26 November,https://www.skynews.com.au/stream/opinion-programs/the-rita-panahi-show/the-rita-panahi-show-26-november/video/216f45edc57d818889b83362001b9840
Sky News,"""Unsustainable': Shock number of parents still financially supporting adult children",https://www.skynews.com.au/business/finance/more-than-one-in-three-parents-financially-supporting-their-adult-children-comparison-site-finder-reveals-as-cost-of-living-pressures-plague-millions-of-australians/news-story/246a5d59dfe1119b2155f782cb697515
Sky News,"""Get rates up': Major RBA call after inflation spikes",https://www.skynews.com.au/business/finance/get-rates-up-eq-economics-warren-hogan-delivers-major-interest-rate-call-after-inflation-spikes-in-year-to-october/news-story/fb6ebeb34e2becc8a85fcdf3f3a4d33e
Sky News,"Senate rejects inquiry into ABC despite broadcaster's ""very big failings'",https://www.skynews.com.au/business/media/senate-rejects-motion-for-inquiry-into-abc-after-sarah-henderson-pursues-broadcaster-over-very-big-failings/news-story/e454b9ac910f65396772e45a2f593da4
Sky News,Warning to Australia's super sector after major fund fined $23.5m,https://www.skynews.com.au/business/finance/asic-chair-joe-longo-delivers-warning-to-australias-superannuation-sector-after-cbus-fined-235m/news-story/cfac72739cf65c1aa7c5f876063ee6d7
Sky News,Labor under immense pressure over energy rebates as power prices fuel inflation,https://www.skynews.com.au/business/energy/inflation-surge-puts-albanese-government-under-immense-pressure-over-future-of-energy-subsidies/news-story/79d56dfcfafcb0c296d1d6a29d3b4ae5
Sky News,Inflation soars again in October in major blow to mortgage holders,https://www.skynews.com.au/business/finance/inflation-soars-to-38-per-cent-in-october-effectively-killing-future-interest-rate-cuts-and-exceeding-expectations/news-story/de4d3f7fed26537751e2c0c81ef216c8
Sky News,"Another Optus outage leaves more than 14,000 people without service",https://www.skynews.com.au/business/tech-and-innovation/more-than-14000-people-without-service-triplezero-calls-affected-amid-optus-outage-in-southeast-melbourne/news-story/463d09201a41191e60f0c4fff76604ae
Sky News,The Australian industries thriving despite job ads falling 2.2 per cent,https://www.skynews.com.au/business/real-estate/seek-report-reveals-the-australian-industries-thriving-despite-job-ads-falling-22-per-cent-in-12-months/news-story/c3251af63d4cf038d81fd465982f3438
Sky News,Climate chief cannot say when power prices will stop rising in tense grilling,https://www.skynews.com.au/business/energy/climate-change-authority-chair-matt-kean-unable-to-say-when-power-prices-will-stop-rising-in-tense-grilling/news-story/6b6c17155f8667e63861ee49bdaedfdb
Sky News,Queensland Year 12 student dies in horror fall at formal,https://www.skynews.com.au/lifestyle/health/horror-fall-at-queensland-school-formal-results-in-death-of-wellington-point-year-12-student/news-story/2adf7fd0e5b65326c00cb441884125da
Sky News,"Virginia Giuffre died without a will, sparking massive family legal battle",https://www.skynews.com.au/lifestyle/celebrity-life/virginia-giuffre-died-without-a-will-sparking-family-legal-battle-over-her-multimillion-dollar-estate/news-story/fc98a7cf0a69ac3988a3602920ff3dee
Sky News,"""This is an ick': AFL WAG publicly calls out husband",https://www.skynews.com.au/lifestyle/celebrity-life/this-is-an-ick-afl-wag-publicly-calls-out-husband-jack-viney-over-childish-instagram-post-of-demons-star-pedalling-cart/news-story/d349dce192f1239c59472f99425d2282
Sky News,"Judi Dench can ""no longer recognise loved ones' amid heartbreaking health battle",https://www.skynews.com.au/lifestyle/celebrity-life/i-dont-recognise-anyone-oscar-winner-judi-dench-90-shares-devastating-update-amid-rapidly-progressing-health-condition/news-story/2d503262bf715c55a95e4b7932e6d5f1
Sky News,Sunrise favourite reveals major career decision after 30 years at Seven,https://www.skynews.com.au/lifestyle/from-the-bottom-of-my-heart-sunrise-veteran-mark-beretta-59-announces-shock-retirement-after-three-decades-with-channel-seven/news-story/605187414b3dc084374464e0dfcca066
Sky News,Best travel destination for solo tourists is on Australia's doorstep,https://www.skynews.com.au/lifestyle/travel/travel-experts-reveal-the-top-10-solo-holiday-destinations-and-theyre-perfect-for-the-cashstrapped-globetrotter/news-story/a9f3ad02b7b845507f27bf9d8ad2b63b
Sky News,Aussie airlines deliver Christmas surprise with massive flight sales,https://www.skynews.com.au/lifestyle/travel/aussie-airlines-deliver-christmas-surprise-with-huge-flight-sales-from-just-49/news-story/21334e80ea049b53aaecb59a5122efb8
Sky News,"TV crew uncovers 2,000-year-old murder mystery during shoot",https://www.skynews.com.au/lifestyle/travel/tv-crew-uncovers-2000yearold-murder-mystery-during-shoot-at-ancient-british-settlement/news-story/2005b44c56047ddfec385fa1e5b2fb36
Sky News,"""Dirty deal': Labor-Greens alliance ""back in business' on final day of parliament",https://www.skynews.com.au/australia-news/politics/dirty-deal-laborgreens-alliance-back-in-business-on-final-day-of-parliament/video/621a113401ce992762bb36175e1915d0
Sky News,Victorian government to apologise to First Nations people for colonisation,https://www.skynews.com.au/australia-news/politics/victorian-government-to-apologise-to-first-nations-people-for-colonisation/video/6c438351b78f92daaff45cd33b2c57cc
