Section,Headline,Link
Sky News,Tasmanian government phasing out greyhound racing,https://www.skynews.com.au/australia-news/politics/tasmanian-government-phasing-out-greyhound-racing/video/67c8efd7b5aeeada64025fb09bd78c7a
Sky News,Western Australia to establish first standalone defence agency,https://www.skynews.com.au/australia-news/defence-and-foreign-affairs/western-australia-to-establish-first-standalone-defence-agency/video/ed7afd1b0532a6b5eaa6fc319be5bab6
Sky News,"NSW Police address media following arrest of alleged ""kill team'",https://www.skynews.com.au/australia-news/crime/nsw-police-address-media-following-arrest-of-alleged-kill-team/video/e716b6abf84acfce8061d8e7a63f0fc0
Sky News,"""Extraordinary stuff up': Optus sent outage email to wrong address",https://www.skynews.com.au/australia-news/politics/extraordinary-stuff-up-optus-sent-outage-email-to-wrong-address/video/24a630f71dd857b73ea9828cef390a08
Sky News,Melbourne's $15.5 billion Metro Tunnel to open after years of delays,https://www.skynews.com.au/australia-news/melbournes-155-billion-metro-tunnel-to-open-after-years-of-delays/video/381e898b2dc6f1a0ffdee7ecca836422
Sky News,"""It makes me sick': Littleproud condemns ""vile' pro-Palestine protests on October 7",https://www.skynews.com.au/australia-news/politics/it-makes-me-sick-littleproud-condemns-vile-propalestine-protests-on-october-7/video/80664dd55e214e3135e71dab6c962f79
Sky News,Qld Mount Isa copper smelter deal reached following month of negotiations,https://www.skynews.com.au/australia-news/politics/qld-mount-isa-copper-smelter-deal-reached-following-month-of-negotiations/video/e0464bccd6fa6dc4885cfbb97ec9a3a1
Sky News,Israel deports Australians detained on Gaza-bound aid flotilla,https://www.skynews.com.au/australia-news/israel-deports-australians-detained-on-gazabound-aid-flotilla/video/eab10771f63ea36668586fe88fe18a8a
Sky News,Today's News Headlines: Israel and Hamas engage in ceasefire talks,https://www.skynews.com.au/australia-news/todays-news-headlines-israel-and-hamas-engage-in-ceasefire-talks/video/0a57ca12d4df750abc7a7a6b03408d9b
Sky News,"NSW Police arrest alleged ""kill team'",https://www.skynews.com.au/australia-news/crime/nsw-police-arrest-alleged-kill-team/video/bd8610001489a273d76255cb0e3d7f06
Sky News,"Listen to ""Sky News Radio' on the Nova Player app",https://www.skynews.com.au/business/media/you-can-listen-to-sky-news-australia-anytime-and-on-any-platform-with-sky-news-radio-on-iheartradio/news-story/2d6aca31bc7566b5c0652db48284f5b7
Sky News,Catch up on your favourite Sky News shows with podcasts,https://www.skynews.com.au/opinion/your-favourite-sky-news-australia-shows-are-available-to-listen-to-any-time-as-podcasts/news-story/379bbe36e745709ce679d2813be0249c
