Section,Headline,Link
Guardian,Foreign hacker reportedly breached FBI servers holding Epstein files in 2023 ,https://www.theguardian.com/us-news/2026/mar/11/fbi-epstein-files-hacker-break-in
Guardian,US inflation stayed flat at 2.4% in February before effects of war on Iran kicked in,https://www.theguardian.com/business/2026/mar/11/inflation-february
Guardian,"Democrat and Republican head to Georgia runoff election for Marjorie Taylor Greene""s seat "" US politics live",https://www.theguardian.com/us-news/live/2026/mar/11/politics-georgia-election-democrats-republicans-trump-ohio
ABC,Dubai's 'tranquillity shattered' as Iran makes UAE a primary target,https://www.abc.net.au/news/2026-03-11/iran-targeting-uae-dubai-gulf-states-us-israel-war/106436816
ABC,Hundreds of millions wagered on Iran through online betting markets,https://www.abc.net.au/news/2026-03-11/iran-polymarket-anonymous-gamblers-made-millions-betting/106433384
ABC,Former spy boss resigns from antisemitism royal commission,https://www.abc.net.au/news/2026-03-11/dennis-richardson-resigns-from-antisemitism-royal-commission/106443996
ABC,"War, oil, inflation are all creating interest rate perfect storm",https://www.abc.net.au/news/2026-03-11/rba-forecast-to-hike-interest-rates-as-middle-east-war-continues/106441154
ABC,Two people arrested less than a week after hate speech laws pass parliament,https://www.abc.net.au/news/2026-03-11/qld-protesters-arrested-hate-speech-laws/106443370
ABC,What happens when online NAPLAN testing is disrupted?,https://www.abc.net.au/news/2026-03-11/naplan-disruption-delays-online-testing-for-students/106440830
ABC,Magnitude 4.4 earthquake shakes regional NSW,https://www.abc.net.au/news/2026-03-11/earthquake-hits-boorowa-nsw/106443952
ABC,More views of SA Liberal candidate emerge against Islam and 'trans agenda',https://www.abc.net.au/news/2026-03-11/sa-liberal-candidate-carston-woodhouse-islam-transgender-issues/106440958
ABC,Government doubles graduate visa fee but some countries exempt,https://www.abc.net.au/news/2026-03-11/tiered-pricing-australia-immigration-temporary-graduate-visa/106437482
ABC,Chance find reunites former cop with the protester he arrested,https://www.abc.net.au/news/2026-03-11/police-officer-and-franklin-river-protestor-reunite/106440490
ABC,"Man arrested, teen on the run after alleged four-day crime spree",https://www.abc.net.au/news/2026-03-11/mildura-teenage-crime-spree-stolen-car-melbourne/106441820
ABC,Quiz: Can you find your way around the world?,https://www.abc.net.au/news/2026-03-11/travel-quiz/106252612
ABC,Commercial rat baits to be banned from supermarket shelves,https://www.abc.net.au/news/2026-03-11/rat-bait-rodenticides-restricted-under-new-regulation/106437604
ABC,NT speaker launches extraordinary spray on NT MLA facing bullying claims,https://www.abc.net.au/news/2026-03-11/tanzil-rahman-bullying-allegations-defamatory-labor-inquiry-bid/106440652
ABC,"Triple killer lived with two foster children, minister lashes department",https://www.abc.net.au/news/2026-03-11/foster-children-were-living-with-triple-killer-regina-arthurell/106441246
ABC,Bus company linked to fatal wedding crash admits to heavy vehicle breaches,https://www.abc.net.au/news/2026-03-11/bus-company-and-directors-plead-guilty-to-safety-breaches/106440832
ABC,"Former inspector tells CFMEU inquiry she felt pressured to issue $3,600 fine",https://www.abc.net.au/news/2026-03-11/qld-cfmeu-enquiry-workplace-health-safety/106442018
ABC,Why this popular dairy product has been flying off the shelf,https://www.abc.net.au/news/2026-03-11/why-there-is-a-greek-yoghurt-shortage-in-australia/106435584
ABC,Contentious Melbourne rail project makes priority infrastructure list,https://www.abc.net.au/news/2026-03-11/suburban-rail-loop-infrastructure-australia-priority-list/106442368
ABC,"Man missing for months likely murdered in home, police say",https://www.abc.net.au/news/2026-03-11/missing-mackay-man-wayne-pedro-morseu-likely-murdered-police-say/106441612
ABC,Fine for Melbourne aged care home where 45 residents died from COVID,https://www.abc.net.au/news/2026-03-11/st-basils-aged-care-fawkner-sentenced-over-fatal-covid-breaches/106439878
ABC,Adebayo's 83 puts him above Kobe on NBA's all-time single-game scoring chart,https://www.abc.net.au/news/2026-03-11/bam-adebayo-83-points-miami-heat-kobe-bryant-wilt-chamberlain/106442074
ABC,"The Cavalry won the season, then dropped out. Now they want back in",https://www.abc.net.au/news/2026-03-09/canberra-cavalry-to-learn-what-future-holds/106424588
ABC,People doing EMDR mental health therapy warned they may lose legal justice,https://www.abc.net.au/news/2026-03-09/mental-health-emdr-therapy-may-have-cost-katie-justice/106425114
ABC,'It's about emotion': Labor minister explains how to deradicalise young boys,https://www.abc.net.au/news/2026-03-07/anne-aly-roger-cook-radicalisation-extremism-solutions-terror/106423686
ABC,Cory Bernardi stands by bestiality claim ahead of SA election,https://www.abc.net.au/news/2026-03-07/cory-bernardi-stands-by-bestiality-claim-ahead-of-sa-election/106423186
ABC,New Nationals leader Canavan vows to 'fight back' for Australians,https://www.abc.net.au/news/2026-03-11/matt-canavan-elected-nationals-leader/106440618
ABC,Two found corrupt over robodebt but Morrison cleared,https://www.abc.net.au/news/2026-03-11/anti-corruption-investigation-into-robodebt-findings/106440278
ABC,"Iranian football team member granted asylum changes mind, will return to Iran",https://www.abc.net.au/news/2026-03-11/government-confirms-seven-visas-iranian-football-team/106439840
ABC,Foreign Facebook pages have been promoting One Nation. It wants them to stop,https://www.abc.net.au/news/2026-03-11/foreign-fake-news-pauline-hanson-one-nation/106436702
ABC,"Mine-laying boats 'eliminated' near Strait of Hormuz, US says",https://www.abc.net.au/news/2026-03-11/iran-hit-with-most-intense-day-of-strikes-hegseth-says/106439622
ABC,UN determines Russian deportation of Ukrainian children are crimes against humanity,https://www.abc.net.au/news/2026-03-11/russian-deportations-ukrainian-children-crimes-against-humanity/106440160
ABC,Queen Camilla delivers message of support to survivors of all types of violence,https://www.abc.net.au/news/2026-03-11/queen-camilla-women-of-the-world-reception-at-james-palace/106440036
ABC,How petrol price panic is unfolding across Asia,https://www.abc.net.au/news/2026-03-10/petrol-prices-surge-asia-middle-east-war-iran-us-israel/106432518
ABC,ASX posts modest win as Asian markets regain ground — as it happened,https://www.abc.net.au/news/2026-03-11/asx-markets-business-live-news/106439790
ABC,Financial markets 'sleepwalking into a storm' as money trumps logic,https://www.abc.net.au/news/2026-03-11/why-financial-markets-have-thrown-logic-to-the-wind/106438760
ABC,"Lululemon fined more than $700,000 over hundreds of thousands of spam emails",https://www.abc.net.au/news/2026-03-11/lululemon-fined-acma-over-spam-breaches/106436246
ABC,"Without fuel, these rural businesses say there will be no food",https://www.abc.net.au/news/2026-03-11/fuel-shortages-hit-regional-queensland-businesses/106440262
ABC,Brisbane Roar opens doors to Iranian players granted asylum,https://www.abc.net.au/news/2026-03-11/a-league-teams-reach-out-to-iranian-players/106440390
ABC,Popovic eyes the finer details as Socceroos ramp up World Cup planning,https://www.abc.net.au/news/2026-03-11/tony-popovic-socceroos-finer-details-world-cup-prep/106439928
ABC,Gibson downs Italian world number seven to reach Indian Wells quarterfinals,https://www.abc.net.au/news/2026-03-11/tennis-indian-wells-gibson-beats-paolini-sabalenka-beats-osaka/106440550
ABC,Denny and British rival bring Ashes rivalry to discus in rare partnership,https://www.abc.net.au/news/2026-03-11/matt-denny-lawrence-okoye-discus-mates/106406604
ABC,The five practices I always return to when dealing with anxiety,https://www.abc.net.au/news/2026-03-10/five-things-i-do-when-anxiety-takes-over/106337552
ABC,Five tasty recipes that also make a great lunch the next day,https://www.abc.net.au/news/2026-03-09/tasty-lunchboxes-from-leftovers-recipes/106414678
ABC,A career break gave one woman a 'safety net' to return to her job,https://www.abc.net.au/news/2026-03-09/what-is-a-career-break-how-to-ask-for-one/106405662
ABC,Are couples happier sleeping separately?,https://www.abc.net.au/news/2026-03-08/are-couples-happier-sleeping-separately/106382482
ABC,Two new novels lift the curtain on what life is really like as a royal,https://www.abc.net.au/news/2026-03-11/heir-apparent-rebecca-armitage-royal-spin-omid-scobie/106431892
ABC,The Perth Festival shows it's well and truly back post-COVID,https://www.abc.net.au/news/2026-03-11/six-shows-we-loved-at-perth-festival/106432576
ABC,Maggie Gyllenhaal's Franken-feminist fable fumbles the plot,https://www.abc.net.au/news/2026-03-10/the-bride-movie-review-jessie-buckley/106425756
ABC,AI's assault on creatives put to the sword in new play,https://www.abc.net.au/news/2026-03-10/dragon-i-tackles-ai-theatre-perth-festival/106421822
Sky News,"""Revive our great nation': Canavan offers conservative ""cut-through' as new Nationals leader",https://www.skynews.com.au/opinion/chris-kenny/revive-our-great-nation-canavan-offers-conservative-cutthrough-as-new-nationals-leader/video/aaf7c169559ec260b703beefac0ed657
Sky News,"Matt Canavan expected to ""shake things up' after elected as National Party leader",https://www.skynews.com.au/opinion/peta-credlin/matt-canavan-expected-to-shake-things-up-after-elected-as-national-party-leader/video/2a5bc023797939d55223b922d36aa72b
Sky News,"""Someone like Hanson': Canavan is the Nationals' best hope at beating One Nation",https://www.skynews.com.au/opinion/andrew-bolt/someone-like-hanson-canavan-is-the-nationals-best-hope-at-beating-one-nation/video/705b8aa2490c3ca522db0f0da3972682
Sky News,"Australia so ""far removed' from an era of ""great leadership'",https://www.skynews.com.au/opinion/sharri-markson/australia-so-far-removed-from-an-era-of-great-leadership/video/3fbe1666f107a71eddf226f174ae1958
Sky News,Next RBA rate rise linked to domestic inflation pressures rather than Middle East conflict,https://www.skynews.com.au/opinion/paul-murray/next-rba-rate-rise-linked-to-domestic-inflation-pressures-rather-than-middle-east-conflict/video/a85f7845d5accb6876ed0809d7d2e912
Sky News,Ali Khamenei reportedly urged in his will not to elect his son as supreme leader,https://www.skynews.com.au/opinion/ali-khamenei-reportedly-urged-in-his-will-not-to-elect-his-son-as-supreme-leader/video/52d57ac9d03e61abd7d275f46c439177
Sky News,Watch: John Howard's powerful legacy explored in new documentary,https://www.skynews.com.au/australia-news/politics/how-to-watch-chris-uhlmann-presents-powerful-documentary-john-howard-a-life-in-politics/news-story/5aeb82e49eb1255248aff7b1e8042493
Sky News,Former ASIO head Dennis Richardson quits Bondi Royal Commission,https://www.skynews.com.au/australia-news/politics/former-asio-head-dennis-richardson-quits-royal-commission-into-bondi-terror-attack-after-less-than-three-months/news-story/3e54911faf2c88d33268c97736cf9852
Sky News,"""Answer the question': Chris Bowen's wild fuel claim exposed as farmers hit back",https://www.skynews.com.au/australia-news/politics/energy-minister-chris-bowen-doubles-down-on-wild-claim-as-farmers-warn-diesel-orders-have-dried-up/news-story/758783317c554ebf8e452a8e6997dc16
Sky News,US destroys Iranian navy vessels ' including 16 minelayers ' near Strait of Hormuz,https://www.skynews.com.au/world-news/global-affairs/us-destroys-iranian-navy-vessels-including-16-minelayers-near-strait-of-hormuz/news-story/bd418794f83eb4e297a1f97b28eca732
Sky News,Clive Palmer announces shock return to politics,https://www.skynews.com.au/australia-news/politics/clive-palmer-will-run-for-parliament-under-united-australia-banner-at-next-election-in-queensland-seat-of-fadden/news-story/8b19ad139ced59e90244bc43e1ceebaf
Sky News,Karl Stefanovic's bizarre hotel request while in London,https://www.skynews.com.au/lifestyle/celebrity-life/today-host-karl-stefanovic-raises-eyebrows-with-bizarre-hotel-request-as-he-prepares-to-record-eponymous-podcast-in-london/news-story/bc0aed877dcb2b7dc632f6ac82b43a79
Sky News,"""Trained him well': Barnaby Joyce says Canavan closer to One Nation than Liberals",https://www.skynews.com.au/australia-news/politics/trained-him-well-barnaby-joyce-says-new-nationals-leader-matt-canavan-closer-to-one-nation-than-liberals/news-story/4a3cecd1b4e8f15189b62647041ecf2d
Sky News,"Labor slammed for trying to ""gaslight' Victorians over crime crisis",https://www.skynews.com.au/australia-news/politics/labor-slammed-for-trying-to-gaslight-victorians-after-minister-claims-victoria-police-well-resourced-to-handle-crime-crisis/news-story/33b6bea055b9f7c05135903f8cd68e4b
Sky News,ALDI $29.99 product wins BEST in the world,https://www.skynews.com.au/australia-news/aldi-2999-product-takes-home-gold-in-worldwide-competition/news-story/5528c675c4466dd67727166ecb07928e
Sky News,Beloved biscuit flavour returns to supermarket shelves,https://www.skynews.com.au/lifestyle/beloved-ritz-in-a-biskit-revives-cultfavourite-crispy-potato-flavour/news-story/b377314a8bbc609d688dca6956870b63
Sky News,"""Recipe for disaster': Renter reveals dangerous detail landlord refuses to fix",https://www.skynews.com.au/lifestyle/trending/tenant-exposes-staircase-with-drop-onto-fireplace-claiming-landlord-refuses-to-fix-dangerous-design/news-story/73c4275f3a11c2aab3afee494b97a3b1
Sky News,"""Something to hide': Cruise ship clash erupts after officials blocked from boarding in Sydney",https://www.skynews.com.au/australia-news/union-accuses-carnival-of-breaching-laws-as-inspectors-turned-away-at-circular-quay/news-story/bc560fe0c259aaa28200547853f443cb
Sky News,"Major retailer set to create 3,000 Aussie jobs with $750m investment",https://www.skynews.com.au/australia-news/amazon-invests-750m-in-warehouse-the-size-of-20-footy-fields-creating-3000-jobs-for-queenslanders/news-story/7923ac32e11323c782115722c657f116
Sky News,"Beloved activewear brand fined more than $700,000 for spamming customers",https://www.skynews.com.au/business/finance/beloved-activewear-brand-lululemon-fined-700000-after-acma-investigation-found-it-was-spamming-customers/news-story/53f22b6e3b25d45ec20ed2add209cbf6
Sky News,Massive update in search for missing Gus Lamont as police return to key location,https://www.skynews.com.au/australia-news/crime/big-update-in-search-for-missing-south-australian-boy-gus-lamont-as-police-return-to-key-location/news-story/61431dc15f2ed0e9cba86c5ba20a4040
Sky News,The PM's Iran claim that will raise alarm bells in Washington over core AUKUS detail,https://www.skynews.com.au/insights-and-analysis/pms-iran-claim-sure-to-raise-eyebrows-in-washington-as-labor-equivocates-endlessly-on-the-crisis-in-the-middle-east/news-story/f8554573352d43420a5115e5eff48e34
Sky News,Chris Uhlmann looks back on Howard govt after 30-year anniversary of first election win,https://www.skynews.com.au/insights-and-analysis/chris-uhlmann-looks-back-on-the-howard-government-30-years-after-its-first-election-ahead-of-new-sky-news-documentary/news-story/d108595758c21202f35583c6c830d813
Sky News,Inside the worst-case scenario for Australia's economy as Middle East conflict wreaks financial havoc,https://www.skynews.com.au/insights-and-analysis/inside-the-worstcase-scenario-for-australia-as-middle-east-conflict-causes-global-financial-chaos/news-story/22b7ced6e7645cbd9080bccdf61f15ce
Sky News,Hilary Duff speaks on devastating rift with sister Haylie,https://www.skynews.com.au/lifestyle/what-went-wrong-with-hilary-and-haylie-duff-the-rift-that-tore-the-family-apart/news-story/993f442a9d902c92ee32602c42553739
Sky News,US destroys Iranian navy vessels ' including 16 minelayers ' near Strait of Hormuz,https://www.skynews.com.au/world-news/global-affairs/us-destroys-iranian-navy-vessels-including-16-minelayers-near-strait-of-hormuz/news-story/bd418794f83eb4e297a1f97b28eca732
Sky News,Lead investigator in Guthrie case forced to resign in first policing job over laundry list of infractions,https://www.skynews.com.au/world-news/united-states/lead-investigator-in-nancy-guthrie-case-sheriff-chris-nanos-was-forced-to-resign-from-first-policing-job-over-laundry-list-of-infractions/news-story/ba2ea2b0b8e9f70be64084f7e1f5ee16
Sky News,"Russia desperately wipes video showing Putin cough, struggle for breath amid ongoing health rumours",https://www.skynews.com.au/world-news/global-affairs/russia-desperately-wipes-video-showing-putin-cough-struggle-for-breath-amid-rumoured-ongoing-health-woes/news-story/9a8dc074e9a88513435ba9a937540774
Sky News,Why isn't motormouth Megan Rapinoe using her megaphone for Iran's female soccer team?,https://www.skynews.com.au/world-news/global-affairs/why-isnt-motormouth-megan-rapinoe-using-her-megaphone-for-irans-female-soccer-team/news-story/6a61c696d2ded52fa920300d074489aa
Sky News,Why the Iran war may come down to the control of one tiny island,https://www.skynews.com.au/world-news/global-affairs/the-iran-war-may-come-down-to-the-control-of-one-tiny-island-which-handles-90-per-cent-of-the-countrys-crude-oil-exports/news-story/708bdf76822fbbedd7e5c83884a2a0a4
Sky News,"Girl, 12, dies after savage fight with fellow student at school bus stop",https://www.skynews.com.au/world-news/united-states/girl-12-dies-after-savage-fight-with-fellow-student-at-georgia-school-bus-stop/news-story/8ca0e0f891b9ba6f4d5899a56da05eb5
Sky News,"Iran preparing to lay mines in Strait of Hormuz, reports say",https://www.skynews.com.au/world-news/global-affairs/iran-preparing-to-lay-mines-in-strait-of-hormuz-reports-say/news-story/ec9847884821ff9b59b413a2e70a6c2d
Sky News,"""Can't even defend themselves': UK-US relationship could be in jeopardy",https://www.skynews.com.au/opinion/cant-even-defend-themselves-ukus-relationship-could-be-in-jeopardy/video/4a6db3df1830cec5f56303a235d8fa96
Sky News,"Children's drawings labelled ""potentially blasphemous' in new UK schooling guidelines",https://www.skynews.com.au/opinion/childrens-drawings-labelled-potentially-blasphemous-in-new-uk-schooling-guidelines/video/c8f0f6b2322dc0049b6ed1152f504fd5
Sky News,"AFL planning to overhaul illicit drug policy after complaints current system is ""too laxed'",https://www.skynews.com.au/opinion/afl-planning-to-overhaul-illicit-drug-policy-after-complaints-current-system-is-too-laxed/video/11d4f6550d4cc803a050ae228c6895c6
Sky News,The Kenny Report | 11 March,https://www.skynews.com.au/stream/opinion-programs/the-kenny-report/the-kenny-report-11-march/video/bb527f6dd4ac3c4ad23414c75867f615
Sky News,Credlin | 11 March,https://www.skynews.com.au/stream/opinion-programs/credlin/credlin-11-march/video/8b9e2fb2ec374d67651f4a1f71bd59ef
Sky News,The Bolt Report | 11 March,https://www.skynews.com.au/stream/opinion-programs/the-bolt-report/the-bolt-report-11-march/video/f34a4c1ad8e34934ded93b1548a04713
Sky News,Sharri | 11 March,https://www.skynews.com.au/stream/opinion-programs/sharri/sharri-11-march/video/539bbab9640956256c4d3c00a58099a8
Sky News,Paul Murray Live | 11 March,https://www.skynews.com.au/stream/opinion-programs/paul-murray-live/paul-murray-live-11-march/video/372a128868dac26d8da92a3404266e01
Sky News,The Late Debate | 10 March,https://www.skynews.com.au/stream/opinion-programs/the-late-debate/the-late-debate-10-march/video/0ac251701c537cf84ad743f8b3f2e318
Sky News,The Rita Panahi Show | 11 March,https://www.skynews.com.au/stream/opinion-programs/the-rita-panahi-show/the-rita-panahi-show-11-march/video/d3c4a4a6003e6f17e6775bfa29c66edb
Sky News,The cutting-edge new tech that's changing the way Australian retailers do business,https://www.skynews.com.au/business/tech-and-innovation/zebra-technologies-launches-aipowered-technology-to-help-retailers-build-intelligent-operations/news-story/e558ac1bb1629d2797200d8a3164fea0
Sky News,"Beloved activewear brand fined more than $700,000 for spamming customers",https://www.skynews.com.au/business/finance/beloved-activewear-brand-lululemon-fined-700000-after-acma-investigation-found-it-was-spamming-customers/news-story/53f22b6e3b25d45ec20ed2add209cbf6
Sky News,"Thousands have lost their super savings without knowing, leading investor warns",https://www.skynews.com.au/business/finance/about-10000-australians-have-lost-their-super-savings-without-knowing-barefoot-investor-scott-pape-warns/news-story/91c62578ab3b114a03c79c5c14631eb2
Sky News,"Veteran journalist blasts ""desperately exposed' Labor over energy crisis",https://www.skynews.com.au/business/energy/albanese-government-desperately-exposed-on-energy-as-nationals-urged-to-target-labor-over-fuel-security/news-story/3bc5a21323a9bd27b1f77207ab69ee1f
Sky News,Disney star stands by divisive posts despite $170 million box office loss,https://www.skynews.com.au/business/media/disney-star-rachel-zegler-refuses-to-assimilate-after-snow-white-backlash/news-story/e1435e4b8e6c512710d12daab3c6790a
Sky News,Major warning as more mortgage pain could be delivered next week,https://www.skynews.com.au/business/finance/economists-money-markets-now-pricing-in-an-interest-rate-hike-next-week-as-soaring-oil-costs-weigh-on-inflation/news-story/9f5b77e9c9b3383b1744880daac5e769
Sky News,When Australians can expect fuel price pain to end,https://www.skynews.com.au/business/energy/security-expert-reveals-when-australians-can-expect-fuel-price-pain-to-end-as-oil-supply-remains-constrained/news-story/d06f7d928693bfff7943415b0e943a71
Sky News,"""Get on with it': Demand on the RBA ahead of next week's rates call",https://www.skynews.com.au/business/finance/just-get-on-with-it-major-demand-on-the-reserve-bank-of-australia-ahead-of-next-weeks-interest-rates-call/news-story/2af39dc1e994461cd71a2962e04dee55
Sky News,Warning inflation could lift to three-year high as fuel prices soar,https://www.skynews.com.au/business/finance/inflation-could-lift-above-five-per-cent-as-fuel-prices-soar-due-to-middle-east-conflict-westpacs-pat-bustamante-warns/news-story/07dcbb759b3e0a685efe422a2e981739
Sky News,"""Recipe for disaster': Renter reveals dangerous detail landlord refuses to fix",https://www.skynews.com.au/lifestyle/trending/tenant-exposes-staircase-with-drop-onto-fireplace-claiming-landlord-refuses-to-fix-dangerous-design/news-story/73c4275f3a11c2aab3afee494b97a3b1
Sky News,Karl Stefanovic's bizarre hotel request while in London,https://www.skynews.com.au/lifestyle/celebrity-life/today-host-karl-stefanovic-raises-eyebrows-with-bizarre-hotel-request-as-he-prepares-to-record-eponymous-podcast-in-london/news-story/bc0aed877dcb2b7dc632f6ac82b43a79
Sky News,Traveller shocked to see pilot doing this when she looked into the cockpit,https://www.skynews.com.au/lifestyle/trending/traveller-headiing-to-the-maldives-shocked-to-see-pilot-doing-this-when-she-looked-into-the-cockpit/news-story/6db470553a6539722707c653b3032904
Sky News,"""Cooked': Ben Fordham's brutal take on radio rival Kyle Sandilands",https://www.skynews.com.au/lifestyle/celebrity-life/cooked-ben-fordhams-brutal-take-on-radio-rivals-kyle-sandilands-and-jackie-o-hendersons-future-with-arn/news-story/d0194d03e3919282a6ffe4771939e878
Sky News,Meghan's pal gives major three-word update on Will and Harry's relationship,https://www.skynews.com.au/lifestyle/celebrity-life/none-of-them-have-been-met-meghan-markles-mouthpiece-omid-scobie-gives-stark-threeword-update-on-prince-william-and-prince-harrys-longrunning-rift/news-story/4f402b10517f13a2e96e61f35c6a116b
Sky News,"Samurai swords, meteorite among bizarre items left behind by travellers: report",https://www.skynews.com.au/lifestyle/travel/samurai-swords-wwii-flight-jacket-meteorite-among-items-left-behind-by-travelers-unclaimed-baggage-report/news-story/38527df5de4fa68fdac8669aa56984f4
Sky News,"Ancient Jesus-era footprints discovered on Scotland beach, triggering remarkable race",https://www.skynews.com.au/lifestyle/travel/dog-walkers-trigger-archaeological-race-to-preserve-2000yearold-footprints-in-shifting-sands/news-story/7ddf8e03aa5df8e872842340de82132f
Sky News,"Sydney surf spot among most ""relaxing' beaches in the world ' and it's not Bondi",https://www.skynews.com.au/lifestyle/travel/revealed-the-popular-surf-spot-in-sydneys-north-lauded-as-one-of-the-most-relaxing-beaches-in-the-world-and-its-not-bondi/news-story/3fee1e8de43a19599a03d96419d7cb65
Sky News,Today's News Headlines: The cost of oil has risen again,https://www.skynews.com.au/australia-news/todays-news-headlines-the-cost-of-oil-has-risen-again/video/9d60e590f6afb454c3d22fefcd0fcd38
Sky News,"""We've been preparing for this': Bundaberg flooding impacting community and businesses",https://www.skynews.com.au/australia-news/weather/weve-been-preparing-for-this-bundaberg-flooding-impacting-community-and-businesses/video/2db04d50b6665e2459a6c9c1a4db4755
Sky News,"""They will deal with it': Bowen announces ACCC penalties to increase as fuel supply chain strains",https://www.skynews.com.au/australia-news/politics/they-will-deal-with-it-bowen-announces-accc-penalties-to-increase-as-fuel-supply-chain-strains/video/d23c20f557821635ebd59203c7746b25
Sky News,Iranian footballer reverses visa choice,https://www.skynews.com.au/australia-news/politics/iranian-footballer-reverses-visa-choice/video/e96b2571e749f156f387a6d4796b8133
Sky News,"""Will you apologise?': Tim Wilson blasts Chalmers as NAB predicts 14th rate rise",https://www.skynews.com.au/australia-news/politics/will-you-apologise-tim-wilson-blasts-chalmers-as-nab-predicts-14th-rate-rise/video/ad1d1d869de38b4f2091ff2101a60043
Sky News,"Australia's fuel supply remains ""secure' as Iran conflict continues",https://www.skynews.com.au/australia-news/politics/australias-fuel-supply-remains-secure-as-iran-conflict-continues/video/81643ace939d60baaa498fc36294afd2
