Section,Headline,Link
ABC,Disgraced former NSW MP jailed for sexually abusing two young men,https://www.abc.net.au/news/2025-10-31/gareth-ward-ex-nsw-liberal-minister-jailed-sexual-abuse/105948558
ABC,Lightning strike kills talented sportswoman on soccer field,https://www.abc.net.au/news/2025-10-31/lightning-strike-fatal-sporting-complex-cooroy/105955574
ABC,'Race to the bottom': Democrats gerrymander as US democracy strains,https://www.abc.net.au/news/2025-10-31/california-gerrymandering-election-map-november-4/105944438
ABC,'It's gotten out of hand': Wind farmers fear threat to turn to violence,https://www.abc.net.au/news/2025-10-31/anti-renewables-campaigns-fuel-community-division-in-regions/105938440
ABC,Calls for mandatory protection in cricket after tragic Melbourne death,https://www.abc.net.au/news/2025-10-31/cricket-safety-neck-head-helmet-ben-austin/105954522
ABC,'We are against its mere existence': Ultra-orthodox Israelis reject country and army service,https://www.abc.net.au/news/2025-10-31/ultra-orthodox-israelis-protest-against-military-draft-jerusalem/105954936
ABC,Albanese government 'leans into a culture of secrecy',https://www.abc.net.au/news/2025-10-31/labor-transparency-david-pocock-jobs-for-mates/105938080
ABC,UK's rival to the Tim Tam can no longer be called chocolate,https://www.abc.net.au/news/2025-10-31/tim-tams-vs-penguins-cocoa-price-challenges/105931332
ABC,Pocock issues threat to Labor on Senate games,https://www.abc.net.au/news/2025-10-31/federal-politics-live-blog-oct-31/105953464
ABC,Woman charged with murder of eight-month-old baby in Perth's south,https://www.abc.net.au/news/2025-10-31/woman-charged-with-murder-of-baby-in-baldivis-in-southern-perth/105956052
ABC,Commissioner to hear submissions on why Snowtown killer should not get parole,https://www.abc.net.au/news/2025-10-31/review-commissioner-to-hear-submissions-on-vlassakis-parole/105956792
ABC,"Weekly news quiz: History exams, an unusual gift and the 'storm of the century'",https://www.abc.net.au/news/2025-10-31/weekly-news-quiz-october-31/105951152
ABC,ASX on the rise but ANZ shares fall on profit hit,https://www.abc.net.au/news/2025-10-31/asx-markets-business-live-news-31-oct/105955602
ABC,'Fireball' and 'panic' as WWII bomb explodes in Solomon Islands capital,https://www.abc.net.au/news/2025-10-31/solomon-islands-explosion-capital-second-world-war-bomb/105955910
ABC,Gen Alpha's viral 'six-seven' named word of the year,https://www.abc.net.au/news/2025-10-31/dictorary-dot-com-word-of-the-year-is-67/105955222
ABC,Australian-first treaty legislation passes in Victorian parliament,https://www.abc.net.au/news/2025-10-31/victorian-first-nations-treaty-legislation-passes/105954864
ABC,The quiet movement removing barbed wire fences to save wildlife,https://www.abc.net.au/news/2025-10-31/man-removes-18km-of-barbed-wire-fencing-to-help-wildlife/105890356
ABC,How a yacht salvage team raced against the clock to protect pristine island reef,https://www.abc.net.au/news/2025-10-31/yacht-salvage-team-protects-lady-elliot-island-reef/105952960
ABC,Melbourne woman Isla Bell's alleged murderer committed to stand trial,https://www.abc.net.au/news/2025-10-31/isla-bell-alleged-murderer-marat-ganiev-to-stand-trial/105955932
ABC,Aldi shoppers report 'ripper' static shocks at supermarket,https://www.abc.net.au/news/2025-10-31/aldi-investigates-static-shocks-nambour-store/105942226
ABC,The 10 albums our critics couldn't stop listening to in October,https://www.abc.net.au/news/2025-10-31/10-best-albums-october-lily-allen-tame-impala-dave-baker-boy/105952214
ABC,"Darling Downs 'inundated' with reports of snakes, bites and near misses",https://www.abc.net.au/news/2025-10-31/snakes-becoming-more-prevalent-on-the-darling-downs/105953444
ABC,Jillaroos dealt massive injury blow ahead of Kiwi Ferns Test,https://www.abc.net.au/news/2025-10-31/pacific-championships-australia-jillaroos-new-zealand-kiwi-ferns/105956360
ABC,Canberra is a step closer to getting its first dementia care village,https://www.abc.net.au/news/2025-10-31/canberra-dementia-care-village-on-site-of-sold-school/105942542
ABC,Remote Aboriginal community returning to licensed liquor after 30 years,https://www.abc.net.au/news/2025-10-30/nt-wadeye-alcohol-sales-social-club-returns-dry-community/105943922
ABC,Burn or bury? Gold Coast weighs $1.6 billion plan to deal with rubbish,https://www.abc.net.au/news/2025-10-30/waste-to-energy-plan-gold-coast-landfill-solution/105869872
ABC,Cattle station owners face charges over alleged illegal dams,https://www.abc.net.au/news/2025-10-30/sa-anna-creek-station-illegal-dams-charge/105947060
ABC,Court documents reveal Nampijinpa Price rejected settlement offer,https://www.abc.net.au/news/2025-10-30/nt-jacinta-nampijinpa-price-60000-defamation-settlement-offer/105952936
ABC,Barnaby Joyce denies allegation he yelled at staffer,https://www.abc.net.au/news/2025-10-30/barnaby-joyce-denies-yelling-allegation/105952654
ABC,"Coalition split but this time it's over a T-shirt, not net zero",https://www.abc.net.au/news/2025-10-30/coalition-split-albanese-tshirt-labor-transparency/105938072
ABC,Albanese confident on AUKUS despite Trump's Korean subs promise,https://www.abc.net.au/news/2025-10-30/albanese-confident-on-aukus-despite-us-korean-subs/105952342
ABC,Why Chinese Australian women should get checked for breast cancer earlier,https://www.abc.net.au/news/2025-10-31/chinese-women-get-breast-cancer-younger-than-in-the-west/105927052
ABC,US politicians call for Trump to act on 'unspeakable atrocities' in Sudan,https://www.abc.net.au/news/2025-10-31/sudan-violence-calls-for-trump-to-act/105955336
ABC,"Trump sets US refugee cap at 7,500, white South Africans given priority",https://www.abc.net.au/news/2025-10-31/donald-trump-asylum-cap-white-south-africans-priority/105955480
ABC,Dutch centrists 'confident' as far-right party suffers setback in election,https://www.abc.net.au/news/2025-10-31/dutch-election-results-d66-pvv/105955042
ABC,'Blood on the floor': How James Hardie's board came undone,https://www.abc.net.au/news/2025-10-30/why-the-james-hardie-board-was-gutted/105954054
ABC,'An amazing meeting': What you may have missed from the Xi-Trump sit-down,https://www.abc.net.au/news/2025-10-30/key-takeaways-from-october-trump-and-xi-meeting/105952166
ABC,"Borrowers can expect one more rate cut, if they're lucky, bank economists predict",https://www.abc.net.au/news/2025-10-30/big-four-banks-expect-no-cash-rate-cut-in-november/105948378
ABC,Winery becomes Australia's largest to go off the grid,https://www.abc.net.au/news/2025-10-30/mudgee-off-electricity-grid-winery-lowe-wines/105941576
ABC,The invisible opponent Katherine Smith played AFLW against for years,https://www.abc.net.au/news/2025-10-31/endometriosis-elite-athlete-katherine-smith-aflw-gws-giants/105952810
ABC,Wallabies forced to play by World Rugby's rules in England Test,https://www.abc.net.au/news/2025-10-31/rugby-union-australia-wallabies-england-twickenham-test/105955734
ABC,Australia out of World Cup as India completes miracle run chase,https://www.abc.net.au/news/2025-10-30/australia-vs-india-womens-odi-world-cup-semifinal-live-blog/105954326
ABC,"SA runner to join NRL, AFL greats at New York Marathon",https://www.abc.net.au/news/2025-10-31/indigenous-marathon-foundation-squad-prepare-for-new-york/105950978
ABC,Is the Victoria's Secret catwalk a 'lone gesture'?,https://www.abc.net.au/news/2025-10-30/victorias-secret-show-body-inclusivity-positivity/105946528
ABC,Aussie artists on what it's like to share a break-up with the world,https://www.abc.net.au/news/2025-10-29/lily-allen-west-end-girl-artists-on-their-own-breakup-songs/105942042
ABC,What loving someone with an addiction or dependence can look like,https://www.abc.net.au/news/2025-10-28/loving-someone-with-an-addiction-or-dependence/105921866
ABC,We are socialising less and loneliness is rising. Here is what can help,https://www.abc.net.au/news/2025-10-27/decline-in-socialising-rates-impacting-our-wellbeing/105865064
ABC,Historic hall's $20m modern makeover slammed as 'not fit for purpose',https://www.abc.net.au/news/2025-10-31/questions-over-20m-reno-to-launceston-albert-hall/105953582
ABC,"Phar Lap turns 100 in 2026. This year, two musicals inspired by him debut",https://www.abc.net.au/news/2025-10-30/phar-lap-the-electro-swing-musical-wonder-horse-life-afterlife/105922314
ABC,Drake appeals defamation loss over Kendrick Lamar's Not Like Us,https://www.abc.net.au/news/2025-10-30/drake-appeals-defamation-loss-over-kendrick-lamar-not-like-us/105950556
ABC,From Yothu Yindi to Iron & Wine — WOMADelaide's line-up is here,https://www.abc.net.au/news/2025-10-30/womadelaide-line-up-2026-adelaide-yothu-yindi-obongjayar/105948966
Sky News,"""Be very afraid': Jim Chalmers looking to treat super as their ""investment slush fund'",https://www.skynews.com.au/opinion/chris-kenny/be-very-afraid-jim-chalmers-looking-to-treat-super-as-their-investment-slush-fund/video/fedf15a073da9f260c68eeca69f2adfa
Sky News,"""Wrong in every aspect': Indigenous patients at St Vincent's set to be ""assigned as urgent'",https://www.skynews.com.au/opinion/peta-credlin/wrong-in-every-aspect-indigenous-patients-at-st-vincents-set-to-be-assigned-as-urgent/video/2a4db6b4cfa7f987ef6ccd7174472816
Sky News,"""I fear for the future': Trump signed his surrender to China",https://www.skynews.com.au/opinion/andrew-bolt/i-fear-for-the-future-trump-signed-his-surrender-to-china/video/2d4c22c8287a357a34138e402371d6a7
Sky News,"""Not coincidental': Trump's nuclear testing bombshell seen as power message to China",https://www.skynews.com.au/opinion/sharri-markson/not-coincidental-trumps-nuclear-testing-bombshell-seen-as-power-message-to-china/video/d9cff2709f311afb09795bbd57e36bc7
Sky News,Victorian parliament passes Indigenous treaty,https://www.skynews.com.au/opinion/paul-murray/victorian-parliament-passes-indigenous-treaty/video/95a955c9a554e1203693f4ceb2a1078b
Sky News,"""Delusional and crazy' CNN host claims Trump is building ballroom to stay in office forever",https://www.skynews.com.au/opinion/rita-panahi/delusional-and-crazy-cnn-host-claims-trump-is-building-ballroom-to-stay-in-office-forever/video/e060b85f659ecaaf162247b0af67b4e6
Sky News,"""Bring the state to a standstill': Grim warning over Victoria's new Indigenous treaty",https://www.skynews.com.au/australia-news/politics/bring-the-state-to-a-standstill-victorians-warned-of-sweeping-powers-given-to-states-newly-passed-indigenous-treaty-body/news-story/c1d5eafe02fb4227b7963f3aaa598628
Sky News,Beatrice and Eugenie's royal future revealed as Andrew stripped of titles,https://www.skynews.com.au/lifestyle/celebrity-life/princesses-beatrice-and-eugenie-to-retain-royal-titles-despite-their-parents-downfall-with-king-charles-iii-reportedly-very-keen-to-protect-them/news-story/2f741fbd8186f9bb6f500a1d376994b5
Sky News,"Andrew loses prince title and booted from royal residence, Buckingham Palace confirms",https://www.skynews.com.au/lifestyle/celebrity-life/andrew-mountbatten-windsor-loses-prince-title-and-kicked-out-of-royal-lodge-amid-epstein-fallout-buckingham-palace-confirms/news-story/897dd5b7ead052f6b695455eeb4d7857
Sky News,"""500 kids': Aussie man's Halloween decorations turn neighbours' lives into a nightmare",https://www.skynews.com.au/lifestyle/trending/500-kids-how-aussie-mans-halloween-decorations-are-turning-his-neighbours-lives-into-a-nightmare/news-story/189cf46aebc3c20fe30de2db0f6223f5
Sky News,"Police drain dam ""out of an abundance of caution' in search for missing four-year-old",https://www.skynews.com.au/australia-news/search-for-missing-fouryearold-boy-from-south-australia-gus-lamont-begins-in-large-dam-on-familys-property/news-story/53728ee3344522318119b9f17c50e45a
Sky News,"""Hurting the country': Taylor tears into British billionaire who sacked hundreds of Aussies",https://www.skynews.com.au/australia-news/politics/british-billionaire-sanjeev-gupta-hurting-the-country-by-keeping-tahmoor-coal-mine-closed-sacking-hundreds-of-workers-liberal-mp-angus-taylor-declares/news-story/5331efd5f2a3583f3558b0935b4b9705
Sky News,"Sussan Ley takes aim at Albanese over Tomago aluminium smelter's ""uncertain future'",https://www.skynews.com.au/australia-news/politics/victorian-treaty-passes-parliament-as-documents-reveal-millions-spent-on-body-which-oversaw-negotiations/live-coverage/4355b5254e013d3ef70aa988205ee4b7
Sky News,"""Door open for Barnaby': Nationals Senate leader says net zero change could decide Joyce's future",https://www.skynews.com.au/australia-news/politics/bridget-mckenzie-signals-rethink-on-coalition-climate-policy-as-nationals-prepare-to-debate-net-zero/news-story/abf22ea685e18ed4fbf9ae2e0612e437
Sky News,Heartbreaking detail on car windscreen exposes Melbourne's cruelty to homeless,https://www.skynews.com.au/lifestyle/trending/all-i-have-read-the-heartbreaking-note-on-homeless-mans-windshield-exposing-major-problem-faced-by-melbournes-persistent-rough-sleepers/news-story/fe1c14e158d9baabc809f1a8ee66407f
Sky News,"""Times have changed': Morrison backs nuclear in net zero pitch to Coalition",https://www.skynews.com.au/australia-news/politics/times-have-changed-former-prime-minister-scott-morrison-backs-nuclear-power-warns-2050-net-zero-goal-out-of-reach/news-story/15bf021f9515ccc1e5837e940fa20a2e
Sky News,Lightning strike kills 21-year-old woman,https://www.skynews.com.au/australia-news/horrifically-loud-lightning-strike-kills-young-woman-on-a-sunshine-coast-sports-field/news-story/c68b04b4895132b7832d6043a0cd7301
Sky News,Hamas' wild attempt to overturn Australia's terror listing,https://www.skynews.com.au/australia-news/politics/hamas-makes-wild-bid-to-have-australia-remove-the-palestinian-militant-group-from-its-terror-list-claims-designation-unlawful/news-story/9534875335b81b6c8e582183533e85e8
Sky News,"""I cried every day': ""Innings of a lifetime' sees India defeat error-ridden Australia",https://www.skynews.com.au/australia-news/sport/i-cried-every-day-innings-of-a-lifetime-sees-india-defeat-errorridden-australia-in-womens-odi-world-cup-semifinal/news-story/a7c425b9aac798f59aace86764b7d26c
Sky News,Young Aussie's finances go viral after admitting to spending $994 a month on eating out,https://www.skynews.com.au/lifestyle/trending/sabotaging-your-future-young-aussies-finances-go-viral-after-admitting-to-spending-994-a-month-on-eating-out/news-story/b164eb7b204e815f43cb741a3d436ce2
Sky News,"""Bring the state to a standstill': Grim warning over Victoria's new Indigenous treaty",https://www.skynews.com.au/australia-news/politics/bring-the-state-to-a-standstill-victorians-warned-of-sweeping-powers-given-to-states-newly-passed-indigenous-treaty-body/news-story/c1d5eafe02fb4227b7963f3aaa598628
Sky News,Bureaucracies of virtue: Why the Victoria Treaty Bill risks repeating NZ's mistakes,https://www.skynews.com.au/insights-and-analysis/a-bureaucracy-of-virtue-victorian-treaty-bill-risks-repeating-new-zealands-mistakes-by-miring-state-in-a-labyrinth-of-costly-paperwork/news-story/9847319ddfe2f680be15fb8782984cc0
Sky News,"Why an immigration halt could give Australia ""fresh bargaining power' over China",https://www.skynews.com.au/insights-and-analysis/coveted-place-to-live-immigration-pause-still-one-of-canberras-sharpest-levers-to-wield-over-china-as-xitrump-chess-game-unfolds/news-story/99b4e3e3ba33eddddc5460e3bb9ec74f
Sky News,The cutting-edge technology set to transform Australia's housing sector,https://www.skynews.com.au/insights-and-analysis/green-steel-can-slash-housing-costs-by-unlocking-faster-construction-at-scale-as-well-as-reduce-australias-carbon-bill/news-story/8a6822e2510efd76fa2a2eb01186eef6
Sky News,Squatting nanny makes couple's lavish $1.5 million farmhouse a living hell: report,https://www.skynews.com.au/world-news/united-states/squatting-nanny-makes-couples-lavish-15-million-upstate-new-york-farmhouse-a-living-hell-report/news-story/1baa66014d3dec14b861624eb15757d9
Sky News,"Grandfather ""stabbed to death with screwdriver by nanny, who fled naked, covered in blood'",https://www.skynews.com.au/world-news/united-states/grandfather-83-stabbed-to-death-with-screwdriver-by-granddaughters-nanny-who-fled-naked-covered-in-blood-cops/news-story/f57fcebfad657402713fb5c1d58e1128
Sky News,Downer: Trump'Xi meeting signals easing tensions and reset on strained relations,https://www.skynews.com.au/australia-news/politics/a-cordial-and-quite-successful-meeting-former-foreign-minister-praises-trumps-breakthrough-talks-with-china/news-story/818f04b21cd906ecca9fd42927dc5434
Sky News,"Donald Trump announces US will ""immediately' begin nuclear weapons testing",https://www.skynews.com.au/world-news/united-states/us-president-donald-trump-announces-us-to-immediately-begin-process-of-nuclear-weapons-testing/news-story/c74de55dba8f550f46affd1961f3d519
Sky News,"""We have a deal': Trump-Xi reach major trade deal in South Korea",https://www.skynews.com.au/world-news/united-states/very-successful-meeting-us-president-donald-trump-and-chinese-president-xi-jinping-sit-down-for-trade-negotiations/news-story/d3507023368c690ed1c7dc9c636d33eb
Sky News,"""Be more specific': Kamala Harris snaps at ABC's Sarah Ferguson in trainwreck interview",https://www.skynews.com.au/world-news/united-states/kamala-harris-and-abcs-sarah-ferguson-clash-over-question-about-joe-bidens-delayed-withdrawal-from-2024-election-race/news-story/56abd9bd5d9dde613c184092759b5673
Sky News,Charlie Kirk suspect's trans lover goes missing six weeks after assassination,https://www.skynews.com.au/world-news/united-states/charlie-kirk-suspects-trans-lover-lance-twiggs-goes-missing-six-weeks-after-political-assassination/news-story/20c841bd605eb50ec928f069beaff021
Sky News,"Principal ""ignored' warnings six-year-old had gun before shooting teacher",https://www.skynews.com.au/world-news/united-states/principal-ignored-warnings-sixyearold-had-gun-before-shooting-virginia-teacher-abby-zwerner-he-has-little-pockets/news-story/d8f54c8b45ca6535c28828a46d0656d8
Sky News,"Green energy costing Australians ""more than was promised'",https://www.skynews.com.au/opinion/andrew-bolt/green-energy-costing-australians-more-than-was-promised/video/262fc225ab80cbf3b48863a989ad2b35
Sky News,"No pants, no problem: Detroit officer appears in court half-dressed",https://www.skynews.com.au/opinion/no-pants-no-problem-detroit-officer-appears-in-court-halfdressed/video/82de71d9c651755db0154fb88a3f81a6
Sky News,"""Ludicrous': Chicago Mayor goes on bizarre rant targeting Donald Trump",https://www.skynews.com.au/opinion/ludicrous-chicago-mayor-goes-on-bizarre-rant-targeting-donald-trump/video/cfcde8b4caf89905b820b7245ae06c29
Sky News,The Kenny Report | 30 October,https://www.skynews.com.au/stream/opinion-programs/the-kenny-report/the-kenny-report-30-october/video/9333f973a631be20c5bbf86c6d6f73f1
Sky News,Credlin | 30 October,https://www.skynews.com.au/stream/opinion-programs/credlin/credlin-30-october/video/907ffbf24222bccfc90401d6c0a33f18
Sky News,The Bolt Report | 30 October,https://www.skynews.com.au/stream/opinion-programs/the-bolt-report/the-bolt-report-30-october/video/733f095c6bbaf6b6c3dbe359b73a8a60
Sky News,Sharri | 30 October,https://www.skynews.com.au/stream/opinion-programs/sharri/sharri-30-october/video/7811b65128fd2df9c5d276cce08371db
Sky News,Paul Murray Live | 30 October,https://www.skynews.com.au/stream/opinion-programs/paul-murray-live/paul-murray-live-30-october/video/2f7a3811bf846dc6e330748d769d900a
Sky News,The Late Debate | 30 October,https://www.skynews.com.au/stream/opinion-programs/the-late-debate/the-late-debate-30-october/video/c9024bc6751f8228ed6a5184bb5f6593
Sky News,The Rita Panahi Show | 30 October,https://www.skynews.com.au/stream/opinion-programs/the-rita-panahi-show/the-rita-panahi-show-30-october/video/cb119cb47c655ff229763205f6dc3f6d
Sky News,Company linked to star chef and pub baron facing seven-figure debt,https://www.skynews.com.au/business/company-linked-to-star-chef-george-calombaris-and-pub-baron-jon-adgemis-facing-sevenfigure-debt-amid-collapse/news-story/935184b8180338bb267c5413d0367770
Sky News,"Coles' profits soar, as price inflation continues for consumers",https://www.skynews.com.au/business/coles-earnings-streak-past-woolworths-in-revenue-report-as-the-extent-of-product-inflation-for-consumers-is-revealed/news-story/c4f197ae9fb063b66f0f184e2955427a
Sky News,10 News+ trimmed to half-hour time slot as ratings fall short,https://www.skynews.com.au/business/media/network-tens-the-project-replacement-10-news-trimmed-from-hourlong-runtime-to-30minute-slot-amid-poor-ratings/news-story/35ef4bfca4678d0933b9a9b66c41c074
Sky News,"Proposed business tax will ""drive investment offshore', Bunnings boss warns",https://www.skynews.com.au/business/finance/proposed-cash-flow-tax-on-businesses-will-drive-investment-offshore-wesfarmers-chair-michael-chaney-to-declare/news-story/d79bab4e99d57107f5e07d39c9855784
Sky News,"""Rate hike next year': Crushing blow for mortgage holders after inflation jumps",https://www.skynews.com.au/business/finance/pain-for-mortgage-holders-as-possible-rate-hike-on-the-cards-next-year-after-crushing-september-inflation-data/news-story/6a4e4a8d27c965d5fcb63b699f5b52eb
Sky News,"AusPost boss calls cheap Amazon, Temu imports a ""drug'",https://www.skynews.com.au/business/finance/drug-of-the-cheapest-product-available-australia-post-ceo-paul-graham-says-aussies-hooked-on-amazon-temu-as-he-pleads-for-customers-to-buy-local/news-story/e718d17606bb9dcd27ca116722b117b3
Sky News,"""Energy prices are killing industry': Warning inflation surge will hit harder still",https://www.skynews.com.au/business/finance/warning-soaring-energy-costs-driving-inflation-higher-and-putting-australian-industries-on-life-support/news-story/1d5f1cee5de90bf43ec062c20f21d303
Sky News,"""Tricky territory': Crucial reason future rate cuts remain up in the air",https://www.skynews.com.au/business/finance/australian-interest-rates-in-tricky-territory-anzs-chief-economist-richard-yetsenga-says-as-future-cuts-remain-uncertain/news-story/b74cabc956ff6817574e9cc268cbd617
Sky News,"""Enough is enough': Backlash to renewables surges across regional Australia",https://www.skynews.com.au/business/energy/standing-up-for-australian-prosperity-growing-resistance-to-wind-and-solar-projects-intensifies-as-australia-shows-a-national-revolt-against-net-zero/news-story/9ed8a2a6eb3f7ad9dc1d550fbbedee5e
Sky News,"""500 kids': Aussie man's Halloween decorations turn neighbours' lives into a nightmare",https://www.skynews.com.au/lifestyle/trending/500-kids-how-aussie-mans-halloween-decorations-are-turning-his-neighbours-lives-into-a-nightmare/news-story/189cf46aebc3c20fe30de2db0f6223f5
Sky News,Lip reader reveals Meghan's three-word remark to Harry at baseball game,https://www.skynews.com.au/lifestyle/celebrity-life/lip-reader-reveals-meghan-markles-threeword-remark-to-prince-harry-at-world-series-baseball-game-moments-before-being-booed-by-the-los-angeles-crowd/news-story/c1d533f99b435100148095bf5f0870f7
Sky News,"What Queen would REALLY think of Meghan's ""overpriced' lifestyle brand",https://www.skynews.com.au/lifestyle/celebrity-life/exploiting-everyday-people-queen-elizabeth-would-think-meghan-markle-was-using-royals-as-marketing-tool-to-flog-brand-celeb-chef-claims/news-story/63fefebe7395b7472041c64fafde9fad
Sky News,Customers erupt over supermarket's cheeky special prices,https://www.skynews.com.au/lifestyle/trending/harris-farm-markets-accused-of-being-misleading-over-signage-for-special-deals/news-story/fac52e1df2c9d00521fa67d13d2d38f1
Sky News,"JK Rowling blasts magazine over trans women on ""Women of the Year' cover",https://www.skynews.com.au/lifestyle/trending/jk-rowling-blasts-glamour-uks-women-of-the-year-cover-featuring-nine-trans-women/news-story/92e4c7b83d01e290bbd2d06e85c52a62
Sky News,"Trove of coins, jewellery unearthed in Christian city near Sea of Galilee",https://www.skynews.com.au/lifestyle/travel/treasure-trove-of-gold-coins-ancient-jewellery-unearthed-in-christian-city-near-sea-of-galilee/news-story/84815c907f6a32eef2a8aece30bbb880
Sky News,Qantas launches massive global sale with fares starting from $299,https://www.skynews.com.au/lifestyle/travel/qantas-launches-massive-global-sale-to-27-destinations-including-la-bali-tokyo-with-airfares-starting-from-299-oneway/news-story/db785e3546080cdbbac73b40dfd3df38
Sky News,Sleepy Aussie city named one of the top tourist destinations in the world,https://www.skynews.com.au/lifestyle/travel/sleepy-aussie-city-named-one-of-the-top-tourist-destinations-in-the-world-in-sustainability-travel-rankings/news-story/db360cdddb1840d491a2f78ee18507b6
Sky News,"""Incredibly disappointing day': Victoria passes Indigenous treaty legislation",https://www.skynews.com.au/australia-news/politics/incredibly-disappointing-day-victoria-passes-indigenous-treaty-legislation/video/d1c9a71f815ef72fce5d89a61f6e62cb
Sky News,Today's News Headlines: Prince Andrew to move out of Royal Lodge,https://www.skynews.com.au/australia-news/todays-news-headlines-prince-andrew-to-move-out-of-royal-lodge/video/4fa4a0e4b154142c0b4e9213945c6b15
Sky News,Barnaby Joyce to face parliamentary probe after behaviour complaint,https://www.skynews.com.au/australia-news/politics/barnaby-joyce-to-face-parliamentary-probe-after-behaviour-complaint/video/9d81992e43fa367edd4bcd69abb7725f
Sky News,Severe storm risk across the east coast,https://www.skynews.com.au/australia-news/weather/severe-storm-risk-across-the-east-coast/video/71e8bd46d88465d951f6c76eaeefd89c
Sky News,"Today's News Headlines: Trump praises Xi as ""tough negotiator'",https://www.skynews.com.au/australia-news/todays-news-headlines-trump-praises-xi-as-tough-negotiator/video/24deb97f7570ccd42d92d73f3071230c
