Section,Headline,Link
Guardian,"FBI investigating US school attack as domestic terrorism "" as it happened",https://www.theguardian.com/us-news/live/2025/aug/27/minneapolis-annunciation-catholic-school-shooting-news-updates
ABC,No sightings of alleged Porepunkah gunman as manhunt enters day three,https://www.abc.net.au/news/2025-08-28/live-blog-porepunkah-victoria-police-shooting/105705474
ABC,Accused gunman Dezi Freeman wrote about dead police on Instagram,https://www.abc.net.au/news/2025-08-28/dezi-freeman-abc-verify-online-posts-porepunkah/105703096
ABC,PM meets with Usman Khawaja to discuss Gaza,https://www.abc.net.au/news/2025-08-28/federal-politics-live-august-28/105704874
ABC,Pentagon says Marles meeting with Hesgarth 'happenstance encounter',https://www.abc.net.au/news/2025-08-28/pentagon-says-marles-hegseth-meeting-happenstance-encounter/105706694
ABC,"ATO whistleblower Richard Boyle spared convictions, jail sentence",https://www.abc.net.au/news/2025-08-28/ato-whistleblower-richard-boyle-sentenced/105702198
ABC,School bus rollover victim identified as talented 12yo basketballer,https://www.abc.net.au/news/2025-08-28/victoria-stonehaven-school-bus-rollover-milla-killeen-identified/105706824
ABC,Qantas profit leaps 28 per cent to $1.6 billion,https://www.abc.net.au/news/2025-08-28/airline-qantas-profit-up-28-per-cent-strong-travel-demand/105705262
ABC,"Reynolds vindicated in defamation battle against Higgins, but at what cost?",https://www.abc.net.au/news/2025-08-28/linda-reynolds-brittany-higgins-defamation-trial-analysis/105702578
ABC,Matt Wright defence says crash pilot played 'traumatic brain injury card',https://www.abc.net.au/news/2025-08-28/matt-wright-trial-nt-court-defence-closing-address-begins/105706360
ABC,US shares edge up as Nvidia profit meets expectations,https://www.abc.net.au/news/2025-08-28/asx-markets-business-news-live-updates/105706132
ABC,The government takes swift action on Iran but the Coalition maintains the rage,https://www.abc.net.au/news/2025-08-28/iranian-ambassador-asio-political-brawl-antisemitism-goes-on/105691632
ABC,Employers switching super funds to send climate message,https://www.abc.net.au/news/2025-08-28/super-funds-at-risk-of-losing-members-over-fossil-fuels/105618490
ABC,SA MP Troy Bell steps down after losing court appeal,https://www.abc.net.au/news/2025-08-28/sa-mp-troy-bell-loses-appeal-against-jury-verdict/105702418
ABC,'Cost me a fortune': NT man sells apartment for loss after strata nightmare,https://www.abc.net.au/news/2025-08-28/nt-strata-body-corporate-apartment-block-special-levy-difficulty/105667814
ABC,"Net zero transition at risk of stalling amid shortfall of 42,000 workers",https://www.abc.net.au/news/2025-08-28/net-zero-transition-at-risk-of-stalling-amid-worker-shortfall/105704400
ABC,Star under another cloud as bankers lose patience,https://www.abc.net.au/news/2025-08-28/star-entertainment-ballys-corporation-deal-analysis/105703708
ABC,From Ablett to Anderson — the Suns' long road to the AFL finals,https://www.abc.net.au/news/2025-08-28/the-suns-long-road-to-afl-finals/105628408
ABC,'No class and no education': Ostapenko once again the villain at US Open,https://www.abc.net.au/news/2025-08-28/ostapenko-townsend-clash-jack-draper-casper-ruud-out-of-us-open/105706372
ABC,Killer responsible for the Gonzales family murders wins right to appeal,https://www.abc.net.au/news/2025-08-28/triple-murderer-sef-gonzales-wins-right-to-appeal-life-sentence/105706012
ABC,Trump administration to tighten visa rules for students and media,https://www.abc.net.au/news/2025-08-28/trump-administration-visa-changes-students-journalists/105705902
ABC,Denmark summons US envoy over suspected influence operations in Greenland,https://www.abc.net.au/news/2025-08-28/denmark-summons-us-envoy-people-carrying-influence-in-greenland/105705686
ABC,Hundreds of clients and employees to be affected by disability service closure,https://www.abc.net.au/news/2025-08-28/centacare-slash-disability-services-jobs-ndis/105698992
ABC,"Minneapolis school shooting a 'hate crime targeting Catholics,' says FBI",https://www.abc.net.au/news/2025-08-28/shooting-reported-at-annunciation-church-school-in-minneapolis/105705812
ABC,Younger-onset dementia patients missing out on timely diagnosis,https://www.abc.net.au/news/health/2025-08-28/diagnostic-criteria-for-younger-onset-dementia-needs-overhaul/105702886
ABC,Devastated families may take legal action over museum that kept body parts,https://www.abc.net.au/news/2025-08-27/coronial-project-tasmania-families-consider-legal-action/105668826
ABC,"Crime reforms, overflowing prisons dominate NT government's first year",https://www.abc.net.au/news/2025-08-26/nt-clp-government-one-year-on-from-being-elected-crime-reform/105693154
ABC,Seagulls reaching plague proportions outside Parliament House,https://www.abc.net.au/news/2025-08-26/act-seagulls-reaching-plague-proportion-outside-parliament-house/105694442
ABC,'Visibly distressed': Report questions use of force at Canberra's youth prison,https://www.abc.net.au/news/2025-08-26/act-report-use-force-children-bimberi-youth-justice-centre/105694120
ABC,Unlikely allies push Labor to increase home care packages,https://www.abc.net.au/news/2025-08-27/push-to-get-older-australians-more-help-at-home/105704028
ABC,"Sanctions, gas and gambling: Here's what Anthony Albanese had to say to your questions",https://www.abc.net.au/news/2025-08-27/anthony-albanese-questions-abc-news/105703172
ABC,Calls to tweak tax rules to bring down NDIS costs,https://www.abc.net.au/news/2025-08-27/calls-to-tweak-tax-rules-to-bring-down-ndis-costs/105700856
ABC,"Wait for aged care bed destroyed my dying dad's dignity, daughter says",https://www.abc.net.au/news/2025-08-27/aged-care-shortage-causes-hospital-bed-block-nsw/105679814
ABC,At least 30 people killed in landslide in India-controlled Kashmir,https://www.abc.net.au/news/2025-08-28/at-least-30-people-killed-in-india-controlled-kashmir-floods/105705664
ABC,"Israel is 'waging an open war on free media', says Palestinian press syndicate",https://www.abc.net.au/news/2025-08-27/israel-has-killed-240-palestinian-journalists-in-gaza/105697128
ABC,"Why would Iran target Australia now? To answer that, look to Europe",https://www.abc.net.au/news/2025-08-27/analysis-iran-alleged-antisemitic-attacks-power-exercise/105700758
ABC,Government moves to bolster powers to deport non-citizens to Nauru,https://www.abc.net.au/news/2025-08-27/government-bolsters-non-citizen-deportation-powers-third-country/105699476
ABC,"Inflation resurges in July, but Woolies shares dive on emerging price war",https://www.abc.net.au/news/2025-08-27/inflation-abs-july-consumer-price-index-woolworths-coles/105702438
ABC,Australian-first soft plastic plant recycles REDcycle collapse backlog,https://www.abc.net.au/news/2025-08-28/large-scale-recycling-household-soft-plastics-new-taree-facility/105699588
ABC,A quarter of your water. Could this be the true cost of AI?,https://www.abc.net.au/news/2025-08-27/ai-to-take-up-one-quarter-of-sydney-water-in-a-decade/105700928
ABC,Why does Trump want to remove Lisa Cook from the Fed?,https://www.abc.net.au/news/2025-08-27/donald-trump-wants-to-fire-federal-reserve-governor-lisa-cook/105702068
ABC,Aussie qualifier Priscilla Hon reaches US Open third round with stunning upset,https://www.abc.net.au/news/2025-08-28/priscilla-hon-stuns-17th-seed-us-open-jordan-thompson/105706814
ABC,NRL bloodletting continues after Knights coach became 'a distraction',https://www.abc.net.au/news/2025-08-28/newcastle-knights-coach-adam-obrien-depart-club/105706114
ABC,Olyslagers wins latest duel with high jump rival ahead of world champs,https://www.abc.net.au/news/2025-08-28/nicola-olyslagers-wins-high-jump-diamond-league-in-zurich/105706212
ABC,How a former Eagles captain developed a new crop of rising stars,https://www.abc.net.au/news/2025-08-28/steve-malaxos-develops-afl-rising-star-nominees-scotch-college/105685970
ABC,Veggies and herbs you can easily grow from seeds,https://www.abc.net.au/news/2025-08-27/vegetables-and-herbs-you-can-easily-cheaply-grow-from-seeds/105672892
ABC,'I was lucky': How social media helped me find community in my teens,https://www.abc.net.au/news/2025-08-26/how-online-friendships-saved-me-in-my-teens/105681774
ABC,Our best weeknight pasta recipes in 30 minutes or less,https://www.abc.net.au/news/2025-08-25/easy-weeknight-pasta-recipes-under-30-minutes/105547468
ABC,"Looking forward to 'pet-friendly' flights in Australia? Here""s what experts say",https://www.abc.net.au/news/2025-08-23/how-to-prepare-small-pets-for-in-cabin-flights-virgin/105677280
ABC,Liz's first song was about Harry Potter. Now she's playing Coachella,https://www.abc.net.au/news/2025-08-27/chit-chat-the-beths-liz-stokes-straight-line-lie-new-album-tour/105651956
ABC,90-year-old artist finally gets her due in new blockbuster exhibition,https://www.abc.net.au/news/2025-08-26/janet-dawson-exhibition-agnsw-far-away-so-close/105676658
ABC,Andrew Bovell on Lantana and why he keeps writing for theatre,https://www.abc.net.au/news/2025-08-27/play-that-became-hit-film-lantana-returns-to-perth-stage/105698246
ABC,That ominous two-note theme and a malfunctioning mechanical shark: Jaws at 50,https://www.abc.net.au/news/2025-08-25/jaws-50-year-anniversary-steven-spielberg-director-sharks/105515272
Sky News,Israeli intelligence assisted ASIO in determining Iran was behind antisemitic attacks,https://www.skynews.com.au/opinion/sharri-markson/israeli-intelligence-assisted-asio-in-determining-iran-was-behind-antisemitic-attacks/video/bd202c24efc9aa9d070414f4ebee96cc
Sky News,"Albanese government ""bowed' to Iran's pressure",https://www.skynews.com.au/opinion/chris-kenny/albanese-government-bowed-to-irans-pressure/video/5fa8d971b2cb080c6d7a7133da2ba811
Sky News,"Megyn Kelly lauds Trump for ""putting a stop' to Washington crime",https://www.skynews.com.au/opinion/paul-murray/megyn-kelly-lauds-trump-for-putting-a-stop-to-washington-crime/video/b545fc4f1589e0cdcc52749c25a1bbe1
Sky News,"""Conviction and backbone': Nigel Farage commits to stopping the boats",https://www.skynews.com.au/opinion/rita-panahi/conviction-and-backbone-nigel-farage-commits-to-stopping-the-boats/video/9e85a08d0e6e07a10b729c6333062c7f
Sky News,"Brittany Higgins ""convinced herself' of a cover up in defamation case with Linda Reynolds",https://www.skynews.com.au/opinion/andrew-bolt/brittany-higgins-convinced-herself-of-a-cover-up-in-defamation-case-with-linda-reynolds/video/9b9f5f912f8efa31eda12122e14b41be
Sky News,"Need for ""solidarity' following deaths of two Victorian police officers",https://www.skynews.com.au/opinion/peta-credlin/need-for-solidarity-following-deaths-of-two-victorian-police-officers/video/3a814b6e376f0d2e8434ee1e978119c5
Sky News,Shock details behind warrant that led to two dead police officers,https://www.skynews.com.au/australia-news/crime/porepunkah-police-shooting-search-for-accused-cop-killer-enters-third-day-in-northeast-victoria-as-slain-officers-identified/news-story/375f7bcda518376556ec825022256d54
Sky News,"""Inverted moral logic': Labor summoned Israel more than Iran until terror campaign exposed",https://www.skynews.com.au/australia-news/politics/labor-called-in-israels-ambassador-for-criticism-more-than-irans-as-senator-dave-sharma-slams-inverted-moral-logic/news-story/41d12497c8434ceaf36841f8042cefb6
Sky News,"Swelling NDIS autism diagnoses a ""five alarm fire' in a wealthy first-world country: expert",https://www.skynews.com.au/australia-news/politics/five-alarm-fire-swelling-ndis-autism-diagnoses-incomprehensible-in-a-wealthy-firstworld-country-leading-disability-advocate-says/news-story/93dc4b31e4e3be9ae208af5b61db48cf
Sky News,Senate vote forces eSafety Commissioner to hand over key documents,https://www.skynews.com.au/australia-news/politics/prime-minister-anthony-albanese-pays-tribute-to-two-fallen-policemen-as-search-continues-for-gunman/live-coverage/06a8cbe7dd3c5fbaaa7b3e0c5f7ca288
Sky News,"""Failing him': Bruce Willis' wife speaks on star's dementia battle",https://www.skynews.com.au/lifestyle/celebrity-life/failing-him-bruce-willis-wife-emma-heming-willis-shares-heartbreaking-new-details-about-the-actors-cognitive-decline-from-frontotemporal-dementia/news-story/333710e2cd8491c1fab2623119d3e787
Sky News,"Pentagon dismisses Marles-Hegseth meeting as ""happenstance encounter'",https://www.skynews.com.au/australia-news/politics/us-pentagon-denies-meeting-between-richard-marles-and-pete-hegseth-calling-it-happenstance-encounter/news-story/8694b8256244914e187f890026bfd3de
Sky News,"""Devastating': Legal expert scolds media for spreading Higgins' ""falsehoods' after Reynolds victory",https://www.skynews.com.au/australia-news/politics/devastating-legal-expert-scolds-media-for-spreading-higgins-falsehoods-after-reynolds-vindication-casts-doubt-on-mammoth-labor-payout/news-story/869592c3cae8a7f470470bcc1485244f
Sky News,Former detective reveals how authorities respond to sovereign citizens after two police officers killed,https://www.skynews.com.au/australia-news/crime/radical-group-former-detective-reveals-how-authorities-respond-to-sovereign-citizens-after-dezi-freeman-allegedly-shot-and-killed-two-police-officers/news-story/cd48eed820acdbe05d3f30d3ff5e7ffb
Sky News,"""They did not need to take this long': Labor ""dragged its feet' on Iran terror listing",https://www.skynews.com.au/australia-news/politics/shadow-minister-says-the-albanese-government-ignored-coalition-offers-to-change-the-law-leaving-australia-vulnerable-to-terror-attacks/news-story/e2dd0a6cf5c60e4344d69a62df98940e
Sky News,Young man dead after stabbing at Western Sydney bus interchange,https://www.skynews.com.au/australia-news/crime/man-19-dead-and-another-injured-following-stabbing-at-bus-interchange-in-mount-druitt-in-western-sydney/news-story/dc1ef02bd25f5c90ffc93e8ed530b175
Sky News,"Temperatures set to plummet in south-east with ""significant drop' of snow on the way",https://www.skynews.com.au/australia-news/weather/temperatures-set-to-plummet-in-nations-southeast-with-significant-drop-of-snow-on-the-way-due-to-looming-weather-system/news-story/3cba90f4f70877eec5458ab4872f2195
Sky News,"""A worry': Travel giant says one generation is ditching holidays",https://www.skynews.com.au/business/finance/flight-centre-boss-graham-turner-reveals-the-generation-backing-away-from-travelling-as-cost-of-living-pressure-persists/news-story/71451e505669cff8fb42ecb7fe665447
Sky News,Israeli intelligence assisted ASIO investigation into Iran,https://www.skynews.com.au/australia-news/sources-reveal-israeli-intelligence-assisted-asio-investigation-into-iran-in-major-tipoff/news-story/eea80c18b847c77a4fcc6dfa14e6be07
Sky News,"Sussan Ley dazzles in $1,300 designer gown at Midwinter Ball",https://www.skynews.com.au/lifestyle/celebrity-life/one-word-politichic-lnp-leader-sussan-ley-turns-heads-in-a-australian-designer-dress-worth-1300-at-canberras-exclusive-midwinter-ball/news-story/4d43a70756622e2a01ff2ccf0d8b5bb6
Sky News,Chinese business manager denies threatening to spy on Aussie staff members,https://www.skynews.com.au/business/real-estate/chinese-business-manager-denies-threatening-to-pay-ccp-to-spy-on-aussie-staff-members-wechat-messages/news-story/d17c08fab62664f8c3f856949816634c
Sky News,I watched all 283 minutes of Meghan's painfully bad new Netflix season so you don't have to,https://www.skynews.com.au/insights-and-analysis/inside-meghan-markle-magical-plan-to-upstage-princess-catherines-christmas-message-of-kindness-as-duchess-releases-new-netflix-season/news-story/e986c4e27d78508bac478a81ca927902
Sky News,The two developments that have imperiled Taiwan's geopolitical security,https://www.skynews.com.au/insights-and-analysis/domestic-chaos-putting-taiwans-geopolitical-security-in-scary-position-as-donald-trump-walks-the-tariff-tightrope-with-china/news-story/2e01ce7b1650df09a3c946d61a1c8986
Sky News,"As productivity slumps, we are left with one question about this Labor govt",https://www.skynews.com.au/insights-and-analysis/how-on-earth-did-albanese-win-the-nation-over-at-the-last-federal-election-amid-voice-failure-productivity-and-cost-of-living-slump/news-story/3ae328adb40386c2602d0bb01ea1f7d3
Sky News,"Trans shooter mused about slaughtering ""filthy Zionist Jews' in sick journal before massacre",https://www.skynews.com.au/world-news/united-states/trans-minneapolis-shooter-robin-westman-mused-about-slaughtering-filthy-zionist-jews-in-sick-journal-before-deadly-catholic-school-massacre/news-story/2d1ddcdbdd4bef79bf259b639d77d2b5
Sky News,"Harris fundraising events ""disappointing' as Dems pay off her campaign debt: report",https://www.skynews.com.au/world-news/united-states/kamala-harris-fundraising-events-have-been-a-flop-to-help-raise-money-for-democratic-national-committee-report/news-story/dd93181c17a480acc9e917c63acb9718
Sky News,"Mum of mass shooter worked at school where he opened fire, killing two kids: police",https://www.skynews.com.au/world-news/united-states/mum-of-minneapolis-mass-shooter-robin-westman-worked-at-catholic-school-where-he-opened-fire-killing-two-kids-police/news-story/a4b05b130a2665e41fe0eaa595d17e3a
Sky News,"Trans gunman who slaughtered US Catholic school children had ""kill Trump' manifesto",https://www.skynews.com.au/world-news/united-states/two-children-killed-17-injured-in-shooting-during-church-mass-at-catholic-school-in-minneapolis-minnesota/news-story/889fe85279554d8e196cfee71d74d3a3
Sky News,Man with grisly mug shot charged with sexual exploitation of a minor,https://www.skynews.com.au/world-news/united-states/man-70-with-grisly-mug-shot-charged-in-south-carolina-with-several-counts-of-sexual-exploitation-of-a-minor/news-story/8f9eaa53b1876698ebba205bc1e4fd12
Sky News,Slain teen's mum reveals son adored cheerleader girlfriend charged over his murder,https://www.skynews.com.au/world-news/united-states/mother-of-slain-south-carolina-teen-reveals-son-adored-his-queen-bee-cheerleader-girlfriend-charged-with-orchestrating-his-murder/news-story/8562d7e14c4cf16beec0473d183846c1
Sky News,Podiatrist hired hit man to kill wife ' months after jail release for first plot to murder her,https://www.skynews.com.au/world-news/united-states/new-york-podiatrist-hired-hit-man-to-kill-his-wife-just-months-after-prison-release-for-first-failed-150000-plot-to-have-her-murdered/news-story/b9a9761356ed20ff79a36a69e112f54f
Sky News,Horrific moment bullfighter is gored to death during his first performance,https://www.skynews.com.au/world-news/global-affairs/horrific-moment-bullfighter-is-gored-to-death-during-his-first-performance-in-lisbon-portugal/news-story/311c4fa983e117a8ec8cd5c2820ad2ad
Sky News,"""Young and silly woman': Andrew Bolt reacts to Higgins' defamation suit loss",https://www.skynews.com.au/opinion/andrew-bolt/young-and-silly-woman-andrew-bolt-reacts-to-higgins-defamation-suit-loss/video/8a76a00c80ff26c471955b14203bd2fd
Sky News,"""Why the panic?': Richard Marles scrutinised for ""hasty' trip to meet Pete Hegseth",https://www.skynews.com.au/opinion/sharri-markson/why-the-panic-richard-marles-scrutinised-for-hasty-trip-to-meet-pete-hegseth/video/32872bb4e561b73b24e21c953d2ad1d8
Sky News,"Democrats in ""disarray' after bizarre acknowledgement of country for DNC meeting",https://www.skynews.com.au/opinion/rita-panahi/democrats-in-disarray-after-bizarre-acknowledgement-of-country-for-dnc-meeting/video/bd0c0c4d504489a7761313ca4f423da6
Sky News,The Kenny Report | 27 August,https://www.skynews.com.au/stream/opinion-programs/the-kenny-report/the-kenny-report-27-august/video/42d1bf505d6e7a95c17892346b41c12e
Sky News,Credlin | 27 August,https://www.skynews.com.au/stream/opinion-programs/credlin/credlin-27-august/video/c145e3dbfece2617a51d99a1711d5f1f
Sky News,The Bolt Report | 27 August,https://www.skynews.com.au/stream/opinion-programs/the-bolt-report/the-bolt-report-27-august/video/3290e3f5c99abb66011b7b0c083ffc35
Sky News,Sharri | 27 August,https://www.skynews.com.au/stream/opinion-programs/sharri/sharri-27-august/video/ae45db95979b50d09a032dd4844dad6b
Sky News,Paul Murray Live | 27 August,https://www.skynews.com.au/stream/opinion-programs/paul-murray-live/paul-murray-live-27-august/video/ed0afc62f9558aa45ea5ad8c0ca6ea25
Sky News,The Late Debate | 27 August,https://www.skynews.com.au/stream/opinion-programs/the-late-debate/the-late-debate-27-august/video/d2cc4c023dab6e709df88f185437b905
Sky News,The Rita Panahi Show | 27 August,https://www.skynews.com.au/stream/opinion-programs/the-rita-panahi-show/the-rita-panahi-show-27-august/video/108f0592ccef018e51e19c436da9a6ac
Sky News,"""A worry': Travel giant says one generation is ditching holidays",https://www.skynews.com.au/business/finance/flight-centre-boss-graham-turner-reveals-the-generation-backing-away-from-travelling-as-cost-of-living-pressure-persists/news-story/71451e505669cff8fb42ecb7fe665447
Sky News,Chinese business manager denies threatening to spy on Aussie staff members,https://www.skynews.com.au/business/real-estate/chinese-business-manager-denies-threatening-to-pay-ccp-to-spy-on-aussie-staff-members-wechat-messages/news-story/d17c08fab62664f8c3f856949816634c
Sky News,Inflation spikes to highest point in a year,https://www.skynews.com.au/business/finance/inflation-spikes-to-highest-point-in-a-year-as-energy-rebates-run-dry/news-story/356e1d411932129bffb546b7877be148
Sky News,ASX lifts as Domino's nosedives after posting first annual loss in 20 years,https://www.skynews.com.au/business/markets/asx-200-lifts-on-wednesday-as-dominos-woolworths-and-wisetech-crash-over-disappointing-2025-financial-year-results/news-story/4998821d581a644111d7b1018e795a7f
Sky News,Mind-blowing amount Australians spending to attend a wedding revealed,https://www.skynews.com.au/business/finance/finder-research-reveals-average-australian-spends-2593-attending-a-wedding-as-industry-holds-strong-amid-tough-economic-climate/news-story/9edb7371e89f6614bfe964c26772348c
Sky News,Fashion magazine may face staff walkout over potential Melania Trump feature,https://www.skynews.com.au/business/media/vanity-fair-editor-rages-over-potential-melania-trump-cover-predicts-half-the-editorial-staff-will-walk/news-story/25ff92b578fe5a71fcbbaba3543609af
Sky News,Iconic resto's language change on famous table game sparks criticism,https://www.skynews.com.au/business/media/cracker-barrels-changed-language-on-famous-peg-game-in-rebrand-sparks-criticism/news-story/ce631e7ac20bb5d1b5b7350661a5189c
Sky News,Sydney shopping centre aiming to attract affluent clientele in refurbishment plan,https://www.skynews.com.au/lifestyle/shopping-centre-on-sydneys-lower-north-shore-set-to-focus-on-affluence-as-brands-like-louis-vuitton-sign-on-as-tenants/news-story/be5ccf8a618a31b19f1b46224fd6917e
Sky News,Queensland takes action to recoup $66m from Twiggy Forest's Fortescue over failed green hydrogen project,https://www.skynews.com.au/business/energy/queensland-government-takes-action-to-recoup-66m-from-twiggy-forests-fortescue-over-failed-green-hydrogen-project-in-gladstone/news-story/f6a57ab9b189af4880018e760070e920
Sky News,"""Failing him': Bruce Willis' wife speaks on star's dementia battle",https://www.skynews.com.au/lifestyle/celebrity-life/failing-him-bruce-willis-wife-emma-heming-willis-shares-heartbreaking-new-details-about-the-actors-cognitive-decline-from-frontotemporal-dementia/news-story/333710e2cd8491c1fab2623119d3e787
Sky News,My best friend cheated on her fiancé ' so she fired me as her maid of honour,https://www.skynews.com.au/lifestyle/trending/brides-bestfriend-reveals-shocking-reason-she-was-fired-as-maid-of-honour-after-hens-night-ended-in-cheating-scandal-disaster/news-story/7e132a7518d8d3698ce8d4de9d9c116d
Sky News,Princesses Beatrice and Eugenie in shock inheritance twist,https://www.skynews.com.au/lifestyle/celebrity-life/princesses-beatrice-and-eugenie-could-inherit-60-million-royal-lodge-mansion-from-prince-andrew-through-legal-loophole/news-story/2854b06557185f3ebb7606160eebacdf
Sky News,"Sussan Ley dazzles in $1,300 designer gown at Midwinter Ball",https://www.skynews.com.au/lifestyle/celebrity-life/one-word-politichic-lnp-leader-sussan-ley-turns-heads-in-a-australian-designer-dress-worth-1300-at-canberras-exclusive-midwinter-ball/news-story/4d43a70756622e2a01ff2ccf0d8b5bb6
Sky News,"Plus-sized traveller's ""entitled' plane act divides social media",https://www.skynews.com.au/lifestyle/trending/plussized-traveller-angers-social-media-as-she-shares-list-of-reasons-why-she-will-no-longer-purchase-a-second-plane-seat/news-story/793661dcb6bbbb2c5d3c876a57303f1a
Sky News,Cult comedian's Victorian machete bins roast goes viral,https://www.skynews.com.au/lifestyle/trending/thats-a-bargain-cult-comedians-13-million-victorian-machete-bins-roast-goes-viral-on-tiktok/news-story/254b26b284f1415fc46436b455df385e
Sky News,"At least 10 people hospitalised after ""dairy-free' product found to contain milk",https://www.skynews.com.au/lifestyle/health/a-major-recall-has-been-issued-for-cocobella-yoghurt-after-multiple-consumers-were-rushed-to-hospital-suffering-severe-allergic-reactions/news-story/1483ce497a9c139442f7e3b28ba168da
Sky News,"Why Meghan is ""freer' and more ""authentic' in Montecito",https://www.skynews.com.au/lifestyle/celebrity-life/a-little-bit-inauthentic-meghan-markle-says-her-life-feels-freer-in-montecito-without-royal-rules-and-pantyhose-expectations-in-a-candid-new-interview/news-story/52d0810bdfbd96118166d92e526a8bf2
Sky News,"Labor ""could not ignore' Iran's antisemitic attacks in Australia",https://www.skynews.com.au/australia-news/politics/labor-could-not-ignore-irans-antisemitic-attacks-in-australia/video/4956e3e8dab95986ffe4b575189f4171
