Section,Headline,Link
9 News,Death toll rises to 44 in horror Hong Kong high-rise inferno,https://www.9news.com.au/world/hong-kong-fire-deadly-fire-breaks-out-in-highrise-residential-buildings-in-tai-po-district/c6a4aeb1-5d20-4a54-aad6-4c98eb4b1103
9 News,UPDATEThousands remain without power as NSW faces huge storm clean up,https://www.9news.com.au/national/nsw-storms-severe-weather-damaging-winds-large-hail-sydney/527cdd97-b529-44e5-adac-97b7ab338aad
9 News,exclusiveJane quit a corporate job to chase her dream. It makes $100 million in sales a year,https://www.9news.com.au/national/showpo-ceo-jane-lu-secrets-to-success/52e5a566-b5fa-494e-8010-21cf530b149e
9 News,Why a patch of concrete is worth more than most Aussie homes,https://www.domain.com.au/news/these-sydney-car-spots-sold-for-600k-a-pop-begging-the-question-should-we-ditch-the-house-and-buy-some-bitumen-1462284/?utm_source=9news.com.au&utm_medium=referral&utm_campaign=editorial-homepage-driver
9 News,Home 'held together by plants' gets TV-worthy reno,https://www.domain.com.au/living/reveal-me-rooms-1461617/?utm_source=9news.com.au&utm_medium=referral&utm_campaign=editorial-homepage-driver
9 News,Police continue to scour bushland for missing mum Samantha Murphy2 hours ago,https://www.9news.com.au/national/samantha-murphy-search-ballarat-enfield-state-park/b1536f14-a9af-446c-a02a-740156eaf8d7
9 News,"Brazen Sydney scooter theft part of a 'wave', police say",https://www.9news.com.au/national/scooter-thefts-police-cracking-down-on-surge-nsw/11413d04-ba45-4474-b3f2-17613fa5dabe
9 News,breakingEnvironment laws to finally pass after five years following final-day deal,https://www.9news.com.au/national/environmental-laws-to-pass-government-greens-deal/cf777a38-95ed-414f-901a-93d253f3d71d
9 News,BREAKINGSuspect 'not cooperating' after National Guardsmen shot near the White House2 hours ago,https://www.9news.com.au/world/shooting-near-white-house-leaves-national-guard-troops-injured/cfdcc643-d684-46f9-9603-61c81147097b
9 News,Man allegedly stabbed in machete attack after car crash in Melbourne's north2 hours ago,https://www.9news.com.au/national/broadmeadows-affray-four-people-including-two-teenagers-arrested/f6d71d49-a32d-436f-9284-5193f4f8cbdd
9 News,Shots fired at suburban house while occupants slept inside,https://www.9news.com.au/national/shots-fired-at-house-in-north-west-sydney/ab664769-4193-4959-8c58-9d38eb4a8405
9 News,$5 billion early Christmas gift could be on the cards for every Aussie,https://www.9news.com.au/national/energy-bill-rebate-comments-treasurer-jim-chalmers-inflation/51fa0981-73dc-447e-803b-53c9f5eefe58
9 News,Melbourne former childcare worker charged over alleged assault of toddler,https://www.9news.com.au/national/former-melbourne-childcare-worker-charged-over-alleged-assault-of-toddler/4978e772-49c3-4bd8-acdf-6b22b8460ae4
9 News,Man charged after greyhounds die in bike locker in Sydney,https://www.9news.com.au/national/man-charged-alleged-animal-cruelty-penrith/264487b4-9c38-4cec-92e8-f6539ec6ae80
9 News,UpdateWA councillor who tried to expense a drink at Adelaide strip club resigns,https://www.9news.com.au/national/western-australia-joondalup-nige-jones-accidentally-walked-into-strip-club-premier-police-minister-respond/8c627ee6-24e7-468c-b2a2-24745bb9bcb5
9 News,"No daily drug tests for pilots before Sea World crash, inquest hears",https://www.9news.com.au/national/sea-world-helicopter-crash-inquest-no-daily-drug-tests-for-pilots-before-sea-world-crash/c527e20b-d437-41d9-a35f-2f48f20d8f3d
9 News,Accused Easey Street killer to stand trial on two counts of murder,https://www.9news.com.au/national/accused-easey-street-killers-rape-charge-struck-out-as-he-is-committed-to-stand-trial-on-two-counts-of-murder/bbd96e51-b5d3-4504-8fc6-a8b32040c6ae
9 News,Specialist police launch new search for missing Ballarat mum Samantha Murphy,https://www.9news.com.au/national/specialist-police-launch-new-search-for-missing-ballarat-mum-samantha-murphy/90b1831e-3168-4053-abf6-2f950ef8931a
9 News,Scramble to fix oversight that would create 'pedestrian tollway',https://www.9news.com.au/national/victorian-government-scrambles-to-fix-blunder-that-would-create-first-pedestrian-tollway/825d2c45-4809-420f-9f5d-bb41467b8741
9 News,exclusiveJane quit a corporate job to chase her dream. It makes $100 million in sales a year,https://www.9news.com.au/national/showpo-ceo-jane-lu-secrets-to-success/52e5a566-b5fa-494e-8010-21cf530b149e
9 News,Why a patch of concrete is worth more than most Aussie homes,https://www.domain.com.au/news/these-sydney-car-spots-sold-for-600k-a-pop-begging-the-question-should-we-ditch-the-house-and-buy-some-bitumen-1462284/?utm_source=9news.com.au&utm_medium=referral&utm_campaign=editorial-homepage-driver
9 News,Home 'held together by plants' gets TV-worthy reno,https://www.domain.com.au/living/reveal-me-rooms-1461617/?utm_source=9news.com.au&utm_medium=referral&utm_campaign=editorial-homepage-driver
9 News,TODAY IN HISTORYFrank Sinatra arrested on an arcane charge,https://www.9news.com.au/world/today-in-history-november-27-what-happened-on-this-day-frank-sinatra-arrest/508c524f-c62f-4d52-8025-abb39fcc0a8d
9 News,The $1200 crime Aussies are committing without realising,https://www.9news.com.au/national/seatbelt-fines-rules-in-australia-explained/0055f393-a2d0-4f50-b479-bd9d5c289b1d
9 News,Who else has been name-checked in the Epstein email trove?,https://www.9news.com.au/world/jeffrey-epstein-emails-more-revelations-donald-trump-prince-andrew-ghislaine-maxwell-bill-clinton/1aab28f8-865f-47ac-9df8-63ba6b4c722a
9 News,"The US government has reopened after a historic shutdown. What does that mean, exactly?",https://www.9news.com.au/world/us-government-shutdown-what-it-is-how-works-how-affects-australians-explained/fb5f4b09-2157-461d-bc45-b4037bb7afe0
9 News,A Current AffairInside the extortion racket bombarding small businesses with fake one-star Google reviews,https://9now.nine.com.au/a-current-affair/inside-the-extortion-racket-bombarding-small-businesses-with-fake-onestar-google-reviews/f7cf796d-d393-4154-be56-89ef2532533c
9 News,WatchUkraine backs essence of peace deal,https://www.9news.com.au/videos/world/ukraine-backs-essence-of-peace-deal/cmiexbqhh00080hmo9oq9tdpu
9 News,"A Current AffairThe industry looking for women to fill jobs with $150,000 salaries",https://9now.nine.com.au/a-current-affair/the-industry-looking-for-women-to-fill-jobs-with-150000-salaries/b7f9d95d-e2df-4686-8932-052ab38dfdde
9 News,Teen charged after allegedly being duped into importing 16kg of meth into Australia,https://www.9news.com.au/national/australia-teenager-charged-meth-import/0dd11765-8b30-41cf-8bd7-b7af46b6e35d
9 News,"The tax loophole leaving innocent Aussies with massive, secret debts",https://www.9news.com.au/national/gender-based-violence-coerced-directorships-what-is-it-how-to-get-help-everything-to-know-explained/487aeff4-33b3-4f13-b90d-1aa4885a58bb
9 News,More wild weather on the way as Queensland cleans up after severe storms,https://www.9news.com.au/national/queensland-weather-news-storms-heatwave/8fe42b4d-159f-4358-bfda-4d1c2f1ff9cc
9 News,Extra charges for veteran Tasmanian cop's alleged killer,https://www.9news.com.au/national/leigh-geoffrey-sushames-court-updates-extra-charges-for-veteran-cops-alleged-killer-north-motton-tasmanias-north-west/1b666c37-3530-426b-a129-b9df8045c18e
9 News,'Ridiculously expensive': Council splashes $20m on planter boxes,https://www.9news.com.au/national/city-of-sydney-council-faces-scrutiny-over-cost-of-expensive-planter-boxes/bda8eebf-a7fe-47df-8857-52f42e7a7dd1
9 News,MP files court action challenging consitutionality of social media ban,https://www.9news.com.au/national/social-media-ban-nsw-mp-john-ruddick-files-high-court-action-challenging-consitutionality/51042b13-e28f-4a32-b523-b32d927032af
9 News,"Vandals blamed for Optus outage that hit more than 14,500 customers",https://www.9news.com.au/national/optus-triple-zero-outage-frankston-and-mornington-peninsula/3bc0233a-c38e-4e1e-aded-0b9661fbe057
9 News,These dangerous texts are flooding millions of Aussies' phones,https://www.9news.com.au/national/gambling-advertising-spam-text-messages-rules-regulations-betting-companies-how-they-can-message-you-explainer/e4c69943-2fd0-4d3d-8d50-08d44ed6f75a
9 News,Crowdsourced site reveals devastating reality of Hong Kong inferno,https://www.9news.com.au/world/hong-kong-fire-crowdsourced-safety-tracking-app/c0f4d6d8-d4d1-4f77-a32f-48e433a9a54d
9 News,Fire-prone materials made deadly Hong Kong inferno an 'accident waiting  to happen',https://www.9news.com.au/world/hong-kong-fire-shows-risk-of-using-bamboo-scaffolding/ba7739b1-90c7-450b-9eee-54807e7b9ef1
9 News,"Mysterious underground caves could be yours for $110,000",https://www.domain.com.au/news/mysterious-underground-caves-could-be-yours-for-110000-1462416/?utm_source=9news.com.au&utm_medium=referral&utm_campaign=editorial-homepage-driver
9 News,Judge dismisses Georgia election election interference case against Trump,https://www.9news.com.au/world/donald-trump-update-new-prosecutor-wont-pursue-charges-against-trump-and-others-in-georgia-election-interference-case/ff02b0ea-05d0-457c-b59f-ecaaeb27dd3e
9 News,House buried under 'jungle' of weeds hits market for $1.8m,https://www.domain.com.au/news/house-buried-under-jungle-of-weeds-hits-market-for-1-8-million-1462102/?utm_source=9news.com.au&utm_medium=referral&utm_campaign=editorial-homepage-driver
9 News,Man's shock at what $4.46m buys you near Buckingham Palace,https://www.domain.com.au/news/mans-shock-at-what-4-46-million-buys-you-near-buckingham-palace-1461852/?utm_source=9news.com.au&utm_medium=referral&utm_campaign=editorial-homepage-driver
9 News,'Not the right person': Merrett quits as Essendon captain,https://www.nine.com.au/sport/afl/news-2025-zach-merrett-captain-resignation-essendon-bombers-hawthorn-hawks-trade/61539598-906b-4014-9603-f2c6f63cf577
9 News,'I would be amazed': English admission after Ashes 'humiliation',https://www.nine.com.au/sport/cricket/news-2025-ashes-uk-view-test-collapse-perth-michael-atherton-michael-vaughan-comments/9ca52b67-96ba-4d71-ab95-e997da23909b
9 News,No early exit for 'world's best' coach Schmidt,https://www.nine.com.au/sport/rugby/news-2025-joe-schmidt-coaching-contract-future-pressure-wallabies-troubles-ceo-comments/60b12a85-d0a9-46d1-bc9d-22f074620a63
9 News,Seibold admits star could leave Manly amid three-club hunt,https://www.nine.com.au/sport/nrl/players-off-contract-2026-complete-list-open-market-free-agency-perth-bears/45b5c04c-7525-4d72-bef0-ec5e5f7c4689
9 News,Outrageous claim or bold truth? Breaking down Cox's big statement,https://www.nine.com.au/sport/afl/news-2025-fremantle-dockers-best-list-mason-cox-collingwood-magpies/8c85190b-2b41-46af-b22c-d41c37041765
9 News,Pot luck ensures Socceroos will avoid heavyweights at World Cup,https://www.nine.com.au/sport/football/news-2025-socceroos-fifa-world-cup-2026-draw-pot-2-seeding/3127faa9-8480-4169-b3fb-17af164fcc21
9 News,Chelsea's whiz-kids make giant Champions League statement,https://www.nine.com.au/sport/football/champions-league-2025-chelsea-barcelona-highlights-manchester-city-result-newcastle-united-scores-news/6aa95cb0-fabf-4067-bf53-c747d13b50c5
9 News,Today's 2025 Christmas gift guide,https://9now.nine.com.au/today/today-show-christmas-gift-guide-2025/54e63235-f97b-4d94-999c-0b9ad450fbba
9 News,'World's Sexiest Man' makes more surprise appearances around Sydney,https://9now.nine.com.au/today/jonathan-bailey-sydney-surprise-appearances-tiktok-awards-gay-bingo-pub-entertainment-news/115744a0-58b9-4b9b-bd63-f791a7e1f7b0
9 News,Karl slams Sydney council's $20 million 'plant box' spend,https://9now.nine.com.au/today/city-of-sydney-council-under-fire-over-20-million-spend-on-plant-boxes/a8b823b6-702a-451e-8a5e-78f200b6221c
9 News,New concerns for dog on Sydney apartment balcony,https://9now.nine.com.au/a-current-affair/new-concerns-for-dog-on-sydney-apartment-balcony/88f501e5-7673-454c-b1e1-9dcf07d542c5
9 News,"The industry looking for women to fill jobs with $150,000 salaries",https://9now.nine.com.au/a-current-affair/the-industry-looking-for-women-to-fill-jobs-with-150000-salaries/b7f9d95d-e2df-4686-8932-052ab38dfdde
9 News,Inside the extortion racket bombarding small businesses with fake one-star Google reviews,https://9now.nine.com.au/a-current-affair/inside-the-extortion-racket-bombarding-small-businesses-with-fake-onestar-google-reviews/f7cf796d-d393-4154-be56-89ef2532533c
9 News,Sanna Marin: The partying prime minister who stood up against Russia,https://9now.nine.com.au/60-minutes/finland-sanna-marin-partying-prime-minister-who-stood-up-against-russia/49abe402-f6b5-4496-9669-a6b7536ea953
9 News,Allegation of cover-up in Laos methanol poisoning investigation,https://9now.nine.com.au/60-minutes/allegation-of-cover-up-in-laos-methanol-poisoning-investigation/c842f67a-f968-4fe6-988e-e4e86a44b07a
9 News,Bree thought surgery would solve her problems. It led to a world of pain,https://9now.nine.com.au/60-minutes/bree-thought-jaw-surgery-would-solve-her-problems-instead-it-led-to-a-world-of-pain/78c0d278-46fb-43c8-afda-70665ad213aa
9 News,Couple arrive home to find nasty note taped to their door,https://www.domain.com.au/news/couple-confronted-by-rude-note-eight-hours-after-picking-up-apartment-keys-1414069/?utm_source=nine.com.au&utm_medium=referral&utm_campaign=editorial-homepage-driver
9 News,The last affordable suburb in Sydney revealed,https://www.domain.com.au/news/girraween-the-closest-suburb-to-sydneys-cbd-for-under-1-million-is-24km-away-1408376/?utm_source=nine.com.au&utm_medium=referral&utm_campaign=editorial-homepage-driver
9 News,The unusual reason Peter bought this derelict cottage,https://www.domain.com.au/news/i-collected-it-peter-bought-this-run-down-riverside-nz-cottage-for-nostalgia-1414033/?utm_source=nine.com.au&utm_medium=referral&utm_campaign=editorial-homepage-driver
9 News,This is Australia's most congested city,https://www.drive.com.au/caradvice/the-10-billion-problem-this-is-the-countrys-most-congested-city-australia-traffic/?utm_source=nine-rail&utm_medium=referral
9 News,No experience? No worries: How I replaced my car's entire tail-light,https://www.drive.com.au/caradvice/no-experience-no-worries-how-i-replaced-my-cars-entire-tail-light/?utm_source=nine-front-page&utm_medium=referral
9 News,Three-door 4WD returns to Australian showrooms,https://www.drive.com.au/news/2026-suzuki-jimny-price-and-specs-three-door-4wd-returns-to-australian-showrooms/?utm_source=nine-rail&utm_medium=referral
9 News,Coroner hands down findings into Lilie James' horrific murder31 minutes ago,https://www.9news.com.au/national/coroner-hands-down-findings-into-lilie-james-horrific-murder/1d19078d-531d-45cc-b683-cfb09cc900f7
9 News,Crowdsourced site reveals devastating reality of Hong Kong infernoan hour ago,https://www.9news.com.au/world/hong-kong-fire-crowdsourced-safety-tracking-app/c0f4d6d8-d4d1-4f77-a32f-48e433a9a54d
9 News,Aussies blocked from deepfake nudifying websites over child abuse materialan hour ago,https://www.9news.com.au/national/itai-tech-aussies-blocked-from-deepfake-nudifying-websites-over-child-abuse-material/b8b3ce4e-dc42-4221-a499-5cae689c4b63
9 News,Fire-prone materials made deadly Hong Kong inferno an 'accident waiting  to happen'an hour ago,https://www.9news.com.au/world/hong-kong-fire-shows-risk-of-using-bamboo-scaffolding/ba7739b1-90c7-450b-9eee-54807e7b9ef1
9 News,Victims of fatal NSW attack were known to each otheran hour ago,https://www.9news.com.au/national/shark-attack-crowdy-head-nsw-multiple-victims/8d5d56d6-00ae-4b5e-b353-99ed6840bd38
9 News,Suspect 'not cooperating' after National Guardsmen shot near the White House2 hours ago,https://www.9news.com.au/world/shooting-near-white-house-leaves-national-guard-troops-injured/cfdcc643-d684-46f9-9603-61c81147097b
9 News,Man allegedly stabbed in machete attack after car crash in Melbourne's north2 hours ago,https://www.9news.com.au/national/broadmeadows-affray-four-people-including-two-teenagers-arrested/f6d71d49-a32d-436f-9284-5193f4f8cbdd
9 News,Police continue to scour bushland for missing mum Samantha Murphy2 hours ago,https://www.9news.com.au/national/samantha-murphy-search-ballarat-enfield-state-park/b1536f14-a9af-446c-a02a-740156eaf8d7
9 News,Shots fired at suburban house while occupants slept inside,https://www.9news.com.au/national/shots-fired-at-house-in-north-west-sydney/ab664769-4193-4959-8c58-9d38eb4a8405
9 News,Environment laws to finally pass after five years following final-day deal,https://www.9news.com.au/national/environmental-laws-to-pass-government-greens-deal/cf777a38-95ed-414f-901a-93d253f3d71d
Guardian,"Guinea-Bissau military takes ""total control"" amid election chaos",https://www.theguardian.com/world/2025/nov/26/guinea-bissau-officers-take-total-control-close-borders-amid-election-chaos
Guardian,Nigerian schoolgirls rescued after mass abduction in Kebbi,https://www.theguardian.com/world/2025/nov/25/nigerian-schoolgirls-rescued-after-mass-abduction-in-kebbi
Guardian,"Jacob Zuma""s daughter accused of tricking men into fighting for Russia in Ukraine",https://www.theguardian.com/world/2025/nov/25/jacob-zuma-daughter-accused-tricking-men-fighting-for-russia-in-ukraine
Guardian,UK rejects Nigerian request to deport former politican jailed for organ trafficking,https://www.theguardian.com/uk-news/2025/nov/24/uk-rejects-nigerian-request-to-deport-former-politican-ike-ekweremadu-jailed-for-organ-trafficking
Guardian,"Ethiopian volcano erupts for first time in 12,000 years ",https://www.theguardian.com/world/2025/nov/24/ethiopian-volcano-hayli-gubbi-erupts-first-time-12000-years
Guardian,Trump officials halt protected status for Haitians in US,https://www.theguardian.com/us-news/2025/nov/26/trump-temporary-protected-status-haiti
Guardian,"Noem made decision to continue deportation flights to El Salvador, justice department says",https://www.theguardian.com/us-news/2025/nov/26/kristi-noem-deportation-flights-el-salvador
Guardian,"Trump threatens Venezuela""s Maduro with ""the easy way … or the hard way""",https://www.theguardian.com/world/2025/nov/26/maduro-defends-venezuela-against-trump-military
Guardian,US justice department memo about boat strikes diverges from Trump narrative,https://www.theguardian.com/us-news/2025/nov/25/trump-caribbean-boat-strikes-memo
Guardian,Jair Bolsonaro ordered to start 27-year prison term for plotting Brazil coup,https://www.theguardian.com/world/2025/nov/25/jair-bolsonaro-brazil-prison
Guardian,"Hong Kong fire: rescue crews search apartment blocks for survivors; dozens killed and hundreds missing after blaze "" follow updates",https://www.theguardian.com/world/live/2025/nov/27/hong-kong-fire-arrests-dead-killed-hundreds-missing-housing-complex-blaze
Guardian,Death toll in Hong Kong tower block fire rises to 44 with hundreds still missing,https://www.theguardian.com/world/2025/nov/26/hong-kong-fire-tai-po-towers
Guardian,Bamboo scaffolding may be to blame for spread of Hong Kong tower block fire,https://www.theguardian.com/world/2025/nov/26/bamboo-scaffolding-may-be-to-blame-for-spread-of-hong-kong-tower-block-fire
Guardian,"Taiwan plans extra $40bn in defence spending to counter China""s ""intensifying"" threats",https://www.theguardian.com/world/2025/nov/26/taiwan-extra-40bn-defence-spending-china-threat
Guardian,Nauru president accused in parliament of corruptly siphoning off millions of Australian funding,https://www.theguardian.com/australia-news/2025/nov/26/nauru-president-accused-in-parliament-of-corruption-siphoning-off-millions-of-australian-funding
Guardian,"Australia politics live: Turnbull says Coalition energy policy dictated by ""ideology and idiocy"" as Ley attacks Labor-Greens environment deal",https://www.theguardian.com/australia-news/live/2025/nov/27/australia-politics-live-barnaby-joyce-one-nation-pauline-hanson-environment-nature-bill-deal-coalition-greens-murray-watt-question-time-anthony-albanese-sussan-ley-ntwnfb
Guardian,Temperatures to stay up to 8C above average for Queensland and northern NSW into next week after storms wreak havoc,https://www.theguardian.com/australia-news/2025/nov/27/heatwave-queensland-nsw-temperatures-above-8c-average-after-storms
Guardian,"Lilie James victim of ""calculated premeditated killing"" by ex-boyfriend, coroner finds after inquest",https://www.theguardian.com/australia-news/2025/nov/27/lilie-james-inquest-calculated-premeditated-killing-by-ex-boyfriend-ntwnfb
Guardian,Nationals colleagues make last-ditch appeals as Barnaby Joyce expected to announce defection to One Nation,https://www.theguardian.com/australia-news/2025/nov/27/barnaby-joyce-nationals-defection-one-nation
Guardian,Australia shark attack: woman killed on NSW beach and man taken to hospital in critical condition,https://www.theguardian.com/environment/2025/nov/27/crowdy-beach-bay-shark-attack-nsw-mid-north-coast
Guardian,"Putin trying to negotiate an end to Ukraine war as he cannot win it on battlefield, says EU""s Kallas "" as it happened",https://www.theguardian.com/world/live/2025/nov/26/russia-ukraine-war-peace-plan-europe-latest-news-updates
Guardian,"Von der Leyen warns against ""carving up"" of Ukraine amid crunch US-led talks",https://www.theguardian.com/world/2025/nov/26/von-der-leyen-warns-against-carving-up-of-sovereign-european-nation-amid-crunch-ukraine-talks
Guardian,European parliament calls for social media ban on under-16s,https://www.theguardian.com/technology/2025/nov/26/social-media-ban-under-16s-european-parliament-resolution
Guardian,"As France prepares military expansion, how is Europe beefing up its armies?",https://www.theguardian.com/world/2025/nov/26/as-france-prepares-military-expansion-how-is-europe-beefing-up-its-armies
Guardian,"Can Europe prevent an unjust ""peace"" in Ukraine "" and what is at stake if it fails?",https://www.theguardian.com/world/2025/nov/26/this-is-europe-ukraine-peace-plan-russia-us
Guardian,Hundreds of Israeli soldiers raid Palestinian town in West Bank,https://www.theguardian.com/world/2025/nov/26/hundreds-israeli-soldiers-raid-palestinian-town-tubas-west-bank
Guardian,Bahrain to argue at UK supreme court it has immunity from surveillance claims,https://www.theguardian.com/world/2025/nov/26/bahrain-uk-supreme-court-immunity-surveillance-claims
Guardian,"Rebuilding ""human-made abyss"" in Gaza will cost at least $70bn, UN says",https://www.theguardian.com/world/2025/nov/25/rebuilding-human-made-abyss-gaza-un
Guardian,US and Israel-backed Gaza Humanitarian Foundation to end operations in territory,https://www.theguardian.com/world/2025/nov/24/us-and-israel-backed-gaza-humanitarian-foundation-to-end-operations-in-territory
Guardian,Questions for UK embassy in Tel Aviv over employee who owns home in illegal settlement,https://www.theguardian.com/world/2025/nov/24/questions-for-uk-embassy-in-tel-aviv-over-employee-who-owns-home-in-settlement
Guardian,Junta hails end to US protected status for Myanmar nationals,https://www.theguardian.com/world/2025/nov/26/myanmar-us-protected-status-removal
Guardian,"Taliban accuses Pakistan of killing 10 "" including nine children "" in strikes on Afghanistan",https://www.theguardian.com/world/2025/nov/25/taliban-accuses-pakistan-strikes-afghanistan
Guardian,"Dharmendra, Bollywood""s ""He Man"" and one of its most enduring stars, dies at 89",https://www.theguardian.com/world/2025/nov/24/dharmendra-bollywood-he-man-enduring-star-dies
Guardian,"Bhutan PM on leading the first carbon-negative nation: ""The wellbeing of our people is at the centre of our agenda""",https://www.theguardian.com/environment/2025/nov/18/bhutan-pm-tshering-tobgay-first-carbon-negative-nation-climate-wellbeing
Guardian,Ousted Bangladesh PM Sheikh Hasina sentenced to death for crimes against humanity,https://www.theguardian.com/world/2025/nov/17/ousted-bangladesh-pm-sheikh-hasina-found-guilty-of-crimes-against-humanity
Guardian,"£15,000 prize launched for writers from refugee and migrant backgrounds",https://www.theguardian.com/books/2025/nov/27/15000-prize-footnote-x-counterpoints-refugee-migrant
Guardian,"UK net migration predicted to drop to pre-Brexit levels, figures show",https://www.theguardian.com/uk-news/2025/nov/27/uk-net-migration-predicted-to-drop-to-pre-brexit-levels-figures-show
Guardian,"Severe asthma can be controlled by a monthly injection, trial finds",https://www.theguardian.com/society/2025/nov/26/severe-asthma-controlled-monthly-injection-tezepelumab-trial-finds
Guardian,"Rachel Reeves targets UK""s wealthiest in £26bn tax-raising budget",https://www.theguardian.com/uk-news/2025/nov/26/rachel-reeves-targets-uks-wealthiest-in-26bn-tax-raising-budget
Guardian,Is Farage right to claim that racism allegations are response to a dislike of his politics?,https://www.theguardian.com/politics/2025/nov/26/is-nigel-farage-claim-that-allegations-of-racism-are-a-response-to-a-dislike-of-his-politics-true
Guardian,"Washington DC shooting: suspect in attack on national guard members identified as Afghan national "" latest updates",https://www.theguardian.com/us-news/live/2025/nov/26/us-politics-latest-news-pete-hegseth-donald-trump-marjorie-taylor-greene-mark-kelly
Guardian,Police identify suspect in national guard shooting as Afghan man ,https://www.theguardian.com/us-news/2025/nov/26/washington-national-guard-shooting-suspect
Guardian, Two national guard members in critical condition after Washington DC shooting,https://www.theguardian.com/us-news/2025/nov/26/national-guard-soldiers-shot-washington-dc
Guardian,Shock and dismay after national guard troops shot near White House,https://www.theguardian.com/us-news/2025/nov/26/white-house-washington-national-guard
