Section,Headline,Link
9 News,'Terrible Pandora's box': Inside Amorosi's decade-long family disputean hour ago,https://9now.nine.com.au/60-minutes/vanessa-amorosi-breaks-her-silence-after-decadelong-family-dispute/3c4cf6de-8d61-47ca-8a26-bdaa51bec4ae
9 News,updateAlbanese meets with King Charles at Balmoral,https://www.9news.com.au/national/prime-minister-albanese-uk-visit-king/3a0b60ce-429c-4a20-8f54-794453459963
9 News,From 1967 to today: The events that have led to the UN retaliating against Iran,https://www.9news.com.au/world/un-nuclear-sanctions-iran-timeline/1b1b8ebd-fec6-4753-acdf-f896c6ac9afd
9 News,Man arrested after dramatic shopping centre chase with police in Perth's south,https://www.9news.com.au/national/perth-wa-man-arrested-supermarket/44e06065-c6e0-45fe-85d1-6fc785f6b625
9 News,Egyptian wrestler pulls 700-ton ship with his teeth,https://www.9news.com.au/world/ashraf-mahrous-egypt-guinness-world-record-pull-ship-teeth/40d0d59f-5816-4b87-8a95-004e4decd01b
9 News,'Ripped off': Calls for new inquest into beach town tragedy2 hours ago,https://9now.nine.com.au/60-minutes/ripped-off-calls-for-new-inquest-into-queensland-beach-town-tragedy/4d83319e-34e9-453e-9f72-634297ef7cbf
9 News,Tributes flow for 'loving' teen killed in targeted machete attack,https://www.9news.com.au/national/morwell-man-dies-after-altercation-the-boulevard-gippsland-victoria-news/19619ac3-cb6d-4755-9555-24ad9f322ede
9 News,Clive Palmer takes case against Australia to Switzerland's highest court,https://www.9news.com.au/national/clive-palmer-escalates-case-against-australian-government-to-switzerlands-federal-supreme-court/f733800a-8b16-4d92-9e0d-1dbbf6a6d132
9 News,Gunman on the run after shooting outside Melbourne shopping centre,https://www.9news.com.au/national/melbourne-broadmeadows-shopping-centre-man-shot/dbd19105-a1f0-4800-a4ac-0abc597d0a4b
9 News,Eight skydivers successfully left plane before crash that killed pilot,https://www.9news.com.au/national/moruya-plane-crash-nsw-australia/b00ac7ba-23aa-4d57-8930-af04e8c9851d
9 News,"UN imposes 'snapback' sanctions on a hungrier, poorer and more anxious Iran",https://www.9news.com.au/world/un-imposes-snapback-sanctions-on-a-hungrier-poorer-and-more-anxious-iran/4d5160f6-9196-42f4-92d8-913702719fd4
9 News,Man found dead in 'brutal and violent' attack at Brisbane shopping centre,https://www.9news.com.au/national/brisbane-homicide-manly-west-body-found-at-shopping-centre-queensland-news/d3fa1d74-e555-4c38-ad2c-93c4494963e3
9 News,Painting set to raise money for newborn intensive care stolen from gallery,https://www.9news.com.au/national/melbourne-cheltenham-painting-set-to-raise-money-for-newborn-intensive-care-stolen-from-art-gallery/db329f48-cf23-46a1-ab45-345a5ce7dfb8
9 News,Trump authorises 'full force if necessary' while sending troops to Portland,https://www.9news.com.au/world/trump-says-hes-sending-troops-to-portland-to-protect-ice-facilities/f917dbcd-1814-403c-8005-53fee6260bef
9 News,"Two dead, three injured after car crash on WA island",https://www.9news.com.au/national/perth-wedge-island-wa-crash/d8edc81f-b679-4e2d-815f-5031fed5014c
9 News,"Residents forced to evacuate, driver in hospital after car smashes into home at 3am",https://www.9news.com.au/national/adelaide-car-crash-clearview/8f6aee1a-fe50-475e-a4c4-9327a2eeec1e
9 News,Trump to meet with congressional leaders as government shutdown risk looms,https://www.9news.com.au/world/trump-to-meet-monday-with-top-four-congressional-leaders-as-government-shutdown-risk-looms/bde23d91-aa90-420a-9513-afe561a8e94b
9 News,Nine out of 10 Aussie drivers admit they drive while distracted,https://www.9news.com.au/national/australia-distracted-driving-survey/0bd22597-7c5f-442d-af51-7e41e20d93f2
9 News,Russian foreign minister delivers veiled warning at UN address,https://www.9news.com.au/world/russia-sergey-lavrov-war-nato-ukraine-united-nations/0294558a-7b31-4a1e-a338-1f9e7b99bd83
9 News,From 1967 to today: The events that have led to the UN retaliating against Iran,https://www.9news.com.au/world/un-nuclear-sanctions-iran-timeline/1b1b8ebd-fec6-4753-acdf-f896c6ac9afd
9 News,Man arrested after dramatic shopping centre chase with police in Perth's south,https://www.9news.com.au/national/perth-wa-man-arrested-supermarket/44e06065-c6e0-45fe-85d1-6fc785f6b625
9 News,Egyptian wrestler pulls 700-ton ship with his teeth,https://www.9news.com.au/world/ashraf-mahrous-egypt-guinness-world-record-pull-ship-teeth/40d0d59f-5816-4b87-8a95-004e4decd01b
9 News,TODAY IN HISTORYIncredibly lucky landing spot saves pilot shot in mid-air,https://www.9news.com.au/world/today-in-history-september-27-what-happened-on-this-day/9d02adee-f4ce-4af1-ba8d-bc6de5495fa4
9 News,Millions of Aussies to get a cash boost as Centrelink payments jump,https://www.9news.com.au/national/centrelink-payments-changes-2025-new-rates-september-20-everything-to-know-explained/7ad1411a-7f1e-4e0d-b1dd-c1dd45803dd6
9 News,Are shark attacks on the rise and what can we do to stop them?,https://www.9news.com.au/national/shark-attack-dee-why-update-what-happened-do-shark-nets-work-explainer/3f0a70c5-963b-447f-9e98-baf02fb2e5ed
9 News,It's magpie swooping season again. Here's how to avoid getting injured,https://www.9news.com.au/national/magpie-swooping-season-australia-how-to-avoid-everything-to-know-explained/1461d5a2-9e46-4cb7-9e6c-49569187b31c
9 News,'Appointed in error': Ref whacked amid Bledisloe flashpoints,https://www.nine.com.au/sport/rugby/bledisloe-cup-2025-all-blacks-wallabies-result-video-highlights-harry-potter-yellow-card-20250927-p5myd2.html
9 News,"This is not an apartment, just a wardrobe",https://www.domain.com.au/news/palatial-mansion-comes-with-a-wardrobe-the-size-of-a-home-1431977/
9 News,A Current AffairDoco tells story of school principal Malka Leifer's crimes,https://9now.nine.com.au/a-current-affair/malka-leifer-doumentary-surviving-malka-leifer-stan/881d4770-0218-4be9-aa00-41f184d97d7f
9 News,Driver cops massive fine after allegedly being caught doing 179km/h,https://www.9news.com.au/national/driver-cops-massive-fine-after-being-caught-speeding-in-south-australia-news/79ce5ff4-5f5e-4917-b31c-5a064da9aa06
9 News,Lions' second-half surge seals back-to-back flags,https://www.nine.com.au/sport/afl/grand-final-2025-brisbane-lions-defeat-geelong-cats-result-video-highlights-20250927-p5myd3.html
9 News,Former governor selling her long-held Palm Beach weekender for $10m,https://www.domain.com.au/news/dame-marie-bashir-selling-her-long-held-palm-beach-weekender-for-10m-1432214/
9 News,"Investigation as bodies of woman, 61, and man in his 60s found in NSW home",https://www.9news.com.au/national/coffs-harbour-nsw-two-bodies-found-boambee/28bdbbf5-4b08-4b28-af4b-35856410f179
9 News,A Current AffairSingle mother determined to beat dementia at just 29,https://9now.nine.com.au/a-current-affair/dementia-early-onset-mother/b9d84957-f976-4f00-b62b-c92918febbaf
9 News,ExclusiveWoman fighting for life after being hit by allegedly stolen car,https://www.9news.com.au/national/gold-coast-woman-fighting-for-life-after-being-hit-by-allegedly-stolen-car-runaway-bay/35c9abbb-5386-4606-a64a-93dce6157104
9 News,Luxury yacht with multimillion dollar price tag destroyed in inferno,https://www.9news.com.au/national/luxury-yacht-with-multimillion-dollar-price-tag-destroyed-in-inferno/edfd4bba-e60a-4569-8822-abef607f64d5
9 News,"Man, 54, dies after plane owned by skydiving business crashes",https://www.9news.com.au/national/moruya-plane-crash-man-dies-after-plane-owned-by-skydiving-business-crashes-on-nsw-far-south-coast/05d8a128-6b09-4c42-a5d8-6aae337eda8c
9 News,The sparse indictment of Comey by Trump's department belies a complicated backstory,https://www.9news.com.au/world/the-sparse-indictment-of-comey-by-trumps-justice-department-belies-a-complicated-backstory/fb5ad137-06a0-4768-900b-5be80ea40a9c
9 News,Danish defence ministry reports renewed drone sightings at military facilities,https://www.9news.com.au/world/danish-defense-ministry-reports-renewed-drone-sightings-at-military-facilities/d29cae3f-1072-4e77-b85e-3ef5ac749aea
9 News,Would you pay $715 a week to bump your head?,https://www.domain.com.au/news/would-you-pay-715-a-week-to-bump-your-head-1431971/?utm_source=9news.com.au&utm_medium=referral&utm_campaign=editorial-homepage-driver
9 News,US Financier accused of abusing women in soundproofed 'dungeon' in NYC penthouse,https://www.9news.com.au/world/financier-accused-of-abusing-women-in-soundproofed-dungeon-in-nyc-penthouse/f0597b2d-2535-4b85-8f16-93229c6ddbbd
9 News,"New Epstein files mention Elon Musk, Peter Thiel, top Trump aide Steve Bannon",https://www.9news.com.au/world/jeffrey-epstein-daily-schedules-elon-musk-peter-thiel-prince-andrew-steve-bannon-donald-trump-news/7c2f80ae-4772-4c11-88bf-eca4c8646b80
9 News,'Are you f---ing kidding me?': Kamala Harris vents at Donald Trump decision,https://www.9news.com.au/world/kamala-harris-james-comey-donald-trump-us-politics-news/b2707c48-a4fe-4e93-aaee-a296b70c85ac
9 News,Historic first awaiting Lions if they go back-to-back,https://www.nine.com.au/sport/afl/grand-final-2025-geelong-cats-brisbane-lions-date-start-time-team-lineups-entertainment-odds-umpires-everything-need-know-ultimate-guide/17f570d1-5c0d-429f-81ca-971bbfafa5ef
9 News,Selectors spill on star's Kangaroos hope after rugby reveal,https://www.nine.com.au/sport/nrl/news-2025-mark-nawaqanitawase-kangaroos-selection-kevin-walters-comments-andrew-johns-exclusive/f21a31e6-d2fc-4b1f-8637-bedb956ad605
9 News,'He actually rang me': Call that shocked Gal amid bitter feud,https://www.nine.com.au/sport/nrl/finals-news-2025-melbourne-storm-vs-cronulla-sharks-feud-paul-gallen-will-chambers-video-ronaldo-mulitalo-history-rivalry-exclusive/1381f748-a4bf-4357-b68b-c0da702c9bd4
9 News,Injury that had Alcaraz 'scared' in tournament debut,https://www.nine.com.au/sport/tennis/news-2025-carlos-alcaraz-injury-tokyo-open-debut/5ea0e480-d2e6-4f64-8ba8-c3573418139d
9 News,Joey questions 'gamble' as Keary poised to join Knights,https://www.nine.com.au/sport/nrl/news-2025-luke-keary-newcastle-knights-coaching-role-andrew-johns-exclusive-comments/3a061d06-1b7b-46cc-b722-1e6823cf19c8
9 News,Urgent review launched after star's freak death at 21,https://www.nine.com.au/sport/football/news-2025-former-arsenal-youth-player-billy-vigar-dies-brain-injury-during-soccer-game/116c4925-aecc-47d3-975b-03e1ef756429
9 News,Boxing 'shaken' as fighter dies days after losing fight,https://www.nine.com.au/sport/combat-sports/boxing-news-2025-ernest-akushey-death-eleven-days-after-loss/8a2d5b03-0f1d-4c95-a23c-541c961e7b08
9 News,How much rent should parents charge their children?,https://9now.nine.com.au/today/boarding-how-much-rent-should-adult-children-still-living-at-home-pay/adfa3e27-d241-4cbe-9223-165fd3437d1e
9 News,Today host startled by toothy baby crocodile live on air,https://9now.nine.com.au/today/tim-davies-baby-crocodile-surprise-wildlife-unleashed/ed60842c-1cd9-4f75-9fe0-24b3fc8258e2
9 News,Search for next James Bond gets interesting update,https://9now.nine.com.au/today/search-for-next-james-bond-update-and-other-entertainment-news-on-september-26/5849c323-e707-447f-a459-8966c7287695
9 News,How to plan your next holiday using AI,https://9now.nine.com.au/a-current-affair/holiday-planning-using-ai/c9ebbd38-357b-4090-946c-4746e25a8e6a
9 News,Nurse retires after 50 years on the wards,https://9now.nine.com.au/a-current-affair/nurse-sheryl-borradaile-retites-agfter-50-years/fb4f84be-f36c-4c4b-a40d-ad273a806638
9 News,Doco tells story of school principal Malka Leifer's crimes,https://9now.nine.com.au/a-current-affair/malka-leifer-doumentary-surviving-malka-leifer-stan/881d4770-0218-4be9-aa00-41f184d97d7f
9 News,'Terrible Pandora's box': Inside Amorosi's decade-long family dispute,https://9now.nine.com.au/60-minutes/vanessa-amorosi-breaks-her-silence-after-decadelong-family-dispute/3c4cf6de-8d61-47ca-8a26-bdaa51bec4ae
9 News,'Ripped off': Calls for new inquest into Queensland beach town tragedy,https://9now.nine.com.au/60-minutes/ripped-off-calls-for-new-inquest-into-queensland-beach-town-tragedy/4d83319e-34e9-453e-9f72-634297ef7cbf
9 News,'She deserves better': Grieving daughter's fight for justice after mother's murder,https://9now.nine.com.au/60-minutes/prabha-arunkumar-murder-sydney-parramatta-park-grieving-daughters-fight-for-justice/fca20ea5-e60d-40b6-afd3-048e5ad41c8f
9 News,Couple arrive home to find nasty note taped to their door,https://www.domain.com.au/news/couple-confronted-by-rude-note-eight-hours-after-picking-up-apartment-keys-1414069/?utm_source=nine.com.au&utm_medium=referral&utm_campaign=editorial-homepage-driver
9 News,The last affordable suburb in Sydney revealed,https://www.domain.com.au/news/girraween-the-closest-suburb-to-sydneys-cbd-for-under-1-million-is-24km-away-1408376/?utm_source=nine.com.au&utm_medium=referral&utm_campaign=editorial-homepage-driver
9 News,The unusual reason Peter bought this derelict cottage,https://www.domain.com.au/news/i-collected-it-peter-bought-this-run-down-riverside-nz-cottage-for-nostalgia-1414033/?utm_source=nine.com.au&utm_medium=referral&utm_campaign=editorial-homepage-driver
9 News,"Holden's worst-selling car wasn't the Camira, nor was it bad",https://www.drive.com.au/caradvice/holdens-worst-selling-car-wasnt-bad-it-was-the-holden-volt/?utm_source=nine-rail&utm_medium=referral
9 News,"Polestar 2 confirmed for second generation, without a name change",https://www.drive.com.au/news/polestar-2-confirmed-for-second-generation-without-a-name-change/?utm_source=nine-rail&utm_medium=referral
9 News,Toyota does not see the need in extending warranty because of Australian Consumer Law,https://www.drive.com.au/news/toyota-does-not-see-the-need-in-extending-warranty-because-of-australian-consumer-law/?utm_source=nine-rail&utm_medium=referral
9 News,'I just want him to come home': Daughter's plea after boat disappears26 minutes ago,https://www.9news.com.au/national/missing-yacht-heading-from-yamba-in-nsw-to-queensland-gold-coast-sparks-search/d2153c20-1dc1-4afb-a535-ebe64c2b677b
9 News,Police search for clues in mystery disappearancean hour ago,https://www.9news.com.au/videos/national/police-search-for-clues-in-mystery-disappearance/cmg3ku82e000m0hlbe0yheapl
9 News,'Terrible Pandora's box': Inside Amorosi's decade-long family disputean hour ago,https://9now.nine.com.au/60-minutes/vanessa-amorosi-breaks-her-silence-after-decadelong-family-dispute/3c4cf6de-8d61-47ca-8a26-bdaa51bec4ae
9 News,'Ripped off': Calls for new inquest into beach town tragedy2 hours ago,https://9now.nine.com.au/60-minutes/ripped-off-calls-for-new-inquest-into-queensland-beach-town-tragedy/4d83319e-34e9-453e-9f72-634297ef7cbf
9 News,Painting set to raise money for newborn intensive care stolen from gallery,https://www.9news.com.au/national/melbourne-cheltenham-painting-set-to-raise-money-for-newborn-intensive-care-stolen-from-art-gallery/db329f48-cf23-46a1-ab45-345a5ce7dfb8
9 News,Tributes flow for 'loving' teen killed in targeted machete attack,https://www.9news.com.au/national/morwell-man-dies-after-altercation-the-boulevard-gippsland-victoria-news/19619ac3-cb6d-4755-9555-24ad9f322ede
9 News,Gunman on the run after shooting outside Melbourne shopping centre,https://www.9news.com.au/national/melbourne-broadmeadows-shopping-centre-man-shot/dbd19105-a1f0-4800-a4ac-0abc597d0a4b
9 News,'One of the great redemption stories': Penrith reign ends as Brisbane seals dramatic comeback,https://www.nine.com.au/sport/nrl/news-2025-brisbane-broncos-v-penrith-panthers-result-highlights-deine-mariner-try-20250928-p5myiw.html
9 News,Man found dead in 'brutal and violent' attack at Brisbane shopping centre,https://www.9news.com.au/national/brisbane-homicide-manly-west-body-found-at-shopping-centre-queensland-news/d3fa1d74-e555-4c38-ad2c-93c4494963e3
9 News,Clive Palmer takes case against Australia to Switzerland's highest court,https://www.9news.com.au/national/clive-palmer-escalates-case-against-australian-government-to-switzerlands-federal-supreme-court/f733800a-8b16-4d92-9e0d-1dbbf6a6d132
Guardian,NoViolet Bulawayo wins the Best of Caine award,https://www.theguardian.com/books/2025/sep/27/noviolet-bulawayo-wins-the-best-of-caine-award
Guardian,"""A donkey cart out of El Fasher costs more than a new car"": how 500 days under siege is tearing the city apart",https://www.theguardian.com/global-development/2025/sep/27/el-fasher-darfur-sudan-rsf-donkey-cart-costs-more-than-a-car
Guardian,"World must deny Israel ""tools of genocide"", says growing alliance of activist states",https://www.theguardian.com/world/2025/sep/26/world-must-deny-israel-tools-of-genocide-says-growing-alliance-of-activist-states
Guardian,"Sarkozy says he will ""sleep in jail but with head held high"" after conviction",https://www.theguardian.com/world/2025/sep/25/nicolas-sarkozy-found-guilty-of-criminal-conspiracy-in-libya-trial
Guardian,"Malawi""s 85-year-old ex-leader returns to power in presidential election",https://www.theguardian.com/world/2025/sep/24/former-president-peter-mutharika-defeats-incumbent-in-malawi-presidential-election
Guardian,"Leaders of Mexican megachurch led a sprawling sex-trafficking enterprise, US prosecutors allege",https://www.theguardian.com/world/2025/sep/28/la-luz-del-mundo-church-sex-trafficking-conspiracy-charges
Guardian,"""It""s incredibly exciting"": ancient canoe unearthed after Hurricane Ian stormed through Florida",https://www.theguardian.com/us-news/2025/sep/28/florida-ancient-canoes
Guardian,"US revokes visa for Colombian president Gustavo Petro after ""reckless"" actions in New York",https://www.theguardian.com/us-news/2025/sep/27/us-revokes-visa-for-colombian-president-gustavo-petro-after-reckless-actions-in-new-york
Guardian,"Assata Shakur, an icon of Black liberation who was exiled to Cuba, dies aged 78",https://www.theguardian.com/us-news/2025/sep/26/assata-shakur-dies-aged-78
Guardian,Canada postal workers strike after government orders end to door-to-door delivery,https://www.theguardian.com/world/2025/sep/26/canada-postal-workers-strike
Guardian,"Super Typhoon Ragasa rampages through Taiwan, Hong Kong and southern China",https://www.theguardian.com/environment/2025/sep/26/super-typhoon-ragasa-rampages-through-taiwan-hong-kong-and-southern-china
Guardian,Trump signs executive order to transfer TikTok to US owners,https://www.theguardian.com/technology/2025/sep/25/trump-china-tiktok-deal
Guardian,"Opponents of Australia cutting emissions pointed to China""s lack of a target. That argument just got harder to make",https://www.theguardian.com/australia-news/2025/sep/26/china-first-emissions-reduction-target-announced-global-impact
Guardian,Taiwan convicts four former ruling party officials of spying for China,https://www.theguardian.com/world/2025/sep/25/taiwan-convicts-four-former-ruling-party-officials-of-spying-for-china
Guardian,Weakened Super Typhoon Ragasa heads towards Vietnam after battering China and Hong Kong,https://www.theguardian.com/world/2025/sep/25/weakened-super-typhoon-ragasa-heads-towards-vietnam-after-battering-china-and-hong-kong
Guardian,Albanese rallies behind Starmer saying Labour can fight back the rise of populist right,https://www.theguardian.com/australia-news/2025/sep/28/albanese-rallies-behind-starmer-saying-labour-can-fight-back-the-rise-of-populist-right
Guardian,Crisafulli insists on more shark nets to protect human lives despite trapped mother and baby whale,https://www.theguardian.com/australia-news/2025/sep/28/crisafulli-insists-on-more-shark-nets-to-protect-human-lives-despite-trapped-mother-and-baby-whale
Guardian,"Labor""s proposed FoI clampdown ""ripe"" for high court challenge, legal expert says",https://www.theguardian.com/australia-news/2025/sep/28/labors-proposed-foi-clampdown-ripe-for-high-court-challenge-legal-expert-says
Guardian,Clive Palmer banks on Swiss strategy after court throws out $305bn mine compensation claim,https://www.theguardian.com/australia-news/2025/sep/28/clive-palmer-banks-on-swiss-strategy-after-court-throws-out-305bn-mine-compensation-claim
Guardian,"Lions coach hails AFL grand final win as ""better than last year"" "" as it happened",https://www.theguardian.com/australia-news/live/2025/sep/28/australia-news-live-albanese-king-charles-afl-brisbane-coalition-liberals-western-australia-gst-queensland-nsw-victoria-labor-ntwnfb
Guardian,"Zelenskyy condemns ""vile"" and deadly Russian strikes on Ukraine; drones spotted over Danish military sites "" Europe live",https://www.theguardian.com/world/live/2025/sep/28/ukraine-russia-war-volodymyr-zelenskyy-vladimir-putin-nato-europe-latest-live-news-updates
Guardian,"Zelenskyy condemns Russia""s ""vile and brutal"" 12-hour bombardment of Ukraine",https://www.theguardian.com/world/2025/sep/28/hundreds-of-russian-missiles-and-drones-hit-ukraine-as-poland-scrambles-jets
Guardian,Moldova heads to polls in pivotal vote that could steer it closer to EU or Russia,https://www.theguardian.com/world/2025/sep/28/moldova-heads-to-the-polls-in-tense-vote-that-could-steer-country-closer-to-eu-or-russia
Guardian,"""You have to live"": Ukrainians on frontline practise normality despite Russian bombings",https://www.theguardian.com/news/ng-interactive/2025/sep/28/you-have-to-live-ukrainians-on-frontline-practice-normality-despite-russian-bombings
Guardian,Nato to step up vigilance in Baltic Sea region after drones spotted over military bases,https://www.theguardian.com/world/2025/sep/27/denmark-new-drone-sightings-biggest-military-base
Guardian,Iran angry as sweeping UN sanctions take effect after failure of nuclear talks,https://www.theguardian.com/world/2025/sep/28/sweeping-un-sanctions-on-iran-come-into-effect-after-nuclear-talks-fail
Guardian,Yvette Cooper suggests international community on brink of Gaza peace deal,https://www.theguardian.com/world/2025/sep/27/yvette-cooper-suggests-international-community-on-brink-of-gaza-peace-deal
Guardian,Family of British couple held in Iran say their health is deteriorating in prison,https://www.theguardian.com/world/2025/sep/27/family-of-british-couple-held-in-iran-say-their-health-is-deteriorating-in-prison
Guardian,State department appoints official to handle case of American-Palestinian teen detained by Israel,https://www.theguardian.com/world/2025/sep/27/mohammed-ibrahim-case-state-department
Guardian,Israeli strikes and shootings kill 57 as assault in Gaza City intensifies,https://www.theguardian.com/world/2025/sep/27/israeli-strikes-kill-people-gaza-city-attack
Guardian,At least 39 dead and more than 40 injured in crush at Vijay rally in India,https://www.theguardian.com/world/2025/sep/27/dead-and-injured-in-stampede-at-vijay-rally-in-india
Guardian,"Trump brags of ""massive"" oil deal in Pakistan "" but drilling has not found any",https://www.theguardian.com/world/2025/sep/27/pakistan-us-oil-deal-analysis-trump
Guardian,Ladakh statehood activist arrested days after violent crackdown by Modi,https://www.theguardian.com/world/2025/sep/26/activist-arrested-ladakh-crackdown-modi-sonam-wangchuk
Guardian,Protesters flood streets of Philippines over state corruption,https://www.theguardian.com/world/2025/sep/21/protests-philippines-corruption-state-flood
Guardian,British couple released after detention in Afghanistan say they feared being executed,https://www.theguardian.com/uk-news/2025/sep/21/british-couple-released-after-detention-in-afghanistan-say-they-feared-being-executed
Guardian,"Starmer calls Reform""s policy on immigration ""racist"" and says Farage""s party would ""tear country apart"" "" Labour conference live",https://www.theguardian.com/politics/live/2025/sep/28/labour-conference-keir-starmer-latest-uk-politics-news-live-updates
Guardian,"UK businesses fear new EHRC guidance on toilets will be ""unworkable""",https://www.theguardian.com/society/2025/sep/28/uk-businesses-fear-new-ehrc-guidance-on-toilets-will-be-unworkable
Guardian,"UK government urged to restore Electoral Commission""s independence to protect democracy",https://www.theguardian.com/politics/2025/sep/28/uk-government-urged-to-restore-electoral-commissions-independence-to-protect-democracy
Guardian,"Keir Starmer attacks ""racist"" Farage plan to deport people settled in the UK",https://www.theguardian.com/uk-news/2025/sep/28/keir-starmer-says-farage-plan-racist-deport-people-settled-in-the-uk
Guardian,"Populist threat to rule of law a danger to UK working class, says attorney general",https://www.theguardian.com/politics/2025/sep/28/labour-richard-hermer-attorney-general-populist-danger-rule-of-law-uk-working-class
Guardian,"Children left short of clean water and sleep amid ""prolonged"" detention by Ice, watchdog groups allege",https://www.theguardian.com/us-news/2025/sep/28/ice-detention-texas-children
Guardian,US set for largest mass resignation in history as Trump continues deep cuts,https://www.theguardian.com/us-news/2025/sep/28/us-mass-resignation-federal-workers
Guardian,Three dead in Arizona flooding as the Carolinas brace for possible hurricane,https://www.theguardian.com/us-news/2025/sep/27/arizona-flooding-carolinas-hurricane
Guardian,FBI arrest man who allegedly threatened to shoot people at Texas Pride parade,https://www.theguardian.com/us-news/2025/sep/27/fbi-arrest-man-texas-pride-parade
Guardian,"Donald Trump says he is deploying troops to Portland, Oregon",https://www.theguardian.com/us-news/2025/sep/27/portland-oregon-us-military-trump
ABC,"With the season on the line, Brisbane's biggest star stepped aside",https://www.abc.net.au/news/2025-09-28/adam-reynolds-reece-walsh-nrl-final-game-winning-moment/105828288
ABC,Colombian leader tells Trump to 'distance yourself from Hitler',https://www.abc.net.au/news/2025-09-28/colombian-president-us-visa-revoked/105827698
