Section,Headline,Link
ABC,Former home of Sydney rapper shot at in drive-by,https://www.abc.net.au/news/2025-09-14/merrylands-sydney-shooting-three-people-avoid-injury/105771760
ABC,FBI director Patel to face Congress amid missteps on Kirk assassination,https://www.abc.net.au/news/2025-09-14/kash-patel-faces-congressional-hearing/105771606
ABC,Reece Walsh grabs the Sun to win the NRL's battle of ice and fire,https://www.abc.net.au/news/2025-09-14/canberra-raiders-brisbane-broncos-nrl-finals-reece-walsh/105767838
ABC,"Ricky Hatton, world champion boxer, dies at age 46",https://www.abc.net.au/news/2025-09-14/boxer-ricky-hatton-dead-at-age-46/105772360
ABC,Belgians break Australian hearts in Davis Cup classic,https://www.abc.net.au/news/2025-09-14/tennis-de-minaur-australia-belgium-davis-cup-wrap/105772264
ABC,Reigning AFLW premiers North flex muscles in grand final rematch,https://www.abc.net.au/news/2025-09-14/aflw-round-5-sunday-wrap-kangaroos-beat-lions-gf-rematch/105771940
ABC,Crawford creates boxing history after downing Canelo in front of record crowd,https://www.abc.net.au/news/2025-09-14/boxing-terence-crawford-beats-canelo-alvarez-vegas-fight-result/105771950
ABC,Finding 'paradise' in the midst of devastating destruction,https://www.abc.net.au/news/2025-09-14/palestinian-couple-adopts-baby-who-survived-israeli-strike/105691626
ABC,Protesters gather at ABC in South Bank to mourn journalist deaths in Gaza,https://www.abc.net.au/news/2025-09-14/brisbane-protesters-shine-light-on-journalists-killed-in-gaza/105772016
ABC,Police hunt for occupants of stolen vehicle near Sunshine Coast,https://www.abc.net.au/news/2025-09-14/police-issue-pspa-as-search-for-fugitives-continues-in-glenview/105771868
ABC,Swift water rescue of man trapped for hours on ute tray in remote Tasmanian river,https://www.abc.net.au/news/2025-09-14/man-rescued-from-ute-submerged-in-arthur-river/105771954
ABC,'Totally integrated': Australia to join military forces with PNG,https://www.abc.net.au/news/2025-09-14/australia-and-png-defence-treaty-to-integrate-military-forces/105770088
ABC,Neale not abandoning grand final dream despite 'one per cent chance',https://www.abc.net.au/news/2025-09-14/afl-brisbane-lions-lachie-neale-50-per-cent-chance-gf/105771982
ABC,'White-hot anger' in the bush as Victorians take on Allan government,https://www.abc.net.au/news/2025-09-14/why-regional-victorians-are-angry-at-state-government/105761034
ABC,Charlie Kirk's accused killer awaits formal charges in Utah,https://www.abc.net.au/news/2025-09-14/tyler-robinson-awaits-formal-charges-over-charlie-kirk-murder/105771364
ABC,Australia's press gallery has a unique problem with its political coverage,https://www.abc.net.au/news/2025-09-14/australias-press-gallery-problem-with-political-coverage/105762464
ABC,"WA to introduce new public holidays, opposition worried about cost",https://www.abc.net.au/news/2025-09-14/wa-set-to-get-two-new-holidays-in-shake-up-of-public-holidays/105771652
ABC,"When speaking doesn't come easily, the consequences can be life altering",https://www.abc.net.au/news/2025-09-14/australias-speech-pathology-therapy-language-delay/105658306
ABC,Pressure mounts on Speakman after Liberals' Kiama loss,https://www.abc.net.au/news/2025-09-14/nsw-kiama-by-election-analysis/105768772
ABC,Victoria set to have first new national parks in more than a decade,https://www.abc.net.au/news/2025-09-14/victoria-set-to-have-three-new-national-parks/105762596
ABC,GMO ingredient concerns suspend fire ant treatment on organic farms,https://www.abc.net.au/news/rural/2025-09-14/fire-ant-treatment-suspended-organic-farm-certification-gmo/105767376
ABC,Why the answers to Europe's Russia issues could lie in their own backyards,https://www.abc.net.au/news/2025-09-14/drone-attack-on-poland-shows-europe-is-not-equiped-for-war/105769208
ABC,How a 'bone lady' helped bring closure to Daniel Morcombe's family,https://www.abc.net.au/news/2025-09-14/life-of-qld-police-forensic-anthropologist-donna-macgregor/105757258
ABC,Five things you can do to spring clean indoor plants,https://www.abc.net.au/news/2025-09-14/how-to-spring-clean-indoor-plants/105754044
ABC,How to watch the 77th primetime Emmys,https://www.abc.net.au/news/2025-09-14/how-to-watch-the-emmys-2025-primetime-awards-los-angeles/105751936
ABC,World-famous bee sanctuary under threat from destructive parasite,https://www.abc.net.au/news/2025-09-14/world-famous-bee-sanctuary-under-threat-from-parasite/105766650
ABC,Australia on alert as shot-hole borer wipes out thousands of trees,https://www.abc.net.au/news/2025-09-10/shot-hole-borer-tree-threat-australia/105740250
ABC,Friends combine finances to buy dream home together,https://www.abc.net.au/news/2025-09-10/homebuyers-turn-to-shared-ownership-in-property-market/105719548
ABC,'Jarring to have my experience dismissed': Women report low healthcare satisfaction,https://www.abc.net.au/news/2025-09-09/women-health-canberra-survey-access-affordability-not-serious/105748894
ABC,Government pledges $12b for AUKUS facility it expects will be used by US,https://www.abc.net.au/news/2025-09-13/albanese-announces-aukus-12-billion-dollar-defence-spend-perth/105770188
ABC,Far-right figures want to see shift away from Australia's 'legacy' politicians,https://www.abc.net.au/news/2025-09-13/what-next-for-far-right-john-macgowan/105735032
ABC,Trump and his 'good man' Albanese have more in common than you think,https://www.abc.net.au/news/2025-09-13/donald-trump-anthony-albanese-common/105756898
ABC,"Try again on religious discrimination laws, says Islamophobia envoy",https://www.abc.net.au/news/2025-09-12/islamophobia-envoy-wants-religious-discrimination-laws/105767918
ABC,"Trump threatens new sanctions on Russia, but has prerequisites for NATO",https://www.abc.net.au/news/2025-09-14/donald-trump-demands-nato-stop-all-russia-oil-imports/105771434
ABC,The Pacific won a stunning climate victory. What's next?,https://www.abc.net.au/news/2025-09-14/whats-next-after-pacific-icj-climate-victory/105747794
ABC,Fault lines form as Robert F Kennedy Jr's anti-vaccine agenda forges ahead,https://www.abc.net.au/news/2025-09-14/trump-health-chief-rfk-jr-divides-republicans-on-vaccines/105763060
ABC,Nepal authorities lift curfews after gen Z protests,https://www.abc.net.au/news/2025-09-13/nepal-authorities-lift-curfew-for-residents-in-kathmandu/105770846
ABC,More Australian consumers are falling for mimic shopping websites,https://www.abc.net.au/news/2025-09-12/clone-websites-retailers-catch-out-online-shoppers-scam/105736854
ABC,Regulator in gas leak 'scandal' had paid role with industry lobbyist,https://www.abc.net.au/news/2025-09-12/nt-regulator-oversight-gas-leak-scandal-paid-role-lobbyist/105752490
ABC,Growing group of Labor MPs urge 2035 emissions target above Climate Authority's floor,https://www.abc.net.au/news/2025-09-12/labor-mps-urge-2035-target-within-climate-authority-advice/105762592
ABC,"Supermarkets are collecting soft plastics again, as recycling trial expands",https://www.abc.net.au/news/science/2025-09-12/soft-plastics-recycling-woolworths-coles-aldi-trial/105756840
ABC,Hunt field goal seals Broncos heist after bunker controversially denies Raiders,https://www.abc.net.au/news/2025-09-14/nrl-live-updates-finals-canberra-raiders-brisbane-broncos/105767630
ABC,Inaugural Blue hopes for finals berth after hot start,https://www.abc.net.au/news/2025-09-14/with-a-few-added-pieces-carlton-have-flown-up-the-ladder-aflw/105770732
ABC,Steeplechaser stops to help struggling rival at World Athletics Champs,https://www.abc.net.au/news/2025-09-14/world-athletics-championships-steeplechase-tim-van-de-velde/105771466
ABC,Wallaroos' World Cup hopes dashed by dominant Canada,https://www.abc.net.au/news/2025-09-14/rugby-world-cup-wallaroos-canada-quarterfinal/105771382
ABC,Nourishing and easy sweet potato and lentil bowls,https://www.abc.net.au/news/2025-09-13/easy-roasted-sweet-potato-and-lentil-bowl/105643934
ABC,The simple system I use for composting,https://www.abc.net.au/news/2025-09-12/simple-system-use-for-composting/105648580
ABC,"Is the pink soap scum in my bathroom mould, or something else?",https://www.abc.net.au/news/2025-09-11/why-is-the-soap-scum-in-my-bathroom-pink-and-orange-/105721212
ABC,There is a high rate of suicide in construction. Here's what to look for,https://www.abc.net.au/news/2025-09-10/supporting-loved-ones-who-work-in-construction/105724124
ABC,Keio Yoshida's new book fights for more considered recognition of queer lives,https://www.abc.net.au/news/2025-09-13/keio-yoshida-pride-and-prejudices-queer-lives-and-the-law/105658412
ABC,Renowned NT artist becomes first Australian with solo Tate Modern show,https://www.abc.net.au/news/2025-09-14/emily-kam-kngwarray-nt-artist-solo-exhibition-tate-modern/105748722
ABC,How Big Thief turned loss into laughter on their new album,https://www.abc.net.au/news/2025-09-13/big-thief-double-infinity-adrianne-lenker-new-album-interview/105754728
ABC,Toni Jordan grew up at the greyhound track. It inspired her latest novel,https://www.abc.net.au/news/2025-09-12/toni-jordan-books-tenderfoot-interview/105754310
Sky News,"""Significant impact': The life and death of Charlie Kirk discussed",https://www.skynews.com.au/opinion/significant-impact-the-life-and-death-of-charlie-kirk-discussed/video/9cdf720d6f516fa413956e00d0022ea5
Sky News,Zali Steggall caught liking pro-political violence post,https://www.skynews.com.au/opinion/zali-steggall-caught-liking-propolitical-violence-post/video/669bc853356821af20f5a97fd0cf27aa
Sky News,"""Like a battle cry': Charlie Kirk's widow Erika promises his work will grow in strength",https://www.skynews.com.au/opinion/like-a-battle-cry-charlie-kirks-widow-erika-promises-his-work-will-grow-in-strength/video/7b0d8cbf8c3b80dba21bc922142fc22a
Sky News,"""We are in decline': Pauline Hanson hits out against immigration",https://www.skynews.com.au/opinion/we-are-in-decline-pauline-hanson-hits-out-against-immigration/video/33456b49ab84f16ffba051586ec00f4a
Sky News,"The media were ""always' going to come for Jacinta Price",https://www.skynews.com.au/opinion/paul-murray/the-media-were-always-going-to-come-for-jacinta-price/video/e980a6603098489d14ca28984acb096a
Sky News,"""Big protest action': Nearly one million hit UK streets against illegal immigration",https://www.skynews.com.au/opinion/paul-murray/big-protest-action-nearly-one-million-hit-uk-streets-against-illegal-immigration/video/dae8444c023a7e0f40aca42377ff63fe
Sky News,Charlie Kirk's alleged killer's disturbing brag revealed as Trump set to attend funeral,https://www.skynews.com.au/world-news/united-states/disturbing-previous-brag-of-charlie-kirks-alleged-killer-revealed-as-trump-plans-to-attend-funeral-of-slain-activist/news-story/9128d0d2c93c1c42aa10de17b7d102d0
Sky News,"Cops make big call after ""largest ever' tactical operation in hunt for accused police killer",https://www.skynews.com.au/australia-news/crime/dezi-freeman-search-cops-make-big-call-after-conducting-largest-ever-tactical-operation-in-hunt-for-accused-gunman/news-story/d4e975573719a9c4bfa87a4351e1c4c2
Sky News,"Allan to meet Chinese Ministers, seek backing for controversial rail loop",https://www.skynews.com.au/australia-news/politics/victorian-premier-jacinta-allan-to-meet-chinese-ministers-seek-backing-for-controversial-rail-loop-on-beijing-trip/news-story/57630f0005156d1f77ac5d3061952a35
Sky News,Ley unveils shadow cabinet reshuffle after sacking Jacinta Price from frontbench,https://www.skynews.com.au/australia-news/politics/opposition-leader-sussan-ley-unveils-cabinet-reshuffle-after-sacking-jacinta-nampijinpa-price-from-frontbench/news-story/506d73ad611016a6fce5632079538f93
Sky News,Teal MP backs away from controversial post on Charlie Kirk killing after backlash,https://www.skynews.com.au/australia-news/politics/teal-mp-zali-steggall-unlikes-controversial-social-media-post-on-charlie-kirk-killing-after-backlash/news-story/0cf4d2767dea2086abeccbd8d4d01259
Sky News,"Labor ""not focused' on GDP in defence spending decisions",https://www.skynews.com.au/australia-news/politics/labor-not-focused-on-gdp-in-defence-spending-decisions-ahead-of-prime-minister-anthony-albaneses-us-visit/news-story/bf4c758f6d024b5d55801d237cc04cd7
Sky News,Firearm found after Sunshine Coast suburb plunged into lockdown,https://www.skynews.com.au/australia-news/firearm-found-after-police-lockdown-area-in-sunshine-coast-amid-manhunt-for-armed-suspect-following-crash/news-story/9af51dd9df5953871a31658ed400325f
Sky News,Albanese forced to close office after years of protests,https://www.skynews.com.au/australia-news/politics/prime-minister-anthony-albanese-forced-to-relocate-grayndler-electorate-office-after-years-of-propalestine-protests/news-story/02efb3b61dbe5768e2ce09fbe9a14f21
Sky News,"Senior Liberal calls for party to ""move on' from Jacinta Price saga",https://www.skynews.com.au/australia-news/politics/shadow-health-minister-anne-ruston-urges-liberals-to-focus-on-issues-that-matter-as-party-slides-in-polls-amid-jacinta-nampijinpa-price-saga/news-story/bd336432d02f5374231bbb29c78ba8b3
Sky News,Perth's geostrategic role crucial as Australia counters China's Indo-Pacific assertiveness,https://www.skynews.com.au/australia-news/politics/defence-minister-richard-marles-highlights-perth-was-geostrategic-importance-amid-indopacific-tensions-with-china/news-story/3cc2ee01c13729c457d8847ab90baf2b
Sky News,Wake-up call for Australian economy as CEOs make stunning admission,https://www.skynews.com.au/business/finance/ceos-of-major-australian-companies-admit-investing-overseas-is-more-attractive-amid-challenging-business-conditions/news-story/4e1f4e810a0cfb9dd41644fe950a67a0
Sky News,"Defence Minister reveals ""positive sentiment' in Trump administration over AUKUS deal",https://www.skynews.com.au/australia-news/politics/defence-minister-richard-marles-confirms-positive-sentiment-in-trump-administration-surrounding-aukus-deal/news-story/14c6eaf45c6038aaac512f1e7f70f390
Sky News,"Albanese poised for Trump talks in New York, steering clear of White House",https://www.skynews.com.au/australia-news/politics/prime-minister-anthony-albanese-likely-to-meet-donald-trump-in-new-york-during-un-general-assembly-trip/news-story/e8ffa9916461056c84bb911b47d71163
Sky News,Albanese invests $12bn in submarine base upgrades ahead of US trip,https://www.skynews.com.au/australia-news/politics/albanese-government-announces-12-billion-to-upgrade-henderson-submarine-base-amid-aukus-push-and-ghost-shark-rollout/news-story/3ae845730251644068fce8a4624213a5
Sky News,Labor wins Kiama in NSW by-election,https://www.skynews.com.au/australia-news/politics/labor-wins-kiama-in-nsw-byelection-putting-state-opposition-leader-mark-speakman-under-pressure/news-story/9e9b337852cee63b6ff9bf0be26c9649
Sky News,"Charlie Kirk's brutal murder exposed far-left problem in Australian media, politics",https://www.skynews.com.au/insights-and-analysis/charlie-kirks-brutal-murder-exposed-a-farleft-problem-in-australias-media-and-politics-that-is-only-getting-worse/news-story/f225416435429d93af1a7b81d0e4705b
Sky News,"Core problem in Victoria's Indigenous Treaty a ""sad' indictment of modern Australia",https://www.skynews.com.au/insights-and-analysis/allan-governments-treaty-drives-a-wedge-between-indigenous-and-nonindigenous-victorians-marking-a-sad-development-for-modern-australia/news-story/5bbe6242f02fcc8f15a5c85fdc731de1
Sky News,The smarter path Ley could have taken to discipline Price,https://www.skynews.com.au/insights-and-analysis/sussan-ley-could-have-taken-a-smarter-path-to-disciplining-jacinta-price-without-booting-her-from-the-frontbench/news-story/ce431fc1cc5a56743a422e56b357c782
Sky News,Russian drone incursion over Poland a warning to NATO: expert,https://www.skynews.com.au/world-news/global-affairs/target-practice-russian-drone-incursion-over-poland-was-deliberate-test-and-warning-to-nato-expert-says/news-story/390f261dbb2a3f930b534e5f34389de9
Sky News,Joe Rogan left speechless as Charlie Kirk assassination confirmed on his show,https://www.skynews.com.au/world-news/united-states/joe-rogan-and-charlie-sheen-left-stunned-after-learning-of-charlie-kirks-fatal-shooting-during-podcast-recording/news-story/3d814d67b4cabf8555e8cdcf669a8708
Sky News,Charlie Kirk's alleged killer's disturbing brag revealed as Trump set to attend funeral,https://www.skynews.com.au/world-news/united-states/disturbing-previous-brag-of-charlie-kirks-alleged-killer-revealed-as-trump-plans-to-attend-funeral-of-slain-activist/news-story/9128d0d2c93c1c42aa10de17b7d102d0
Sky News,Fresh details emerge about private life of Charlie Kirk's alleged assassin,https://www.skynews.com.au/world-news/united-states/fresh-details-emerge-on-charlie-kirks-alleged-assassin-who-sources-claim-lived-with-transgender-partner-in-utah/news-story/8ab45cd2ac8bd537ade91cb0d0aaef27
Sky News,"Stephen King forced into apology after ""heinous' Charlie Kirk comments",https://www.skynews.com.au/world-news/united-states/the-bestselling-author-faced-a-furious-backlash-after-suggesting-the-murdered-commentator-supported-violence-against-gay-people/news-story/36972862b45349b05349dd64dd89af08
Sky News,"""You have no idea what you unleashed': Charlie Kirk's wife speaks out for first time",https://www.skynews.com.au/world-news/united-states/watch-live-charlie-kirks-wife-speaks-for-first-time-since-his-assassination/news-story/61c9abf3efc670ee42000b9db229f95a
Sky News,Tyler Robinson's eerie Discord messages revealed following Charlie Kirk's assassination,https://www.skynews.com.au/world-news/united-states/tyler-robinsons-eerie-discord-messages-revealed-as-charlie-kirks-assassination-declared-wakeup-call-for-australia/news-story/366c55908db87dcff6ceef87ac4d43b1
Sky News,What we know so far about Charlie Kirk's alleged assassin as more details emerge,https://www.skynews.com.au/world-news/united-states/what-we-know-so-far-about-charlie-kirks-alleged-assassin-tyler-robinson-as-more-details-emerge-about-the-22yearold/news-story/fb067f113b4c3c911d3750bd3ca55129
Sky News,EXCLUSIVE: Megyn Kelly concerned for her safety after Charlie Kirk assassination,https://www.skynews.com.au/opinion/paul-murray/exclusive-megyn-kelly-concerned-for-her-safety-after-charlie-kirk-assassination/video/80405fde9213d8786860401ccc2af1be
Sky News,"""He was a uniter': Kirk's assassination a reflection of ""serious sickness' within US",https://www.skynews.com.au/opinion/sharri-markson/he-was-a-uniter-kirks-assassination-a-reflection-of-serious-sickness-within-us/video/34d650fcaf85feca5a23a7c235fe47eb
Sky News,"""So much for women': Jacinta Price's axing exposes deep division in Coalition",https://www.skynews.com.au/opinion/peta-credlin/so-much-for-women-jacinta-prices-axing-exposes-deep-division-in-coalition/video/e93d01c977dd6d92e51b5a5858bd8b3e
Sky News,The Sunday Showdown | 14 September,https://www.skynews.com.au/stream/opinion-programs/the-sunday-showdown/the-sunday-showdown-14-september/video/30f2f704d0dfd840d838641e763643d5
Sky News,Danica & James | 14 September,https://www.skynews.com.au/stream/opinion-programs/danica-and-james/danica-james-14-september/video/fcc5f31bdfb988d1e101051096b61341
Sky News,Freya Fires Up | 14 September,https://www.skynews.com.au/stream/opinion-programs/freya-fires-up/freya-fires-up-14-september/video/30cfca6018e2bca9217220c748ffeffa
Sky News,Outsiders | 14 September,https://www.skynews.com.au/stream/opinion-programs/outsiders/outsiders-14-september/video/6d25d9a18435f1b1518c09ee13e58bc8
Sky News,Danica De Giorgio | 12 September,https://www.skynews.com.au/stream/opinion-programs/danica-de-giorgio/danica-de-giorgio-12-september/video/997da633ad4030802f8cd49f8b665e64
Sky News,Steve Price | 12 September,https://www.skynews.com.au/stream/opinion-programs/steve-price/steve-price-12-september/video/357819e5945d8d6a10510d3ae5a5deaa
Sky News,The World According to Rowan Dean | 12 September,https://www.skynews.com.au/stream/opinion-programs/the-world-according-to-rowan-dean/the-world-according-to-rowan-dean-12-september/video/43d856bacd2613ac616bbca865233cd8
Sky News,Wake-up call for Australian economy as CEOs make stunning admission,https://www.skynews.com.au/business/finance/ceos-of-major-australian-companies-admit-investing-overseas-is-more-attractive-amid-challenging-business-conditions/news-story/4e1f4e810a0cfb9dd41644fe950a67a0
Sky News,Labor approves controversial North West Shelf project,https://www.skynews.com.au/business/energy/environment-minister-murray-watt-approves-extending-woodsides-controversial-north-west-shelf-project-to-2070-with-48-conditions/news-story/29397312995d8fa04d4073e45ab2150f
Sky News,Former Virgin Australia CEO reaps $50m payday after leaving airline,https://www.skynews.com.au/business/finance/former-virgin-australia-chief-executive-officer-jayne-hrdlicka-reaps-50m-windfall-after-leaving-the-airline/news-story/0656d8767c509c92a6ab8c0045455fbc
Sky News,Aussie stocks jump after Wall Street hits record highs,https://www.skynews.com.au/business/markets/asx-200-soars-after-major-wall-street-indexes-hit-record-highs-on-rate-cut-hopes/news-story/faca269bb07b17d1f0d8428fe1f3a92f
Sky News,"""Brave face': Chinese car makers dominate European competitors at major car show",https://www.skynews.com.au/business/tech-and-innovation/european-car-makers-put-on-brave-face-against-dominant-chinese-competitors-at-2025-international-motor-show-germany/news-story/0620f1097ec17b80a1f235a86fc36b49
Sky News,"""Oh hell no': Brisbane comic dives into city's ""terrifying' pool",https://www.skynews.com.au/lifestyle/christian-hull-finally-takes-the-plunge-at-27storeyhigh-infinity-pool-as-social-media-erupts-in-fear-and-fascination/news-story/37139df9a9d79d4b77b84a2ba9f50937
Sky News,Shocking rise of home insurance costs hurts struggling Australians,https://www.skynews.com.au/business/finance/home-and-contents-insurance-premiums-skyrocket-upwards-of-700-over-past-year-fresh-canstar-research-shows/news-story/149e446e5925b94c232961f388b8fbac
Sky News,"Another bank slashes jobs as sector faces a ""tidal wave of cuts'",https://www.skynews.com.au/business/finance/bendigo-bank-cuts-158-jobs-after-anz-nab-bank-of-queensland-slashed-roles-as-the-sector-faces-a-tidal-wave-of-cuts/news-story/7642f96cc7ee23474f058a582dea1918
Sky News,Elon Musk briefly dethroned as the world's richest man,https://www.skynews.com.au/business/markets/elon-musk-briefly-dethroned-as-worlds-richest-man-by-oracles-larry-ellison-after-massive-deal-with-chatgptmaker-openai/news-story/4f815572254a47fc47f0137ad6066e88
Sky News,Prince Harry seeks royal reset after meeting King Charles,https://www.skynews.com.au/lifestyle/celebrity-life/insiders-say-prince-harry-regrets-some-of-his-past-actions-and-hopes-to-build-bridges-with-both-the-public-and-the-monarchy/news-story/c67344c801f09d982862678d358bf5ca
Sky News,"""Call the cops': Why these simple photos of taxis have enraged social media",https://www.skynews.com.au/lifestyle/trending/silver-top-taxis-allegedly-parked-illegally-at-sydneys-westmead-hospital-as-drivers-threaten-violence-fuels-rage-on-social-media/news-story/22a3df2a4da625f3235835c688e3b072
Sky News,Heartbreaking detail about Harry and Charles summit,https://www.skynews.com.au/lifestyle/celebrity-life/prince-harry-reportedly-showed-up-to-king-charles-summit-armed-with-photos-of-prince-archie-and-princess-lilibet/news-story/1f4507ec4be2fa439d033eda55dae085
Sky News,Dementia revealed to be Australia's deadliest illness,https://www.skynews.com.au/lifestyle/health/more-than-17000-australians-died-of-dementia-last-year-as-new-report-warns-cases-will-climb-to-one-million-within-four-decades/news-story/84630fb471db447e3626516dfa460f86
Sky News,"""I stand by everything': Piers fires back at Harry and Meghan",https://www.skynews.com.au/lifestyle/celebrity-life/hes-kept-the-royal-titles-so-he-can-continue-making-money-piers-morgans-shock-onair-rant-over-prince-harry-after-his-infamous-meghan-comments-on-good-morning-britain/news-story/11bd5b046dbfcda67a2ddbfee76f9171
Sky News,"Kate's clear ""message' in cold war between Prince William, Prince Harry",https://www.skynews.com.au/lifestyle/celebrity-life/not-a-random-choice-princess-catherine-sends-very-clear-message-to-prince-harry-meghan-markle-after-breakthrough-king-charles-meeting/news-story/cb03a9fc2fce68023be02f4938b3750d
Sky News,Married At First Sight star dies suddenly at 47,https://www.skynews.com.au/lifestyle/celebrity-life/married-at-first-sight-star-lachlan-rofe-dead-at-age-47-after-spending-final-years-on-nsw-farm-out-of-limelight/news-story/4e3e81c711b7507553f84c506e17bc5a
Sky News,Greta Thunberg's sister distances herself from climate activist,https://www.skynews.com.au/lifestyle/celebrity-life/greta-thunbergs-sister-beata-ernman-quietly-distances-herself-from-climate-activist-after-name-change/news-story/df63c011852c902ba0f66ac6eda03a0e
Sky News,Today's News Headlines: Government commits $12b to defence precinct,https://www.skynews.com.au/australia-news/todays-news-headlines-government-commits-12b-to-defence-precinct/video/888471099bb1eedd86cf2a90a59132fb
Sky News,Albanese announces $12 billion for defence precinct in WA,https://www.skynews.com.au/australia-news/politics/albanese-announces-12-billion-for-defence-precinct-in-wa/video/5db41acdf9c0c74e6118d44f4c3df2ae
Sky News,Today's News Headlines: Shots fired at a house in Sydney's west,https://www.skynews.com.au/australia-news/todays-news-headlines-shots-fired-at-a-house-in-sydneys-west/video/fb051d661a92a6cc0c9adcc0abff81b8
Sky News,Sussan Ley reshuffles shadow cabinet after sacking of Jacinta Price,https://www.skynews.com.au/australia-news/politics/sussan-ley-reshuffles-shadow-cabinet-after-sacking-of-jacinta-price/video/107c759bb63a3aa12d465de68c9edbe2
