Section,Headline,Link
ABC,"Weekend brings fire threat to NSW, with maximums to hit 44C",https://www.abc.net.au/news/2026-01-10/australia-weather-weekend-fire-threat-nsw-possible-cyclone-qld/106214346
ABC,North Queensland braces for tropical cyclone likely to form today,https://www.abc.net.au/news/2026-01-10/queensland-tropical-low-expected-to-intensify-into-cyclone-koji/106213662
ABC,The rhetoric of the Trump administration has taken a chilling turn,https://www.abc.net.au/news/2026-01-10/trump-power-venezuela-greenland-international-law-morality/106214406
ABC,Mums who drank during pregnancy call for universal alcohol warnings,https://www.abc.net.au/news/2026-01-10/mums-drank-pregnancy-alcohol-warning-labels/106154908
ABC,'Rich have become poor': Venezuelans describe their daily struggle,https://www.abc.net.au/news/2026-01-10/inside-venezuela-daily-struggle-continues-in-caracas/106215776
ABC,Iran's leader accuses protesters of trying to 'please' Trump,https://www.abc.net.au/news/2026-01-10/iranian-leader-defiant-amid-nationwide-protests/106215570
ABC,Elon Musk limits X's AI image generator over non-consensual sexual imagery,https://www.abc.net.au/news/2026-01-10/grok-ai-undressing-australia-women-children/106213644
ABC,The Korean Wave may splash back into China amid thawing ties,https://www.abc.net.au/news/2026-01-10/china-ban-south-korean-pop-culture-could-lift-amid-warmer-ties/106205780
ABC,A Tasmanian council built a wall. It hasn't gone down well,https://www.abc.net.au/news/2026-01-10/wall-blocking-views-on-strahan-waterfront-ridiculed/106209782
ABC,PFAS to perfection: The story behind regional NT town's 'designer' water,https://www.abc.net.au/news/2026-01-10/katherine-pfas-australia-best-drinking-water/106184842
ABC,'Chain of errors' contributed to woman's death after routine surgery: coroner,https://www.abc.net.au/news/2026-01-10/nt-inquest-indigenous-woman-died-at-royal-darwin-hospital-rdh/106214552
ABC,The Bondi royal commission is due to report in April. Here's what we know,https://www.abc.net.au/news/2026-01-10/nsw-bondi-beach-terror-attack-royal-commission-explainer/106214222
ABC,Hollywood-backed Wrexham knocks Premier League side out of FA Cup,https://www.abc.net.au/news/2026-01-10/fa-cup-wrexham-beats-nottingham-forest-on-penalties/106216130
ABC,'Terrible job to cuddle baby wombats': Behind the scenes as a wildlife carer,https://www.abc.net.au/news/2026-01-10/behind-the-scenes-wildlife-carer-need-for-more-volunteers/106197866
ABC,Aussies exit United Cup and Poland advances to semis,https://www.abc.net.au/news/2026-01-10/united-cup-australia-loses-to-poland-in-quarterfinals/106215862
ABC,Sabalenka defeats Keys in Australian Open final re-match,https://www.abc.net.au/news/2026-01-10/brisbane-international-aryna-sabalenka-defeats-madison-keys/106215886
ABC,Donald Trump withdraws the US from 66 international organisations,https://www.abc.net.au/news/2026-01-09/us-withdrawal-trump-united-nations-organisations/106210134
ABC,"In Greenland, Trump's talk of annexation is stirring up a dark past",https://www.abc.net.au/news/2026-01-09/donald-trump-greenland-denmark-nato-comments-worrying-island/106210090
ABC,NSW SES to allow people to volunteer for a day when disaster strikes,https://www.abc.net.au/news/2026-01-10/nsw-ses-embraces-spontaneous-volunteering-from-mud-armies/106148252
ABC,Australia's population forecast to reach 28 million this year,https://www.abc.net.au/news/2026-01-09/australias-population-to-reach-28-million-in-2026/106213420
ABC,The Queensland town taking heat out of the global AI industry,https://www.abc.net.au/news/2026-01-10/alpha-hpa-gladstone-high-purity-alumina-ai/106213676
ABC,NSW premier responds to undeclared donation allegations,https://www.abc.net.au/news/2026-01-09/nsw-chris-minns-responds-to-undeclared-donation-allegations/106213922
ABC,Philippines landfill collapse kills at least one person with dozens missing,https://www.abc.net.au/news/2026-01-09/philippines-landfill-collapse/106215352
ABC,Palestinian author calls for apology as dozens quit Adelaide Writers' Week,https://www.abc.net.au/news/2026-01-09/sa-palestinian-author-calls-for-apology-over-writers-week-axing/106212878
ABC,NT pokies clubs claiming members' perks as giving back to the community,https://www.abc.net.au/news/2026-01-09/nt-pokies-community-contributions-member-perks-renovations-foi/106084120
ABC,Teenage girl sexually assaulted and pregnant while in state care,https://www.abc.net.au/news/2026-01-06/13-year-old-pregnant-sexual-assaults-state-residential-care/105980432
ABC,Patient says 'traumatising' hospital care deepened her mental health crisis,https://www.abc.net.au/news/2026-01-05/patient-traumatising-hospital-care-act-crisis/106157462
ABC,Katherine may have 700 half-siblings. She's trying to find them to pass on medical advice,https://www.abc.net.au/news/2026-01-05/national-donor-conception-register-for-key-information-call/106188336
ABC,Calling a royal commission is just the start of Albanese's leadership test,https://www.abc.net.au/news/2026-01-09/bondi-royal-commission-test-albanese-leadership/106213854
ABC,NSW scraps its royal commission after PM announces federal antisemitism inquiry — as it happened,https://www.abc.net.au/news/2026-01-08/live-blog-albanese-antisemitism-royal-commission/106205802
ABC,Former High Court justice to lead Bondi royal commission,https://www.abc.net.au/news/2026-01-08/albanese-bell-royal-commission-antisemitism-bondi/106210052
ABC,PM's possible pick to lead Bondi royal commission sparks pushback,https://www.abc.net.au/news/2026-01-08/bondi-attack-royal-commission-albanese-pick-pushback/106209204
ABC,"Russia hits Ukraine with hypersonic missile, Qatari embassy damaged",https://www.abc.net.au/news/2026-01-09/russia-says-it-hit-ukraine-with-oreshnik-hypersonic-missile/106214842
ABC,Trump warns Iran will 'pay hell' if protesters are killed amid internet outage,https://www.abc.net.au/news/2026-01-09/internet-blackout-imposed-in-iran-amid-nationwide-protests/106213246
ABC,Diana received a tip to flee Venezuela. She was on a list to be arrested,https://www.abc.net.au/news/2026-01-09/nicolas-maduros-regime-came-for-these-women-who-fled-to-colombia/106207412
ABC,Alleged cybercrime 'mastermind' goes from billionaire to black bag over the head,https://www.abc.net.au/news/2026-01-09/accused-scam-kingpin-chen-zhi-extradited-china-cambodia/106213664
ABC,"Rio Tinto stock tumbles on mega merger talks, dragging down ASX  — as it happened",https://www.abc.net.au/news/2026-01-09/asx-markets-business-live-news-jan-2025-9/106212732
ABC,'How rude can I be?' RBA deputy gets candid on inflation and rates,https://www.abc.net.au/news/2026-01-09/rba-deputy-governor-andrew-hauser-interest-rates-inflation-janda/106210128
ABC,Rio Tinto in merger talks with Glencore but total takeover not the only option,https://www.abc.net.au/news/2026-01-09/rio-tinto-in-talks-to-take-over-glencore-mega-miner-merger/106213252
ABC,"'Let's be clear, it's too high': RBA deputy downplays easing inflation",https://www.abc.net.au/news/2026-01-08/rba-deputy-andrew-hauser-inflation-interest-rates/106208716
ABC,Kyrgios says he will not be seeking an Aus Open wildcard,https://www.abc.net.au/news/2026-01-09/kyrgios-says-he-will-not-be-seeking-an-aus-open-wildcard/106213610
ABC,Joint gets Barty's backing with teenager's Aus Open milestone confirmed,https://www.abc.net.au/news/2026-01-09/joint-gets-barty-s-backing-ahead-of-aus-open-seeding/106212664
ABC,Martinelli apologises for 'disgraceful' act towards injured Liverpool player,https://www.abc.net.au/news/2026-01-09/martinelli-disgraceful-act-towards-injured-liverpool-player/106213400
ABC,'Our world changed': Matildas star returns home to face family tragedy,https://www.abc.net.au/news/2026-01-09/matildas-star-cooney-cross-returns-home-to-face-family-tragedy/106212710
ABC,How to avoid fly and maggot infestations in your home,https://www.abc.net.au/news/2026-01-07/how-to-reduce-flies-maggots-at-home/105941190
ABC,"Pastas, curries and tray bakes: Your favourite recipes of 2025",https://www.abc.net.au/news/2026-01-05/your-favourite-recipes-of-2025/106091718
ABC,Experts weigh in on the butter versus margarine debate,https://www.abc.net.au/news/2026-01-04/butter-margarine-nut-spreads-which-is-best/106010740
ABC,Reading goals that are good for your brain,https://www.abc.net.au/news/2026-01-03/how-to-read-more-in-the-new-year/105977668
ABC,"With five Emmys and two Golden Globes noms, everyone's loving The Pitt",https://www.abc.net.au/news/2026-01-09/the-pitt-noah-wyle-er-r-scott-gemmill-john-wells/106118716
ABC,It's never too late to learn a musical instrument (or how to sing),https://www.abc.net.au/news/2026-01-09/top-tips-for-learning-a-musical-instrument-or-taking-up-singing/106206612
ABC,Authors withdraw from festival after Palestinian Australian author dropped,https://www.abc.net.au/news/2026-01-08/randa-abdel-fattah-adelaide-writers-week-axed-authors-withdraw/106210464
ABC,The best movies and TV series you can watch now — no fee required,https://www.abc.net.au/news/2026-01-08/free-movies-free-tv-watch-online/106207308
Sky News,"Anthony Albanese ""smiled for the cameras' after announcing Royal Commission",https://www.skynews.com.au/opinion/anthony-albanese-smiled-for-the-cameras-after-announcing-royal-commission/video/01311367ed6a64e95ea1cf9897d36923
Sky News,"The West's ""enemies' are buckling worldwide as critics continue to complain about Trump",https://www.skynews.com.au/opinion/the-wests-enemies-are-buckling-worldwide-as-critics-continue-to-complain-about-trump/video/6fb3e46f24da94f0c869c6bbf994b9ad
Sky News,Internet erupts as hilarious Marco Rubio job memes circulate online,https://www.skynews.com.au/opinion/internet-erupts-as-hilarious-marco-rubio-job-memes-circulate-online/video/1b7160af1239b3f19aae3201a07ff58c
Sky News,"""He's happy to watch America burn': Tim Walz battered for ""not standing with law and order'",https://www.skynews.com.au/opinion/hes-happy-to-watch-america-burn-tim-walz-battered-for-not-standing-with-law-and-order/video/85ecc7c4477d65ac50dd4d41a792bbf6
Sky News,"""Tough questions to be answered': Royal Commission must examine domestic radicalisation",https://www.skynews.com.au/opinion/tough-questions-to-be-answered-royal-commission-must-examine-domestic-radicalisation/video/c5aa839027311db8fbfd43ce1a72ec83
Sky News,"""Truly extraordinary numbers': One Nation draws level with Coalition in new polling",https://www.skynews.com.au/opinion/truly-extraordinary-numbers-one-nation-draws-level-with-coalition-in-new-polling/video/6b3fb624b0f70fb5687c63b789cbaf59
Sky News,"Major update on three missing in Victorian fires, as communities ""obliterated'",https://www.skynews.com.au/australia-news/weather/you-are-in-danger-dire-warnings-issued-as-victorian-bushfires-rage-out-of-control-amid-catastrophic-fire-conditions/news-story/13c7608495f3040b9485bc5d8b30fafe
Sky News,"Sydney set for ""hottest day in eight years' as temperatures soar past 40C",https://www.skynews.com.au/australia-news/weather/sydney-set-for-hottest-day-in-eight-years-on-saturday-as-temperatures-soar-past-40c/news-story/99e8a39fe0b3f1f7c4e999bf45daf681
Sky News,Labor's under-16 social media ban under fire as children remain online,https://www.skynews.com.au/australia-news/politics/labors-under16-social-media-ban-under-fire-as-children-remain-online-a-month-on/news-story/124d184a875c19cbfa7b4a295f069bcc
Sky News,Popular household item pulled from Kmart shelves amid serious health risks,https://www.skynews.com.au/lifestyle/health/popular-household-item-pulled-from-kmart-shelves-amid-serious-health-risk-warnings/news-story/53034824e8ae48e55f83242bffe8931a
Sky News,"""Attacking philosophy': PM under fire for not including radical Islam as key Royal Commission focus",https://www.skynews.com.au/australia-news/politics/attacking-philosophy-anthony-albanese-under-fire-for-not-including-radical-islam-as-key-focus-of-royal-commission/news-story/87c058b13dbb7ef985276477754c7e09
Sky News,Kendall Jenner breaks her silence after years of sexuality speculation,https://www.skynews.com.au/lifestyle/celebrity-life/after-years-of-online-speculation-kendall-jenner-finally-opens-up-about-her-sexuality/news-story/44a15a3b9834dbb6d1b5d09fc355469f
Sky News,All the evidence that betrays PM's claim he hasn't played politics over Bondi tragedy,https://www.skynews.com.au/insights-and-analysis/inside-the-mountain-of-evidence-that-betrays-anthony-albaneses-claim-he-hasnt-played-politics-over-bondi-beach-tragedy/news-story/a19ae51403dc60d286a4347a1282fd22
Sky News,Inside Prince Harry's ring of steel after he scoops taxpayer-paid security,https://www.skynews.com.au/insights-and-analysis/prince-harrys-ring-of-steel-inside-look-at-his-new-dual-lifestyle-after-scooping-taxpayerfunded-security/news-story/e91557afd40fe2da396c22d5b08345c9
Sky News,I made my wife ride in the back seat for this reason ' and everyone agrees with me,https://www.skynews.com.au/lifestyle/trending/this-is-a-safety-issue-mans-unorthodox-solution-to-wifes-dangerous-backseat-driving-praised-online/news-story/21e3f5706528ae92d3c7c25296b0a45b
Sky News,Major cities in firing line of likely cyclone as wild weather inbound,https://www.skynews.com.au/australia-news/weather/townsville-and-cairns-in-firing-line-of-likely-tropical-cyclone-as-major-weather-warning-issued-for-north-qld-residents/news-story/5305629b40fc2e8eef5ccf54bf68faca
Sky News,"""That didn't happen': Frydenberg says PM did not have support for Royal Commissioner choice",https://www.skynews.com.au/australia-news/politics/that-didnt-happen-frydenberg-says-pm-did-not-have-support-from-jewish-community-for-royal-commissioner-virginia-bell-before-he-announced/news-story/2e1556c8045c6f3a17d23e994ddb63d3
Sky News,"Legendary footy star unleashes on ""unAustralian' beach etiquette",https://www.skynews.com.au/lifestyle/celebrity-life/its-not-on-legendary-footy-star-brian-taylor-unleashes-on-unaustralian-beach-etiquette/news-story/8bc6085ef423b018b591cd39bba13fcf
Sky News,Nicole Kidman's custody heartbreak during Tom Cruise divorce shaped fight with Keith,https://www.skynews.com.au/lifestyle/celebrity-life/keith-knew-hed-never-win-how-nicole-kidmans-custody-heartbreak-during-tom-cruise-divorce-taught-her-a-valuable-lesson-in-fight-with-urban/news-story/461aa1d7fb9fefb92c2f7c8251cd9492
Sky News,Veteran NRL commentator's shock cancer diagnosis revealed,https://www.skynews.com.au/australia-news/sport/veteran-nrl-commentator-paul-kents-shock-cancer-diagnosis-revealed/news-story/b16b0804454ca69d25f8193eeb1fc354
Sky News,"""Going to start now': Trump outlines Mexico military strikes",https://www.skynews.com.au/world-news/united-states/going-to-start-now-trump-flags-mexico-military-ambitions-promises-to-exert-regional-influence-in-sitdown-interview-with-fox-news/news-story/01065d8e634465ccad417f337f7fdeda
Sky News,All the evidence that betrays PM's claim he hasn't played politics over Bondi tragedy,https://www.skynews.com.au/insights-and-analysis/inside-the-mountain-of-evidence-that-betrays-anthony-albaneses-claim-he-hasnt-played-politics-over-bondi-beach-tragedy/news-story/a19ae51403dc60d286a4347a1282fd22
Sky News,Inside Prince Harry's ring of steel after he scoops taxpayer-paid security,https://www.skynews.com.au/insights-and-analysis/prince-harrys-ring-of-steel-inside-look-at-his-new-dual-lifestyle-after-scooping-taxpayerfunded-security/news-story/e91557afd40fe2da396c22d5b08345c9
Sky News,"""Scared' PM faced lose-lose situation before he made humiliating Royal Commission backtrack",https://www.skynews.com.au/insights-and-analysis/scared-anthony-albanese-faced-loselose-situation-before-humiliating-backtrack-over-bondi-royal-commission/news-story/1b11c80aa37afb26b82040a751a855e7
Sky News,Trump team floats massive cash payments to Greenland residents in acquisition plan,https://www.skynews.com.au/world-news/global-affairs/donald-trump-admin-reportedly-considers-paying-each-greenland-resident-up-to-150000-amid-us-takeover-talks/news-story/8fda9923630cd2d985437618de6043f1
Sky News,"""Going to start now': Trump outlines Mexico military strikes",https://www.skynews.com.au/world-news/united-states/going-to-start-now-trump-flags-mexico-military-ambitions-promises-to-exert-regional-influence-in-sitdown-interview-with-fox-news/news-story/01065d8e634465ccad417f337f7fdeda
Sky News,US federal agents shoot two people in Portland,https://www.skynews.com.au/world-news/united-states/us-federal-agents-shoot-two-people-in-portland-oregon-days-after-minneapolis-shooting-as-protests-break-out-across-the-country/news-story/4dc975fe7194cae75a4ba16e6d231c04
Sky News,Mum fatally shot by ICE agent was trained to resist feds before shooting,https://www.skynews.com.au/world-news/united-states/renee-nicole-good-was-minneapolis-ice-watch-warrior-who-trained-to-resist-feds-before-shooting/news-story/28fa9bfcabe379d3426e5211cbd71753
Sky News,"Iran regime ""unleashing Hezbollah and Iraqi militias' as uprising spreads",https://www.skynews.com.au/world-news/global-affairs/iran-regime-reportedly-unleashing-hezbollah-and-iraqi-militias-as-uprising-spreads/news-story/64bea8eb537f61d01275bd2d39ba2521
Sky News,"Renee Good's sobbing wife who said Minneapolis ICE shooting was ""my fault' revealed",https://www.skynews.com.au/world-news/united-states/renee-nicole-goods-sobbing-wife-who-claimed-minneapolis-ice-shooting-was-my-fault-revealed/news-story/ba8990022b373b9f7687aa648ff26765
Sky News,"Agent who shot woman in car was dragged, injured by migrant driver last year",https://www.skynews.com.au/world-news/united-states/ice-agent-who-opened-fire-on-renee-good-was-dragged-hospitalised-by-illegal-migrant-driver-last-year/news-story/b6676d63608d42c5ecaf9c119ad20d0b
Sky News,"LA wildfire report edited to ""soften' criticism, chief says as questions swirl over mayor's role",https://www.skynews.com.au/world-news/united-states/los-angeles-wildfire-report-was-edited-to-soften-criticism-chief-says-as-questions-swirl-about-mayor-karen-bass-role/news-story/f94f0104c0b01a0b25ceaf15477b7943
Sky News,"Mexico doesn't have ""control' over much of the country",https://www.skynews.com.au/opinion/mexico-doesnt-have-control-over-much-of-the-country/video/5fdea3fc8cb5dfcc244979e4f8e72f1f
Sky News,"Donald Trump talks about ""land strikes' in Mexico",https://www.skynews.com.au/opinion/donald-trump-talks-about-land-strikes-in-mexico/video/e5c17356e5a57721c3394dcf3f881686
Sky News,"Mandatory eye checks for senior drivers shouldn't be a ""controversial' rule",https://www.skynews.com.au/opinion/mandatory-eye-checks-for-senior-drivers-shouldnt-be-a-controversial-rule/video/580fb09cd6b8cccd0576d79e8c43ff68
Sky News,Credlin | 9 January,https://www.skynews.com.au/stream/opinion-programs/credlin/credlin-9-january/video/d5a11735d5c8681283184abdfa4df178
Sky News,The Late Debate | 8 January,https://www.skynews.com.au/stream/opinion-programs/the-late-debate/the-late-debate-8-january/video/4a3d9a285ea60a525f229d5d9b44b3de
Sky News,The Bolt Report | 9 January,https://www.skynews.com.au/stream/opinion-programs/the-bolt-report/the-bolt-report-9-january/video/b9d455dab55ecb8472abebd5c152dcb4
Sky News,The Late Debate | 9 January,https://www.skynews.com.au/stream/opinion-programs/the-late-debate/the-late-debate-9-january/video/800b552fe283404d203c0ef45491a8e1
Sky News,The Bolt Report | 7 January,https://www.skynews.com.au/stream/opinion-programs/the-bolt-report/the-bolt-report-7-january/video/552bae96b85bb4e2dbd52d2e4e360022
Sky News,Credlin | 7 January,https://www.skynews.com.au/stream/opinion-programs/credlin/credlin-7-january/video/315e7627b3918369d2f1a86abe552688
Sky News,The Late Debate | 6 January,https://www.skynews.com.au/stream/opinion-programs/the-late-debate/the-late-debate-6-january/video/b0c7c0770970b2dfd36edf67854567b2
Sky News,Popular Sydney restaurant announces shock closure after more than 40 years in business,https://www.skynews.com.au/business/heavy-hearts-popular-sydney-restaurant-announces-shock-closure-after-more-than-40-years-in-business/news-story/4e3925253c358ace55cbd9b3aaaad6cf
Sky News,"""Didn't think this could happen to me': Adrian Portelli's $50 million renovation hell",https://www.skynews.com.au/business/real-estate/didnt-think-this-could-happen-to-me-the-block-star-adrian-portellis-50-million-renovation-hell-as-he-reveals-builder-threatened-him-over-ruined-penthouse/news-story/202e3d699d9bd870b5ff0c9fb4ea94c3
Sky News,"Economist reveals harsh rates truth ""no one wants to hear'",https://www.skynews.com.au/business/markets/economist-warren-hogan-reveals-harsh-rates-truth-no-one-wants-to-hear-after-latest-inflation-figures/news-story/ba6a519e03ebbcea4a132c26fe2453f8
Sky News,"""Not appropriate': Grim reality behind ""encouraging' inflation figures",https://www.skynews.com.au/business/finance/not-appropriate-grim-reality-behind-encouraging-inflation-figures-as-mortgageholders-await-next-rate-meeting-in-february/news-story/e30062eef421330a2aa4cc6e3dccfddf
Sky News,"""The Simpsons' says goodbye to beloved character after 30 years",https://www.skynews.com.au/business/media/the-simpsons-says-goodbye-to-beloved-character-duffman-after-30-years/news-story/9986a0f770397a79ff80941d385286dd
Sky News,"""Deeply offensive': SMH, The Age cop backlash over cartoon mocking Bondi Royal Commission calls",https://www.skynews.com.au/business/media/smh-the-age-cop-backlash-over-deeply-offensive-cartoon-mocking-calls-for-a-royal-commission-into-bondi-terror-attack/news-story/ae91d9a00d3869192c45dfe6439347ad
Sky News,"Tony Dokoupil's first night anchoring ""CBS Evening News' marred by on-air confusion",https://www.skynews.com.au/business/media/tony-dokoupils-first-night-anchoring-cbs-evening-news-marred-by-onair-confusion/news-story/5ecf3bc6f924a4f3c8b95fc9042c46d0
Sky News,CBS News staff clashed over trans language in internal email blow-up: report,https://www.skynews.com.au/business/media/cbs-news-staff-clashed-over-transgender-language-in-internal-email-blowup-report/news-story/ffa508bc0b8325ea743820c1c13abb8d
Sky News,Gmail users urged to switch off these two main features over privacy concerns,https://www.skynews.com.au/business/tech-and-innovation/gmail-users-urged-to-switch-off-these-two-main-features-over-privacy-concerns/news-story/dc3604bfeab02123770e007339443af0
Sky News,Kendall Jenner breaks her silence after years of sexuality speculation,https://www.skynews.com.au/lifestyle/celebrity-life/after-years-of-online-speculation-kendall-jenner-finally-opens-up-about-her-sexuality/news-story/44a15a3b9834dbb6d1b5d09fc355469f
Sky News,Popular household item pulled from Kmart shelves amid serious health risks,https://www.skynews.com.au/lifestyle/health/popular-household-item-pulled-from-kmart-shelves-amid-serious-health-risk-warnings/news-story/53034824e8ae48e55f83242bffe8931a
Sky News,I made my wife ride in the back seat for this reason ' and everyone agrees with me,https://www.skynews.com.au/lifestyle/trending/this-is-a-safety-issue-mans-unorthodox-solution-to-wifes-dangerous-backseat-driving-praised-online/news-story/21e3f5706528ae92d3c7c25296b0a45b
Sky News,Inside Prince Harry's ring of steel after he scoops taxpayer-paid security,https://www.skynews.com.au/insights-and-analysis/prince-harrys-ring-of-steel-inside-look-at-his-new-dual-lifestyle-after-scooping-taxpayerfunded-security/news-story/e91557afd40fe2da396c22d5b08345c9
Sky News,Nicole Kidman's custody heartbreak during Tom Cruise divorce shaped fight with Keith,https://www.skynews.com.au/lifestyle/celebrity-life/keith-knew-hed-never-win-how-nicole-kidmans-custody-heartbreak-during-tom-cruise-divorce-taught-her-a-valuable-lesson-in-fight-with-urban/news-story/461aa1d7fb9fefb92c2f7c8251cd9492
Sky News,"Medieval castle with 100 rooms hits market with nearly 1,000 years of history",https://www.skynews.com.au/lifestyle/travel/jawdropping-french-medieval-castle-with-100-rooms-hits-market-with-nearly-1000-years-of-history/news-story/a952244ca1045ce8bf27bc1a838fb8ea
Sky News,Hotel experts reveal the tiny detail that could get in the way of your stay,https://www.skynews.com.au/lifestyle/travel/hotel-experts-reveal-which-room-numbers-to-book-for-a-more-peaceful-stay/news-story/5d413b7586904974a30f3bb11dc4b668
Sky News,Fresh travel warning issued to Aussies in Iran amid ongoing violent protests,https://www.skynews.com.au/lifestyle/travel/leave-asap-fresh-travel-warning-issued-to-australians-in-iran-amid-ongoing-violent-protests-and-unpredictable-security-situation/news-story/b9041a8169245b9d29dc428d7e8918f8
Sky News,Australia's biosecurity crackdown: Travellers warned as thousands of items seized,https://www.skynews.com.au/australia-news/australias-biosecurity-crackdown-travellers-warned-as-thousands-of-items-seized/video/508f59f5a12d8a464be70f011c0279c2
Sky News,"""They are in great spirits': Three injured firefighting personnel currently recovering",https://www.skynews.com.au/australia-news/they-are-in-great-spirits-three-injured-firefighting-personnel-currently-recovering/video/9efce770f84be49eb81db8bc822cbfca
Sky News,Fires across Victoria could burn for weeks as at least 115 structures lost,https://www.skynews.com.au/australia-news/weather/fires-across-victoria-could-burn-for-weeks-as-at-least-115-structures-lost/video/f4a6652dfdfeda528c182226763e592c
Sky News,North Queensland on cyclone watch as state prepares for wild weather,https://www.skynews.com.au/australia-news/weather/north-queensland-on-cyclone-watch-as-state-prepares-for-wild-weather/video/b98eb798615ef86f406278bc98a5ace6
Sky News,"""Incredibly traumatic': Albanese provides update on devastating weather across Australia",https://www.skynews.com.au/australia-news/incredibly-traumatic-albanese-provides-update-on-devastating-weather-across-australia/video/8214b891eccca2f2b3a73e9339577b42
