Section,Headline,Link
Sky News,Footy player stood down over arson attack on former home of Alex Ryvchin,https://www.skynews.com.au/australia-news/footy-player-stood-down-over-arson-attack-on-former-home-of-alex-ryvchin/video/2e5d1d292b5ac65dc3bb96218b2c4192
Sky News,Today's News Headlines: President Trump: Charlie Kirk is dead,https://www.skynews.com.au/australia-news/todays-news-headlines-president-trump-charlie-kirk-is-dead/video/6966521cd14cc5670dd149f37a0a2925
Sky News,Today's News Headlines: Jacinta Price sacked from shadow cabinet,https://www.skynews.com.au/australia-news/todays-news-headlines-jacinta-price-sacked-from-shadow-cabinet/video/5bde5a5f9d799e59e065fcf9a3a02e40
Sky News,"Man jailed over rape of 13-year-old who was ""promised' in marriage",https://www.skynews.com.au/australia-news/man-jailed-over-rape-of-13yearold-who-was-promised-in-marriage/video/f4c62dbec9d1804e75989cd9e55b672b
Sky News,Labor government announces $1.7 billion investment in Ghost Shark submarines,https://www.skynews.com.au/australia-news/defence-and-foreign-affairs/labor-government-announces-17-billion-investment-in-ghost-shark-submarines/video/50316ec8b3ba868745e104dc20cae487
Sky News,"Listen to ""Sky News Radio' on the Nova Player app",https://www.skynews.com.au/business/media/you-can-listen-to-sky-news-australia-anytime-and-on-any-platform-with-sky-news-radio-on-iheartradio/news-story/2d6aca31bc7566b5c0652db48284f5b7
Sky News,Catch up on your favourite Sky News shows with podcasts,https://www.skynews.com.au/opinion/your-favourite-sky-news-australia-shows-are-available-to-listen-to-any-time-as-podcasts/news-story/379bbe36e745709ce679d2813be0249c
