Section,Headline,Link
Sky News,"""I'm not a candidate': Stephen Conroy rules himself out of US ambassador race",https://www.skynews.com.au/australia-news/politics/im-not-a-candidate-stephen-conroy-rules-himself-out-of-us-ambassador-race/video/4fdb2b30954766b840fd025a7ba70d02
Sky News,Neo-Nazi group forced to disband over hate speech laws,https://www.skynews.com.au/australia-news/politics/neonazi-group-forced-to-disband-over-hate-speech-laws/video/cb8a8e232fa579ae485339d48b8662c3
Sky News,Iconic Magic Millions spectacle transforms Gold Coast beachfront,https://www.skynews.com.au/australia-news/sport/iconic-magic-millions-spectacle-transforms-gold-coast-beachfront/video/6167577802911db5da6666a826881a76
Sky News,"""Face up': Albanese blasted for ""diverting' from ""core problem' of Bondi attack",https://www.skynews.com.au/australia-news/politics/face-up-albanese-blasted-for-diverting-from-core-problem-of-bondi-attack/video/ddd77bdc4471c8655b1746b713ba6237
Sky News,"""Reckless': Littleproud blasts Albanese's ""poor' US ambassador pick",https://www.skynews.com.au/australia-news/politics/reckless-littleproud-blasts-albaneses-poor-us-ambassador-pick/video/ba344e357163e6b2bb97ec75413e6fb7
Sky News,Today's News Headlines: Queensland disaster minister on holiday amid crisis,https://www.skynews.com.au/australia-news/todays-news-headlines-queensland-disaster-minister-on-holiday-amid-crisis/video/f37e5dbb6a7ebaa29e346b18fb2e4f9c
Sky News,Snap parliamentary committee probes hate speech and firearm laws ahead of debate,https://www.skynews.com.au/australia-news/politics/snap-parliamentary-committee-probes-hate-speech-and-firearm-laws-ahead-of-debate/video/d81901e97029fcbb2e2e2a9a1af24314
Sky News,Today's News Headlines: Australian children's author Craig Silvey has been charged,https://www.skynews.com.au/australia-news/todays-news-headlines-australian-childrens-author-craig-silvey-has-been-charged/video/d945f8d38da7e5d1543e8d58dee7a39e
Sky News,"Listen to ""Sky News Radio' on the Nova Player app",https://www.skynews.com.au/business/media/you-can-listen-to-sky-news-australia-anytime-and-on-any-platform-with-sky-news-radio-on-iheartradio/news-story/2d6aca31bc7566b5c0652db48284f5b7
Sky News,Catch up on your favourite Sky News shows with podcasts,https://www.skynews.com.au/opinion/your-favourite-sky-news-australia-shows-are-available-to-listen-to-any-time-as-podcasts/news-story/379bbe36e745709ce679d2813be0249c
