Section,Headline,Link
9 News,NRLRadley opens up after massive Roosters sanction,https://www.nine.com.au/sport/nrl/news-2025-victor-radley-interview-sydney-roosters-suspension-fine-st-vincents-hospital-nick-politis-20250923-p5mxf2.html
9 News,'National treasure': Beloved cricket figure dies at home24 minutes ago,https://www.nine.com.au/sport/cricket/news-2025-former-test-umpire-harold-dickie-bird-dies-age-92-20250923-p5mxft.html
9 News,The 10 most culturally powerful people in Australia in 2025an hour ago,https://www.9news.com.au/national/australias-10-most-culturally-powerful-people-in-2025-afr-magazines-full-list-in-pictures/3332e536-a5de-422c-a5c3-0cfe4d4de5e8
9 News,A Current AffairBusinesses shunted by major transport project fight state for scrapsan hour ago,https://9now.nine.com.au/a-current-affair/small-businesses-shunted-by-major-transport-project-fight-the-state-for-scraps/4970b505-4eaf-444e-be35-99579279d129
9 News,Sydneysiders to pay $475 more on water bills by 2030,https://www.9news.com.au/national/sydney-water-bill-price-hikes-confirmed/000470a6-f85b-44c8-bc28-34a9e30bf73a
9 News,'Night Stalker' admits 18 rapes against eight women,https://www.9news.com.au/national/sydney-night-stalker-glenn-gary-cameron-moore-park/4b45c629-fec6-4af7-a4d9-485fadc04849
9 News,A Current AffairWoman claims Optus complaints fell on deaf ears,https://9now.nine.com.au/a-current-affair/woman-claims-optus-complaints-fell-on-deaf-ears/db86b0a0-43f0-4f73-ada4-392e11b5616b
9 News,Warning of issue that ruined millions of Aussies' commutes ignored for five years,https://www.9news.com.au/national/sydney-trains-outage-independent-review-findings/d47e39fa-0ef6-458c-a748-908680a9b78e
9 News,Woman arrested after allegedly trying to rob bank with stolen knife,https://www.9news.com.au/national/kingsgrove-attempted-bank-robbery/1f2a9a3c-2f1f-4b6a-b68d-4805349e2c14
9 News,Brisbane childcare tries to charge parents thousands for kids' artwork,https://www.9news.com.au/national/brisbane-childcare-craigslea-allegedly-tries-to-charge-parents-thousands-for-kids-artwork-queensland-news/2e074a4f-c60c-4ce3-af90-050c2da5774e
9 News,Coroner probes death of newborn baby at Queensland hospital,https://www.9news.com.au/national/hugo-mcgregor-coroner-probes-death-of-newborn-baby-in-hospital-townsville-queensland-news/7d344bb2-2450-456d-a486-9295ebd85811
9 News,Semi-trailer spills load of beer across Sydney road12 minutes ago,https://www.9news.com.au/national/sydney-beer-thefts-good-samaritans-help-driver-pinch-a-couple/42a9ed20-6ba2-4760-a2a2-d7e27a34a9bd
9 News,ASX accused of 'repeated and serious failures' by corporate watchdog,https://www.9news.com.au/national/corporate-watchdog-asic-launches-inquiry-into-australian-securities-exchange-asx-amid-major-concerns/81123bf9-7aa9-4a3d-bca1-49c16735c760
9 News,Adelaide facing major traffic delays if bid to host COP31 succeeds,https://www.9news.com.au/national/adelaide-traffic-delays-cop31-bid/80bec931-d342-492b-9cf3-2294b6cf2024
9 News,Ley accused of going 'rogue' with unprecedented letter to Republicans,https://www.9news.com.au/national/sussan-ley-pens-letter-to-republicans-claiming-she-will-revoke-palestine-statehood-recognition-if-elected/0fa8a59b-c2e2-448a-a74f-457e7c8ae9a2
9 News,Melbourne father and son accused of murdering man over stolen wallet,https://www.9news.com.au/national/melbourne-murder-abdurhman-jemal/d6a3416b-c438-4222-a918-539ad941cd8d
9 News,Eighth person charged over alleged machete murders in Melbourne,https://www.9news.com.au/national/cobblebank-machete-deaths-eighth-person-charged-over-alleged-murders-dau-akueng-and-chol-achiek/91cc214e-417c-46df-9fda-9ed41c07908b
9 News,Major insurance company accused of misleading customers,https://www.9news.com.au/national/corporate-watchdog-takes-racq-for-misleading-customers/da4f16ce-cf29-4cb8-9cbd-b43f57ca1367
9 News,Couple found guilty of murdering former son-in-law lose appeal,https://www.9news.com.au/national/cedric-and-noelene-jordan-appeal-decision-for-couple-who-killed-former-son-in-law/c31e078f-59f8-4824-ad5c-d793b7a429a6
9 News,The 10 most culturally powerful people in Australia in 2025an hour ago,https://www.9news.com.au/national/australias-10-most-culturally-powerful-people-in-2025-afr-magazines-full-list-in-pictures/3332e536-a5de-422c-a5c3-0cfe4d4de5e8
9 News,A Current AffairBusinesses shunted by major transport project fight state for scrapsan hour ago,https://9now.nine.com.au/a-current-affair/small-businesses-shunted-by-major-transport-project-fight-the-state-for-scraps/4970b505-4eaf-444e-be35-99579279d129
9 News,Sydneysiders to pay $475 more on water bills by 2030,https://www.9news.com.au/national/sydney-water-bill-price-hikes-confirmed/000470a6-f85b-44c8-bc28-34a9e30bf73a
9 News,Today in HIstoryThe tiny 'clue' in world's first conspiracy theory,https://www.9news.com.au/world/today-in-history-september-23-paul-mccartney-conspiracy-theory/e53d5e35-5815-4be7-acfd-e56d1ea33598
9 News,Millions of Aussies to get a cash boost today as Centrelink payments jump,https://www.9news.com.au/national/centrelink-payments-changes-2025-new-rates-september-20-everything-to-know-explained/7ad1411a-7f1e-4e0d-b1dd-c1dd45803dd6
9 News,Are shark attacks on the rise and what can we do to stop them?,https://www.9news.com.au/national/shark-attack-dee-why-update-what-happened-do-shark-nets-work-explainer/3f0a70c5-963b-447f-9e98-baf02fb2e5ed
9 News,It's magpie swooping season again. Here's how to avoid getting injured,https://www.9news.com.au/national/magpie-swooping-season-australia-how-to-avoid-everything-to-know-explained/1461d5a2-9e46-4cb7-9e6c-49569187b31c
9 News,AFLHawks star learns fate over tackle that concussed Stewart,https://www.nine.com.au/sport/afl/news-2025-hawthorn-mabior-chol-cleared-suspension-tribunal-tom-stewart-concussion-20250923-p5mxfb.html
9 News,EXCLUSIVEMany pandemic measures 'a waste of time': former top doctor,https://www.9news.com.au/national/neil-mitchell-brett-sutton-interview-we-never-want-to-do-that-again/f503cd11-b8bf-4f9c-a156-cb8d815ad3a7
9 News,Trump just blamed autism on paracetamol. Here's the official advice for Aussies,https://www.9news.com.au/national/paracetamol-australia-tylenol-uses-everything-to-know-explainer/87b991f1-c4d2-41cb-9793-8d81963040f5
9 News,"Four charged with theft of 40 guns, but majority still haven't been found",https://www.9news.com.au/national/stolen-guns-nsw-australia-police/55c75cdc-3394-4d34-8638-80f87347b9a0
9 News,Former SA Police contractor accused of possessing child abuse material,https://www.9news.com.au/national/former-sa-police-contractor-jonathan-poole-accused-of-possessing-child-abuse-material/eba04390-0bc2-4ae1-921d-700344716657
9 News,Police officer charged with assault over arrest of Greens candidate at anti-Israel protest,https://www.9news.com.au/national/nsw-police-officer-charged-in-hannah-thomas-assault/2488eacf-729e-49c4-9224-58278bf71998
9 News,RBA promises to keep cash as an option despite its rapidly declining use,https://www.9news.com.au/national/rba-promises-to-keep-cash-as-payment-option-for-as-long-as-australians-want-or-need-to-use-it/54fd8113-3314-47a2-a425-0727238e2abe
9 News,'Miracle' as police dog Rocco escapes horror crash with only a few scrapes,https://www.9news.com.au/national/police-dog-thrown-from-car-in-melbourne-crash/bf75552c-822e-4a7d-976d-58773ff1e486
9 News,Mark Nawaqanitawase set to return to rugby union,https://www.nine.com.au/sport/nrl/news-2025-mark-nawaqanitawase-rugby-union-return-sydney-roosters-exit-wallabies-world-cup-20250923-p5mxcz.html
9 News,Why days are getting a little brighter across Australia,https://www.9news.com.au/national/australia-days-nights-spring-equinox-weather/06006451-e29b-46aa-9b8b-822b23fc2dbc
9 News,Murder charge after man 'deliberately struck' with car on WA road,https://www.9news.com.au/national/wa-crime-man-charged-with-murder-after-man-found-critically-injured-on-road/99083bd8-5138-40e9-ad58-92687719c4bc
9 News,Mystery drones shut down two major European airports,https://www.9news.com.au/world/copenhagen-oslo-airports-shut-drones/354cc31b-c5e1-43c1-96d0-9ea8feee62cc
9 News,Satellite images show eye of super typhoon hitting Philippines,https://www.9news.com.au/world/super-typhoon-blowing-by-northern-philippines-and-taiwan-forces-evacuations-and-closures/7786a1ee-1a46-499f-b8a3-1f6667472753
9 News,What we know about autism's causes and any potential link to Tylenol,https://www.9news.com.au/world/what-we-know-about-autisms-causes-and-any-potential-link-to-tylenol/0d9b908f-816a-4769-81d3-16a3defb1ead
9 News,Driving licences stolen by Southport killer to buy weapons,https://www.9news.com.au/world/southport-stabbing-inquiry-killer-stole-identities-to-buy-weapons/c4b1492c-4257-404c-ad38-2ca33b6321a4
9 News,Roadblock in Jimmy Kimmel's return to TV,https://www.9news.com.au/world/jimmy-kimmel-to-be-reinstated-after-suspension-following-charlie-kirk-comments-abc-says/3a2f0e00-def6-4588-b3cf-a347d6557cfb
9 News,Aussie doc responds after Trump links common painkiller to autism,https://www.9news.com.au/world/donald-trump-autism-announcement-experts-skeptical/d6a96499-4cc9-4b7c-9170-df4251ce3843
9 News,Brownlow winner calls for overhaul after 'crazy' snub,https://www.nine.com.au/sport/afl/news-2025-nasiah-wanganeen-milera-brownlow-medal-snub-stuns-room-jack-viney-st-kilda-melbourne/41820de7-77d6-45a5-9606-4bf453bc2ad3
9 News,Clue to what went horribly wrong found in Dogs' 'unhappy ending',https://www.nine.com.au/sport/nrl/news-2025-the-mole-exclusive-canterbury-bulldogs-season-review/5949df4b-ae97-493c-9518-5f00dae9c05d
9 News,Cost of shocking illness laid bare by fresh Strange honour,https://www.nine.com.au/sport/nrl/news-2025-rlpa-players-dream-team-ethan-strange-canberra-raiders/726939c0-bc72-4dd0-981b-8ab3e170c22c
9 News,Merrett breaks silence amid 'difficult' Bombers saga,https://www.nine.com.au/sport/afl/brownlow-medal-2025-essendon-bombers-zach-merrett-comments-trade-request-hawthorn-hawks/6fad20e1-8544-4ecd-8935-19343acbb32b
9 News,Gould slams 'childish' criticism amid 'self sabotage' claim,https://www.nine.com.au/sport/nrl/news-2025-phil-gould-canterbury-bulldogs-lachlan-galvin-critics-cameron-ciraldo-coach-season/7f9b306b-90f8-4254-aa8a-de1052edd882
9 News,Pre-count predictions prove how insane Rowell's win was,https://www.nine.com.au/sport/afl/brownlow-medal-2025-matt-rowell-gold-coast-suns-pre-count-predictions-exclusive/6ab9ad97-a4a2-464e-90b3-63afed90bd8d
9 News,'It's a strange time': What superstar's brief switch really means,https://www.nine.com.au/sport/football/premier-league-2025-adam-peacock-column-erling-haaland-pep-guardiola-manchester-city/19b99532-0fc3-41ec-a3b4-d9224c86debe
9 News,Aussie doc responds after Trump links common painkiller to autism,https://9now.nine.com.au/today/donald-trump-autism-painkillers-claims-experts-skeptical/a180e639-24ba-4569-9eda-0b0121d71a2f
9 News,Disney backflips on Jimmy Kimmel suspension,https://9now.nine.com.au/today/jimmy-kimmel-live-returns-after-show-taken-off-air-other-entertainment-news-on-september-23/8616f313-545e-4796-b036-c82b13d56965
9 News,Make-up 'incident' leaves Today Extra host looking noticeably different,https://9now.nine.com.au/today/sylvia-jeffreys-stinging-lips-after-hair-and-makeup-incident/a0857fe4-3868-4485-9fab-71d6fd5306f5
9 News,Woman claims Optus complaints fell on deaf ears,https://9now.nine.com.au/a-current-affair/woman-claims-optus-complaints-fell-on-deaf-ears/db86b0a0-43f0-4f73-ada4-392e11b5616b
9 News,Childcare worker allowed to leave Australia after being accused of shocking crime against girl,https://9now.nine.com.au/a-current-affair/fijian-childcare-worker-allowed-to-leave-australia-after-being-accused-of-shocking-crime-against-girl/87042de0-8bb4-49b2-9aa1-f5c2eeaf2b0f
9 News,Businesses shunted by major transport project fight state for scraps,https://9now.nine.com.au/a-current-affair/small-businesses-shunted-by-major-transport-project-fight-the-state-for-scraps/4970b505-4eaf-444e-be35-99579279d129
9 News,'She deserves better': Grieving daughter's fight for justice after mother's murder,https://9now.nine.com.au/60-minutes/prabha-arunkumar-murder-sydney-parramatta-park-grieving-daughters-fight-for-justice/fca20ea5-e60d-40b6-afd3-048e5ad41c8f
9 News,Charlie Sheen makes shocking confessions in rare sit-down interview,https://9now.nine.com.au/60-minutes/charlie-sheen-makes-shocking-confessions-in-rare-sitdown-interview/ef60df27-23c6-47da-9d84-06d7fe567891
9 News,'I became a prisoner': Virginia Giuffre's diaries reveal private battle,https://9now.nine.com.au/60-minutes/virginia-giuffre-took-on-the-worlds-most-powerful-but-she-was-fighting-her-own-private-battle/1aecbba5-970b-41f5-a836-ae9ed8ec683f
9 News,Couple arrive home to find nasty note taped to their door,https://www.domain.com.au/news/couple-confronted-by-rude-note-eight-hours-after-picking-up-apartment-keys-1414069/?utm_source=nine.com.au&utm_medium=referral&utm_campaign=editorial-homepage-driver
9 News,The last affordable suburb in Sydney revealed,https://www.domain.com.au/news/girraween-the-closest-suburb-to-sydneys-cbd-for-under-1-million-is-24km-away-1408376/?utm_source=nine.com.au&utm_medium=referral&utm_campaign=editorial-homepage-driver
9 News,The unusual reason Peter bought this derelict cottage,https://www.domain.com.au/news/i-collected-it-peter-bought-this-run-down-riverside-nz-cottage-for-nostalgia-1414033/?utm_source=nine.com.au&utm_medium=referral&utm_campaign=editorial-homepage-driver
9 News,Why Canberra is wary of connected cars,https://www.drive.com.au/caradvice/the-5-million-cyber-shield-why-canberra-is-wary-of-connected-cars/?utm_source=nine-rail&utm_medium=referral
9 News,MG ute review. Does it stack up against rivals?,https://www.drive.com.au/reviews/2026-mg-u9-review-australian-preview-drive/?utm_source=nine-rail&utm_medium=referral
9 News,Is this new Tesla Model Y competitor worth the hype?,https://www.drive.com.au/reviews/2026-zeekr-7x-review-australian-preview-drive/?utm_source=nine-rail&utm_medium=referral
9 News,Semi-trailer spills load of beer across Sydney road12 minutes ago,https://www.9news.com.au/national/sydney-beer-thefts-good-samaritans-help-driver-pinch-a-couple/42a9ed20-6ba2-4760-a2a2-d7e27a34a9bd
9 News,'National treasure': Beloved cricket figure dies at home24 minutes ago,https://www.nine.com.au/sport/cricket/news-2025-former-test-umpire-harold-dickie-bird-dies-age-92-20250923-p5mxft.html
9 News,Businesses shunted by major transport project fight state for scrapsan hour ago,https://9now.nine.com.au/a-current-affair/small-businesses-shunted-by-major-transport-project-fight-the-state-for-scraps/4970b505-4eaf-444e-be35-99579279d129
9 News,Missing prospectors investigation taking fresh approachan hour ago,https://www.9news.com.au/videos/national/missing-prospectors-investigation-taking-fresh-approach/cmfwe7i0500040hsqaio6qbai
9 News,The 10 most culturally powerful people in Australia in 2025an hour ago,https://www.9news.com.au/national/australias-10-most-culturally-powerful-people-in-2025-afr-magazines-full-list-in-pictures/3332e536-a5de-422c-a5c3-0cfe4d4de5e8
9 News,Adelaide facing major traffic delays if bid to host COP31 succeeds,https://www.9news.com.au/national/adelaide-traffic-delays-cop31-bid/80bec931-d342-492b-9cf3-2294b6cf2024
9 News,Nedd Brockmann striving to boost tradies' mental health,https://www.9news.com.au/national/nedd-brockmann-run-tradies-mental-health/59ca830f-44d7-4da1-b678-57d2f44d02f8
9 News,Brisbane childcare tries to charge parents thousands for kids' artwork,https://www.9news.com.au/national/brisbane-childcare-craigslea-allegedly-tries-to-charge-parents-thousands-for-kids-artwork-queensland-news/2e074a4f-c60c-4ce3-af90-050c2da5774e
9 News,Gold Coast's iconic Marina Mirage shopping centre set for demolition,https://www.9news.com.au/national/gold-coast-marina-mirage-set-for-demolition-to-make-way-for-new-development-queensland-news/4d3e088d-2042-4ef6-a546-9eaebc808f36
9 News,Childcare worker allowed to leave Australia after being accused of shocking crime against girl,https://9now.nine.com.au/a-current-affair/fijian-childcare-worker-allowed-to-leave-australia-after-being-accused-of-shocking-crime-against-girl/87042de0-8bb4-49b2-9aa1-f5c2eeaf2b0f
Guardian,Disabled Nigerian man living in UK for 38 years wins appeal against deportation,https://www.theguardian.com/uk-news/2025/sep/22/disabled-nigerian-anthony-olubunmi-george-wins-appeal-deportation
Guardian,"Mass grave reveals scale of unlawful killings by Egyptian army in Sinai, say campaigners",https://www.theguardian.com/world/2025/sep/22/mass-grave-reveals-scale-of-unlawful-killings-by-egyptian-army-in-sinai-say-campaigners
Guardian,"Kenya""s arrest warrant is milestone in Agnes Wanjiru case but lengthy UK process awaits",https://www.theguardian.com/world/2025/sep/21/kenya-issues-arrest-warrant-agnes-wanjiru-uk-must-rule-on-extradition
Guardian,Scores killed by RSF drone strike on mosque in besieged Sudanese city,https://www.theguardian.com/world/2025/sep/19/rsf-drone-strike-kills-scores-people-mosque-sudan
Guardian,"Kenya""s Turkana people genetically adapted to live in harsh environment, study suggests",https://www.theguardian.com/global-development/2025/sep/19/kenya-turkana-people-genetically-adapted-to-live-in-harsh-environment-study-suggests
Guardian,"Ice targeted me for organizing, says farm worker who left US for Mexico",https://www.theguardian.com/us-news/2025/sep/23/ice-deportation-us-mexico-farm-worker
Guardian,"""A heavy burden"": Belém residents evicted in rush for profits from Cop30 rentals",https://www.theguardian.com/environment/2025/sep/22/belem-residents-evicted-to-make-way-for-cop30-rentals
Guardian,Weather tracker: Flash floods and landslides wreak havoc in California,https://www.theguardian.com/environment/2025/sep/22/weather-tracker-flash-floods-landslides-havoc-california
Guardian,Brazilians protest in their thousands against granting Bolsonaro amnesty,https://www.theguardian.com/world/2025/sep/21/brazil-protest-against-jair-bolsonaro-amnesty
Guardian,Trump again asks supreme court to end protections for Venezuelans in US,https://www.theguardian.com/us-news/2025/sep/19/trump-tps-immigration-venezuela
Guardian,Unification Church leader arrested in South Korea over bribery allegations linked to former first lady,https://www.theguardian.com/world/2025/sep/23/unification-church-leader-han-hak-ja-arrested-south-korea-ntwnfb
Guardian,"Mother in New Zealand""s ""suitcase murders"" found guilty of killing her two children",https://www.theguardian.com/world/2025/sep/23/new-zealand-suitcase-murders-mother-found-guilty-of-killing-her-two-children
Guardian,"Rodrigo Duterte, former Philippines president, charged with crimes against humanity at ICC",https://www.theguardian.com/world/2025/sep/23/rodrigo-duterte-charged-crimes-against-humanity-icc-philippines-ntwnfb
Guardian,New Zealand loosens residency restrictions as record number of citizens leave,https://www.theguardian.com/world/2025/sep/23/new-zealand-visa-country-loosens-residency-restrictions-record-numbers-of-citizens-leave
Guardian,UN and rights groups condemn reported jailing of Wuhan Covid citizen journalist,https://www.theguardian.com/world/2025/sep/22/un-rights-groups-condemn-reported-jailing-wuhan-covid-citizen-journalist-zhang-zhan
Guardian,"How DNA on a glass of beer at airport led to capture of serial Australian rapist, the Night Stalker",https://www.theguardian.com/australia-news/2025/sep/23/sydney-night-stalker-rapist-pleads-guilty-13-charges-over-1990s-attacks-against-women-ntwnfb
Guardian,"Intelligence agencies should report on foreign interests in ""activist groups"", Australian coal lobby group argues",https://www.theguardian.com/australia-news/2025/sep/23/intelligence-agencies-should-report-on-foreign-interests-in-activist-groups-australian-coal-lobby-group-argues
Guardian,"Sky News Australia staffer helped arrange bacon on guest""s shirt before offensive anti-Islam interview",https://www.theguardian.com/media/2025/sep/23/sky-news-australia-staffer-helped-arrange-bacon-on-guests-shirt-before-offensive-anti-islam-interview
Guardian,"Two MPs cleared in Jacinta Allan manure investigation; search for Tasmanian plane called off "" as it happened",https://www.theguardian.com/australia-news/live/2025/sep/23/australia-news-live-albanese-new-york-palestine-united-nations-donald-trump-mark-butler-paracetamol-pregnancy-ntwnfb
Guardian,"Queensland coalmines marked for closure ""uneconomic"", analysis shows, despite sector blaming royalties scheme",https://www.theguardian.com/business/2025/sep/23/queensland-coalmines-closing-uneconomic-royalties-scheme-zombie-mines-bhp-anglo-american-qcoal
Guardian,"Nato ready to ""defend every inch of allied territory"", says Rutte after Russian incursions "" Europe live",https://www.theguardian.com/world/live/2025/sep/23/copenhagen-oslo-airport-drones-denmark-norway-russia-nato-estonia-europe-live-latest-news-updates
Guardian,"Danish PM: airport drone incursion a ""serious attack"" on critical infrastructure",https://www.theguardian.com/world/2025/sep/23/drone-sightings-cause-disruption-delays-norway-denmark-airports
Guardian,"Hungary refuses to stop buying Russian oil despite Trump""s Nato demand",https://www.theguardian.com/world/2025/sep/23/hungary-refuses-to-stop-buying-russian-oil-despite-trumps-nato-demand
Guardian,"EU chemical firms plan to export rising quantities of ""toxic"" pesticides, documents show",https://www.theguardian.com/environment/2025/sep/23/eu-chemical-firms-export-toxic-pesticides
Guardian,"Trump is waging culture war on Europe by promoting rightwing allies, report finds",https://www.theguardian.com/world/2025/sep/23/trump-culture-war-europe-promoting-rightwing-allies-report-finds
Guardian,"Trump to address UN general assembly as Israeli attacks on Gaza City continue "" Middle East crisis live",https://www.theguardian.com/world/live/2025/sep/23/gaza-israel-palestinian-state-recognition-donald-trump-un-unga-latest-news-live-updates
Guardian,British-Egyptian activist Alaa Abd el-Fattah freed from prison,https://www.theguardian.com/world/2025/sep/22/british-egyptian-activist-alaa-abd-el-fattah-to-be-freed-from-prison
Guardian,"Abbas says Hamas must ""surrender their weapons"" "" as it happened",https://www.theguardian.com/world/live/2025/sep/22/palestinian-state-gaza-israel-middle-east-hamas-benjamin-netanyahu-latest-live-updates
Guardian,"Albanese warns Netanyahu expansion of settlements in West Bank risks putting two-state solution ""out of reach""",https://www.theguardian.com/australia-news/2025/sep/22/albanese-warns-netanyahu-expansion-of-settlements-in-west-bank-risks-putting-two-state-solution-out-of-reach
Guardian,France recognises Palestine and calls for UN force in Gaza,https://www.theguardian.com/world/2025/sep/22/arab-and-muslim-leaders-to-meet-trump-to-discuss-peace-plan-for-gaza
Guardian,British couple released after detention in Afghanistan say they feared being executed,https://www.theguardian.com/uk-news/2025/sep/21/british-couple-released-after-detention-in-afghanistan-say-they-feared-being-executed
Guardian,"Tulip Siddiq fears plans to use ""fake"" documents to secure conviction in corruption trial",https://www.theguardian.com/politics/2025/sep/21/tulip-siddiq-fears-plans-to-use-fake-documents-to-secure-conviction-in-corruption-trial
Guardian,British couple detained by Taliban in Afghanistan return to UK,https://www.theguardian.com/uk-news/2025/sep/20/british-couple-detained-by-taliban-in-afghanistan-return-to-uk
Guardian,"""This is their attempt to silence him"": Umar Khalid reaches five years in Indian jail without trial",https://www.theguardian.com/world/2025/sep/20/umar-khalid-five-years-in-jail-without-trial-india
Guardian,"Family tell of ""immense joy"" at release of British couple detained in Afghanistan",https://www.theguardian.com/world/2025/sep/19/british-couple-peter-and-barbie-reynolds-freed-after-six-months-in-captivity-in-afghanistan
Guardian,"""Don""t pay any attention to what Trump says about medicine"", Wes Streeting tells Britons "" UK politics live",https://www.theguardian.com/politics/live/2025/sep/23/lib-dem-ed-davey-conference-donald-trump-keir-starmer-labour-reform-tory-latest-politics-live-news-updates
Guardian,"Wild bird numbers continue to fall in UK with some species in ""dramatic freefall""",https://www.theguardian.com/environment/2025/sep/23/wild-bird-numbers-continue-to-fall-in-uk-with-some-species-in-dramatic-freefall
Guardian,All Amazon Fresh stores in UK to close,https://www.theguardian.com/technology/2025/sep/23/all-amazon-fresh-stores-in-uk-to-close-whole-foods
Guardian,Asylum seeker at centre of Essex hotel protests jailed for 12 months,https://www.theguardian.com/uk-news/2025/sep/23/asylum-seeker-at-centre-of-essex-hotel-protests-jailed-for-12-months
Guardian,"""Pay no attention"": global health agencies dismiss false Trump claim on everyday painkillers",https://www.theguardian.com/society/2025/sep/23/global-health-agencies-dismiss-false-trump-claim-everyday-painkillers
Guardian,"Secret Service says it dismantled ""imminent telecommunications threat"" near UN general assembly ahead of Trump speech "" live",https://www.theguardian.com/us-news/live/2025/sep/23/donald-trump-unga-autism-tylenol-us-politics-live-news-updates
Guardian,"""Fear and hopelessness"": one in four professors in the US south are leaving",https://www.theguardian.com/us-news/2025/sep/23/professors-us-south-leaving
Guardian,First Thing: Trump officials announce highly contentious conclusions on autism,https://www.theguardian.com/us-news/2025/sep/23/first-thing-trump-officials-highly-contentious-conclusions-autism
